{"ts": "2026-05-22T14:55:41.759860+08:00", "session_id": "20260522_140003_ff19e4", "market": "cn", "formula": "rank(ts_mean(amount / circ_market_cap, 20)) * rank(-ts_std(ret_1d, 20))", "name": "quiet_float_absorption_20", "is_ic": -0.0342, "is_ic_ir": -0.153, "is_sharpe": -5.111, "is_turnover": 0.089, "is_monotonicity": -0.2, "gates": "FAIL", "status": "reverted", "eval_seconds": 91.4, "sleeve_id": "cn_ai_infra_accumulation", "mispricing_source": "Slow-moving long-only/thematic capital accumulates in constrained-float AI bottleneck names before filings and news fully confirm demand, while the market underreacts to orderly absorption.", "forced_counterparty": "retail profit-takers, redemption-driven thematic funds, and short-horizon traders selling into calm pullbacks", "data_requirements": "[\"daily OHLCV\", \"amount\", \"circ_market_cap\", \"beta-hedged sleeve attribution\", \"correlation to existing promoted sleeves before promotion\"]", "failure_mode": "Fails in liquidity panics or headline-chasing melt-ups, when high amount reflects distribution/speculation instead of absorption and low volatility no longer implies hidden demand.", "report_contract": "setup_overlay", "ai_supercycle_layer": "ai_chip_equipment_materials_packaging", "supply_chain_hypothesis": "candidate bottleneck hardware suppliers are being accumulated ahead of publicly verified capex/order/backlog evidence", "relationship_evidence_required": "true", "money_readiness": "research_only", "decision": "revert", "session_branch": "main", "base_ref": "origin/main", "merge_base": "c99187be1dc8d78a84147200981562efcde7b8d5", "head_commit": "c99187be1dc8d78a84147200981562efcde7b8d5"}
{"ts": "2026-05-22T14:55:41.759860+08:00", "session_id": "20260522_140003_ff19e4", "market": "cn", "formula": "rank(-ts_std(amount,20))*rank(ret_20d-ret_5d)", "name": "stable_amount_trend_digest", "is_ic": 0.0047, "is_ic_ir": 0.024, "is_sharpe": -1.771, "is_turnover": 0.182, "is_monotonicity": -0.2, "gates": "FAIL", "status": "reverted", "eval_seconds": 100.4, "sleeve_id": "flow_accumulation_overlay", "mispricing_source": "Short-horizon capital overreacts to recent cooling and underprices medium-horizon institutional sponsorship in liquid AI leaders; the amount-stability leg aims to separate orderly accumulation from noisy breakout chasing.", "forced_counterparty": "T+1 retail momentum traders and benchmark-aware thematic funds trimming recent winners on short-term relative weakness", "data_requirements": "[\"daily OHLCV+amount on CN AI universe\",\"source-reviewed AI universe membership/status\",\"benchmark series for 000300.SH and 399006.SZ beta-hedged attribution\",\"rolling correlation check vs promoted sleeves\"]", "failure_mode": "Fails when the market switches to violent mean reversion or policy-driven de-rating, where stable amount reflects distribution by large holders rather than accumulation and 20-day leadership no longer persists.", "report_contract": "setup_overlay", "ai_supercycle_layer": "ai_networking_optical_cpo", "supply_chain_hypothesis": "Source-reviewed optical interconnect/CPO and adjacent AI bandwidth bottleneck names should exhibit this orderly-pullback accumulation pattern earlier than the rest of the CN AI universe during cloud capex upcycles.", "relationship_evidence_required": "true", "money_readiness": "research_only", "decision": "revert", "session_branch": "main", "base_ref": "origin/main", "merge_base": "c99187be1dc8d78a84147200981562efcde7b8d5", "head_commit": "c99187be1dc8d78a84147200981562efcde7b8d5"}
{"ts": "2026-05-22T14:55:41.759860+08:00", "session_id": "20260522_140003_ff19e4", "market": "cn", "formula": "rank(-ts_corr(ret_1d,shift(ret_1d,1),20))*rank(-ts_std(turnover_rate,20)/ts_mean(turnover_rate,20))", "name": "anti_autocorr_turnover_stability_20", "is_ic": -0.0261, "is_ic_ir": -0.084, "is_sharpe": -2.607, "is_turnover": 0.18, "is_monotonicity": -0.25, "gates": "FAIL", "status": "reverted", "eval_seconds": 176.1, "sleeve_id": "cn_ai_flow_underreaction", "mispricing_source": "Slow institutional re-risking in AI bottleneck names is underreacted to because turnover looks calm rather than exciting, while short-term traders keep mean-reverting the tape and delay full repricing.", "forced_counterparty": "retail swing traders and benchmark-constrained mutual funds that cannot take full size immediately", "data_requirements": "[\"daily OHLC\", \"daily turnover_rate\", \"ai_infra universe membership and evidence status\", \"benchmark hedge return series for portfolio attribution\"]", "failure_mode": "It should decay in retail-mania or policy-gap regimes where single-day burst leaders keep trending without mean reversion, or if turnover data becomes stale/noisy.", "report_contract": "setup_overlay", "ai_supercycle_layer": "ai_chip_equipment_materials_packaging", "supply_chain_hypothesis": "Candidate D1-D3 AI bottleneck suppliers in equipment/materials/packaging should exhibit this quiet re-accumulation pattern before consensus fully prices verified order or capex linkage.", "relationship_evidence_required": "true", "money_readiness": "research_only", "decision": "revert", "session_branch": "main", "base_ref": "origin/main", "merge_base": "c99187be1dc8d78a84147200981562efcde7b8d5", "head_commit": "c99187be1dc8d78a84147200981562efcde7b8d5"}
{"ts": "2026-05-22T14:55:41.759860+08:00", "session_id": "20260522_140003_ff19e4", "market": "cn", "formula": "rank(ret_20d) * rank(-delta(turnover_rate, 10))", "name": "leader_turnover_digest_20_10", "is_ic": -0.0209, "is_ic_ir": -0.07, "is_sharpe": -3.413, "is_turnover": 0.393, "is_monotonicity": -0.45, "gates": "FAIL", "status": "reverted", "eval_seconds": 91.8, "sleeve_id": "cn_ai_leadership_digest", "mispricing_source": "The market underreacts when thematic leaders stop attracting noisy turnover but keep their medium-term trend; attention metrics fade before the underlying sponsorship does.", "forced_counterparty": "T+1 retail profit-takers and short-horizon momentum traders who sell into quieter tape after a run", "data_requirements": "[\"CN daily price/turnover data\", \"AI-infra universe membership/tags\", \"benchmark hedge attribution vs 000300.SH and 399006.SZ before promotion\", \"sleeve correlation check against promoted factors\"]", "failure_mode": "It stops working when the market shifts to sharp mean reversion or policy shock regimes, where falling turnover reflects exhaustion and liquidity withdrawal rather than absorption.", "report_contract": "setup_overlay", "ai_supercycle_layer": "none", "supply_chain_hypothesis": "Cross-layer domestic AI-infra bottleneck names can show leadership continuation after turnover digestion before order/backlog confirmation is visible in filings.", "relationship_evidence_required": "true", "money_readiness": "research_only", "decision": "revert", "session_branch": "main", "base_ref": "origin/main", "merge_base": "c99187be1dc8d78a84147200981562efcde7b8d5", "head_commit": "c99187be1dc8d78a84147200981562efcde7b8d5"}
{"ts": "2026-05-22T14:55:41.759860+08:00", "session_id": "20260522_140003_ff19e4", "market": "cn", "formula": "rank(-ts_corr(ret_5d,turnover_rate,20)-ts_max(turnover_rate,20)/ts_sum(turnover_rate,20))", "name": "quiet_turnover_absorption_20", "is_ic": 0.0292, "is_ic_ir": 0.091, "is_sharpe": -0.718, "is_turnover": 0.153, "is_monotonicity": 0.15, "gates": "FAIL", "status": "reverted", "eval_seconds": 155.7, "sleeve_id": "cn_aiinfra_flow_absorption", "mispricing_source": "The market overreacts to visible breakout-volume names and underreacts to quiet institutional absorption in AI-infra bottleneck leaders, especially under T+1 trading and theme-chasing behavior.", "forced_counterparty": "retail chase flow and short-horizon theme rotators", "data_requirements": "[\"daily OHLCV\",\"daily_basic.turnover_rate\",\"AI-infra universe membership\",\"beta-hedged sleeve return and residual risk attribution\"]; any supplier/customer or backlog claim still needs filings, official PRs, or transcripts", "failure_mode": "It stops working when the tape shifts into pure speculative squeeze regimes where one-day turnover spikes are rewarded, or when policy/news shocks dominate gradual accumulation.", "report_contract": "setup_overlay", "ai_supercycle_layer": "ai_chip_equipment_materials_packaging", "supply_chain_hypothesis": "Candidate bottleneck names in equipment/materials/advanced-packaging subchains are repriced first through distributed turnover absorption before backlog or capex evidence is fully recognized by the market.", "relationship_evidence_required": "true", "money_readiness": "research_only", "decision": "revert", "session_branch": "main", "base_ref": "origin/main", "merge_base": "c99187be1dc8d78a84147200981562efcde7b8d5", "head_commit": "c99187be1dc8d78a84147200981562efcde7b8d5"}
{"ts": "2026-05-22T14:55:41.759860+08:00", "session_id": "20260522_140003_ff19e4", "market": "cn", "formula": "rank(-ts_std(amount,20)/ts_mean(amount,20))", "name": "amount_cv_20", "is_ic": 0.0149, "is_ic_ir": 0.099, "is_sharpe": -1.952, "is_turnover": 0.128, "is_monotonicity": -0.15, "gates": "FAIL", "status": "reverted", "eval_seconds": 122.5, "sleeve_id": "cn_ai_flow_sponsorship", "mispricing_source": "Slow accumulation by institutions is underreacted to because daily amount stability is not a headline catalyst, while retail capital overprices noisy turnover spikes and underprices quiet sponsorship.", "forced_counterparty": "Retail momentum chasers and short-horizon hot-money desks recycling liquidity around theme bursts", "data_requirements": "[\"daily OHLCV\",\"amount\",\"beta-hedged sleeve return vs 000300.SH/399006.SZ\",\"residual risk attribution\",\"correlation matrix vs promoted sleeves\"]", "failure_mode": "It stops working when stable amount merely tags large defensive names, or when the AI theme shifts into pure event-gap trading where bursty flow, not orderly sponsorship, drives returns.", "report_contract": "fresh_buy_gate", "ai_supercycle_layer": "none", "supply_chain_hypothesis": "Within the source-reviewed CN AI universe, D1-D3 bottleneck suppliers under quiet accumulation should re-rate before later capex/order evidence becomes obvious; this is a universe-level bottleneck hypothesis, not a new verified supplier claim.", "relationship_evidence_required": "true", "money_readiness": "money_candidate", "decision": "revert", "session_branch": "main", "base_ref": "origin/main", "merge_base": "c99187be1dc8d78a84147200981562efcde7b8d5", "head_commit": "c99187be1dc8d78a84147200981562efcde7b8d5"}
{"ts": "2026-05-22T14:55:41.759860+08:00", "session_id": "20260522_140003_ff19e4", "market": "cn", "formula": "rank(ret_20d - ret_5d) * rank(-ts_mean(volume_ratio, 5))", "name": "leader_pullback_dryup_20_5", "is_ic": -0.0144, "is_ic_ir": -0.085, "is_sharpe": -3.436, "is_turnover": 0.244, "is_monotonicity": -0.65, "gates": "FAIL", "status": "reverted", "eval_seconds": 99.3, "sleeve_id": "cn_ai_leader_pullback", "mispricing_source": "Time-horizon mismatch between short-horizon thematic traders reacting to recent cooling and slower capital repricing durable AI-capex bottleneck exposure.", "forced_counterparty": "T+1 retail momentum traders and short-window thematic funds that cut exposure after 3-5 day pullbacks.", "data_requirements": "[\"daily OHLCV\", \"volume_ratio\", \"beta-hedged sleeve return vs 000300.SH/399006.SZ\", \"rolling corr vs promoted factors\", \"residual risk attribution by AI layer\"]", "failure_mode": "Fails in broad risk-off or mean-reverting tape where 20-day leadership does not persist, or when low-volume pullbacks reflect real thesis decay instead of benign digestion.", "report_contract": "setup_overlay", "ai_supercycle_layer": "none", "supply_chain_hypothesis": "Within already source-reviewed CN AI-infra names, bottleneck legs should show leader-plus-low-volume-digestion behavior before the next repricing wave; no new supplier/customer edge is asserted here.", "relationship_evidence_required": "false", "money_readiness": "research_only", "decision": "revert", "session_branch": "main", "base_ref": "origin/main", "merge_base": "c99187be1dc8d78a84147200981562efcde7b8d5", "head_commit": "c99187be1dc8d78a84147200981562efcde7b8d5"}
{"ts": "2026-05-22T14:55:41.759860+08:00", "session_id": "20260522_140003_ff19e4", "market": "cn", "formula": "rank(-(ts_max(turnover_rate,20)/ts_sum(turnover_rate,20)))", "name": "turnover_spike_share_20", "is_ic": -0.0557, "is_ic_ir": -0.225, "is_sharpe": -3.806, "is_turnover": 0.155, "is_monotonicity": -0.3, "gates": "FAIL", "status": "reverted", "eval_seconds": 250.6, "sleeve_id": "cn_ai_infra_accumulation_quality", "mispricing_source": "A-share AI narratives pull in hot-money bursts, but real institutional accumulation in bottleneck names is spread over multiple sessions due size, T+1 frictions, and benchmark risk. This payoff comes from distinguishing distributed float absorption from speculative spike-chasing, not from reusing an existing reversal or shadow-price signal.", "forced_counterparty": "retail theme chasers and short-horizon event funds that concentrate volume into headline days", "data_requirements": "[\"daily turnover_rate for signal calc\", \"20d mean amount or circ_market_cap capacity filter before live sizing\", \"beta-hedged sleeve attribution vs 000300.SH and 399006.SZ\", \"ai_infra BFS depth/module tags for post-trade attribution\"]", "failure_mode": "It underperforms when regime leadership is driven by genuine information shocks or policy gap-ups, where one-day turnover spikes carry real discovery instead of hot-money exhaustion.", "report_contract": "setup_overlay", "ai_supercycle_layer": "none", "supply_chain_hypothesis": "Candidate CN AI-infra bottleneck suppliers should exhibit multi-day float absorption before explicit order, capex, or customer evidence is fully public; any specific supplier/customer mapping remains a source-review task.", "relationship_evidence_required": "true", "money_readiness": "research_only", "decision": "revert", "session_branch": "main", "base_ref": "origin/main", "merge_base": "c99187be1dc8d78a84147200981562efcde7b8d5", "head_commit": "c99187be1dc8d78a84147200981562efcde7b8d5"}
{"ts": "2026-05-22T14:55:41.759860+08:00", "session_id": "20260522_140003_ff19e4", "market": "cn", "formula": "rank(-pb)*rank(ts_mean(amount/circ_market_cap,20)/ts_std(amount/circ_market_cap,20))", "name": "low_pb_stable_float_flow_20", "is_ic": -0.0001, "is_ic_ir": 0.034, "is_sharpe": -2.567, "is_turnover": 0.123, "is_monotonicity": -0.4, "gates": "FAIL", "status": "reverted", "eval_seconds": 153.9, "sleeve_id": "cn_ai_infra_repricing", "mispricing_source": "Low-multiple AI-infra bottleneck names are neglected by style and benchmark constraints; steady float-adjusted trading value signals informed accumulation before fundamentals are broadly repriced.", "forced_counterparty": "Growth-style mutual funds, retail thematic chasers, and benchmark-aware managers who avoid low-PB heavy-asset names until confirmation is obvious", "data_requirements": "[\"daily CN price/volume/daily_basic already available\",\"for promotion: beta-hedged sleeve attribution, correlation to existing sleeves, and original-source filings/transcripts/backlog-capex evidence for any supplier or customer claim\"]", "failure_mode": "Fails when the market stays in a pure high-beta narrative chase and low-PB names remain value traps, or when stable flow is just illiquidity rather than accumulation.", "report_contract": "action_overlay", "ai_supercycle_layer": "hard_assets_energy_heavy", "supply_chain_hypothesis": "AI datacenter power, grid, cooling, and other hard-asset bottlenecks in the CN AI-infra chain are accumulated quietly before order visibility is fully reflected in price.", "relationship_evidence_required": "true", "money_readiness": "research_only", "decision": "revert", "session_branch": "main", "base_ref": "origin/main", "merge_base": "c99187be1dc8d78a84147200981562efcde7b8d5", "head_commit": "c99187be1dc8d78a84147200981562efcde7b8d5"}
{"ts": "2026-05-22T14:55:41.759860+08:00", "session_id": "20260522_140003_ff19e4", "market": "cn", "formula": "rank(ts_corr(ret_1d,shift(ret_1d,1),20))*rank(-ts_std(turnover_rate,20)/(ts_std(turnover_rate,120)+0.01))", "name": "orderly_persistence_turnreg_20_120", "is_ic": -0.0675, "is_ic_ir": -0.232, "is_sharpe": -5.781, "is_turnover": 0.183, "is_monotonicity": -0.6, "gates": "FAIL", "status": "reverted", "eval_seconds": 157.2, "sleeve_id": "cn_ai_leadership_overlay", "mispricing_source": "A-share AI leaders are often under-owned and reprice through gradual follow-through; conditioning return persistence on a calmer turnover-vol regime targets orderly sponsorship rather than a high-correlation price-only reversal/momentum clone.", "forced_counterparty": "Short-horizon retail churn and benchmark-constrained institutions that trim or underweight early instead of warehousing the full AI capex repricing.", "data_requirements": "[\"daily ret_1d\",\"daily turnover_rate\",\"validated AI universe membership/source-review status\",\"benchmark hedge attribution vs 000300.SH and 399006.SZ before promotion\"]", "failure_mode": "Fails in sharp mean-reversion or policy-headline tape where low turnover-vol simply reflects exhaustion/liquidity drought rather than accumulation.", "report_contract": "setup_overlay", "ai_supercycle_layer": "ai_chip_equipment_materials_packaging", "supply_chain_hypothesis": "Candidate D1-D3 AI bottleneck equipment/materials/packaging names should show orderly return persistence with subdued near-term turnover-vol before verified order or capacity disclosures.", "relationship_evidence_required": "true", "money_readiness": "research_only", "decision": "revert", "session_branch": "main", "base_ref": "origin/main", "merge_base": "c99187be1dc8d78a84147200981562efcde7b8d5", "head_commit": "c99187be1dc8d78a84147200981562efcde7b8d5"}
{"ts": "2026-05-22T14:55:41.759860+08:00", "session_id": "20260522_140003_ff19e4", "market": "cn", "formula": "rank(-ts_corr(ret_1d,shift(ret_1d,1),20))*rank(ts_std(turnover_rate,20)/(ts_std(turnover_rate,120)+0.01))", "name": "anti_autocorr_turn_reaccel_20_120", "is_ic": 0.0755, "is_ic_ir": 0.24, "is_sharpe": 4.171, "is_turnover": 0.165, "is_monotonicity": 0.3, "gates": "PASS", "status": "reverted", "eval_seconds": 186.6, "sleeve_id": "cn_ai_infra_absorption", "mispricing_source": "Early accumulation is masked by noisy daily reversals, so the market underprices improving sponsorship until later confirmation.", "forced_counterparty": "T+1 retail traders and benchmark-constrained longs rotating out of volatile theme names", "data_requirements": "[\"daily price and turnover_rate\",\"ai_infra universe depth/module tags for sleeve attribution\",\"benchmark beta and residual-risk attribution\",\"filings/official disclosures before promoting any supplier or order claim\"]", "failure_mode": "This stops working when smooth momentum is directly rewarded, or when turnover reacceleration is speculative blow-off rather than absorption.", "report_contract": "setup_overlay", "ai_supercycle_layer": "ai_chip_equipment_materials_packaging", "supply_chain_hypothesis": "CN second-tier AI bottleneck suppliers may show turnover-regime reacceleration plus choppy absorption before verified order/backlog evidence becomes public.", "relationship_evidence_required": "true", "money_readiness": "research_only", "decision": "revert", "session_branch": "main", "base_ref": "origin/main", "merge_base": "c99187be1dc8d78a84147200981562efcde7b8d5", "head_commit": "c99187be1dc8d78a84147200981562efcde7b8d5", "oos": "FAIL", "checks_status": "skipped"}
{"ts": "2026-05-22T14:55:41.759860+08:00", "session_id": "20260522_140003_ff19e4", "market": "cn", "formula": "rank(-ts_corr(ret_1d, shift(ret_1d, 1), 20)) * rank(ts_mean(amount / circ_market_cap, 20) / ts_mean(amount / circ_market_cap, 120))", "name": "anti_autocorr_floatflow_reaccel_20_120", "is_ic": 0.0626, "is_ic_ir": 0.198, "is_sharpe": 2.831, "is_turnover": 0.15, "is_monotonicity": 0.45, "gates": "FAIL", "status": "reverted", "eval_seconds": 194.5, "sleeve_id": "cn_ai_flow_reaccel", "mispricing_source": "This is a participation-regime signal, not a pure price signal; float-adjusted flow re-acceleration reveals re-underwriting of AI bottleneck exposure before benchmarked books and narrative chasers fully rerate the name.", "forced_counterparty": "T+1 retail swing traders and benchmark-constrained managers who cannot pre-position before evidence confirmation", "data_requirements": "[\"current daily price/amount/circ_market_cap is enough for IS test\",\"before promotion require sleeve correlation matrix, long-minus-benchmark hedge ledger vs 000300.SH or 399006.SZ, and residual risk attribution inside the AI universe\"]", "failure_mode": "It stops working when theme-wide policy beta or speculative squeeze dominates idiosyncratic accumulation, so higher float-adjusted flow becomes exit liquidity or exhaustion instead of absorption.", "report_contract": "research_only", "ai_supercycle_layer": "ai_chip_equipment_materials_packaging", "supply_chain_hypothesis": "Domestic equipment, materials, and advanced-packaging names tied to accelerator and datacenter build-outs may show stealth float-flow re-acceleration before orders, capacity awards, or customer ramps are confirmed by original sources.", "relationship_evidence_required": "true", "money_readiness": "research_only", "decision": "revert", "session_branch": "main", "base_ref": "origin/main", "merge_base": "c99187be1dc8d78a84147200981562efcde7b8d5", "head_commit": "c99187be1dc8d78a84147200981562efcde7b8d5"}
