{"ts": "2026-05-14T06:57:17.389776+08:00", "session_id": "20260514_060003_7f53cb", "market": "cn", "formula": "rank(ts_mean(amount / circ_market_cap, 20)) * rank(-pb)", "name": "float_flow_lowpb_20", "is_ic": 0.0, "is_ic_ir": 0.0, "is_sharpe": 0.0, "is_turnover": 0.0, "is_monotonicity": 0.0, "gates": "FAIL", "status": "reverted", "eval_seconds": 107.4, "sleeve_id": "cn_ai_flow_value", "mispricing_source": "Thematic capital overpays for obvious concept leaders first and underprices real-capacity suppliers; float-normalized traded value can reveal accumulation before valuation catches up, so this is not just another short-horizon price factor.", "forced_counterparty": "Retail theme chasers and benchmarked growth managers who avoid low-multiple capex names; legacy holders needing liquidity provide stock into institutional accumulation.", "data_requirements": "[\"daily price/volume/daily_basic for factor\", \"beta-hedged sleeve return attribution\", \"correlation vs existing promoted sleeves\", \"ai_infra evidence cards or original sources before any specific supplier/customer claim is used in reports\"]", "failure_mode": "It stops working when narrative beta dominates monetization quality, or when low-PB names are true value traps because capex, margins, or order quality are deteriorating.", "report_contract": "fresh_buy_gate", "ai_supercycle_layer": "hard_assets_energy_heavy", "supply_chain_hypothesis": "Asset-heavy enablers of AI datacenter, power, packaging, and optical buildout should re-rate after quiet institutional absorption before order visibility is fully capitalized.", "relationship_evidence_required": "true", "money_readiness": "money_candidate", "decision": "revert", "session_branch": "main", "base_ref": "origin/main", "merge_base": "7e34f69c6d80fac556ec0c4417978d3bf014bde7", "head_commit": "7e34f69c6d80fac556ec0c4417978d3bf014bde7"}
{"ts": "2026-05-14T06:57:17.389776+08:00", "session_id": "20260514_060003_7f53cb", "market": "cn", "formula": "rank(-(ts_max(turnover_rate,20)/ts_sum(turnover_rate,20)))", "name": "turnover_spike_share_20", "is_ic": 0.0, "is_ic_ir": 0.0, "is_sharpe": 0.0, "is_turnover": 0.0, "is_monotonicity": 0.0, "gates": "FAIL", "status": "reverted", "eval_seconds": 149.9, "sleeve_id": "cn_ai_infra_absorption", "mispricing_source": "The market overpays for headline-day liquidity and underweights slow inventory transfer into stronger hands; this is a flow-concentration signal, not a simple momentum clone.", "forced_counterparty": "Retail theme chasers and short-horizon funds reacting to AI headlines; legacy holders using spike liquidity to exit.", "data_requirements": "[\"current daily turnover_rate is enough for IS testing\",\"promotion needs beta-hedged sleeve attribution vs 000300.SH and 399006.SZ\",\"run corr check vs kshadow_5 and amount/turnover stability family\",\"track sleeve drawdown and residual risk inside the validated ai_infra CN universe\"]", "failure_mode": "It stops working when policy or headline gaps make one-day turnover spikes genuinely informative instead of a crowding/unwind signal.", "report_contract": "setup_overlay", "ai_supercycle_layer": "none", "supply_chain_hypothesis": "none", "relationship_evidence_required": "false", "money_readiness": "research_only", "decision": "revert", "session_branch": "main", "base_ref": "origin/main", "merge_base": "7e34f69c6d80fac556ec0c4417978d3bf014bde7", "head_commit": "7e34f69c6d80fac556ec0c4417978d3bf014bde7"}
{"ts": "2026-05-14T06:57:17.389776+08:00", "session_id": "20260514_060003_7f53cb", "market": "cn", "formula": "rank(ret_20d / clamp(ts_mean(turnover_rate,20),0.5,5))", "name": "quiet_leadership_turnover_20", "is_ic": 0.0, "is_ic_ir": 0.0, "is_sharpe": 0.0, "is_turnover": 0.0, "is_monotonicity": 0.0, "gates": "FAIL", "status": "reverted", "eval_seconds": 111.2, "sleeve_id": "cn_ai_tape_flow_overlay", "mispricing_source": "A-share participants systematically overpay for high-churn AI theme rallies and underweight smoother repricing with moderate turnover, so return-per-turnover can capture underreaction rather than raw beta.", "forced_counterparty": "retail concept chasers and short-horizon liquidity traders recycling float in high-turnover names", "data_requirements": "[\"CN daily returns\",\"daily_basic.turnover_rate\",\"validated ai_infra CN universe membership\",\"benchmark series 000300.SH and 399006.SZ for beta-hedged residual attribution\"]", "failure_mode": "It stops working in rumor/policy melt-up regimes where the highest-turnover names keep squeezing, or when low turnover reflects illiquidity/exhausted demand instead of informed holding.", "report_contract": "fresh_buy_gate", "ai_supercycle_layer": "none", "supply_chain_hypothesis": "Within the CN AI-infra universe, genuine bottleneck suppliers should show sustained 20-day leadership on only moderate turnover before order/backlog evidence is broadly recognized.", "relationship_evidence_required": "true", "money_readiness": "money_candidate", "decision": "revert", "session_branch": "main", "base_ref": "origin/main", "merge_base": "7e34f69c6d80fac556ec0c4417978d3bf014bde7", "head_commit": "7e34f69c6d80fac556ec0c4417978d3bf014bde7"}
{"ts": "2026-05-14T06:57:17.389776+08:00", "session_id": "20260514_060003_7f53cb", "market": "cn", "formula": "rank(-ts_corr(ret_1d,shift(ret_1d,1),20))*rank(-ts_std(delta(volume_ratio,1),20))", "name": "anti_autocorr_relvol_change_smooth_20", "is_ic": 0.0, "is_ic_ir": 0.0, "is_sharpe": 0.0, "is_turnover": 0.0, "is_monotonicity": 0.0, "gates": "FAIL", "status": "reverted", "eval_seconds": 165.0, "sleeve_id": "cn_aiinfra_accumulation", "mispricing_source": "Underreaction to steady institutional absorption in AI-infra names; the payoff is not just another price factor because it requires both anti-autocorrelated tape and smooth participation dynamics.", "forced_counterparty": "Retail T+1 chasers, thematic funds reacting to headlines, and short-horizon liquidity providers leaning against temporary inventory.", "data_requirements": "[\"daily OHLCV\",\"volume_ratio\",\"AI-infra universe/BFS tags\",\"beta hedge attribution vs 000300.SH and 399006.SZ\",\"live correlation check vs kshadow_5 and current sleeves\"]", "failure_mode": "It breaks in one-way speculative melt-ups or in illiquid regimes where negative autocorr no longer means absorption and smooth volume just means no demand.", "report_contract": "setup_overlay", "ai_supercycle_layer": "ai_chip_equipment_materials_packaging", "supply_chain_hypothesis": "Domestic AI bottleneck enablers can be accumulated steadily before verified customer/order disclosure, especially when qualification cycles are long and tape leads filings/news.", "relationship_evidence_required": "true", "money_readiness": "research_only", "decision": "revert", "session_branch": "main", "base_ref": "origin/main", "merge_base": "7e34f69c6d80fac556ec0c4417978d3bf014bde7", "head_commit": "7e34f69c6d80fac556ec0c4417978d3bf014bde7"}
{"ts": "2026-05-14T06:57:17.389776+08:00", "session_id": "20260514_060003_7f53cb", "market": "cn", "formula": "rank(-ts_std(pct_change(amount,5),20))*rank(-ts_max(ret_1d,20))", "name": "low_lottery_amtchg_stability_20", "is_ic": 0.0, "is_ic_ir": 0.0, "is_sharpe": 0.0, "is_turnover": 0.0, "is_monotonicity": 0.0, "gates": "FAIL", "status": "reverted", "eval_seconds": 124.4, "sleeve_id": "cn_aiinfra_accumulation_overlay", "mispricing_source": "Underreaction to slow institutional accumulation in validated AI-infra names; this is flow-path quality plus anti-lottery crowding, not a simple variant of momentum or upper-shadow price action.", "forced_counterparty": "Retail theme chasers and short-horizon fast money that prefer volatile breakout names and provide liquidity to quieter accumulators.", "data_requirements": "[\"daily OHLCV\",\"amount\",\"beta-hedged sleeve attribution vs 000300.SH and 399006.SZ before promotion\",\"rolling correlation to existing sleeves\"]", "failure_mode": "It should fail in regimes where limit-up/high-beta chasing keeps extending, or when low amount-change volatility reflects neglect/liquidity decay rather than accumulation.", "report_contract": "setup_overlay", "ai_supercycle_layer": "none", "supply_chain_hypothesis": "Within the validated CN AI-infra universe, this should surface bottleneck names being accumulated ahead of source-confirmed order, capex, or backlog evidence; no specific supplier/customer relationship is inferred from tape alone.", "relationship_evidence_required": "true", "money_readiness": "research_only", "decision": "revert", "session_branch": "main", "base_ref": "origin/main", "merge_base": "7e34f69c6d80fac556ec0c4417978d3bf014bde7", "head_commit": "7e34f69c6d80fac556ec0c4417978d3bf014bde7"}
{"ts": "2026-05-14T06:57:17.389776+08:00", "session_id": "20260514_060003_7f53cb", "market": "cn", "formula": "rank(-(ts_max(turnover_rate,20)/(ts_mean(turnover_rate,20)+0.01)))", "name": "turnover_spike_ratio_20", "is_ic": 0.0, "is_ic_ir": 0.0, "is_sharpe": 0.0, "is_turnover": 0.0, "is_monotonicity": 0.0, "gates": "FAIL", "status": "reverted", "eval_seconds": 117.5, "sleeve_id": "ai_cn_flow_quality", "mispricing_source": "Salient one-day volume surges attract retail and fast-money attention, so the market overprices bursty participation and underprices quiet multi-day accumulation; this is an ownership-path signal, not a plain price-momentum clone.", "forced_counterparty": "Retail theme chasers and short-horizon managers rotating into the hottest daily print", "data_requirements": "Current DSL data is sufficient for IS testing; before promotion, require long-alpha vs benchmark-hedge attribution, sleeve correlation to existing stability factors, and residual risk decomposition inside the validated AI universe.", "failure_mode": "This stops working when the regime rewards rumor-driven spike chasing, low-float squeezes, or policy headlines that overpower steady accumulation.", "report_contract": "fresh_buy_gate", "ai_supercycle_layer": "none", "supply_chain_hypothesis": "Validated AI-infra bottleneck names should show distributed turnover across sessions as positions are built ahead of broader repricing, while single-day turnover bursts are more likely non-durable theme traffic.", "relationship_evidence_required": "false", "money_readiness": "money_candidate", "decision": "revert", "session_branch": "main", "base_ref": "origin/main", "merge_base": "7e34f69c6d80fac556ec0c4417978d3bf014bde7", "head_commit": "7e34f69c6d80fac556ec0c4417978d3bf014bde7"}
{"ts": "2026-05-14T06:57:17.389776+08:00", "session_id": "20260514_060003_7f53cb", "market": "cn", "formula": "rank(ts_mean(amount/circ_market_cap,20)/ts_max(amount/circ_market_cap,20))", "name": "float_even_flow_20", "is_ic": 0.0, "is_ic_ir": 0.0, "is_sharpe": 0.0, "is_turnover": 0.0, "is_monotonicity": 0.0, "gates": "FAIL", "status": "reverted", "eval_seconds": 142.5, "sleeve_id": "daily_float_flow_quality", "mispricing_source": "Underreaction to quiet float-adjusted accumulation; the market overweights visible turnover spikes and underweights steady multi-week sponsorship.", "forced_counterparty": "Retail T+1 theme traders and benchmark/redemption-constrained long-only funds that trade for liquidity or mandate rather than 10-20 day expected value.", "data_requirements": "[\"amount\",\"circ_market_cap\",\"000300.SH and 399006.SZ benchmark returns for beta-hedged sleeve attribution\",\"sleeve correlation matrix\",\"intraday/member flow ledger before money-ready deployment\",\"filings/official PRs/transcripts if a supplier/customer claim is later attached\"]", "failure_mode": "Fails in policy-gap or speculative chase regimes where bursty participation is genuinely informative, or when smooth float flow mainly reflects dead illiquidity/passive churn rather than informed accumulation.", "report_contract": "research_only", "ai_supercycle_layer": "ai_chip_equipment_materials_packaging", "supply_chain_hypothesis": "Domestic AI equipment, materials, packaging, and testing bottleneck names should show steady float-normalized participation before verified order or backlog evidence is broadly recognized.", "relationship_evidence_required": "true", "money_readiness": "research_only", "decision": "revert", "session_branch": "main", "base_ref": "origin/main", "merge_base": "7e34f69c6d80fac556ec0c4417978d3bf014bde7", "head_commit": "7e34f69c6d80fac556ec0c4417978d3bf014bde7"}
{"ts": "2026-05-14T06:57:17.389776+08:00", "session_id": "20260514_060003_7f53cb", "market": "cn", "formula": "rank(ts_mean(amount/circ_market_cap,20)/(ts_std(amount/circ_market_cap,20)+0.01))", "name": "float_amount_sponsorship_20", "is_ic": 0.0, "is_ic_ir": 0.0, "is_sharpe": 0.0, "is_turnover": 0.0, "is_monotonicity": 0.0, "gates": "FAIL", "status": "reverted", "eval_seconds": 86.5, "sleeve_id": "cn_ai_infra_flow", "mispricing_source": "Underreaction to persistent ownership transfer; the market overweights visible price spikes and underweights quiet float-normalized capital commitment.", "forced_counterparty": "Benchmark-hugging funds and short-horizon retail traders who recycle float for liquidity or profit-taking rather than because AI-infra evidence changed.", "data_requirements": "[\"daily amount\",\"circ_market_cap\",\"ai_infra universe membership and source-review status\",\"beta-hedged sleeve attribution before promotion\"]", "failure_mode": "It should stop working in policy-shock or broad deleveraging regimes where stable flow reflects illiquidity apathy instead of informed accumulation, or when speculative one-day spikes dominate leadership.", "report_contract": "setup_overlay", "ai_supercycle_layer": "ai_chip_equipment_materials_packaging", "supply_chain_hypothesis": "Upstream AI chip-equipment/materials/packaging names exposed to accelerator and memory capex bottlenecks should show steadier float-normalized value absorption before backlog or order evidence becomes public.", "relationship_evidence_required": "true", "money_readiness": "research_only", "decision": "revert", "session_branch": "main", "base_ref": "origin/main", "merge_base": "7e34f69c6d80fac556ec0c4417978d3bf014bde7", "head_commit": "7e34f69c6d80fac556ec0c4417978d3bf014bde7"}
{"ts": "2026-05-14T06:57:17.389776+08:00", "session_id": "20260514_060003_7f53cb", "market": "cn", "formula": "rank(ts_min(amount / circ_market_cap,20) / ts_max(amount / circ_market_cap,20))", "name": "float_flow_corridor_20", "is_ic": 0.0, "is_ic_ir": 0.0, "is_sharpe": 0.0, "is_turnover": 0.0, "is_monotonicity": 0.0, "gates": "FAIL", "status": "reverted", "eval_seconds": 137.1, "sleeve_id": "cn_aiinfra_flow_overlay", "mispricing_source": "The market overreacts to visible theme spikes and underprices quiet, persistent float absorption in AI bottleneck names.", "forced_counterparty": "short-horizon retail traders and benchmark-aware funds that add only after public confirmation, leaving patient accumulators to buy earlier", "data_requirements": "[current daily data is sufficient for IS test; before promotion require sleeve corr to active factors, beta-hedged attribution vs 000300.SH and 399006.SZ, and standard AI-universe evidence status checks]", "failure_mode": "It should fail when the regime becomes pure headline/speculation chasing and one-day turnover spikes lead returns, or when float/corporate-action data becomes noisy.", "report_contract": "setup_overlay", "ai_supercycle_layer": "ai_networking_optical_cpo", "supply_chain_hypothesis": "Domestic optical/CPO and interconnect bottleneck names with genuine AI buildout exposure should exhibit persistent float-normalized flow corridors before backlog or order evidence is fully disclosed.", "relationship_evidence_required": "true", "money_readiness": "research_only", "decision": "revert", "session_branch": "main", "base_ref": "origin/main", "merge_base": "7e34f69c6d80fac556ec0c4417978d3bf014bde7", "head_commit": "7e34f69c6d80fac556ec0c4417978d3bf014bde7"}
{"ts": "2026-05-14T06:57:17.389776+08:00", "session_id": "20260514_060003_7f53cb", "market": "cn", "formula": "rank(ts_corr(ret_1d,shift(ret_1d,1),20))*rank(ts_min(turnover_rate,20)/ts_mean(turnover_rate,20))", "name": "autocorr_turnover_floor_20", "is_ic": 0.0, "is_ic_ir": 0.0, "is_sharpe": 0.0, "is_turnover": 0.0, "is_monotonicity": 0.0, "gates": "FAIL", "status": "reverted", "eval_seconds": 192.4, "sleeve_id": "cn_ai_quiet_leadership", "mispricing_source": "Underreaction to persistent accumulation in bottleneck AI-infra names; this is not just another price factor because it conditions return persistence on continuous participation rather than one-day speculative churn.", "forced_counterparty": "Retail theme chasers and benchmark-constrained mutual funds trading around T+1, liquidity, and headline bursts.", "data_requirements": "[\"daily OHLCV\",\"daily_basic turnover_rate\",\"AI-infra universe/BFS metadata\",\"beta-hedged sleeve attribution vs 000300.SH and 399006.SZ\",\"original filings or official releases before any optical/PCB supplier claim is promoted\"]", "failure_mode": "It stops working when rumor/policy squeeze regimes reward turnover spikes over steady accumulation, or when AI-infra breadth collapses and the signal turns into a low-liquidity proxy.", "report_contract": "fresh_buy_gate", "ai_supercycle_layer": "ai_networking_optical_cpo", "supply_chain_hypothesis": "optical-module and high-speed interconnect names with persistent return follow-through and a stable turnover floor may be early CN bottleneck beneficiaries of AI cluster/network buildouts.", "relationship_evidence_required": "true", "money_readiness": "money_candidate", "decision": "revert", "session_branch": "main", "base_ref": "origin/main", "merge_base": "7e34f69c6d80fac556ec0c4417978d3bf014bde7", "head_commit": "7e34f69c6d80fac556ec0c4417978d3bf014bde7"}
{"ts": "2026-05-14T14:57:24.823429+08:00", "session_id": "20260514_140002_68da11", "market": "cn", "formula": "rank(ret_20d) * ts_mean(turnover_rate,20) / ts_std(turnover_rate,20)", "name": "stable_turnover_lead_20", "is_ic": 0.0, "is_ic_ir": 0.0, "is_sharpe": 0.0, "is_turnover": 0.0, "is_monotonicity": 0.0, "gates": "FAIL", "status": "reverted", "eval_seconds": 153.5, "sleeve_id": "cn_ai_bottleneck_accumulation", "mispricing_source": "Slow information diffusion in niche AI-capex beneficiaries lets institutions accumulate over weeks; the stable-turnover term makes this an ownership-transfer signal rather than a high-correlation clone of a pure price factor.", "forced_counterparty": "Short-horizon retail traders taking profits into strength and benchmark-constrained managers underweight specialized upstream suppliers until order evidence is obvious.", "data_requirements": "[\"daily price and turnover_rate already available\", \"ai_infra universe metadata for layer/depth filtering\", \"portfolio-stage beta hedge return and residual risk attribution vs 000300.SH/399006.SZ\"]", "failure_mode": "It should stop working in policy-headline squeeze regimes or broad small-cap manias, where unstable speculative turnover dominates and steady accumulation no longer separates future leaders.", "report_contract": "fresh_buy_gate", "ai_supercycle_layer": "ai_networking_optical_cpo", "supply_chain_hypothesis": "Datacenter optical interconnect and CPO bottlenecks should reprice first through steady accumulation in CN optical-component suppliers before lagging confirmation from reported orders.", "relationship_evidence_required": "true", "money_readiness": "money_candidate", "decision": "revert", "session_branch": "main", "base_ref": "origin/main", "merge_base": "d2c1f8b0275f77c8ecaaf5e8c1e7af34eb0f89bd", "head_commit": "d2c1f8b0275f77c8ecaaf5e8c1e7af34eb0f89bd"}
{"ts": "2026-05-14T14:57:24.823429+08:00", "session_id": "20260514_140002_68da11", "market": "cn", "formula": "rank(-(ts_max(turnover_rate,20)/ts_mean(turnover_rate,20)))*rank(-ts_corr(ret_1d,shift(ret_1d,1),40))", "name": "turnover_reversion_absorb_20_40", "is_ic": 0.0, "is_ic_ir": 0.0, "is_sharpe": 0.0, "is_turnover": 0.0, "is_monotonicity": 0.0, "gates": "FAIL", "status": "reverted", "eval_seconds": 198.6, "sleeve_id": "quiet_flow_underreaction", "mispricing_source": "A-share retail and news-driven theme traders create one-day turnover bursts and overshoot tape, while slower institutions accumulate AI-infra leaders across several weeks; the market underprices steady post-spike absorption.", "forced_counterparty": "retail theme chasers and benchmark-constrained institutions trading on liquidity/news windows", "data_requirements": "[\"daily turnover_rate\",\"daily ret_1d\",\"AI universe membership/evidence status\",\"beta hedge and residual risk attribution vs CN benchmarks for sleeve deployment\"]", "failure_mode": "It stops working in clean momentum/breakout regimes where turnover spikes are informed continuation rather than temporary retail crowding, or when policy beta dominates stock-specific accumulation.", "report_contract": "setup_overlay", "ai_supercycle_layer": "ai_networking_optical_cpo", "supply_chain_hypothesis": "Candidate CN optical interconnect and datacenter-networking bottleneck names should show low-spike turnover and pullback absorption before verified AI-cluster order evidence is fully reflected.", "relationship_evidence_required": "true", "money_readiness": "research_only", "decision": "revert", "session_branch": "main", "base_ref": "origin/main", "merge_base": "d2c1f8b0275f77c8ecaaf5e8c1e7af34eb0f89bd", "head_commit": "d2c1f8b0275f77c8ecaaf5e8c1e7af34eb0f89bd"}
