{"ts": "2026-05-14T14:57:24.823429+08:00", "session_id": "20260514_140002_68da11", "market": "cn", "formula": "rank(ts_min(amount/circ_market_cap,20)/ts_mean(amount/circ_market_cap,20))", "name": "float_floor_support_20", "is_ic": 0.0, "is_ic_ir": 0.0, "is_sharpe": 0.0, "is_turnover": 0.0, "is_monotonicity": 0.0, "gates": "FAIL", "status": "reverted", "eval_seconds": 132.5, "sleeve_id": "cn_ai_absorption_quality", "mispricing_source": "A-share theme rotation over-rewards bursty attention and underprices names where capital stays committed on quiet days; the market notices the steady base only after evidence/news catches up.", "forced_counterparty": "theme-chasing retail and benchmarked mutual funds that rotate toward high-excitement spikes and away from quiet consolidations", "data_requirements": "[\"daily amount and circ_market_cap (available)\", \"rolling corr vs kshadow_5 and amount_stability_20\", \"beta-hedged sleeve attribution vs 000300.SH/399006.SZ\", \"evidence cards/original sources before naming any specific supplier/customer relationship\"]", "failure_mode": "It should decay if AI-infra leadership becomes purely event-driven and bursty, or if float-normalized amount floor collapses into a simple size/liquidity proxy inside the 33-name universe.", "report_contract": "setup_overlay", "ai_supercycle_layer": "none", "supply_chain_hypothesis": "Layer-agnostic within the validated CN AI-infra universe: persistent float-floor support may surface D2-D4 bottleneck suppliers being accumulated ahead of explicit order/capex confirmation.", "relationship_evidence_required": "true", "money_readiness": "research_only", "decision": "revert", "session_branch": "main", "base_ref": "origin/main", "merge_base": "d2c1f8b0275f77c8ecaaf5e8c1e7af34eb0f89bd", "head_commit": "d2c1f8b0275f77c8ecaaf5e8c1e7af34eb0f89bd"}
{"ts": "2026-05-14T14:57:24.823429+08:00", "session_id": "20260514_140002_68da11", "market": "cn", "formula": "rank(ret_20d)*rank(-ret_5d)*rank(ts_mean(amount,20)/ts_std(amount,20))", "name": "stable_amount_pullback_20_5", "is_ic": 0.0, "is_ic_ir": 0.0, "is_sharpe": 0.0, "is_turnover": 0.0, "is_monotonicity": 0.0, "gates": "FAIL", "status": "reverted", "eval_seconds": 23.5, "sleeve_id": "ai_infra_pullback_continuation", "mispricing_source": "Short-horizon retail de-risking and theme rotation create temporary pullbacks, while slower institutional accumulation in AI-infra leaders keeps medium-term demand intact.", "forced_counterparty": "Retail momentum chasers and short-horizon benchmarked traders who must cut recent underperformers during theme rotations.", "data_requirements": "[\"daily price/volume/amount already sufficient for prototype\", \"before promotion: sleeve correlation to existing factors, beta-hedged attribution vs 000300.SH/399006.SZ, residual risk decomposition\", \"if tying signal to specific AI supply links: filings/transcripts/source-review evidence\"]", "failure_mode": "Stops working in broad liquidity crashes or sharp mean-reversion regimes where 20-day winners become crowded exits and stable amount reflects distribution rather than absorption.", "report_contract": "setup_overlay", "ai_supercycle_layer": "ai_chip_equipment_materials_packaging", "supply_chain_hypothesis": "Tape should surface accumulation in domestic AI bottleneck suppliers and equipment names when the market buys medium-term localization winners on temporary pullbacks.", "relationship_evidence_required": "true", "money_readiness": "research_only", "decision": "revert", "session_branch": "main", "base_ref": "origin/main", "merge_base": "d2c1f8b0275f77c8ecaaf5e8c1e7af34eb0f89bd", "head_commit": "d2c1f8b0275f77c8ecaaf5e8c1e7af34eb0f89bd"}
{"ts": "2026-05-14T14:57:24.823429+08:00", "session_id": "20260514_140002_68da11", "market": "cn", "formula": "rank(ret_20d) * rank(-ps_ttm)", "name": "cheap_trend_ai_20", "is_ic": 0.0, "is_ic_ir": 0.0, "is_sharpe": 0.0, "is_turnover": 0.0, "is_monotonicity": 0.0, "gates": "FAIL", "status": "reverted", "eval_seconds": 109.3, "sleeve_id": "cn_ai_infra_value_momentum", "mispricing_source": "Order-cycle beneficiaries rerate slowly because benchmarked managers anchor to stale valuation frameworks and wait for fundamental confirmation after price leadership has already started.", "forced_counterparty": "Benchmark-constrained long-only funds and short-horizon retail traders rotating on headlines rather than optimizing 10-20 day relative value inside AI-infra names.", "data_requirements": "[\"prototype uses current CN daily fields only\",\"before promotion: hedge attribution vs 000300.SH and 399006.SZ\",\"sleeve correlation and residual risk attribution\",\"filings/transcripts/backlog-capex evidence if used to claim specific supply-chain bottleneck exposure\"]", "failure_mode": "It stops working when the market shifts into fast reversal/liquidity squeeze, or once the AI-infra rerating is fully crowded and low sales multiples no longer proxy for delayed estimate upgrades.", "report_contract": "research_only", "ai_supercycle_layer": "ai_chip_equipment_materials_packaging", "supply_chain_hypothesis": "Validated AI-infra bottleneck suppliers with still-low sales multiples should keep rerating as accelerator and datacenter capex propagates into equipment, materials, and packaging order books.", "relationship_evidence_required": "true", "money_readiness": "research_only", "decision": "revert", "session_branch": "main", "base_ref": "origin/main", "merge_base": "d2c1f8b0275f77c8ecaaf5e8c1e7af34eb0f89bd", "head_commit": "d2c1f8b0275f77c8ecaaf5e8c1e7af34eb0f89bd"}
{"ts": "2026-05-14T14:57:24.823429+08:00", "session_id": "20260514_140002_68da11", "market": "cn", "formula": "rank(ts_mean(amount,20)/(ts_std(amount,20)+1))*rank(ret_20d-ret_5d)", "name": "amount_absorb_pause_20", "is_ic": 0.0, "is_ic_ir": 0.0, "is_sharpe": 0.0, "is_turnover": 0.0, "is_monotonicity": 0.0, "gates": "FAIL", "status": "reverted", "eval_seconds": 106.8, "sleeve_id": "cn_ai_infra_leadership_pullback", "mispricing_source": "Public confirmation of AI capex, backlog, or domestic substitution demand usually lags tape, so steady value turnover plus a controlled pullback is underpriced by short-horizon participants.", "forced_counterparty": "Benchmarked mutual funds and short-horizon retail traders trimming after 5-day weakness or risk-budget resets", "data_requirements": "[\"daily price/amount data for signal construction\", \"beta-hedge and residual return attribution\", \"source-reviewed filings/press releases/transcripts for any supplier/order claim\", \"backlog/capex/gross-margin data before promotion beyond setup use\"]", "failure_mode": "Fails when AI-theme breadth collapses, policy or earnings shocks reset the capex narrative, or stable amount reflects distribution rather than accumulation.", "report_contract": "setup_overlay", "ai_supercycle_layer": "ai_chip_equipment_materials_packaging", "supply_chain_hypothesis": "Candidate domestic chip equipment/materials/packaging bottleneck names should show steady amount-backed pullbacks before verified order or capacity evidence is explicit in filings.", "relationship_evidence_required": "true", "money_readiness": "research_only", "decision": "revert", "session_branch": "main", "base_ref": "origin/main", "merge_base": "d2c1f8b0275f77c8ecaaf5e8c1e7af34eb0f89bd", "head_commit": "d2c1f8b0275f77c8ecaaf5e8c1e7af34eb0f89bd"}
{"ts": "2026-05-14T14:57:24.823429+08:00", "session_id": "20260514_140002_68da11", "market": "cn", "formula": "rank(ret_20d/max(ts_std(turnover_rate,20),0.01))", "name": "trend_absorption_20", "is_ic": 0.0, "is_ic_ir": 0.0, "is_sharpe": 0.0, "is_turnover": 0.0, "is_monotonicity": 0.0, "gates": "FAIL", "status": "compute_error", "eval_seconds": 108.6, "sleeve_id": "cn_ai_accumulation_overlay", "mispricing_source": "T+1 trading, theme-chasing retail, and benchmark-aware long-only funds underreact to slow institutional absorption in scarce AI-capex beneficiaries, so calm-churn leaders remain under-owned.", "forced_counterparty": "Short-horizon retail traders taking quick profits and benchmark-constrained mutual funds that cannot add full size immediately.", "data_requirements": "[\"daily CN price and turnover_rate data for IS testing\", \"000300.SH and 399006.SZ benchmark series for beta-hedged sleeve attribution\", \"filings/press releases/transcripts before any supplier, customer, backlog, or capex-link claim is promoted\"]", "failure_mode": "This stops working when the AI theme flips into violent mean reversion, policy shock forces de-risking, or low turnover volatility is just illiquidity rather than real accumulation.", "report_contract": "setup_overlay", "ai_supercycle_layer": "ai_chip_equipment_materials_packaging", "supply_chain_hypothesis": "Domestic D2-D3 AI capex bottleneck names, especially equipment and advanced-packaging suppliers, should show persistent 20-day leadership with calm float rotation before backlog and utilization are fully recognized by the market.", "relationship_evidence_required": "true", "money_readiness": "research_only", "decision": "revert", "session_branch": "main", "base_ref": "origin/main", "merge_base": "d2c1f8b0275f77c8ecaaf5e8c1e7af34eb0f89bd", "head_commit": "d2c1f8b0275f77c8ecaaf5e8c1e7af34eb0f89bd"}
{"ts": "2026-05-14T14:57:24.823429+08:00", "session_id": "20260514_140002_68da11", "market": "cn", "formula": "rank(ts_min(turnover_rate,20)/(ts_mean(turnover_rate,20)+0.01))*rank(ts_mean(sign(close-open),20))", "name": "turnover_floor_body_bias_20", "is_ic": 0.0, "is_ic_ir": 0.0, "is_sharpe": 0.0, "is_turnover": 0.0, "is_monotonicity": 0.0, "gates": "FAIL", "status": "reverted", "eval_seconds": 170.5, "sleeve_id": "cn_ai_flow_body_overlay", "mispricing_source": "Underreaction to steady institutional absorption in float-constrained names; the market overpays for bursty headline tape and underprices dull but persistent sponsorship.", "forced_counterparty": "Retail momentum traders and liquidity-needing holders rotating out of quiet names too early.", "data_requirements": "[\"daily OHLC\",\"daily_basic.turnover_rate\",\"canonical AI-infra universe membership/evidence state\",\"beta-hedge and residual-risk attribution for promotion\"]", "failure_mode": "It stops working in rumor/limit-up regimes where one-shot speculative spikes dominate gradual accumulation, or when the turnover floor comes from trapped holders rather than informed buyers.", "report_contract": "setup_overlay", "ai_supercycle_layer": "none", "supply_chain_hypothesis": "none", "relationship_evidence_required": "false", "money_readiness": "research_only", "decision": "revert", "session_branch": "main", "base_ref": "origin/main", "merge_base": "d2c1f8b0275f77c8ecaaf5e8c1e7af34eb0f89bd", "head_commit": "d2c1f8b0275f77c8ecaaf5e8c1e7af34eb0f89bd"}
{"ts": "2026-05-14T14:57:24.823429+08:00", "session_id": "20260514_140002_68da11", "market": "cn", "formula": "rank(-(ts_max(turnover_rate,20) / ts_mean(turnover_rate,20)))", "name": "turnover_spike_quiet_20", "is_ic": 0.0, "is_ic_ir": 0.0, "is_sharpe": 0.0, "is_turnover": 0.0, "is_monotonicity": 0.0, "gates": "FAIL", "status": "reverted", "eval_seconds": 212.2, "sleeve_id": "cn_ai_flow_absorption", "mispricing_source": "The payoff comes from avoiding crowded turnover spikes and preferring orderly accumulation; this is a participation-structure signal, not just another price-momentum variant.", "forced_counterparty": "Retail theme chasers and T+1 constrained fast money that must react to policy/news bursts; benchmark-aware long-only funds that add AI bottleneck exposure gradually.", "data_requirements": "[\"daily turnover_rate is enough for IS test\", \"before promotion require beta-hedged sleeve attribution vs 000300.SH and 399006.SZ\", \"corr matrix vs existing sleeves\", \"AI-universe source-review status for ranked names\"]", "failure_mode": "It stops working when the market rewards pure event spikes, or when low spike ratios simply reflect dead liquidity instead of real accumulation.", "report_contract": "fresh_buy_gate", "ai_supercycle_layer": "ai_chip_equipment_materials_packaging", "supply_chain_hypothesis": "Domestic AI equipment/materials/packaging bottleneck names should show steadier sponsorship than crowded tourist names during supercycle repricing.", "relationship_evidence_required": "false", "money_readiness": "money_candidate", "decision": "revert", "session_branch": "main", "base_ref": "origin/main", "merge_base": "d2c1f8b0275f77c8ecaaf5e8c1e7af34eb0f89bd", "head_commit": "d2c1f8b0275f77c8ecaaf5e8c1e7af34eb0f89bd"}
{"ts": "2026-05-14T14:57:24.823429+08:00", "session_id": "20260514_140002_68da11", "market": "cn", "formula": "rank(ts_mean(amount/circ_market_cap,20)/(ts_std(amount/circ_market_cap,20)+0.01))", "name": "float_flow_stability_20", "is_ic": 0.0, "is_ic_ir": 0.0, "is_sharpe": 0.0, "is_turnover": 0.0, "is_monotonicity": 0.0, "gates": "FAIL", "status": "reverted", "eval_seconds": 95.2, "sleeve_id": "cn_ai_flow_overlay", "mispricing_source": "A-share AI-infra leaders are often repriced with delay because benchmarked funds and fundamental managers scale in gradually, while the market overreacts to noisy volume spikes and underweights slow, persistent sponsorship.", "forced_counterparty": "Retail turnover-chasers and mandate-constrained institutions that cannot immediately reach target weights in smaller or less-liquid AI-infra names", "data_requirements": "[\"daily amount\",\"daily circ_market_cap\",\"correlation check vs kshadow_5 and amount_stability_20\",\"beta-hedged sleeve attribution vs 000300.SH/399006.SZ\"]", "failure_mode": "Stops working when the regime shifts to headline-driven one-day speculation or when broad sector de-rating overwhelms stock-specific accumulation signals.", "report_contract": "fresh_buy_gate", "ai_supercycle_layer": "ai_networking_optical_cpo", "supply_chain_hypothesis": "Candidate optical/interconnect and adjacent AI-infra bottleneck names should show persistent float-adjusted absorption before backlog and order evidence is fully reflected in price.", "relationship_evidence_required": "true", "money_readiness": "money_candidate", "decision": "revert", "session_branch": "main", "base_ref": "origin/main", "merge_base": "d2c1f8b0275f77c8ecaaf5e8c1e7af34eb0f89bd", "head_commit": "d2c1f8b0275f77c8ecaaf5e8c1e7af34eb0f89bd"}
{"ts": "2026-05-14T14:57:24.823429+08:00", "session_id": "20260514_140002_68da11", "market": "cn", "formula": "rank(ret_20d) * rank(-abs(ret_5d))", "name": "leader_digestion_20_5", "is_ic": 0.0, "is_ic_ir": 0.0, "is_sharpe": 0.0, "is_turnover": 0.0, "is_monotonicity": 0.0, "gates": "FAIL", "status": "reverted", "eval_seconds": 114.0, "sleeve_id": "daily_price_overlay", "mispricing_source": "Short-horizon traders overreact to recent cooling in strong AI-infra leaders, while slower institutional demand is still entering and is not fully reflected in price.", "forced_counterparty": "retail T+1 profit-takers and fast theme-rotation accounts exiting after the first pause", "data_requirements": "[\"current CN daily price data is sufficient for IS test\", \"CN benchmark return series for beta-hedged attribution\", \"sleeve correlation and turnover-cost ledger before promotion\"]", "failure_mode": "This stops working when the market flips into broad mean reversion, policy shock disperses AI leadership, or the 20-day trend is already a late-stage blowoff rather than orderly accumulation.", "report_contract": "setup_overlay", "ai_supercycle_layer": "none", "supply_chain_hypothesis": "Cross-layer AI-infra leaders can keep repricing after shallow digestion during capex-driven theme waves; no specific supplier/customer relationship is asserted by this signal.", "relationship_evidence_required": "false", "money_readiness": "research_only", "decision": "revert", "session_branch": "main", "base_ref": "origin/main", "merge_base": "d2c1f8b0275f77c8ecaaf5e8c1e7af34eb0f89bd", "head_commit": "d2c1f8b0275f77c8ecaaf5e8c1e7af34eb0f89bd"}
{"ts": "2026-05-14T14:57:24.823429+08:00", "session_id": "20260514_140002_68da11", "market": "cn", "formula": "rank(-ts_mean(abs(pct_change(amount/circ_market_cap,5)),20))", "name": "float_flow_smooth_20", "is_ic": 0.0, "is_ic_ir": 0.0, "is_sharpe": 0.0, "is_turnover": 0.0, "is_monotonicity": 0.0, "gates": "FAIL", "status": "reverted", "eval_seconds": 229.7, "sleeve_id": "cn_ai_float_flow_overlay", "mispricing_source": "The market overpays for visible high-churn AI theme traffic and underprices quiet multi-week ownership transfer; this is a flow-path quality signal, not a high-correlation clone of `kshadow_5`.", "forced_counterparty": "Retail T+1 theme chasers, redemption-driven sellers, and benchmark-constrained long-only funds trading for liquidity or mandate rather than 10-20 day alpha.", "data_requirements": "[\"current daily amount and circ_market_cap are sufficient for IS test\",\"before promotion require long-alpha vs 000300.SH/399006.SZ beta-hedge attribution\",\"residual risk and sleeve drawdown attribution\",\"rolling corr check vs kshadow_5 and other flow sleeves\",\"original filings/PRs/transcripts before attaching any supplier/customer narrative\"]", "failure_mode": "Fails in policy-gap or rumor-squeeze regimes where bursty turnover keeps being rewarded, or when smooth float-normalized flow is just dead illiquidity rather than informed accumulation.", "report_contract": "setup_overlay", "ai_supercycle_layer": "ai_chip_equipment_materials_packaging", "supply_chain_hypothesis": "Domestic AI chip-equipment, materials, packaging, and testing bottlenecks should show smoother float-normalized weekly flow than downstream narrative names while institutions accumulate ahead of source-reviewed order/backlog/capex evidence.", "relationship_evidence_required": "true", "money_readiness": "research_only", "decision": "revert", "session_branch": "main", "base_ref": "origin/main", "merge_base": "d2c1f8b0275f77c8ecaaf5e8c1e7af34eb0f89bd", "head_commit": "d2c1f8b0275f77c8ecaaf5e8c1e7af34eb0f89bd"}
{"ts": "2026-05-14T14:57:24.823429+08:00", "session_id": "20260514_140002_68da11", "market": "cn", "formula": "rank(-ts_corr(ret_1d,shift(ret_1d,1),20))*rank(-ts_std(pct_change(amount,5),20))", "name": "anti_autocorr_weekly_amount_stability", "is_ic": 0.0, "is_ic_ir": 0.0, "is_sharpe": 0.0, "is_turnover": 0.0, "is_monotonicity": 0.0, "gates": "FAIL", "status": "reverted", "eval_seconds": 129.0, "sleeve_id": "cn_ai_infra_flow_overlay", "mispricing_source": "Slow underreaction to persistent institutional accumulation in scarce-capacity AI-infra names; price-only factors miss the information in smooth capital-commitment paths.", "forced_counterparty": "Retail momentum traders and calendar-constrained sector rotators who chase headlines and provide liquidity against slow institutional buying.", "data_requirements": "[\"daily amount and returns for IS test\",\"hedged sleeve attribution vs 000300.SH and 399006.SZ\",\"corr check vs kshadow_5 and turnover/amount stability sleeves before promotion\"]", "failure_mode": "Fails when policy/news shocks dominate tape, or when speculative lottery rallies overwhelm steady accumulation and short-term autocorrelation turns trend-following.", "report_contract": "fresh_buy_gate", "ai_supercycle_layer": "ai_chip_equipment_materials_packaging", "supply_chain_hypothesis": "If AI supercycle capex is genuinely tightening CN bottleneck capacity, orderly accumulation should appear first in validated packaging/equipment/materials names before broader second-derivative followers.", "relationship_evidence_required": "true", "money_readiness": "money_candidate", "decision": "revert", "session_branch": "main", "base_ref": "origin/main", "merge_base": "d2c1f8b0275f77c8ecaaf5e8c1e7af34eb0f89bd", "head_commit": "d2c1f8b0275f77c8ecaaf5e8c1e7af34eb0f89bd"}
{"ts": "2026-05-14T14:57:24.823429+08:00", "session_id": "20260514_140002_68da11", "market": "cn", "formula": "rank(ts_min(amount/circ_market_cap,20)/ts_max(amount/circ_market_cap,20))", "name": "float_flow_corridor_20", "is_ic": 0.0, "is_ic_ir": 0.0, "is_sharpe": 0.0, "is_turnover": 0.0, "is_monotonicity": 0.0, "gates": "FAIL", "status": "reverted", "eval_seconds": 169.4, "sleeve_id": "cn_ai_infra_flow_corridor", "mispricing_source": "This is a participation-distribution signal rather than a plain price factor; it captures slow accumulation and absorption in constrained AI-infra leaders before tape strength is fully priced.", "forced_counterparty": "Retail spike chasers and short-horizon profit takers; benchmarked long-only funds that cannot finish reallocating in one session.", "data_requirements": "[\"current daily amount and circ_market_cap are sufficient for IS test\",\"need sleeve correlation, beta-hedged alpha, and residual risk attribution before promotion\",\"if a picked name is claimed as a verified supplier/customer, add filings/press releases/transcripts\"]", "failure_mode": "It should stop working in rumor-spike regimes where one-day liquidity shocks dominate or when broad liquidity lifts the whole universe indiscriminately.", "report_contract": "setup_overlay", "ai_supercycle_layer": "ai_networking_optical_cpo", "supply_chain_hypothesis": "Bottleneck optical/interconnect and adjacent AI-infra suppliers should exhibit steady float-adjusted participation before order visibility is confirmed in filings or official disclosures.", "relationship_evidence_required": "true", "money_readiness": "research_only", "decision": "revert", "session_branch": "main", "base_ref": "origin/main", "merge_base": "d2c1f8b0275f77c8ecaaf5e8c1e7af34eb0f89bd", "head_commit": "d2c1f8b0275f77c8ecaaf5e8c1e7af34eb0f89bd"}
