{"ts": "2026-05-15T06:55:04.788753+08:00", "session_id": "20260515_060002_96bdd9", "market": "cn", "formula": "rank(ret_20d-ret_5d) * rank(-ts_std(amount,20)/ts_mean(amount,20))", "name": "steady_amount_leadership", "is_ic": 0.0, "is_ic_ir": 0.0, "is_sharpe": 0.0, "is_turnover": 0.0, "is_monotonicity": 0.0, "gates": "FAIL", "status": "reverted", "eval_seconds": 99.4, "sleeve_id": "cn_ai_leadership_overlay", "mispricing_source": "This is a flow-conditioned leadership signal, not a pure price-momentum clone; it only pays when medium-term strength is backed by orderly capital commitment instead of unstable speculative bursts.", "forced_counterparty": "retail profit-takers and benchmarked or liquidity-constrained funds that trim or avoid concentrated AI-infra names during low-noise digestion", "data_requirements": "[\"current daily price/amount data is sufficient for IS testing\",\"before promotion require beta-hedged sleeve attribution vs 000300.SH and 399006.SZ plus correlation to promoted sleeves\"]", "failure_mode": "It weakens in policy-shock or broad mean-reversion regimes where stable amount reflects inactivity instead of sponsorship, or when AI-theme turnover becomes purely rumor/news driven.", "report_contract": "fresh_buy_gate", "ai_supercycle_layer": "ai_datacenter_edge_infra", "supply_chain_hypothesis": "CN servers, optical links, and power-support names tied to verified AI datacenter buildout should show steady-amount trend digestion before wider thematic re-rating.", "relationship_evidence_required": "true", "money_readiness": "money_candidate", "decision": "revert", "session_branch": "main", "base_ref": "origin/main", "merge_base": "0994185783159f479f554edf1e5a4e45d9f34cfe", "head_commit": "0994185783159f479f554edf1e5a4e45d9f34cfe"}
{"ts": "2026-05-15T06:55:04.788753+08:00", "session_id": "20260515_060002_96bdd9", "market": "cn", "formula": "rank((ret_20d-ret_5d)/(ts_std(amount,20)/ts_mean(amount,20)+0.01))", "name": "stable_amount_pullback_resume", "is_ic": 0.0, "is_ic_ir": 0.0, "is_sharpe": 0.0, "is_turnover": 0.0, "is_monotonicity": 0.0, "gates": "FAIL", "status": "reverted", "eval_seconds": 103.8, "sleeve_id": "cn_ai_infra_trend_digest", "mispricing_source": "A-share thematic capital often overreacts to short pullbacks in true leaders; stable成交额 suggests committed capital is still present, so the market underprices continuation after the shakeout.", "forced_counterparty": "Short-horizon retail profit-takers and benchmarked funds trimming extended winners", "data_requirements": "[\"daily ret_20d, ret_5d, amount (available)\", \"benchmark-hedged sleeve attribution vs 000300.SH and 399006.SZ before promotion\", \"correlation check vs amount_stability_20 and kshadow_5\"]", "failure_mode": "It stops working in broad liquidity shocks or rumor-driven melt-ups, where stable amount reflects exit liquidity or crowded churn rather than accumulation.", "report_contract": "fresh_buy_gate", "ai_supercycle_layer": "none", "supply_chain_hypothesis": "Orderly pullbacks with stable capital participation should preferentially surface AI-infra bottleneck leaders already inside the validated universe, but no specific supplier/customer link is asserted by this formula alone.", "relationship_evidence_required": "false", "money_readiness": "money_candidate", "decision": "revert", "session_branch": "main", "base_ref": "origin/main", "merge_base": "0994185783159f479f554edf1e5a4e45d9f34cfe", "head_commit": "0994185783159f479f554edf1e5a4e45d9f34cfe"}
{"ts": "2026-05-15T06:55:04.788753+08:00", "session_id": "20260515_060002_96bdd9", "market": "cn", "formula": "rank(ts_count(ret_1d,20))*rank(-ts_mean(volume_ratio,5))", "name": "grindup_relvol_digest_20", "is_ic": 0.0, "is_ic_ir": 0.0, "is_sharpe": 0.0, "is_turnover": 0.0, "is_monotonicity": 0.0, "gates": "FAIL", "status": "reverted", "eval_seconds": 133.0, "sleeve_id": "daily_price_overlay", "mispricing_source": "The market chases obvious high-volume breakouts and underprices quieter post-breakout digestion in under-owned AI-infra names; this is an accumulation/tight-float effect, not just a raw momentum clone.", "forced_counterparty": "Retail momentum chasers and benchmarked institutions waiting for clearer confirmation before adding smaller bottleneck suppliers.", "data_requirements": "[\"daily price/volume available now\", \"benchmark-hedged attribution vs 000300.SH and 399006.SZ before promotion\", \"correlation to promoted sleeves\", \"source-review evidence if supplier/order interpretation is used in reporting\"]", "failure_mode": "It fails when the market shifts to sharp mean-reversion or when low volume reflects genuine demand exhaustion instead of absorbed supply.", "report_contract": "setup_overlay", "ai_supercycle_layer": "ai_chip_equipment_materials_packaging", "supply_chain_hypothesis": "Candidate AI bottleneck equipment/materials/packaging suppliers are being accumulated before visible order confirmation, so they show many small up days while relative volume cools.", "relationship_evidence_required": "true", "money_readiness": "research_only", "decision": "revert", "session_branch": "main", "base_ref": "origin/main", "merge_base": "0994185783159f479f554edf1e5a4e45d9f34cfe", "head_commit": "0994185783159f479f554edf1e5a4e45d9f34cfe"}
{"ts": "2026-05-15T06:55:04.788753+08:00", "session_id": "20260515_060002_96bdd9", "market": "cn", "formula": "rank(ret_20d/(ts_std(turnover_rate,20)+0.01))", "name": "stable_turnover_leadership_20", "is_ic": 0.0, "is_ic_ir": 0.0, "is_sharpe": 0.0, "is_turnover": 0.0, "is_monotonicity": 0.0, "gates": "FAIL", "status": "reverted", "eval_seconds": 27.9, "sleeve_id": "cn_ai_infra_accumulation", "mispricing_source": "The market underweights persistent accumulation in bottleneck AI-infra names because near-term attention chases noisier high-turnover narratives; stable leaders reprice more slowly as research and order evidence diffuse.", "forced_counterparty": "Short-horizon retail momentum chasers and benchmarked traders who rotate toward the loudest turnover spikes rather than the steadier accumulation names.", "data_requirements": "[\"beta-hedged sleeve attribution vs 000300.SH and 399006.SZ\",\"rolling correlation to existing promoted factors\",\"sector/module neutralization check inside AI-infra universe\",\"future source-review evidence for any supplier/customer interpretation\"]", "failure_mode": "It stops working when the market shifts into pure speculative breadth where unstable high-turnover names dominate, or when policy/liquidity shocks overwhelm accumulation signals.", "report_contract": "fresh_buy_gate", "ai_supercycle_layer": "ai_chip_equipment_materials_packaging", "supply_chain_hypothesis": "Bottleneck semiconductor equipment/materials/packaging names with genuine AI capex sensitivity should show steadier turnover-backed leadership before lagging peers.", "relationship_evidence_required": "true", "money_readiness": "money_candidate", "decision": "revert", "session_branch": "main", "base_ref": "origin/main", "merge_base": "0994185783159f479f554edf1e5a4e45d9f34cfe", "head_commit": "0994185783159f479f554edf1e5a4e45d9f34cfe"}
{"ts": "2026-05-15T06:55:04.788753+08:00", "session_id": "20260515_060002_96bdd9", "market": "cn", "formula": "rank(-ts_max(ret_1d,20))*rank(ts_mean(turnover_rate,20)/ts_max(turnover_rate,20))", "name": "low_lottery_turnover_evenness_20", "is_ic": 0.0, "is_ic_ir": 0.0, "is_sharpe": 0.0, "is_turnover": 0.0, "is_monotonicity": 0.0, "gates": "FAIL", "status": "reverted", "eval_seconds": 289.2, "sleeve_id": "cn_ai_quiet_flow", "mispricing_source": "Slow institutional accumulation versus fast retail/thematic overreaction; the market overpays for visible spike days and underprices steady absorption in capacity-linked AI names.", "forced_counterparty": "Retail hot-money, short-horizon thematic traders, and relative-performance-constrained desks that must react to attention spikes rather than accumulate patiently.", "data_requirements": "[\"current daily price+daily_basic data is enough for IS test\",\"source-reviewed AI-universe membership from ai_infra before production use\",\"sleeve beta-hedge attribution vs 000300.SH and 399006.SZ\",\"correlation and residual-risk attribution versus existing sleeves\"]", "failure_mode": "Fails when the market rewards gap/spike speculation for extended periods, or when AI-infra repricing becomes pure macro beta and steady accumulation no longer carries informational edge.", "report_contract": "fresh_buy_gate", "ai_supercycle_layer": "ai_datacenter_edge_infra", "supply_chain_hypothesis": "Quiet, even-turnover accumulation should surface reviewed CN datacenter, networking, cooling, and power-enablement bottleneck names before consensus fully prices the next capex leg.", "relationship_evidence_required": "true", "money_readiness": "money_candidate", "decision": "revert", "session_branch": "main", "base_ref": "origin/main", "merge_base": "0994185783159f479f554edf1e5a4e45d9f34cfe", "head_commit": "0994185783159f479f554edf1e5a4e45d9f34cfe"}
{"ts": "2026-05-15T06:55:04.788753+08:00", "session_id": "20260515_060002_96bdd9", "market": "cn", "formula": "rank(ts_min(amount,20)/ts_mean(amount,20))*rank(-ts_corr(ret_1d,shift(ret_1d,1),40))", "name": "amount_floor_anti_autocorr_20_40", "is_ic": 0.0, "is_ic_ir": 0.0, "is_sharpe": 0.0, "is_turnover": 0.0, "is_monotonicity": 0.0, "gates": "FAIL", "status": "reverted", "eval_seconds": 203.3, "sleeve_id": "daily_flow_absorption", "mispricing_source": "The payoff comes from participation quality, not naked price reversal; negative return autocorr is only bullish when a cash-turnover floor shows patient capital is still absorbing supply.", "forced_counterparty": "Short-horizon retail/theme traders constrained by T+1, stop-loss behavior, and benchmark-chasing flows.", "data_requirements": "[\"amount\",\"ret_1d\",\"validated CN ai_infra universe membership\",\"beta-hedged sleeve attribution and residual risk stats for promotion\"]", "failure_mode": "It stops working when the turnover floor is just passive liquidity or distribution support, or when broad thematic de-risking causes AI names to lose sponsorship together.", "report_contract": "fresh_buy_gate", "ai_supercycle_layer": "none", "supply_chain_hypothesis": "Cross-layer AI-infra bottleneck names in the validated CN universe can show steady cash-turnover floors before backlog/capex evidence is fully priced by the market.", "relationship_evidence_required": "false", "money_readiness": "money_candidate", "decision": "revert", "session_branch": "main", "base_ref": "origin/main", "merge_base": "0994185783159f479f554edf1e5a4e45d9f34cfe", "head_commit": "0994185783159f479f554edf1e5a4e45d9f34cfe"}
{"ts": "2026-05-15T06:55:04.788753+08:00", "session_id": "20260515_060002_96bdd9", "market": "cn", "formula": "rank((ret_20d - ret_5d) / (ts_std(turnover_rate,20) + 0.01))", "name": "low_churn_leader_pullback", "is_ic": 0.0, "is_ic_ir": 0.0, "is_sharpe": 0.0, "is_turnover": 0.0, "is_monotonicity": 0.0, "gates": "FAIL", "status": "reverted", "eval_seconds": 184.0, "sleeve_id": "cn_ai_accumulation_resume", "mispricing_source": "A-share AI themes attract short-horizon profit-taking, while institutions with slower sizing windows keep building positions in real bottleneck names; low turnover-volatility helps separate that sponsorship from speculative churn.", "forced_counterparty": "Theme-chasing retail traders and benchmarked managers trimming recent winners during short pullbacks.", "data_requirements": "[close, ret_5d, ret_20d, turnover_rate for IS testing; before promotion require beta-hedged sleeve PnL, residual risk attribution vs CN benchmarks, factor correlation matrix, and limit-up/capacity ledger]", "failure_mode": "Breaks when the market rewards pure high-beta theme spikes over orderly accumulation, or when policy/news gaps dominate 10-20 day price discovery.", "report_contract": "setup_overlay", "ai_supercycle_layer": "ai_networking_optical_cpo", "supply_chain_hypothesis": "Validated AI-universe optical/interconnect and datacenter-connectivity bottleneck names should exhibit low-churn pullback-resume behavior as AI capex transmission moves downstream.", "relationship_evidence_required": "true", "money_readiness": "research_only", "decision": "revert", "session_branch": "main", "base_ref": "origin/main", "merge_base": "0994185783159f479f554edf1e5a4e45d9f34cfe", "head_commit": "0994185783159f479f554edf1e5a4e45d9f34cfe"}
{"ts": "2026-05-15T06:55:04.788753+08:00", "session_id": "20260515_060002_96bdd9", "market": "cn", "formula": "rank(-ts_corr(turnover_rate, high / low - 1, 20))", "name": "turnover_range_absorption_20", "is_ic": 0.0, "is_ic_ir": 0.0, "is_sharpe": 0.0, "is_turnover": 0.0, "is_monotonicity": 0.0, "gates": "FAIL", "status": "reverted", "eval_seconds": 232.1, "sleeve_id": "daily_flow_absorption", "mispricing_source": "The market underreacts to quiet absorption because narrow-range, high-participation sessions look unexciting on headline screens even when stronger hands are taking inventory.", "forced_counterparty": "Retail momentum traders and legacy holders selling into steady demand", "data_requirements": "[\"daily OHLC\",\"turnover_rate\",\"benchmark beta-hedged sleeve attribution\",\"sleeve drawdown/correlation stats\",\"ai_infra source-review status before any supplier/customer narrative is upgraded from research_only\"]", "failure_mode": "It stops working when the regime shifts to pure speculative breakout chasing or forced deleveraging, where high turnover with tight ranges no longer means accumulation.", "report_contract": "action_overlay", "ai_supercycle_layer": "ai_chip_equipment_materials_packaging", "supply_chain_hypothesis": "Verified CN AI equipment/materials/packaging bottleneck names should show absorption on the tape before order, capex, or customer evidence is widely recognized.", "relationship_evidence_required": "true", "money_readiness": "research_only", "decision": "revert", "session_branch": "main", "base_ref": "origin/main", "merge_base": "0994185783159f479f554edf1e5a4e45d9f34cfe", "head_commit": "0994185783159f479f554edf1e5a4e45d9f34cfe"}
{"ts": "2026-05-15T06:55:04.788753+08:00", "session_id": "20260515_060002_96bdd9", "market": "cn", "formula": "rank(-(ts_max(turnover_rate,20)/ts_mean(turnover_rate,20)))", "name": "turnover_spike_concentration_20", "is_ic": 0.0, "is_ic_ir": 0.0, "is_sharpe": 0.0, "is_turnover": 0.0, "is_monotonicity": 0.0, "gates": "FAIL", "status": "reverted", "eval_seconds": 105.1, "sleeve_id": "cn_ai_flow_distribution", "mispricing_source": "The market overreacts to salient one-day turnover bursts and underreacts to distributed multi-day accumulation; this uses participation concentration, not price trend or upper-shadow shape, so it should be less collinear with existing price sleeves.", "forced_counterparty": "Retail T+1 theme chasers, redemption-driven sellers, and benchmarked long-only funds trading for liquidity rather than medium-horizon residual alpha", "data_requirements": "[\"current daily turnover_rate is sufficient for IS test\",\"before promotion require beta-hedged sleeve attribution vs 000300.SH and 399006.SZ\",\"rolling corr check vs kshadow_5 and amount/turnover stability families\",\"original filings/press releases/transcripts before attaching any supplier/customer claim\"]", "failure_mode": "Fails in rumor/policy-squeeze regimes where bursty turnover carries real information and keeps being rewarded, or when broad sector beta swamps stock-level accumulation quality.", "report_contract": "setup_overlay", "ai_supercycle_layer": "ai_chip_equipment_materials_packaging", "supply_chain_hypothesis": "Validated CN semicap, materials, packaging, and testing bottleneck names should show lower single-day turnover concentration during quiet accumulation before backlog/order evidence is fully recognized.", "relationship_evidence_required": "true", "money_readiness": "research_only", "decision": "revert", "session_branch": "main", "base_ref": "origin/main", "merge_base": "0994185783159f479f554edf1e5a4e45d9f34cfe", "head_commit": "0994185783159f479f554edf1e5a4e45d9f34cfe"}
{"ts": "2026-05-15T06:55:04.788753+08:00", "session_id": "20260515_060002_96bdd9", "market": "cn", "formula": "rank(-ts_corr(ret_1d,shift(ret_1d,1),20))*rank(ts_min(turnover_rate,20)/ts_mean(turnover_rate,20))", "name": "return_shakeout_turnover_floor_20", "is_ic": 0.0, "is_ic_ir": 0.0, "is_sharpe": 0.0, "is_turnover": 0.0, "is_monotonicity": 0.0, "gates": "FAIL", "status": "reverted", "eval_seconds": 130.3, "sleeve_id": "cn_aiinfra_flow_absorption", "mispricing_source": "Short-horizon thematic traders overreact to daily swings, while slower funds accumulate AI-infra bottleneck exposure over multi-week windows and cannot finish the position in one burst.", "forced_counterparty": "T+1 retail momentum traders and benchmarked managers de-risking after short spikes", "data_requirements": "[\"current CN daily price/volume/turnover_rate data for IS test\", \"for promotion: sleeve beta-hedge and residual-risk attribution\", \"if semicap bottleneck thesis is used in reporting: ai_infra evidence cards, source registry, and source-review status\"]", "failure_mode": "This stops working in pure liquidity-chasing melt-ups or broad deleveraging regimes where turnover persistence no longer signals accumulation and negative return autocorrelation just reflects distribution.", "report_contract": "fresh_buy_gate", "ai_supercycle_layer": "ai_chip_equipment_materials_packaging", "supply_chain_hypothesis": "Domestic semicap and advanced-packaging bottleneck names that keep a healthy turnover floor through shakeouts are being accumulated ahead of later capex, order, or localization confirmation.", "relationship_evidence_required": "true", "money_readiness": "money_candidate", "decision": "revert", "session_branch": "main", "base_ref": "origin/main", "merge_base": "0994185783159f479f554edf1e5a4e45d9f34cfe", "head_commit": "0994185783159f479f554edf1e5a4e45d9f34cfe"}
{"ts": "2026-05-15T06:55:04.788753+08:00", "session_id": "20260515_060002_96bdd9", "market": "cn", "formula": "rank(ts_corr(ret_1d, shift(ret_1d, 1), 20)) * rank(-ts_std(turnover_rate, 20) / (ts_std(turnover_rate, 120) + 0.01))", "name": "ret_autocorr_turn_regime_20", "is_ic": 0.0, "is_ic_ir": 0.0, "is_sharpe": 0.0, "is_turnover": 0.0, "is_monotonicity": 0.0, "gates": "FAIL", "status": "reverted", "eval_seconds": 228.7, "sleeve_id": "daily_flow_regime_overlay", "mispricing_source": "Slow underreaction to persistent accumulation in limited-float AI-infra leaders; the market over-discounts short-term turnover calm as “no catalyst” even when sponsorship is building.", "forced_counterparty": "Retail T+1 profit-takers and rebalance/liquidity sellers who feed inventory into benchmark-constrained institutions averaging in over multiple days.", "data_requirements": "[\"daily ret_1d and turnover_rate history\", \"beta-hedged sleeve return attribution vs 000300.SH/399006.SZ\", \"correlation check vs kshadow_5 and existing turnover/amount stability sleeves\"]", "failure_mode": "Breaks when the market shifts to one-day theme chasing or macro shock/gap-reversal regimes, where positive autocorrelation stops reflecting accumulation and turnover spikes dominate.", "report_contract": "fresh_buy_gate", "ai_supercycle_layer": "none", "supply_chain_hypothesis": "Cross-layer AI-infra bottleneck names under real accumulation should show positive return autocorrelation while short-horizon turnover volatility compresses relative to their own 120-day baseline, surfacing leadership before backlog/order evidence is fully priced.", "relationship_evidence_required": "true", "money_readiness": "money_candidate", "decision": "revert", "session_branch": "main", "base_ref": "origin/main", "merge_base": "0994185783159f479f554edf1e5a4e45d9f34cfe", "head_commit": "0994185783159f479f554edf1e5a4e45d9f34cfe"}
{"ts": "2026-05-15T06:55:04.788753+08:00", "session_id": "20260515_060002_96bdd9", "market": "cn", "formula": "rank(ts_min(turnover_rate,20)/(ts_max(turnover_rate,20)+0.01))", "name": "turnover_corridor_20", "is_ic": 0.0, "is_ic_ir": 0.0, "is_sharpe": 0.0, "is_turnover": 0.0, "is_monotonicity": 0.0, "gates": "FAIL", "status": "reverted", "eval_seconds": 211.7, "sleeve_id": "cn_ai_accumulation", "mispricing_source": "The market underprices slow ownership migration because orderly accumulation looks optically quiet before backlog, capex, or order evidence is visible; this is a participation-shape signal, not a price-pattern clone.", "forced_counterparty": "Retail chasers and benchmark-constrained PMs reacting to headlines, rebalances, and short-term liquidity windows", "data_requirements": "[\"daily prices\", \"turnover_rate\", \"ai_infra universe membership\", \"benchmark beta hedge return\", \"residual risk attribution\"]; no extra non-daily data required for IS testing", "failure_mode": "It should decay when the market becomes purely event-driven and even turnover reflects distribution/crowding rather than accumulation, or when speculative rotation dominates 10-20 day horizons.", "report_contract": "fresh_buy_gate", "ai_supercycle_layer": "none", "supply_chain_hypothesis": "none", "relationship_evidence_required": "false", "money_readiness": "money_candidate", "decision": "revert", "session_branch": "main", "base_ref": "origin/main", "merge_base": "0994185783159f479f554edf1e5a4e45d9f34cfe", "head_commit": "0994185783159f479f554edf1e5a4e45d9f34cfe"}
