{"ts": "2026-05-08T14:57:39.897050+08:00", "session_id": "20260508_140002_cb715f", "market": "cn", "formula": "rank(-ts_corr(ret_1d,shift(ret_1d,1),20))*rank(ts_min(ts_sum(amount/circ_market_cap,5),20)/ts_std(ts_sum(amount/circ_market_cap,5),20))", "name": "anti_autocorr_weekly_float_floorstd_20", "is_ic": 0.0367, "is_ic_ir": 0.44, "is_sharpe": 3.947, "is_turnover": 0.151, "is_monotonicity": 0.6, "gates": "PASS", "status": "candidate", "eval_seconds": 86.8, "sleeve_id": "anti_autocorr_float_absorption", "mispricing_source": "Underreaction to steady sponsorship per unit free float after transitory inventory shocks; this is a flow-support signal, not a raw price-momentum or price-volume-correlation clone.", "forced_counterparty": "retail attention traders, redemption-driven sellers, and benchmark-constrained long-only funds rebalancing for liquidity rather than 10-20 day alpha", "data_requirements": "[\"ret_1d\",\"amount\",\"circ_market_cap\"]", "failure_mode": "Breaks when bursty speculative flow is genuinely informative, or when smooth float-normalized flow mainly reflects stagnant illiquidity instead of accumulation.", "report_contract": "fresh_buy_gate", "money_readiness": "money_candidate", "decision": "candidate", "session_branch": "main", "base_ref": "origin/main", "merge_base": "62e27b1718a9c8c7cee619126770fe57cd98d173", "head_commit": "62e27b1718a9c8c7cee619126770fe57cd98d173"}
{"ts": "2026-05-08T14:57:39.897050+08:00", "session_id": "20260508_140002_cb715f", "market": "cn", "formula": "rank(ts_mean(amount / circ_market_cap, 20)) * rank(-ts_std(amount / circ_market_cap, 20))", "name": "steady_float_value_sponsorship_20", "is_ic": 0.0068, "is_ic_ir": 0.053, "is_sharpe": -3.225, "is_turnover": 0.074, "is_monotonicity": -0.4, "gates": "FAIL", "status": "reverted", "eval_seconds": 139.5, "sleeve_id": "float_value_flow_stability", "mispricing_source": "Slow diffusion of float-constrained demand; the signal is built from float-normalized traded value, not past returns, so it is a sponsorship/participation sleeve rather than another price factor clone.", "forced_counterparty": "Retail liquidity suppliers, benchmarked funds rebalancing on schedule, and institutions forced to execute gradually under impact constraints.", "data_requirements": "[\"amount\",\"circ_market_cap\"]", "failure_mode": "Stops working when amount is dominated by speculative theme-chasing or policy shock turnover, so stable participation no longer maps to informed accumulation.", "report_contract": "fresh_buy_gate", "money_readiness": "money_candidate", "decision": "revert", "session_branch": "main", "base_ref": "origin/main", "merge_base": "62e27b1718a9c8c7cee619126770fe57cd98d173", "head_commit": "62e27b1718a9c8c7cee619126770fe57cd98d173"}
{"ts": "2026-05-08T14:57:39.897050+08:00", "session_id": "20260508_140002_cb715f", "market": "cn", "formula": "rank(-ts_corr(delta(turnover_rate,5),shift(delta(turnover_rate,5),5),20))*rank(ts_min(turnover_rate,20)/ts_mean(turnover_rate,20))", "name": "anti_autocorr_weekly_turnover_floor_20", "is_ic": 0.0163, "is_ic_ir": 0.15, "is_sharpe": -3.902, "is_turnover": 0.193, "is_monotonicity": 0.0, "gates": "FAIL", "status": "reverted", "eval_seconds": 86.8, "sleeve_id": "weekly_flow_absorption", "mispricing_source": "Temporary liquidity-demand shocks are over-extrapolated; this measures replenishing participation rather than another price-trend variant.", "forced_counterparty": "Retail momentum traders and benchmark-constrained mutual funds/ETF baskets rebalancing around subscriptions, redemptions, and index events.", "data_requirements": "[\"turnover_rate\"]", "failure_mode": "It stops working when turnover shocks become persistent and information-driven, such as policy/theme manias, or when turnover floor collapses market-wide.", "report_contract": "fresh_buy_gate", "money_readiness": "money_candidate", "decision": "revert", "session_branch": "main", "base_ref": "origin/main", "merge_base": "62e27b1718a9c8c7cee619126770fe57cd98d173", "head_commit": "62e27b1718a9c8c7cee619126770fe57cd98d173"}
{"ts": "2026-05-08T14:57:39.897050+08:00", "session_id": "20260508_140002_cb715f", "market": "cn", "formula": "rank(-ts_corr(ret_5d,pct_change(amount,5),20))", "name": "weakness_absorption_amount_20", "is_ic": 0.0327, "is_ic_ir": 0.225, "is_sharpe": -0.199, "is_turnover": 0.117, "is_monotonicity": -0.05, "gates": "PASS", "status": "candidate", "eval_seconds": 145.7, "sleeve_id": "daily_flow_absorption", "mispricing_source": "Temporary inventory imbalances and underreaction to sponsor-quality of dip buying; the market sees weak price action but does not fully price that capital is stepping in on the other side.", "forced_counterparty": "retail panic sellers, theme chasers unwinding, and funds meeting redemptions into weakness", "data_requirements": "[\"ret_5d\",\"amount\"]", "failure_mode": "In broad de-risking or policy-shock regimes, high amount on weakness can reflect informed distribution rather than absorption, so the signal turns into a falling-knife trap.", "report_contract": "fresh_buy_gate", "money_readiness": "money_candidate", "decision": "candidate", "session_branch": "main", "base_ref": "origin/main", "merge_base": "62e27b1718a9c8c7cee619126770fe57cd98d173", "head_commit": "62e27b1718a9c8c7cee619126770fe57cd98d173"}
{"ts": "2026-05-08T14:57:39.897050+08:00", "session_id": "20260508_140002_cb715f", "market": "cn", "formula": "rank(-ts_std(delta(amount,5),20)/ts_mean(amount,20))*rank(-ts_max(ret_1d,20))", "name": "low_lottery_weekly_amount_change_stability_20", "is_ic": 0.0412, "is_ic_ir": 0.261, "is_sharpe": 0.046, "is_turnover": 0.095, "is_monotonicity": -0.05, "gates": "PASS", "status": "checks_failed", "eval_seconds": 94.2, "sleeve_id": "quiet_sponsorship_underreaction", "mispricing_source": "Attention-driven lottery preference and slow recognition of stable sponsorship; this is a participation-path signal, not a high-correlation variant of simple price momentum.", "forced_counterparty": "Retail momentum chasers and benchmark-constrained managers who gravitate toward salient spike names and underweight quiet accumulations", "data_requirements": "[amount, ret_1d]", "failure_mode": "Fails in lottery-led squeeze regimes or policy/event tapes where one-day jump risk is rewarded and steady sponsorship stops being scarce", "report_contract": "fresh_buy_gate", "money_readiness": "money_candidate", "decision": "revert", "session_branch": "main", "base_ref": "origin/main", "merge_base": "62e27b1718a9c8c7cee619126770fe57cd98d173", "head_commit": "62e27b1718a9c8c7cee619126770fe57cd98d173", "oos": "PASS", "checks_status": "failed"}
{"ts": "2026-05-08T14:57:39.897050+08:00", "session_id": "20260508_140002_cb715f", "market": "cn", "formula": "rank(-ts_std(delta(volume_ratio,5),20)) * rank(-ts_std(open / close,20))", "name": "weekly_relvol_body_stability_20", "is_ic": 0.0394, "is_ic_ir": 0.252, "is_sharpe": -0.085, "is_turnover": 0.09, "is_monotonicity": 0.0, "gates": "PASS", "status": "candidate", "eval_seconds": 148.5, "sleeve_id": "daily_participation_quality", "mispricing_source": "The market overreacts to loud turnover bursts and underreacts to slow, low-impact accumulation spread across days; this is a participation-quality signal, not a direct price-chasing variant.", "forced_counterparty": "retail attention traders and benchmarked/passive rebalancers who trade for non-alpha reasons and provide liquidity against patient accumulators", "data_requirements": "[open, close, volume_ratio]", "failure_mode": "This should weaken in regimes where breakouts are driven by attention spikes and gap-risk rather than quiet accumulation, or if volume_ratio becomes dominated by event flow.", "report_contract": "fresh_buy_gate", "money_readiness": "money_candidate", "decision": "candidate", "session_branch": "main", "base_ref": "origin/main", "merge_base": "62e27b1718a9c8c7cee619126770fe57cd98d173", "head_commit": "62e27b1718a9c8c7cee619126770fe57cd98d173"}
{"ts": "2026-05-11T06:56:38.409230+08:00", "session_id": "20260511_060043_a5d430", "market": "cn", "formula": "rank(-ts_corr(ret_1d,shift(ret_1d,1),20))*rank(ts_mean(turnover_rate,20)/ts_max(turnover_rate,20))", "name": "anti_autocorr_turnover_evenness_20", "is_ic": 0.0341, "is_ic_ir": 0.458, "is_sharpe": 2.258, "is_turnover": 0.174, "is_monotonicity": 0.25, "gates": "PASS", "status": "candidate", "eval_seconds": 138.3, "sleeve_id": "daily_turnover_absorption", "mispricing_source": "Quiet-accumulation underreaction; this is driven by participation-path quality, not raw price trend, so it should be less correlated with the existing close-volume correlation sleeves than another pure price or range factor.", "forced_counterparty": "retail attention-chasers and mandate-driven rebalance/redemption sellers", "data_requirements": "[\"ret_1d\",\"turnover_rate\"]", "failure_mode": "Fails in broad momentum/chasing regimes where short-horizon return autocorrelation turns positive, or when even turnover simply becomes a crowded low-beta/liquidity proxy.", "report_contract": "fresh_buy_gate", "money_readiness": "money_candidate", "decision": "candidate", "session_branch": "main", "base_ref": "origin/main", "merge_base": "62e27b1718a9c8c7cee619126770fe57cd98d173", "head_commit": "62e27b1718a9c8c7cee619126770fe57cd98d173"}
{"ts": "2026-05-11T06:56:38.409230+08:00", "session_id": "20260511_060043_a5d430", "market": "cn", "formula": "rank(ts_min(ts_sum(amount/circ_market_cap,5),20)/ts_max(ts_sum(amount/circ_market_cap,5),20))*rank(-ret_5d)", "name": "weekly_float_corridor_pullback_20", "is_ic": 0.0239, "is_ic_ir": 0.147, "is_sharpe": -2.13, "is_turnover": 0.267, "is_monotonicity": 0.35, "gates": "FAIL", "status": "reverted", "eval_seconds": 194.9, "sleeve_id": "quiet_flow_underreaction", "mispricing_source": "Short-term underreaction conditioned on orderly float participation; this is not a naked reversal factor because the signal requires stable float-flow, not just recent weakness.", "forced_counterparty": "Retail de-riskers and funds facing redemption or rebalance sells", "data_requirements": "[\"daily amount\",\"daily circ_market_cap\",\"daily ret_5d\"]", "failure_mode": "Fails in momentum-chasing or genuine bad-news regimes where pullbacks keep trending lower and stable participation no longer signals absorption.", "report_contract": "setup_overlay", "money_readiness": "research_only", "decision": "revert", "session_branch": "main", "base_ref": "origin/main", "merge_base": "62e27b1718a9c8c7cee619126770fe57cd98d173", "head_commit": "62e27b1718a9c8c7cee619126770fe57cd98d173"}
{"ts": "2026-05-11T06:56:38.409230+08:00", "session_id": "20260511_060043_a5d430", "market": "cn", "formula": "rank(-ts_std(pct_change(amount/circ_market_cap,5),20))*rank(-ts_std(close/open-1,20))", "name": "weekly_floatchg_body_stability_20", "is_ic": 0.0422, "is_ic_ir": 0.268, "is_sharpe": 0.178, "is_turnover": 0.093, "is_monotonicity": -0.05, "gates": "PASS", "status": "checks_failed", "eval_seconds": 160.8, "sleeve_id": "daily_flow_absorption", "mispricing_source": "Slow ownership transfer is underreacted to in a retail-heavy tape; the market overpays for noisy attention and underprices steady float absorption.", "forced_counterparty": "Retail chasers and benchmarked funds trading for liquidity/rebalance reasons rather than information", "data_requirements": "[\"amount\",\"circ_market_cap\",\"open\",\"close\"]", "failure_mode": "Fails in momentum-chasing or policy-shock regimes where bursty high-beta names lead and quiet absorption stops being rewarded.", "report_contract": "fresh_buy_gate", "money_readiness": "money_candidate", "decision": "revert", "session_branch": "main", "base_ref": "origin/main", "merge_base": "62e27b1718a9c8c7cee619126770fe57cd98d173", "head_commit": "62e27b1718a9c8c7cee619126770fe57cd98d173", "oos": "PASS", "checks_status": "failed"}
{"ts": "2026-05-11T06:56:38.409230+08:00", "session_id": "20260511_060043_a5d430", "market": "cn", "formula": "rank(ts_mean(ts_sum(volume,5),20)/ts_max(ts_sum(volume,5),20))", "name": "weekly_volume_evenness_20", "is_ic": 0.0294, "is_ic_ir": 0.322, "is_sharpe": 0.321, "is_turnover": 0.127, "is_monotonicity": 0.95, "gates": "PASS", "status": "candidate", "eval_seconds": 143.7, "sleeve_id": "weekly_share_flow_quality", "mispricing_source": "Slow ownership transfer under retail attention bias; this is a share-flow time-shape signal, not a price-response clone of `vpcorr_5` or `d2_10_513`.", "forced_counterparty": "retail attention traders chasing burst-volume names; benchmark/rebalance and redemption-driven long-only funds trading for mandate or liquidity rather than medium-horizon alpha", "data_requirements": "[\"volume\"] for research; intraday order-flow or member-level trade ledger needed before money-ready deployment to separate quiet accumulation from smooth distribution", "failure_mode": "Fails when smooth volume mainly reflects dead illiquidity, or in policy/speculative regimes where bursty high-volume leaders carry genuine information and keep outperforming.", "report_contract": "setup_overlay", "money_readiness": "research_only", "decision": "candidate", "session_branch": "main", "base_ref": "origin/main", "merge_base": "62e27b1718a9c8c7cee619126770fe57cd98d173", "head_commit": "62e27b1718a9c8c7cee619126770fe57cd98d173"}
{"ts": "2026-05-11T06:56:38.409230+08:00", "session_id": "20260511_060043_a5d430", "market": "cn", "formula": "rank(-ts_max(ret_1d,20))*rank(ts_mean(ts_sum(amount/circ_market_cap,5),20)/ts_max(ts_sum(amount/circ_market_cap,5),20))", "name": "low_lottery_weekly_float_evenness_20", "is_ic": 0.0403, "is_ic_ir": 0.266, "is_sharpe": 0.322, "is_turnover": 0.111, "is_monotonicity": 0.0, "gates": "PASS", "status": "candidate", "eval_seconds": 169.4, "sleeve_id": "float_flow_underreaction", "mispricing_source": "Attention segmentation plus slow recognition of quiet float-normalized accumulation", "forced_counterparty": "retail lottery chasers and benchmark/redemption-driven funds trading for mandate or liquidity rather than alpha", "data_requirements": "[\"ret_1d\",\"amount\",\"circ_market_cap\"]; for money-ready deployment add intraday order-flow or member-level trade ledger to distinguish true accumulation from smooth distribution or dead liquidity", "failure_mode": "Fails in policy/theme momentum or price-limit regimes where lottery names keep leading, or when smooth float turnover is mostly illiquidity/passive crowding rather than informed absorption", "report_contract": "fresh_buy_gate", "money_readiness": "money_candidate", "decision": "candidate", "session_branch": "main", "base_ref": "origin/main", "merge_base": "62e27b1718a9c8c7cee619126770fe57cd98d173", "head_commit": "62e27b1718a9c8c7cee619126770fe57cd98d173"}
{"ts": "2026-05-11T06:56:38.409230+08:00", "session_id": "20260511_060043_a5d430", "market": "cn", "formula": "rank(ts_corr(amount, shift(amount, 5), 20)) * rank(ts_mean(turnover_rate,20)/ts_max(turnover_rate,20))", "name": "weekly_amount_persist_turnover_evenness_20", "is_ic": 0.029, "is_ic_ir": 0.299, "is_sharpe": -1.151, "is_turnover": 0.167, "is_monotonicity": 0.4, "gates": "PASS", "status": "candidate", "eval_seconds": 191.7, "sleeve_id": "steady_participation_flow", "mispricing_source": "Underreaction to persistent, float-aware execution flow; this is a participation-quality sleeve, not a close-volume price-correlation variant.", "forced_counterparty": "Retail attention traders and liquidity-motivated sellers who supply stock while patient buyers execute across many sessions.", "data_requirements": "[\"amount\", \"turnover_rate\"]", "failure_mode": "Fails when speculative bursty turnover is rewarded, or when steady execution becomes crowded and no longer signals incremental demand.", "report_contract": "setup_overlay", "money_readiness": "research_only", "decision": "candidate", "session_branch": "main", "base_ref": "origin/main", "merge_base": "62e27b1718a9c8c7cee619126770fe57cd98d173", "head_commit": "62e27b1718a9c8c7cee619126770fe57cd98d173"}
{"ts": "2026-05-11T06:56:38.409230+08:00", "session_id": "20260511_060043_a5d430", "market": "cn", "formula": "rank(-ts_corr(ret_1d,shift(ret_1d,1),20))*rank(ts_mean(volume_ratio,20)/ts_max(volume_ratio,20))", "name": "anti_autocorr_vratio_evenness_20", "is_ic": 0.0331, "is_ic_ir": 0.425, "is_sharpe": 1.823, "is_turnover": 0.17, "is_monotonicity": 0.05, "gates": "PASS", "status": "candidate", "eval_seconds": 223.4, "sleeve_id": "daily_attention_absorption", "mispricing_source": "Retail attention spikes overprice noisy names, while steady relative-volume names with anti-chasing return paths are under-discounted; this is an attention-smoothness signal, not a close-volume correlation clone.", "forced_counterparty": "retail attention-chasers and liquidity-motivated sellers/rebalancers", "data_requirements": "[\"ret_1d\",\"volume_ratio\"]", "failure_mode": "It should weaken in momentum-chasing regimes where lumpy attention and positive feedback get rewarded, or if `volume_ratio` mostly collapses into a generic liquidity proxy.", "report_contract": "fresh_buy_gate", "money_readiness": "money_candidate", "decision": "candidate", "session_branch": "main", "base_ref": "origin/main", "merge_base": "62e27b1718a9c8c7cee619126770fe57cd98d173", "head_commit": "62e27b1718a9c8c7cee619126770fe57cd98d173"}
{"ts": "2026-05-11T06:56:38.409230+08:00", "session_id": "20260511_060043_a5d430", "market": "cn", "formula": "rank(-ts_max(ret_1d,20))*rank(ts_std(delta(turnover_rate,5),60)/ts_std(delta(turnover_rate,5),20))", "name": "low_lottery_turnshock_compress_20_60", "is_ic": 0.0238, "is_ic_ir": 0.153, "is_sharpe": -2.822, "is_turnover": 0.101, "is_monotonicity": -0.4, "gates": "FAIL", "status": "reverted", "eval_seconds": 137.8, "sleeve_id": "participation_regime_underreaction", "mispricing_source": "Attention-driven lottery demand and slow recognition of post-churn supply absorption; this is turnover-shock normalization conditioned on low salience, not a high-correlation variant of existing price-volume correlation factors.", "forced_counterparty": "retail lottery chasers, redemption-driven small funds, and benchmark/rebalance sellers who trade for liquidity or mandate rather than 10-20 day alpha", "data_requirements": "[\"ret_1d\",\"turnover_rate\"]; intraday order-flow or broker/member trade ledger would improve money-readiness by separating true strong-hand absorption from dead liquidity", "failure_mode": "Breaks in policy/thematic momentum regimes where bursty turnover is genuinely informative and recent jackpot names keep leading, or when turnover compression mainly reflects illiquidity freeze rather than absorption.", "report_contract": "setup_overlay", "money_readiness": "research_only", "decision": "revert", "session_branch": "main", "base_ref": "origin/main", "merge_base": "62e27b1718a9c8c7cee619126770fe57cd98d173", "head_commit": "62e27b1718a9c8c7cee619126770fe57cd98d173"}
{"ts": "2026-05-11T06:56:38.409230+08:00", "session_id": "20260511_060043_a5d430", "market": "cn", "formula": "rank(ts_min(amount/circ_market_cap,20)/ts_max(amount/circ_market_cap,20))", "name": "float_flow_corridor_20", "is_ic": 0.0321, "is_ic_ir": 0.333, "is_sharpe": 0.676, "is_turnover": 0.116, "is_monotonicity": 0.75, "gates": "PASS", "status": "candidate", "eval_seconds": 150.2, "sleeve_id": "daily_float_flow_quality", "mispricing_source": "Episodic retail attention and flow-constrained rebalancers create noisy participation spikes; names with steady float-normalized turnover are underreacted-to because their accumulation is less visible than price-chasing narratives.", "forced_counterparty": "Retail attention traders and benchmarked long-only funds with subscription/redemption and tracking-error constraints", "data_requirements": "[amount, circ_market_cap]", "failure_mode": "This stops working when theme/chase regimes dominate and one-off turnover spikes become the main return driver, so steady-flow names lag speculative leaders.", "report_contract": "fresh_buy_gate", "money_readiness": "money_candidate", "decision": "candidate", "session_branch": "main", "base_ref": "origin/main", "merge_base": "62e27b1718a9c8c7cee619126770fe57cd98d173", "head_commit": "62e27b1718a9c8c7cee619126770fe57cd98d173"}
{"ts": "2026-05-11T06:56:38.409230+08:00", "session_id": "20260511_060043_a5d430", "market": "cn", "formula": "rank(-ts_std(turnover_rate,20)/ts_mean(turnover_rate,20))*rank(-ps_ttm)", "name": "cheap_float_evenness_20", "is_ic": 0.0169, "is_ic_ir": 0.105, "is_sharpe": -2.424, "is_turnover": 0.08, "is_monotonicity": -0.4, "gates": "FAIL", "status": "reverted", "eval_seconds": 109.5, "sleeve_id": "neglect_flow_value", "mispricing_source": "Retail attention chases high-story/high-turnover names, while cheap dull names with stable ownership transfer reprice slowly as fundamental buyers absorb supply.", "forced_counterparty": "Retail speculators and benchmarked mutual funds avoiding low-glamour low-PS names until price confirms.", "data_requirements": "[\"turnover_rate\",\"ps_ttm\"]", "failure_mode": "Fails in speculative momentum regimes when high-valuation glamour leads, or when low PS is mainly distress/policy risk rather than neglect.", "report_contract": "fresh_buy_gate", "money_readiness": "money_candidate", "decision": "revert", "session_branch": "main", "base_ref": "origin/main", "merge_base": "62e27b1718a9c8c7cee619126770fe57cd98d173", "head_commit": "62e27b1718a9c8c7cee619126770fe57cd98d173"}
