{"ts": "2026-05-28T14:56:22.652239+08:00", "session_id": "20260528_140003_a6f06a", "market": "cn", "formula": "rank(-ps_ttm) * rank(ts_min(amount / circ_market_cap, 20))", "name": "low_ps_float_sponsorship_floor_20", "is_ic": 0.0474, "is_ic_ir": 0.186, "is_sharpe": 1.401, "is_turnover": 0.028, "is_monotonicity": 0.0, "gates": "FAIL", "status": "reverted", "eval_seconds": 82.0, "sleeve_id": "cn_aiinfra_value_accumulation", "mispricing_source": "Valuation neglect plus persistent float absorption inside the AI-infra universe; the market is slow to reprice quiet supply-chain names until evidence broadens beyond specialist holders.", "forced_counterparty": "Retail momentum traders and benchmark-aware managers who rotate toward louder theme leaders and are unwilling to warehouse quiet low-PS suppliers through a 10-20 day holding window.", "data_requirements": "[\"daily amount\",\"circ_market_cap\",\"ps_ttm\",\"validated ai_infra CN universe membership\",\"portfolio beta-hedge and residual risk attribution\",\"original-source evidence before any specific supplier/customer claim is promoted\"]", "failure_mode": "Fails when the market rewards speculative high-PS concept beta over steady accumulation, or when persistent trading floor reflects trapped liquidity/distribution instead of sponsorship.", "report_contract": "fresh_buy_gate", "ai_supercycle_layer": "ai_chip_equipment_materials_packaging", "supply_chain_hypothesis": "Domestic AI capex bottleneck suppliers can show persistent float absorption before order visibility and valuation rerating are broadly recognized.", "relationship_evidence_required": "true", "money_readiness": "money_candidate", "decision": "revert", "session_branch": "main", "base_ref": "origin/main", "merge_base": "e23d553d30623951cda2e54c387d49e2cd55c5a2", "head_commit": "e23d553d30623951cda2e54c387d49e2cd55c5a2"}
{"ts": "2026-05-29T08:08:43.492922+08:00", "session_id": "20260529_071202_4a3250", "market": "cn", "formula": "rank(-ts_std(turnover_rate,20)/(ts_mean(turnover_rate,20)+0.001))*rank(-ts_corr(ret_1d,shift(ret_1d,1),40))", "name": "anti_autocorr_turnover_stability_20_40", "is_ic": -0.007, "is_ic_ir": -0.003, "is_sharpe": -0.835, "is_turnover": 0.146, "is_monotonicity": 0.1, "gates": "FAIL", "status": "reverted", "eval_seconds": 70.5, "sleeve_id": "cn_ai_infra_absorption", "mispricing_source": "Float-supply absorption is slow, but the marginal counterparty prices the names off noisy daily swings instead of shareholder-base stability; the factor monetizes that mismatch rather than raw momentum.", "forced_counterparty": "Retail theme chasers and benchmark-aware managers recycling AI exposure around short-term volatility", "data_requirements": "Current CN daily price/volume/daily_basic data is sufficient for IS testing; for promotion require beta-hedged sleeve attribution, turnover cost attribution, and correlation vs existing promoted sleeves", "failure_mode": "It should weaken in one-way speculative melt-ups or forced deleveraging regimes where stable turnover no longer means accumulation and return autocorrelation flips sign", "report_contract": "research_only", "ai_supercycle_layer": "ai_chip_equipment_materials_packaging", "supply_chain_hypothesis": "Domestic AI bottleneck suppliers in equipment/materials/advanced packaging should show this steady-absorption tape before earnings/news fully confirm capex pull-forward", "relationship_evidence_required": "true", "money_readiness": "research_only", "decision": "revert", "session_branch": "main", "base_ref": "origin/main", "merge_base": "c94ca064b4ac72dfdf1f906eaaf12dbbc0a6779a", "head_commit": "c94ca064b4ac72dfdf1f906eaaf12dbbc0a6779a"}
{"ts": "2026-05-29T08:08:43.492922+08:00", "session_id": "20260529_071202_4a3250", "market": "cn", "formula": "rank((ts_mean(amount/circ_market_cap,20)/ts_std(amount/circ_market_cap,20))/(abs(pb)+0.1))", "name": "pb_float_flow_stability_20", "is_ic": 0.0083, "is_ic_ir": 0.041, "is_sharpe": -2.659, "is_turnover": 0.074, "is_monotonicity": -0.15, "gates": "FAIL", "status": "reverted", "eval_seconds": 270.8, "sleeve_id": "cn_hard_asset_accumulation", "mispricing_source": "Slow AI-capex underreaction in balance-sheet-heavy enablers; stable float-adjusted flow reveals accumulation before reported backlog, margin, or order evidence is fully priced.", "forced_counterparty": "growth-style benchmark funds and retail momentum traders", "data_requirements": "[\"amount\",\"circ_market_cap\",\"pb\" daily history for IS test, \"ai_infra evidence card/source-review status\" for universe eligibility, \"backlog/capex/gross_margin/FCF\" before promotion to money-ready]", "failure_mode": "Fails in narrative melt-up regimes where expensive beta leads regardless of valuation, or when AI capex slows and low-PB hard-asset names become value traps.", "report_contract": "fresh_buy_gate", "ai_supercycle_layer": "hard_assets_energy_heavy", "supply_chain_hypothesis": "Verified AI datacenter power/grid/cooling and other heavy-asset enablers in the CN AI universe should show stable float-normalized flow before formal backlog recognition.", "relationship_evidence_required": "true", "money_readiness": "money_candidate", "decision": "revert", "session_branch": "main", "base_ref": "origin/main", "merge_base": "c94ca064b4ac72dfdf1f906eaaf12dbbc0a6779a", "head_commit": "c94ca064b4ac72dfdf1f906eaaf12dbbc0a6779a"}
{"ts": "2026-05-29T08:08:43.492922+08:00", "session_id": "20260529_071202_4a3250", "market": "cn", "formula": "rank(ts_mean(amount,20)/(ts_std(amount,20)+1))*rank(-ts_std(turnover_rate,20))", "name": "stable_amount_quiet_turnover_20", "is_ic": -0.053, "is_ic_ir": -0.182, "is_sharpe": -4.229, "is_turnover": 0.106, "is_monotonicity": -0.9, "gates": "FAIL", "status": "reverted", "eval_seconds": 68.5, "sleeve_id": "cn_ai_infra_flow_accumulation", "mispricing_source": "A-share AI themes are dominated by short-horizon retail rotation and delayed institutional build-ups; stable value traded with subdued turnover volatility reflects absorption before benchmarked capital and momentum chasers reprice the stock.", "forced_counterparty": "retail theme traders and benchmark-constrained mutual funds that wait for visible trend confirmation", "data_requirements": "[\"daily amount\",\"daily turnover_rate\",\"AI-infra universe tags\",\"benchmark hedge attribution vs 000300.SH and 399006.SZ\",\"correlation to promoted sleeves\"]", "failure_mode": "It stops working when the market shifts to indiscriminate high-beta chasing or liquidity stress, because quiet turnover then signals lack of interest rather than accumulation.", "report_contract": "setup_overlay", "ai_supercycle_layer": "ai_chip_equipment_materials_packaging", "supply_chain_hypothesis": "Domestic AI accelerator, advanced packaging, and semiconductor equipment beneficiaries are accumulated on pullbacks before source-verified order or capex evidence becomes broadly visible.", "relationship_evidence_required": "true", "money_readiness": "research_only", "decision": "revert", "session_branch": "main", "base_ref": "origin/main", "merge_base": "c94ca064b4ac72dfdf1f906eaaf12dbbc0a6779a", "head_commit": "c94ca064b4ac72dfdf1f906eaaf12dbbc0a6779a"}
{"ts": "2026-05-29T08:08:43.492922+08:00", "session_id": "20260529_071202_4a3250", "market": "cn", "formula": "rank(ts_mean(turnover_rate,20)/(ts_std(turnover_rate,20)+0.01))", "name": "turnover_stability_20", "is_ic": -0.0357, "is_ic_ir": -0.134, "is_sharpe": -3.408, "is_turnover": 0.133, "is_monotonicity": -0.3, "gates": "FAIL", "status": "reverted", "eval_seconds": 216.4, "sleeve_id": "cn_ai_infra_flow_accumulation", "mispricing_source": "Order visibility and capacity tightening are recognized with a lag in A-shares; stable float turnover reveals informed accumulation earlier than price-only factors and is structurally different from the current close/return correlation sleeves.", "forced_counterparty": "Retail swing traders and benchmark-constrained generalists who sell into orderly demand or fail to warehouse inventory through a slow accumulation phase.", "data_requirements": "[\"daily turnover_rate panel (available)\", \"20d hold backtest\", \"factor correlation vs promoted sleeves\", \"beta-hedged sleeve return attribution\", \"residual risk and drawdown attribution by AI layer\"]", "failure_mode": "It should decay when the theme becomes purely retail-chasing or macro/policy shocks force indiscriminate turnover, breaking the link between smooth flow and informed sponsorship.", "report_contract": "setup_overlay", "ai_supercycle_layer": "ai_chip_equipment_materials_packaging", "supply_chain_hypothesis": "In AI chip equipment/materials/packaging bottlenecks, names with real order-backed sponsorship should show steadier float turnover than concept-chasing peers before backlog confirmation is fully visible in reported fundamentals.", "relationship_evidence_required": "true", "money_readiness": "research_only", "decision": "revert", "session_branch": "main", "base_ref": "origin/main", "merge_base": "c94ca064b4ac72dfdf1f906eaaf12dbbc0a6779a", "head_commit": "c94ca064b4ac72dfdf1f906eaaf12dbbc0a6779a"}
{"ts": "2026-05-29T08:08:43.492922+08:00", "session_id": "20260529_071202_4a3250", "market": "cn", "formula": "rank(ts_mean(amount,20)/ts_std(amount,20))*rank(-pb)", "name": "stable_amount_low_pb_20", "is_ic": 0.0106, "is_ic_ir": 0.085, "is_sharpe": -1.978, "is_turnover": 0.105, "is_monotonicity": -0.2, "gates": "FAIL", "status": "reverted", "eval_seconds": 75.5, "sleeve_id": "cn_ai_infra_accumulation", "mispricing_source": "Slow institutional accumulation in under-owned AI-infra value names before fundamental confirmation", "forced_counterparty": "Theme-chasing retail traders and benchmarked managers avoiding lower-multiple hardware names until momentum confirms", "data_requirements": "[\"daily amount and pb data for score construction\",\"beta-hedged sleeve attribution vs 000300.SH and 399006.SZ\",\"sleeve correlation matrix\",\"source-reviewed evidence cards before treating any supplier bottleneck as validated\"]", "failure_mode": "Fails when AI leadership turns into pure speculative momentum, low-PB names remain value traps, or stable amount is just illiquidity rather than accumulation", "report_contract": "setup_overlay", "ai_supercycle_layer": "ai_chip_equipment_materials_packaging", "supply_chain_hypothesis": "Domestic chip equipment, materials, and advanced packaging names can show quiet accumulation ahead of visible AI capex bottleneck repricing", "relationship_evidence_required": "true", "money_readiness": "research_only", "decision": "revert", "session_branch": "main", "base_ref": "origin/main", "merge_base": "c94ca064b4ac72dfdf1f906eaaf12dbbc0a6779a", "head_commit": "c94ca064b4ac72dfdf1f906eaaf12dbbc0a6779a"}
{"ts": "2026-05-29T08:08:43.492922+08:00", "session_id": "20260529_071202_4a3250", "market": "cn", "formula": "rank(ts_mean(amount,20)/circ_market_cap) * rank(ts_mean(amount,20)/ts_std(amount,20))", "name": "float_scaled_amount_stability_20", "is_ic": 0.0176, "is_ic_ir": 0.121, "is_sharpe": 1.067, "is_turnover": 0.112, "is_monotonicity": 0.0, "gates": "FAIL", "status": "reverted", "eval_seconds": 91.0, "sleeve_id": "cn_ai_flow_leadership", "mispricing_source": "This measures persistent cash-through-float sponsorship rather than raw momentum or simple price/volume correlation, so it can surface institutional accumulation before the tape fully trends; the market underreacts because retail flow is short-horizon and benchmark-aware managers cannot instantly chase crowded AI leaders.", "forced_counterparty": "Retail theme rotators and benchmark-constrained long-only funds that are slow to reweight into limited-float AI leaders.", "data_requirements": "[\"daily amount\",\"circ_market_cap\",\"beta-hedged sleeve attribution vs 000300.SH and 399006.SZ\",\"rolling 60d correlation to promoted factors\",\"residual risk and drawdown attribution before promotion\"]", "failure_mode": "It stops working when AI participation broadens into indiscriminate small-cap speculation, or when policy/liquidity shocks dominate stock selection so stable cash sponsorship no longer distinguishes real bottlenecks from followers.", "report_contract": "fresh_buy_gate", "ai_supercycle_layer": "ai_datacenter_edge_infra", "supply_chain_hypothesis": "Persistent float-scaled cash absorption should first surface CN datacenter, networking, cooling, and power-infra bottleneck names that are indirectly leveraged to AI capex buildout, before slower evidence propagation reaches lagging peers.", "relationship_evidence_required": "true", "money_readiness": "money_candidate", "decision": "revert", "session_branch": "main", "base_ref": "origin/main", "merge_base": "c94ca064b4ac72dfdf1f906eaaf12dbbc0a6779a", "head_commit": "c94ca064b4ac72dfdf1f906eaaf12dbbc0a6779a"}
{"ts": "2026-05-29T08:08:43.492922+08:00", "session_id": "20260529_071202_4a3250", "market": "cn", "formula": "rank(ts_min(amount/circ_market_cap,20)/ts_mean(amount/circ_market_cap,20))*rank(-ts_mean(high/low-1,10))", "name": "float_floor_quiet_range_20", "is_ic": -0.0473, "is_ic_ir": -0.145, "is_sharpe": -4.085, "is_turnover": 0.153, "is_monotonicity": -0.2, "gates": "FAIL", "status": "reverted", "eval_seconds": 203.8, "sleeve_id": "cn_ai_absorption_overlay", "mispricing_source": "The market overreacts to visible spikes and underreacts to steady float absorption on calm tape, so AI-infra leaders can stay mispriced until a catalyst makes sponsorship obvious.", "forced_counterparty": "Retail momentum traders, short-horizon margin accounts, and benchmarked thematic funds trimming names that look inactive", "data_requirements": "[\"current daily fields are sufficient for IS test\",\"before promotion: correlation vs turnover_stability_20 and d2_20_514\",\"beta-hedged attribution vs 000300.SH and 399006.SZ\",\"capacity/turnover impact check using amount\"]", "failure_mode": "It fails when quiet tape reflects real demand exhaustion instead of absorption, or when AI-theme flows become broad beta and floor-flow no longer separates bottleneck leaders from the rest of the universe.", "report_contract": "setup_overlay", "ai_supercycle_layer": "ai_chip_equipment_materials_packaging", "supply_chain_hypothesis": "Within the validated AI universe, domestic equipment/materials/packaging bottleneck names should show steady float absorption and quiet range compression before order, capex, or customer evidence is fully reflected in price.", "relationship_evidence_required": "true", "money_readiness": "research_only", "decision": "revert", "session_branch": "main", "base_ref": "origin/main", "merge_base": "c94ca064b4ac72dfdf1f906eaaf12dbbc0a6779a", "head_commit": "c94ca064b4ac72dfdf1f906eaaf12dbbc0a6779a"}
{"ts": "2026-05-29T08:08:43.492922+08:00", "session_id": "20260529_071202_4a3250", "market": "cn", "formula": "rank(ret_20d-ret_5d)*rank(-ts_std(amount/circ_market_cap,20))", "name": "float_amount_pullback_20", "is_ic": -0.0317, "is_ic_ir": -0.12, "is_sharpe": -2.894, "is_turnover": 0.191, "is_monotonicity": -0.4, "gates": "FAIL", "status": "reverted", "eval_seconds": 116.4, "sleeve_id": "cn_ai_accumulation_pullback", "mispricing_source": "Short-horizon traders sell recent pullbacks, while benchmark-aware institutions accumulate AI bottleneck names gradually; stable float-scaled amount distinguishes sponsored consolidations from collapsing momentum and keeps this from being just another price-only reversal factor.", "forced_counterparty": "retail momentum traders, hot-money theme chasers, and short-horizon de-riskers", "data_requirements": "[daily close/ret_5d/ret_20d/amount/circ_market_cap already available; promotion requires beta-hedged sleeve attribution, correlation-to-existing-sleeves matrix, and realized turnover-cost ledger]", "failure_mode": "It breaks when the market shifts to indiscriminate mean reversion or liquidity stress, so stable amount reflects crowding/illiquidity instead of sponsorship and the 20-day trend no longer persists.", "report_contract": "setup_overlay", "ai_supercycle_layer": "ai_chip_equipment_materials_packaging", "supply_chain_hypothesis": "Domestic AI equipment/materials/packaging bottleneck names should show orderly pullbacks with steady float-adjusted value traded as funds pre-position for capex and import-substitution demand before filings fully confirm it.", "relationship_evidence_required": "true", "money_readiness": "research_only", "decision": "revert", "session_branch": "main", "base_ref": "origin/main", "merge_base": "c94ca064b4ac72dfdf1f906eaaf12dbbc0a6779a", "head_commit": "c94ca064b4ac72dfdf1f906eaaf12dbbc0a6779a"}
{"ts": "2026-05-29T08:08:43.492922+08:00", "session_id": "20260529_071202_4a3250", "market": "cn", "formula": "rank(ts_mean(turnover_rate,20)/ts_max(turnover_rate,20))*rank(-ret_5d)", "name": "turnover_spike_pullback_5", "is_ic": -0.0263, "is_ic_ir": -0.1, "is_sharpe": -3.647, "is_turnover": 0.264, "is_monotonicity": -0.2, "gates": "FAIL", "status": "reverted", "eval_seconds": 174.6, "sleeve_id": "cn_ai_flow_pullback", "mispricing_source": "A-share theme rotation overreacts to short-term drawdowns, but institutions accumulating scarce AI-infra exposure cannot fully step away; the market underprices pullbacks where participation stays broad instead of collapsing after a single hot day.", "forced_counterparty": "short-horizon theme traders and momentum chasers constrained by T+1, risk limits, and rapid rotation", "data_requirements": "[\"daily OHLCV\",\"turnover_rate\",\"ai_infra universe metadata for scope/filtering\",\"CN benchmark series for beta-hedged residual attribution\"]", "failure_mode": "Fails when the market rewards one-day speculative spikes over orderly sponsorship, or when AI theme breadth collapses and distributed turnover no longer signals accumulation.", "report_contract": "setup_overlay", "ai_supercycle_layer": "ai_datacenter_edge_infra", "supply_chain_hypothesis": "Datacenter, interconnect, and adjacent buildout bottleneck names should show this pattern when downstream AI capex remains active and specialist capital keeps absorbing supply through pullbacks.", "relationship_evidence_required": "true", "money_readiness": "research_only", "decision": "revert", "session_branch": "main", "base_ref": "origin/main", "merge_base": "c94ca064b4ac72dfdf1f906eaaf12dbbc0a6779a", "head_commit": "c94ca064b4ac72dfdf1f906eaaf12dbbc0a6779a"}
{"ts": "2026-05-29T08:08:43.492922+08:00", "session_id": "20260529_071202_4a3250", "market": "cn", "formula": "rank(ts_mean(turnover_rate,20)-ts_std(turnover_rate,20))*rank(ret_20d-ret_5d)", "name": "orderly_turnover_trend_digestion_20", "is_ic": -0.0059, "is_ic_ir": -0.06, "is_sharpe": 0.026, "is_turnover": 0.162, "is_monotonicity": -0.05, "gates": "FAIL", "status": "reverted", "eval_seconds": 129.6, "sleeve_id": "cn_ai_flow_pullback", "mispricing_source": "Underreaction to steady institutional accumulation; T+1 retail pullback selling and benchmarked funds trimming recent winners create temporary inventory without breaking the medium-term thesis.", "forced_counterparty": "Retail swing traders and mandate-driven funds de-risking after short-term softness", "data_requirements": "[\"daily OHLCV\",\"daily_basic turnover_rate\",\"for promotion: ai_infra source-review status by ticker, rolling beta-hedge attribution vs 000300.SH/399006.SZ, sleeve correlation matrix\"]", "failure_mode": "Fails in liquidity-chasing limit-up regimes or broad mean-reversion bear tape, where stable turnover no longer signals accumulation and 5-day pullbacks are distribution.", "report_contract": "setup_overlay", "ai_supercycle_layer": "ai_chip_equipment_materials_packaging", "supply_chain_hypothesis": "Candidate D1-D3 domestic chip-equipment, materials, and advanced-packaging bottleneck names should exhibit orderly multi-week accumulation before backlog and capex evidence fully reaches prices.", "relationship_evidence_required": "true", "money_readiness": "research_only", "decision": "revert", "session_branch": "main", "base_ref": "origin/main", "merge_base": "c94ca064b4ac72dfdf1f906eaaf12dbbc0a6779a", "head_commit": "c94ca064b4ac72dfdf1f906eaaf12dbbc0a6779a"}
