{"ts": "2026-05-28T07:22:55.044373+08:00", "session_id": "20260528_062703_a5bf9c", "market": "cn", "formula": "rank(-ts_corr(ret_1d,shift(ret_1d,1),20))*rank(ts_min(turnover_rate,20)/ts_max(turnover_rate,20))", "name": "anti_autocorr_turnover_corridor_20", "is_ic": -0.0392, "is_ic_ir": -0.135, "is_sharpe": -2.508, "is_turnover": 0.194, "is_monotonicity": -0.4, "gates": "FAIL", "status": "reverted", "eval_seconds": 182.7, "sleeve_id": "cn_ai_tape_absorption", "mispricing_source": "T+1 retail de-risking and theme-rotation selling overreact to weak tape, while stable turnover suggests no true informed distribution from long-horizon holders.", "forced_counterparty": "short-horizon retail traders, theme-rotation funds, and mechanical rebalance flows", "data_requirements": "[\"daily OHLCV\",\"turnover_rate\",\"ai_infra universe/source-review status\",\"benchmark beta and residual attribution vs 000300.SH and 399006.SZ\"]", "failure_mode": "Fails in momentum melt-ups or policy squeezes where trend persistence dominates mean reversion, and in dead-liquidity names where a tight turnover corridor is just inactivity.", "report_contract": "setup_overlay", "ai_supercycle_layer": "ai_chip_equipment_materials_packaging", "supply_chain_hypothesis": "Tape should surface domestic semiconductor equipment/material bottleneck names being absorbed on shakeouts ahead of source-verified capex or order confirmation.", "relationship_evidence_required": "true", "money_readiness": "research_only", "decision": "revert", "session_branch": "main", "base_ref": "origin/main", "merge_base": "83848153d53e89b19c687fcb9440d135d63e22a2", "head_commit": "83848153d53e89b19c687fcb9440d135d63e22a2"}
{"ts": "2026-05-28T07:22:55.044373+08:00", "session_id": "20260528_062703_a5bf9c", "market": "cn", "formula": "rank(-ret_5d) * rank(-ts_max(turnover_rate,20)/ts_mean(turnover_rate,20))", "name": "uncrowded_turnover_pullback_20", "is_ic": -0.0263, "is_ic_ir": -0.1, "is_sharpe": -3.647, "is_turnover": 0.264, "is_monotonicity": -0.2, "gates": "FAIL", "status": "reverted", "eval_seconds": 155.1, "sleeve_id": "cn_ai_infra_pullback_absorption", "mispricing_source": "Short-horizon theme traders de-risk after a down week, but names without a recent turnover spike are less likely to be in true distribution; the market overprices crowding risk and underprices steady demand.", "forced_counterparty": "T+1 retail and fast-money thematic accounts unwinding after short-term weakness", "data_requirements": "[\"close\",\"turnover_rate\"]; before promotion also require beta-hedged sleeve attribution vs 000300.SH/399006.SZ and correlation check versus promoted sleeves", "failure_mode": "Fails in broad liquidity shocks or policy panics when even orderly names become real distribution, and in melt-up regimes where crowded spike leaders keep extending instead of mean-reverting.", "report_contract": "setup_overlay", "ai_supercycle_layer": "none", "supply_chain_hypothesis": "Cross-layer AI bottleneck names often digest gains with orderly float turnover before leadership resumes; this factor is meant to surface that tape pattern without hard-coding any supplier/customer claim.", "relationship_evidence_required": "false", "money_readiness": "research_only", "decision": "revert", "session_branch": "main", "base_ref": "origin/main", "merge_base": "83848153d53e89b19c687fcb9440d135d63e22a2", "head_commit": "83848153d53e89b19c687fcb9440d135d63e22a2"}
{"ts": "2026-05-28T07:22:55.044373+08:00", "session_id": "20260528_062703_a5bf9c", "market": "cn", "formula": "rank(ret_20d-ret_5d) * rank(ts_mean(amount/circ_market_cap,20)/ts_std(amount/circ_market_cap,20))", "name": "float_amount_leader_reset", "is_ic": -0.0533, "is_ic_ir": -0.19, "is_sharpe": -2.352, "is_turnover": 0.206, "is_monotonicity": -0.2, "gates": "FAIL", "status": "reverted", "eval_seconds": 121.8, "sleeve_id": "cn_ai_leadership_pullback", "mispricing_source": "Short-horizon traders sell weekly weakness, while the market underreacts when stable float-normalized成交额 says stronger hands are still accumulating AI bottleneck names.", "forced_counterparty": "Retail momentum traders, benchmark-constrained mutual funds trimming thematic volatility, and short-horizon mean-reversion books", "data_requirements": "[\"daily amount\",\"circ_market_cap\",\"ret_5d\",\"ret_20d\",\"ai_infra universe layer/status tags\",\"beta-hedged sleeve return and residual risk attribution\"]; if used to argue supplier/order linkage, add filings, official PRs, transcripts, and verified news", "failure_mode": "Fails in broad mean-reverting tape, policy/liquidity shocks that hit the whole AI theme, or when stable amount reflects distribution/locked-float effects instead of real accumulation", "report_contract": "setup_overlay", "ai_supercycle_layer": "ai_networking_optical_cpo", "supply_chain_hypothesis": "Bandwidth and optical interconnect bottleneck beneficiaries should show medium-term leadership with orderly float-scaled money flow before verified cloud capex and order evidence is fully priced", "relationship_evidence_required": "true", "money_readiness": "research_only", "decision": "revert", "session_branch": "main", "base_ref": "origin/main", "merge_base": "83848153d53e89b19c687fcb9440d135d63e22a2", "head_commit": "83848153d53e89b19c687fcb9440d135d63e22a2"}
{"ts": "2026-05-28T07:22:55.044373+08:00", "session_id": "20260528_062703_a5bf9c", "market": "cn", "formula": "rank(ret_20d - ret_5d) * rank(-ts_std(log(amount),20))", "name": "quiet_amount_reset_20", "is_ic": -0.0004, "is_ic_ir": -0.001, "is_sharpe": -2.187, "is_turnover": 0.202, "is_monotonicity": -0.25, "gates": "FAIL", "status": "reverted", "eval_seconds": 118.4, "sleeve_id": "cn_ai_infra_leadership_reset", "mispricing_source": "The market overreacts to short pullbacks in crowded AI narratives but underreacts to stable trading-value persistence, which is a slower-moving signal of sponsorship and float absorption.", "forced_counterparty": "Short-horizon retail momentum traders and fast thematic money that de-risk on the first pullback after a run", "data_requirements": "[\"daily CN price/amount history\", \"ai_infra universe BFS/module/current-pool tags\", \"correlation to promoted sleeves\", \"beta-hedged attribution vs 000300.SH and 399006.SZ\", \"original-source evidence before any supplier/customer narrative\"]", "failure_mode": "It should fail in pure beta melt-up or panic-liquidity regimes where stable amount just proxies large-cap defensiveness and short pullbacks stop mean-reverting into continuation.", "report_contract": "setup_overlay", "ai_supercycle_layer": "ai_chip_equipment_materials_packaging", "supply_chain_hypothesis": "Inside the validated AI-infra universe, orderly pullback leaders may surface bottleneck equipment/materials/packaging names being accumulated before capex or order confirmation is fully reflected in price.", "relationship_evidence_required": "true", "money_readiness": "research_only", "decision": "revert", "session_branch": "main", "base_ref": "origin/main", "merge_base": "83848153d53e89b19c687fcb9440d135d63e22a2", "head_commit": "83848153d53e89b19c687fcb9440d135d63e22a2"}
{"ts": "2026-05-28T07:22:55.044373+08:00", "session_id": "20260528_062703_a5bf9c", "market": "cn", "formula": "rank(pct_change(close, 60) - pct_change(close, 10)) * rank(-ts_mean(volume_ratio, 5))", "name": "leader_reset_light_relvol", "is_ic": -0.0178, "is_ic_ir": -0.097, "is_sharpe": -2.705, "is_turnover": 0.172, "is_monotonicity": -0.65, "gates": "FAIL", "status": "reverted", "eval_seconds": 152.1, "sleeve_id": "ai_cn_leader_reset", "mispricing_source": "The market overreacts to short-term de-risking in AI-theme leaders and underprices how quickly institutional buyers re-absorb supply when weekly relative volume stays muted; this is a leader-reset signal, not a naked reversal clone.", "forced_counterparty": "Retail momentum traders, short-horizon theme funds, and benchmark-constrained managers trimming recent winners", "data_requirements": "[\"close\", \"volume_ratio\", \"benchmark-hedged sleeve return\", \"residual risk attribution\", \"correlation vs promoted factors\", \"source-reviewed AI-universe membership tags\"]", "failure_mode": "Fails when light relative volume reflects demand exhaustion instead of orderly absorption, or when the underlying AI capex/order narrative genuinely breaks and leadership rotates away from the bottleneck cohort.", "report_contract": "setup_overlay", "ai_supercycle_layer": "ai_chip_equipment_materials_packaging", "supply_chain_hypothesis": "If the signal clusters in domestic chip-equipment/materials/packaging names, it may be surfacing bottleneck suppliers whose order-cycle expectations remain intact despite short-term tape resets.", "relationship_evidence_required": "true", "money_readiness": "research_only", "decision": "revert", "session_branch": "main", "base_ref": "origin/main", "merge_base": "83848153d53e89b19c687fcb9440d135d63e22a2", "head_commit": "83848153d53e89b19c687fcb9440d135d63e22a2"}
{"ts": "2026-05-28T07:22:55.044373+08:00", "session_id": "20260528_062703_a5bf9c", "market": "cn", "formula": "rank(-ts_corr(ret_1d, shift(ret_1d, 1), 20)) * rank(ts_mean(turnover_rate, 5) / (ts_std(turnover_rate, 20) + 0.01))", "name": "anti_autocorr_turnover_flow_20", "is_ic": -0.0144, "is_ic_ir": -0.047, "is_sharpe": -1.446, "is_turnover": 0.203, "is_monotonicity": -0.3, "gates": "FAIL", "status": "reverted", "eval_seconds": 166.8, "sleeve_id": "cn_ai_tape_absorption", "mispricing_source": "T+1 frictions, retail theme chasing, and benchmarked sector rotation create temporary supply on weak days; steady turnover lets informed buyers accumulate before the tape fully reflects AI leadership.", "forced_counterparty": "short-horizon retail traders and benchmark-constrained sector rotators", "data_requirements": "[\"daily ret_1d\", \"daily turnover_rate\", \"AI-infra universe membership\", \"benchmark beta/residual attribution vs 000300.SH and 399006.SZ\"]", "failure_mode": "It should fail in broad speculative breakout regimes where noisy high-turnover momentum dominates, or if smooth turnover is just selecting stale low-information names.", "report_contract": "setup_overlay", "ai_supercycle_layer": "none", "supply_chain_hypothesis": "Cross-layer AI-infra bottleneck candidates should show steady weekly float transfer and anti-autocorrelated tape before obvious leadership; exact upstream/downstream links must come from source review.", "relationship_evidence_required": "true", "money_readiness": "research_only", "decision": "revert", "session_branch": "main", "base_ref": "origin/main", "merge_base": "83848153d53e89b19c687fcb9440d135d63e22a2", "head_commit": "83848153d53e89b19c687fcb9440d135d63e22a2"}
{"ts": "2026-05-28T07:22:55.044373+08:00", "session_id": "20260528_062703_a5bf9c", "market": "cn", "formula": "rank(-ts_corr(ret_1d, shift(ret_1d, 1), 20)) * rank(ts_min(volume_ratio,20)/ts_mean(volume_ratio,20))", "name": "anti_autocorr_relvol_floor_20", "is_ic": 0.0189, "is_ic_ir": 0.11, "is_sharpe": -1.736, "is_turnover": 0.182, "is_monotonicity": 0.25, "gates": "FAIL", "status": "reverted", "eval_seconds": 247.6, "sleeve_id": "daily_price_overlay", "mispricing_source": "Retail narrative traders and short-horizon fast money overreact around daily swings, while institutions accumulating AI-infra exposure keep relative participation from breaking down; the market underprices that quiet absorption because it lacks a single blowout-volume signal.", "forced_counterparty": "T+1 retail momentum traders and benchmark-aware fast money reducing risk into pullbacks", "data_requirements": "[\"daily OHLCV\", \"volume_ratio\", \"ai_infra universe membership/status\", \"benchmark beta hedge return and residual-risk attribution before promotion\"]", "failure_mode": "Fails in one-way mania or liquidation regimes where anti-autocorr disappears, or when a high volume-ratio floor is just crowded thematic churn rather than sponsorship.", "report_contract": "setup_overlay", "ai_supercycle_layer": "none", "supply_chain_hypothesis": "Cross-layer AI-infra bottleneck candidates may show this pattern when the market is quietly accumulating exposure ahead of source-verified capex, order, or capacity evidence.", "relationship_evidence_required": "true", "money_readiness": "research_only", "decision": "revert", "session_branch": "main", "base_ref": "origin/main", "merge_base": "83848153d53e89b19c687fcb9440d135d63e22a2", "head_commit": "83848153d53e89b19c687fcb9440d135d63e22a2"}
{"ts": "2026-05-28T07:22:55.044373+08:00", "session_id": "20260528_062703_a5bf9c", "market": "cn", "formula": "rank(-ts_corr(ret_1d,shift(ret_1d,1),20))*rank(ts_min(amount/circ_market_cap,20)/ts_max(amount/circ_market_cap,20))", "name": "anti_autocorr_float_corridor_20", "is_ic": -0.0354, "is_ic_ir": -0.122, "is_sharpe": -2.084, "is_turnover": 0.193, "is_monotonicity": -0.4, "gates": "FAIL", "status": "reverted", "eval_seconds": 175.8, "sleeve_id": "cn_ai_accumulation_overlay", "mispricing_source": "The market overreacts to short-term theme swings but underprices steady absorption by constrained institutions building AI-infra positions before fundamentals and source-reviewed evidence fully propagate.", "forced_counterparty": "Retail theme chasers and short-horizon liquidity providers forced to trade headlines, volatility, and T+1 inventory constraints", "data_requirements": "[\"daily ret_1d, amount, circ_market_cap\", \"benchmark hedge attribution vs 000300.SH and 399006.SZ\", \"existing sleeve correlation and residual risk ledger\"]", "failure_mode": "It stops working in one-way policy/momentum melt-ups where reversals disappear, or in broad deleveraging when a tight flow corridor reflects illiquidity instead of accumulation.", "report_contract": "setup_overlay", "ai_supercycle_layer": "ai_chip_equipment_materials_packaging", "supply_chain_hypothesis": "Domestic AI-capex bottleneck suppliers in semicap equipment/materials/packaging should exhibit steadier float-normalized absorption than downstream narrative names before order and capex evidence is fully visible.", "relationship_evidence_required": "true", "money_readiness": "research_only", "decision": "revert", "session_branch": "main", "base_ref": "origin/main", "merge_base": "83848153d53e89b19c687fcb9440d135d63e22a2", "head_commit": "83848153d53e89b19c687fcb9440d135d63e22a2"}
{"ts": "2026-05-28T07:22:55.044373+08:00", "session_id": "20260528_062703_a5bf9c", "market": "cn", "formula": "rank(ts_min(volume_ratio,20)/ts_mean(volume_ratio,20))*rank(ret_5d-ret_20d)", "name": "relvol_floor_rebound_gap", "is_ic": 0.0436, "is_ic_ir": 0.232, "is_sharpe": 0.017, "is_turnover": 0.185, "is_monotonicity": 0.0, "gates": "PASS", "status": "kept", "eval_seconds": 195.1, "sleeve_id": "cn_ai_infra_flow_reentry", "mispricing_source": "A-share retail and benchmark-constrained sellers overreact to the prior drawdown, while slower allocators re-enter bottleneck AI names before narrative/news confirmation; the relative-volume floor filters for sponsorship instead of dead-cat bounces.", "forced_counterparty": "short-horizon retail/theme chasers, redemption/rebalance-driven sellers, and benchmark-constrained long-only funds", "data_requirements": "[\"daily close\",\"volume_ratio\",\"ret_5d\",\"ret_20d\",\"source-reviewed CN ai_infra universe membership\"]; before promotion require beta-hedged sleeve return vs 000300.SH and 399006.SZ, residual-risk attribution, rolling corr vs promoted sleeves, and source evidence before any supplier/customer claim", "failure_mode": "It fails when rebound attempts are rumor-driven beta squeezes with no real sponsorship, or when broad liquidity/policy stress makes a stable relative-volume floor reflect trapped liquidity rather than accumulation.", "report_contract": "setup_overlay", "ai_supercycle_layer": "ai_chip_equipment_materials_packaging", "supply_chain_hypothesis": "Within source-reviewed CN AI bottleneck names, domestic semiconductor equipment/materials/advanced-packaging suppliers should show a non-collapsing relative-volume floor as the 5-day tape turns up from a 20-day drawdown before backlog/order evidence is fully recognized.", "relationship_evidence_required": "true", "money_readiness": "research_only", "decision": "keep", "session_branch": "main", "base_ref": "origin/main", "merge_base": "83848153d53e89b19c687fcb9440d135d63e22a2", "head_commit": "83848153d53e89b19c687fcb9440d135d63e22a2", "oos": "PASS", "checks_status": "passed"}
{"ts": "2026-05-28T07:22:55.044373+08:00", "session_id": "20260528_062703_a5bf9c", "market": "cn", "formula": "rank(-ts_corr(turnover_rate,abs(ret_5d),20))*rank(-ret_5d)", "name": "turnover_absorption_pullback_20", "is_ic": -0.0152, "is_ic_ir": -0.056, "is_sharpe": -4.01, "is_turnover": 0.292, "is_monotonicity": -0.55, "gates": "FAIL", "status": "reverted", "eval_seconds": 159.4, "sleeve_id": "daily_flow_absorption", "mispricing_source": "The market overreacts to visible pullbacks and underprices steady net accumulation when turnover stays high but marginal price impact collapses.", "forced_counterparty": "retail de-riskers and benchmark-hugging funds reducing exposure into weakness", "data_requirements": "[\"daily OHLCV\",\"turnover_rate\",\"AI-universe membership/BFS tags\",\"beta-hedged sleeve attribution\",\"rolling correlation to promoted factors\",\"intraday order-imbalance/auction data before production deployment\"]", "failure_mode": "It fails in gap-driven breakout regimes where leaders reprice immediately, or when low price impact reflects illiquidity instead of real absorption.", "report_contract": "research_only", "ai_supercycle_layer": "ai_networking_optical_cpo", "supply_chain_hypothesis": "Domestic optical/CPO and adjacent datacenter-link suppliers may show orderly turnover-through-pullback accumulation before verified order/backlog evidence becomes public.", "relationship_evidence_required": "true", "money_readiness": "research_only", "decision": "revert", "session_branch": "main", "base_ref": "origin/main", "merge_base": "83848153d53e89b19c687fcb9440d135d63e22a2", "head_commit": "83848153d53e89b19c687fcb9440d135d63e22a2"}
{"ts": "2026-05-28T07:22:55.044373+08:00", "session_id": "20260528_062703_a5bf9c", "market": "cn", "formula": "rank(ts_mean(turnover_rate,20)/ts_max(turnover_rate,20))*rank(-ts_mean(high/low-1,10))", "name": "turnover_concentration_absorption_20", "is_ic": -0.0823, "is_ic_ir": -0.272, "is_sharpe": -4.981, "is_turnover": 0.161, "is_monotonicity": -0.75, "gates": "FAIL", "status": "reverted", "eval_seconds": 177.9, "sleeve_id": "cn_ai_quiet_accumulation", "mispricing_source": "Slow sponsor accumulation is hard to observe in a T+1, retail-heavy market; traders anchor on breakout spikes and miss orderly float transfer with low impact.", "forced_counterparty": "Retail momentum traders and short-horizon thematic funds rotating out after no immediate breakout", "data_requirements": "[\"daily OHLCV\",\"turnover_rate\",\"CN AI-infra validated universe membership\",\"beta-hedged sleeve PnL attribution\",\"factor correlation vs promoted sleeves\"]", "failure_mode": "It stops working when leadership only advances through high-beta breakout chasing, or when tight ranges reflect illiquidity/distribution instead of sponsored accumulation during broad risk-off tape.", "report_contract": "research_only", "ai_supercycle_layer": "ai_chip_equipment_materials_packaging", "supply_chain_hypothesis": "Broad CN AI-infra bottleneck hardware names should show distributed float turnover and range compression before the next repricing leg; no single supplier/customer claim is asserted.", "relationship_evidence_required": "false", "money_readiness": "research_only", "decision": "revert", "session_branch": "main", "base_ref": "origin/main", "merge_base": "83848153d53e89b19c687fcb9440d135d63e22a2", "head_commit": "83848153d53e89b19c687fcb9440d135d63e22a2"}
{"ts": "2026-05-28T07:22:55.044373+08:00", "session_id": "20260528_062703_a5bf9c", "market": "cn", "formula": "rank(-(ts_max(turnover_rate,20)/ts_sum(turnover_rate,20))) * rank(-ret_5d)", "name": "orderly_turnover_pullback_20", "is_ic": -0.0263, "is_ic_ir": -0.1, "is_sharpe": -3.647, "is_turnover": 0.264, "is_monotonicity": -0.2, "gates": "FAIL", "status": "reverted", "eval_seconds": 166.8, "sleeve_id": "daily_price_overlay", "mispricing_source": "The payoff comes from institutional absorption being under-recognized while short-horizon traders mechanically sell recent weakness in a retail-dominated T+1 market.", "forced_counterparty": "Retail momentum traders and fast theme chasers cutting after a short drawdown; benchmark-aware institutions that wait for tape confirmation.", "data_requirements": "[\"daily turnover_rate\",\"ret_5d\",\"AI universe membership\",\"correlation vs promoted sleeves\",\"beta-hedged sleeve attribution\",\"turnover-cost attribution\"]", "failure_mode": "It should fail when the regime shifts to one-day policy/news spike trading, or when pullbacks are caused by genuine distribution rather than temporary profit-taking.", "report_contract": "setup_overlay", "ai_supercycle_layer": "none", "supply_chain_hypothesis": "Candidate CN AI-infra bottleneck names should show orderly multi-day turnover accumulation and only shallow pullbacks before the next repricing leg; exact upstream/downstream links still require source review.", "relationship_evidence_required": "true", "money_readiness": "research_only", "decision": "revert", "session_branch": "main", "base_ref": "origin/main", "merge_base": "83848153d53e89b19c687fcb9440d135d63e22a2", "head_commit": "83848153d53e89b19c687fcb9440d135d63e22a2"}
