{"ts": "2026-05-29T08:08:43.492922+08:00", "session_id": "20260529_071202_4a3250", "market": "cn", "formula": "rank(-ts_corr(ret_1d,shift(ret_1d,1),20))*rank(-ts_std(pct_change(amount,5),20))", "name": "anti_autocorr_weekly_amount_change_stability_20", "is_ic": 0.031, "is_ic_ir": 0.192, "is_sharpe": -0.562, "is_turnover": 0.165, "is_monotonicity": 0.05, "gates": "FAIL", "status": "reverted", "eval_seconds": 151.5, "sleeve_id": "anti_autocorr_flow_evenness", "mispricing_source": "The market overpays for bursty attention and underprices gradual ownership transfer; this factor scores second-order flow smoothness plus anti-persistent daily tape, rather than the level of returns, volume, or valuation.", "forced_counterparty": "Retail attention traders and benchmark/redemption-constrained mutual funds that trade for flow, mandate, or confirmation needs rather than medium-horizon alpha timing.", "data_requirements": "[ret_1d, amount, ai_infra source-reviewed CN universe tags, beta-hedged sleeve PnL vs 000300.SH and 399006.SZ, residual-risk attribution, rolling correlation vs promoted sleeves, original-source evidence for any supplier/order claim]", "failure_mode": "It stops working in one-way policy or speculative momentum regimes where bursty turnover is genuinely informative and daily return autocorrelation turns positive.", "report_contract": "setup_overlay", "ai_supercycle_layer": "ai_chip_equipment_materials_packaging", "supply_chain_hypothesis": "Source-reviewed D1-D3 CN semicap, materials, packaging, and test bottleneck suppliers should show smooth weekly amount-change paths and anti-persistent daily returns while institutions accumulate before verified order, backlog, or capex evidence is fully priced.", "relationship_evidence_required": "true", "money_readiness": "research_only", "decision": "revert", "session_branch": "main", "base_ref": "origin/main", "merge_base": "c94ca064b4ac72dfdf1f906eaaf12dbbc0a6779a", "head_commit": "c94ca064b4ac72dfdf1f906eaaf12dbbc0a6779a"}
{"ts": "2026-05-29T08:08:43.492922+08:00", "session_id": "20260529_071202_4a3250", "market": "cn", "formula": "rank(ts_mean(volume_ratio,20)/(ts_std(volume_ratio,20)+0.01))", "name": "relvol_persistence_20", "is_ic": 0.0104, "is_ic_ir": 0.069, "is_sharpe": -1.538, "is_turnover": 0.127, "is_monotonicity": -0.2, "gates": "FAIL", "status": "reverted", "eval_seconds": 119.2, "sleeve_id": "cn_ai_flow_accumulation", "mispricing_source": "Slow capital reallocation into AI-capex beneficiaries is not fully priced when buying is orderly and persistent rather than explosive, so steady relative-volume pressure gets discounted as “noise” until follow-through arrives.", "forced_counterparty": "short-horizon retail sellers and liquidity providers fading non-spiky flow", "data_requirements": "[\"daily OHLCV and volume_ratio already available\", \"before promotion: beta-hedged sleeve attribution vs 000300.SH and 399006.SZ\", \"correlation check versus amount_stability_20 and existing vpcorr sleeves\"]", "failure_mode": "It should fail when the tape shifts into pure one-day theme speculation or broad risk-off deleveraging, because persistent relative volume then reflects distribution/crowding instead of informed accumulation.", "report_contract": "setup_overlay", "ai_supercycle_layer": "ai_networking_optical_cpo", "supply_chain_hypothesis": "Optical interconnect, CPO, and fiber bottleneck names tied to AI datacenter buildout should show sustained above-baseline participation before formal order/backlog evidence is fully recognized by the tape.", "relationship_evidence_required": "true", "money_readiness": "research_only", "decision": "revert", "session_branch": "main", "base_ref": "origin/main", "merge_base": "c94ca064b4ac72dfdf1f906eaaf12dbbc0a6779a", "head_commit": "c94ca064b4ac72dfdf1f906eaaf12dbbc0a6779a"}
{"ts": "2026-05-29T08:08:43.492922+08:00", "session_id": "20260529_071202_4a3250", "market": "cn", "formula": "rank(-ts_std(amount,20))*rank(ts_mean(turnover_rate,20))", "name": "stable_amount_active_turnover_20", "is_ic": 0.0116, "is_ic_ir": 0.054, "is_sharpe": -4.211, "is_turnover": 0.096, "is_monotonicity": -0.15, "gates": "FAIL", "status": "reverted", "eval_seconds": 109.7, "sleeve_id": "cn_ai_infra_accumulation", "mispricing_source": "Short-horizon traders overweight recent price noise and underweight stable value-traded participation; this signal captures impact-managed accumulation rather than a high-correlation variant of existing price-reversal factors.", "forced_counterparty": "short-horizon retail sellers and redemption-constrained thematic funds under T+1/liquidity pressure", "data_requirements": "[\"daily CN price/volume/daily_basic data\",\"ai_infra universe metadata for attribution only\",\"beta-hedged sleeve PnL vs 000300.SH and 399006.SZ\",\"source-reviewed supplier/order evidence before production promotion\"]", "failure_mode": "It stops working when active turnover reflects distribution/churn instead of accumulation, or when stable amount is just a large-cap liquidity proxy during macro beta squeezes.", "report_contract": "setup_overlay", "ai_supercycle_layer": "ai_chip_equipment_materials_packaging", "supply_chain_hypothesis": "Domestic equipment/materials/packaging bottleneck names should show steady but active capital absorption before filings fully confirm accelerator, memory, or advanced-packaging capex transmission.", "relationship_evidence_required": "true", "money_readiness": "research_only", "decision": "revert", "session_branch": "main", "base_ref": "origin/main", "merge_base": "c94ca064b4ac72dfdf1f906eaaf12dbbc0a6779a", "head_commit": "c94ca064b4ac72dfdf1f906eaaf12dbbc0a6779a"}
{"ts": "2026-05-29T08:08:43.492922+08:00", "session_id": "20260529_071202_4a3250", "market": "cn", "formula": "rank(-ts_corr(ret_1d,shift(ret_1d,1),20))*rank(-ts_max(ret_1d,20))", "name": "autocorr_low_lottery_20", "is_ic": 0.0306, "is_ic_ir": 0.168, "is_sharpe": -1.51, "is_turnover": 0.163, "is_monotonicity": 0.0, "gates": "FAIL", "status": "reverted", "eval_seconds": 249.0, "sleeve_id": "cn_ai_tape_quality", "mispricing_source": "Lottery preference and T+1 crowd rotation overvalue recent spike profiles; this factor isolates quieter digestion paths that institutions can absorb.", "forced_counterparty": "Theme-chasing retail and short-horizon momentum traders who crowd into recent spike names despite weak 10-20 day expectancy.", "data_requirements": "[\"daily close/ret_1d is sufficient for IS test\",\"before promotion: beta-hedged sleeve attribution, sleeve-correlation check, and ai_infra source-review status for any issuer-specific supercycle narrative\"]", "failure_mode": "Fails in panic/liquidity-shock or vertical breakout regimes where persistent spike days are rewarded and low-lottery paths stop signaling under-ownership.", "report_contract": "setup_overlay", "ai_supercycle_layer": "ai_chip_equipment_materials_packaging", "supply_chain_hypothesis": "Among CN semicap/materials/packaging names tied to AI capex, real beneficiaries should reprice through repeated digestion and low lottery-style bursts, while rumor-driven lookalikes print single-day spikes.", "relationship_evidence_required": "true", "money_readiness": "research_only", "decision": "revert", "session_branch": "main", "base_ref": "origin/main", "merge_base": "c94ca064b4ac72dfdf1f906eaaf12dbbc0a6779a", "head_commit": "c94ca064b4ac72dfdf1f906eaaf12dbbc0a6779a"}
{"ts": "2026-05-29T08:08:43.492922+08:00", "session_id": "20260529_071202_4a3250", "market": "cn", "formula": "rank(ts_min(amount,20)/ts_mean(amount,20))*rank(-(ts_max(turnover_rate,20)/ts_mean(turnover_rate,20)))", "name": "amount_floor_no_spike_20", "is_ic": -0.0644, "is_ic_ir": -0.249, "is_sharpe": -6.029, "is_turnover": 0.164, "is_monotonicity": -0.7, "gates": "FAIL", "status": "reverted", "eval_seconds": 158.6, "sleeve_id": "cn_ai_participation_quality", "mispricing_source": "A-share participants chase visible volume bursts and neglect steady sponsorship during consolidation; this targets participation quality rather than another pure price reversal/momentum variant.", "forced_counterparty": "Headline-chasing retail traders and benchmark-aware thematic funds that are pushed into high-turnover breakout days and out of quiet consolidators.", "data_requirements": "[\"current daily amount and turnover_rate are sufficient for IS test\",\"promotion requires beta-hedged sleeve PnL, residual-risk attribution, sleeve correlation vs existing factors, and ai_infra source-review status for ranked names\"]", "failure_mode": "It should fail in policy/liquidity melt-up regimes where turnover spikes are rewarded, or when AI-infra leadership broadens so much that quiet sponsorship no longer differentiates winners from speculative laggards.", "report_contract": "setup_overlay", "ai_supercycle_layer": "ai_networking_optical_cpo", "supply_chain_hypothesis": "Optical/CPO and interconnect bottleneck candidates with real downstream AI capex linkage should retain a steady traded-value floor without distribution-like turnover spikes during digestion.", "relationship_evidence_required": "true", "money_readiness": "research_only", "decision": "revert", "session_branch": "main", "base_ref": "origin/main", "merge_base": "c94ca064b4ac72dfdf1f906eaaf12dbbc0a6779a", "head_commit": "c94ca064b4ac72dfdf1f906eaaf12dbbc0a6779a"}
{"ts": "2026-05-29T08:08:43.492922+08:00", "session_id": "20260529_071202_4a3250", "market": "cn", "formula": "rank(ret_20d-ret_5d)*rank(-(ts_mean(amount,5)/ts_mean(amount,20)))", "name": "leader_digestion_light_amount", "is_ic": -0.0138, "is_ic_ir": -0.082, "is_sharpe": -3.166, "is_turnover": 0.251, "is_monotonicity": -0.8, "gates": "FAIL", "status": "reverted", "eval_seconds": 112.2, "sleeve_id": "cn_ai_infra_pullback_continuation", "mispricing_source": "Retail/theme traders overreact to the first pullback in crowded AI names, while medium-horizon allocators scale in slowly and leave a low-flow digestion pattern that the market underprices.", "forced_counterparty": "short-horizon hot money and benchmark-constrained funds trimming recent winners", "data_requirements": "[\"daily OHLCV and amount\",\"ai_infra universe membership plus BFS/layer metadata for post-rank attribution\",\"benchmark returns for beta-hedged sleeve evaluation\",\"original-source filings/PRs if any supplier/customer narrative is attached to promoted names\"]", "failure_mode": "This stops working in non-trending or policy-shock regimes where true leadership breaks and high-volume breakout chasing outperforms orderly pullback buying.", "report_contract": "action_overlay", "ai_supercycle_layer": "ai_chip_equipment_materials_packaging", "supply_chain_hypothesis": "Domestic AI capex bottleneck names in equipment, materials, and advanced packaging should show low-amount pullback digestion before procurement-cycle continuation.", "relationship_evidence_required": "true", "money_readiness": "research_only", "decision": "revert", "session_branch": "main", "base_ref": "origin/main", "merge_base": "c94ca064b4ac72dfdf1f906eaaf12dbbc0a6779a", "head_commit": "c94ca064b4ac72dfdf1f906eaaf12dbbc0a6779a"}
{"ts": "2026-05-29T08:08:43.492922+08:00", "session_id": "20260529_071202_4a3250", "market": "cn", "formula": "rank(-ts_std(pct_change(amount/circ_market_cap,5),20))*rank(ts_mean((close-open)/(high-low+0.01),20))", "name": "weekly_floatchg_body_bias_20", "is_ic": -0.0215, "is_ic_ir": -0.062, "is_sharpe": 0.127, "is_turnover": 0.184, "is_monotonicity": -0.3, "gates": "FAIL", "status": "reverted", "eval_seconds": 131.4, "sleeve_id": "float_flow_underreaction", "mispricing_source": "Underreaction to orderly float-normalized accumulation with positive close control; the market pays for loud tape and discounts quiet sponsorship.", "forced_counterparty": "retail attention traders, redemption-driven sellers, and benchmark/rebalance-constrained mutual funds", "data_requirements": "[\"amount\",\"circ_market_cap\",\"open\",\"close\",\"high\",\"low\",\"ai_infra CN universe membership/status\",\"beta-hedged sleeve return and residual-risk attribution vs 000300.SH and 399006.SZ\",\"rolling correlation vs promoted sleeves\"]", "failure_mode": "Fails in policy/headline squeeze regimes, price-limit regimes, or illiquid names where positive body bias and smooth float-flow change reflect crowding or dead liquidity rather than informed accumulation.", "report_contract": "fresh_buy_gate", "ai_supercycle_layer": "ai_chip_equipment_materials_packaging", "supply_chain_hypothesis": "Source-reviewed CN semicap, materials, packaging, and test bottleneck names should show smooth weekly float-normalized participation with buyer-controlled closes before verified capex, backlog, or order evidence is fully reflected.", "relationship_evidence_required": "true", "money_readiness": "money_candidate", "decision": "revert", "session_branch": "main", "base_ref": "origin/main", "merge_base": "c94ca064b4ac72dfdf1f906eaaf12dbbc0a6779a", "head_commit": "c94ca064b4ac72dfdf1f906eaaf12dbbc0a6779a"}
{"ts": "2026-05-29T08:08:43.492922+08:00", "session_id": "20260529_071202_4a3250", "market": "cn", "formula": "rank(ts_corr(ret_1d,shift(ret_1d,1),20))*rank(ts_mean(amount/circ_market_cap,20)/ts_std(amount/circ_market_cap,20))", "name": "autocorr_float_absorption_20", "is_ic": -0.0501, "is_ic_ir": -0.21, "is_sharpe": -3.095, "is_turnover": 0.194, "is_monotonicity": -0.3, "gates": "FAIL", "status": "reverted", "eval_seconds": 113.9, "sleeve_id": "cn_ai_packaging_absorption", "mispricing_source": "Slow information diffusion and staged institutional accumulation in AI-infra leaders create underreaction; smooth float turnover filters out one-day speculation and keeps the signal from collapsing into plain price momentum.", "forced_counterparty": "Retail turnover chasing headlines and benchmark-constrained funds that add exposure gradually or provide liquidity into strength.", "data_requirements": "[\"daily OHLCV\",\"amount\",\"circ_market_cap\",\"validated ai_infra universe tags\",\"AI layer tags for sleeve restriction\",\"beta-hedge attribution vs 000300.SH and 399006.SZ\"]", "failure_mode": "It stops working when the market becomes pure headline beta or policy squeeze, so positive autocorr reflects crowded speculation instead of orderly accumulation.", "report_contract": "action_overlay", "ai_supercycle_layer": "ai_chip_equipment_materials_packaging", "supply_chain_hypothesis": "Domestic packaging, testing, and equipment bottleneck names should show orderly float absorption before formal order or capex evidence is fully recognized by the market.", "relationship_evidence_required": "true", "money_readiness": "research_only", "decision": "revert", "session_branch": "main", "base_ref": "origin/main", "merge_base": "c94ca064b4ac72dfdf1f906eaaf12dbbc0a6779a", "head_commit": "c94ca064b4ac72dfdf1f906eaaf12dbbc0a6779a"}
{"ts": "2026-05-29T08:08:43.492922+08:00", "session_id": "20260529_071202_4a3250", "market": "cn", "formula": "rank(-ts_std(pct_change(turnover_rate,5),20))*rank(ts_mean((close-open)/(high-low+0.01),20))", "name": "weekly_turnchg_body_bias_20", "is_ic": -0.0236, "is_ic_ir": -0.071, "is_sharpe": -0.123, "is_turnover": 0.186, "is_monotonicity": -0.3, "gates": "FAIL", "status": "reverted", "eval_seconds": 173.2, "sleeve_id": "cn_aiinfra_orderly_accumulation", "mispricing_source": "Slow institutional accumulation under T+1, liquidity, and mandate constraints creates underreaction; tape strength appears before benchmark allocators and retail chasers fully respond.", "forced_counterparty": "short-horizon retail mean-reverters and liquidity-motivated sellers providing stock into orderly strength", "data_requirements": "[\"daily OHLC\",\"amount\",\"turnover_rate\",\"validated ai_infra CN universe membership\",\"beta-hedge attribution vs 000300.SH and 399006.SZ\",\"sleeve drawdown/correlation/residual risk stats\"]", "failure_mode": "It stops working when the theme becomes crowded and turnover spikes, or when the tape shifts to fast mean-reversion so positive bodies are just distribution.", "report_contract": "fresh_buy_gate", "ai_supercycle_layer": "none", "supply_chain_hypothesis": "Orderly accumulation should cluster in D1-D3 AI bottleneck names being repriced ahead of verified backlog or order evidence, but this factor makes no specific supplier/customer claim.", "relationship_evidence_required": "true", "money_readiness": "money_candidate", "decision": "revert", "session_branch": "main", "base_ref": "origin/main", "merge_base": "c94ca064b4ac72dfdf1f906eaaf12dbbc0a6779a", "head_commit": "c94ca064b4ac72dfdf1f906eaaf12dbbc0a6779a"}
{"ts": "2026-05-29T08:08:43.492922+08:00", "session_id": "20260529_071202_4a3250", "market": "cn", "formula": "rank(-(ts_max(turnover_rate,20)/ts_mean(turnover_rate,20)))", "name": "turnover_spike_suppression_20", "is_ic": -0.0557, "is_ic_ir": -0.225, "is_sharpe": -3.806, "is_turnover": 0.155, "is_monotonicity": -0.3, "gates": "FAIL", "status": "reverted", "eval_seconds": 146.5, "sleeve_id": "cn_ai_flow_quality", "mispricing_source": "Theme-chasing flow overreacts to visible turnover bursts, while slower institutional absorption in AI-infra leaders is underpriced because it does not look dramatic on a single day.", "forced_counterparty": "Retail momentum traders and benchmark-constrained mutual funds reacting to AI theme spikes under T+1 and liquidity constraints", "data_requirements": "[\"current CN daily prices\",\"daily_basic.turnover_rate\",\"beta-hedged sleeve attribution vs 000300.SH and 399006.SZ\",\"correlation check against promoted sleeves before promotion\"]", "failure_mode": "It stops working in policy- or rumor-driven melt-up regimes where turnover spikes carry real new information and crowding persists instead of mean-reverting.", "report_contract": "action_overlay", "ai_supercycle_layer": "none", "supply_chain_hypothesis": "none", "relationship_evidence_required": "false", "money_readiness": "research_only", "decision": "revert", "session_branch": "main", "base_ref": "origin/main", "merge_base": "c94ca064b4ac72dfdf1f906eaaf12dbbc0a6779a", "head_commit": "c94ca064b4ac72dfdf1f906eaaf12dbbc0a6779a"}
{"ts": "2026-05-29T08:08:43.492922+08:00", "session_id": "20260529_071202_4a3250", "market": "cn", "formula": "rank(-ts_std(pct_change(amount,5),20))*rank(ts_min(turnover_rate,20)/ts_mean(turnover_rate,20))", "name": "weekly_amount_floor_stability_20", "is_ic": -0.0324, "is_ic_ir": -0.135, "is_sharpe": -4.304, "is_turnover": 0.151, "is_monotonicity": -0.45, "gates": "FAIL", "status": "reverted", "eval_seconds": 177.8, "sleeve_id": "daily_flow_quality_overlay", "mispricing_source": "Slow information diffusion and underreaction to orderly sponsorship in AI-infra names; this is a flow-shape sleeve, not a high-correlation variant of the existing price-rank or price-volume-corr factors.", "forced_counterparty": "Retail theme chasers, benchmark-constrained mutual funds, and redemption-driven sellers who supply stock during quiet consolidations.", "data_requirements": "[\"IS uses amount and turnover_rate only\",\"before promotion: ai_infra CN universe/source-review tags\",\"beta-hedged attribution vs 000300.SH and 399006.SZ\",\"rolling corr vs promoted sleeves\",\"residual risk and drawdown attribution\",\"official filings/press releases if any supplier/order claim is attached\"]", "failure_mode": "It stops working in rumor-squeeze or policy-gap regimes where bursty turnover carries the information, or when a turnover floor reflects trapped liquidity rather than sponsorship.", "report_contract": "fresh_buy_gate", "ai_supercycle_layer": "ai_chip_equipment_materials_packaging", "supply_chain_hypothesis": "Candidate semicap, advanced-packaging, and test beneficiaries of AI accelerator and datacenter capex should show smooth weekly cash participation with a persistent turnover floor before backlog or order evidence is explicit.", "relationship_evidence_required": "true", "money_readiness": "money_candidate", "decision": "revert", "session_branch": "main", "base_ref": "origin/main", "merge_base": "c94ca064b4ac72dfdf1f906eaaf12dbbc0a6779a", "head_commit": "c94ca064b4ac72dfdf1f906eaaf12dbbc0a6779a"}
