{"ts": "2026-06-01T14:57:18.048716+08:00", "session_id": "20260601_140001_9b0632", "market": "cn", "formula": "rank(-(ts_std(turnover_rate,20)/ts_std(turnover_rate,60)))", "name": "turnover_vol_compress_20_60", "is_ic": -0.0387, "is_ic_ir": -0.153, "is_sharpe": -3.429, "is_turnover": 0.115, "is_monotonicity": -0.4, "gates": "FAIL", "status": "reverted", "eval_seconds": 173.0, "sleeve_id": "daily_flow_quality", "mispricing_source": "The market prices headlines and breakouts faster than it prices liquidity-regime improvement; this factor captures quiet accumulation and holder-quality improvement, not just recent returns.", "forced_counterparty": "short-horizon retail theme traders rotating out after the first spike; benchmarked mutual funds are structurally slow accumulators", "data_requirements": "[\"daily OHLCV\",\"amount\",\"turnover_rate\",\"ai_infra universe membership\"]; for production use also require sleeve correlation, beta-hedged attribution, and source-reviewed order/backlog evidence if a supplier thesis is invoked", "failure_mode": "Fails in rumor-driven or limit-up regimes where winners need expanding turnover and crowd participation instead of quiet absorption.", "report_contract": "fresh_buy_gate", "ai_supercycle_layer": "ai_chip_equipment_materials_packaging", "supply_chain_hypothesis": "Domestic semicap equipment, packaging, and materials bottleneck names should show turnover-volatility compression as patient capital builds positions ahead of confirmed AI capex and localization orders.", "relationship_evidence_required": "true", "money_readiness": "money_candidate", "decision": "revert", "session_branch": "codex/gamma-v2-ai-infra-options", "base_ref": "origin/main", "merge_base": "e979de0f705a966ec1870cbed91949a54db4590f", "head_commit": "b4c10f429652877de4e1cc191872e642ceb61c65"}
{"ts": "2026-06-01T14:57:18.048716+08:00", "session_id": "20260601_140001_9b0632", "market": "cn", "formula": "rank(-(ts_max(turnover_rate,20)/ts_sum(turnover_rate,20)))", "name": "turnover_spike_share_20", "is_ic": -0.0557, "is_ic_ir": -0.225, "is_sharpe": -3.806, "is_turnover": 0.155, "is_monotonicity": -0.3, "gates": "FAIL", "status": "reverted", "eval_seconds": 220.9, "sleeve_id": "cn_ai_flow_quality", "mispricing_source": "A-share participants chase conspicuous turnover spikes and neglect quieter multi-week accumulation; this is a flow-concentration signal, not a price-level momentum clone.", "forced_counterparty": "Retail theme-chasers and benchmarked PMs rotating into already-hot tape, plus liquidity-motivated sellers exiting on quiet days.", "data_requirements": "[\"CN daily turnover_rate for IS test\",\"beta-hedged sleeve return and residual risk attribution before promotion\",\"filings/transcripts/official disclosures if any supplier or AI-capex linkage is attached to surfaced names\"]", "failure_mode": "It stops working when policy/news shock regimes reward one-day spike chasing, or when even turnover is just illiquidity with no real sponsorship.", "report_contract": "setup_overlay", "ai_supercycle_layer": "ai_chip_equipment_materials_packaging", "supply_chain_hypothesis": "Upstream semiconductor equipment, materials, and advanced packaging suppliers feeding AI accelerator and HBM capacity expansion should show lower turnover-spike concentration before order visibility is fully repriced.", "relationship_evidence_required": "true", "money_readiness": "research_only", "decision": "revert", "session_branch": "codex/gamma-v2-ai-infra-options", "base_ref": "origin/main", "merge_base": "e979de0f705a966ec1870cbed91949a54db4590f", "head_commit": "b4c10f429652877de4e1cc191872e642ceb61c65"}
{"ts": "2026-06-01T14:57:18.048716+08:00", "session_id": "20260601_140001_9b0632", "market": "cn", "formula": "rank(-ts_corr(ret_1d,shift(ret_1d,1),20))*rank(-ts_std(pct_change(amount/circ_market_cap,5),20))", "name": "anti_autocorr_floatchg_smooth_20", "is_ic": -0.0121, "is_ic_ir": -0.043, "is_sharpe": -1.402, "is_turnover": 0.168, "is_monotonicity": -0.2, "gates": "FAIL", "status": "reverted", "eval_seconds": 178.1, "sleeve_id": "cn_ai_flow_absorption", "mispricing_source": "Benchmark-aware institutions build AI-infra exposure gradually and buy weakness; short-horizon traders create noisy reversals that delay full repricing of medium-horizon demand.", "forced_counterparty": "Retail/event-driven traders and liquidity-window rebalancers who sell into short-term volatility without underwriting the multi-week AI capex thesis.", "data_requirements": "[\"source-reviewed AI universe membership\",\"daily amount\",\"circ_market_cap\",\"ret_1d\",\"benchmark beta-hedge and residual-risk attribution for sleeve promotion\"]", "failure_mode": "Fails in speculative chase regimes where spiky turnover is rewarded, or in genuine liquidity droughts where smooth float-flow just reflects neglect rather than accumulation.", "report_contract": "fresh_buy_gate", "ai_supercycle_layer": "ai_chip_equipment_materials_packaging", "supply_chain_hypothesis": "Validated D2-D3 domestic compute bottleneck suppliers in equipment/materials/advanced packaging should show orderly float-flow absorption before capex/order evidence is fully priced.", "relationship_evidence_required": "true", "money_readiness": "money_candidate", "decision": "revert", "session_branch": "codex/gamma-v2-ai-infra-options", "base_ref": "origin/main", "merge_base": "e979de0f705a966ec1870cbed91949a54db4590f", "head_commit": "b4c10f429652877de4e1cc191872e642ceb61c65"}
{"ts": "2026-06-01T14:57:18.048716+08:00", "session_id": "20260601_140001_9b0632", "market": "cn", "formula": "rank(ts_mean(amount,20)/(ts_std(amount,20)+1))*rank(-ret_5d)", "name": "amount_stable_pullback_20_5", "is_ic": 0.0303, "is_ic_ir": 0.167, "is_sharpe": -2.417, "is_turnover": 0.271, "is_monotonicity": 0.15, "gates": "FAIL", "status": "reverted", "eval_seconds": 127.0, "sleeve_id": "cn_ai_accumulation_pullback", "mispricing_source": "A-share AI leaders are often accumulated gradually by institutions, while T+1 retail and fast money sell short pullbacks; stable amount distinguishes sponsored consolidation from true demand collapse.", "forced_counterparty": "Retail momentum traders and redemption-constrained funds trimming recent losers into short-term weakness", "data_requirements": "[\"daily OHLCV+amount for CN AI-universe names\",\"benchmark returns for beta-hedged attribution vs 000300.SH/399006.SZ\",\"sleeve turnover/correlation ledger vs promoted factors\"]", "failure_mode": "It stops working when stable amount is actually large-holder distribution, or when the theme shifts into broad deleveraging so pullbacks no longer mean-revert.", "report_contract": "fresh_buy_gate", "ai_supercycle_layer": "none", "supply_chain_hypothesis": "Within the validated CN AI-infra universe, stable-amount names that pull back over 5 days are often domestic bottleneck links being accumulated ahead of later order/capex evidence.", "relationship_evidence_required": "true", "money_readiness": "money_candidate", "decision": "revert", "session_branch": "codex/gamma-v2-ai-infra-options", "base_ref": "origin/main", "merge_base": "e979de0f705a966ec1870cbed91949a54db4590f", "head_commit": "b4c10f429652877de4e1cc191872e642ceb61c65"}
{"ts": "2026-06-01T14:57:18.048716+08:00", "session_id": "20260601_140001_9b0632", "market": "cn", "formula": "rank(ts_mean(amount/circ_market_cap,20))*rank(-ts_rank(turnover_rate,20))", "name": "float_value_absorb_20", "is_ic": 0.0286, "is_ic_ir": 0.116, "is_sharpe": -0.83, "is_turnover": 0.385, "is_monotonicity": 0.0, "gates": "FAIL", "status": "reverted", "eval_seconds": 126.0, "sleeve_id": "cn_ai_flow_absorption", "mispricing_source": "A-share retail and thematic fast money often sell into low-excitement consolidations, while benchmarked institutions accumulate gradually and cannot reveal intent immediately.", "forced_counterparty": "retail momentum traders and short-horizon thematic funds reducing churn after the initial speculation burst", "data_requirements": "[\"Current daily CN fields are enough for IS testing\", \"Need Level-2/block-trade or top-holder flow data plus execution slippage ledger before money-ready promotion\", \"Need AI-universe BFS layer and source-review metadata for sleeve attribution\"]", "failure_mode": "It fails when low turnover reflects fading attention/liquidity instead of absorption, or when macro/policy shocks dominate stock-specific ownership transfer.", "report_contract": "research_only", "ai_supercycle_layer": "ai_chip_equipment_materials_packaging", "supply_chain_hypothesis": "Candidate bottleneck semiconductor equipment, materials, and advanced-packaging names tighten float before order, capex, or domestic-substitution evidence is fully public.", "relationship_evidence_required": "true", "money_readiness": "research_only", "decision": "revert", "session_branch": "codex/gamma-v2-ai-infra-options", "base_ref": "origin/main", "merge_base": "e979de0f705a966ec1870cbed91949a54db4590f", "head_commit": "b4c10f429652877de4e1cc191872e642ceb61c65"}
{"ts": "2026-06-01T14:57:18.048716+08:00", "session_id": "20260601_140001_9b0632", "market": "cn", "formula": "rank(-ts_corr(amount,high/low-1,20))*rank(ts_min(turnover_rate,20)/ts_mean(turnover_rate,20))", "name": "turnover_floor_absorb_20", "is_ic": -0.0204, "is_ic_ir": -0.083, "is_sharpe": -2.425, "is_turnover": 0.205, "is_monotonicity": -0.15, "gates": "FAIL", "status": "reverted", "eval_seconds": 201.9, "sleeve_id": "cn_ai_liquidity_absorption", "mispricing_source": "The market underreacts when sponsorship is visible in flow structure but not yet obvious in narrative or reported fundamentals, so quiet accumulation is not fully priced until later confirmation.", "forced_counterparty": "Retail event-chasers and short-horizon liquidity sellers; institutions with capacity and tracking-error limits that must accumulate over multiple sessions.", "data_requirements": "[\"daily OHLCV\",\"amount\",\"turnover_rate\",\"ai_infra universe membership and layer tags\",\"benchmark hedge series for residual-return attribution\"]", "failure_mode": "It breaks in speculative melt-up regimes or policy-gap regimes where a stable turnover floor reflects crowded hot-money rotation rather than patient accumulation.", "report_contract": "setup_overlay", "ai_supercycle_layer": "ai_chip_equipment_materials_packaging", "supply_chain_hypothesis": "Within the validated CN AI-infra universe, this should preferentially surface bottleneck chip-equipment/materials/packaging names being accumulated before verified order or backlog evidence is fully public.", "relationship_evidence_required": "true", "money_readiness": "research_only", "decision": "revert", "session_branch": "codex/gamma-v2-ai-infra-options", "base_ref": "origin/main", "merge_base": "e979de0f705a966ec1870cbed91949a54db4590f", "head_commit": "b4c10f429652877de4e1cc191872e642ceb61c65"}
{"ts": "2026-06-01T14:57:18.048716+08:00", "session_id": "20260601_140001_9b0632", "market": "cn", "formula": "rank(ts_mean(amount/circ_market_cap,20))*rank(-pb)", "name": "low_pb_float_flow_20", "is_ic": 0.0459, "is_ic_ir": 0.198, "is_sharpe": 3.266, "is_turnover": 0.032, "is_monotonicity": 0.35, "gates": "FAIL", "status": "reverted", "eval_seconds": 137.6, "sleeve_id": "cn_ai_value_accumulation", "mispricing_source": "A-share capital tends to crowd high-multiple narrative leaders and underprice lower-multiple AI-infra enablers until sustained flow and later fundamental confirmation force a rerating.", "forced_counterparty": "Retail momentum chasers and benchmark-constrained growth managers who avoid low-multiple hard-asset suppliers until the theme is already obvious.", "data_requirements": "[\"CN daily amount\",\"circ_market_cap\",\"pb\",\"ai_infra universe membership/tags\",\"post-backtest beta-hedge and sleeve correlation attribution\"]", "failure_mode": "It should fail when the market regime is pure concept-beta chasing, when low PB mostly reflects genuine balance-sheet stress/value traps, or when AI capex breadth narrows away from hard-asset bottlenecks.", "report_contract": "research_only", "ai_supercycle_layer": "hard_assets_energy_heavy", "supply_chain_hypothesis": "Datacenter power/cooling/grid, optical-capex, and packaging/tooling suppliers with tangible asset backing are accumulated ahead of fully verified downstream AI order visibility.", "relationship_evidence_required": "true", "money_readiness": "research_only", "decision": "revert", "session_branch": "codex/gamma-v2-ai-infra-options", "base_ref": "origin/main", "merge_base": "e979de0f705a966ec1870cbed91949a54db4590f", "head_commit": "b4c10f429652877de4e1cc191872e642ceb61c65"}
{"ts": "2026-06-01T14:57:18.048716+08:00", "session_id": "20260601_140001_9b0632", "market": "cn", "formula": "rank(ts_min(amount,20)/(circ_market_cap+1))*rank(-pb)", "name": "low_pb_flow_floor_20", "is_ic": 0.0519, "is_ic_ir": 0.235, "is_sharpe": 2.091, "is_turnover": 0.052, "is_monotonicity": 0.3, "gates": "PASS", "status": "checks_failed", "eval_seconds": 206.7, "sleeve_id": "cn_ai_hardasset_absorption", "mispricing_source": "The market overpays noisy AI narratives and underreacts to steady sponsorship in cheaper hard-asset enablers until source-reviewed demand evidence becomes obvious.", "forced_counterparty": "Retail theme chasers, redemption-driven sellers, and benchmark-constrained growth managers underweighting low-multiple infra names", "data_requirements": "[\"current CN daily fields are enough for IS test\",\"beta-hedged sleeve return vs 000300.SH and 399006.SZ\",\"rolling corr vs amount_stability_20 and low_pb_float_flow family\",\"source-reviewed evidence cards before any supplier/order claim\"]", "failure_mode": "It fails in speculative melt-up regimes where expensive narrative beta dominates, or when low-`pb` names are cheap because of genuine balance-sheet/order deterioration and the flow floor reflects trapped liquidity rather than accumulation.", "report_contract": "setup_overlay", "ai_supercycle_layer": "hard_assets_energy_heavy", "supply_chain_hypothesis": "Asset-heavy AI power, cooling, datacenter, and adjacent equipment names should keep a non-collapsing float-scaled cash floor before backlog/order evidence is fully recognized.", "relationship_evidence_required": "true", "money_readiness": "research_only", "decision": "revert", "session_branch": "codex/gamma-v2-ai-infra-options", "base_ref": "origin/main", "merge_base": "e979de0f705a966ec1870cbed91949a54db4590f", "head_commit": "b4c10f429652877de4e1cc191872e642ceb61c65", "oos": "PASS", "checks_status": "failed"}
{"ts": "2026-06-01T14:57:18.048716+08:00", "session_id": "20260601_140001_9b0632", "market": "cn", "formula": "rank(-pb) * rank(ts_mean(amount,20)/ts_max(amount,20))", "name": "low_pb_amount_evenness_20", "is_ic": 0.0008, "is_ic_ir": 0.038, "is_sharpe": -2.046, "is_turnover": 0.125, "is_monotonicity": -0.2, "gates": "FAIL", "status": "reverted", "eval_seconds": 154.1, "sleeve_id": "ai_infra_value_flow", "mispricing_source": "Quiet institutional accumulation in cheap, asset-heavy AI-infra names is slow to reprice because retail attention follows headline spikes, not steady cash participation.", "forced_counterparty": "Retail thematic chasers and redemption-driven active funds that sell or ignore dull low-PB infra names between headline cycles.", "data_requirements": "[\"current CN daily_basic + amount data for IS test\",\"correlation check vs low_pb_flow_floor_20 and amount_stability_20\",\"beta-hedged sleeve attribution\",\"ai_infra source-review status for surfaced names before promotion\"]", "failure_mode": "Fails when speculative narrative beta dominates fundamentals, or when low PB mostly identifies value traps rather than constrained AI-infra assets under accumulation.", "report_contract": "fresh_buy_gate", "ai_supercycle_layer": "hard_assets_energy_heavy", "supply_chain_hypothesis": "Candidate discovery of asset-heavy AI-infra bottleneck names in datacenter, power, and equipment chains that are being accumulated before source-reviewed demand evidence is fully priced.", "relationship_evidence_required": "true", "money_readiness": "money_candidate", "decision": "revert", "session_branch": "codex/gamma-v2-ai-infra-options", "base_ref": "origin/main", "merge_base": "e979de0f705a966ec1870cbed91949a54db4590f", "head_commit": "b4c10f429652877de4e1cc191872e642ceb61c65"}
{"ts": "2026-06-01T14:57:18.048716+08:00", "session_id": "20260601_140001_9b0632", "market": "cn", "formula": "rank(-ps_ttm) * rank(-ts_std(turnover_rate,20))", "name": "low_ps_turnover_stability_20", "is_ic": 0.0072, "is_ic_ir": 0.018, "is_sharpe": -2.127, "is_turnover": 0.052, "is_monotonicity": -0.05, "gates": "FAIL", "status": "reverted", "eval_seconds": 90.9, "sleeve_id": "cn_ai_value_accumulation", "mispricing_source": "Benchmark-aware managers and retail traders crowd into expensive headline AI leaders, while lower-multiple infrastructure suppliers with steady sponsorship rerate later when procurement and capacity evidence diffuses.", "forced_counterparty": "retail momentum traders and benchmark-constrained growth funds", "data_requirements": "[\"daily price/volume/turnover_rate/ps_ttm\", \"ai_infra universe membership\", \"filings/transcripts/news for backlog, capex, and customer verification before production promotion\"]", "failure_mode": "Fails when speculative theme chasing dominates valuation discipline, or when sales multiples lose comparability because revenue quality deteriorates or accounting/base effects distort ps_ttm.", "report_contract": "setup_overlay", "ai_supercycle_layer": "ai_datacenter_edge_infra", "supply_chain_hypothesis": "Low-PS CN datacenter, cooling, networking, and fit-out suppliers with steady turnover are being accumulated ahead of visible AI buildout procurement and capacity expansion.", "relationship_evidence_required": "true", "money_readiness": "research_only", "decision": "revert", "session_branch": "codex/gamma-v2-ai-infra-options", "base_ref": "origin/main", "merge_base": "e979de0f705a966ec1870cbed91949a54db4590f", "head_commit": "b4c10f429652877de4e1cc191872e642ceb61c65"}
{"ts": "2026-06-01T14:57:18.048716+08:00", "session_id": "20260601_140001_9b0632", "market": "cn", "formula": "rank(-pb) * rank(-ts_std(turnover_rate, 20)) * rank(-ret_20d)", "name": "low_pb_turnover_compress_pullback", "is_ic": 0.0076, "is_ic_ir": 0.031, "is_sharpe": -2.648, "is_turnover": 0.123, "is_monotonicity": -0.2, "gates": "FAIL", "status": "reverted", "eval_seconds": 28.9, "sleeve_id": "daily_price_overlay", "mispricing_source": "A-share AI supply-chain names are often over-discounted after short-term de-risking, while low turnover dispersion signals locked-up float and patient capital accumulation before the next thematic leg.", "forced_counterparty": "Short-horizon retail momentum traders and benchmark-constrained managers reducing crowded winners on drawdowns", "data_requirements": "[\"beta-hedged sleeve attribution vs 000300.SH/399006.SZ\",\"rolling factor correlation to promoted value/reversal sleeves\",\"post-cost turnover decay by holding bucket\"]", "failure_mode": "Fails when low PB is a value trap tied to genuine order deterioration, or when regime shifts to indiscriminate high-beta momentum where pullback names keep lagging.", "report_contract": "fresh_buy_gate", "ai_supercycle_layer": "ai_chip_equipment_materials_packaging", "supply_chain_hypothesis": "Tape should surface accumulation in domestic semiconductor equipment/materials/packaging names that are strategic substitutes in AI compute bottlenecks, but specific supplier/customer links still need source review.", "relationship_evidence_required": "true", "money_readiness": "money_candidate", "decision": "revert", "session_branch": "codex/gamma-v2-ai-infra-options", "base_ref": "origin/main", "merge_base": "e979de0f705a966ec1870cbed91949a54db4590f", "head_commit": "b4c10f429652877de4e1cc191872e642ceb61c65"}
{"ts": "2026-06-01T14:57:18.048716+08:00", "session_id": "20260601_140001_9b0632", "market": "cn", "formula": "rank(ts_mean(amount/circ_market_cap,20)/ts_max(amount/circ_market_cap,20))*rank(-ps_ttm)", "name": "low_ps_float_evenness_20", "is_ic": -0.0155, "is_ic_ir": -0.047, "is_sharpe": -1.597, "is_turnover": 0.128, "is_monotonicity": -0.25, "gates": "FAIL", "status": "reverted", "eval_seconds": 143.7, "sleeve_id": "cn_ai_infra_flow_value", "mispricing_source": "Quiet float-adjusted accumulation in cheaper AI-infra names is underreacted to because investors anchor on headline volume spikes and narrative leaders rather than steady ownership transfer.", "forced_counterparty": "Benchmarked mutual funds avoiding smaller float names and retail momentum traders who prefer high-turnover spike days", "data_requirements": "[\"daily OHLCV\",\"amount\",\"circ_market_cap\",\"ps_ttm\",\"ai_infra universe membership\",\"benchmark hedge return and residual risk attribution\",\"official filings/press releases if a specific supplier/customer link is cited\"]", "failure_mode": "It stops working in pure narrative beta melt-ups or distressed-value regimes, where low PS reflects genuine impairment and steady flow is just illiquidity rather than accumulation.", "report_contract": "fresh_buy_gate", "ai_supercycle_layer": "ai_chip_equipment_materials_packaging", "supply_chain_hypothesis": "Domestic chip equipment/materials/advanced-packaging names with persistent float-adjusted cash-turnover support are being accumulated ahead of localization and AI capex order visibility.", "relationship_evidence_required": "true", "money_readiness": "money_candidate", "decision": "revert", "session_branch": "codex/gamma-v2-ai-infra-options", "base_ref": "origin/main", "merge_base": "e979de0f705a966ec1870cbed91949a54db4590f", "head_commit": "b4c10f429652877de4e1cc191872e642ceb61c65"}
