{"ts": "2026-06-01T14:57:18.048716+08:00", "session_id": "20260601_140001_9b0632", "market": "cn", "formula": "rank(-pb)*rank(ts_min(amount,20)/ts_mean(amount,20))", "name": "low_pb_amount_floor_20", "is_ic": 0.0151, "is_ic_ir": 0.058, "is_sharpe": -1.347, "is_turnover": 0.119, "is_monotonicity": 0.05, "gates": "FAIL", "status": "reverted", "eval_seconds": 121.7, "sleeve_id": "cn_ai_value_flow_floor", "mispricing_source": "A-share retail churn and benchmark-hugging institutions are slow to add cheap AI-infra names before hard evidence, so informed sponsorship appears first as a persistent cash-turnover floor.", "forced_counterparty": "short-horizon retail profit takers and benchmarked institutions that wait for headline or earnings confirmation", "data_requirements": "[\"daily amount\",\"pb\",\"AI universe membership\",\"factor correlation to promoted sleeves\",\"beta-hedged return and residual risk attribution\",\"filings/news only if narrating supplier links\"]", "failure_mode": "It stops working if low-PB turns into a value-trap regime during AI-capex slowdown, or if amount floors become a generic illiquidity artifact instead of informed accumulation.", "report_contract": "research_only", "ai_supercycle_layer": "none", "supply_chain_hypothesis": "Cross-layer D1-D3 domestic AI bottleneck suppliers should keep a durable cash-turnover floor before order or backlog confirmation is fully priced.", "relationship_evidence_required": "true", "money_readiness": "research_only", "decision": "revert", "session_branch": "codex/gamma-v2-ai-infra-options", "base_ref": "origin/main", "merge_base": "e979de0f705a966ec1870cbed91949a54db4590f", "head_commit": "b4c10f429652877de4e1cc191872e642ceb61c65"}
{"ts": "2026-06-01T14:57:18.048716+08:00", "session_id": "20260601_140001_9b0632", "market": "cn", "formula": "rank((ts_min(volume_ratio,20)/ts_mean(volume_ratio,20))/clamp(pb,0.1,20))", "name": "low_pb_relvol_floor_20", "is_ic": 0.0192, "is_ic_ir": 0.089, "is_sharpe": -0.711, "is_turnover": 0.064, "is_monotonicity": 0.1, "gates": "FAIL", "status": "reverted", "eval_seconds": 257.8, "sleeve_id": "cn_ai_infra_value_flow", "mispricing_source": "The market overreacts to noisy AI-theme spikes and underreacts to quieter persistence in validated beneficiaries, so cheap names with a participation floor can rerate after attention rotates away.", "forced_counterparty": "Retail theme traders who de-risk after the first spike, plus benchmark-aware funds that delay adding lower-visibility AI supply-chain names.", "data_requirements": "[\"daily OHLCV\",\"daily_basic pb and volume_ratio\",\"ai_infra universe membership/source-review status\",\"beta-hedged sleeve attribution vs 000300.SH and 399006.SZ\",\"evidence cards before any supplier/customer claim is treated as fact\"]", "failure_mode": "It stops working in pure squeeze regimes where crowded high-volume chasing dominates, or when low PB names are value traps and the relvol floor only reflects stagnant baseline trading.", "report_contract": "setup_overlay", "ai_supercycle_layer": "ai_chip_equipment_materials_packaging", "supply_chain_hypothesis": "Source-reviewed domestic chip equipment, materials, and packaging names tied to accelerator or memory bottlenecks should retain a relative-volume floor even after headline intensity cools.", "relationship_evidence_required": "true", "money_readiness": "research_only", "decision": "revert", "session_branch": "codex/gamma-v2-ai-infra-options", "base_ref": "origin/main", "merge_base": "e979de0f705a966ec1870cbed91949a54db4590f", "head_commit": "b4c10f429652877de4e1cc191872e642ceb61c65"}
{"ts": "2026-06-01T14:57:18.048716+08:00", "session_id": "20260601_140001_9b0632", "market": "cn", "formula": "rank(-clamp(pb,0.1,20))*rank(ts_corr(turnover_rate,shift(turnover_rate,1),20))", "name": "low_pb_turnover_persistence_20", "is_ic": -0.01, "is_ic_ir": -0.045, "is_sharpe": -3.279, "is_turnover": 0.145, "is_monotonicity": -0.3, "gates": "FAIL", "status": "reverted", "eval_seconds": 125.5, "sleeve_id": "cn_ai_infra_value_accumulation", "mispricing_source": "Valuation anchors keep hard-asset AI-infra suppliers optically cheap, while slow-moving institutions accumulate over weeks; the market underreacts because headline-driven participants prefer faster narrative beta.", "forced_counterparty": "Retail theme chasers and mandate-constrained holders exiting low-narrative industrial names before fundamentals re-rate", "data_requirements": "[\"pb\",\"turnover_rate\",\"daily OHLCV panel\",\"ai_infra universe depth/module tags\",\"for supplier/customer interpretation: filings, official press releases, transcripts, backlog/capex disclosures\"]", "failure_mode": "This stops working when the market shifts into pure speculative breakout regimes, or when book value is a poor anchor because balance sheets are deteriorating or being diluted.", "report_contract": "fresh_buy_gate", "ai_supercycle_layer": "hard_assets_energy_heavy", "supply_chain_hypothesis": "Capex-heavy domestic AI-infra bottleneck suppliers in power, cooling, equipment, and related build-out chains are accumulated before verified datacenter expansion evidence becomes consensus.", "relationship_evidence_required": "true", "money_readiness": "money_candidate", "decision": "revert", "session_branch": "codex/gamma-v2-ai-infra-options", "base_ref": "origin/main", "merge_base": "e979de0f705a966ec1870cbed91949a54db4590f", "head_commit": "b4c10f429652877de4e1cc191872e642ceb61c65"}
{"ts": "2026-06-01T14:57:18.048716+08:00", "session_id": "20260601_140001_9b0632", "market": "cn", "formula": "rank(-pb)*rank(-ts_mean(abs(pct_change(amount/circ_market_cap,5)),20))", "name": "pb_weekly_floatflow_smooth_20", "is_ic": 0.0024, "is_ic_ir": 0.015, "is_sharpe": -1.276, "is_turnover": 0.113, "is_monotonicity": -0.1, "gates": "FAIL", "status": "reverted", "eval_seconds": 263.1, "sleeve_id": "cn_ai_infra_flow_value", "mispricing_source": "Valuation anchoring plus underreaction to smooth float-normalized flow; this is a sponsorship-path signal, not a high-correlation clone of momentum or reversal.", "forced_counterparty": "Retail theme chasers, benchmark-constrained growth funds, and redemption-driven sellers trading for liquidity or narrative exposure rather than long-horizon bottleneck value.", "data_requirements": "[\"current signal test uses pb, amount, circ_market_cap\", \"before promotion require beta-hedged sleeve return vs 000300.SH and 399006.SZ\", \"rolling corr vs promoted sleeves\", \"residual risk attribution\", \"filings/backlog/capex/original-source evidence for any supplier or order claim\"]", "failure_mode": "Fails in speculative melt-up or forced-deleveraging regimes where expensive beta leads regardless of valuation, or when low-pb plus smooth float flow is just illiquidity/distress rather than accumulation.", "report_contract": "setup_overlay", "ai_supercycle_layer": "ai_power_nuclear_grid", "supply_chain_hypothesis": "Candidate signal for CN power-grid, electrical equipment, and datacenter power-enabler names where float-adjusted weekly sponsorship builds before verified AI-load expansion, backlog, or order evidence is consensus.", "relationship_evidence_required": "true", "money_readiness": "research_only", "decision": "revert", "session_branch": "codex/gamma-v2-ai-infra-options", "base_ref": "origin/main", "merge_base": "e979de0f705a966ec1870cbed91949a54db4590f", "head_commit": "b4c10f429652877de4e1cc191872e642ceb61c65"}
{"ts": "2026-06-01T14:57:18.048716+08:00", "session_id": "20260601_140001_9b0632", "market": "cn", "formula": "rank(-pb) * rank(ts_mean(turnover_rate,20)/ts_max(turnover_rate,20))", "name": "low_pb_even_turnover_20", "is_ic": -0.0081, "is_ic_ir": 0.0, "is_sharpe": -2.228, "is_turnover": 0.13, "is_monotonicity": -0.5, "gates": "FAIL", "status": "reverted", "eval_seconds": 126.8, "sleeve_id": "daily_price_overlay", "mispricing_source": "Cheap AI-infra stocks with broad, non-spiky participation are typically being transferred from impatient headline-chasers to slower institutional holders before earnings/order evidence catches up.", "forced_counterparty": "Retail spike-chasers and benchmarked managers rotating toward already-crowded AI leaders", "data_requirements": "[\"daily pb\",\"daily turnover_rate\",\"validated AI-infra universe membership\",\"portfolio beta-hedge and residual-risk attribution ledger for sleeve deployment\"]", "failure_mode": "It stops working when CN enters a pure speculative regime where turnover spikes, not quiet accumulation, are rewarded, or when low-PB names are value traps because backlog/capex quality is deteriorating.", "report_contract": "fresh_buy_gate", "ai_supercycle_layer": "none", "supply_chain_hypothesis": "Cross-layer AI-infra bottleneck names in the validated CN universe should show quiet ownership accumulation before the market fully prices domestic substitution or capacity tightness.", "relationship_evidence_required": "true", "money_readiness": "money_candidate", "decision": "revert", "session_branch": "codex/gamma-v2-ai-infra-options", "base_ref": "origin/main", "merge_base": "e979de0f705a966ec1870cbed91949a54db4590f", "head_commit": "b4c10f429652877de4e1cc191872e642ceb61c65"}
{"ts": "2026-06-01T14:57:18.048716+08:00", "session_id": "20260601_140001_9b0632", "market": "cn", "formula": "rank(-ts_std(amount,20))*rank(ret_20d-ret_5d)", "name": "amount_stable_leader_pullback", "is_ic": 0.0047, "is_ic_ir": 0.024, "is_sharpe": -1.771, "is_turnover": 0.182, "is_monotonicity": -0.2, "gates": "FAIL", "status": "reverted", "eval_seconds": 81.1, "sleeve_id": "cn_ai_infra_accumulation_pullback", "mispricing_source": "Short-horizon traders and theme money react to recent weakness, while slower institutional buyers in AI-infra leaders keep turnover value steady; the market underprices the persistence of that sponsorship. This should be less correlated to existing pure price reversals because the amount-stability gate tries to isolate sponsored leaders instead of broad losers.", "forced_counterparty": "Retail momentum traders, short-horizon thematic funds, and risk-budgeted accounts forced to cut recent 5-day underperformers despite intact 20-day leadership", "data_requirements": "[\"daily amount\",\"ret_5d\",\"ret_20d\",\"ai_infra universe membership and source-review status\",\"beta-hedged sleeve return\",\"residual risk attribution\",\"correlation to promoted sleeves\"]", "failure_mode": "Fails when the market flips into indiscriminate mean reversion, or when stable amount merely identifies crowded large caps with no fresh marginal buyer", "report_contract": "setup_overlay", "ai_supercycle_layer": "none", "supply_chain_hypothesis": "none", "relationship_evidence_required": "false", "money_readiness": "research_only", "decision": "revert", "session_branch": "codex/gamma-v2-ai-infra-options", "base_ref": "origin/main", "merge_base": "e979de0f705a966ec1870cbed91949a54db4590f", "head_commit": "b4c10f429652877de4e1cc191872e642ceb61c65"}
{"ts": "2026-06-01T14:57:18.048716+08:00", "session_id": "20260601_140001_9b0632", "market": "cn", "formula": "rank(-pb) * rank(-ts_rank(volume_ratio,20))", "name": "low_pb_relvol_lull_20", "is_ic": 0.0439, "is_ic_ir": 0.197, "is_sharpe": -1.649, "is_turnover": 0.392, "is_monotonicity": 0.2, "gates": "FAIL", "status": "reverted", "eval_seconds": 96.0, "sleeve_id": "cn_ai_value_flow_overlay", "mispricing_source": "Retail/thematic capital overpays for attention and underprices temporarily quiet AI-infra names even when strategic demand exposure is unchanged.", "forced_counterparty": "Short-horizon theme traders and benchmark-aware managers who avoid low-attention names until volume confirms.", "data_requirements": "[\"existing CN daily price/volume/daily_basic\", \"portfolio beta-hedge attribution vs 000300.SH and 399006.SZ\", \"sleeve correlation to promoted factors before promotion\"]", "failure_mode": "It stops working in pure momentum melt-up regimes where attention itself is the scarce asset, or when low PB is a genuine balance-sheet/value-trap signal rather than temporary neglect.", "report_contract": "fresh_buy_gate", "ai_supercycle_layer": "ai_chip_equipment_materials_packaging", "supply_chain_hypothesis": "Candidate domestic AI capex bottleneck suppliers in equipment/materials can show quiet re-accumulation after speculative volume washes out, before the next order/backlog repricing wave.", "relationship_evidence_required": "true", "money_readiness": "money_candidate", "decision": "revert", "session_branch": "codex/gamma-v2-ai-infra-options", "base_ref": "origin/main", "merge_base": "e979de0f705a966ec1870cbed91949a54db4590f", "head_commit": "b4c10f429652877de4e1cc191872e642ceb61c65"}
{"ts": "2026-06-01T14:57:18.048716+08:00", "session_id": "20260601_140001_9b0632", "market": "cn", "formula": "rank(ts_mean(amount / circ_market_cap,20) / (ts_std(amount / circ_market_cap,20) * clamp(pb,0.1,20)))", "name": "pb_float_absorption_20", "is_ic": 0.0076, "is_ic_ir": 0.037, "is_sharpe": -2.526, "is_turnover": 0.071, "is_monotonicity": 0.1, "gates": "FAIL", "status": "reverted", "eval_seconds": 274.9, "sleeve_id": "cn_ai_value_flow_overlay", "mispricing_source": "AI buildout beneficiaries in power/datacenter/heavy infrastructure get re-rated slowly because accounting value looks dull and order visibility is lagged, so steady float-scaled trading can reveal informed accumulation before the narrative catches up.", "forced_counterparty": "Short-horizon retail chasers and benchmarked managers rotating toward recent headline winners instead of quietly accumulating low-multiple infrastructure enablers.", "data_requirements": "[\"daily OHLCV\",\"daily_basic amount,pb,circ_market_cap\",\"beta-hedge and residual-risk attribution vs 000300.SH and 399006.SZ before promotion\"]", "failure_mode": "It breaks when low PB is a genuine balance-sheet trap or when policy/liquidity waves lift high-beta stories indiscriminately, making stable flow reflect distribution or dead money rather than accumulation.", "report_contract": "setup_overlay", "ai_supercycle_layer": "hard_assets_energy_heavy", "supply_chain_hypothesis": "Should preferentially surface AI datacenter power, cooling, electrical equipment, and other heavy-asset buildout names where institutions build exposure before verified order/backlog evidence is visible.", "relationship_evidence_required": "true", "money_readiness": "research_only", "decision": "revert", "session_branch": "codex/gamma-v2-ai-infra-options", "base_ref": "origin/main", "merge_base": "e979de0f705a966ec1870cbed91949a54db4590f", "head_commit": "b4c10f429652877de4e1cc191872e642ceb61c65"}
{"ts": "2026-06-01T14:57:18.048716+08:00", "session_id": "20260601_140001_9b0632", "market": "cn", "formula": "rank(-clamp(pb,0.1,20)*ts_min(amount/circ_market_cap,20)/ts_max(amount/circ_market_cap,20))", "name": "low_pb_float_corridor_20", "is_ic": 0.0331, "is_ic_ir": 0.184, "is_sharpe": 1.654, "is_turnover": 0.069, "is_monotonicity": 0.05, "gates": "FAIL", "status": "reverted", "eval_seconds": 200.0, "sleeve_id": "cn_ai_infra_accumulation", "mispricing_source": "Quiet float-flow absorption in cheap AI-infra names is slow to clear because the market overreacts to headline beta and turnover spikes, not persistent base-building.", "forced_counterparty": "retail momentum traders and benchmark-constrained managers avoiding low-PB laggards", "data_requirements": "[\"daily amount\",\"circ_market_cap\",\"pb\",\"source-reviewed AI-infra universe membership\",\"beta-hedge attribution vs 000300.SH/399006.SZ before promotion\"]", "failure_mode": "Fails when speculative squeeze regimes reward high-turnover concept names, or when low PB reflects genuine balance-sheet deterioration instead of temporary neglect.", "report_contract": "setup_overlay", "ai_supercycle_layer": "hard_assets_energy_heavy", "supply_chain_hypothesis": "Candidate AI datacenter power/cooling/grid and other capex-heavy bottleneck names should show a steady float-flow corridor before verified order/backlog evidence becomes obvious.", "relationship_evidence_required": "true", "money_readiness": "research_only", "decision": "revert", "session_branch": "codex/gamma-v2-ai-infra-options", "base_ref": "origin/main", "merge_base": "e979de0f705a966ec1870cbed91949a54db4590f", "head_commit": "b4c10f429652877de4e1cc191872e642ceb61c65"}
