{"ts": "2026-05-05T14:56:33.343274+08:00", "session_id": "20260505_140029_9903b6", "market": "cn", "formula": "rank(-ts_corr(ret_1d,shift(ret_1d,1),20))*rank(ts_min(ts_sum(amount/circ_market_cap,5),20)/ts_mean(ts_sum(amount/circ_market_cap,5),20))", "name": "anti_autocorr_weekly_float_floor_20", "is_ic": 0.036, "is_ic_ir": 0.398, "is_sharpe": 3.528, "is_turnover": 0.166, "is_monotonicity": 0.6, "gates": "PASS", "status": "candidate", "eval_seconds": 151.3, "decision": "candidate", "session_branch": "main", "base_ref": "origin/main", "merge_base": "7e71edc0d50443d3db4f0dd72c25238cd7ac1282", "head_commit": "7e71edc0d50443d3db4f0dd72c25238cd7ac1282"}
{"ts": "2026-05-05T14:56:33.343274+08:00", "session_id": "20260505_140029_9903b6", "market": "cn", "formula": "rank(-ts_corr(ret_1d,shift(ret_1d,1),20))*rank(ts_mean(ts_sum(amount/market_cap,5),20)/ts_std(ts_sum(amount/market_cap,5),20))", "name": "anti_autocorr_weekly_mcapflow_stability_20", "is_ic": 0.0364, "is_ic_ir": 0.452, "is_sharpe": 3.305, "is_turnover": 0.151, "is_monotonicity": 0.65, "gates": "PASS", "status": "candidate", "eval_seconds": 132.3, "decision": "candidate", "session_branch": "main", "base_ref": "origin/main", "merge_base": "7e71edc0d50443d3db4f0dd72c25238cd7ac1282", "head_commit": "7e71edc0d50443d3db4f0dd72c25238cd7ac1282"}
{"ts": "2026-05-05T14:56:33.343274+08:00", "session_id": "20260505_140029_9903b6", "market": "cn", "formula": "rank(-ts_max(ret_1d,20))*rank(ts_mean(ts_sum(turnover_rate,5),20)/ts_max(ts_sum(turnover_rate,5),20))", "name": "low_lottery_weekly_turnover_evenness_20", "is_ic": 0.0403, "is_ic_ir": 0.267, "is_sharpe": 0.348, "is_turnover": 0.111, "is_monotonicity": 0.0, "gates": "PASS", "status": "checks_failed", "eval_seconds": 196.0, "decision": "revert", "session_branch": "main", "base_ref": "origin/main", "merge_base": "7e71edc0d50443d3db4f0dd72c25238cd7ac1282", "head_commit": "7e71edc0d50443d3db4f0dd72c25238cd7ac1282", "oos": "PASS", "checks_status": "failed"}
{"ts": "2026-05-05T14:56:33.343274+08:00", "session_id": "20260505_140029_9903b6", "market": "cn", "formula": "rank(-ts_max(ret_1d,20))*rank(ts_min(ts_sum(amount/market_cap,5),20)/ts_mean(ts_sum(amount/market_cap,5),20))", "name": "low_lottery_weekly_mcap_floor_20", "is_ic": 0.0362, "is_ic_ir": 0.238, "is_sharpe": 0.436, "is_turnover": 0.101, "is_monotonicity": -0.3, "gates": "PASS", "status": "candidate", "eval_seconds": 132.1, "decision": "candidate", "session_branch": "main", "base_ref": "origin/main", "merge_base": "7e71edc0d50443d3db4f0dd72c25238cd7ac1282", "head_commit": "7e71edc0d50443d3db4f0dd72c25238cd7ac1282"}
{"ts": "2026-05-05T14:56:33.343274+08:00", "session_id": "20260505_140029_9903b6", "market": "cn", "formula": "rank(-ts_corr(ret_1d,shift(ret_1d,1),20))*rank(ts_min(ts_sum(volume_ratio,5),20)/ts_mean(ts_sum(volume_ratio,5),20))", "name": "anti_autocorr_weekly_relvol_floor_20", "is_ic": 0.0371, "is_ic_ir": 0.434, "is_sharpe": 3.783, "is_turnover": 0.162, "is_monotonicity": 0.35, "gates": "PASS", "status": "candidate", "eval_seconds": 134.2, "decision": "candidate", "session_branch": "main", "base_ref": "origin/main", "merge_base": "7e71edc0d50443d3db4f0dd72c25238cd7ac1282", "head_commit": "7e71edc0d50443d3db4f0dd72c25238cd7ac1282"}
{"ts": "2026-05-05T14:56:33.343274+08:00", "session_id": "20260505_140029_9903b6", "market": "cn", "formula": "rank(-ts_corr(ret_1d,shift(ret_1d,1),20))*rank(ts_mean(ts_sum(amount/market_cap,5),20)/ts_max(ts_sum(amount/market_cap,5),20))", "name": "anti_autocorr_weekly_mcapflow_evenness_20", "is_ic": 0.0369, "is_ic_ir": 0.481, "is_sharpe": 3.384, "is_turnover": 0.17, "is_monotonicity": 0.45, "gates": "PASS", "status": "candidate", "eval_seconds": 176.7, "decision": "candidate", "session_branch": "main", "base_ref": "origin/main", "merge_base": "7e71edc0d50443d3db4f0dd72c25238cd7ac1282", "head_commit": "7e71edc0d50443d3db4f0dd72c25238cd7ac1282"}
{"ts": "2026-05-05T14:56:33.343274+08:00", "session_id": "20260505_140029_9903b6", "market": "cn", "formula": "rank(-ts_max(ret_1d,20))*rank(-ts_std(ts_sum(volume_ratio,5),20)/ts_mean(ts_sum(volume_ratio,5),20))", "name": "low_lottery_weekly_relvol_stability_20", "is_ic": 0.0401, "is_ic_ir": 0.266, "is_sharpe": 0.595, "is_turnover": 0.087, "is_monotonicity": -0.05, "gates": "PASS", "status": "checks_failed", "eval_seconds": 145.3, "decision": "revert", "session_branch": "main", "base_ref": "origin/main", "merge_base": "7e71edc0d50443d3db4f0dd72c25238cd7ac1282", "head_commit": "7e71edc0d50443d3db4f0dd72c25238cd7ac1282", "oos": "PASS", "checks_status": "failed"}
{"ts": "2026-05-05T14:56:33.343274+08:00", "session_id": "20260505_140029_9903b6", "market": "cn", "formula": "rank(-ts_max(ret_1d,20))*rank(ts_mean(ts_sum(amount/market_cap,5),20)/ts_std(ts_sum(amount/market_cap,5),20))", "name": "low_lottery_weekly_mcapflow_stability_20", "is_ic": 0.0372, "is_ic_ir": 0.243, "is_sharpe": 0.236, "is_turnover": 0.09, "is_monotonicity": -0.15, "gates": "PASS", "status": "candidate", "eval_seconds": 217.9, "decision": "candidate", "session_branch": "main", "base_ref": "origin/main", "merge_base": "7e71edc0d50443d3db4f0dd72c25238cd7ac1282", "head_commit": "7e71edc0d50443d3db4f0dd72c25238cd7ac1282"}
{"ts": "2026-05-05T14:56:33.343274+08:00", "session_id": "20260505_140029_9903b6", "market": "cn", "formula": "rank(-ts_corr(ret_1d,shift(ret_1d,1),20))*rank(ts_min(turnover_rate,20)/ts_mean(turnover_rate,20))", "name": "anti_autocorr_turnover_floor_20", "is_ic": 0.0379, "is_ic_ir": 0.443, "is_sharpe": 1.599, "is_turnover": 0.177, "is_monotonicity": 0.45, "gates": "PASS", "status": "candidate", "eval_seconds": 205.6, "decision": "candidate", "session_branch": "main", "base_ref": "origin/main", "merge_base": "7e71edc0d50443d3db4f0dd72c25238cd7ac1282", "head_commit": "7e71edc0d50443d3db4f0dd72c25238cd7ac1282"}
{"ts": "2026-05-05T14:56:33.343274+08:00", "session_id": "20260505_140029_9903b6", "market": "cn", "formula": "rank(-ts_corr(ret_5d, turnover_rate, 20))", "name": "weekly_turnover_return_inversion_20", "is_ic": 0.0353, "is_ic_ir": 0.221, "is_sharpe": -0.226, "is_turnover": 0.126, "is_monotonicity": 0.05, "gates": "PASS", "status": "candidate", "eval_seconds": 70.4, "decision": "candidate", "session_branch": "main", "base_ref": "origin/main", "merge_base": "7e71edc0d50443d3db4f0dd72c25238cd7ac1282", "head_commit": "7e71edc0d50443d3db4f0dd72c25238cd7ac1282"}
{"ts": "2026-05-05T14:56:33.343274+08:00", "session_id": "20260505_140029_9903b6", "market": "cn", "formula": "rank(-ts_corr(ret_1d,shift(ret_1d,1),20))*rank(ts_mean(amount,20)/ts_max(amount,20))", "name": "anti_autocorr_amount_evenness_20", "is_ic": 0.0366, "is_ic_ir": 0.475, "is_sharpe": 2.167, "is_turnover": 0.174, "is_monotonicity": 0.15, "gates": "PASS", "status": "candidate", "eval_seconds": 145.5, "decision": "candidate", "session_branch": "main", "base_ref": "origin/main", "merge_base": "7e71edc0d50443d3db4f0dd72c25238cd7ac1282", "head_commit": "7e71edc0d50443d3db4f0dd72c25238cd7ac1282"}
{"ts": "2026-05-05T14:56:33.343274+08:00", "session_id": "20260505_140029_9903b6", "market": "cn", "formula": "rank(-ts_corr(ret_1d, shift(ret_1d, 1), 20)) * rank(ts_min(ts_sum(amount, 5), 20) / ts_mean(ts_sum(amount, 5), 20))", "name": "anti_autocorr_weekly_amount_floor_20", "is_ic": 0.0348, "is_ic_ir": 0.392, "is_sharpe": 2.992, "is_turnover": 0.164, "is_monotonicity": 0.15, "gates": "PASS", "status": "candidate", "eval_seconds": 120.2, "decision": "candidate", "session_branch": "main", "base_ref": "origin/main", "merge_base": "7e71edc0d50443d3db4f0dd72c25238cd7ac1282", "head_commit": "7e71edc0d50443d3db4f0dd72c25238cd7ac1282"}
{"ts": "2026-05-05T14:56:33.343274+08:00", "session_id": "20260505_140029_9903b6", "market": "cn", "formula": "rank(-ts_corr(ret_1d,shift(ret_1d,1),20))*rank(ts_min(ts_sum(turnover_rate,5),20)/ts_std(ts_sum(turnover_rate,5),20))", "name": "anti_autocorr_weekly_turnover_support_20", "is_ic": 0.0367, "is_ic_ir": 0.441, "is_sharpe": 4.149, "is_turnover": 0.151, "is_monotonicity": 0.6, "gates": "PASS", "status": "candidate", "eval_seconds": 213.3, "decision": "candidate", "session_branch": "main", "base_ref": "origin/main", "merge_base": "7e71edc0d50443d3db4f0dd72c25238cd7ac1282", "head_commit": "7e71edc0d50443d3db4f0dd72c25238cd7ac1282"}
{"ts": "2026-05-05T14:56:33.343274+08:00", "session_id": "20260505_140029_9903b6", "market": "cn", "formula": "rank(-ts_corr(ret_1d,shift(ret_1d,1),20))*rank(ts_min(ts_sum(amount/circ_market_cap,5),20)/ts_max(ts_sum(amount/circ_market_cap,5),20))", "name": "anti_autocorr_weekly_mcapflow_support_20", "is_ic": 0.0378, "is_ic_ir": 0.452, "is_sharpe": 3.54, "is_turnover": 0.161, "is_monotonicity": 0.5, "gates": "PASS", "status": "candidate", "eval_seconds": 244.8, "decision": "candidate", "session_branch": "main", "base_ref": "origin/main", "merge_base": "7e71edc0d50443d3db4f0dd72c25238cd7ac1282", "head_commit": "7e71edc0d50443d3db4f0dd72c25238cd7ac1282"}
{"ts": "2026-05-05T14:56:33.343274+08:00", "session_id": "20260505_140029_9903b6", "market": "cn", "formula": "rank(-ts_corr(ret_1d,shift(ret_1d,1),20))*rank(ts_mean(ts_mean(volume_ratio,5),20)/ts_max(ts_mean(volume_ratio,5),20))", "name": "anti_autocorr_weekly_relvol_evenness_20", "is_ic": 0.0362, "is_ic_ir": 0.466, "is_sharpe": 2.861, "is_turnover": 0.162, "is_monotonicity": 0.3, "gates": "PASS", "status": "candidate", "eval_seconds": 135.8, "decision": "candidate", "session_branch": "main", "base_ref": "origin/main", "merge_base": "7e71edc0d50443d3db4f0dd72c25238cd7ac1282", "head_commit": "7e71edc0d50443d3db4f0dd72c25238cd7ac1282"}
{"ts": "2026-05-05T14:56:33.343274+08:00", "session_id": "20260505_140029_9903b6", "market": "cn", "formula": "rank(-ts_corr(ret_1d,shift(ret_1d,1),20))*rank(ts_mean(ts_sum(amount,5),20)/ts_max(ts_sum(amount,5),20))", "name": "anti_autocorr_weekly_amount_evenness_20", "is_ic": 0.0367, "is_ic_ir": 0.473, "is_sharpe": 3.934, "is_turnover": 0.167, "is_monotonicity": 0.35, "gates": "PASS", "status": "candidate", "eval_seconds": 150.4, "decision": "candidate", "session_branch": "main", "base_ref": "origin/main", "merge_base": "7e71edc0d50443d3db4f0dd72c25238cd7ac1282", "head_commit": "7e71edc0d50443d3db4f0dd72c25238cd7ac1282"}
{"ts": "2026-05-05T14:56:33.343274+08:00", "session_id": "20260505_140029_9903b6", "market": "cn", "formula": "rank(-ts_max(ret_1d,20))*rank(ts_min(amount/market_cap,20)/ts_mean(amount/market_cap,20))", "name": "low_lottery_mcapflow_support_20", "is_ic": 0.0379, "is_ic_ir": 0.262, "is_sharpe": -0.375, "is_turnover": 0.115, "is_monotonicity": -0.05, "gates": "PASS", "status": "candidate", "eval_seconds": 161.5, "decision": "candidate", "session_branch": "main", "base_ref": "origin/main", "merge_base": "7e71edc0d50443d3db4f0dd72c25238cd7ac1282", "head_commit": "7e71edc0d50443d3db4f0dd72c25238cd7ac1282"}
{"ts": "2026-05-05T14:56:33.343274+08:00", "session_id": "20260505_140029_9903b6", "market": "cn", "formula": "rank(-ts_corr(ret_1d, shift(ret_1d, 1), 20)) * rank(-ts_std(volume_ratio, 20) / ts_std(volume_ratio, 60))", "name": "anti_autocorr_relvol_compress_20_60", "is_ic": 0.0275, "is_ic_ir": 0.208, "is_sharpe": 0.554, "is_turnover": 0.173, "is_monotonicity": 0.0, "gates": "PASS", "status": "candidate", "eval_seconds": 253.8, "decision": "candidate", "session_branch": "main", "base_ref": "origin/main", "merge_base": "7e71edc0d50443d3db4f0dd72c25238cd7ac1282", "head_commit": "7e71edc0d50443d3db4f0dd72c25238cd7ac1282"}
{"ts": "2026-05-05T14:56:33.343274+08:00", "session_id": "20260505_140029_9903b6", "market": "cn", "formula": "rank(-ts_corr(ret_5d,shift(ret_5d,5),20))*rank(ts_min(ts_sum(amount,5),20)/ts_max(ts_sum(amount,5),20))", "name": "anti_autocorr_weekly_amount_support_20", "is_ic": 0.0117, "is_ic_ir": 0.08, "is_sharpe": -1.359, "is_turnover": 0.145, "is_monotonicity": 0.45, "gates": "FAIL", "status": "reverted", "eval_seconds": 186.6, "decision": "revert", "session_branch": "main", "base_ref": "origin/main", "merge_base": "7e71edc0d50443d3db4f0dd72c25238cd7ac1282", "head_commit": "7e71edc0d50443d3db4f0dd72c25238cd7ac1282"}
{"ts": "2026-05-06T06:57:52.927825+08:00", "session_id": "20260506_060002_3a2ce6", "market": "cn", "formula": "rank(-ts_max(ret_1d,20))*rank(ts_min(turnover_rate,5)/ts_mean(turnover_rate,20))", "name": "low_lottery_weekly_turnover_floor", "is_ic": 0.0253, "is_ic_ir": 0.184, "is_sharpe": -2.427, "is_turnover": 0.187, "is_monotonicity": -0.05, "gates": "FAIL", "status": "reverted", "eval_seconds": 147.8, "decision": "revert", "session_branch": "main", "base_ref": "origin/main", "merge_base": "0f85d5996390cb003536dacf895618eda74b9333", "head_commit": "0f85d5996390cb003536dacf895618eda74b9333"}
{"ts": "2026-05-06T06:57:52.927825+08:00", "session_id": "20260506_060002_3a2ce6", "market": "cn", "formula": "rank(-ts_corr(ret_1d,shift(ret_1d,1),20))*rank(ts_mean(turnover_rate,20)/ts_max(turnover_rate,20))", "name": "anti_autocorr_turnover_evenness_20", "is_ic": 0.0341, "is_ic_ir": 0.458, "is_sharpe": 2.258, "is_turnover": 0.174, "is_monotonicity": 0.25, "gates": "PASS", "status": "candidate", "eval_seconds": 167.9, "decision": "candidate", "session_branch": "main", "base_ref": "origin/main", "merge_base": "0f85d5996390cb003536dacf895618eda74b9333", "head_commit": "0f85d5996390cb003536dacf895618eda74b9333"}
{"ts": "2026-05-06T06:57:52.927825+08:00", "session_id": "20260506_060002_3a2ce6", "market": "cn", "formula": "rank(-ts_corr(ret_1d,shift(ret_1d,1),20))*rank(ts_mean(ts_sum(amount/market_cap,5),20)/ts_std(ts_sum(amount/market_cap,5),20))", "name": "anti_autocorr_weekly_mcapflow_stability_20", "is_ic": 0.0364, "is_ic_ir": 0.452, "is_sharpe": 3.305, "is_turnover": 0.151, "is_monotonicity": 0.65, "gates": "PASS", "status": "candidate", "eval_seconds": 81.9, "decision": "candidate", "session_branch": "main", "base_ref": "origin/main", "merge_base": "0f85d5996390cb003536dacf895618eda74b9333", "head_commit": "0f85d5996390cb003536dacf895618eda74b9333"}
{"ts": "2026-05-06T06:57:52.927825+08:00", "session_id": "20260506_060002_3a2ce6", "market": "cn", "formula": "rank(-ts_corr(ret_1d,shift(ret_1d,1),20))*rank(ts_min(ts_sum(amount/market_cap,5),20)/ts_std(ts_sum(amount/market_cap,5),20))", "name": "anti_autocorr_weekly_mcap_floorstd_20", "is_ic": 0.0372, "is_ic_ir": 0.445, "is_sharpe": 3.949, "is_turnover": 0.151, "is_monotonicity": 0.6, "gates": "PASS", "status": "candidate", "eval_seconds": 210.7, "decision": "candidate", "session_branch": "main", "base_ref": "origin/main", "merge_base": "0f85d5996390cb003536dacf895618eda74b9333", "head_commit": "0f85d5996390cb003536dacf895618eda74b9333"}
{"ts": "2026-05-06T06:57:52.927825+08:00", "session_id": "20260506_060002_3a2ce6", "market": "cn", "formula": "rank(-ts_max(ret_1d,20))*rank(ts_mean(ts_sum(amount/circ_market_cap,5),20)/ts_std(ts_sum(amount/circ_market_cap,5),20))", "name": "low_lottery_weekly_mcapflow_stability_20", "is_ic": 0.0369, "is_ic_ir": 0.241, "is_sharpe": 0.262, "is_turnover": 0.09, "is_monotonicity": -0.05, "gates": "PASS", "status": "candidate", "eval_seconds": 168.2, "decision": "candidate", "session_branch": "main", "base_ref": "origin/main", "merge_base": "0f85d5996390cb003536dacf895618eda74b9333", "head_commit": "0f85d5996390cb003536dacf895618eda74b9333"}
{"ts": "2026-05-06T06:57:52.927825+08:00", "session_id": "20260506_060002_3a2ce6", "market": "cn", "formula": "rank(-ts_corr(amount/circ_market_cap,shift(amount/circ_market_cap,5),20))*rank(ts_mean(turnover_rate,20)/ts_max(turnover_rate,20))", "name": "anti_autocorr_mcap_even_turnover_20", "is_ic": 0.0118, "is_ic_ir": 0.128, "is_sharpe": -1.432, "is_turnover": 0.167, "is_monotonicity": 0.4, "gates": "FAIL", "status": "reverted", "eval_seconds": 59.1, "decision": "revert", "session_branch": "main", "base_ref": "origin/main", "merge_base": "0f85d5996390cb003536dacf895618eda74b9333", "head_commit": "0f85d5996390cb003536dacf895618eda74b9333"}
{"ts": "2026-05-06T06:57:52.927825+08:00", "session_id": "20260506_060002_3a2ce6", "market": "cn", "formula": "rank(-ts_max(ret_1d,20))*rank(ts_min(ts_sum(amount/circ_market_cap,5),20)/ts_std(ts_sum(amount/circ_market_cap,5),20))", "name": "low_lottery_weekly_mcap_floorstd_20", "is_ic": 0.0369, "is_ic_ir": 0.241, "is_sharpe": -0.002, "is_turnover": 0.089, "is_monotonicity": -0.05, "gates": "PASS", "status": "candidate", "eval_seconds": 146.2, "decision": "candidate", "session_branch": "main", "base_ref": "origin/main", "merge_base": "0f85d5996390cb003536dacf895618eda74b9333", "head_commit": "0f85d5996390cb003536dacf895618eda74b9333"}
{"ts": "2026-05-06T06:57:52.927825+08:00", "session_id": "20260506_060002_3a2ce6", "market": "cn", "formula": "rank(-ts_corr(close,volume,20))*rank(ts_mean(amount,20)/ts_std(amount,20))", "name": "quiet_accumulation_amount_stability_20", "is_ic": 0.0393, "is_ic_ir": 0.29, "is_sharpe": 0.232, "is_turnover": 0.138, "is_monotonicity": 0.3, "gates": "PASS", "status": "checks_failed", "eval_seconds": 99.9, "decision": "revert", "session_branch": "main", "base_ref": "origin/main", "merge_base": "0f85d5996390cb003536dacf895618eda74b9333", "head_commit": "0f85d5996390cb003536dacf895618eda74b9333", "oos": "PASS", "checks_status": "failed"}
{"ts": "2026-05-06T06:57:52.927825+08:00", "session_id": "20260506_060002_3a2ce6", "market": "cn", "formula": "rank(-ts_corr(ret_1d,shift(ret_1d,1),20))*rank(ts_min(ts_sum(amount/circ_market_cap,5),20)/ts_std(ts_sum(amount/circ_market_cap,5),20))", "name": "anti_autocorr_weekly_float_floorstd_20", "is_ic": 0.0367, "is_ic_ir": 0.44, "is_sharpe": 3.947, "is_turnover": 0.151, "is_monotonicity": 0.6, "gates": "PASS", "status": "candidate", "eval_seconds": 185.3, "decision": "candidate", "session_branch": "main", "base_ref": "origin/main", "merge_base": "0f85d5996390cb003536dacf895618eda74b9333", "head_commit": "0f85d5996390cb003536dacf895618eda74b9333"}
{"ts": "2026-05-06T06:57:52.927825+08:00", "session_id": "20260506_060002_3a2ce6", "market": "cn", "formula": "rank(-ts_max(ret_1d,20))*rank(ts_min(ts_sum(amount,5)/circ_market_cap,20)/ts_std(ts_sum(amount,5)/circ_market_cap,20))", "name": "low_lottery_weekly_float_floorstd_20", "is_ic": 0.0364, "is_ic_ir": 0.242, "is_sharpe": 0.267, "is_turnover": 0.091, "is_monotonicity": -0.1, "gates": "PASS", "status": "candidate", "eval_seconds": 83.2, "decision": "candidate", "session_branch": "main", "base_ref": "origin/main", "merge_base": "0f85d5996390cb003536dacf895618eda74b9333", "head_commit": "0f85d5996390cb003536dacf895618eda74b9333"}
{"ts": "2026-05-06T06:57:52.927825+08:00", "session_id": "20260506_060002_3a2ce6", "market": "cn", "formula": "rank(-ts_corr(ret_1d,shift(ret_1d,1),20))*rank(-ts_corr(delta(amount/circ_market_cap,5),high/low-1,20))", "name": "anti_autocorr_float_range_absorb_20", "is_ic": 0.0307, "is_ic_ir": 0.356, "is_sharpe": 0.581, "is_turnover": 0.204, "is_monotonicity": 0.5, "gates": "PASS", "status": "candidate", "eval_seconds": 147.4, "decision": "candidate", "session_branch": "main", "base_ref": "origin/main", "merge_base": "0f85d5996390cb003536dacf895618eda74b9333", "head_commit": "0f85d5996390cb003536dacf895618eda74b9333"}
{"ts": "2026-05-06T06:57:52.927825+08:00", "session_id": "20260506_060002_3a2ce6", "market": "cn", "formula": "rank(-ts_corr(ret_1d,shift(ret_1d,1),20))*rank(ts_min(volume_ratio,20)/ts_mean(volume_ratio,20))", "name": "anti_autocorr_relvol_floor_20", "is_ic": 0.0303, "is_ic_ir": 0.341, "is_sharpe": 0.947, "is_turnover": 0.18, "is_monotonicity": 0.25, "gates": "PASS", "status": "candidate", "eval_seconds": 133.3, "decision": "candidate", "session_branch": "main", "base_ref": "origin/main", "merge_base": "0f85d5996390cb003536dacf895618eda74b9333", "head_commit": "0f85d5996390cb003536dacf895618eda74b9333"}
{"ts": "2026-05-06T06:57:52.927825+08:00", "session_id": "20260506_060002_3a2ce6", "market": "cn", "formula": "rank(-ts_corr(ret_1d,shift(ret_1d,1),20))*rank(ts_min(close/open,20)/ts_std(close/open,20))", "name": "anti_autocorr_openclose_floorstd_20", "is_ic": 0.0416, "is_ic_ir": 0.331, "is_sharpe": 0.784, "is_turnover": 0.15, "is_monotonicity": 0.0, "gates": "PASS", "status": "checks_failed", "eval_seconds": 161.3, "decision": "revert", "session_branch": "main", "base_ref": "origin/main", "merge_base": "0f85d5996390cb003536dacf895618eda74b9333", "head_commit": "0f85d5996390cb003536dacf895618eda74b9333", "oos": "PASS", "checks_status": "failed"}
{"ts": "2026-05-06T06:57:52.927825+08:00", "session_id": "20260506_060002_3a2ce6", "market": "cn", "formula": "rank(ts_min(ts_mean(turnover_rate,5),20)/ts_max(ts_mean(turnover_rate,5),20))", "name": "weekly_turnover_corridor_20", "is_ic": 0.0282, "is_ic_ir": 0.275, "is_sharpe": 0.411, "is_turnover": 0.107, "is_monotonicity": 0.75, "gates": "PASS", "status": "candidate", "eval_seconds": 164.2, "decision": "candidate", "session_branch": "main", "base_ref": "origin/main", "merge_base": "0f85d5996390cb003536dacf895618eda74b9333", "head_commit": "0f85d5996390cb003536dacf895618eda74b9333"}
{"ts": "2026-05-06T06:57:52.927825+08:00", "session_id": "20260506_060002_3a2ce6", "market": "cn", "formula": "rank(-ts_corr(ret_1d,shift(ret_1d,1),20))*rank(ts_min(ts_sum(amount,5),20)/ts_std(ts_sum(amount,5),20))", "name": "anti_autocorr_weekly_amount_floorstd_20", "is_ic": 0.035, "is_ic_ir": 0.423, "is_sharpe": 3.897, "is_turnover": 0.149, "is_monotonicity": 0.3, "gates": "PASS", "status": "candidate", "eval_seconds": 178.9, "decision": "candidate", "session_branch": "main", "base_ref": "origin/main", "merge_base": "0f85d5996390cb003536dacf895618eda74b9333", "head_commit": "0f85d5996390cb003536dacf895618eda74b9333"}
