{"ts": "2026-05-19T07:24:13.107689+08:00", "session_id": "20260519_062703_3d7e37", "market": "cn", "formula": "rank(ts_mean(sign(ret_1d),20))*rank(-ts_std(turnover_rate,20))", "name": "upday_turnover_stability_20", "is_ic": 0.0, "is_ic_ir": 0.0, "is_sharpe": 0.0, "is_turnover": 0.0, "is_monotonicity": 0.0, "gates": "FAIL", "status": "reverted", "eval_seconds": 121.4, "sleeve_id": "cn_ai_accumulation", "mispricing_source": "The market underreacts to slow, non-headline accumulation in scarce AI-infra leaders and overreacts to noisy spikes, so orderly leaders stay underowned for another 10-20 trading days.", "forced_counterparty": "Short-horizon retail profit takers and benchmark-constrained institutions trimming into gradual rallies.", "data_requirements": "[\"daily OHLCV\",\"turnover_rate from daily_basic\",\"ai_infra CN universe membership/BFS metadata\",\"CSI300/ChiNext benchmark returns and existing sleeve correlation matrix for beta-hedged promotion\"]", "failure_mode": "Fails in sharp mean-reversion or policy-gap regimes where returns come from one-off jumps instead of steady accumulation, and when turnover becomes event-driven rather than absorption-driven.", "report_contract": "fresh_buy_gate", "ai_supercycle_layer": "none", "supply_chain_hypothesis": "Candidate D1-D3 AI-infra bottleneck names should show stair-step accumulation before source-reviewed backlog, capex, or order evidence is broadly recognized.", "relationship_evidence_required": "true", "money_readiness": "money_candidate", "decision": "revert", "session_branch": "main", "base_ref": "origin/main", "merge_base": "cba2bf7038911f7fc6f17786240fd0ea6749fcda", "head_commit": "cba2bf7038911f7fc6f17786240fd0ea6749fcda"}
{"ts": "2026-05-19T07:24:13.107689+08:00", "session_id": "20260519_062703_3d7e37", "market": "cn", "formula": "rank(-ts_std(amount,20) / ts_mean(amount,20)) * rank(ret_20d - ret_5d)", "name": "amount_stable_pullback_20", "is_ic": 0.0, "is_ic_ir": 0.0, "is_sharpe": 0.0, "is_turnover": 0.0, "is_monotonicity": 0.0, "gates": "FAIL", "status": "reverted", "eval_seconds": 86.7, "sleeve_id": "cn_ai_accumulation_pullback", "mispricing_source": "This is not a pure momentum clone because it conditions medium-term strength on low dispersion in traded value, isolating orderly consolidation rather than crowded chase behavior.", "forced_counterparty": "benchmarked mutual funds and fast theme traders trimming recent weakness under T+1 and liquidity constraints", "data_requirements": "[\"No extra data for first-pass CN tape backtest\", \"Promote only with beta-hedged sleeve attribution, factor-correlation check, and ai_infra evidence-state join\"]", "failure_mode": "It stops working when AI theme leadership breaks at the regime level, or when stable amount reflects illiquidity/stale attention instead of real absorption.", "report_contract": "fresh_buy_gate", "ai_supercycle_layer": "ai_networking_optical_cpo", "supply_chain_hypothesis": "Within validated CN AI networking/optical bottleneck names, leaders that pull back on stable traded value are being reloaded ahead of the next demand repricing wave rather than structurally de-rated.", "relationship_evidence_required": "false", "money_readiness": "money_candidate", "decision": "revert", "session_branch": "main", "base_ref": "origin/main", "merge_base": "cba2bf7038911f7fc6f17786240fd0ea6749fcda", "head_commit": "cba2bf7038911f7fc6f17786240fd0ea6749fcda"}
{"ts": "2026-05-19T07:24:13.107689+08:00", "session_id": "20260519_062703_3d7e37", "market": "cn", "formula": "rank(ts_corr(ret_5d, shift(ret_5d, 5), 20)) * rank(-ts_std(turnover_rate, 20) / (ts_std(turnover_rate, 120) + 0.01))", "name": "weekly_autocorr_turnover_regime_20_120", "is_ic": 0.0, "is_ic_ir": 0.0, "is_sharpe": 0.0, "is_turnover": 0.0, "is_monotonicity": 0.0, "gates": "FAIL", "status": "reverted", "eval_seconds": 164.5, "sleeve_id": "cn_ai_infra_flow_quality", "mispricing_source": "Underreaction in bottleneck AI-infra names where fundamental repricing is gradual and sponsorship builds before consensus upgrades.", "forced_counterparty": "Theme-chasing retail flow and benchmark-aware mutual funds that rotate on visible volume spikes rather than warehouse quiet leaders early.", "data_requirements": "[\"daily CN price/volume/daily_basic already available for IS test\", \"beta-hedged sleeve return vs 000300.SH and 399006.SZ\", \"rolling corr to kshadow_5 and promoted flow sleeves\", \"filings/press releases if any supplier/customer link is later claimed\"]", "failure_mode": "It stops working when the whole AI-infra tape becomes speculative and turnover expands broadly, or when policy/news shocks dominate with gap-driven moves instead of steady weekly underreaction.", "report_contract": "fresh_buy_gate", "ai_supercycle_layer": "ai_chip_equipment_materials_packaging", "supply_chain_hypothesis": "Domestic advanced-packaging and chip-equipment bottleneck names may show quiet weekly continuation before backlog and capex evidence is fully confirmed, with possible spillover to optical/datacenter adjacencies.", "relationship_evidence_required": "true", "money_readiness": "money_candidate", "decision": "revert", "session_branch": "main", "base_ref": "origin/main", "merge_base": "cba2bf7038911f7fc6f17786240fd0ea6749fcda", "head_commit": "cba2bf7038911f7fc6f17786240fd0ea6749fcda"}
{"ts": "2026-05-19T07:24:13.107689+08:00", "session_id": "20260519_062703_3d7e37", "market": "cn", "formula": "rank(ts_mean(amount/circ_market_cap,20)/ts_max(amount/circ_market_cap,20))*rank(-ts_max(ret_1d,20))", "name": "float_even_lowlottery_20", "is_ic": 0.0, "is_ic_ir": 0.0, "is_sharpe": 0.0, "is_turnover": 0.0, "is_monotonicity": 0.0, "gates": "FAIL", "status": "reverted", "eval_seconds": 199.0, "sleeve_id": "float_flow_underreaction", "mispricing_source": "Underreaction to steady float-normalized accumulation plus lottery-preference overpricing of spike names; this is a flow-quality/ownership-transfer signal, not a close-only momentum clone.", "forced_counterparty": "Retail attention traders chasing recent spike days, plus benchmark-constrained long-only funds that must scale into positions over multiple sessions rather than clear the mispricing immediately.", "data_requirements": "[\"amount\",\"circ_market_cap\",\"ret_1d\"]; before promotion require beta-hedged sleeve attribution vs 000300.SH and 399006.SZ, residual risk attribution, and correlation vs promoted sleeves; any supplier/order narrative still needs filings, official PRs, transcripts, or verified news.", "failure_mode": "Fails in policy-squeeze or speculative mania regimes where one-day spike winners keep trending and even float flow is just dull liquidity rather than informed accumulation.", "report_contract": "fresh_buy_gate", "ai_supercycle_layer": "ai_chip_equipment_materials_packaging", "supply_chain_hypothesis": "Validated CN semicap, materials, packaging, and test bottleneck names should show even float-adjusted participation without lottery-like spike days before backlog, qualification, or order evidence is fully priced.", "relationship_evidence_required": "true", "money_readiness": "money_candidate", "decision": "revert", "session_branch": "main", "base_ref": "origin/main", "merge_base": "cba2bf7038911f7fc6f17786240fd0ea6749fcda", "head_commit": "cba2bf7038911f7fc6f17786240fd0ea6749fcda"}
{"ts": "2026-05-19T07:24:13.107689+08:00", "session_id": "20260519_062703_3d7e37", "market": "cn", "formula": "rank(-ts_corr(turnover_rate,shift(turnover_rate,5),20))*rank(ts_min(turnover_rate,20)/ts_mean(turnover_rate,20))", "name": "turnover_floor_anti_autocorr_20", "is_ic": 0.0, "is_ic_ir": 0.0, "is_sharpe": 0.0, "is_turnover": 0.0, "is_monotonicity": 0.0, "gates": "FAIL", "status": "reverted", "eval_seconds": 264.3, "sleeve_id": "daily_flow_accumulation", "mispricing_source": "Daily leaderboards reward visible spikes, but they miss names where institutions keep rebuilding bids after each turnover burst; this is a flow-cadence signal, not a pure price-shadow clone of an existing factor.", "forced_counterparty": "Retail thematic chasers and short-horizon profit takers selling into quiet weeks; liquidity-constrained institutions scaling in over time.", "data_requirements": "[\"current daily turnover_rate is sufficient for IS test\",\"for promotion: beta-hedged sleeve attribution vs 000300.SH and 399006.SZ\",\"sleeve correlation and drawdown stats\",\"ai_infra source-review metadata for layer tagging\"]", "failure_mode": "Breaks in one-way policy beta rallies or panic deleveraging, when turnover floors reflect crowding/distribution instead of patient accumulation.", "report_contract": "setup_overlay", "ai_supercycle_layer": "ai_networking_optical_cpo", "supply_chain_hypothesis": "Candidate AI optical/interconnect bottleneck suppliers should show replenishing turnover floors and alternating weekly turnover as funds build positions before order or backlog confirmation reaches filings or official releases.", "relationship_evidence_required": "true", "money_readiness": "research_only", "decision": "revert", "session_branch": "main", "base_ref": "origin/main", "merge_base": "cba2bf7038911f7fc6f17786240fd0ea6749fcda", "head_commit": "cba2bf7038911f7fc6f17786240fd0ea6749fcda"}
{"ts": "2026-05-19T07:24:13.107689+08:00", "session_id": "20260519_062703_3d7e37", "market": "cn", "formula": "rank(-ts_std(pct_change(amount/circ_market_cap,5),20))*rank(ts_min(turnover_rate,20)/ts_mean(turnover_rate,20))", "name": "weekly_floatchg_turnover_floor_20", "is_ic": 0.0, "is_ic_ir": 0.0, "is_sharpe": 0.0, "is_turnover": 0.0, "is_monotonicity": 0.0, "gates": "FAIL", "status": "reverted", "eval_seconds": 201.0, "sleeve_id": "cn_ai_infra_flow_absorption", "mispricing_source": "Underreaction to gradual float-normalized accumulation; the market overweights visible spike days and underweights steady replenishment of demand across multiple weeks.", "forced_counterparty": "Retail theme traders, benchmark-constrained mutual funds, and liquidity/rebalance sellers who trade for mandate or cash-flow reasons rather than 10-20 day alpha.", "data_requirements": "[\"amount\",\"circ_market_cap\",\"turnover_rate\",\"beta-hedged sleeve attribution vs 000300.SH and 399006.SZ before promotion\",\"rolling correlation vs existing CN sleeves\",\"ai_infra source-review evidence before any supplier/order narrative\"]", "failure_mode": "Fails in policy-beta melt-up or liquidation regimes where bursty turnover is genuinely informative, or when turnover floors reflect crowded exits instead of informed accumulation.", "report_contract": "fresh_buy_gate", "ai_supercycle_layer": "ai_chip_equipment_materials_packaging", "supply_chain_hypothesis": "Within the validated CN AI universe, semicap/equipment/materials/advanced-packaging names tied to AI capacity bottlenecks should show smooth weekly float-flow change plus a persistent turnover floor before filings or order news confirm the bottleneck.", "relationship_evidence_required": "true", "money_readiness": "money_candidate", "decision": "revert", "session_branch": "main", "base_ref": "origin/main", "merge_base": "cba2bf7038911f7fc6f17786240fd0ea6749fcda", "head_commit": "cba2bf7038911f7fc6f17786240fd0ea6749fcda"}
{"ts": "2026-05-19T07:24:13.107689+08:00", "session_id": "20260519_062703_3d7e37", "market": "cn", "formula": "rank(ret_20d)*rank(-ts_std(volume_ratio,20))", "name": "quiet_leadership_20", "is_ic": 0.0, "is_ic_ir": 0.0, "is_sharpe": 0.0, "is_turnover": 0.0, "is_monotonicity": 0.0, "gates": "FAIL", "status": "reverted", "eval_seconds": 112.1, "sleeve_id": "cn_ai_infra_flow_quality", "mispricing_source": "The payoff comes from ownership transfer quality, not raw price alone; a positive 20-day trend with low `volume_ratio` dispersion suggests persistent sponsorship and tighter float rather than noisy breakout chasing.", "forced_counterparty": "short-horizon retail theme traders and benchmarked managers waiting for high-volume confirmation", "data_requirements": "[\"daily OHLCV\", \"volume_ratio\", \"ret_20d\", \"ai_infra CN universe membership\", \"beta-hedge attribution vs 000300.SH/399006.SZ\", \"sleeve correlation history\"]", "failure_mode": "It should fail when the market rewards only high-turnover speculative bursts, or when true leadership requires expanding turnover to validate breakouts rather than quiet accumulation.", "report_contract": "setup_overlay", "ai_supercycle_layer": "ai_chip_equipment_materials_packaging", "supply_chain_hypothesis": "Candidate AI chip equipment/materials/packaging bottleneck suppliers in the reviewed CN universe should show orderly 20-day leadership with low volume-ratio dispersion before broader theme participation catches up.", "relationship_evidence_required": "true", "money_readiness": "research_only", "decision": "revert", "session_branch": "main", "base_ref": "origin/main", "merge_base": "cba2bf7038911f7fc6f17786240fd0ea6749fcda", "head_commit": "cba2bf7038911f7fc6f17786240fd0ea6749fcda"}
{"ts": "2026-05-19T07:24:13.107689+08:00", "session_id": "20260519_062703_3d7e37", "market": "cn", "formula": "rank(-ts_corr(ret_1d,shift(ret_1d,1),20))*rank(ts_min(ts_sum(amount/circ_market_cap,5),20)/ts_max(ts_sum(amount/circ_market_cap,5),20))", "name": "weekly_float_corridor_absorb_20", "is_ic": 0.0, "is_ic_ir": 0.0, "is_sharpe": 0.0, "is_turnover": 0.0, "is_monotonicity": 0.0, "gates": "FAIL", "status": "reverted", "eval_seconds": 189.1, "sleeve_id": "cn_ai_flow_absorption", "mispricing_source": "Underreaction to institutional accumulation inside crowded AI themes; the market overweights noisy daily reversals and underweights the persistence of weekly capital commitment versus float.", "forced_counterparty": "Retail T+1 traders, short-horizon theme rotators, and benchmark huggers trimming into noise rather than underwriting multi-week AI capex repricing.", "data_requirements": "[\"daily close\",\"ret_1d\",\"amount\",\"circ_market_cap\",\"ai_infra source-reviewed CN universe filter\",\"beta-hedge return and residual risk attribution before promotion\"]", "failure_mode": "This stops working when the tape shifts to pure momentum-chase or event-gap regimes, or when weekly flow corridors reflect illiquidity/stagnation instead of active institutional absorption.", "report_contract": "fresh_buy_gate", "ai_supercycle_layer": "ai_chip_equipment_materials_packaging", "supply_chain_hypothesis": "Domestic AI capex bottleneck names in semicap equipment, materials, and packaging/testing should exhibit steady weekly float-flow corridors before filings or order evidence are fully capitalized by the market.", "relationship_evidence_required": "true", "money_readiness": "money_candidate", "decision": "revert", "session_branch": "main", "base_ref": "origin/main", "merge_base": "cba2bf7038911f7fc6f17786240fd0ea6749fcda", "head_commit": "cba2bf7038911f7fc6f17786240fd0ea6749fcda"}
{"ts": "2026-05-19T07:24:13.107689+08:00", "session_id": "20260519_062703_3d7e37", "market": "cn", "formula": "rank(ts_mean(amount,20)/ts_std(amount,20))*rank(ret_20d)", "name": "amount_stability_momentum_20", "is_ic": 0.0, "is_ic_ir": 0.0, "is_sharpe": 0.0, "is_turnover": 0.0, "is_monotonicity": 0.0, "gates": "FAIL", "status": "reverted", "eval_seconds": 20.3, "sleeve_id": "cn_ai_leadership_accumulation", "mispricing_source": "The market underweights stable institutional accumulation inside crowded thematic sectors and overfocuses on noisy daily headlines and limit-up style bursts.", "forced_counterparty": "Short-horizon retail traders and benchmarked fast money that rotate out after low-excitement trending tapes.", "data_requirements": "[\"daily amount\",\"daily returns\",\"beta-hedged sleeve attribution\",\"correlation to existing sleeves\",\"future if promoted: verified ai_infra source-review status per ticker\"]", "failure_mode": "Stops working when AI themes become purely liquidity-driven and leadership shifts to high-churn speculative squeezes instead of steady accumulation.", "report_contract": "fresh_buy_gate", "ai_supercycle_layer": "ai_chip_equipment_materials_packaging", "supply_chain_hypothesis": "Detects tape-level accumulation in domestic bottleneck suppliers that the AI compute buildout pulls forward, without asserting any unverified supplier/customer link.", "relationship_evidence_required": "true", "money_readiness": "money_candidate", "decision": "revert", "session_branch": "main", "base_ref": "origin/main", "merge_base": "cba2bf7038911f7fc6f17786240fd0ea6749fcda", "head_commit": "cba2bf7038911f7fc6f17786240fd0ea6749fcda"}
{"ts": "2026-05-19T07:24:13.107689+08:00", "session_id": "20260519_062703_3d7e37", "market": "cn", "formula": "rank(-ts_std(amount,20)/ts_std(amount,60))", "name": "amount_vol_compress_20_60", "is_ic": 0.0, "is_ic_ir": 0.0, "is_sharpe": 0.0, "is_turnover": 0.0, "is_monotonicity": 0.0, "gates": "FAIL", "status": "reverted", "eval_seconds": 200.6, "sleeve_id": "daily_price_overlay", "mispricing_source": "Post-spike ownership cleanup is underpriced; retail/theme traders read quieter activity as story decay, while slower capital uses it to accumulate validated AI names with less price impact.", "forced_counterparty": "Retail theme chasers and short-horizon momentum traders exiting when headline intensity fades", "data_requirements": "[\"ai_infra source-review status and BFS metadata for ranked names\",\"beta-hedged sleeve return vs 000300.SH and 399006.SZ\",\"rolling correlation to kshadow_5 and other active CN sleeves\",\"10-20d hold turnover and residual risk attribution\"]", "failure_mode": "It fails when falling amount reflects genuine demand withdrawal or broad policy-beta/liquidity shocks, not constructive ownership compression.", "report_contract": "setup_overlay", "ai_supercycle_layer": "none", "supply_chain_hypothesis": "Cross-layer AI bottleneck names that keep orderly amount compression after an attention spike are more likely to be real supercycle leaders than noisy second-derivative followers; any specific supplier/customer claim still needs source review.", "relationship_evidence_required": "true", "money_readiness": "research_only", "decision": "revert", "session_branch": "main", "base_ref": "origin/main", "merge_base": "cba2bf7038911f7fc6f17786240fd0ea6749fcda", "head_commit": "cba2bf7038911f7fc6f17786240fd0ea6749fcda"}
{"ts": "2026-05-19T07:24:13.107689+08:00", "session_id": "20260519_062703_3d7e37", "market": "cn", "formula": "rank(close/ts_max(high,20))*rank(ts_sum(turnover_rate,20)/ts_max(turnover_rate,20))", "name": "nearhigh_turnover_uniformity_20", "is_ic": 0.0, "is_ic_ir": 0.0, "is_sharpe": 0.0, "is_turnover": 0.0, "is_monotonicity": 0.0, "gates": "FAIL", "status": "reverted", "eval_seconds": 147.5, "sleeve_id": "cn_ai_tape_leadership", "mispricing_source": "The market overpays for one-day AI excitement but underprices slow multi-day absorption in upstream bottleneck names that are still being accumulated.", "forced_counterparty": "Benchmark-aware mutual funds and short-horizon retail traders who chase spike days or trim winners too early", "data_requirements": "[\"daily price+turnover_rate is sufficient for IS test\",\"beta-hedged sleeve attribution vs 000300.SH and 399006.SZ\",\"corr check vs turnover_stability_20 and other turnover-uniformity sleeves\",\"source review before naming any specific supplier/customer link\"]", "failure_mode": "It should fail in violent mean-reversion or policy-shock regimes where near-high tape is exhaustion and one-day spike behavior dominates sector leadership.", "report_contract": "fresh_buy_gate", "ai_supercycle_layer": "ai_chip_equipment_materials_packaging", "supply_chain_hypothesis": "Orderly near-high tape should preferentially surface CN chip-equipment, materials, and advanced-packaging beneficiaries absorbing AI accelerator/HBM/datacenter capex spillover.", "relationship_evidence_required": "true", "money_readiness": "money_candidate", "decision": "revert", "session_branch": "main", "base_ref": "origin/main", "merge_base": "cba2bf7038911f7fc6f17786240fd0ea6749fcda", "head_commit": "cba2bf7038911f7fc6f17786240fd0ea6749fcda"}
{"ts": "2026-05-19T07:24:13.107689+08:00", "session_id": "20260519_062703_3d7e37", "market": "cn", "formula": "rank(ret_20d/clamp(ps_ttm,0.5,20))", "name": "low_ps_leadership_20", "is_ic": 0.0, "is_ic_ir": 0.0, "is_sharpe": 0.0, "is_turnover": 0.0, "is_monotonicity": 0.0, "gates": "FAIL", "status": "reverted", "eval_seconds": 143.5, "sleeve_id": "cn_ai_value_leadership", "mispricing_source": "Valuation rerating lags tape confirmation for AI-infra suppliers; the market overpays for obvious stories and underreacts to cheaper names where demand is only starting to show up in price.", "forced_counterparty": "Retail theme chasers and benchmarked long-only funds that are slow to rotate into lower-multiple upstream beneficiaries.", "data_requirements": "[\"current CN daily price/volume/daily_basic are sufficient for first-pass IS test\", \"before promotion: beta-hedge return, residual return, sleeve drawdown, and correlation ledger\", \"if a supplier/customer interpretation is used: filings, official PRs, transcripts, and ai_infra evidence-card confirmation\"]", "failure_mode": "Fails when speculative high-multiple beta dominates the tape or when low-multiple names are cheap for real fundamental reasons and rerating never arrives.", "report_contract": "setup_overlay", "ai_supercycle_layer": "ai_chip_equipment_materials_packaging", "supply_chain_hypothesis": "Domestic semicap, materials, packaging, and adjacent bottleneck suppliers can show early tape leadership while still screening cheap on sales before order visibility becomes consensus.", "relationship_evidence_required": "true", "money_readiness": "research_only", "decision": "revert", "session_branch": "main", "base_ref": "origin/main", "merge_base": "cba2bf7038911f7fc6f17786240fd0ea6749fcda", "head_commit": "cba2bf7038911f7fc6f17786240fd0ea6749fcda"}
