{"ts": "2026-05-21T14:55:05.681559+08:00", "session_id": "20260521_140002_d2b4fa", "market": "cn", "formula": "rank(ts_corr(ret_1d,log(amount+1),20))", "name": "upflow_sponsorship_20", "is_ic": -0.0198, "is_ic_ir": -0.119, "is_sharpe": -3.812, "is_turnover": 0.201, "is_monotonicity": -0.5, "gates": "FAIL", "status": "reverted", "eval_seconds": 172.6, "sleeve_id": "cn_ai_flow_sponsorship", "mispricing_source": "Slow institutional accumulation and benchmark inertia let flow-backed AI bottleneck leaders keep rerating over the 10-20 day horizon after sponsorship first appears in tape.", "forced_counterparty": "Retail profit-takers and benchmark-constrained funds that are late to build positions in emerging AI-infra leaders.", "data_requirements": "[\"daily CN tape and amount (available for IS)\",\"benchmark beta-hedged sleeve attribution\",\"correlation to promoted sleeves\",\"source-review evidence before naming any specific supplier/customer link\"]", "failure_mode": "It breaks in crowded policy/theme blowoffs, where high up-day amount is distribution or speculative churn rather than genuine accumulation.", "report_contract": "research_only", "ai_supercycle_layer": "ai_networking_optical_cpo", "supply_chain_hypothesis": "Order anticipation in optical/interconnect bottlenecks should first appear as repeated up-day CNY sponsorship before fully confirmed revenue or backlog evidence diffuses through the market.", "relationship_evidence_required": "true", "money_readiness": "research_only", "decision": "revert", "session_branch": "main", "base_ref": "origin/main", "merge_base": "c550618668ba3d3ec82401f36dd85be095d0fc92", "head_commit": "c550618668ba3d3ec82401f36dd85be095d0fc92"}
{"ts": "2026-05-21T14:55:05.681559+08:00", "session_id": "20260521_140002_d2b4fa", "market": "cn", "formula": "rank(ts_mean(turnover_rate,20)/ts_max(turnover_rate,20))*rank(-ts_mean(high/low-1,10))", "name": "even_turnover_tight_range_20", "is_ic": -0.0823, "is_ic_ir": -0.272, "is_sharpe": -4.981, "is_turnover": 0.161, "is_monotonicity": -0.75, "gates": "FAIL", "status": "reverted", "eval_seconds": 260.2, "sleeve_id": "cn_ai_flow_quality", "mispricing_source": "Attention-driven preference for visible breakout tapes causes underreaction to quiet, even turnover accumulation in bottleneck AI-infra names.", "forced_counterparty": "retail theme chasers and short-horizon momentum funds", "data_requirements": "[\"daily OHLC\", \"turnover_rate\", \"AI-infra universe membership\", \"benchmark series for beta-hedged attribution\", \"sleeve correlation/risk report versus existing promoted factors\"]", "failure_mode": "It should weaken when the market rewards one-day high-range speculation and policy/news gaps keep extending instead of mean-reverting into steady sponsorship.", "report_contract": "setup_overlay", "ai_supercycle_layer": "ai_chip_equipment_materials_packaging", "supply_chain_hypothesis": "Steady even-turnover plus tight-range names are candidate D1-D3 bottleneck suppliers in domestic AI compute buildout, especially packaging/testing and adjacent equipment, where capital accumulates before verified capacity/order evidence is broadly recognized.", "relationship_evidence_required": "true", "money_readiness": "research_only", "decision": "revert", "session_branch": "main", "base_ref": "origin/main", "merge_base": "c550618668ba3d3ec82401f36dd85be095d0fc92", "head_commit": "c550618668ba3d3ec82401f36dd85be095d0fc92"}
{"ts": "2026-05-21T14:55:05.681559+08:00", "session_id": "20260521_140002_d2b4fa", "market": "cn", "formula": "rank(-ps_ttm) * rank(ts_mean(turnover_rate,20) / (ts_std(turnover_rate,20) + 0.01))", "name": "sales_sponsor_stability_20", "is_ic": -0.0004, "is_ic_ir": 0.011, "is_sharpe": -2.5, "is_turnover": 0.113, "is_monotonicity": -0.35, "gates": "FAIL", "status": "reverted", "eval_seconds": 95.6, "sleeve_id": "cn_ai_sponsorship_value", "mispricing_source": "Theme-chasing capital overpays for visible AI stories and underprices boring enablers whose demand is real but not yet fully narrated; steady turnover can reveal accumulation before valuation closes.", "forced_counterparty": "Retail momentum traders and benchmark-constrained long-only funds that wait for headline confirmation instead of paying into quiet accumulation", "data_requirements": "[\"daily_basic CN features are sufficient for IS test\",\"before promotion require beta-hedged sleeve PnL, residual risk attribution, factor correlation to promoted sleeves, and source-reviewed backlog/capex/debt checks to avoid cheap value traps\"]", "failure_mode": "It stops working when low ps_ttm is mostly distress rather than under-recognized AI demand, or when turnover persistence reflects distribution instead of accumulation during broad liquidity contractions.", "report_contract": "setup_overlay", "ai_supercycle_layer": "ai_chip_equipment_materials_packaging", "supply_chain_hypothesis": "Domestic AI chip equipment/materials/packaging bottleneck names can be accumulated ahead of explicit order/backlog confirmation, creating a quiet re-rating window inside the source-reviewed AI universe.", "relationship_evidence_required": "true", "money_readiness": "research_only", "decision": "revert", "session_branch": "main", "base_ref": "origin/main", "merge_base": "c550618668ba3d3ec82401f36dd85be095d0fc92", "head_commit": "c550618668ba3d3ec82401f36dd85be095d0fc92"}
{"ts": "2026-05-21T14:55:05.681559+08:00", "session_id": "20260521_140002_d2b4fa", "market": "cn", "formula": "rank(-ts_corr(high / low - 1, delta(turnover_rate, 5), 20))", "name": "range_turnover_accel_absorb_20", "is_ic": 0.0223, "is_ic_ir": 0.084, "is_sharpe": -0.979, "is_turnover": 0.199, "is_monotonicity": 0.2, "gates": "FAIL", "status": "reverted", "eval_seconds": 164.5, "sleeve_id": "cn_ai_absorption_overlay", "mispricing_source": "The market discounts quiet accumulation when participation improves but realized range does not expand, so sponsorship-quality improvement is not fully priced immediately.", "forced_counterparty": "Retail momentum traders and fast-rotation thematic accounts selling into flat tape; benchmarked institutions that wait for visible price confirmation.", "data_requirements": "[\"daily high\",\"daily low\",\"daily turnover_rate\",\"AI universe membership + source-review status\",\"beta-hedged sleeve attribution vs 000300.SH and 399006.SZ\",\"for promotion: filings/transcripts/backlog/capex evidence on candidate equipment/material/packaging bottlenecks\"]", "failure_mode": "It fails in broad speculative melt-ups where valid leadership requires range expansion, or in dead/illiquid names where compressed range reflects lack of demand rather than absorption.", "report_contract": "setup_overlay", "ai_supercycle_layer": "ai_chip_equipment_materials_packaging", "supply_chain_hypothesis": "Domestic AI chip equipment, materials, and advanced packaging bottleneck names should exhibit rising float participation with compressed ranges before order visibility and capex confirmation become obvious in filings.", "relationship_evidence_required": "true", "money_readiness": "research_only", "decision": "revert", "session_branch": "main", "base_ref": "origin/main", "merge_base": "c550618668ba3d3ec82401f36dd85be095d0fc92", "head_commit": "c550618668ba3d3ec82401f36dd85be095d0fc92"}
{"ts": "2026-05-21T14:55:05.681559+08:00", "session_id": "20260521_140002_d2b4fa", "market": "cn", "formula": "rank(-ps_ttm) * rank(ts_mean(turnover_rate,20) / ts_std(turnover_rate,20))", "name": "low_ps_orderly_turnover_20", "is_ic": -0.0021, "is_ic_ir": 0.002, "is_sharpe": -2.558, "is_turnover": 0.111, "is_monotonicity": -0.35, "gates": "FAIL", "status": "reverted", "eval_seconds": 137.3, "sleeve_id": "cn_aiinfra_value_sponsorship", "mispricing_source": "The market overpays story density and underweights boring but real capacity providers; valuation plus orderly sponsorship is a different payoff stream from pure price momentum/reversal.", "forced_counterparty": "retail concept chasers and short-horizon thematic traders", "data_requirements": "[\"CN daily tape and daily_basic fields already listed\",\"ai_infra universe/module/depth metadata\",\"filings/transcripts/official releases to verify AI-capex supplier exposure before promotion\",\"beta-hedged sleeve attribution and correlation to existing sleeves\"]", "failure_mode": "This stops working when the market shifts into indiscriminate concept squeezes or when turnover stops reflecting sponsorship and becomes pure speculative churn.", "report_contract": "setup_overlay", "ai_supercycle_layer": "ai_chip_equipment_materials_packaging", "supply_chain_hypothesis": "Domestic equipment/material/packaging names with verified AI-capex exposure are being accumulated before shipment/order evidence is fully capitalized in price.", "relationship_evidence_required": "true", "money_readiness": "research_only", "decision": "revert", "session_branch": "main", "base_ref": "origin/main", "merge_base": "c550618668ba3d3ec82401f36dd85be095d0fc92", "head_commit": "c550618668ba3d3ec82401f36dd85be095d0fc92"}
{"ts": "2026-05-21T14:55:05.681559+08:00", "session_id": "20260521_140002_d2b4fa", "market": "cn", "formula": "rank(ts_mean(amount/circ_market_cap,20)/ts_std(amount/circ_market_cap,20))", "name": "float_flow_stability_20", "is_ic": -0.0422, "is_ic_ir": -0.16, "is_sharpe": -4.034, "is_turnover": 0.141, "is_monotonicity": -0.5, "gates": "FAIL", "status": "reverted", "eval_seconds": 154.6, "sleeve_id": "cn_ai_infra_flow_quality", "mispricing_source": "Slow ownership transfer in scarce-float AI-infra names is underreacted to by the market; steady float absorption tends to be priced with a lag and can show up as residual alpha after beta hedging.", "forced_counterparty": "Retail momentum chasers and liquidity-mandated benchmark/ETF rebalancers", "data_requirements": "[\"amount\",\"circ_market_cap\",\"beta-hedge attribution vs 000300.SH and 399006.SZ\",\"free-float change/unlock calendar\",\"filings/transcripts if mapping winners to specific AI-capex customer pull-through\"]", "failure_mode": "It stops working in policy-squeeze or limit-up mania regimes where spiky turnover is rewarded, or when float changes/unlocks make circ_market_cap stale.", "report_contract": "fresh_buy_gate", "ai_supercycle_layer": "ai_chip_equipment_materials_packaging", "supply_chain_hypothesis": "Domestic AI capex bottleneck names in chip equipment, materials, and advanced packaging should show orderly float recycling before backlog confirmation is fully recognized by the tape.", "relationship_evidence_required": "true", "money_readiness": "money_candidate", "decision": "revert", "session_branch": "main", "base_ref": "origin/main", "merge_base": "c550618668ba3d3ec82401f36dd85be095d0fc92", "head_commit": "c550618668ba3d3ec82401f36dd85be095d0fc92"}
{"ts": "2026-05-22T07:22:04.701442+08:00", "session_id": "20260522_062703_274f5a", "market": "cn", "formula": "rank(ts_min(turnover_rate,20)/ts_mean(turnover_rate,20)) * rank((ts_max(high,40)-close)/ts_max(high,40))", "name": "turnover_floor_pullback_40", "is_ic": -0.0168, "is_ic_ir": -0.073, "is_sharpe": -3.135, "is_turnover": 0.226, "is_monotonicity": -0.45, "gates": "FAIL", "status": "reverted", "eval_seconds": 156.8, "sleeve_id": "cn_ai_infra_pullback_absorption", "mispricing_source": "Short-horizon thematic traders sell failed breakouts, while benchmarked long-only funds wait for renewed price confirmation, so orderly pullbacks with stable participation are typically underpriced.", "forced_counterparty": "Retail momentum sellers and benchmark-constrained long-only funds", "data_requirements": "[\"daily high/close/turnover_rate on validated CN AI universe\",\"beta-hedged attribution vs 000300.SH and 399006.SZ\",\"corr vs amount_stability_20 and turnover_stability_20\",\"source-review evidence before asserting any supplier/customer relationship\"]", "failure_mode": "It stops working when pullbacks reflect real order deterioration or policy disappointment, or when speculative breakout-chasing dominates and steady bases no longer lead to follow-through.", "report_contract": "fresh_buy_gate", "ai_supercycle_layer": "ai_chip_equipment_materials_packaging", "supply_chain_hypothesis": "Domestic AI accelerator packaging and equipment bottleneck names should hold a steady turnover floor during pullbacks before the market fully reprices the next capex or order leg.", "relationship_evidence_required": "true", "money_readiness": "money_candidate", "decision": "revert", "session_branch": "main", "base_ref": "origin/main", "merge_base": "c550618668ba3d3ec82401f36dd85be095d0fc92", "head_commit": "c550618668ba3d3ec82401f36dd85be095d0fc92"}
{"ts": "2026-05-22T07:22:04.701442+08:00", "session_id": "20260522_062703_274f5a", "market": "cn", "formula": "rank(ts_rank(amount/circ_market_cap,20))*rank(-ts_std(turnover_rate,20))", "name": "cash_float_absorption_20", "is_ic": -0.0213, "is_ic_ir": -0.1, "is_sharpe": -4.86, "is_turnover": 0.408, "is_monotonicity": -0.1, "gates": "FAIL", "status": "reverted", "eval_seconds": 76.4, "sleeve_id": "cn_ai_flow_accumulation", "mispricing_source": "Slow ownership transfer in AI-theme leaders leaves steady cash absorption under-discounted by daily marks; the market overreacts to short-term churn and underprices inventory being transferred to stronger hands.", "forced_counterparty": "Retail theme chasers and benchmarked funds forced to trim into volatility or liquidity windows", "data_requirements": "[\"daily amount\",\"daily turnover_rate\",\"circ_market_cap\",\"CN AI-universe membership\",\"beta-hedged sleeve PnL\",\"residual-risk attribution\",\"correlation check vs promoted factors\"]", "failure_mode": "It stops working when high amount/float reflects distribution or rumor-driven blow-off instead of accumulation, especially during broad retail mania or liquidity stress.", "report_contract": "research_only", "ai_supercycle_layer": "none", "supply_chain_hypothesis": "Persistent float absorption should surface D1-D3 AI bottleneck suppliers before source-reviewed order or backlog evidence is public.", "relationship_evidence_required": "true", "money_readiness": "research_only", "decision": "revert", "session_branch": "main", "base_ref": "origin/main", "merge_base": "c550618668ba3d3ec82401f36dd85be095d0fc92", "head_commit": "c550618668ba3d3ec82401f36dd85be095d0fc92"}
{"ts": "2026-05-22T07:22:04.701442+08:00", "session_id": "20260522_062703_274f5a", "market": "cn", "formula": "rank(ts_mean(amount,20)/ts_std(amount,20))*rank(ret_20d-ret_5d)", "name": "stable_amount_trend_reset_20", "is_ic": -0.0132, "is_ic_ir": -0.079, "is_sharpe": -3.853, "is_turnover": 0.203, "is_monotonicity": -0.85, "gates": "FAIL", "status": "reverted", "eval_seconds": 84.9, "sleeve_id": "cn_ai_infra_pullback", "mispricing_source": "Slow-moving institutional accumulation is only partially visible in daily prices; stable traded cash plus a short pause identifies sponsored leaders before the market fully reprices them. This is not plain price momentum because continuation is conditioned on cash-flow stability, not raw return strength alone.", "forced_counterparty": "Retail T+1 profit-takers and benchmark-aware funds trimming recent winners on short-horizon weakness", "data_requirements": "[\"daily amount\",\"ret_5d\",\"ret_20d\",\"factor correlation vs promoted sleeves\",\"beta/residual attribution vs 000300.SH and 399006.SZ before promotion\"]", "failure_mode": "Fails in broad liquidity shocks or pure gap-driven speculative regimes, where stable amount reflects crowding/trapped liquidity rather than informed accumulation.", "report_contract": "setup_overlay", "ai_supercycle_layer": "ai_chip_equipment_materials_packaging", "supply_chain_hypothesis": "Verified domestic AI bottleneck suppliers in equipment/materials/packaging should show steady cash sponsorship and shallow reset pullbacks before the next leg of relative-strength continuation.", "relationship_evidence_required": "true", "money_readiness": "research_only", "decision": "revert", "session_branch": "main", "base_ref": "origin/main", "merge_base": "c550618668ba3d3ec82401f36dd85be095d0fc92", "head_commit": "c550618668ba3d3ec82401f36dd85be095d0fc92"}
{"ts": "2026-05-22T07:22:04.701442+08:00", "session_id": "20260522_062703_274f5a", "market": "cn", "formula": "rank(ts_mean(amount,20)/ts_max(amount,20)/log(circ_market_cap))", "name": "float_even_flow_scarcity_20", "is_ic": -0.0378, "is_ic_ir": -0.134, "is_sharpe": -3.615, "is_turnover": 0.158, "is_monotonicity": -0.4, "gates": "FAIL", "status": "reverted", "eval_seconds": 174.3, "sleeve_id": "cn_ai_infra_flow_quality", "mispricing_source": "The market underreacts to smooth cash absorption in limited-float AI-infra names because confirmation of capex, customer wins, and bottleneck status arrives later than the tape.", "forced_counterparty": "T+1 retail momentum traders who provide spike-day liquidity, plus benchmark-constrained managers who wait for headline confirmation before adding size.", "data_requirements": "[\"Current DSL data is enough for IS test\",\"for promotion require rolling corr vs existing sleeves, beta-hedged sleeve attribution, residual risk contribution, and source-reviewed filings/press releases if a bottleneck supplier claim is attached\"]", "failure_mode": "It should degrade in retail squeeze regimes where one-day theme spikes outperform steady accumulation, or when float changes from placements/unlocks make circ_market_cap a stale scarcity proxy.", "report_contract": "setup_overlay", "ai_supercycle_layer": "ai_chip_equipment_materials_packaging", "supply_chain_hypothesis": "Candidate D1-D3 domestic equipment/materials/packaging bottlenecks show steady float absorption before verified order and capex evidence is obvious in public reporting.", "relationship_evidence_required": "true", "money_readiness": "research_only", "decision": "revert", "session_branch": "main", "base_ref": "origin/main", "merge_base": "c550618668ba3d3ec82401f36dd85be095d0fc92", "head_commit": "c550618668ba3d3ec82401f36dd85be095d0fc92"}
{"ts": "2026-05-22T07:22:04.701442+08:00", "session_id": "20260522_062703_274f5a", "market": "cn", "formula": "rank(ts_mean(amount/circ_market_cap,20)/(ts_std(amount/circ_market_cap,20)+0.01))*rank(ts_mean((high-close)/(high-low+0.01),10))", "name": "float_shadow_absorption_20", "is_ic": 0.0041, "is_ic_ir": 0.048, "is_sharpe": -0.026, "is_turnover": 0.207, "is_monotonicity": 0.1, "gates": "FAIL", "status": "reverted", "eval_seconds": 192.9, "sleeve_id": "cn_ai_leadership_absorption", "mispricing_source": "Patient accumulation in bottleneck AI-infra names is hidden by intraday selling pressure; stable float-normalized flow plus recurring upper shadows indicates supply is being cleared before the next repricing leg.", "forced_counterparty": "T+1 retail and short-horizon momentum traders selling into strength; benchmark-aware funds trimming crowded winners on risk limits", "data_requirements": "[\"daily OHLCV\",\"daily_basic.amount\",\"daily_basic.circ_market_cap\",\"CN benchmark returns for beta-hedged attribution\",\"existing sleeve correlation/risk stats before promotion\"]", "failure_mode": "It stops working when upper shadows represent true distribution or financing stress, or when macro/policy shock turns the market into gap-driven one-day squeezes instead of orderly absorption.", "report_contract": "setup_overlay", "ai_supercycle_layer": "ai_networking_optical_cpo", "supply_chain_hypothesis": "Candidate D1-D3 AI networking/optical bottleneck names may be accumulated ahead of verified order, capex, or customer confirmation; the tape should surface leadership before source-review evidence is complete.", "relationship_evidence_required": "true", "money_readiness": "research_only", "decision": "revert", "session_branch": "main", "base_ref": "origin/main", "merge_base": "c550618668ba3d3ec82401f36dd85be095d0fc92", "head_commit": "c550618668ba3d3ec82401f36dd85be095d0fc92"}
{"ts": "2026-05-22T07:22:04.701442+08:00", "session_id": "20260522_062703_274f5a", "market": "cn", "formula": "rank(-ts_mean(abs(delta(turnover_rate,5)),20)/(ts_mean(turnover_rate,20)+0.01))*rank(-ts_max(ret_1d,20))", "name": "low_lottery_turnover_drift_smooth_20", "is_ic": -0.052, "is_ic_ir": -0.179, "is_sharpe": -4.316, "is_turnover": 0.123, "is_monotonicity": -0.65, "gates": "FAIL", "status": "reverted", "eval_seconds": 168.0, "sleeve_id": "cn_ai_flow_underreaction", "mispricing_source": "Attention-driven overpricing of jumpy AI-theme tapes and underreaction to quiet accumulation; this is participation-path quality plus anti-lottery filtering, not another raw price reversal clone.", "forced_counterparty": "Retail momentum traders and benchmark-constrained long-only funds that wait for visible breakouts or explicit order/news confirmation.", "data_requirements": "[\"turnover_rate\",\"ret_1d\",\"ai_infra universe membership\",\"beta-hedged sleeve return vs 000300.SH and 399006.SZ\",\"residual risk attribution\",\"realized turnover-cost/slippage ledger before promotion\"]", "failure_mode": "Fails in speculative melt-up or policy-gap regimes where high-lottery spikes keep outperforming and smooth-turnover names become funding sources instead of accumulation targets.", "report_contract": "setup_overlay", "ai_supercycle_layer": "ai_chip_equipment_materials_packaging", "supply_chain_hypothesis": "Within validated CN semicap, materials, and advanced-packaging names, true AI bottleneck beneficiaries should show smooth weekly participation drift and fewer jackpot days before source-reviewed order, capex, or backlog evidence is fully reflected in price.", "relationship_evidence_required": "true", "money_readiness": "research_only", "decision": "revert", "session_branch": "main", "base_ref": "origin/main", "merge_base": "c550618668ba3d3ec82401f36dd85be095d0fc92", "head_commit": "c550618668ba3d3ec82401f36dd85be095d0fc92"}
