{"ts": "2026-05-25T07:23:06.199590+08:00", "session_id": "20260525_062703_ae377b", "market": "cn", "formula": "rank(ret_20d - ret_5d) * rank(-ts_std(turnover_rate, 20))", "name": "orderly_pullback_turnover_20", "is_ic": -0.033, "is_ic_ir": -0.125, "is_sharpe": -2.979, "is_turnover": 0.188, "is_monotonicity": -0.35, "gates": "FAIL", "status": "reverted", "eval_seconds": 124.0, "sleeve_id": "daily_price_overlay", "mispricing_source": "The market overreacts to recent 5-day cooling inside a still-strong 20-day trend and underprices the information in stable turnover, which signals that supply is being absorbed rather than distributed.", "forced_counterparty": "Short-horizon retail and momentum accounts reducing exposure after stalled breakouts, plus benchmarked funds that wait for explicit confirmation before adding on pullbacks.", "data_requirements": "[\"daily CN price/turnover fields are sufficient for initial IS test\", \"beta-hedged sleeve attribution vs 000300.SH and 399006.SZ before promotion\", \"sleeve correlation matrix vs promoted factors\", \"source-reviewed order/backlog evidence if used to claim a specific AI supply-chain link\"]", "failure_mode": "This stops working in speculative melt-up regimes where high-turnover breakout chasing dominates, or in true information-downturn regimes where the 5-day weakness reflects deteriorating fundamentals rather than orderly digestion.", "report_contract": "setup_overlay", "ai_supercycle_layer": "ai_chip_equipment_materials_packaging", "supply_chain_hypothesis": "Domestic AI chip equipment/material suppliers showing strong 20-day leadership but calm 5-day pullbacks may be under quiet accumulation ahead of verified capex, localization, or order-flow confirmation from accelerator and advanced-packaging demand.", "relationship_evidence_required": "true", "money_readiness": "research_only", "decision": "revert", "session_branch": "main", "base_ref": "origin/main", "merge_base": "c99187be1dc8d78a84147200981562efcde7b8d5", "head_commit": "c99187be1dc8d78a84147200981562efcde7b8d5"}
{"ts": "2026-05-25T07:23:06.199590+08:00", "session_id": "20260525_062703_ae377b", "market": "cn", "formula": "rank(decay_linear(volume_ratio,5))*rank(-ts_std(amount,20))", "name": "persistent_participation_absorb_20", "is_ic": 0.0084, "is_ic_ir": 0.046, "is_sharpe": -0.382, "is_turnover": 0.165, "is_monotonicity": 0.3, "gates": "FAIL", "status": "reverted", "eval_seconds": 185.4, "sleeve_id": "cn_ai_flow_absorption", "mispricing_source": "Slow ownership transfer and underreaction to institutional accumulation inside theme-driven AI hardware names; abnormal participation persists before consensus fully prices the demand bottleneck.", "forced_counterparty": "Retail theme traders and short-horizon funds taking profits after the first spike, plus benchmarked managers rebalancing gradually instead of buying full size immediately.", "data_requirements": "[\"Current CN daily price/volume/daily_basic fields are sufficient for IS test\", \"For promotion: sleeve-vs-benchmark hedge attribution, residual risk attribution, and correlation to existing promoted sleeves\"]", "failure_mode": "It stops working when elevated volume_ratio is exhaustion from rumor/policy bursts rather than accumulation, or when market-wide liquidity shocks dominate sector-specific flow.", "report_contract": "setup_overlay", "ai_supercycle_layer": "ai_chip_equipment_materials_packaging", "supply_chain_hypothesis": "Domestic substitution leaders in semiconductor equipment, materials, or advanced packaging attract sustained abnormal participation before verified fab/order/backlog evidence is fully reflected in price.", "relationship_evidence_required": "true", "money_readiness": "research_only", "decision": "revert", "session_branch": "main", "base_ref": "origin/main", "merge_base": "c99187be1dc8d78a84147200981562efcde7b8d5", "head_commit": "c99187be1dc8d78a84147200981562efcde7b8d5"}
{"ts": "2026-05-25T07:23:06.199590+08:00", "session_id": "20260525_062703_ae377b", "market": "cn", "formula": "rank(-ts_std(turnover_rate,20))*rank(ret_20d-ret_5d)", "name": "turnover_stability_lead_gap_20", "is_ic": -0.033, "is_ic_ir": -0.125, "is_sharpe": -2.979, "is_turnover": 0.188, "is_monotonicity": -0.35, "gates": "FAIL", "status": "reverted", "eval_seconds": 255.2, "sleeve_id": "cn_ai_leadership_pullback", "mispricing_source": "The market overreacts to short-horizon pullbacks in crowded themes and underweights the information in stable ownership turnover, so continuation after orderly digestion is mispriced.", "forced_counterparty": "Short-horizon retail traders and benchmarked/theme-rotation funds that de-risk after a 5-day wobble rather than hold through the capex cycle", "data_requirements": "[\"CN daily price/volume/daily_basic is sufficient for IS test\",\"for promotion: hedge-adjusted sleeve attribution vs 000300.SH and 399006.SZ\",\"if linked to specific optical/CPO orders or customers: filings, official PRs, transcripts\"]", "failure_mode": "It breaks when theme leadership broadens indiscriminately or when low turnover volatility reflects illiquidity/trapped holders instead of accumulation, causing the factor to buy genuine de-ratings.", "report_contract": "setup_overlay", "ai_supercycle_layer": "ai_networking_optical_cpo", "supply_chain_hypothesis": "Potentially surfaces domestic optical/CPO and interconnect bottleneck names where shallow pullbacks on stable float churn reflect continued datacenter and AI-network capex positioning.", "relationship_evidence_required": "true", "money_readiness": "research_only", "decision": "revert", "session_branch": "main", "base_ref": "origin/main", "merge_base": "c99187be1dc8d78a84147200981562efcde7b8d5", "head_commit": "c99187be1dc8d78a84147200981562efcde7b8d5"}
{"ts": "2026-05-25T07:23:06.199590+08:00", "session_id": "20260525_062703_ae377b", "market": "cn", "formula": "rank(ts_mean(turnover_rate,20)/ts_max(turnover_rate,20))*rank(ts_mean((high-close)/(high-low+0.01),10))", "name": "turnover_even_wick_absorb_20", "is_ic": -0.0282, "is_ic_ir": -0.103, "is_sharpe": -3.029, "is_turnover": 0.225, "is_monotonicity": -0.5, "gates": "FAIL", "status": "reverted", "eval_seconds": 173.9, "sleeve_id": "daily_flow_overlay", "mispricing_source": "This targets ownership-breadth plus supply-absorption, not raw momentum or simple reversal; it should be less collinear than a standalone price factor because both broad participation and wick absorption must co-occur.", "forced_counterparty": "Theme-chasing retail and short-horizon momentum traders who buy intraday AI headlines and then de-risk failed breakouts under T+1 and capital-usage constraints", "data_requirements": "[\"current CN daily tape fields already available\",\"factor correlation matrix vs promoted sleeves\",\"beta-hedged sleeve attribution vs 000300.SH/399006.SZ\",\"source-reviewed AI layer tags before interpreting discovered names as confirmed AI bottlenecks\"]", "failure_mode": "It should weaken in pure squeeze regimes where one-day speculative spikes keep getting rewarded, or in distribution regimes where upper shadows reflect real supply rather than absorption.", "report_contract": "setup_overlay", "ai_supercycle_layer": "ai_networking_optical_cpo", "supply_chain_hypothesis": "Candidate CN optical/interconnect bottleneck names may show repeated wick absorption with evenly distributed turnover before order evidence is fully recognized by the market.", "relationship_evidence_required": "true", "money_readiness": "research_only", "decision": "revert", "session_branch": "main", "base_ref": "origin/main", "merge_base": "c99187be1dc8d78a84147200981562efcde7b8d5", "head_commit": "c99187be1dc8d78a84147200981562efcde7b8d5"}
{"ts": "2026-05-25T07:23:06.199590+08:00", "session_id": "20260525_062703_ae377b", "market": "cn", "formula": "rank(ts_min(ts_sum(volume_ratio,5),20)/ts_mean(ts_sum(volume_ratio,5),20))", "name": "weekly_relvol_floor_20", "is_ic": 0.017, "is_ic_ir": 0.107, "is_sharpe": -0.374, "is_turnover": 0.123, "is_monotonicity": -0.2, "gates": "FAIL", "status": "reverted", "eval_seconds": 156.5, "sleeve_id": "cn_ai_participation_floor", "mispricing_source": "Attention capital pays up for spike days, while benchmarked and slower fundamental capital accumulates AI-infra bottlenecks over multiple weeks; the market underprices that steadier ownership transfer path.", "forced_counterparty": "Retail breakout chasers and benchmark-constrained long-only funds that wait for visible price confirmation", "data_requirements": "[\"daily volume_ratio on the reviewed CN AI universe\", \"beta-hedged sleeve return vs 000300.SH and 399006.SZ\", \"rolling correlation vs promoted sleeves\", \"intraday/member-level flow ledger before money-ready promotion\"]", "failure_mode": "Fails in speculative melt-up regimes where bursty high-attention names keep leading, or in illiquid/risk-off regimes where a high relative-volume floor reflects distribution or trapped liquidity instead of accumulation.", "report_contract": "research_only", "ai_supercycle_layer": "ai_chip_equipment_materials_packaging", "supply_chain_hypothesis": "Source-reviewed CN D1-D3 semicap, materials, and advanced-packaging bottleneck names should keep a defended weekly abnormal-participation floor before verified backlog, capex, or localization evidence is fully repriced.", "relationship_evidence_required": "true", "money_readiness": "research_only", "decision": "revert", "session_branch": "main", "base_ref": "origin/main", "merge_base": "c99187be1dc8d78a84147200981562efcde7b8d5", "head_commit": "c99187be1dc8d78a84147200981562efcde7b8d5"}
{"ts": "2026-05-25T07:23:06.199590+08:00", "session_id": "20260525_062703_ae377b", "market": "cn", "formula": "rank(-ts_std(delta(log(amount),5),20))*rank(ts_mean((close-open)/(high-low+0.01),20))", "name": "log_amountchg_body_bias_20", "is_ic": -0.0011, "is_ic_ir": -0.008, "is_sharpe": -2.514, "is_turnover": 0.179, "is_monotonicity": -0.2, "gates": "FAIL", "status": "reverted", "eval_seconds": 195.5, "sleeve_id": "cn_ai_flow_quality", "mispricing_source": "Second-order flow underreaction; this is a flow-path quality signal with buyer-controlled closes, not a high-correlation clone of raw momentum, reversal, or a standalone candle-shape factor.", "forced_counterparty": "Retail theme chasers, benchmark-constrained mutual funds, and redemption-driven sellers who provide stock during quiet consolidations.", "data_requirements": "[\"current IS test uses amount/open/close/high/low\",\"before promotion require ai_infra universe tags, beta-hedged sleeve PnL, residual-risk attribution, rolling correlation vs promoted factors, and original-source filings/PRs/transcripts for any supplier/order claim\"]", "failure_mode": "Fails in policy-gap or pure speculative momentum regimes where bursty turnover and wide bodies carry the information, or when smooth amount paths reflect illiquidity rather than accumulation.", "report_contract": "setup_overlay", "ai_supercycle_layer": "ai_chip_equipment_materials_packaging", "supply_chain_hypothesis": "Source-reviewed CN semicap, materials, packaging, and test bottleneck names should show smooth weekly notional-change paths and buyer-controlled closes before verified order, backlog, or capex evidence is fully priced.", "relationship_evidence_required": "true", "money_readiness": "research_only", "decision": "revert", "session_branch": "main", "base_ref": "origin/main", "merge_base": "c99187be1dc8d78a84147200981562efcde7b8d5", "head_commit": "c99187be1dc8d78a84147200981562efcde7b8d5"}
{"ts": "2026-05-25T07:23:06.199590+08:00", "session_id": "20260525_062703_ae377b", "market": "cn", "formula": "rank(ts_mean(turnover_rate,20)/ts_max(turnover_rate,20))*rank(-ts_max(ret_1d,20))", "name": "turnover_even_low_lottery_20", "is_ic": -0.0658, "is_ic_ir": -0.228, "is_sharpe": -5.511, "is_turnover": 0.144, "is_monotonicity": -0.75, "gates": "FAIL", "status": "reverted", "eval_seconds": 182.5, "sleeve_id": "cn_ai_infra_flow_quality", "mispricing_source": "Steady float turnover reflects incremental position building, while one-day return spikes are typically overpaying by short-horizon speculative capital and mean-revert as supply comes back.", "forced_counterparty": "retail theme chasers, T+1 swing traders, and benchmark-insensitive momentum accounts", "data_requirements": "[\"daily OHLCV+daily_basic turnover_rate for CN AI-infra universe\",\"factor correlation matrix vs promoted sleeves\",\"beta-hedged sleeve return and residual risk attribution vs 000300.SH and 399006.SZ\"]", "failure_mode": "It should weaken when policy/liquidity regime rewards pure chase behavior, or when AI-infra becomes so crowded that steady turnover simply proxies large-cap defensiveness rather than accumulation.", "report_contract": "action_overlay", "ai_supercycle_layer": "ai_chip_equipment_materials_packaging", "supply_chain_hypothesis": "candidate bottleneck repricing in domestic AI equipment/material/packaging names; no specific supplier/customer claim is asserted by the tape alone", "relationship_evidence_required": "false", "money_readiness": "research_only", "decision": "revert", "session_branch": "main", "base_ref": "origin/main", "merge_base": "c99187be1dc8d78a84147200981562efcde7b8d5", "head_commit": "c99187be1dc8d78a84147200981562efcde7b8d5"}
{"ts": "2026-05-25T07:23:06.199590+08:00", "session_id": "20260525_062703_ae377b", "market": "cn", "formula": "rank(ts_min(turnover_rate,20)/ts_mean(turnover_rate,20))*rank(ret_20d-ret_5d)", "name": "turnover_floor_lead_pause_20", "is_ic": -0.041, "is_ic_ir": -0.15, "is_sharpe": -2.921, "is_turnover": 0.209, "is_monotonicity": -0.25, "gates": "FAIL", "status": "reverted", "eval_seconds": 257.4, "sleeve_id": "daily_flow_overlay", "mispricing_source": "The market overreacts to short pullbacks in theme leaders and underweights the information in resilient participation; this is not just a high-correlation price factor because it requires both prior leadership and a non-collapsing turnover floor.", "forced_counterparty": "retail thematic traders and benchmarked long-only funds cutting winners on short-term drawdowns and window-dressing pressure", "data_requirements": "[\"existing daily price/turnover_rate data for signal generation\", \"beta-hedged sleeve attribution vs 000300.SH and 399006.SZ\", \"correlation test vs promoted CN sleeves\", \"source-reviewed evidence before attaching any supplier/customer narrative\"]", "failure_mode": "It stops working when AI names trade as indiscriminate beta/meme baskets so turnover floor no longer separates sponsorship from hype, or when pullbacks reflect real counterevidence rather than liquidity exits.", "report_contract": "setup_overlay", "ai_supercycle_layer": "ai_chip_equipment_materials_packaging", "supply_chain_hypothesis": "Candidate semicap/materials/advanced-packaging bottleneck names that retain turnover floors during 5-day pullbacks while keeping 20-day leadership may be under active institutional accumulation.", "relationship_evidence_required": "true", "money_readiness": "research_only", "decision": "revert", "session_branch": "main", "base_ref": "origin/main", "merge_base": "c99187be1dc8d78a84147200981562efcde7b8d5", "head_commit": "c99187be1dc8d78a84147200981562efcde7b8d5"}
{"ts": "2026-05-25T07:23:06.199590+08:00", "session_id": "20260525_062703_ae377b", "market": "cn", "formula": "rank(ts_std(amount,60)/ts_std(amount,20))*rank(-ts_corr(amount,high/low,20))", "name": "amount_compress_range_absorb_20_60", "is_ic": 0.0317, "is_ic_ir": 0.191, "is_sharpe": 0.241, "is_turnover": 0.165, "is_monotonicity": 0.85, "gates": "FAIL", "status": "reverted", "eval_seconds": 255.7, "sleeve_id": "cn_ai_infra_accumulation", "mispricing_source": "The market overreacts to visible wide-range churn and underweights quieter follow-through accumulation; T+1 and theme rotation make supply exhaustion slow to price in.", "forced_counterparty": "T+1 retail traders and short-horizon thematic funds exiting after prior wide-range swings", "data_requirements": "[\"daily OHLC\",\"daily amount\",\"CN AI-universe membership\",\"beta-hedged sleeve attribution vs 000300.SH/399006.SZ before promotion\"]", "failure_mode": "It stops working when amount compression is just illiquidity/stale trading, or when policy/news gaps create one-way momentum and ranges legitimately need to expand with volume.", "report_contract": "setup_overlay", "ai_supercycle_layer": "ai_chip_equipment_materials_packaging", "supply_chain_hypothesis": "Candidate domestic semicap equipment/materials/packaging bottleneck suppliers should show compression-plus-absorption tape before source-reviewed order/backlog evidence is broadly recognized.", "relationship_evidence_required": "true", "money_readiness": "research_only", "decision": "revert", "session_branch": "main", "base_ref": "origin/main", "merge_base": "c99187be1dc8d78a84147200981562efcde7b8d5", "head_commit": "c99187be1dc8d78a84147200981562efcde7b8d5"}
{"ts": "2026-05-25T07:23:06.199590+08:00", "session_id": "20260525_062703_ae377b", "market": "cn", "formula": "rank(ts_mean(amount/circ_market_cap,20)/ts_std(amount/circ_market_cap,20))*rank(-ts_max(turnover_rate,20)/ts_sum(turnover_rate,20))", "name": "float_even_turnover_absorb_20", "is_ic": -0.0508, "is_ic_ir": -0.198, "is_sharpe": -4.026, "is_turnover": 0.147, "is_monotonicity": -0.5, "gates": "FAIL", "status": "reverted", "eval_seconds": 231.2, "sleeve_id": "cn_ai_accumulation", "mispricing_source": "Slow institutional build-up in validated AI-infra names is under-reflected by price-only factors; free-float absorption with non-spiky turnover captures demand before headlines, earnings revisions, or benchmark reweights adjust.", "forced_counterparty": "retail theme-chasers and benchmark/rebalance liquidity providers", "data_requirements": "[\"daily amount\",\"turnover_rate\",\"circ_market_cap\",\"OOS PASS/FAIL\",\"beta-hedged sleeve attribution vs 000300.SH and 399006.SZ\",\"correlation check vs promoted sleeves\"]", "failure_mode": "It stops working when the AI theme becomes a pure retail momentum tape or policy/news gaps dominate trading, because even turnover no longer means patient institutional accumulation.", "report_contract": "setup_overlay", "ai_supercycle_layer": "none", "supply_chain_hypothesis": "Within the validated CN AI-infra universe, prospective bottleneck suppliers should show steady free-float absorption with evenly distributed turnover before order/backlog evidence is public.", "relationship_evidence_required": "false", "money_readiness": "research_only", "decision": "revert", "session_branch": "main", "base_ref": "origin/main", "merge_base": "c99187be1dc8d78a84147200981562efcde7b8d5", "head_commit": "c99187be1dc8d78a84147200981562efcde7b8d5"}
{"ts": "2026-05-25T07:23:06.199590+08:00", "session_id": "20260525_062703_ae377b", "market": "cn", "formula": "rank(ts_mean(amount/circ_market_cap,20))*rank(-ts_std(amount/circ_market_cap,20))", "name": "stable_cash_float_20", "is_ic": -0.0008, "is_ic_ir": -0.005, "is_sharpe": -1.212, "is_turnover": 0.122, "is_monotonicity": 0.0, "gates": "FAIL", "status": "reverted", "eval_seconds": 105.3, "sleeve_id": "cn_ai_flow_quality", "mispricing_source": "The market overreacts to visible one-day spikes and underweights steady cash-per-float accumulation; this is a flow-quality signal, not a simple variant of past-return momentum or candle-shape factors.", "forced_counterparty": "T+1 retail swing traders and redemption-constrained active funds that sell or provide liquidity on quiet days despite needing AI exposure over time.", "data_requirements": "[\"daily amount\",\"circ_market_cap\",\"beta-hedged sleeve attribution vs 000300.SH and 399006.SZ\",\"correlation check vs promoted sleeves before promotion\"]", "failure_mode": "It stops working when stable turnover is distribution rather than accumulation, or when unlocks/new issuance/policy whipsaw remove the float-scarcity constraint.", "report_contract": "setup_overlay", "ai_supercycle_layer": "ai_chip_equipment_materials_packaging", "supply_chain_hypothesis": "D2-D3 chip equipment/materials/packaging bottlenecks with scarce float should show steady cash-per-float accumulation before source-reviewed capex, order, or backlog confirmation.", "relationship_evidence_required": "true", "money_readiness": "research_only", "decision": "revert", "session_branch": "main", "base_ref": "origin/main", "merge_base": "c99187be1dc8d78a84147200981562efcde7b8d5", "head_commit": "c99187be1dc8d78a84147200981562efcde7b8d5"}
