{"ts": "2026-05-20T07:23:20.341546+08:00", "session_id": "20260520_062702_8909c7", "market": "cn", "formula": "rank(ret_20d-ret_5d)*rank(ts_min(turnover_rate,20)/ts_mean(turnover_rate,20))", "name": "leader_pullback_turnfloor_ratio", "is_ic": -0.0282, "is_ic_ir": -0.091, "is_sharpe": 3.901, "is_turnover": 0.227, "is_monotonicity": 0.6, "gates": "FAIL", "status": "reverted", "eval_seconds": 186.4, "sleeve_id": "cn_ai_leadership_pullback", "mispricing_source": "Underreaction to sponsored leadership resets; this is not just a price factor because the turnover-floor term isolates persistent sponsorship and filters out one-spike momentum.", "forced_counterparty": "T+1 retail momentum traders and short-horizon theme accounts de-risking on the first pullback", "data_requirements": "[\"close\",\"ret_5d\",\"ret_20d\",\"turnover_rate\",\"validated CN AI universe membership\",\"beta-hedged sleeve attribution vs 000300.SH and 399006.SZ before promotion\"]", "failure_mode": "Fails in straight-line breakout regimes where winners do not mean-revert at all, or when a high turnover floor is driven by trapped speculative inventory rather than institutional absorption.", "report_contract": "research_only", "ai_supercycle_layer": "ai_datacenter_edge_infra", "supply_chain_hypothesis": "Validated CN datacenter power/cooling/server-interconnect beneficiaries should show shallow-pullback accumulation with supported turnover floors as allocators position for the next AI buildout leg.", "relationship_evidence_required": "true", "money_readiness": "research_only", "decision": "revert", "session_branch": "main", "base_ref": "origin/main", "merge_base": "b127bcb38ef90487e053bb7009fa8bafbe89687b", "head_commit": "b127bcb38ef90487e053bb7009fa8bafbe89687b"}
{"ts": "2026-05-20T14:55:34.707427+08:00", "session_id": "20260520_140002_6d34ae", "market": "cn", "formula": "rank(ts_min(volume_ratio,20)/ts_max(volume_ratio,20))", "name": "relvol_corridor_20", "is_ic": 0.0165, "is_ic_ir": 0.11, "is_sharpe": -1.477, "is_turnover": 0.125, "is_monotonicity": -0.15, "gates": "FAIL", "status": "reverted", "eval_seconds": 160.4, "sleeve_id": "cn_ai_infra_flow_quality", "mispricing_source": "The market overpays for headline-driven AI volume spikes and underweights names where specialist capital accumulates gradually with a persistent relative-volume floor.", "forced_counterparty": "Theme-chasing retail and fast money reacting to AI headlines on short horizons", "data_requirements": "[\"current CN daily tape is sufficient for IS evaluation\",\"before promotion: rolling corr to promoted sleeves, beta-hedged sleeve return, residual risk attribution, drawdown stats\",\"if mapped to a supplier/customer thesis: filings, official PRs, transcripts, or verified news\"]", "failure_mode": "It stops working in policy-mania or first-leg repricing regimes where true winners are supposed to gap into extreme one-day volume spikes and keep running.", "report_contract": "setup_overlay", "ai_supercycle_layer": "ai_chip_equipment_materials_packaging", "supply_chain_hypothesis": "Candidate domestic AI chip equipment/materials/packaging bottleneck names should exhibit sustained relative-volume participation before backlog or order evidence is fully confirmed.", "relationship_evidence_required": "true", "money_readiness": "research_only", "decision": "revert", "session_branch": "main", "base_ref": "origin/main", "merge_base": "2eab9f478b0dc49677cbf8591dc6f306dae18a0f", "head_commit": "2eab9f478b0dc49677cbf8591dc6f306dae18a0f"}
{"ts": "2026-05-20T14:55:34.707427+08:00", "session_id": "20260520_140002_6d34ae", "market": "cn", "formula": "rank(-ts_corr(ret_1d,shift(ret_1d,1),20))*rank(-ts_std(turnover_rate,20)/ts_mean(turnover_rate,20))", "name": "anti_autocorr_turnover_stability_20", "is_ic": -0.0124, "is_ic_ir": -0.045, "is_sharpe": 4.355, "is_turnover": 0.169, "is_monotonicity": 0.9, "gates": "FAIL", "status": "reverted", "eval_seconds": 137.3, "sleeve_id": "cn_ai_flow_quality", "mispricing_source": "A-share T+1, benchmark/rebalance constraints, and retail short-horizon trading create underreaction in steadily accumulated AI names.", "forced_counterparty": "retail swing traders and benchmarked funds forced to trade for liquidity/redemption reasons", "data_requirements": "[\"daily ret_1d\",\"daily turnover_rate\",\"ai_infra universe metadata (layer/BFS depth/source-review status)\",\"benchmark returns for beta-hedged attribution\",\"transaction-cost/slippage ledger\"]", "failure_mode": "It stops working when the market shifts into one-way theme chasing or policy-shock tape, where stable turnover no longer means accumulation and return autocorrelation turns into persistent momentum.", "report_contract": "action_overlay", "ai_supercycle_layer": "none", "supply_chain_hypothesis": "Layer-agnostic inside the validated CN AI-infra universe; quiet turnover absorption should surface D1-D3 bottleneck suppliers and integrators before filings or news fully confirm demand.", "relationship_evidence_required": "true", "money_readiness": "research_only", "decision": "revert", "session_branch": "main", "base_ref": "origin/main", "merge_base": "2eab9f478b0dc49677cbf8591dc6f306dae18a0f", "head_commit": "2eab9f478b0dc49677cbf8591dc6f306dae18a0f"}
{"ts": "2026-05-20T14:55:34.707427+08:00", "session_id": "20260520_140002_6d34ae", "market": "cn", "formula": "rank(ts_mean(amount/circ_market_cap,20)/(ts_std(amount/circ_market_cap,20)+0.01))", "name": "stable_float_flow_20", "is_ic": 0.0837, "is_ic_ir": 0.341, "is_sharpe": 5.273, "is_turnover": 0.132, "is_monotonicity": 0.9, "gates": "PASS", "status": "checks_failed", "eval_seconds": 123.3, "sleeve_id": "cn_ai_flow_leadership", "mispricing_source": "Slow institutional accumulation in scarce AI-infra leaders is visible in persistent value traded relative to float, while short-horizon participants misread the absence of noisy breakout volume as lack of information.", "forced_counterparty": "Retail theme-chasers and T+1 liquidity traders rotating out of quiet leaders; benchmarked managers who only add after confirmation.", "data_requirements": "[\"daily amount\",\"daily circ_market_cap\",\"AI-universe membership and source-review status\",\"benchmark hedge return series for beta/residual attribution\"]", "failure_mode": "Stops working when the market rewards unstable speculative turnover spikes over steady accumulation, or when float-normalized flow is dominated by passive rebalance events instead of discretionary buying.", "report_contract": "research_only", "ai_supercycle_layer": "ai_chip_equipment_materials_packaging", "supply_chain_hypothesis": "CN equipment/materials/packaging suppliers exposed to accelerator, HBM, and advanced-packaging capex should show stable float-normalized flow before downstream order evidence is widely trusted.", "relationship_evidence_required": "true", "money_readiness": "research_only", "decision": "revert", "session_branch": "main", "base_ref": "origin/main", "merge_base": "2eab9f478b0dc49677cbf8591dc6f306dae18a0f", "head_commit": "2eab9f478b0dc49677cbf8591dc6f306dae18a0f", "oos": "PASS", "checks_status": "failed"}
{"ts": "2026-05-20T14:55:34.707427+08:00", "session_id": "20260520_140002_6d34ae", "market": "cn", "formula": "rank(ts_min(amount/circ_market_cap,20)/ts_mean(amount/circ_market_cap,20))*rank(-ts_corr(ret_1d,shift(ret_1d,1),20))", "name": "float_floor_anti_autocorr_20", "is_ic": -0.0317, "is_ic_ir": -0.121, "is_sharpe": 4.186, "is_turnover": 0.188, "is_monotonicity": 0.7, "gates": "FAIL", "status": "reverted", "eval_seconds": 171.5, "sleeve_id": "cn_ai_float_absorption", "mispricing_source": "A-share retail flow is spiky and narrative-driven, while institutions accumulating AI bottleneck names must slice orders across days; a high daily flow floor plus anti-autocorrelated tape indicates underreaction to steady demand rather than a high-correlation price-only signal.", "forced_counterparty": "T+1 retail sellers and benchmarked funds de-risking into weak tape or small rebounds", "data_requirements": "[\"daily OHLCV\",\"amount\",\"circ_market_cap\",\"ai_infra CN universe membership\",\"000300.SH/399006.SZ benchmark returns for beta-hedged sleeve attribution\",\"sleeve correlation and residual-risk ledger\"]", "failure_mode": "It should fail in one-day narrative squeeze regimes where leadership is driven by gap-chasing and turnover spikes rather than steady absorption, or when policy/event shocks dominate stock-specific accumulation.", "report_contract": "setup_overlay", "ai_supercycle_layer": "ai_networking_optical_cpo", "supply_chain_hypothesis": "Optical/CPO and fiber bottleneck candidates with a persistent float-flow floor and price underreaction may be getting accumulated ahead of source-verified AI datacenter interconnect demand repricing.", "relationship_evidence_required": "true", "money_readiness": "research_only", "decision": "revert", "session_branch": "main", "base_ref": "origin/main", "merge_base": "2eab9f478b0dc49677cbf8591dc6f306dae18a0f", "head_commit": "2eab9f478b0dc49677cbf8591dc6f306dae18a0f"}
{"ts": "2026-05-20T14:55:34.707427+08:00", "session_id": "20260520_140002_6d34ae", "market": "cn", "formula": "rank(-ts_std(turnover_rate,20)/ts_mean(turnover_rate,5))*rank(-ts_corr(ret_1d,turnover_rate,20))", "name": "weekly_turnover_absorption_20", "is_ic": -0.0647, "is_ic_ir": -0.293, "is_sharpe": 7.712, "is_turnover": 0.19, "is_monotonicity": 0.5, "gates": "FAIL", "status": "reverted", "eval_seconds": 129.3, "sleeve_id": "cn_ai_flow_absorption", "mispricing_source": "Quiet accumulation is underreacted because headline-driven capital pays for visible breakouts, not stable dip absorption inside validated AI supply-chain names.", "forced_counterparty": "Retail T+1 theme traders and benchmark-constrained managers who rotate on catalysts and provide liquidity during low-drama accumulation phases.", "data_requirements": "[\"daily turnover_rate\",\"daily ret_1d\",\"AI universe membership filter\",\"beta hedge and residual attribution vs 000300.SH/399006.SZ\",\"source-review evidence card before any supplier/customer claim\"]", "failure_mode": "This breaks in speculative melt-up regimes where winners require expanding turnover spikes, or when turnover_rate is mechanically distorted by suspensions, unlocks, or capital structure events.", "report_contract": "action_overlay", "ai_supercycle_layer": "ai_chip_equipment_materials_packaging", "supply_chain_hypothesis": "Quiet weekly-normalized turnover plus dip absorption should surface D2-D4 packaging/equipment bottleneck names before backlog or capex confirmation is fully priced.", "relationship_evidence_required": "true", "money_readiness": "research_only", "decision": "revert", "session_branch": "main", "base_ref": "origin/main", "merge_base": "2eab9f478b0dc49677cbf8591dc6f306dae18a0f", "head_commit": "2eab9f478b0dc49677cbf8591dc6f306dae18a0f"}
{"ts": "2026-05-20T14:55:34.707427+08:00", "session_id": "20260520_140002_6d34ae", "market": "cn", "formula": "rank(ts_min(amount / circ_market_cap,20) / ts_max(amount / circ_market_cap,20))", "name": "float_flow_corridor_20", "is_ic": -0.0456, "is_ic_ir": -0.168, "is_sharpe": 3.281, "is_turnover": 0.128, "is_monotonicity": 1.0, "gates": "FAIL", "status": "reverted", "eval_seconds": 219.0, "sleeve_id": "cn_ai_flow_absorption", "mispricing_source": "Underreaction to steady inventory absorption in constrained-float AI supply-chain names; this is a participation-shape signal, not a high-correlation variant of raw price momentum or candle-shadow factors.", "forced_counterparty": "Retail theme traders and benchmarked funds that cannot fully own illiquid bottleneck candidates before official confirmation", "data_requirements": "[\"daily amount\",\"circ_market_cap\",\"AI universe membership\",\"beta hedge attribution vs 000300.SH and 399006.SZ\",\"sleeve correlation matrix\",\"source-reviewed AI exposure tags before production promotion\"]", "failure_mode": "Stops working when headline-driven speculative bursts dominate returns or when the whole AI theme rerates together and the signal degrades into a generic small/liquidity effect.", "report_contract": "fresh_buy_gate", "ai_supercycle_layer": "ai_chip_equipment_materials_packaging", "supply_chain_hypothesis": "In the source-reviewed CN AI universe, domestic semiconductor equipment/material/advanced-packaging bottleneck names with a high float-flow corridor are candidates for accumulation ahead of localization and AI capex order confirmation.", "relationship_evidence_required": "true", "money_readiness": "money_candidate", "decision": "revert", "session_branch": "main", "base_ref": "origin/main", "merge_base": "2eab9f478b0dc49677cbf8591dc6f306dae18a0f", "head_commit": "2eab9f478b0dc49677cbf8591dc6f306dae18a0f"}
{"ts": "2026-05-20T14:55:34.707427+08:00", "session_id": "20260520_140002_6d34ae", "market": "cn", "formula": "rank(-ts_max(turnover_rate,20)/(ts_mean(turnover_rate,20)+0.01)-ts_corr(ret_1d,shift(ret_1d,1),40))", "name": "turnover_spike_anti_autocorr_20", "is_ic": 0.0238, "is_ic_ir": 0.083, "is_sharpe": 3.714, "is_turnover": 0.157, "is_monotonicity": 0.7, "gates": "FAIL", "status": "reverted", "eval_seconds": 197.7, "sleeve_id": "cn_ai_flow_absorption", "mispricing_source": "Underreaction to quiet ownership tightening inside AI-infra names; the market overweights spike-day excitement and underprices steady absorption.", "forced_counterparty": "Hot-money retail and benchmarked liquidity providers trading for flow rather than information.", "data_requirements": "[\"daily OHLCV\",\"daily_basic.turnover_rate\",\"beta/residual attribution vs 000300.SH and 399006.SZ before promotion\"]", "failure_mode": "Fails in mania or policy-shock regimes where turnover spikes signal true leadership instead of weak-hand churn.", "report_contract": "setup_overlay", "ai_supercycle_layer": "ai_chip_equipment_materials_packaging", "supply_chain_hypothesis": "Domestic chip equipment/materials/packaging bottlenecks with muted turnover spikes and low return chasing are being accumulated ahead of visible AI capex or order confirmation.", "relationship_evidence_required": "true", "money_readiness": "research_only", "decision": "revert", "session_branch": "main", "base_ref": "origin/main", "merge_base": "2eab9f478b0dc49677cbf8591dc6f306dae18a0f", "head_commit": "2eab9f478b0dc49677cbf8591dc6f306dae18a0f"}
{"ts": "2026-05-20T14:55:34.707427+08:00", "session_id": "20260520_140002_6d34ae", "market": "cn", "formula": "rank(ts_rank(amount,20)-rank(ret_20d))", "name": "cash_absorption_pullback_20", "is_ic": 0.0223, "is_ic_ir": 0.114, "is_sharpe": -2.228, "is_turnover": 0.426, "is_monotonicity": 0.35, "gates": "FAIL", "status": "reverted", "eval_seconds": 111.0, "sleeve_id": "daily_price_overlay", "mispricing_source": "Slow institutional accumulation against short-horizon de-risking creates a temporary discount; the tape shows inventory transfer before price fully recovers.", "forced_counterparty": "Retail momentum traders and volatility-budgeted funds cutting recent laggards into pullbacks.", "data_requirements": "[\"amount\",\"ret_20d\",\"validated ai_infra universe membership\",\"beta-hedged sleeve attribution\",\"corr vs existing sleeves, especially stable_float_flow_20\"]", "failure_mode": "It stops working in pure momentum-chase regimes where high amount only confirms already-extended winners, or in panic/liquidity-shock markets where volume spikes reflect indiscriminate exit rather than absorption.", "report_contract": "setup_overlay", "ai_supercycle_layer": "none", "supply_chain_hypothesis": "Orderly cash absorption after sector pullbacks should surface first in already-validated AI-infra bottleneck names, but the exact supplier/customer path must be confirmed outside the factor.", "relationship_evidence_required": "true", "money_readiness": "research_only", "decision": "revert", "session_branch": "main", "base_ref": "origin/main", "merge_base": "2eab9f478b0dc49677cbf8591dc6f306dae18a0f", "head_commit": "2eab9f478b0dc49677cbf8591dc6f306dae18a0f"}
{"ts": "2026-05-20T14:55:34.707427+08:00", "session_id": "20260520_140002_6d34ae", "market": "cn", "formula": "rank(ts_min(amount/circ_market_cap,20)/ts_mean(amount/circ_market_cap,20))", "name": "float_flow_floor_20", "is_ic": -0.0598, "is_ic_ir": -0.228, "is_sharpe": 1.957, "is_turnover": 0.159, "is_monotonicity": 0.7, "gates": "FAIL", "status": "reverted", "eval_seconds": 208.3, "sleeve_id": "cn_aiinfra_ownership_quality", "mispricing_source": "Quiet multi-day absorption is hard to see in a retail-dominated, catalyst-chasing market, so names with persistent sponsorship between news bursts stay underowned for longer than they should.", "forced_counterparty": "T+1 retail momentum traders and benchmark-aware PMs who transact around spikes or de-risk into quiet sessions rather than warehousing exposure steadily", "data_requirements": "[\"Current CN daily price + daily_basic amount,circ_market_cap are sufficient for IS test\",\"Promotion requires source-reviewed AI-universe membership, sleeve correlation, beta-hedged return, and residual risk attribution\"]", "failure_mode": "This stops working when quiet turnover floor reflects illiquidity instead of accumulation, or when AI-infra trades become pure macro beta and one-day narrative spikes dominate price discovery.", "report_contract": "fresh_buy_gate", "ai_supercycle_layer": "ai_chip_equipment_materials_packaging", "supply_chain_hypothesis": "Validated CN D1-D3 AI bottleneck suppliers, especially chip equipment/materials/packaging names, should show a non-collapsing floor in float-normalized cash turnover before backlog or order evidence is broadly recognized.", "relationship_evidence_required": "true", "money_readiness": "money_candidate", "decision": "revert", "session_branch": "main", "base_ref": "origin/main", "merge_base": "2eab9f478b0dc49677cbf8591dc6f306dae18a0f", "head_commit": "2eab9f478b0dc49677cbf8591dc6f306dae18a0f"}
{"ts": "2026-05-20T14:55:34.707427+08:00", "session_id": "20260520_140002_6d34ae", "market": "cn", "formula": "rank(ts_min(amount,20)/ts_mean(amount,20))*rank(-ts_std(volume_ratio,20))", "name": "amount_floor_relvol_calm_20", "is_ic": 0.0324, "is_ic_ir": 0.207, "is_sharpe": -1.236, "is_turnover": 0.133, "is_monotonicity": 0.05, "gates": "PASS", "status": "checks_failed", "eval_seconds": 176.4, "sleeve_id": "cn_ai_quiet_accumulation", "mispricing_source": "Slow information diffusion and T+1 trading frictions let steady, non-speculative accumulation persist for weeks before benchmark-aware capital chases the move.", "forced_counterparty": "Retail hot-money traders and benchmark-constrained managers rotating toward high-volume story names instead of low-noise accumulators", "data_requirements": "[\"daily OHLCV\",\"amount\",\"volume_ratio\",\"hedged sleeve attribution vs 000300.SH/399006.SZ\",\"factor correlation to promoted sleeves before promotion\"]", "failure_mode": "This stops working in mania regimes where breakout names with spiking turnover dominate, or if AI capex expectations roll over and quiet flow no longer signals latent demand.", "report_contract": "setup_overlay", "ai_supercycle_layer": "ai_chip_equipment_materials_packaging", "supply_chain_hypothesis": "Candidate domestic AI equipment/materials/packaging bottleneck names are being accumulated ahead of verified order spill-through from global accelerator, memory, and networking capex.", "relationship_evidence_required": "true", "money_readiness": "research_only", "decision": "revert", "session_branch": "main", "base_ref": "origin/main", "merge_base": "2eab9f478b0dc49677cbf8591dc6f306dae18a0f", "head_commit": "2eab9f478b0dc49677cbf8591dc6f306dae18a0f", "oos": "PASS", "checks_status": "failed"}
{"ts": "2026-05-20T14:55:34.707427+08:00", "session_id": "20260520_140002_6d34ae", "market": "cn", "formula": "rank(-ts_corr(ret_5d, amount, 20))*rank(ts_min(turnover_rate,20)/ts_mean(turnover_rate,20))", "name": "ret5_amount_absorb_floor_20", "is_ic": -0.0489, "is_ic_ir": -0.19, "is_sharpe": -1.164, "is_turnover": 0.162, "is_monotonicity": -0.1, "gates": "FAIL", "status": "reverted", "eval_seconds": 173.4, "sleeve_id": "daily_flow_absorption_overlay", "mispricing_source": "Short-horizon sellers mark down AI leaders during a 1-week dip even when cash participation stays firm, so price temporarily undershoots persistent demand.", "forced_counterparty": "Retail momentum traders and fast-money funds reducing recent losers into institutions that still need AI exposure.", "data_requirements": "[\"current CN daily tape is sufficient for IS\",\"for promotion require beta-hedged sleeve attribution vs 000300.SH and 399006.SZ\",\"check corr vs turnover_stability_20, stable_float_flow_20, amount_floor_relvol_calm_20\",\"if used to assert supplier bottlenecks, require filings/press releases/evidence cards\"]", "failure_mode": "Fails when the sector is in true distribution or policy/liquidity shock, where a stable turnover floor becomes exit liquidity rather than absorption.", "report_contract": "setup_overlay", "ai_supercycle_layer": "ai_networking_optical_cpo", "supply_chain_hypothesis": "Candidate discovery signal for CN optical/CPO and interconnect bottleneck names where steady turnover persists through pullbacks before another AI-demand repricing leg.", "relationship_evidence_required": "true", "money_readiness": "research_only", "decision": "revert", "session_branch": "main", "base_ref": "origin/main", "merge_base": "2eab9f478b0dc49677cbf8591dc6f306dae18a0f", "head_commit": "2eab9f478b0dc49677cbf8591dc6f306dae18a0f"}
