{"ts": "2026-05-04T06:56:44.512068+08:00", "session_id": "20260504_060002_ba5d5e", "market": "cn", "formula": "rank(-ts_corr(ret_1d, shift(ret_1d, 1), 20)) * rank(-ts_max(ret_1d, 20))", "name": "autocorr_low_lottery_20", "is_ic": 0.0444, "is_ic_ir": 0.374, "is_sharpe": 0.945, "is_turnover": 0.152, "is_monotonicity": 0.05, "gates": "PASS", "status": "checks_failed", "eval_seconds": 116.0, "decision": "revert", "session_branch": "main", "base_ref": "origin/main", "merge_base": "7e71edc0d50443d3db4f0dd72c25238cd7ac1282", "head_commit": "7e71edc0d50443d3db4f0dd72c25238cd7ac1282", "oos": "PASS", "checks_status": "failed"}
{"ts": "2026-05-04T06:56:44.512068+08:00", "session_id": "20260504_060002_ba5d5e", "market": "cn", "formula": "rank(-ts_corr(ret_1d,shift(ret_1d,1),20))*rank(ts_min(ts_sum(amount,5),20)/ts_max(ts_sum(amount,5),20))", "name": "anti_autocorr_weekly_amount_corridor_20", "is_ic": 0.0367, "is_ic_ir": 0.439, "is_sharpe": 4.248, "is_turnover": 0.159, "is_monotonicity": 0.3, "gates": "PASS", "status": "candidate", "eval_seconds": 97.9, "decision": "candidate", "session_branch": "main", "base_ref": "origin/main", "merge_base": "7e71edc0d50443d3db4f0dd72c25238cd7ac1282", "head_commit": "7e71edc0d50443d3db4f0dd72c25238cd7ac1282"}
{"ts": "2026-05-04T06:56:44.512068+08:00", "session_id": "20260504_060002_ba5d5e", "market": "cn", "formula": "rank(-ts_corr(ret_1d,shift(ret_1d,1),20))*rank(-ts_std(pct_change(amount/circ_market_cap,5),20))", "name": "anti_autocorr_float_growth_stability_20", "is_ic": 0.0396, "is_ic_ir": 0.457, "is_sharpe": 3.071, "is_turnover": 0.153, "is_monotonicity": 0.05, "gates": "PASS", "status": "candidate", "eval_seconds": 175.5, "decision": "candidate", "session_branch": "main", "base_ref": "origin/main", "merge_base": "7e71edc0d50443d3db4f0dd72c25238cd7ac1282", "head_commit": "7e71edc0d50443d3db4f0dd72c25238cd7ac1282"}
{"ts": "2026-05-04T06:56:44.512068+08:00", "session_id": "20260504_060002_ba5d5e", "market": "cn", "formula": "rank(-ts_corr(ret_1d,shift(ret_1d,1),20))*rank(ts_min(turnover_rate,20)/ts_max(turnover_rate,20))", "name": "anti_autocorr_turnover_corridor_20", "is_ic": 0.0383, "is_ic_ir": 0.49, "is_sharpe": 4.135, "is_turnover": 0.169, "is_monotonicity": 0.4, "gates": "PASS", "status": "candidate", "eval_seconds": 168.3, "decision": "candidate", "session_branch": "main", "base_ref": "origin/main", "merge_base": "7e71edc0d50443d3db4f0dd72c25238cd7ac1282", "head_commit": "7e71edc0d50443d3db4f0dd72c25238cd7ac1282"}
{"ts": "2026-05-04T06:56:44.512068+08:00", "session_id": "20260504_060002_ba5d5e", "market": "cn", "formula": "rank(-ts_corr(ret_1d,shift(ret_1d,1),20))*rank(-pb)", "name": "pb_anti_autocorr_20", "is_ic": 0.022, "is_ic_ir": 0.179, "is_sharpe": 0.74, "is_turnover": 0.127, "is_monotonicity": -0.15, "gates": "FAIL", "status": "reverted", "eval_seconds": 33.7, "decision": "revert", "session_branch": "main", "base_ref": "origin/main", "merge_base": "7e71edc0d50443d3db4f0dd72c25238cd7ac1282", "head_commit": "7e71edc0d50443d3db4f0dd72c25238cd7ac1282"}
{"ts": "2026-05-04T06:56:44.512068+08:00", "session_id": "20260504_060002_ba5d5e", "market": "cn", "formula": "rank(-ts_corr(ret_1d,shift(ret_1d,1),20))*rank(-ts_max(turnover_rate,20)/ts_sum(turnover_rate,20))", "name": "anti_autocorr_turnover_evenness_20", "is_ic": 0.0341, "is_ic_ir": 0.458, "is_sharpe": 2.258, "is_turnover": 0.174, "is_monotonicity": 0.25, "gates": "PASS", "status": "candidate", "eval_seconds": 158.4, "decision": "candidate", "session_branch": "main", "base_ref": "origin/main", "merge_base": "7e71edc0d50443d3db4f0dd72c25238cd7ac1282", "head_commit": "7e71edc0d50443d3db4f0dd72c25238cd7ac1282"}
{"ts": "2026-05-04T06:56:44.512068+08:00", "session_id": "20260504_060002_ba5d5e", "market": "cn", "formula": "rank(-ts_corr(ret_1d,shift(ret_1d,1),20))*rank(ts_mean(amount/circ_market_cap,20)/ts_std(amount/circ_market_cap,20))", "name": "anti_autocorr_float_flow_smooth_20", "is_ic": 0.0399, "is_ic_ir": 0.495, "is_sharpe": 3.724, "is_turnover": 0.166, "is_monotonicity": 0.35, "gates": "PASS", "status": "checks_failed", "eval_seconds": 146.5, "decision": "revert", "session_branch": "main", "base_ref": "origin/main", "merge_base": "7e71edc0d50443d3db4f0dd72c25238cd7ac1282", "head_commit": "7e71edc0d50443d3db4f0dd72c25238cd7ac1282", "oos": "PASS", "checks_status": "failed"}
{"ts": "2026-05-04T06:56:44.512068+08:00", "session_id": "20260504_060002_ba5d5e", "market": "cn", "formula": "rank(-ts_corr(ret_1d,shift(ret_1d,1),20))*rank(ts_min(volume_ratio,20)/ts_max(volume_ratio,20))", "name": "anti_autocorr_relvol_corridor_20", "is_ic": 0.0339, "is_ic_ir": 0.416, "is_sharpe": 2.188, "is_turnover": 0.167, "is_monotonicity": 0.0, "gates": "PASS", "status": "candidate", "eval_seconds": 126.6, "decision": "candidate", "session_branch": "main", "base_ref": "origin/main", "merge_base": "7e71edc0d50443d3db4f0dd72c25238cd7ac1282", "head_commit": "7e71edc0d50443d3db4f0dd72c25238cd7ac1282"}
{"ts": "2026-05-04T06:56:44.512068+08:00", "session_id": "20260504_060002_ba5d5e", "market": "cn", "formula": "rank(-ts_corr(ret_1d,shift(ret_1d,1),20))*rank(ts_mean(ts_sum(open/close,5),20)/ts_max(ts_sum(open/close,5),20))", "name": "anti_autocorr_weekly_openclose_evenness_20", "is_ic": 0.0282, "is_ic_ir": 0.312, "is_sharpe": 1.08, "is_turnover": 0.156, "is_monotonicity": 0.05, "gates": "PASS", "status": "candidate", "eval_seconds": 184.4, "decision": "candidate", "session_branch": "main", "base_ref": "origin/main", "merge_base": "7e71edc0d50443d3db4f0dd72c25238cd7ac1282", "head_commit": "7e71edc0d50443d3db4f0dd72c25238cd7ac1282"}
{"ts": "2026-05-04T06:56:44.512068+08:00", "session_id": "20260504_060002_ba5d5e", "market": "cn", "formula": "rank(-ts_corr(ret_1d,shift(ret_1d,1),20))*rank(-ts_corr(high/low-1,amount,20))", "name": "anti_autocorr_amount_absorb_20", "is_ic": 0.0308, "is_ic_ir": 0.42, "is_sharpe": 3.192, "is_turnover": 0.196, "is_monotonicity": 0.55, "gates": "PASS", "status": "candidate", "eval_seconds": 171.6, "decision": "candidate", "session_branch": "main", "base_ref": "origin/main", "merge_base": "7e71edc0d50443d3db4f0dd72c25238cd7ac1282", "head_commit": "7e71edc0d50443d3db4f0dd72c25238cd7ac1282"}
{"ts": "2026-05-04T06:56:44.512068+08:00", "session_id": "20260504_060002_ba5d5e", "market": "cn", "formula": "rank(-ts_corr(ret_1d,shift(ret_1d,1),20))*rank(ts_mean(ts_sum(turnover_rate,5),20)/ts_std(ts_sum(turnover_rate,5),20))", "name": "anti_autocorr_weekly_turnover_smooth_20", "is_ic": 0.0362, "is_ic_ir": 0.448, "is_sharpe": 3.558, "is_turnover": 0.151, "is_monotonicity": 0.65, "gates": "PASS", "status": "candidate", "eval_seconds": 190.5, "decision": "candidate", "session_branch": "main", "base_ref": "origin/main", "merge_base": "7e71edc0d50443d3db4f0dd72c25238cd7ac1282", "head_commit": "7e71edc0d50443d3db4f0dd72c25238cd7ac1282"}
{"ts": "2026-05-04T06:56:44.512068+08:00", "session_id": "20260504_060002_ba5d5e", "market": "cn", "formula": "rank(-ts_corr(delta(log(amount),5),shift(delta(log(amount),5),5),20))*rank(-ts_std(delta(log(amount),5),20))", "name": "anti_autocorr_log_amount_smooth_20_5", "is_ic": 0.0, "is_ic_ir": 0.0, "is_sharpe": 0.0, "is_turnover": 0.0, "is_monotonicity": 0.0, "gates": "FAIL", "status": "compute_error", "eval_seconds": 148.4, "decision": "revert", "session_branch": "main", "base_ref": "origin/main", "merge_base": "7e71edc0d50443d3db4f0dd72c25238cd7ac1282", "head_commit": "7e71edc0d50443d3db4f0dd72c25238cd7ac1282"}
{"ts": "2026-05-04T06:56:44.512068+08:00", "session_id": "20260504_060002_ba5d5e", "market": "cn", "formula": "rank(-ret_5d)*rank(-ts_corr(ret_5d,shift(ret_5d,5),20))", "name": "weekly_reversal_autocorr_20", "is_ic": -0.0013, "is_ic_ir": -0.024, "is_sharpe": -4.881, "is_turnover": 0.281, "is_monotonicity": -0.35, "gates": "FAIL", "status": "reverted", "eval_seconds": 122.6, "decision": "revert", "session_branch": "main", "base_ref": "origin/main", "merge_base": "7e71edc0d50443d3db4f0dd72c25238cd7ac1282", "head_commit": "7e71edc0d50443d3db4f0dd72c25238cd7ac1282"}
{"ts": "2026-05-04T06:56:44.512068+08:00", "session_id": "20260504_060002_ba5d5e", "market": "cn", "formula": "rank(-ts_corr(amount,abs(ret_5d),20))", "name": "amount_absorb_20_5d", "is_ic": 0.0018, "is_ic_ir": 0.021, "is_sharpe": -1.796, "is_turnover": 0.153, "is_monotonicity": 0.1, "gates": "FAIL", "status": "reverted", "eval_seconds": 101.0, "decision": "revert", "session_branch": "main", "base_ref": "origin/main", "merge_base": "7e71edc0d50443d3db4f0dd72c25238cd7ac1282", "head_commit": "7e71edc0d50443d3db4f0dd72c25238cd7ac1282"}
{"ts": "2026-05-04T06:56:44.512068+08:00", "session_id": "20260504_060002_ba5d5e", "market": "cn", "formula": "rank(-ts_corr(ret_1d,shift(ret_1d,1),20))*rank(ts_mean(volume_ratio,20)/ts_max(volume_ratio,20))", "name": "anti_autocorr_relvol_evenness_20", "is_ic": 0.0331, "is_ic_ir": 0.425, "is_sharpe": 1.823, "is_turnover": 0.17, "is_monotonicity": 0.05, "gates": "PASS", "status": "candidate", "eval_seconds": 203.8, "decision": "candidate", "session_branch": "main", "base_ref": "origin/main", "merge_base": "7e71edc0d50443d3db4f0dd72c25238cd7ac1282", "head_commit": "7e71edc0d50443d3db4f0dd72c25238cd7ac1282"}
{"ts": "2026-05-04T06:56:44.512068+08:00", "session_id": "20260504_060002_ba5d5e", "market": "cn", "formula": "rank(ts_min(ts_sum(amount/circ_market_cap,5),20)/ts_mean(ts_sum(amount/circ_market_cap,5),20)-ts_corr(ret_1d,shift(ret_1d,1),20))", "name": "weekly_float_floor_underreaction_20", "is_ic": 0.0371, "is_ic_ir": 0.446, "is_sharpe": 4.045, "is_turnover": 0.175, "is_monotonicity": 0.55, "gates": "PASS", "status": "candidate", "eval_seconds": 154.2, "decision": "candidate", "session_branch": "main", "base_ref": "origin/main", "merge_base": "7e71edc0d50443d3db4f0dd72c25238cd7ac1282", "head_commit": "7e71edc0d50443d3db4f0dd72c25238cd7ac1282"}
{"ts": "2026-05-04T06:56:44.512068+08:00", "session_id": "20260504_060002_ba5d5e", "market": "cn", "formula": "rank(-ts_corr(ret_1d,shift(ret_1d,1),20))*rank(ts_min(amount/circ_market_cap,20)/ts_max(amount/circ_market_cap,20))", "name": "anti_autocorr_float_corridor_20", "is_ic": 0.0379, "is_ic_ir": 0.485, "is_sharpe": 4.003, "is_turnover": 0.169, "is_monotonicity": 0.4, "gates": "PASS", "status": "candidate", "eval_seconds": 141.9, "decision": "candidate", "session_branch": "main", "base_ref": "origin/main", "merge_base": "7e71edc0d50443d3db4f0dd72c25238cd7ac1282", "head_commit": "7e71edc0d50443d3db4f0dd72c25238cd7ac1282"}
{"ts": "2026-05-04T06:56:44.512068+08:00", "session_id": "20260504_060002_ba5d5e", "market": "cn", "formula": "rank(-ts_corr(ret_1d,shift(ret_1d,1),20))*rank(-ts_std(ts_sum(volume_ratio,5),20)/ts_mean(ts_sum(volume_ratio,5),20))", "name": "anti_autocorr_weekly_relvol_stability_20", "is_ic": 0.035, "is_ic_ir": 0.445, "is_sharpe": 3.792, "is_turnover": 0.147, "is_monotonicity": 0.3, "gates": "PASS", "status": "candidate", "eval_seconds": 217.2, "decision": "candidate", "session_branch": "main", "base_ref": "origin/main", "merge_base": "7e71edc0d50443d3db4f0dd72c25238cd7ac1282", "head_commit": "7e71edc0d50443d3db4f0dd72c25238cd7ac1282"}
{"ts": "2026-05-04T06:56:44.512068+08:00", "session_id": "20260504_060002_ba5d5e", "market": "cn", "formula": "rank(-ts_corr(ret_1d,shift(ret_1d,1),20))*rank(-ts_mean(abs(pct_change(amount/market_cap,5)),20))", "name": "anti_autocorr_mcapflow_change_smooth_20", "is_ic": 0.0423, "is_ic_ir": 0.452, "is_sharpe": 3.456, "is_turnover": 0.157, "is_monotonicity": 0.05, "gates": "PASS", "status": "checks_failed", "eval_seconds": 183.5, "decision": "revert", "session_branch": "main", "base_ref": "origin/main", "merge_base": "7e71edc0d50443d3db4f0dd72c25238cd7ac1282", "head_commit": "7e71edc0d50443d3db4f0dd72c25238cd7ac1282", "oos": "PASS", "checks_status": "failed"}
{"ts": "2026-05-04T06:56:44.512068+08:00", "session_id": "20260504_060002_ba5d5e", "market": "cn", "formula": "rank(-ts_corr(ret_1d,shift(ret_1d,1),20))*rank(ts_min(amount/market_cap,20)/ts_mean(amount/market_cap,20))", "name": "anti_autocorr_mcapflow_floor_20", "is_ic": 0.0387, "is_ic_ir": 0.452, "is_sharpe": 1.743, "is_turnover": 0.178, "is_monotonicity": 0.4, "gates": "PASS", "status": "candidate", "eval_seconds": 140.9, "decision": "candidate", "session_branch": "main", "base_ref": "origin/main", "merge_base": "7e71edc0d50443d3db4f0dd72c25238cd7ac1282", "head_commit": "7e71edc0d50443d3db4f0dd72c25238cd7ac1282"}
{"ts": "2026-05-04T06:56:44.512068+08:00", "session_id": "20260504_060002_ba5d5e", "market": "cn", "formula": "rank(ts_min(ts_sum(amount/market_cap,5),20)/ts_mean(ts_sum(amount/market_cap,5),20)-ts_corr(ret_1d,shift(ret_1d,1),20))", "name": "weekly_mcapflow_floor_underreaction_20", "is_ic": 0.0376, "is_ic_ir": 0.449, "is_sharpe": 4.254, "is_turnover": 0.175, "is_monotonicity": 0.45, "gates": "PASS", "status": "candidate", "eval_seconds": 163.1, "decision": "candidate", "session_branch": "main", "base_ref": "origin/main", "merge_base": "7e71edc0d50443d3db4f0dd72c25238cd7ac1282", "head_commit": "7e71edc0d50443d3db4f0dd72c25238cd7ac1282"}
{"ts": "2026-05-04T06:56:44.512068+08:00", "session_id": "20260504_060002_ba5d5e", "market": "cn", "formula": "rank(-ts_corr(ret_1d,shift(ret_1d,1),20))*rank(ts_mean(ts_sum(amount/market_cap,5),20)/ts_std(ts_sum(amount/market_cap,5),20))", "name": "anti_autocorr_weekly_mcapflow_stability_20", "is_ic": 0.0364, "is_ic_ir": 0.452, "is_sharpe": 3.305, "is_turnover": 0.151, "is_monotonicity": 0.65, "gates": "PASS", "status": "candidate", "eval_seconds": 179.2, "decision": "candidate", "session_branch": "main", "base_ref": "origin/main", "merge_base": "7e71edc0d50443d3db4f0dd72c25238cd7ac1282", "head_commit": "7e71edc0d50443d3db4f0dd72c25238cd7ac1282"}
{"ts": "2026-05-04T14:56:53.498474+08:00", "session_id": "20260504_140002_0c1464", "market": "cn", "formula": "rank(-ts_std(turnover_rate, 20) / ts_mean(turnover_rate, 20))", "name": "turnover_stability_20", "is_ic": 0.0374, "is_ic_ir": 0.373, "is_sharpe": 1.522, "is_turnover": 0.121, "is_monotonicity": 0.7, "gates": "PASS", "status": "candidate", "eval_seconds": 115.0, "decision": "candidate", "session_branch": "main", "base_ref": "origin/main", "merge_base": "7e71edc0d50443d3db4f0dd72c25238cd7ac1282", "head_commit": "7e71edc0d50443d3db4f0dd72c25238cd7ac1282"}
{"ts": "2026-05-04T14:56:53.498474+08:00", "session_id": "20260504_140002_0c1464", "market": "cn", "formula": "rank(ts_min(ts_sum(turnover_rate,5),20)/ts_max(ts_sum(turnover_rate,5),20))", "name": "weekly_turnover_corridor_20", "is_ic": 0.0282, "is_ic_ir": 0.275, "is_sharpe": 0.411, "is_turnover": 0.107, "is_monotonicity": 0.75, "gates": "PASS", "status": "candidate", "eval_seconds": 191.3, "decision": "candidate", "session_branch": "main", "base_ref": "origin/main", "merge_base": "7e71edc0d50443d3db4f0dd72c25238cd7ac1282", "head_commit": "7e71edc0d50443d3db4f0dd72c25238cd7ac1282"}
{"ts": "2026-05-04T14:56:53.498474+08:00", "session_id": "20260504_140002_0c1464", "market": "cn", "formula": "rank(-ts_corr(ret_1d,shift(ret_1d,1),20))*rank(-ts_std(turnover_rate,20)/ts_mean(turnover_rate,20))", "name": "anti_autocorr_turnover_stability_20", "is_ic": 0.0403, "is_ic_ir": 0.497, "is_sharpe": 3.701, "is_turnover": 0.166, "is_monotonicity": 0.35, "gates": "PASS", "status": "candidate", "eval_seconds": 104.1, "decision": "candidate", "session_branch": "main", "base_ref": "origin/main", "merge_base": "7e71edc0d50443d3db4f0dd72c25238cd7ac1282", "head_commit": "7e71edc0d50443d3db4f0dd72c25238cd7ac1282"}
{"ts": "2026-05-04T14:56:53.498474+08:00", "session_id": "20260504_140002_0c1464", "market": "cn", "formula": "rank(-ts_corr(ret_1d,shift(ret_1d,1),20))*rank(ts_mean(amount,20)/ts_max(amount,20))", "name": "anti_autocorr_amount_peak_balance_20", "is_ic": 0.0366, "is_ic_ir": 0.475, "is_sharpe": 2.167, "is_turnover": 0.174, "is_monotonicity": 0.15, "gates": "PASS", "status": "candidate", "eval_seconds": 141.7, "decision": "candidate", "session_branch": "main", "base_ref": "origin/main", "merge_base": "7e71edc0d50443d3db4f0dd72c25238cd7ac1282", "head_commit": "7e71edc0d50443d3db4f0dd72c25238cd7ac1282"}
{"ts": "2026-05-04T14:56:53.498474+08:00", "session_id": "20260504_140002_0c1464", "market": "cn", "formula": "rank(-ts_corr(ret_1d,shift(ret_1d,1),20))*rank(ts_min(close/open,20)/ts_max(close/open,20))", "name": "anti_autocorr_openclose_corridor_20", "is_ic": 0.041, "is_ic_ir": 0.349, "is_sharpe": 0.573, "is_turnover": 0.152, "is_monotonicity": 0.0, "gates": "PASS", "status": "candidate", "eval_seconds": 241.8, "decision": "candidate", "session_branch": "main", "base_ref": "origin/main", "merge_base": "7e71edc0d50443d3db4f0dd72c25238cd7ac1282", "head_commit": "7e71edc0d50443d3db4f0dd72c25238cd7ac1282"}
{"ts": "2026-05-04T14:56:53.498474+08:00", "session_id": "20260504_140002_0c1464", "market": "cn", "formula": "rank(-ts_corr(amount,shift(amount,5),20))", "name": "anti_weekly_amount_autocorr_20", "is_ic": -0.0192, "is_ic_ir": -0.203, "is_sharpe": -5.142, "is_turnover": 0.175, "is_monotonicity": -0.45, "gates": "FAIL", "status": "reverted", "eval_seconds": 136.8, "decision": "revert", "session_branch": "main", "base_ref": "origin/main", "merge_base": "7e71edc0d50443d3db4f0dd72c25238cd7ac1282", "head_commit": "7e71edc0d50443d3db4f0dd72c25238cd7ac1282"}
{"ts": "2026-05-04T14:56:53.498474+08:00", "session_id": "20260504_140002_0c1464", "market": "cn", "formula": "rank(-ts_corr(ret_1d,shift(ret_1d,1),20))*rank(ts_mean(ts_sum(amount/market_cap,5),20)/ts_std(ts_sum(amount/market_cap,5),20))", "name": "anti_autocorr_weekly_mcapflow_stability_20", "is_ic": 0.0364, "is_ic_ir": 0.452, "is_sharpe": 3.305, "is_turnover": 0.151, "is_monotonicity": 0.65, "gates": "PASS", "status": "candidate", "eval_seconds": 89.3, "decision": "candidate", "session_branch": "main", "base_ref": "origin/main", "merge_base": "7e71edc0d50443d3db4f0dd72c25238cd7ac1282", "head_commit": "7e71edc0d50443d3db4f0dd72c25238cd7ac1282"}
{"ts": "2026-05-04T14:56:53.498474+08:00", "session_id": "20260504_140002_0c1464", "market": "cn", "formula": "rank(ts_mean(amount/circ_market_cap,20)/ts_max(amount/circ_market_cap,20))*rank(-ts_corr(amount/circ_market_cap,shift(amount/circ_market_cap,5),20))", "name": "anti_autocorr_weekly_mcapflow_peak_balance_20", "is_ic": 0.0112, "is_ic_ir": 0.119, "is_sharpe": -1.363, "is_turnover": 0.167, "is_monotonicity": 0.3, "gates": "FAIL", "status": "reverted", "eval_seconds": 142.7, "decision": "revert", "session_branch": "main", "base_ref": "origin/main", "merge_base": "7e71edc0d50443d3db4f0dd72c25238cd7ac1282", "head_commit": "7e71edc0d50443d3db4f0dd72c25238cd7ac1282"}
{"ts": "2026-05-04T14:56:53.498474+08:00", "session_id": "20260504_140002_0c1464", "market": "cn", "formula": "rank(-ts_corr(ret_1d,shift(ret_1d,1),20))*rank(ts_mean(ts_sum(volume_ratio,5),20)/ts_max(ts_sum(volume_ratio,5),20))", "name": "anti_autocorr_weekly_relvol_evenness_20", "is_ic": 0.0362, "is_ic_ir": 0.466, "is_sharpe": 2.861, "is_turnover": 0.162, "is_monotonicity": 0.3, "gates": "PASS", "status": "candidate", "eval_seconds": 124.3, "decision": "candidate", "session_branch": "main", "base_ref": "origin/main", "merge_base": "7e71edc0d50443d3db4f0dd72c25238cd7ac1282", "head_commit": "7e71edc0d50443d3db4f0dd72c25238cd7ac1282"}
{"ts": "2026-05-04T14:56:53.498474+08:00", "session_id": "20260504_140002_0c1464", "market": "cn", "formula": "rank(-ts_corr(ret_1d,shift(ret_1d,1),20))*rank(ts_min(ts_sum(amount/market_cap,5),20)/ts_mean(ts_sum(amount/market_cap,5),20))", "name": "anti_autocorr_weekly_mcapflow_floor_20", "is_ic": 0.037, "is_ic_ir": 0.405, "is_sharpe": 3.589, "is_turnover": 0.167, "is_monotonicity": 0.6, "gates": "PASS", "status": "candidate", "eval_seconds": 107.4, "decision": "candidate", "session_branch": "main", "base_ref": "origin/main", "merge_base": "7e71edc0d50443d3db4f0dd72c25238cd7ac1282", "head_commit": "7e71edc0d50443d3db4f0dd72c25238cd7ac1282"}
{"ts": "2026-05-04T14:56:53.498474+08:00", "session_id": "20260504_140002_0c1464", "market": "cn", "formula": "rank(-ts_corr(ret_1d,shift(ret_1d,1),20))*rank(ts_mean(ts_sum(turnover_rate,5),20)/ts_max(ts_sum(turnover_rate,5),20))", "name": "anti_autocorr_weekly_turnover_evenness_20", "is_ic": 0.0372, "is_ic_ir": 0.479, "is_sharpe": 3.253, "is_turnover": 0.17, "is_monotonicity": 0.5, "gates": "PASS", "status": "candidate", "eval_seconds": 152.6, "decision": "candidate", "session_branch": "main", "base_ref": "origin/main", "merge_base": "7e71edc0d50443d3db4f0dd72c25238cd7ac1282", "head_commit": "7e71edc0d50443d3db4f0dd72c25238cd7ac1282"}
{"ts": "2026-05-04T14:56:53.498474+08:00", "session_id": "20260504_140002_0c1464", "market": "cn", "formula": "-ts_mean(abs(delta(close/open,5)),20)", "name": "openclose_weekly_smooth_20", "is_ic": 0.0333, "is_ic_ir": 0.197, "is_sharpe": -0.078, "is_turnover": 0.083, "is_monotonicity": -0.05, "gates": "FAIL", "status": "reverted", "eval_seconds": 243.8, "decision": "revert", "session_branch": "main", "base_ref": "origin/main", "merge_base": "7e71edc0d50443d3db4f0dd72c25238cd7ac1282", "head_commit": "7e71edc0d50443d3db4f0dd72c25238cd7ac1282"}
{"ts": "2026-05-04T14:56:53.498474+08:00", "session_id": "20260504_140002_0c1464", "market": "cn", "formula": "rank(-ts_corr(ret_1d,shift(ret_1d,1),20))*rank(-ts_mean(abs(delta(turnover_rate,5)),20)/ts_mean(turnover_rate,20))", "name": "anti_autocorr_turnover_change_smooth_20", "is_ic": 0.0384, "is_ic_ir": 0.416, "is_sharpe": 2.504, "is_turnover": 0.162, "is_monotonicity": 0.3, "gates": "PASS", "status": "candidate", "eval_seconds": 193.2, "decision": "candidate", "session_branch": "main", "base_ref": "origin/main", "merge_base": "7e71edc0d50443d3db4f0dd72c25238cd7ac1282", "head_commit": "7e71edc0d50443d3db4f0dd72c25238cd7ac1282"}
