{"ts": "2026-05-04T14:56:53.498474+08:00", "session_id": "20260504_140002_0c1464", "market": "cn", "formula": "rank(ts_min(ts_sum(amount,5),20)/ts_mean(ts_sum(amount,5),20)-ts_corr(ret_1d,shift(ret_1d,1),20))", "name": "weekly_amount_floor_underreaction_20", "is_ic": 0.0364, "is_ic_ir": 0.443, "is_sharpe": 3.493, "is_turnover": 0.174, "is_monotonicity": 0.2, "gates": "PASS", "status": "candidate", "eval_seconds": 106.6, "decision": "candidate", "session_branch": "main", "base_ref": "origin/main", "merge_base": "7e71edc0d50443d3db4f0dd72c25238cd7ac1282", "head_commit": "7e71edc0d50443d3db4f0dd72c25238cd7ac1282"}
{"ts": "2026-05-04T14:56:53.498474+08:00", "session_id": "20260504_140002_0c1464", "market": "cn", "formula": "rank(-ts_max(ret_1d,20))*rank(-ts_std(pct_change(amount,5),20))", "name": "low_lottery_amount_change_smooth_20", "is_ic": 0.0442, "is_ic_ir": 0.3, "is_sharpe": 0.925, "is_turnover": 0.089, "is_monotonicity": -0.15, "gates": "PASS", "status": "checks_failed", "eval_seconds": 194.3, "decision": "revert", "session_branch": "main", "base_ref": "origin/main", "merge_base": "7e71edc0d50443d3db4f0dd72c25238cd7ac1282", "head_commit": "7e71edc0d50443d3db4f0dd72c25238cd7ac1282", "oos": "PASS", "checks_status": "failed"}
{"ts": "2026-05-04T14:56:53.498474+08:00", "session_id": "20260504_140002_0c1464", "market": "cn", "formula": "rank(ts_mean(amount,20)/ts_max(amount,20))*rank(-ts_max(ret_1d,20))", "name": "low_lottery_amount_evenness_20", "is_ic": 0.0416, "is_ic_ir": 0.285, "is_sharpe": 0.06, "is_turnover": 0.108, "is_monotonicity": -0.05, "gates": "PASS", "status": "checks_failed", "eval_seconds": 183.5, "decision": "revert", "session_branch": "main", "base_ref": "origin/main", "merge_base": "7e71edc0d50443d3db4f0dd72c25238cd7ac1282", "head_commit": "7e71edc0d50443d3db4f0dd72c25238cd7ac1282", "oos": "PASS", "checks_status": "failed"}
{"ts": "2026-05-04T14:56:53.498474+08:00", "session_id": "20260504_140002_0c1464", "market": "cn", "formula": "rank(-ts_max(ret_1d,20))*rank(ts_min(ts_sum(amount/circ_market_cap,5),20)/ts_mean(ts_sum(amount/circ_market_cap,5),20))", "name": "low_lottery_weekly_mcapflow_floor_20", "is_ic": 0.0355, "is_ic_ir": 0.234, "is_sharpe": 0.381, "is_turnover": 0.101, "is_monotonicity": -0.3, "gates": "PASS", "status": "candidate", "eval_seconds": 159.1, "decision": "candidate", "session_branch": "main", "base_ref": "origin/main", "merge_base": "7e71edc0d50443d3db4f0dd72c25238cd7ac1282", "head_commit": "7e71edc0d50443d3db4f0dd72c25238cd7ac1282"}
{"ts": "2026-05-04T14:56:53.498474+08:00", "session_id": "20260504_140002_0c1464", "market": "cn", "formula": "rank(-ts_corr(amount/circ_market_cap,shift(amount/circ_market_cap,5),20))*rank(-ts_mean(high/low-1,10))", "name": "low_lottery_weekly_floatflow_revert_20", "is_ic": 0.0152, "is_ic_ir": 0.105, "is_sharpe": -2.14, "is_turnover": 0.145, "is_monotonicity": -0.05, "gates": "FAIL", "status": "reverted", "eval_seconds": 139.3, "decision": "revert", "session_branch": "main", "base_ref": "origin/main", "merge_base": "7e71edc0d50443d3db4f0dd72c25238cd7ac1282", "head_commit": "7e71edc0d50443d3db4f0dd72c25238cd7ac1282"}
{"ts": "2026-05-04T14:56:53.498474+08:00", "session_id": "20260504_140002_0c1464", "market": "cn", "formula": "rank(ts_min(turnover_rate,20)/ts_mean(turnover_rate,20))*rank(-ts_corr(turnover_rate,shift(turnover_rate,5),20))", "name": "anti_autocorr_weekly_turnover_floor_20", "is_ic": 0.0122, "is_ic_ir": 0.099, "is_sharpe": -2.913, "is_turnover": 0.164, "is_monotonicity": 0.2, "gates": "FAIL", "status": "reverted", "eval_seconds": 138.5, "decision": "revert", "session_branch": "main", "base_ref": "origin/main", "merge_base": "7e71edc0d50443d3db4f0dd72c25238cd7ac1282", "head_commit": "7e71edc0d50443d3db4f0dd72c25238cd7ac1282"}
{"ts": "2026-05-04T14:56:53.498474+08:00", "session_id": "20260504_140002_0c1464", "market": "cn", "formula": "rank(-ts_max(ret_1d,20))*rank(-ts_std(pct_change(turnover_rate,5),20))", "name": "low_lottery_turnover_change_smooth_20", "is_ic": 0.0431, "is_ic_ir": 0.298, "is_sharpe": 0.942, "is_turnover": 0.091, "is_monotonicity": -0.2, "gates": "PASS", "status": "checks_failed", "eval_seconds": 135.9, "decision": "revert", "session_branch": "main", "base_ref": "origin/main", "merge_base": "7e71edc0d50443d3db4f0dd72c25238cd7ac1282", "head_commit": "7e71edc0d50443d3db4f0dd72c25238cd7ac1282", "oos": "PASS", "checks_status": "failed"}
{"ts": "2026-05-04T14:56:53.498474+08:00", "session_id": "20260504_140002_0c1464", "market": "cn", "formula": "rank(ts_min(ts_sum(amount,5),20)/ts_mean(ts_sum(amount,5),20))*rank(-ts_max(ret_1d,20))", "name": "low_lottery_weekly_amount_floor_20", "is_ic": 0.0355, "is_ic_ir": 0.233, "is_sharpe": -0.114, "is_turnover": 0.099, "is_monotonicity": -0.15, "gates": "PASS", "status": "candidate", "eval_seconds": 115.4, "decision": "candidate", "session_branch": "main", "base_ref": "origin/main", "merge_base": "7e71edc0d50443d3db4f0dd72c25238cd7ac1282", "head_commit": "7e71edc0d50443d3db4f0dd72c25238cd7ac1282"}
{"ts": "2026-05-04T14:56:53.498474+08:00", "session_id": "20260504_140002_0c1464", "market": "cn", "formula": "rank(ts_min(ts_sum(amount/market_cap,5),20)/ts_max(ts_sum(amount/market_cap,5),20)-ts_corr(ret_1d,shift(ret_1d,1),20))", "name": "weekly_mcapflow_corridor_underreaction_20", "is_ic": 0.0389, "is_ic_ir": 0.489, "is_sharpe": 4.682, "is_turnover": 0.17, "is_monotonicity": 0.35, "gates": "PASS", "status": "candidate", "eval_seconds": 250.0, "decision": "candidate", "session_branch": "main", "base_ref": "origin/main", "merge_base": "7e71edc0d50443d3db4f0dd72c25238cd7ac1282", "head_commit": "7e71edc0d50443d3db4f0dd72c25238cd7ac1282"}
{"ts": "2026-05-05T06:55:55.497711+08:00", "session_id": "20260505_060002_dd6e5d", "market": "cn", "formula": "rank(ts_mean(pb,120)/pb)*rank(-ts_std(turnover_rate,20))", "name": "pb_turnover_stability_120_20", "is_ic": -0.0127, "is_ic_ir": -0.021, "is_sharpe": -4.282, "is_turnover": 0.07, "is_monotonicity": -0.75, "gates": "FAIL", "status": "reverted", "eval_seconds": 47.6, "decision": "revert", "session_branch": "main", "base_ref": "origin/main", "merge_base": "7e71edc0d50443d3db4f0dd72c25238cd7ac1282", "head_commit": "7e71edc0d50443d3db4f0dd72c25238cd7ac1282"}
{"ts": "2026-05-05T06:55:55.497711+08:00", "session_id": "20260505_060002_dd6e5d", "market": "cn", "formula": "rank(ts_mean(amount / circ_market_cap, 20) / ts_std(amount / circ_market_cap, 20))", "name": "float_absorption_stability_20", "is_ic": 0.0367, "is_ic_ir": 0.369, "is_sharpe": 1.412, "is_turnover": 0.12, "is_monotonicity": 0.7, "gates": "PASS", "status": "candidate", "eval_seconds": 46.7, "decision": "candidate", "session_branch": "main", "base_ref": "origin/main", "merge_base": "7e71edc0d50443d3db4f0dd72c25238cd7ac1282", "head_commit": "7e71edc0d50443d3db4f0dd72c25238cd7ac1282"}
{"ts": "2026-05-05T06:55:55.497711+08:00", "session_id": "20260505_060002_dd6e5d", "market": "cn", "formula": "rank(ts_mean(amount / circ_market_cap, 20) / max(ts_std(ret_1d, 20), 0.01))", "name": "quiet_absorption_20", "is_ic": 0.0, "is_ic_ir": 0.0, "is_sharpe": 0.0, "is_turnover": 0.0, "is_monotonicity": 0.0, "gates": "FAIL", "status": "compute_error", "eval_seconds": 88.2, "decision": "revert", "session_branch": "main", "base_ref": "origin/main", "merge_base": "7e71edc0d50443d3db4f0dd72c25238cd7ac1282", "head_commit": "7e71edc0d50443d3db4f0dd72c25238cd7ac1282"}
{"ts": "2026-05-05T06:55:55.497711+08:00", "session_id": "20260505_060002_dd6e5d", "market": "cn", "formula": "rank(ts_std(amount,60)/ts_std(decay_linear(amount,5),20))", "name": "amount_quiet_compress_20_60", "is_ic": 0.0301, "is_ic_ir": 0.252, "is_sharpe": 2.728, "is_turnover": 0.105, "is_monotonicity": 0.8, "gates": "PASS", "status": "candidate", "eval_seconds": 144.6, "decision": "candidate", "session_branch": "main", "base_ref": "origin/main", "merge_base": "7e71edc0d50443d3db4f0dd72c25238cd7ac1282", "head_commit": "7e71edc0d50443d3db4f0dd72c25238cd7ac1282"}
{"ts": "2026-05-05T06:55:55.497711+08:00", "session_id": "20260505_060002_dd6e5d", "market": "cn", "formula": "rank(-ts_corr(ret_1d,shift(ret_1d,1),20))*rank(ts_mean(ts_sum(turnover_rate,5),20)/ts_max(ts_sum(turnover_rate,5),20))", "name": "anti_autocorr_weekly_turnover_evenness_20", "is_ic": 0.0372, "is_ic_ir": 0.479, "is_sharpe": 3.253, "is_turnover": 0.17, "is_monotonicity": 0.5, "gates": "PASS", "status": "candidate", "eval_seconds": 107.1, "decision": "candidate", "session_branch": "main", "base_ref": "origin/main", "merge_base": "7e71edc0d50443d3db4f0dd72c25238cd7ac1282", "head_commit": "7e71edc0d50443d3db4f0dd72c25238cd7ac1282"}
{"ts": "2026-05-05T06:55:55.497711+08:00", "session_id": "20260505_060002_dd6e5d", "market": "cn", "formula": "rank(-ts_corr(ret_1d,shift(ret_1d,1),20))*rank(ts_min(volume_ratio,20)/ts_max(volume_ratio,20))", "name": "anti_autocorr_relvol_corridor_20", "is_ic": 0.0339, "is_ic_ir": 0.416, "is_sharpe": 2.188, "is_turnover": 0.167, "is_monotonicity": 0.0, "gates": "PASS", "status": "candidate", "eval_seconds": 158.2, "decision": "candidate", "session_branch": "main", "base_ref": "origin/main", "merge_base": "7e71edc0d50443d3db4f0dd72c25238cd7ac1282", "head_commit": "7e71edc0d50443d3db4f0dd72c25238cd7ac1282"}
{"ts": "2026-05-05T06:55:55.497711+08:00", "session_id": "20260505_060002_dd6e5d", "market": "cn", "formula": "rank(-ts_max(ret_1d,20))*rank(ts_min(ts_sum(turnover_rate,5),20)/ts_max(ts_sum(turnover_rate,5),20))", "name": "low_lottery_weekly_turnover_corridor_20", "is_ic": 0.0383, "is_ic_ir": 0.251, "is_sharpe": 0.217, "is_turnover": 0.097, "is_monotonicity": -0.05, "gates": "PASS", "status": "candidate", "eval_seconds": 81.2, "decision": "candidate", "session_branch": "main", "base_ref": "origin/main", "merge_base": "7e71edc0d50443d3db4f0dd72c25238cd7ac1282", "head_commit": "7e71edc0d50443d3db4f0dd72c25238cd7ac1282"}
{"ts": "2026-05-05T06:55:55.497711+08:00", "session_id": "20260505_060002_dd6e5d", "market": "cn", "formula": "rank(-ts_corr(ret_1d,shift(ret_1d,1),20))*rank(ts_min(amount/circ_market_cap,20)/ts_max(amount/circ_market_cap,20))", "name": "anti_autocorr_floatflow_corridor_20", "is_ic": 0.0379, "is_ic_ir": 0.485, "is_sharpe": 4.003, "is_turnover": 0.169, "is_monotonicity": 0.4, "gates": "PASS", "status": "candidate", "eval_seconds": 140.7, "decision": "candidate", "session_branch": "main", "base_ref": "origin/main", "merge_base": "7e71edc0d50443d3db4f0dd72c25238cd7ac1282", "head_commit": "7e71edc0d50443d3db4f0dd72c25238cd7ac1282"}
{"ts": "2026-05-05T06:55:55.497711+08:00", "session_id": "20260505_060002_dd6e5d", "market": "cn", "formula": "rank(-ts_corr(ret_1d,shift(ret_1d,1),20))*rank(ts_mean(ts_sum(amount/market_cap,5),20)/ts_std(ts_sum(amount/market_cap,5),20))", "name": "anti_autocorr_weekly_mcapflow_stability_20", "is_ic": 0.0364, "is_ic_ir": 0.452, "is_sharpe": 3.305, "is_turnover": 0.151, "is_monotonicity": 0.65, "gates": "PASS", "status": "candidate", "eval_seconds": 177.9, "decision": "candidate", "session_branch": "main", "base_ref": "origin/main", "merge_base": "7e71edc0d50443d3db4f0dd72c25238cd7ac1282", "head_commit": "7e71edc0d50443d3db4f0dd72c25238cd7ac1282"}
{"ts": "2026-05-05T06:55:55.497711+08:00", "session_id": "20260505_060002_dd6e5d", "market": "cn", "formula": "rank(ts_min(ts_sum(amount/market_cap,5),20)/ts_max(ts_sum(amount/market_cap,5),20)-ts_corr(ret_1d,shift(ret_1d,1),20))", "name": "weekly_mcapflow_corridor_underreaction_20", "is_ic": 0.0389, "is_ic_ir": 0.489, "is_sharpe": 4.682, "is_turnover": 0.17, "is_monotonicity": 0.35, "gates": "PASS", "status": "reverted", "eval_seconds": 174.3, "decision": "revert", "session_branch": "main", "base_ref": "origin/main", "merge_base": "7e71edc0d50443d3db4f0dd72c25238cd7ac1282", "head_commit": "7e71edc0d50443d3db4f0dd72c25238cd7ac1282", "oos": "FAIL", "checks_status": "skipped"}
{"ts": "2026-05-05T06:55:55.497711+08:00", "session_id": "20260505_060002_dd6e5d", "market": "cn", "formula": "rank(-ts_max(ret_1d,20))*rank(ts_mean(ts_sum(amount/market_cap,5),20)/ts_max(ts_sum(amount/market_cap,5),20))", "name": "low_lottery_weekly_mcap_evenness_20", "is_ic": 0.0402, "is_ic_ir": 0.267, "is_sharpe": 0.22, "is_turnover": 0.111, "is_monotonicity": 0.0, "gates": "PASS", "status": "checks_failed", "eval_seconds": 121.6, "decision": "revert", "session_branch": "main", "base_ref": "origin/main", "merge_base": "7e71edc0d50443d3db4f0dd72c25238cd7ac1282", "head_commit": "7e71edc0d50443d3db4f0dd72c25238cd7ac1282", "oos": "PASS", "checks_status": "failed"}
{"ts": "2026-05-05T06:55:55.497711+08:00", "session_id": "20260505_060002_dd6e5d", "market": "cn", "formula": "rank(-ts_skew(amount, 20))", "name": "anti_spike_amount_skew_20", "is_ic": 0.0183, "is_ic_ir": 0.197, "is_sharpe": -1.048, "is_turnover": 0.173, "is_monotonicity": 0.8, "gates": "FAIL", "status": "reverted", "eval_seconds": 124.0, "decision": "revert", "session_branch": "main", "base_ref": "origin/main", "merge_base": "7e71edc0d50443d3db4f0dd72c25238cd7ac1282", "head_commit": "7e71edc0d50443d3db4f0dd72c25238cd7ac1282"}
{"ts": "2026-05-05T06:55:55.497711+08:00", "session_id": "20260505_060002_dd6e5d", "market": "cn", "formula": "rank(-ts_corr(ret_1d, shift(ret_1d, 1), 20)) * rank(ts_min(amount / circ_market_cap, 20) / ts_mean(amount / circ_market_cap, 20))", "name": "anti_autocorr_floatflow_floor_20", "is_ic": 0.0377, "is_ic_ir": 0.44, "is_sharpe": 1.595, "is_turnover": 0.178, "is_monotonicity": 0.4, "gates": "PASS", "status": "candidate", "eval_seconds": 156.7, "decision": "candidate", "session_branch": "main", "base_ref": "origin/main", "merge_base": "7e71edc0d50443d3db4f0dd72c25238cd7ac1282", "head_commit": "7e71edc0d50443d3db4f0dd72c25238cd7ac1282"}
{"ts": "2026-05-05T06:55:55.497711+08:00", "session_id": "20260505_060002_dd6e5d", "market": "cn", "formula": "rank(-ts_corr(ret_1d,shift(ret_1d,1),20))*rank(ts_min(ts_sum(amount/market_cap,5),20)/ts_max(ts_sum(amount/market_cap,5),20))", "name": "anti_autocorr_weekly_mcapflow_corridor_20", "is_ic": 0.0384, "is_ic_ir": 0.456, "is_sharpe": 3.503, "is_turnover": 0.161, "is_monotonicity": 0.5, "gates": "PASS", "status": "candidate", "eval_seconds": 167.2, "decision": "candidate", "session_branch": "main", "base_ref": "origin/main", "merge_base": "7e71edc0d50443d3db4f0dd72c25238cd7ac1282", "head_commit": "7e71edc0d50443d3db4f0dd72c25238cd7ac1282"}
{"ts": "2026-05-05T06:55:55.497711+08:00", "session_id": "20260505_060002_dd6e5d", "market": "cn", "formula": "rank(ts_min(ts_sum(turnover_rate,5),20)/ts_max(ts_sum(turnover_rate,5),20)-ts_corr(ret_1d,shift(ret_1d,1),20))", "name": "weekly_turnover_corridor_underreaction_20", "is_ic": 0.0386, "is_ic_ir": 0.488, "is_sharpe": 4.805, "is_turnover": 0.17, "is_monotonicity": 0.35, "gates": "PASS", "status": "reverted", "eval_seconds": 100.9, "decision": "revert", "session_branch": "main", "base_ref": "origin/main", "merge_base": "7e71edc0d50443d3db4f0dd72c25238cd7ac1282", "head_commit": "7e71edc0d50443d3db4f0dd72c25238cd7ac1282", "oos": "FAIL", "checks_status": "skipped"}
{"ts": "2026-05-05T06:55:55.497711+08:00", "session_id": "20260505_060002_dd6e5d", "market": "cn", "formula": "rank(-ts_corr(ret_1d,shift(ret_1d,1),20))*rank(ts_mean(ts_sum(amount,5),20)/ts_max(ts_sum(amount,5),20))", "name": "anti_autocorr_weekly_amount_evenness_20", "is_ic": 0.0367, "is_ic_ir": 0.473, "is_sharpe": 3.934, "is_turnover": 0.167, "is_monotonicity": 0.35, "gates": "PASS", "status": "candidate", "eval_seconds": 113.7, "decision": "candidate", "session_branch": "main", "base_ref": "origin/main", "merge_base": "7e71edc0d50443d3db4f0dd72c25238cd7ac1282", "head_commit": "7e71edc0d50443d3db4f0dd72c25238cd7ac1282"}
{"ts": "2026-05-05T06:55:55.497711+08:00", "session_id": "20260505_060002_dd6e5d", "market": "cn", "formula": "rank(-pb) * rank(ts_mean(turnover_rate,20) / ts_std(turnover_rate,20))", "name": "cheap_orderly_turnover_20", "is_ic": 0.036, "is_ic_ir": 0.21, "is_sharpe": -0.043, "is_turnover": 0.081, "is_monotonicity": 0.0, "gates": "PASS", "status": "candidate", "eval_seconds": 53.2, "decision": "candidate", "session_branch": "main", "base_ref": "origin/main", "merge_base": "7e71edc0d50443d3db4f0dd72c25238cd7ac1282", "head_commit": "7e71edc0d50443d3db4f0dd72c25238cd7ac1282"}
{"ts": "2026-05-05T06:55:55.497711+08:00", "session_id": "20260505_060002_dd6e5d", "market": "cn", "formula": "rank(ts_mean(ts_sum(amount/market_cap,5),20)/ts_max(ts_sum(amount/market_cap,5),20)-ts_corr(ret_1d,shift(ret_1d,1),20))", "name": "weekly_mcapflow_evenness_underreaction_20", "is_ic": 0.0374, "is_ic_ir": 0.482, "is_sharpe": 4.782, "is_turnover": 0.175, "is_monotonicity": 0.15, "gates": "PASS", "status": "candidate", "eval_seconds": 146.5, "decision": "candidate", "session_branch": "main", "base_ref": "origin/main", "merge_base": "7e71edc0d50443d3db4f0dd72c25238cd7ac1282", "head_commit": "7e71edc0d50443d3db4f0dd72c25238cd7ac1282"}
{"ts": "2026-05-05T06:55:55.497711+08:00", "session_id": "20260505_060002_dd6e5d", "market": "cn", "formula": "rank(-ret_20d)*rank(ts_min(ts_sum(amount/circ_market_cap,5),20)/ts_max(ts_sum(amount/circ_market_cap,5),20))", "name": "weekly_float_corridor_underreaction_20", "is_ic": 0.0306, "is_ic_ir": 0.197, "is_sharpe": -1.122, "is_turnover": 0.153, "is_monotonicity": 0.0, "gates": "FAIL", "status": "reverted", "eval_seconds": 137.2, "decision": "revert", "session_branch": "main", "base_ref": "origin/main", "merge_base": "7e71edc0d50443d3db4f0dd72c25238cd7ac1282", "head_commit": "7e71edc0d50443d3db4f0dd72c25238cd7ac1282"}
{"ts": "2026-05-05T06:55:55.497711+08:00", "session_id": "20260505_060002_dd6e5d", "market": "cn", "formula": "rank(ts_min(turnover_rate,20)/ts_mean(turnover_rate,20))*rank(-ret_5d)", "name": "weekly_turnover_floor_underreaction_20", "is_ic": 0.0249, "is_ic_ir": 0.152, "is_sharpe": -2.664, "is_turnover": 0.277, "is_monotonicity": 0.35, "gates": "FAIL", "status": "reverted", "eval_seconds": 153.8, "decision": "revert", "session_branch": "main", "base_ref": "origin/main", "merge_base": "7e71edc0d50443d3db4f0dd72c25238cd7ac1282", "head_commit": "7e71edc0d50443d3db4f0dd72c25238cd7ac1282"}
{"ts": "2026-05-05T06:55:55.497711+08:00", "session_id": "20260505_060002_dd6e5d", "market": "cn", "formula": "rank(ts_min(ts_sum(amount,5),20)/ts_max(ts_sum(amount,5),20)-ts_corr(ret_1d,shift(ret_1d,1),20))", "name": "weekly_amount_corridor_underreaction_20", "is_ic": 0.0377, "is_ic_ir": 0.48, "is_sharpe": 4.556, "is_turnover": 0.169, "is_monotonicity": 0.2, "gates": "PASS", "status": "candidate", "eval_seconds": 148.2, "decision": "candidate", "session_branch": "main", "base_ref": "origin/main", "merge_base": "7e71edc0d50443d3db4f0dd72c25238cd7ac1282", "head_commit": "7e71edc0d50443d3db4f0dd72c25238cd7ac1282"}
{"ts": "2026-05-05T06:55:55.497711+08:00", "session_id": "20260505_060002_dd6e5d", "market": "cn", "formula": "rank(ts_mean(ts_sum(amount/market_cap,5),20)/ts_std(ts_sum(amount/market_cap,5),20)-ts_corr(ret_1d,shift(ret_1d,1),20))", "name": "weekly_mcapflow_stability_underreaction_20", "is_ic": 0.0259, "is_ic_ir": 0.285, "is_sharpe": 1.055, "is_turnover": 0.1, "is_monotonicity": 0.55, "gates": "PASS", "status": "candidate", "eval_seconds": 209.0, "decision": "candidate", "session_branch": "main", "base_ref": "origin/main", "merge_base": "7e71edc0d50443d3db4f0dd72c25238cd7ac1282", "head_commit": "7e71edc0d50443d3db4f0dd72c25238cd7ac1282"}
{"ts": "2026-05-05T06:55:55.497711+08:00", "session_id": "20260505_060002_dd6e5d", "market": "cn", "formula": "rank(ts_mean(ts_sum(turnover_rate,5),20)/ts_max(ts_sum(turnover_rate,5),20)-ts_corr(ret_1d,shift(ret_1d,1),20))", "name": "weekly_turnover_evenness_underreaction_20", "is_ic": 0.0373, "is_ic_ir": 0.481, "is_sharpe": 5.171, "is_turnover": 0.175, "is_monotonicity": 0.3, "gates": "PASS", "status": "candidate", "eval_seconds": 117.3, "decision": "candidate", "session_branch": "main", "base_ref": "origin/main", "merge_base": "7e71edc0d50443d3db4f0dd72c25238cd7ac1282", "head_commit": "7e71edc0d50443d3db4f0dd72c25238cd7ac1282"}
{"ts": "2026-05-05T06:55:55.497711+08:00", "session_id": "20260505_060002_dd6e5d", "market": "cn", "formula": "rank(ts_mean(ts_sum(amount/circ_market_cap,5),20)/ts_max(ts_sum(amount/circ_market_cap,5),20)-ts_corr(ret_1d,shift(ret_1d,1),20))", "name": "weekly_float_evenness_underreaction_20", "is_ic": 0.0372, "is_ic_ir": 0.481, "is_sharpe": 5.097, "is_turnover": 0.175, "is_monotonicity": 0.15, "gates": "PASS", "status": "candidate", "eval_seconds": 133.1, "decision": "candidate", "session_branch": "main", "base_ref": "origin/main", "merge_base": "7e71edc0d50443d3db4f0dd72c25238cd7ac1282", "head_commit": "7e71edc0d50443d3db4f0dd72c25238cd7ac1282"}
{"ts": "2026-05-05T14:56:33.343274+08:00", "session_id": "20260505_140029_9903b6", "market": "cn", "formula": "rank(-ts_std(turnover_rate, 20) / (ts_mean(turnover_rate, 20) + 0.01))", "name": "turnover_stability_20", "is_ic": 0.0387, "is_ic_ir": 0.367, "is_sharpe": 1.54, "is_turnover": 0.12, "is_monotonicity": 0.7, "gates": "PASS", "status": "checks_failed", "eval_seconds": 103.0, "decision": "revert", "session_branch": "main", "base_ref": "origin/main", "merge_base": "7e71edc0d50443d3db4f0dd72c25238cd7ac1282", "head_commit": "7e71edc0d50443d3db4f0dd72c25238cd7ac1282", "oos": "PASS", "checks_status": "failed"}
{"ts": "2026-05-05T14:56:33.343274+08:00", "session_id": "20260505_140029_9903b6", "market": "cn", "formula": "rank(ts_min(ts_sum(amount/circ_market_cap,5),20)/ts_mean(ts_sum(amount/circ_market_cap,5),20))", "name": "weekly_float_flow_floor_20", "is_ic": 0.0249, "is_ic_ir": 0.221, "is_sharpe": 0.307, "is_turnover": 0.117, "is_monotonicity": 0.35, "gates": "PASS", "status": "candidate", "eval_seconds": 137.7, "decision": "candidate", "session_branch": "main", "base_ref": "origin/main", "merge_base": "7e71edc0d50443d3db4f0dd72c25238cd7ac1282", "head_commit": "7e71edc0d50443d3db4f0dd72c25238cd7ac1282"}
