{"ts": "2026-05-29T14:56:09.477144+08:00", "session_id": "20260529_140002_641f0b", "market": "cn", "formula": "rank((ret_20d-ret_5d)-ts_std(turnover_rate,20)/ts_mean(turnover_rate,20))", "name": "absorbed_leader_pullback_20", "is_ic": -0.0355, "is_ic_ir": -0.127, "is_sharpe": -1.332, "is_turnover": 0.182, "is_monotonicity": -0.1, "gates": "FAIL", "status": "reverted", "eval_seconds": 73.4, "sleeve_id": "cn_ai_infra_pullback_absorption", "mispricing_source": "Retail-dominated A-share flow overreacts to recent weakness, while slower institutional capital accumulates AI bottleneck leaders on orderly pullbacks; the market underprices the persistence of that absorption.", "forced_counterparty": "Short-horizon retail and thematic fast money reducing risk after a weak week", "data_requirements": "[\"daily OHLCV + turnover_rate (available)\",\"beta-hedge attribution vs 000300.SH/399006.SZ before promotion\",\"sleeve correlation and residual risk attribution versus promoted factors\"]", "failure_mode": "Fails when policy/news shocks trigger genuine distribution, or when the market flips into indiscriminate low-quality momentum where orderly turnover no longer separates accumulation from crowding.", "report_contract": "setup_overlay", "ai_supercycle_layer": "ai_networking_optical_cpo", "supply_chain_hypothesis": "Orderly-pullback leaders inside the CN AI-infra universe may be D2-D3 bottleneck suppliers to datacenter interconnect and optical buildout, where institutions defend scarce-capacity names on weakness.", "relationship_evidence_required": "true", "money_readiness": "research_only", "decision": "revert", "session_branch": "main", "base_ref": "origin/main", "merge_base": "c94ca064b4ac72dfdf1f906eaaf12dbbc0a6779a", "head_commit": "c94ca064b4ac72dfdf1f906eaaf12dbbc0a6779a"}
{"ts": "2026-05-29T14:56:09.477144+08:00", "session_id": "20260529_140002_641f0b", "market": "cn", "formula": "rank(-(ts_std(turnover_rate,20)/ts_std(turnover_rate,60)))", "name": "turnover_vol_compress_20_60", "is_ic": -0.0387, "is_ic_ir": -0.153, "is_sharpe": -3.429, "is_turnover": 0.115, "is_monotonicity": -0.4, "gates": "FAIL", "status": "reverted", "eval_seconds": 153.0, "sleeve_id": "daily_flow_regime", "mispricing_source": "The payoff comes from underreaction to quieter, higher-quality ownership transfer; CN theme traders focus on bursty volume and headlines, while compression in float churn is an early tape signal that weak-hand supply has been absorbed.", "forced_counterparty": "Short-horizon retail theme chasers, margin-sensitive traders, and other liquidity-motivated holders exiting after crowded bursts rather than waiting for slow fundamental rerating.", "data_requirements": "[\"daily turnover_rate and OHLCV on the AI-infra universe\",\"benchmark series for 000300.SH/399006.SZ beta-hedge attribution\",\"sleeve correlation and residual-risk attribution vs existing factors\",\"source-review evidence before naming any specific supplier/order relationship\"]", "failure_mode": "It stops working when turnover compression means attention collapse or liquidity death instead of absorption, and in fresh mania regimes where expanding churn, not compressing churn, carries the leadership signal.", "report_contract": "fresh_buy_gate", "ai_supercycle_layer": "ai_chip_equipment_materials_packaging", "supply_chain_hypothesis": "Candidate domestic AI bottleneck suppliers in equipment/materials/advanced packaging should show float-churn compression before backlog, domestic substitution wins, or capex-cycle confirmation is explicit in filings.", "relationship_evidence_required": "true", "money_readiness": "money_candidate", "decision": "revert", "session_branch": "main", "base_ref": "origin/main", "merge_base": "c94ca064b4ac72dfdf1f906eaaf12dbbc0a6779a", "head_commit": "c94ca064b4ac72dfdf1f906eaaf12dbbc0a6779a"}
{"ts": "2026-05-29T14:56:09.477144+08:00", "session_id": "20260529_140002_641f0b", "market": "cn", "formula": "rank(-(ts_max(turnover_rate,20)/ts_sum(turnover_rate,20)))*rank(-ts_corr(ret_1d,shift(ret_1d,1),40))", "name": "distributed_turnover_anti_autocorr_20_40", "is_ic": -0.0202, "is_ic_ir": -0.048, "is_sharpe": -0.903, "is_turnover": 0.171, "is_monotonicity": 0.05, "gates": "FAIL", "status": "reverted", "eval_seconds": 95.8, "sleeve_id": "cn_aiinfra_ownership_transfer", "mispricing_source": "Ownership transfer under T+1, theme rotation, and benchmarked liquidity constraints causes temporary underpricing while fast money exits and patient capital accumulates.", "forced_counterparty": "Retail thematic chasers and short-horizon liquidity managers forced to sell after failed breakouts or rebalance windows.", "data_requirements": "[\"daily price features\",\"ret_1d\",\"daily_basic.turnover_rate\",\"ai_infra universe membership\",\"for promotion: beta-hedged sleeve attribution and correlation to existing sleeves\"]", "failure_mode": "This stops working in one-way momentum or policy-gap regimes where positive autocorrelation dominates and distributed turnover no longer means absorption.", "report_contract": "setup_overlay", "ai_supercycle_layer": "ai_chip_equipment_materials_packaging", "supply_chain_hypothesis": "Within D1-D3 CN AI hardware bottlenecks, this may surface equipment/materials/packaging names being accumulated ahead of verified order, capex, or expansion evidence from accelerator and datacenter build-outs.", "relationship_evidence_required": "true", "money_readiness": "research_only", "decision": "revert", "session_branch": "main", "base_ref": "origin/main", "merge_base": "c94ca064b4ac72dfdf1f906eaaf12dbbc0a6779a", "head_commit": "c94ca064b4ac72dfdf1f906eaaf12dbbc0a6779a"}
{"ts": "2026-05-29T14:56:09.477144+08:00", "session_id": "20260529_140002_641f0b", "market": "cn", "formula": "rank(-ps_ttm) * rank(ts_mean(amount / circ_market_cap, 20))", "name": "cheap_float_flow_20", "is_ic": 0.0481, "is_ic_ir": 0.176, "is_sharpe": 1.927, "is_turnover": 0.026, "is_monotonicity": 0.35, "gates": "FAIL", "status": "reverted", "eval_seconds": 94.1, "sleeve_id": "cn_ai_capacity_repricing", "mispricing_source": "The market overpays headline AI stories and underprices duller capacity suppliers until persistent capital flow confirms they are in the spending path.", "forced_counterparty": "Retail theme chasers and benchmark-aware growth allocators that are structurally biased toward expensive concept leaders, not lower-multiple capacity names.", "data_requirements": "[\"daily price/volume/daily_basic\", \"ai_infra universe BFS/module metadata\", \"source-reviewed evidence cards for any supplier/customer claim\", \"beta-hedged sleeve attribution and correlation to existing sleeves\"]", "failure_mode": "It should fail in pure momentum/manic narrative regimes where valuation stops mattering and the highest-multiple AI concept names keep absorbing marginal flow.", "report_contract": "research_only", "ai_supercycle_layer": "hard_assets_energy_heavy", "supply_chain_hypothesis": "Asset-heavy AI-infra suppliers in power/datacenter/equipment lanes with low sales multiples and rising float-value turnover are being accumulated ahead of visible capex order recognition.", "relationship_evidence_required": "true", "money_readiness": "research_only", "decision": "revert", "session_branch": "main", "base_ref": "origin/main", "merge_base": "c94ca064b4ac72dfdf1f906eaaf12dbbc0a6779a", "head_commit": "c94ca064b4ac72dfdf1f906eaaf12dbbc0a6779a"}
{"ts": "2026-05-29T14:56:09.477144+08:00", "session_id": "20260529_140002_641f0b", "market": "cn", "formula": "rank(ts_mean(amount / circ_market_cap,20) / ts_max(amount / circ_market_cap,20))", "name": "float_turnover_spike_suppression_20", "is_ic": -0.0547, "is_ic_ir": -0.221, "is_sharpe": -4.207, "is_turnover": 0.156, "is_monotonicity": -0.4, "gates": "FAIL", "status": "reverted", "eval_seconds": 191.7, "sleeve_id": "cn_turnover_flow_overlay", "mispricing_source": "Retail theme-chasing and liquidity-constrained allocators overpay for headline-driven turnover spikes, while quiet accumulation in under-owned AI-infra names is slower to arbitrage.", "forced_counterparty": "Retail momentum traders, hot-money desks, and benchmarked funds that must prefer immediate liquidity over patient float absorption.", "data_requirements": "No extra dataset for IS test; before promotion require ai_infra universe membership, sleeve correlation, beta-hedged residual return attribution vs CN benchmarks, and source-review status for any narrative attached to the names it surfaces.", "failure_mode": "It breaks in policy-pulse or limit-up momentum regimes where turnover spikes persist instead of mean-reverting, or when float changes distort circ_market_cap.", "report_contract": "setup_overlay", "ai_supercycle_layer": "none", "supply_chain_hypothesis": "none", "relationship_evidence_required": "false", "money_readiness": "research_only", "decision": "revert", "session_branch": "main", "base_ref": "origin/main", "merge_base": "c94ca064b4ac72dfdf1f906eaaf12dbbc0a6779a", "head_commit": "c94ca064b4ac72dfdf1f906eaaf12dbbc0a6779a"}
{"ts": "2026-05-29T14:56:09.477144+08:00", "session_id": "20260529_140002_641f0b", "market": "cn", "formula": "rank(-ps_ttm)*rank(ts_mean(volume_ratio,20)/ts_max(volume_ratio,20))", "name": "low_ps_relvol_uniformity_20", "is_ic": -0.0212, "is_ic_ir": -0.062, "is_sharpe": -2.619, "is_turnover": 0.122, "is_monotonicity": -0.55, "gates": "FAIL", "status": "reverted", "eval_seconds": 120.0, "sleeve_id": "cn_ai_infra_accumulation_overlay", "mispricing_source": "Retail and fast-thematic capital overpay for obvious high-PS narrative leaders, while benchmarked managers are slow to rotate into cheaper second-derivative AI suppliers unless the tape already forces recognition.", "forced_counterparty": "retail momentum chasers and benchmark-hugging managers concentrated in liquid concept leaders", "data_requirements": "[\"volume_ratio\",\"ps_ttm\",\"canonical ai_infra CN universe membership\",\"benchmark hedge attribution vs 000300.SH/399006.SZ\",\"for promotion: filings/transcripts/backlog/capex evidence confirming AI-demand linkage\"]", "failure_mode": "It stops working when A-share leadership is driven by policy-rumor squeezes or broad speculative beta, where one-day crowded breakouts dominate steady accumulation and valuation stops anchoring entry.", "report_contract": "setup_overlay", "ai_supercycle_layer": "ai_chip_equipment_materials_packaging", "supply_chain_hypothesis": "Cheap CN equipment/materials names with smooth relative-volume participation are candidate second-derivative AI bottleneck suppliers being accumulated ahead of visible order, utilization, or packaging-capacity confirmation.", "relationship_evidence_required": "true", "money_readiness": "research_only", "decision": "revert", "session_branch": "main", "base_ref": "origin/main", "merge_base": "c94ca064b4ac72dfdf1f906eaaf12dbbc0a6779a", "head_commit": "c94ca064b4ac72dfdf1f906eaaf12dbbc0a6779a"}
{"ts": "2026-05-29T14:56:09.477144+08:00", "session_id": "20260529_140002_641f0b", "market": "cn", "formula": "rank(ts_mean(amount,20)/(ts_std(amount,20)+1))*rank(ret_20d-ret_5d)", "name": "amount_stable_leader_digest_20", "is_ic": -0.0132, "is_ic_ir": -0.079, "is_sharpe": -3.851, "is_turnover": 0.203, "is_monotonicity": -0.85, "gates": "FAIL", "status": "reverted", "eval_seconds": 115.6, "sleeve_id": "cn_ai_infra_leader_digest", "mispricing_source": "Short-horizon traders overreact to a brief cooling in strong AI-infra names, while stable成交额 indicates sponsorship that the tape has not fully repriced.", "forced_counterparty": "retail momentum traders, hot-theme rotators, and benchmarked managers slow to re-add after a pause", "data_requirements": "[\"daily OHLCV\",\"amount\",\"AI universe membership\",\"benchmark returns for 000300.SH/399006.SZ residual attribution\"]", "failure_mode": "Fails in violent laggard-led mean-reversion regimes or when stable amount reflects distribution into strength rather than genuine accumulation.", "report_contract": "setup_overlay", "ai_supercycle_layer": "ai_chip_equipment_materials_packaging", "supply_chain_hypothesis": "Verified AI capex bottleneck suppliers in semicap equipment/materials/advanced packaging should show stable value absorption during short consolidations before backlog or order evidence is fully priced.", "relationship_evidence_required": "true", "money_readiness": "research_only", "decision": "revert", "session_branch": "main", "base_ref": "origin/main", "merge_base": "c94ca064b4ac72dfdf1f906eaaf12dbbc0a6779a", "head_commit": "c94ca064b4ac72dfdf1f906eaaf12dbbc0a6779a"}
{"ts": "2026-05-29T14:56:09.477144+08:00", "session_id": "20260529_140002_641f0b", "market": "cn", "formula": "rank(-ps_ttm)*rank(-ts_corr(turnover_rate,ret_5d,20))", "name": "cheap_anticrowd_turnover_20", "is_ic": 0.0541, "is_ic_ir": 0.217, "is_sharpe": -0.425, "is_turnover": 0.131, "is_monotonicity": 0.4, "gates": "PASS", "status": "reverted", "eval_seconds": 85.3, "sleeve_id": "cn_ai_infra_value_flow", "mispricing_source": "Cross-sectional underreaction to cheap AI-infra bottleneck beneficiaries before turnover crowding arrives; this is a valuation-plus-ownership-crowding signal rather than another pure close/volume correlation factor.", "forced_counterparty": "Retail concept chasers who concentrate on high-turnover leaders, plus benchmark-constrained institutions that delay sizing lower-multiple infra names until the tape is already obvious.", "data_requirements": "[\"current CN daily price/daily_basic data is sufficient for IS test\",\"ai_infra universe metadata for BFS/module attribution\",\"benchmark return series for beta-hedged sleeve attribution before promotion\"]", "failure_mode": "Fails in retail mania regimes where crowded high-PS leaders keep squeezing higher, or when low-PS names are cheap because demand/evidence is deteriorating rather than because the market is early.", "report_contract": "setup_overlay", "ai_supercycle_layer": "ai_chip_equipment_materials_packaging", "supply_chain_hypothesis": "Potential early repricing of domestic semiconductor equipment/materials/packaging bottleneck names benefiting from AI compute and datacenter capex before turnover crowding fully confirms.", "relationship_evidence_required": "true", "money_readiness": "research_only", "decision": "revert", "session_branch": "main", "base_ref": "origin/main", "merge_base": "c94ca064b4ac72dfdf1f906eaaf12dbbc0a6779a", "head_commit": "c94ca064b4ac72dfdf1f906eaaf12dbbc0a6779a", "oos": "FAIL", "checks_status": "skipped"}
{"ts": "2026-05-29T14:56:09.477144+08:00", "session_id": "20260529_140002_641f0b", "market": "cn", "formula": "rank(-ts_corr(ret_1d,shift(ret_1d,1),20))*rank(ts_min(volume_ratio,20))", "name": "autocorr_relvol_floor_20", "is_ic": -0.0089, "is_ic_ir": -0.055, "is_sharpe": -2.549, "is_turnover": 0.177, "is_monotonicity": -0.35, "gates": "FAIL", "status": "reverted", "eval_seconds": 234.0, "sleeve_id": "cn_ai_infra_underreaction", "mispricing_source": "T+1 retail churn and short-horizon thematic trading create noisy daily reversals, while specialist capital keeps baseline participation in real bottleneck names; price lags participation persistence.", "forced_counterparty": "retail concept traders, short-horizon momentum funds, and redemption-constrained holders selling weak days", "data_requirements": "[CN daily price/volume_ratio for IS test, ai_infra BFS depth/module/current pool metadata, benchmark hedge attribution vs 000300.SH and 399006.SZ, filings/press releases/backlog evidence before naming any supplier relationship]", "failure_mode": "Fails in one-way momentum or macro-beta shock regimes where negative daily autocorrelation disappears, or when high relvol floor is just static liquidity in large caps rather than accumulation.", "report_contract": "setup_overlay", "ai_supercycle_layer": "ai_chip_equipment_materials_packaging", "supply_chain_hypothesis": "D2-D4 semiconductor equipment/materials/packaging names that keep a high relvol floor despite choppy daily tape may be bottleneck suppliers getting accumulated before order-book confirmation.", "relationship_evidence_required": "true", "money_readiness": "research_only", "decision": "revert", "session_branch": "main", "base_ref": "origin/main", "merge_base": "c94ca064b4ac72dfdf1f906eaaf12dbbc0a6779a", "head_commit": "c94ca064b4ac72dfdf1f906eaaf12dbbc0a6779a"}
{"ts": "2026-05-29T14:56:09.477144+08:00", "session_id": "20260529_140002_641f0b", "market": "cn", "formula": "rank(-ps_ttm)*rank(ts_mean(turnover_rate,20)/ts_max(turnover_rate,20))", "name": "low_ps_turnover_evenness_20", "is_ic": -0.0143, "is_ic_ir": -0.042, "is_sharpe": -1.457, "is_turnover": 0.121, "is_monotonicity": -0.25, "gates": "FAIL", "status": "reverted", "eval_seconds": 147.0, "sleeve_id": "cn_ai_value_accumulation", "mispricing_source": "delayed repricing of under-owned AI-infra bottleneck names with reasonable sales multiples and steady participation; this is driven by valuation and participation shape, not by a reused momentum/reversal signal", "forced_counterparty": "retail theme chasers and benchmark-constrained PMs who crowd into obvious high-PS leaders and under-own quieter suppliers until evidence is public", "data_requirements": "[\"current CN daily data is enough for IS testing\",\"beta-hedge and residual attribution vs 000300.SH/399006.SZ/399006.SZ\",\"correlation check vs existing amount/turnover stability sleeves\",\"ai_infra source-review status before production ranking\"]", "failure_mode": "fails when policy/liquidity regime turns the market into pure theme momentum and valuation dispersion stops mattering, or when steady turnover simply reflects stagnation rather than accumulation", "report_contract": "setup_overlay", "ai_supercycle_layer": "ai_chip_equipment_materials_packaging", "supply_chain_hypothesis": "inside the CN AI-infra universe, lower-PS names with evenly distributed turnover are candidate second-order equipment/material suppliers being accumulated ahead of broader order visibility", "relationship_evidence_required": "true", "money_readiness": "research_only", "decision": "revert", "session_branch": "main", "base_ref": "origin/main", "merge_base": "c94ca064b4ac72dfdf1f906eaaf12dbbc0a6779a", "head_commit": "c94ca064b4ac72dfdf1f906eaaf12dbbc0a6779a"}
{"ts": "2026-05-29T14:56:09.477144+08:00", "session_id": "20260529_140002_641f0b", "market": "cn", "formula": "rank(-ps_ttm) * rank(ts_mean(amount/circ_market_cap,20)/ts_std(amount/circ_market_cap,20))", "name": "cheap_float_absorption_20", "is_ic": -0.0027, "is_ic_ir": -0.001, "is_sharpe": -2.665, "is_turnover": 0.115, "is_monotonicity": -0.35, "gates": "FAIL", "status": "reverted", "eval_seconds": 161.5, "sleeve_id": "cn_ai_infra_accumulation", "mispricing_source": "Slow fundamental recognition and crowding into headline AI names leave quieter, cheaper suppliers under-owned; this is a valuation-plus-flow-stability sleeve rather than another pure price factor.", "forced_counterparty": "Short-horizon retail theme traders and benchmarked managers forced into the most liquid narrative leaders near rebalance windows.", "data_requirements": "[\"daily amount\",\"circ_market_cap\",\"ps_ttm\",\"beta-hedge attribution vs 000300.SH and 399006.SZ\",\"sleeve drawdown/correlation vs promoted factors\",\"ai_infra source-review status for ranked names\"]", "failure_mode": "It stops working when the market shifts to indiscriminate momentum chasing or when low-PS names are value traps caused by deteriorating fundamentals that daily flow data does not capture.", "report_contract": "fresh_buy_gate", "ai_supercycle_layer": "none", "supply_chain_hypothesis": "none", "relationship_evidence_required": "false", "money_readiness": "money_candidate", "decision": "revert", "session_branch": "main", "base_ref": "origin/main", "merge_base": "c94ca064b4ac72dfdf1f906eaaf12dbbc0a6779a", "head_commit": "c94ca064b4ac72dfdf1f906eaaf12dbbc0a6779a"}
{"ts": "2026-06-01T14:57:18.048716+08:00", "session_id": "20260601_140001_9b0632", "market": "cn", "formula": "rank(ts_mean(amount/circ_market_cap,20)/ts_std(turnover_rate,20))", "name": "float_flow_stability_20", "is_ic": -0.0429, "is_ic_ir": -0.162, "is_sharpe": -3.928, "is_turnover": 0.14, "is_monotonicity": -0.5, "gates": "FAIL", "status": "reverted", "eval_seconds": 98.6, "sleeve_id": "daily_flow_accumulation", "mispricing_source": "Slow information diffusion from supply-chain demand into public narratives, plus benchmarked capital that scales into liquid AI leaders gradually rather than immediately.", "forced_counterparty": "Retail theme traders and benchmark-aware mutual funds that cannot fully pre-position before confirmation and often provide liquidity on short-term churn.", "data_requirements": "[\"current daily amount,circ_market_cap,turnover_rate for IS test\",\"factor correlation panel vs promoted sleeves\",\"beta-hedged sleeve PnL and residual risk attribution before promotion\",\"filings/order/backlog evidence if specific AI bottleneck winners are claimed\"]", "failure_mode": "Stops working in pure speculative melt-up regimes where unstable high-churn laggards outperform steady accumulators, or when broad liquidity shocks dominate stock-specific accumulation patterns.", "report_contract": "setup_overlay", "ai_supercycle_layer": "ai_chip_equipment_materials_packaging", "supply_chain_hypothesis": "Domestic wafer-fab equipment, materials, and advanced packaging names should display steady float-adjusted accumulation before AI capex and localization orders are broadly recognized.", "relationship_evidence_required": "true", "money_readiness": "research_only", "decision": "revert", "session_branch": "codex/gamma-v2-ai-infra-options", "base_ref": "origin/main", "merge_base": "e979de0f705a966ec1870cbed91949a54db4590f", "head_commit": "b4c10f429652877de4e1cc191872e642ceb61c65"}
