{"ts": "2026-05-14T14:57:24.823429+08:00", "session_id": "20260514_140002_68da11", "market": "cn", "formula": "rank(ts_rank(close,60))*rank(-pb)", "name": "value_leadership_60_pb", "is_ic": 0.0, "is_ic_ir": 0.0, "is_sharpe": 0.0, "is_turnover": 0.0, "is_monotonicity": 0.0, "gates": "FAIL", "status": "reverted", "eval_seconds": 123.7, "sleeve_id": "cn_ai_leadership_value", "mispricing_source": "Slow institutional rerating of AI-infra leaders with stale balance-sheet anchors; price confirms demand before valuation catches up.", "forced_counterparty": "Retail T+1 profit-takers and benchmarked mutual funds that add late to capex-heavy hardware and infrastructure names.", "data_requirements": "[\"IS test uses close and pb\",\"promotion needs beta-hedged attribution vs 000300.SH and 399006.SZ\",\"corr check vs kshadow_5 and amount_stability_20\",\"source-reviewed backlog/capex/order evidence before labeling any surfaced name an AI bottleneck\"]", "failure_mode": "Fails when low-PB names are cheap because of real balance-sheet stress, or when broad risk-off de-rates cyclical AI-infra assets regardless of leadership.", "report_contract": "fresh_buy_gate", "ai_supercycle_layer": "hard_assets_energy_heavy", "supply_chain_hypothesis": "Asset-heavy AI datacenter, power, cooling, and equipment beneficiaries can rerate in two stages as upstream compute demand forces follow-on infrastructure capex.", "relationship_evidence_required": "true", "money_readiness": "money_candidate", "decision": "revert", "session_branch": "main", "base_ref": "origin/main", "merge_base": "d2c1f8b0275f77c8ecaaf5e8c1e7af34eb0f89bd", "head_commit": "d2c1f8b0275f77c8ecaaf5e8c1e7af34eb0f89bd"}
{"ts": "2026-05-14T14:57:24.823429+08:00", "session_id": "20260514_140002_68da11", "market": "cn", "formula": "rank(-ts_corr(ret_5d,delta(amount/circ_market_cap,5),20))", "name": "ret5_floatflow_diverge_20", "is_ic": 0.0, "is_ic_ir": 0.0, "is_sharpe": 0.0, "is_turnover": 0.0, "is_monotonicity": 0.0, "gates": "FAIL", "status": "reverted", "eval_seconds": 248.5, "sleeve_id": "daily_price_overlay", "mispricing_source": "Underreaction to quiet inventory transfer in float-scarce AI infra names; discretionary traders anchor on recent weakness and miss improving flow quality.", "forced_counterparty": "Retail theme traders and benchmarked holders trimming on drawdowns for liquidity/risk control.", "data_requirements": "[\"daily close/ret_5d/amount/circ_market_cap (available)\", \"benchmark hedge attribution vs 000300.SH and 399006.SZ\", \"sleeve correlation matrix vs existing promoted factors\", \"source-reviewed AI-universe membership before production promotion\"]", "failure_mode": "Fails in limit-up chase or panic-liquidity regimes where wide-range breakout/derisking dominates and quiet absorption no longer leads price.", "report_contract": "setup_overlay", "ai_supercycle_layer": "ai_networking_optical_cpo", "supply_chain_hypothesis": "Discovery cue for optical/interconnect bottlenecks: names with negative 5d-return vs weekly float-flow correlation may be getting accumulated ahead of visible order/backlog confirmation.", "relationship_evidence_required": "true", "money_readiness": "research_only", "decision": "revert", "session_branch": "main", "base_ref": "origin/main", "merge_base": "d2c1f8b0275f77c8ecaaf5e8c1e7af34eb0f89bd", "head_commit": "d2c1f8b0275f77c8ecaaf5e8c1e7af34eb0f89bd"}
{"ts": "2026-05-14T14:57:24.823429+08:00", "session_id": "20260514_140002_68da11", "market": "cn", "formula": "rank(-ts_corr(ret_1d,shift(ret_1d,1),20))*rank(-ts_mean(abs(volume_ratio-1),20))", "name": "anti_autocorr_relvol_uniform_20", "is_ic": 0.0, "is_ic_ir": 0.0, "is_sharpe": 0.0, "is_turnover": 0.0, "is_monotonicity": 0.0, "gates": "FAIL", "status": "reverted", "eval_seconds": 162.2, "sleeve_id": "cn_ai_infra_absorption", "mispricing_source": "T+1 retail churn and theme-rotation funds overreact to noisy daily moves, while patient capital accumulates in quieter names without obvious volume spikes.", "forced_counterparty": "Retail momentum traders and benchmarked managers rotating into visible breakout names instead of holding quiet consolidations.", "data_requirements": "[\"daily OHLCV\",\"daily_basic.volume_ratio\",\"reviewed AI-infra universe membership\",\"benchmark hedge attribution vs 000300.SH/399006.SZ\",\"corr check vs kshadow_5 and amount_stability_20\"]", "failure_mode": "It stops working when quiet volume reflects genuine demand evaporation rather than absorption, or when the regime shifts to broad speculative breakout chasing where stable-volume names lag.", "report_contract": "setup_overlay", "ai_supercycle_layer": "ai_networking_optical_cpo", "supply_chain_hypothesis": "Candidate bottleneck repricing in optical/CPO and datacenter interconnect names where limited float is absorbed during low-drama digestion before backlog or order evidence is fully recognized.", "relationship_evidence_required": "true", "money_readiness": "research_only", "decision": "revert", "session_branch": "main", "base_ref": "origin/main", "merge_base": "d2c1f8b0275f77c8ecaaf5e8c1e7af34eb0f89bd", "head_commit": "d2c1f8b0275f77c8ecaaf5e8c1e7af34eb0f89bd"}
{"ts": "2026-05-14T14:57:24.823429+08:00", "session_id": "20260514_140002_68da11", "market": "cn", "formula": "rank(ts_mean(amount / circ_market_cap,20) / ts_std(amount / circ_market_cap,20))", "name": "float_turnover_stability_20", "is_ic": 0.0, "is_ic_ir": 0.0, "is_sharpe": 0.0, "is_turnover": 0.0, "is_monotonicity": 0.0, "gates": "FAIL", "status": "reverted", "eval_seconds": 107.1, "sleeve_id": "cn_ai_flow_quality", "mispricing_source": "Slow institutional accumulation in scarce-float AI-infra names is not immediately reflected in price because benchmarked and headline-driven capital prefers louder breakouts; smooth float-normalized flow captures that hidden sponsorship.", "forced_counterparty": "Retail momentum traders and benchmark-constrained managers rotating around short-term themes rather than warehousing quiet accumulation.", "data_requirements": "[\"daily amount\",\"circ_market_cap\",\"portfolio beta-hedge attribution vs 000300.SH/399006.SZ\",\"source-review evidence only if any surfaced name is outside current ai_infra universe\"]", "failure_mode": "This stops working when the market regime rewards episodic speculative spikes over steady accumulation, or when turnover-stability becomes crowded and fully arbitraged across the AI sleeve.", "report_contract": "fresh_buy_gate", "ai_supercycle_layer": "ai_chip_equipment_materials_packaging", "supply_chain_hypothesis": "If AI capex bottlenecks are tightening, validated CN semicap/materials/packaging names should show sustained float-normalized turnover before explicit backlog/order evidence is fully reflected in price.", "relationship_evidence_required": "true", "money_readiness": "money_candidate", "decision": "revert", "session_branch": "main", "base_ref": "origin/main", "merge_base": "d2c1f8b0275f77c8ecaaf5e8c1e7af34eb0f89bd", "head_commit": "d2c1f8b0275f77c8ecaaf5e8c1e7af34eb0f89bd"}
{"ts": "2026-05-14T14:57:24.823429+08:00", "session_id": "20260514_140002_68da11", "market": "cn", "formula": "rank(-ts_std(amount,20)/(ts_std(amount,60)+0.01))*rank(-(ts_max(turnover_rate,20)/(ts_mean(turnover_rate,20)+0.01)))", "name": "amount_compress_spike_share_20_60", "is_ic": 0.0, "is_ic_ir": 0.0, "is_sharpe": 0.0, "is_turnover": 0.0, "is_monotonicity": 0.0, "gates": "FAIL", "status": "reverted", "eval_seconds": 107.8, "sleeve_id": "daily_flow_stability_overlay", "mispricing_source": "The market overpays for salient AI-theme spike days and underweights orderly post-spike sponsorship; this sleeve measures participation compression and turnover concentration, not raw momentum or upper-shadow shape.", "forced_counterparty": "Retail T+1 theme chasers, redemption-driven sellers, and benchmark-constrained long-only funds trimming into liquidity rather than optimizing medium-horizon residual alpha.", "data_requirements": "[\"amount\",\"turnover_rate\",\"AI-infra CN universe tags\",\"beta-hedged sleeve attribution vs 000300.SH and 399006.SZ\",\"rolling corr vs kshadow_5 and turnover/amount stability sleeves\",\"original filings or official releases only if later attaching a supplier/order narrative\"]", "failure_mode": "It fails in rumor/policy squeeze regimes where one-day turnover bursts carry real information and keep leading, or in broad deleveraging tapes where compressed amount just reflects neglect and illiquidity.", "report_contract": "setup_overlay", "ai_supercycle_layer": "ai_chip_equipment_materials_packaging", "supply_chain_hypothesis": "Within validated CN AI-infra candidates, domestic semicap, materials, packaging, and testing bottleneck names should transition from bursty attention-led turnover to compressed, broad participation before source-reviewed capex, order, or backlog evidence is fully priced.", "relationship_evidence_required": "true", "money_readiness": "research_only", "decision": "revert", "session_branch": "main", "base_ref": "origin/main", "merge_base": "d2c1f8b0275f77c8ecaaf5e8c1e7af34eb0f89bd", "head_commit": "d2c1f8b0275f77c8ecaaf5e8c1e7af34eb0f89bd"}
{"ts": "2026-05-14T14:57:24.823429+08:00", "session_id": "20260514_140002_68da11", "market": "cn", "formula": "rank(-ts_std(delta(log(amount),5),20))", "name": "log_amount_change_stability_20_5", "is_ic": 0.0, "is_ic_ir": 0.0, "is_sharpe": 0.0, "is_turnover": 0.0, "is_monotonicity": 0.0, "gates": "FAIL", "status": "reverted", "eval_seconds": 140.9, "sleeve_id": "flow_path_smoothness", "mispricing_source": "Second-order flow-path underreaction; this captures smoothness of traded-value change rather than raw price trend, reversal, or candle shape, so it should diversify price-only sleeves.", "forced_counterparty": "Retail theme chasers and benchmarked liquidity/rebalance funds trading in bursts for mandate or attention reasons.", "data_requirements": "[\"amount\",\"beta-hedged sleeve attribution vs 000300.SH and 399006.SZ\",\"rolling correlation to existing sleeves\",\"ai_infra universe tags for post-selection labeling\"]", "failure_mode": "Breaks in policy/headline shock or speculative chase regimes where bursty amount carries real information and smooth flow reflects dead illiquidity rather than accumulation.", "report_contract": "fresh_buy_gate", "ai_supercycle_layer": "ai_chip_equipment_materials_packaging", "supply_chain_hypothesis": "If domestic AI hardware bottlenecks are tightening, CN semicap, packaging, and test beneficiaries should show smooth weekly traded-value changes before explicit order or backlog evidence is public.", "relationship_evidence_required": "true", "money_readiness": "money_candidate", "decision": "revert", "session_branch": "main", "base_ref": "origin/main", "merge_base": "d2c1f8b0275f77c8ecaaf5e8c1e7af34eb0f89bd", "head_commit": "d2c1f8b0275f77c8ecaaf5e8c1e7af34eb0f89bd"}
{"ts": "2026-05-14T14:57:24.823429+08:00", "session_id": "20260514_140002_68da11", "market": "cn", "formula": "rank(-ts_std(pct_change(amount,5),20)/log(circ_market_cap))", "name": "weekly_flow_smooth_float_20", "is_ic": 0.0, "is_ic_ir": 0.0, "is_sharpe": 0.0, "is_turnover": 0.0, "is_monotonicity": 0.0, "gates": "FAIL", "status": "reverted", "eval_seconds": 138.3, "sleeve_id": "cn_aiinfra_flow_quality", "mispricing_source": "The market overprices visible turnover bursts and underprices orderly weekly cash absorption in float-constrained AI leaders, so medium-horizon repricing lags sponsorship improvement.", "forced_counterparty": "Retail T+1 theme traders, redemption-driven sellers, and benchmarked long-only funds that cannot build full positions early in smaller bottleneck names.", "data_requirements": "[\"amount\",\"circ_market_cap\",\"beta-hedged sleeve return vs 000300.SH and 399006.SZ\",\"residual risk attribution\",\"rolling corr vs kshadow_5 and amount_stability_20\",\"filings/press releases if a supplier/customer claim is promoted\"]", "failure_mode": "Fails in policy-gap or squeeze regimes where bursty flow is genuinely informative, or when smooth weekly amount changes mostly reflect illiquidity rather than accumulation.", "report_contract": "setup_overlay", "ai_supercycle_layer": "ai_chip_equipment_materials_packaging", "supply_chain_hypothesis": "Domestic semicap, materials, packaging, and test bottleneck names tied to AI server and accelerator build-out should show smoother weekly cash-flow paths per unit of float before verified backlog or order evidence is fully priced.", "relationship_evidence_required": "true", "money_readiness": "research_only", "decision": "revert", "session_branch": "main", "base_ref": "origin/main", "merge_base": "d2c1f8b0275f77c8ecaaf5e8c1e7af34eb0f89bd", "head_commit": "d2c1f8b0275f77c8ecaaf5e8c1e7af34eb0f89bd"}
{"ts": "2026-05-14T14:57:24.823429+08:00", "session_id": "20260514_140002_68da11", "market": "cn", "formula": "rank(ts_mean(amount,20)/ts_std(amount,20))*rank(ts_rank(close,60))", "name": "stable_amount_leader_60", "is_ic": 0.0, "is_ic_ir": 0.0, "is_sharpe": 0.0, "is_turnover": 0.0, "is_monotonicity": 0.0, "gates": "FAIL", "status": "reverted", "eval_seconds": 89.1, "sleeve_id": "cn_ai_accumulation_overlay", "mispricing_source": "Slow-moving thematic and industrial capital accumulates validated AI-infra names gradually due to liquidity limits and evidence lag, so “stable flow + high price percentile” can lead public confirmation and consensus rerating.", "forced_counterparty": "Short-horizon retail traders and benchmarked allocators who trim quiet leaders because the setup looks crowded only after the visible breakout.", "data_requirements": "[\"daily close\",\"daily amount\",\"benchmark series for beta-hedged attribution\",\"existing AI-universe membership and source-review status\"]", "failure_mode": "Fails in sharp mean-reversion or retail-mania regimes where high price percentile reflects terminal crowding rather than informed accumulation.", "report_contract": "setup_overlay", "ai_supercycle_layer": "ai_networking_optical_cpo", "supply_chain_hypothesis": "Domestic optical/interconnect bottleneck names may show stable-amount leadership before verified hyperscaler or datacenter capex transmission is visible in filings or official releases.", "relationship_evidence_required": "true", "money_readiness": "research_only", "decision": "revert", "session_branch": "main", "base_ref": "origin/main", "merge_base": "d2c1f8b0275f77c8ecaaf5e8c1e7af34eb0f89bd", "head_commit": "d2c1f8b0275f77c8ecaaf5e8c1e7af34eb0f89bd"}
{"ts": "2026-05-14T14:57:24.823429+08:00", "session_id": "20260514_140002_68da11", "market": "cn", "formula": "rank(-ts_corr(ret_1d,shift(ret_1d,1),20))*rank(-ts_std(pct_change(amount,5),20))", "name": "anti_autocorr_weekly_amount_change_stability", "is_ic": 0.0, "is_ic_ir": 0.0, "is_sharpe": 0.0, "is_turnover": 0.0, "is_monotonicity": 0.0, "gates": "FAIL", "status": "reverted", "eval_seconds": 192.7, "sleeve_id": "cn_ai_infra_accumulation", "mispricing_source": "Retail T+1 flow and benchmarked managers anchor on noisy daily tape and underreact to quiet multiweek accumulation in scarce AI-infra names.", "forced_counterparty": "Short-horizon retail momentum traders and benchmark-constrained funds trimming into noise", "data_requirements": "[\"daily ret_1d and amount\",\"ai_infra universe/source-review metadata for post-rank filtering\",\"beta-hedged sleeve attribution vs 000300.SH and 399006.SZ before promotion\"]", "failure_mode": "Fails in broad speculative melt-up regimes where one-way crowding and single-day turnover bursts matter more than quiet accumulation, or once the stability trade becomes crowded.", "report_contract": "setup_overlay", "ai_supercycle_layer": "none", "supply_chain_hypothesis": "Candidate CN AI-infra bottleneck suppliers or enablers should show stable weekly funding and absorbed pullbacks before validated order/customer evidence is broadly priced.", "relationship_evidence_required": "true", "money_readiness": "research_only", "decision": "revert", "session_branch": "main", "base_ref": "origin/main", "merge_base": "d2c1f8b0275f77c8ecaaf5e8c1e7af34eb0f89bd", "head_commit": "d2c1f8b0275f77c8ecaaf5e8c1e7af34eb0f89bd"}
{"ts": "2026-05-14T14:57:24.823429+08:00", "session_id": "20260514_140002_68da11", "market": "cn", "formula": "rank(ts_min(amount,20)/ts_max(amount,20)/log(circ_market_cap))", "name": "float_amount_corridor_20", "is_ic": 0.0, "is_ic_ir": 0.0, "is_sharpe": 0.0, "is_turnover": 0.0, "is_monotonicity": 0.0, "gates": "FAIL", "status": "reverted", "eval_seconds": 178.6, "sleeve_id": "cn_ai_infra_accumulation", "mispricing_source": "A-share participants overreact to visible turnover spikes and underreact to persistent low-noise absorption; steady capital floors in scarce-float AI names are harder to arbitrage quickly under T+1 and theme-rotation behavior.", "forced_counterparty": "retail theme chasers and benchmarked institutions providing episodic liquidity rather than optimizing for quiet 10-20d accumulation patterns", "data_requirements": "[\"daily amount and circ_market_cap in CN universe\", \"ai_infra BFS/module/source-review tags for post-test attribution\", \"benchmark-hedged sleeve attribution vs 000300.SH and 399006.SZ before promotion\"]", "failure_mode": "This stops working in blow-off or panic regimes where one-day spike participation is rewarded more than steady sponsorship, or when broad beta swamps bottleneck-specific flow.", "report_contract": "fresh_buy_gate", "ai_supercycle_layer": "ai_chip_equipment_materials_packaging", "supply_chain_hypothesis": "D2-D4 CN AI hardware bottleneck names should show persistent float-aware amount corridors before repricing as the market recognizes supply tightness; specific supplier/customer claims still need source review.", "relationship_evidence_required": "true", "money_readiness": "money_candidate", "decision": "revert", "session_branch": "main", "base_ref": "origin/main", "merge_base": "d2c1f8b0275f77c8ecaaf5e8c1e7af34eb0f89bd", "head_commit": "d2c1f8b0275f77c8ecaaf5e8c1e7af34eb0f89bd"}
{"ts": "2026-05-15T06:55:04.788753+08:00", "session_id": "20260515_060002_96bdd9", "market": "cn", "formula": "rank(-ts_std(turnover_rate,20)) * rank(ret_20d - ret_5d)", "name": "stable_turnover_trend_digest", "is_ic": 0.0, "is_ic_ir": 0.0, "is_sharpe": 0.0, "is_turnover": 0.0, "is_monotonicity": 0.0, "gates": "FAIL", "status": "reverted", "eval_seconds": 113.6, "sleeve_id": "cn_ai_infra_accumulation", "mispricing_source": "The payoff comes from underreaction to orderly accumulation; the interaction is not just a generic momentum clone because it requires flow stability and a recent digestion phase, rather than raw price strength or intraday candle shape.", "forced_counterparty": "Short-horizon retail traders and benchmarked managers trimming after a 5-day cooldown despite an intact 20-day trend", "data_requirements": "[\"daily CN price/amount/turnover data for IS test\", \"factor correlation matrix vs promoted sleeves\", \"beta-hedged sleeve return and residual risk attribution\", \"ai_infra source-review status before attaching any supplier/customer narrative\"]", "failure_mode": "It stops working when AI-infra tape becomes fully crowd-driven and unstable, or when low turnover stability reflects illiquidity/neglect instead of accumulation.", "report_contract": "setup_overlay", "ai_supercycle_layer": "ai_networking_optical_cpo", "supply_chain_hypothesis": "Candidate bottleneck repricing in CN optical interconnect/CPO names as AI cluster bandwidth demand pulls capital into orderly leaders before headline confirmation", "relationship_evidence_required": "true", "money_readiness": "research_only", "decision": "revert", "session_branch": "main", "base_ref": "origin/main", "merge_base": "0994185783159f479f554edf1e5a4e45d9f34cfe", "head_commit": "0994185783159f479f554edf1e5a4e45d9f34cfe"}
{"ts": "2026-05-15T06:55:04.788753+08:00", "session_id": "20260515_060002_96bdd9", "market": "cn", "formula": "rank(-(ts_std(amount/circ_market_cap,20)/(ts_mean(amount/circ_market_cap,20)+0.01))+ret_20d-ret_5d)", "name": "float_value_stability_pullback", "is_ic": 0.0, "is_ic_ir": 0.0, "is_sharpe": 0.0, "is_turnover": 0.0, "is_monotonicity": 0.0, "gates": "FAIL", "status": "reverted", "eval_seconds": 130.3, "sleeve_id": "cn_ai_flow_accumulation", "mispricing_source": "Slow institutional accumulation in scarce AI-infra names meets T+1 retail profit-taking; float-adjusted value-turnover stability is a flow-quality signal, not just another wick or raw momentum variant.", "forced_counterparty": "Retail momentum traders and benchmarked long-only funds trimming recent winners for risk-budget or month-end constraints.", "data_requirements": "[\"IS test uses amount, circ_market_cap, ret_20d, ret_5d only\", \"promotion needs correlation check vs kshadow_5 and amount_stability_20\", \"benchmark-hedged attribution vs 000300.SH/399006.SZ\", \"source-reviewed AI-universe membership\"]", "failure_mode": "Fails when theme beta or policy bursts dominate stock selection, or when stable flow simply reflects passive/ETF churn instead of active accumulation.", "report_contract": "fresh_buy_gate", "ai_supercycle_layer": "ai_networking_optical_cpo", "supply_chain_hypothesis": "Verified CN optical/interconnect bottleneck names tied to AI datacenter capex should show stable float-adjusted value turnover before secondary repricing after shallow pullbacks.", "relationship_evidence_required": "true", "money_readiness": "money_candidate", "decision": "revert", "session_branch": "main", "base_ref": "origin/main", "merge_base": "0994185783159f479f554edf1e5a4e45d9f34cfe", "head_commit": "0994185783159f479f554edf1e5a4e45d9f34cfe"}
