{"ts": "2026-05-13T14:57:16.348295+08:00", "session_id": "20260513_140001_b22859", "market": "cn", "formula": "rank((ret_20d-ret_5d)*ts_mean(turnover_rate,20)/ts_mean(turnover_rate,5))", "name": "trend_cooloff_turnover_20", "is_ic": 0.0, "is_ic_ir": 0.0, "is_sharpe": 0.0, "is_turnover": 0.0, "is_monotonicity": 0.0, "gates": "FAIL", "status": "reverted", "eval_seconds": 116.6, "sleeve_id": "ai_infra_pullback_accumulation", "mispricing_source": "Underreaction to AI-capex and bottleneck repricing during low-turnover consolidations; this is not just a price factor because it requires leadership plus fading participation, which proxies for weak-hand exit and institutional absorption.", "forced_counterparty": "Retail theme traders taking profits on pullbacks; benchmarked mutual funds and style-constrained allocators adding late after confirmation", "data_requirements": "[\"current CN daily tape features already suffice for signal research\", \"ai_infra universe tags for BFS/module/current-pool filtering and residual-risk buckets\", \"portfolio backtest with beta hedge attribution vs 000300.SH and 399006.SZ\", \"any supplier/customer/order claim still requires filings, transcripts, official PRs, or verified news\"]", "failure_mode": "Breaks when turnover compression reflects loss of sponsorship instead of absorption, especially in broad risk-off deleveraging or after late-stage theme exhaustion.", "report_contract": "setup_overlay", "ai_supercycle_layer": "ai_chip_equipment_materials_packaging", "supply_chain_hypothesis": "Domestic AI chip-equipment, materials, and advanced-packaging beneficiaries should show quiet continuation after short pullbacks as scarce local capacity gets repriced ahead of fully verified order data.", "relationship_evidence_required": "true", "money_readiness": "research_only", "decision": "revert", "session_branch": "main", "base_ref": "origin/main", "merge_base": "53507f2f93b1d8e5cf801b42a52edbea3e9353eb", "head_commit": "3adfb8bbdd9630bca97e8ef5f05dc7964b23b34c"}
{"ts": "2026-05-13T14:57:16.348295+08:00", "session_id": "20260513_140001_b22859", "market": "cn", "formula": "rank(ret_20d-ret_5d)*rank(ts_min(amount/circ_market_cap,20)/ts_max(amount/circ_market_cap,20))", "name": "float_corridor_cooloff_20_5", "is_ic": 0.0, "is_ic_ir": 0.0, "is_sharpe": 0.0, "is_turnover": 0.0, "is_monotonicity": 0.0, "gates": "FAIL", "status": "reverted", "eval_seconds": 260.6, "sleeve_id": "cn_ai_infra_entry_quality", "mispricing_source": "Underreaction after orderly pullbacks in tight-float AI infrastructure leaders; continuation persists because steady buyers keep participation even while weak hands exit.", "forced_counterparty": "Retail swing traders taking profits on 3-5 day stalls and benchmark-constrained institutions that cannot instantly scale into smaller AI-infra names", "data_requirements": "[\"daily OHLCV\",\"amount\",\"circ_market_cap\",\"ai_infra universe metadata\",\"benchmark returns for beta-hedged sleeve attribution\",\"sleeve correlation and residual risk attribution report\"]", "failure_mode": "Fails in speculative melt-up regimes where one-day volume spikes dominate continuation, or in market-wide liquidity shocks where a stable corridor reflects distribution instead of accumulation.", "report_contract": "setup_overlay", "ai_supercycle_layer": "none", "supply_chain_hypothesis": "none", "relationship_evidence_required": "false", "money_readiness": "research_only", "decision": "revert", "session_branch": "main", "base_ref": "origin/main", "merge_base": "53507f2f93b1d8e5cf801b42a52edbea3e9353eb", "head_commit": "3adfb8bbdd9630bca97e8ef5f05dc7964b23b34c"}
{"ts": "2026-05-13T14:57:16.348295+08:00", "session_id": "20260513_140001_b22859", "market": "cn", "formula": "rank(-ts_corr(ret_1d,shift(ret_1d,1),20))*rank(ts_min(ts_sum(volume_ratio,5),20)/ts_mean(ts_sum(volume_ratio,5),20))", "name": "anti_autocorr_weekly_relvol_floor_20", "is_ic": 0.0, "is_ic_ir": 0.0, "is_sharpe": 0.0, "is_turnover": 0.0, "is_monotonicity": 0.0, "gates": "FAIL", "status": "reverted", "eval_seconds": 168.9, "sleeve_id": "daily_flow_underreaction", "mispricing_source": "The market overweights loud spike days and underweights steady participation geometry; this is a flow-shape sleeve, not a high-correlation clone of a simple price or upper-shadow factor.", "forced_counterparty": "retail theme chasers and benchmark/rebalance/redemption-driven sellers trading for liquidity or mandate reasons rather than 10-20 day alpha", "data_requirements": "[\"ret_1d\",\"volume_ratio\"]; for production use also require beta-hedge/residual-risk attribution, and any outside-universe name still needs source-review evidence before promotion", "failure_mode": "Fails in speculative breakout or policy-shock regimes where bursty attention is genuinely informative and smooth relative-volume floors mainly reflect dead liquidity or passive churn.", "report_contract": "fresh_buy_gate", "ai_supercycle_layer": "ai_chip_equipment_materials_packaging", "supply_chain_hypothesis": "Candidate domestic AI equipment, materials, packaging, and testing bottleneck beneficiaries should show a persistent weekly relative-volume floor and two-way absorption before downstream AI capex/order evidence becomes consensus.", "relationship_evidence_required": "true", "money_readiness": "money_candidate", "decision": "revert", "session_branch": "main", "base_ref": "origin/main", "merge_base": "53507f2f93b1d8e5cf801b42a52edbea3e9353eb", "head_commit": "3adfb8bbdd9630bca97e8ef5f05dc7964b23b34c"}
{"ts": "2026-05-13T14:57:16.348295+08:00", "session_id": "20260513_140001_b22859", "market": "cn", "formula": "rank((ret_20d-ret_5d)-ts_std(amount,20)/ts_mean(amount,20))", "name": "stable_amount_pullback_20", "is_ic": 0.0, "is_ic_ir": 0.0, "is_sharpe": 0.0, "is_turnover": 0.0, "is_monotonicity": 0.0, "gates": "FAIL", "status": "reverted", "eval_seconds": 108.0, "sleeve_id": "cn_ai_leadership_overlay", "mispricing_source": "The payoff comes from underreaction to orderly consolidation inside AI-infra leaders; the amount-stability penalty is meant to separate healthy digestion from crowded blow-off volume, so this is not just a high-correlation clone of plain momentum.", "forced_counterparty": "T+1 retail profit-takers and benchmark-constrained long-only funds that scale into themes slowly", "data_requirements": "`[\"daily OHLCV+amount\",\"ai_infra universe membership + source-review status\",\"000300.SH/399006.SZ benchmark returns for beta-hedged attribution\",\"factor correlation matrix\",\"filings/press releases/transcripts if a supplier/backlog claim is later attached\"]`", "failure_mode": "It should fail in panic/liquidity-shock regimes or policy-gap breakout regimes where high amount volatility is bullish rather than a distribution warning, and it should decay if AI leadership broadens enough that pullbacks no longer resolve selectively.", "report_contract": "setup_overlay", "ai_supercycle_layer": "ai_chip_equipment_materials_packaging", "supply_chain_hypothesis": "Domestic AI semiconductor equipment, materials, and advanced-packaging bottleneck names should exhibit orderly 20-day leadership with a 5-day digestion window before the market fully prices capex and order scarcity.", "relationship_evidence_required": "true", "money_readiness": "research_only", "decision": "revert", "session_branch": "main", "base_ref": "origin/main", "merge_base": "53507f2f93b1d8e5cf801b42a52edbea3e9353eb", "head_commit": "3adfb8bbdd9630bca97e8ef5f05dc7964b23b34c"}
{"ts": "2026-05-13T14:57:16.348295+08:00", "session_id": "20260513_140001_b22859", "market": "cn", "formula": "rank(-(ts_max(turnover_rate,20)/ts_sum(turnover_rate,20)))*rank(-ret_5d)", "name": "turnover_spike_pullback_20", "is_ic": 0.0, "is_ic_ir": 0.0, "is_sharpe": 0.0, "is_turnover": 0.0, "is_monotonicity": 0.0, "gates": "FAIL", "status": "reverted", "eval_seconds": 225.9, "sleeve_id": "cn_aiinfra_pullback_absorption", "mispricing_source": "Flow concentration is a proxy for weak-hand crowding, so this is not just a reversal factor; it conditions pullback on ownership-quality/accumulation structure.", "forced_counterparty": "retail momentum chasers and short-horizon theme traders forced to de-risk on pullbacks", "data_requirements": "[\"CN daily tape fields already available\", \"ai_infra BFS depth/module/source-review tags for universe filtering\", \"000300.SH/399006.SZ beta-hedge and residual attribution\", \"primary-source filings/PRs if any supplier/customer claim is attached\"]", "failure_mode": "It should stop working in squeeze-driven or policy-gap regimes where one-day spikes keep extending instead of mean-reverting, or when AI-theme leadership broadens enough that even-turnover pullbacks no longer signal accumulation.", "report_contract": "setup_overlay", "ai_supercycle_layer": "none", "supply_chain_hypothesis": "Cross-layer CN AI-infra bottleneck suppliers should show orderly pullback absorption before the next leg, but exact supplier/customer links remain source-review work.", "relationship_evidence_required": "true", "money_readiness": "research_only", "decision": "revert", "session_branch": "main", "base_ref": "origin/main", "merge_base": "53507f2f93b1d8e5cf801b42a52edbea3e9353eb", "head_commit": "3adfb8bbdd9630bca97e8ef5f05dc7964b23b34c"}
{"ts": "2026-05-13T14:57:16.348295+08:00", "session_id": "20260513_140001_b22859", "market": "cn", "formula": "rank(ts_mean(amount/circ_market_cap,20)/ts_std(amount/circ_market_cap,20))*rank(close/ts_max(high,20))", "name": "float_leadership_stability_20", "is_ic": 0.0, "is_ic_ir": 0.0, "is_sharpe": 0.0, "is_turnover": 0.0, "is_monotonicity": 0.0, "gates": "FAIL", "status": "reverted", "eval_seconds": 171.4, "sleeve_id": "cn_tape_leadership_continuation", "mispricing_source": "Stable float-normalized participation captures persistent institutional absorption, and the 20-day high anchor filters for genuine leadership; this is not just a kshadow variant because the core signal is steady capital recycling, not short-horizon candle shape.", "forced_counterparty": "T+1 retail profit-takers and benchmark-constrained funds that are slow to add narrower AI-infra names", "data_requirements": "[\"current CN daily tape fields are sufficient for IS test\",\"promotion requires long-alpha minus beta-hedge attribution vs 000300.SH/399006.SZ, sleeve correlation to existing CN factors, and source review before attaching any supplier/customer claim\"]", "failure_mode": "It stops working in broad mean-reversion or policy-beta squeeze regimes, where near-high names are crowded and stable turnover no longer means accumulation.", "report_contract": "setup_overlay", "ai_supercycle_layer": "none", "supply_chain_hypothesis": "none", "relationship_evidence_required": "false", "money_readiness": "research_only", "decision": "revert", "session_branch": "main", "base_ref": "origin/main", "merge_base": "53507f2f93b1d8e5cf801b42a52edbea3e9353eb", "head_commit": "3adfb8bbdd9630bca97e8ef5f05dc7964b23b34c"}
{"ts": "2026-05-14T06:57:17.389776+08:00", "session_id": "20260514_060003_7f53cb", "market": "cn", "formula": "rank(-ts_corr(ret_1d,shift(ret_1d,1),20))*rank(-ts_std(turnover_rate,20)/ts_mean(turnover_rate,20))", "name": "anti_autocorr_turnover_stability_20", "is_ic": 0.0, "is_ic_ir": 0.0, "is_sharpe": 0.0, "is_turnover": 0.0, "is_monotonicity": 0.0, "gates": "FAIL", "status": "reverted", "eval_seconds": 160.5, "sleeve_id": "cn_ai_chip_flow_overlay", "mispricing_source": "A-share retail theme traders and short-horizon de-riskers push tape around day to day, while benchmarked institutions build exposure slowly in strategic domestic bottlenecks; the market underreacts to that steady absorption until later evidence arrives.", "forced_counterparty": "Retail T+1 churn, margin-linked sellers, and benchmark-hugging long-only funds that scale in mechanically rather than immediately.", "data_requirements": "[\"daily ret_1d and turnover_rate\",\"AI-infra universe membership from global_universe_v2/source-review\",\"source-reviewed filings/news/transcripts before treating surfaced names as validated bottleneck suppliers\",\"beta-hedge and residual-risk attribution before promotion\"]", "failure_mode": "Fails when the layer is in one-way breakout mode with expanding turnover or in broad deleveraging, because smooth anti-autocorrelated absorption stops being the dominant state.", "report_contract": "research_only", "ai_supercycle_layer": "ai_chip_equipment_materials_packaging", "supply_chain_hypothesis": "Domestic AI chip equipment/materials/packaging bottlenecks should show steady-turnover absorption before backlog or order visibility is fully reflected in price.", "relationship_evidence_required": "true", "money_readiness": "research_only", "decision": "revert", "session_branch": "main", "base_ref": "origin/main", "merge_base": "7e34f69c6d80fac556ec0c4417978d3bf014bde7", "head_commit": "7e34f69c6d80fac556ec0c4417978d3bf014bde7"}
{"ts": "2026-05-14T06:57:17.389776+08:00", "session_id": "20260514_060003_7f53cb", "market": "cn", "formula": "rank(ts_std(pct_change(amount / circ_market_cap, 5), 20))", "name": "weekly_float_turnover_vol_20", "is_ic": 0.0, "is_ic_ir": 0.0, "is_sharpe": 0.0, "is_turnover": 0.0, "is_monotonicity": 0.0, "gates": "FAIL", "status": "reverted", "eval_seconds": 128.1, "sleeve_id": "cn_ai_flow_accumulation", "mispricing_source": "Quiet institutional accumulation is under-discounted, while the market overpays for noisy turnover bursts that look like confirmation but are often just retail/thematic churn.", "forced_counterparty": "Retail momentum chasers and benchmarked funds that can only add on liquid attention spikes.", "data_requirements": "[\"daily amount\",\"circ_market_cap\",\"CN AI universe membership\",\"benchmark beta vs 000300.SH and 399006.SZ\",\"factor correlation matrix vs promoted sleeves\",\"original filings/press releases if a specific supplier/customer claim is later attached\"]", "failure_mode": "Fails in policy-squeeze or headline-chasing regimes where speculative turnover spikes keep being rewarded instead of mean-reverting.", "report_contract": "research_only", "ai_supercycle_layer": "none", "supply_chain_hypothesis": "Cross-layer AI-infra bottleneck names in the CN universe should show smoother weekly float-turnover paths than downstream narrative proxies because real institutions accumulate scarce-capacity exposure gradually.", "relationship_evidence_required": "true", "money_readiness": "research_only", "decision": "revert", "session_branch": "main", "base_ref": "origin/main", "merge_base": "7e34f69c6d80fac556ec0c4417978d3bf014bde7", "head_commit": "7e34f69c6d80fac556ec0c4417978d3bf014bde7"}
{"ts": "2026-05-14T06:57:17.389776+08:00", "session_id": "20260514_060003_7f53cb", "market": "cn", "formula": "rank(ret_20d-ret_5d)*rank(ts_mean(amount,20)/ts_std(amount,20))", "name": "stable_amount_leader_pullback_20", "is_ic": 0.0, "is_ic_ir": 0.0, "is_sharpe": 0.0, "is_turnover": 0.0, "is_monotonicity": 0.0, "gates": "FAIL", "status": "reverted", "eval_seconds": 103.4, "sleeve_id": "cn_ai_infra_leadership_pullback", "mispricing_source": "Benchmark-aware institutions build AI-infra exposure gradually and leave a steady amount footprint, while short-horizon theme traders overreact when the 5-day impulse cools and rotate away too early.", "forced_counterparty": "Retail theme rotators and benchmark-constrained funds trimming recent winners or reallocating toward hotter high-turnover names", "data_requirements": "[\"daily OHLCV\",\"amount\",\"CN benchmark returns for beta-hedged attribution\",\"ai_infra universe layer/status tags\"]; if later interpreted as supplier exposure, add filings/transcripts/news evidence cards before promotion", "failure_mode": "Fails in broad deleveraging or late-stage blowoff regimes where stable amount reflects distribution into passive liquidity rather than continued accumulation", "report_contract": "setup_overlay", "ai_supercycle_layer": "ai_datacenter_edge_infra", "supply_chain_hypothesis": "Orderly pullbacks with stable amount should surface CN datacenter and interconnect buildout beneficiaries repricing to AI rack, power, and networking capex; exact supplier/customer links remain research candidates until source-reviewed", "relationship_evidence_required": "true", "money_readiness": "research_only", "decision": "revert", "session_branch": "main", "base_ref": "origin/main", "merge_base": "7e34f69c6d80fac556ec0c4417978d3bf014bde7", "head_commit": "7e34f69c6d80fac556ec0c4417978d3bf014bde7"}
{"ts": "2026-05-14T06:57:17.389776+08:00", "session_id": "20260514_060003_7f53cb", "market": "cn", "formula": "rank(ts_mean(amount,20)/ts_std(amount,20))*rank(ret_20d-ret_5d)", "name": "amount_stability_pullback_20", "is_ic": 0.0, "is_ic_ir": 0.0, "is_sharpe": 0.0, "is_turnover": 0.0, "is_monotonicity": 0.0, "gates": "FAIL", "status": "reverted", "eval_seconds": 67.4, "sleeve_id": "cn_ai_leadership_pullback", "mispricing_source": "Slow-moving institutional accumulation in AI bottleneck names is not fully impounded after a short pullback; the market overweights recent weakness and underweights persistent sponsorship in traded amount.", "forced_counterparty": "T+1 retail momentum traders and short-horizon discretionary holders taking profits after sharp thematic bursts", "data_requirements": "[\"daily amount and returns (available)\",\"AI-universe source-review status\",\"beta hedge attribution vs 000300.SH/399006.SZ\",\"sleeve correlation and residual risk attribution before promotion\"]", "failure_mode": "Stops working when the market is dominated by indiscriminate rumor squeezes or liquidity shocks, so stable amount becomes a size/liquidity proxy rather than evidence of sponsorship.", "report_contract": "setup_overlay", "ai_supercycle_layer": "ai_chip_equipment_materials_packaging", "supply_chain_hypothesis": "Verified AI hardware bottleneck suppliers in equipment/materials/packaging should exhibit steadier capital sponsorship and shallower, buyable pullbacks than non-bottleneck names during capex repricing cycles.", "relationship_evidence_required": "true", "money_readiness": "research_only", "decision": "revert", "session_branch": "main", "base_ref": "origin/main", "merge_base": "7e34f69c6d80fac556ec0c4417978d3bf014bde7", "head_commit": "7e34f69c6d80fac556ec0c4417978d3bf014bde7"}
{"ts": "2026-05-14T06:57:17.389776+08:00", "session_id": "20260514_060003_7f53cb", "market": "cn", "formula": "rank(ts_mean(amount/circ_market_cap,20)/ts_std(amount/circ_market_cap,20))*rank(-ts_corr(ret_1d,shift(ret_1d,1),20))", "name": "float_absorb_anti_autocorr_20", "is_ic": 0.0, "is_ic_ir": 0.0, "is_sharpe": 0.0, "is_turnover": 0.0, "is_monotonicity": 0.0, "gates": "FAIL", "status": "reverted", "eval_seconds": 146.0, "sleeve_id": "daily_float_flow_overlay", "mispricing_source": "Slow institutional accumulation against limited tradable float; this is a flow-quality and return-feedback signal, not a high-correlation variant of a pure price or candle-shape factor.", "forced_counterparty": "retail attention traders and benchmark/rebalance-constrained funds that trade for liquidity or mandate reasons rather than 10-20 day alpha", "data_requirements": "[\"amount\",\"circ_market_cap\",\"ret_1d\"]; for money-ready AI-supercycle labeling add ai_infra universe tags plus filings/press releases/transcripts to verify any supplier, order, or capacity claim", "failure_mode": "Fails in policy-shock or speculative beta-chase regimes where bursty momentum is genuinely informative and low-autocorr quiet-flow names lag.", "report_contract": "fresh_buy_gate", "ai_supercycle_layer": "ai_chip_equipment_materials_packaging", "supply_chain_hypothesis": "If AI hardware capex is tightening real bottlenecks, CN semicap, packaging, and test beneficiaries should show persistent amount-per-float absorption with muted daily return feedback before broader recognition.", "relationship_evidence_required": "true", "money_readiness": "money_candidate", "decision": "revert", "session_branch": "main", "base_ref": "origin/main", "merge_base": "7e34f69c6d80fac556ec0c4417978d3bf014bde7", "head_commit": "7e34f69c6d80fac556ec0c4417978d3bf014bde7"}
