{"base_ref": "origin/main", "decision": "candidate", "eval_seconds": 272.4, "formula": "rank(-ts_corr(ret_1d,shift(ret_1d,1),20))*rank(ts_min(ts_sum(amount,5),20)/ts_mean(ts_sum(amount,5),20))", "gates": "PASS", "head_commit": "be22710e9483cb7074b0286e64c8e8b58951ab75", "is_ic": 0.0348, "is_ic_ir": 0.392, "is_monotonicity": 0.15, "is_sharpe": 2.992, "is_turnover": 0.164, "market": "cn", "merge_base": "be22710e9483cb7074b0286e64c8e8b58951ab75", "name": "anti_autocorr_weekly_amount_floor_20", "session_branch": "main", "session_id": "20260429_060001_1474fc", "status": "candidate", "ts": "2026-04-29T06:56:06.160302+08:00"}
{"base_ref": "origin/main", "checks_status": "failed", "decision": "revert", "eval_seconds": 111.5, "formula": "rank(-ts_corr(ret_1d,shift(ret_1d,1),20))*rank(-ts_std(pct_change(amount,5),20))", "gates": "PASS", "head_commit": "be22710e9483cb7074b0286e64c8e8b58951ab75", "is_ic": 0.0415, "is_ic_ir": 0.449, "is_monotonicity": 0.15, "is_sharpe": 2.573, "is_turnover": 0.153, "market": "cn", "merge_base": "be22710e9483cb7074b0286e64c8e8b58951ab75", "name": "anti_autocorr_weekly_amount_stability_20", "oos": "PASS", "session_branch": "main", "session_id": "20260429_060001_1474fc", "status": "checks_failed", "ts": "2026-04-29T06:56:06.160302+08:00"}
{"base_ref": "origin/main", "checks_status": "failed", "decision": "revert", "eval_seconds": 185.3, "formula": "rank(-ts_corr(ret_1d,shift(ret_1d,1),20))*rank(ts_min(ts_sum(amount/circ_market_cap,5),20)/ts_max(ts_sum(amount/circ_market_cap,5),20))", "gates": "PASS", "head_commit": "be22710e9483cb7074b0286e64c8e8b58951ab75", "is_ic": 0.0378, "is_ic_ir": 0.452, "is_monotonicity": 0.5, "is_sharpe": 3.54, "is_turnover": 0.161, "market": "cn", "merge_base": "be22710e9483cb7074b0286e64c8e8b58951ab75", "name": "anti_autocorr_weekly_float_corridor_20", "oos": "PASS", "session_branch": "main", "session_id": "20260429_060001_1474fc", "status": "checks_failed", "ts": "2026-04-29T06:56:06.160302+08:00"}
{"base_ref": "origin/main", "decision": "candidate", "eval_seconds": 114.5, "formula": "rank(-ts_corr(ret_1d,shift(ret_1d,1),40))*rank(ts_mean(ts_sum(amount/circ_market_cap,5),20)/ts_max(ts_sum(amount/circ_market_cap,5),20))", "gates": "PASS", "head_commit": "be22710e9483cb7074b0286e64c8e8b58951ab75", "is_ic": 0.0281, "is_ic_ir": 0.311, "is_monotonicity": 0.85, "is_sharpe": 2.613, "is_turnover": 0.137, "market": "cn", "merge_base": "be22710e9483cb7074b0286e64c8e8b58951ab75", "name": "anti_autocorr_weekly_float_evenness_20", "session_branch": "main", "session_id": "20260429_060001_1474fc", "status": "candidate", "ts": "2026-04-29T06:56:06.160302+08:00"}
{"base_ref": "origin/main", "decision": "revert", "eval_seconds": 122.0, "formula": "rank(ts_min(amount/circ_market_cap,20)/ts_mean(amount/circ_market_cap,20)-ts_corr(ret_1d,shift(ret_1d,5),20))", "gates": "FAIL", "head_commit": "be22710e9483cb7074b0286e64c8e8b58951ab75", "is_ic": 0.0044, "is_ic_ir": 0.023, "is_monotonicity": 0.25, "is_sharpe": -5.031, "is_turnover": 0.186, "market": "cn", "merge_base": "be22710e9483cb7074b0286e64c8e8b58951ab75", "name": "anti_autocorr_weekly_float_floor_20", "session_branch": "main", "session_id": "20260429_060001_1474fc", "status": "reverted", "ts": "2026-04-29T06:56:06.160302+08:00"}
{"base_ref": "origin/main", "decision": "candidate", "eval_seconds": 164.5, "formula": "rank(-ts_corr(ret_1d,shift(ret_1d,1),20))*rank(-ts_std(ts_sum(amount/circ_market_cap,5),20)/ts_mean(ts_sum(amount/circ_market_cap,5),20))", "gates": "PASS", "head_commit": "be22710e9483cb7074b0286e64c8e8b58951ab75", "is_ic": 0.0361, "is_ic_ir": 0.448, "is_monotonicity": 0.45, "is_sharpe": 3.214, "is_turnover": 0.151, "market": "cn", "merge_base": "be22710e9483cb7074b0286e64c8e8b58951ab75", "name": "anti_autocorr_weekly_float_stability_20", "session_branch": "main", "session_id": "20260429_060001_1474fc", "status": "candidate", "ts": "2026-04-29T06:56:06.160302+08:00"}
{"base_ref": "origin/main", "decision": "candidate", "eval_seconds": 121.2, "formula": "rank(-ts_corr(ret_1d, shift(ret_1d, 1), 40)) * rank(-ts_std(ts_mean(close / open, 5), 20))", "gates": "PASS", "head_commit": "be22710e9483cb7074b0286e64c8e8b58951ab75", "is_ic": 0.0311, "is_ic_ir": 0.292, "is_monotonicity": 0.0, "is_sharpe": 2.134, "is_turnover": 0.104, "market": "cn", "merge_base": "be22710e9483cb7074b0286e64c8e8b58951ab75", "name": "anti_autocorr_weekly_openclose_stability_20", "session_branch": "main", "session_id": "20260429_060001_1474fc", "status": "candidate", "ts": "2026-04-29T06:56:06.160302+08:00"}
{"base_ref": "origin/main", "decision": "revert", "eval_seconds": 109.9, "formula": "rank(-ts_corr(volume_ratio,shift(volume_ratio,5),20))*rank(ts_mean(volume_ratio,20)/ts_max(volume_ratio,20))", "gates": "FAIL", "head_commit": "be22710e9483cb7074b0286e64c8e8b58951ab75", "is_ic": 0.014, "is_ic_ir": 0.149, "is_monotonicity": 0.2, "is_sharpe": -2.275, "is_turnover": 0.171, "market": "cn", "merge_base": "be22710e9483cb7074b0286e64c8e8b58951ab75", "name": "anti_autocorr_weekly_relvol_evenness_20", "session_branch": "main", "session_id": "20260429_060001_1474fc", "status": "reverted", "ts": "2026-04-29T06:56:06.160302+08:00"}
{"base_ref": "origin/main", "decision": "revert", "eval_seconds": 176.3, "formula": "rank(-ts_corr(ret_5d,shift(ret_5d,5),20))*rank(-(ts_max(turnover_rate,20)/ts_sum(turnover_rate,20)))", "gates": "FAIL", "head_commit": "be22710e9483cb7074b0286e64c8e8b58951ab75", "is_ic": 0.0124, "is_ic_ir": 0.129, "is_monotonicity": 0.7, "is_sharpe": -1.883, "is_turnover": 0.162, "market": "cn", "merge_base": "be22710e9483cb7074b0286e64c8e8b58951ab75", "name": "anti_autocorr_weekly_turn_spike_share_20", "session_branch": "main", "session_id": "20260429_060001_1474fc", "status": "reverted", "ts": "2026-04-29T06:56:06.160302+08:00"}
{"base_ref": "origin/main", "checks_status": "failed", "decision": "revert", "eval_seconds": 110.0, "formula": "rank(-ts_corr(ret_1d,shift(ret_1d,1),20))*rank(ts_min(ts_sum(turnover_rate,5),20)/ts_max(ts_sum(turnover_rate,5),20))", "gates": "PASS", "head_commit": "be22710e9483cb7074b0286e64c8e8b58951ab75", "is_ic": 0.0379, "is_ic_ir": 0.454, "is_monotonicity": 0.5, "is_sharpe": 3.641, "is_turnover": 0.162, "market": "cn", "merge_base": "be22710e9483cb7074b0286e64c8e8b58951ab75", "name": "anti_autocorr_weekly_turnover_corridor_20", "oos": "PASS", "session_branch": "main", "session_id": "20260429_060001_1474fc", "status": "checks_failed", "ts": "2026-04-29T06:56:06.160302+08:00"}
{"base_ref": "origin/main", "decision": "candidate", "eval_seconds": 132.0, "formula": "rank(-ts_corr(ret_1d,shift(ret_1d,1),20))*rank(ts_mean(ts_sum(turnover_rate,5),20)/ts_max(ts_sum(turnover_rate,5),20))", "gates": "PASS", "head_commit": "be22710e9483cb7074b0286e64c8e8b58951ab75", "is_ic": 0.0372, "is_ic_ir": 0.479, "is_monotonicity": 0.5, "is_sharpe": 3.253, "is_turnover": 0.17, "market": "cn", "merge_base": "be22710e9483cb7074b0286e64c8e8b58951ab75", "name": "anti_autocorr_weekly_turnover_evenness_20", "session_branch": "main", "session_id": "20260429_060001_1474fc", "status": "candidate", "ts": "2026-04-29T06:56:06.160302+08:00"}
{"base_ref": "origin/main", "decision": "candidate", "eval_seconds": 179.7, "formula": "rank(-ts_corr(ret_1d,shift(ret_1d,1),20))*rank(-ts_mean(abs(delta(turnover_rate,5)),20))", "gates": "PASS", "head_commit": "be22710e9483cb7074b0286e64c8e8b58951ab75", "is_ic": 0.0342, "is_ic_ir": 0.281, "is_monotonicity": 0.0, "is_sharpe": 1.061, "is_turnover": 0.136, "market": "cn", "merge_base": "be22710e9483cb7074b0286e64c8e8b58951ab75", "name": "anti_autocorr_weekly_turnover_smooth_20", "session_branch": "main", "session_id": "20260429_060001_1474fc", "status": "candidate", "ts": "2026-04-29T06:56:06.160302+08:00"}
{"base_ref": "origin/main", "decision": "revert", "eval_seconds": 91.3, "formula": "rank(-ts_corr(amount,abs(ret_5d),20))", "gates": "FAIL", "head_commit": "be22710e9483cb7074b0286e64c8e8b58951ab75", "is_ic": 0.0018, "is_ic_ir": 0.021, "is_monotonicity": 0.1, "is_sharpe": -1.796, "is_turnover": 0.153, "market": "cn", "merge_base": "be22710e9483cb7074b0286e64c8e8b58951ab75", "name": "quiet_amount_absorption_20", "session_branch": "main", "session_id": "20260429_060001_1474fc", "status": "reverted", "ts": "2026-04-29T06:56:06.160302+08:00"}
{"base_ref": "origin/main", "decision": "revert", "eval_seconds": 67.5, "formula": "rank(ret_20d)*rank(-ts_mean(volume_ratio,5))", "gates": "FAIL", "head_commit": "be22710e9483cb7074b0286e64c8e8b58951ab75", "is_ic": 0.0145, "is_ic_ir": 0.104, "is_monotonicity": 0.35, "is_sharpe": -1.465, "is_turnover": 0.211, "market": "cn", "merge_base": "be22710e9483cb7074b0286e64c8e8b58951ab75", "name": "quiet_momentum_20_5", "session_branch": "main", "session_id": "20260429_060001_1474fc", "status": "reverted", "ts": "2026-04-29T06:56:06.160302+08:00"}
{"base_ref": "origin/main", "decision": "candidate", "eval_seconds": 22.6, "formula": "rank(-ts_std(turnover_rate, 20) / ts_mean(turnover_rate, 20))", "gates": "PASS", "head_commit": "be22710e9483cb7074b0286e64c8e8b58951ab75", "is_ic": 0.0374, "is_ic_ir": 0.373, "is_monotonicity": 0.7, "is_sharpe": 1.522, "is_turnover": 0.121, "market": "cn", "merge_base": "be22710e9483cb7074b0286e64c8e8b58951ab75", "name": "turnover_stability_20", "session_branch": "main", "session_id": "20260429_060001_1474fc", "status": "candidate", "ts": "2026-04-29T06:56:06.160302+08:00"}
{"base_ref": "origin/main", "decision": "candidate", "eval_seconds": 135.9, "formula": "rank(ts_min(ts_sum(amount/circ_market_cap,5),20)/ts_max(ts_sum(amount/circ_market_cap,5),20))", "gates": "PASS", "head_commit": "be22710e9483cb7074b0286e64c8e8b58951ab75", "is_ic": 0.0278, "is_ic_ir": 0.271, "is_monotonicity": 0.75, "is_sharpe": 0.139, "is_turnover": 0.106, "market": "cn", "merge_base": "be22710e9483cb7074b0286e64c8e8b58951ab75", "name": "weekly_float_corridor_20", "session_branch": "main", "session_id": "20260429_060001_1474fc", "status": "candidate", "ts": "2026-04-29T06:56:06.160302+08:00"}
{"base_ref": "origin/main", "decision": "revert", "eval_seconds": 182.8, "formula": "rank(-ts_corr(delta(turnover_rate,5),shift(delta(turnover_rate,5),5),20))", "gates": "FAIL", "head_commit": "be22710e9483cb7074b0286e64c8e8b58951ab75", "is_ic": -0.0048, "is_ic_ir": -0.051, "is_monotonicity": -0.45, "is_sharpe": -4.784, "is_turnover": 0.195, "market": "cn", "merge_base": "be22710e9483cb7074b0286e64c8e8b58951ab75", "name": "weekly_turnover_anti_autocorr_20", "session_branch": "main", "session_id": "20260429_060001_1474fc", "status": "reverted", "ts": "2026-04-29T06:56:06.160302+08:00"}
{"base_ref": "origin/main", "decision": "revert", "eval_seconds": 211.3, "formula": "rank(-ts_corr(turnover_rate,shift(turnover_rate,5),20)/(ts_std(pct_change(turnover_rate,5),20)+0.01))", "gates": "FAIL", "head_commit": "be22710e9483cb7074b0286e64c8e8b58951ab75", "is_ic": -0.0143, "is_ic_ir": -0.154, "is_monotonicity": -0.35, "is_sharpe": -4.646, "is_turnover": 0.173, "market": "cn", "merge_base": "be22710e9483cb7074b0286e64c8e8b58951ab75", "name": "weekly_turnover_growth_smooth_20", "session_branch": "main", "session_id": "20260429_060001_1474fc", "status": "reverted", "ts": "2026-04-29T06:56:06.160302+08:00"}
{"base_ref": "origin/main", "checks_status": "failed", "decision": "revert", "eval_seconds": 141.7, "formula": "rank(-ts_corr(ret_1d,shift(ret_1d,1),20))*rank(ts_mean(ts_sum(amount/circ_market_cap,5),20)/ts_max(ts_sum(amount/circ_market_cap,5),20))", "gates": "PASS", "head_commit": "4ede705179d231f6a5351285121c32d4cfeae900", "is_ic": 0.0372, "is_ic_ir": 0.479, "is_monotonicity": 0.45, "is_sharpe": 3.218, "is_turnover": 0.171, "market": "cn", "merge_base": "4ede705179d231f6a5351285121c32d4cfeae900", "name": "anti_autocorr20_weekly_float_evenness", "oos": "PASS", "session_branch": "main", "session_id": "20260429_140002_505112", "status": "checks_failed", "ts": "2026-04-29T14:57:49.276047+08:00"}
{"base_ref": "origin/main", "decision": "candidate", "eval_seconds": 204.7, "formula": "rank(-ts_corr(ret_1d, shift(ret_1d, 1), 20)) * rank(ts_mean(amount / circ_market_cap, 20) / ts_max(amount / circ_market_cap, 20))", "gates": "PASS", "head_commit": "4ede705179d231f6a5351285121c32d4cfeae900", "is_ic": 0.0336, "is_ic_ir": 0.46, "is_monotonicity": 0.25, "is_sharpe": 2.602, "is_turnover": 0.174, "market": "cn", "merge_base": "4ede705179d231f6a5351285121c32d4cfeae900", "name": "anti_autocorr_floatflow_evenness_20", "session_branch": "main", "session_id": "20260429_140002_505112", "status": "candidate", "ts": "2026-04-29T14:57:49.276047+08:00"}
{"base_ref": "origin/main", "decision": "revert", "eval_seconds": 169.0, "formula": "rank(-ts_corr(ret_1d,shift(ret_1d,1),20))*rank(ts_std(ts_sum(amount,5),60)/ts_std(ts_sum(amount,5),20))", "gates": "FAIL", "head_commit": "4ede705179d231f6a5351285121c32d4cfeae900", "is_ic": 0.0314, "is_ic_ir": 0.198, "is_monotonicity": 0.75, "is_sharpe": 1.211, "is_turnover": 0.151, "market": "cn", "merge_base": "4ede705179d231f6a5351285121c32d4cfeae900", "name": "anti_autocorr_weekly_amount_compress_20_60", "session_branch": "main", "session_id": "20260429_140002_505112", "status": "reverted", "ts": "2026-04-29T14:57:49.276047+08:00"}
{"base_ref": "origin/main", "decision": "revert", "eval_seconds": 159.4, "formula": "rank(-ts_corr(amount,shift(amount,5),20))*rank(ts_min(ts_sum(amount,5),20)/ts_max(ts_sum(amount,5),20))", "gates": "FAIL", "head_commit": "4ede705179d231f6a5351285121c32d4cfeae900", "is_ic": 0.0085, "is_ic_ir": 0.064, "is_monotonicity": 0.15, "is_sharpe": -1.595, "is_turnover": 0.153, "market": "cn", "merge_base": "4ede705179d231f6a5351285121c32d4cfeae900", "name": "anti_autocorr_weekly_amount_corridor_20", "session_branch": "main", "session_id": "20260429_140002_505112", "status": "reverted", "ts": "2026-04-29T14:57:49.276047+08:00"}
{"base_ref": "origin/main", "decision": "revert", "eval_seconds": 126.4, "formula": "rank(-ts_corr(amount, shift(amount, 5), 20)) * rank(ts_min(amount, 20) / ts_max(amount, 20))", "gates": "FAIL", "head_commit": "4ede705179d231f6a5351285121c32d4cfeae900", "is_ic": 0.0132, "is_ic_ir": 0.118, "is_monotonicity": 0.45, "is_sharpe": -1.647, "is_turnover": 0.158, "market": "cn", "merge_base": "4ede705179d231f6a5351285121c32d4cfeae900", "name": "anti_autocorr_weekly_amount_corridor_20", "session_branch": "main", "session_id": "20260429_140002_505112", "status": "reverted", "ts": "2026-04-29T14:57:49.276047+08:00"}
{"base_ref": "origin/main", "decision": "candidate", "eval_seconds": 174.2, "formula": "rank(-ts_corr(ret_1d,shift(ret_1d,1),20))*rank(ts_mean(ts_sum(amount,5),20)/ts_max(ts_sum(amount,5),20))", "gates": "PASS", "head_commit": "4ede705179d231f6a5351285121c32d4cfeae900", "is_ic": 0.0367, "is_ic_ir": 0.473, "is_monotonicity": 0.35, "is_sharpe": 3.934, "is_turnover": 0.167, "market": "cn", "merge_base": "4ede705179d231f6a5351285121c32d4cfeae900", "name": "anti_autocorr_weekly_amount_evenness_20", "session_branch": "main", "session_id": "20260429_140002_505112", "status": "candidate", "ts": "2026-04-29T14:57:49.276047+08:00"}
{"base_ref": "origin/main", "decision": "revert", "eval_seconds": 149.7, "formula": "rank(-ts_corr(ret_1d,shift(ret_1d,5),20))*rank(ts_min(amount,20)/ts_mean(amount,20))", "gates": "FAIL", "head_commit": "4ede705179d231f6a5351285121c32d4cfeae900", "is_ic": 0.0164, "is_ic_ir": 0.125, "is_monotonicity": 0.3, "is_sharpe": -4.692, "is_turnover": 0.179, "market": "cn", "merge_base": "4ede705179d231f6a5351285121c32d4cfeae900", "name": "anti_autocorr_weekly_amount_floor_20", "session_branch": "main", "session_id": "20260429_140002_505112", "status": "reverted", "ts": "2026-04-29T14:57:49.276047+08:00"}
{"base_ref": "origin/main", "decision": "revert", "eval_seconds": 128.1, "formula": "rank(-ts_corr(ts_sum(amount/circ_market_cap,5),shift(ts_sum(amount/circ_market_cap,5),5),20))*rank(ts_min(ts_sum(amount/circ_market_cap,5),20)/ts_max(ts_sum(amount/circ_market_cap,5),20))", "gates": "FAIL", "head_commit": "4ede705179d231f6a5351285121c32d4cfeae900", "is_ic": 0.0047, "is_ic_ir": 0.024, "is_monotonicity": 0.3, "is_sharpe": -1.703, "is_turnover": 0.124, "market": "cn", "merge_base": "4ede705179d231f6a5351285121c32d4cfeae900", "name": "anti_autocorr_weekly_float_corridor_20", "session_branch": "main", "session_id": "20260429_140002_505112", "status": "reverted", "ts": "2026-04-29T14:57:49.276047+08:00"}
{"base_ref": "origin/main", "decision": "candidate", "eval_seconds": 110.3, "formula": "rank(ts_min(ts_sum(amount/circ_market_cap,5),20)/ts_max(ts_sum(amount/circ_market_cap,5),20))*rank(-ts_corr(ret_1d,shift(ret_1d,1),40))", "gates": "PASS", "head_commit": "4ede705179d231f6a5351285121c32d4cfeae900", "is_ic": 0.0272, "is_ic_ir": 0.276, "is_monotonicity": 0.55, "is_sharpe": 1.712, "is_turnover": 0.125, "market": "cn", "merge_base": "4ede705179d231f6a5351285121c32d4cfeae900", "name": "anti_autocorr_weekly_floatflow_corridor_20", "session_branch": "main", "session_id": "20260429_140002_505112", "status": "candidate", "ts": "2026-04-29T14:57:49.276047+08:00"}
{"base_ref": "origin/main", "decision": "candidate", "eval_seconds": 106.2, "formula": "rank(-ts_corr(ret_1d,shift(ret_1d,1),20))*rank(ts_min(ts_sum(amount/circ_market_cap,5),20)/ts_mean(ts_sum(amount/circ_market_cap,5),20))", "gates": "PASS", "head_commit": "4ede705179d231f6a5351285121c32d4cfeae900", "is_ic": 0.036, "is_ic_ir": 0.398, "is_monotonicity": 0.6, "is_sharpe": 3.528, "is_turnover": 0.166, "market": "cn", "merge_base": "4ede705179d231f6a5351285121c32d4cfeae900", "name": "anti_autocorr_weekly_floatflow_floor_20", "session_branch": "main", "session_id": "20260429_140002_505112", "status": "candidate", "ts": "2026-04-29T14:57:49.276047+08:00"}
{"base_ref": "origin/main", "decision": "candidate", "eval_seconds": 166.4, "formula": "rank(-ts_corr(ret_1d,shift(ret_1d,1),20))*rank(-ts_std(ts_sum(amount/circ_market_cap,5),20)/ts_mean(ts_sum(amount/circ_market_cap,5),20))", "gates": "PASS", "head_commit": "4ede705179d231f6a5351285121c32d4cfeae900", "is_ic": 0.0361, "is_ic_ir": 0.448, "is_monotonicity": 0.45, "is_sharpe": 3.214, "is_turnover": 0.151, "market": "cn", "merge_base": "4ede705179d231f6a5351285121c32d4cfeae900", "name": "anti_autocorr_weekly_floatflow_stability_20", "session_branch": "main", "session_id": "20260429_140002_505112", "status": "candidate", "ts": "2026-04-29T14:57:49.276047+08:00"}
{"base_ref": "origin/main", "decision": "revert", "eval_seconds": 221.3, "formula": "rank(-ts_corr(volume_ratio,shift(volume_ratio,5),20))*rank(ts_mean(amount,20)/ts_max(amount,20))", "gates": "FAIL", "head_commit": "4ede705179d231f6a5351285121c32d4cfeae900", "is_ic": 0.0193, "is_ic_ir": 0.195, "is_monotonicity": 0.65, "is_sharpe": -1.069, "is_turnover": 0.178, "market": "cn", "merge_base": "4ede705179d231f6a5351285121c32d4cfeae900", "name": "anti_autocorr_weekly_relvol_amount_evenness_20", "session_branch": "main", "session_id": "20260429_140002_505112", "status": "reverted", "ts": "2026-04-29T14:57:49.276047+08:00"}
{"base_ref": "origin/main", "decision": "revert", "eval_seconds": 123.9, "formula": "rank(ts_min(ts_mean(volume_ratio,5),20)/ts_max(ts_mean(volume_ratio,5),20))*rank(-ts_corr(ts_mean(volume_ratio,5),shift(ts_mean(volume_ratio,5),5),20))", "gates": "FAIL", "head_commit": "4ede705179d231f6a5351285121c32d4cfeae900", "is_ic": 0.0151, "is_ic_ir": 0.15, "is_monotonicity": 0.2, "is_sharpe": -2.061, "is_turnover": 0.126, "market": "cn", "merge_base": "4ede705179d231f6a5351285121c32d4cfeae900", "name": "anti_autocorr_weekly_relvol_corridor_20", "session_branch": "main", "session_id": "20260429_140002_505112", "status": "reverted", "ts": "2026-04-29T14:57:49.276047+08:00"}
{"base_ref": "origin/main", "checks_status": "failed", "decision": "revert", "eval_seconds": 91.1, "formula": "rank(-ts_corr(ret_1d,shift(ret_1d,1),20))*rank(ts_min(ts_sum(volume_ratio,5),20)/ts_mean(ts_sum(volume_ratio,5),20))", "gates": "PASS", "head_commit": "4ede705179d231f6a5351285121c32d4cfeae900", "is_ic": 0.0371, "is_ic_ir": 0.434, "is_monotonicity": 0.35, "is_sharpe": 3.783, "is_turnover": 0.162, "market": "cn", "merge_base": "4ede705179d231f6a5351285121c32d4cfeae900", "name": "anti_autocorr_weekly_relvol_floor_20", "oos": "PASS", "session_branch": "main", "session_id": "20260429_140002_505112", "status": "checks_failed", "ts": "2026-04-29T14:57:49.276047+08:00"}
{"base_ref": "origin/main", "decision": "revert", "eval_seconds": 131.0, "formula": "rank(-ts_corr(delta(turnover_rate,5),shift(delta(turnover_rate,5),5),20))", "gates": "FAIL", "head_commit": "4ede705179d231f6a5351285121c32d4cfeae900", "is_ic": -0.0048, "is_ic_ir": -0.051, "is_monotonicity": -0.45, "is_sharpe": -4.784, "is_turnover": 0.195, "market": "cn", "merge_base": "4ede705179d231f6a5351285121c32d4cfeae900", "name": "anti_autocorr_weekly_turnover_20", "session_branch": "main", "session_id": "20260429_140002_505112", "status": "reverted", "ts": "2026-04-29T14:57:49.276047+08:00"}
{"base_ref": "origin/main", "checks_status": "failed", "decision": "revert", "eval_seconds": 82.1, "formula": "rank(-ts_corr(ret_1d,shift(ret_1d,1),20))*rank(ts_min(ts_sum(turnover_rate,5),20)/ts_max(ts_sum(turnover_rate,5),20))", "gates": "PASS", "head_commit": "4ede705179d231f6a5351285121c32d4cfeae900", "is_ic": 0.0379, "is_ic_ir": 0.454, "is_monotonicity": 0.5, "is_sharpe": 3.641, "is_turnover": 0.162, "market": "cn", "merge_base": "4ede705179d231f6a5351285121c32d4cfeae900", "name": "anti_autocorr_weekly_turnover_corridor_20", "oos": "PASS", "session_branch": "main", "session_id": "20260429_140002_505112", "status": "checks_failed", "ts": "2026-04-29T14:57:49.276047+08:00"}
