{"ts": "2026-05-15T06:55:04.788753+08:00", "session_id": "20260515_060002_96bdd9", "market": "cn", "formula": "rank(ret_20d-ret_5d)*rank(-ts_std(amount,20)/ts_mean(amount,20))", "name": "stable_amount_trend_digest_20", "is_ic": 0.0, "is_ic_ir": 0.0, "is_sharpe": 0.0, "is_turnover": 0.0, "is_monotonicity": 0.0, "gates": "FAIL", "status": "reverted", "eval_seconds": 73.3, "sleeve_id": "cn_ai_infra_pullback_resume", "mispricing_source": "A-share theme traders and fast rotation capital overreact to brief pullbacks, while orderly amount suggests the seller is being absorbed and the medium-horizon trend is underpriced.", "forced_counterparty": "short-horizon retail and theme-rotation funds cutting exposure on 3-5 day weakness", "data_requirements": "[\"daily amount/return data already available for IS test\",\"ai_infra source-review status for any production promotion\",\"beta-hedged sleeve PnL and residual risk attribution before money-ready use\"]", "failure_mode": "This stops working in panic/liquidation regimes or headline-driven limit-up/limit-down phases, where stable amount reflects illiquidity or trapped holders rather than accumulation.", "report_contract": "setup_overlay", "ai_supercycle_layer": "ai_chip_equipment_materials_packaging", "supply_chain_hypothesis": "Orderly pullbacks with stable amount should preferentially surface D2-D4 China semicap, packaging, and adjacent bottleneck suppliers as downstream AI capex demand keeps medium-term leadership intact.", "relationship_evidence_required": "true", "money_readiness": "research_only", "decision": "revert", "session_branch": "main", "base_ref": "origin/main", "merge_base": "0994185783159f479f554edf1e5a4e45d9f34cfe", "head_commit": "0994185783159f479f554edf1e5a4e45d9f34cfe"}
{"ts": "2026-05-15T06:55:04.788753+08:00", "session_id": "20260515_060002_96bdd9", "market": "cn", "formula": "rank(ts_min(amount/circ_market_cap,20)/ts_mean(amount/circ_market_cap,20))*rank(ts_mean((close-open)/(high-low+0.01),5))", "name": "float_floor_body_absorb_20", "is_ic": 0.0, "is_ic_ir": 0.0, "is_sharpe": 0.0, "is_turnover": 0.0, "is_monotonicity": 0.0, "gates": "FAIL", "status": "reverted", "eval_seconds": 136.2, "sleeve_id": "cn_ai_infra_flow_absorption", "mispricing_source": "Slow underreaction to steady sponsorship in scarce-float AI-infra leaders; the market overweights headline spikes and underweights persistent participation floors.", "forced_counterparty": "Retail momentum traders and benchmark-hugging domestic funds that must trade around liquidity, index weights, and short-term volatility.", "data_requirements": "[\"current daily data only for IS test: open, high, low, close, amount, circ_market_cap\", \"before promotion: beta-hedged sleeve attribution vs CSI benchmarks\", \"correlation check vs amount_stability_20 family\", \"ai_infra source-review status for any supplier/customer narrative\"]", "failure_mode": "Stops working in limit-up lottery tape or policy-shock phases where body location becomes noisy and turnover floors no longer distinguish informed accumulation from speculative crowding.", "report_contract": "setup_overlay", "ai_supercycle_layer": "ai_networking_optical_cpo", "supply_chain_hypothesis": "If AI datacenter optical/interconnect demand is tightening, CN optical/CPO bottleneck names should show persistent float-turnover floors and strong close-location before formal order evidence is fully recognized.", "relationship_evidence_required": "true", "money_readiness": "research_only", "decision": "revert", "session_branch": "main", "base_ref": "origin/main", "merge_base": "0994185783159f479f554edf1e5a4e45d9f34cfe", "head_commit": "0994185783159f479f554edf1e5a4e45d9f34cfe"}
{"ts": "2026-05-15T14:57:53.935894+08:00", "session_id": "20260515_140003_9fafac", "market": "cn", "formula": "rank(-ts_corr(ret_1d, shift(ret_1d, 1), 20)) * rank(-ts_mean(abs(pct_change(amount, 5)), 20))", "name": "anti_autocorr_amtflow_smooth_20", "is_ic": 0.0, "is_ic_ir": 0.0, "is_sharpe": 0.0, "is_turnover": 0.0, "is_monotonicity": 0.0, "gates": "FAIL", "status": "reverted", "eval_seconds": 114.8, "sleeve_id": "cn_ai_flow_absorption", "mispricing_source": "The market overweights noisy headline moves and underweights orderly medium-horizon cash absorption in scarce AI-infra leaders, so smooth amount-flow plus anti-persistent tape is mispriced.", "forced_counterparty": "Retail T+1 profit-takers, redemption-driven sellers, and benchmark-constrained domestic funds that cannot build full positions early in smaller bottleneck names.", "data_requirements": "[\"current IS test uses ret_1d and amount only\", \"before promotion: rolling corr vs kshadow_5 and amount/turnover stability family\", \"beta-hedged sleeve attribution vs 000300.SH and 399006.SZ\", \"residual risk and drawdown attribution\", \"source-reviewed AI-universe membership for any surfaced name\"]", "failure_mode": "This stops working when policy-gap or squeeze regimes reward bursty speculative turnover over steady accumulation, or when smooth amount-flow mostly reflects illiquidity instead of informed sponsorship.", "report_contract": "fresh_buy_gate", "ai_supercycle_layer": "ai_chip_equipment_materials_packaging", "supply_chain_hypothesis": "Domestic semicap, materials, packaging, and test bottleneck names tied to AI server and accelerator capex should show smooth weekly cash absorption before verified backlog or order evidence is fully reflected in price.", "relationship_evidence_required": "true", "money_readiness": "money_candidate", "decision": "revert", "session_branch": "main", "base_ref": "origin/main", "merge_base": "630e0dd16b5d38cb718e990195890edf7504d2e6", "head_commit": "630e0dd16b5d38cb718e990195890edf7504d2e6"}
{"ts": "2026-05-15T14:57:53.935894+08:00", "session_id": "20260515_140003_9fafac", "market": "cn", "formula": "rank(-ret_20d) * rank(ts_mean(turnover_rate,20) / (ts_std(turnover_rate,20) + 0.01))", "name": "pullback_turnover_stability_20", "is_ic": 0.0, "is_ic_ir": 0.0, "is_sharpe": 0.0, "is_turnover": 0.0, "is_monotonicity": 0.0, "gates": "FAIL", "status": "reverted", "eval_seconds": 92.2, "sleeve_id": "cn_ai_pullback_reaccumulation", "mispricing_source": "Short-horizon sellers and benchmark-insensitive retail flows exit after recent weakness, while informed capital accumulates without needing panic volume spikes; the market underprices the persistence of orderly reaccumulation.", "forced_counterparty": "Retail momentum traders and short-term liquidity takers reacting to recent 20-day underperformance", "data_requirements": "Current daily CN fields are sufficient for a first tape-only test; before promotion, require long-alpha vs beta-hedge attribution, sleeve drawdown, correlation to existing amount-stability sleeves, and source-review status from ai_infra universe metadata.", "failure_mode": "Breaks in panic/liquidation regimes where stable turnover during drawdowns is not accumulation but trapped illiquidity, or when policy/macro shocks dominate stock-specific reaccumulation.", "report_contract": "setup_overlay", "ai_supercycle_layer": "ai_chip_equipment_materials_packaging", "supply_chain_hypothesis": "Tape should surface orderly reaccumulation in domestic AI bottleneck suppliers after sector pullbacks, especially equipment/material names repriced by funding rotations rather than broken fundamentals.", "relationship_evidence_required": "true", "money_readiness": "research_only", "decision": "revert", "session_branch": "main", "base_ref": "origin/main", "merge_base": "630e0dd16b5d38cb718e990195890edf7504d2e6", "head_commit": "630e0dd16b5d38cb718e990195890edf7504d2e6"}
{"ts": "2026-05-15T14:57:53.935894+08:00", "session_id": "20260515_140003_9fafac", "market": "cn", "formula": "rank(ts_mean(amount / circ_market_cap,20) / ts_std(amount / circ_market_cap,20))", "name": "float_flow_stability_20", "is_ic": 0.0, "is_ic_ir": 0.0, "is_sharpe": 0.0, "is_turnover": 0.0, "is_monotonicity": 0.0, "gates": "FAIL", "status": "reverted", "eval_seconds": 165.4, "sleeve_id": "cn_ai_flow_absorption", "mispricing_source": "Slow institutional accumulation in scarce-float AI-infra names is underreacted to because the tape looks quiet and lacks the obvious breakout that attracts crowding.", "forced_counterparty": "Retail theme chasers and benchmark-constrained managers who buy after visible strength, while earlier steady absorption is left underpriced.", "data_requirements": "[\"current backtest uses available daily data only\", \"production use needs ai_infra source-review status per ticker\", \"benchmark hedge series for 000300.SH/399006.SZ attribution\", \"sleeve correlation and residual risk attribution\"]", "failure_mode": "Fails in retail melt-up regimes where high-turnover spike names keep outperforming and quiet accumulation stops being rewarded.", "report_contract": "action_overlay", "ai_supercycle_layer": "none", "supply_chain_hypothesis": "Within the validated CN AI-infra universe, steady float absorption should surface D1-D3 bottleneck names before backlog/capex/order evidence is fully reflected in price.", "relationship_evidence_required": "true", "money_readiness": "research_only", "decision": "revert", "session_branch": "main", "base_ref": "origin/main", "merge_base": "630e0dd16b5d38cb718e990195890edf7504d2e6", "head_commit": "630e0dd16b5d38cb718e990195890edf7504d2e6"}
{"ts": "2026-05-15T14:57:53.935894+08:00", "session_id": "20260515_140003_9fafac", "market": "cn", "formula": "rank(-ts_corr(ret_5d,amount/ts_mean(amount,20),20))", "name": "ret5_relamount_diverge_20", "is_ic": 0.0, "is_ic_ir": 0.0, "is_sharpe": 0.0, "is_turnover": 0.0, "is_monotonicity": 0.0, "gates": "FAIL", "status": "reverted", "eval_seconds": 183.7, "sleeve_id": "cn_ai_accumulation_divergence", "mispricing_source": "The payoff comes from underreaction to orderly sponsorship and overpricing of high-attention volume spikes; this is a price-flow decoupling sleeve, not a high-correlation clone of an existing candle-price factor.", "forced_counterparty": "Retail T+1 theme chasers, redemption-driven sellers, and benchmark-constrained long-only funds trading for liquidity rather than 10-20 day residual alpha.", "data_requirements": "[\"Current DSL data is sufficient for IS testing\",\"beta-hedged sleeve attribution vs 000300.SH and 399006.SZ before promotion\",\"rolling corr vs kshadow_5 and amount_stability_20\",\"residual risk, drawdown, and concentration attribution\"]", "failure_mode": "It fails in rumor/policy squeeze regimes where abnormal amount truly carries new information, or when low normalized amount just reflects illiquidity and no real sponsorship.", "report_contract": "fresh_buy_gate", "ai_supercycle_layer": "ai_chip_equipment_materials_packaging", "supply_chain_hypothesis": "Validated CN semicap, materials, packaging, and testing bottleneck names should be able to hold 5-day strength without abnormal cash-turnover bursts while institutions accumulate ahead of source-reviewed order, backlog, or capex evidence.", "relationship_evidence_required": "true", "money_readiness": "money_candidate", "decision": "revert", "session_branch": "main", "base_ref": "origin/main", "merge_base": "630e0dd16b5d38cb718e990195890edf7504d2e6", "head_commit": "630e0dd16b5d38cb718e990195890edf7504d2e6"}
{"ts": "2026-05-15T14:57:53.935894+08:00", "session_id": "20260515_140003_9fafac", "market": "cn", "formula": "rank(ret_20d) * rank(-ts_std(turnover_rate,20))", "name": "trend_turnover_stability_20", "is_ic": 0.0, "is_ic_ir": 0.0, "is_sharpe": 0.0, "is_turnover": 0.0, "is_monotonicity": 0.0, "gates": "FAIL", "status": "reverted", "eval_seconds": 26.1, "sleeve_id": "cn_ai_leadership_accumulation", "mispricing_source": "Benchmark-aware funds and thematic allocators build positions gradually in scarce AI-infra exposure, while the market underreacts to persistent low-churn accumulation because daily tape looks less exciting than high-turnover momentum bursts.", "forced_counterparty": "Short-horizon retail traders and fast profit-takers who sell into steady strength; benchmarked institutions that are slow to rebalance into emerging leaders", "data_requirements": "[\"Daily beta-hedged sleeve attribution vs 000300.SH/399006.SZ\", \"Correlation to existing amount_stability_20 sleeve\", \"Crowding and concentration diagnostics\", \"Source-review status from ai_infra universe before production promotion\"]", "failure_mode": "Stops working when market leadership broadens into indiscriminate thematic beta or when turnover spikes become the dominant signal during late-stage retail frenzy.", "report_contract": "setup_overlay", "ai_supercycle_layer": "ai_chip_equipment_materials_packaging", "supply_chain_hypothesis": "Tape should surface persistent accumulation in AI bottleneck suppliers before fully verified order/backlog evidence is broadly priced.", "relationship_evidence_required": "true", "money_readiness": "research_only", "decision": "revert", "session_branch": "main", "base_ref": "origin/main", "merge_base": "630e0dd16b5d38cb718e990195890edf7504d2e6", "head_commit": "630e0dd16b5d38cb718e990195890edf7504d2e6"}
{"ts": "2026-05-15T14:57:53.935894+08:00", "session_id": "20260515_140003_9fafac", "market": "cn", "formula": "rank(-ts_std(delta(amount / circ_market_cap, 5), 20))", "name": "weekly_floatflow_change_stability_20", "is_ic": 0.0, "is_ic_ir": 0.0, "is_sharpe": 0.0, "is_turnover": 0.0, "is_monotonicity": 0.0, "gates": "FAIL", "status": "reverted", "eval_seconds": 199.7, "sleeve_id": "cn_ai_flow_accumulation", "mispricing_source": "A-share investors overreact to visible one-day turnover bursts, while the market underreacts to steadier multi-week float-flow accumulation in bottleneck names.", "forced_counterparty": "short-horizon retail theme traders and legacy holders selling into steady demand", "data_requirements": "[\"daily amount\",\"circ_market_cap\",\"beta-hedged sleeve attribution vs 000300.SH and 399006.SZ\",\"rolling correlation vs kshadow_5 and amount_stability_20\",\"ai_infra source-review status before production promotion\"]", "failure_mode": "It stops working when policy/news shock regimes dominate and turnover is driven by indiscriminate one-day bursts instead of gradual accumulation.", "report_contract": "setup_overlay", "ai_supercycle_layer": "ai_chip_equipment_materials_packaging", "supply_chain_hypothesis": "orderly float-flow accumulation should surface semicap/materials/packaging and adjacent optical bottleneck vendors before backlog or customer evidence is fully confirmed", "relationship_evidence_required": "true", "money_readiness": "research_only", "decision": "revert", "session_branch": "main", "base_ref": "origin/main", "merge_base": "630e0dd16b5d38cb718e990195890edf7504d2e6", "head_commit": "630e0dd16b5d38cb718e990195890edf7504d2e6"}
{"ts": "2026-05-15T14:57:53.935894+08:00", "session_id": "20260515_140003_9fafac", "market": "cn", "formula": "rank(-(ts_max(turnover_rate,20)/ts_mean(turnover_rate,60)))", "name": "turnover_spike_compress_20_60", "is_ic": 0.0, "is_ic_ir": 0.0, "is_sharpe": 0.0, "is_turnover": 0.0, "is_monotonicity": 0.0, "gates": "FAIL", "status": "reverted", "eval_seconds": 161.1, "sleeve_id": "cn_ai_flow_digest", "mispricing_source": "A-share thematic traders overreact on the first catalyst burst, then underprice the follow-through once churn fades but institutional inventory remains.", "forced_counterparty": "Retail theme chasers and short-horizon funds that must de-gross after spike days because of T+1 liquidity needs and benchmark pressure.", "data_requirements": "[\"daily OHLCV\",\"turnover_rate\",\"benchmark hedge ledger vs 000300.SH/399006.SZ\",\"sleeve correlation to existing factors\",\"residual risk attribution for portfolio use\"]", "failure_mode": "It stops working when turnover compression means true loss of sponsorship in a broad risk-off tape, or when the regime rewards fresh breakout crowding instead of post-spike digestion.", "report_contract": "setup_overlay", "ai_supercycle_layer": "none", "supply_chain_hypothesis": "Verified D1-D3 AI bottleneck names can exhibit post-catalyst turnover-spike compression before a second repricing leg, but exact supply-chain links must be source-reviewed.", "relationship_evidence_required": "true", "money_readiness": "research_only", "decision": "revert", "session_branch": "main", "base_ref": "origin/main", "merge_base": "630e0dd16b5d38cb718e990195890edf7504d2e6", "head_commit": "630e0dd16b5d38cb718e990195890edf7504d2e6"}
{"ts": "2026-05-15T14:57:53.935894+08:00", "session_id": "20260515_140003_9fafac", "market": "cn", "formula": "rank(ret_20d / (ts_mean(turnover_rate,5) + 0.01))", "name": "trend_float_absorption_20_5", "is_ic": 0.0, "is_ic_ir": 0.0, "is_sharpe": 0.0, "is_turnover": 0.0, "is_monotonicity": 0.0, "gates": "FAIL", "status": "reverted", "eval_seconds": 141.1, "sleeve_id": "cn_ai_infra_ownership_tightening", "mispricing_source": "A-share AI-infra leaders often get repriced in stages; benchmarked capital and slower discretionary funds add after the initial move, while the tape already shows float absorption through lower recent turnover. The payoff comes from underreaction to tighter ownership, not from raw momentum alone.", "forced_counterparty": "short-horizon retail traders taking quick profits after theme bursts, plus benchmark-aware institutions that are slow to resize into mid-cap bottleneck exposure", "data_requirements": "[\"daily close\",\"daily turnover_rate\",\"current ai_infra CN universe membership\",\"beta-hedged sleeve attribution vs 000300.SH and 399006.SZ\"]; no extra non-daily dataset is required for the first IS test", "failure_mode": "It should break in rumor-driven squeeze regimes where high-churn names dominate, or when low turnover reflects illiquidity/attention decay rather than genuine accumulation.", "report_contract": "fresh_buy_gate", "ai_supercycle_layer": "ai_chip_equipment_materials_packaging", "supply_chain_hypothesis": "Validated domestic AI-capacity bottleneck names in equipment/materials/packaging should show medium-term leadership with lower recent float churn before broader narrative confirmation fully catches up.", "relationship_evidence_required": "false", "money_readiness": "money_candidate", "decision": "revert", "session_branch": "main", "base_ref": "origin/main", "merge_base": "630e0dd16b5d38cb718e990195890edf7504d2e6", "head_commit": "630e0dd16b5d38cb718e990195890edf7504d2e6"}
{"ts": "2026-05-15T14:57:53.935894+08:00", "session_id": "20260515_140003_9fafac", "market": "cn", "formula": "rank(-ts_max(amount/circ_market_cap,20)/ts_mean(amount/circ_market_cap,20))", "name": "float_spike_absorption_20", "is_ic": 0.0, "is_ic_ir": 0.0, "is_sharpe": 0.0, "is_turnover": 0.0, "is_monotonicity": 0.0, "gates": "FAIL", "status": "reverted", "eval_seconds": 145.5, "sleeve_id": "cn_aiinfra_quiet_accumulation", "mispricing_source": "The market overpays for obvious AI-theme volume spikes and underreacts to steady float-adjusted participation that signals real inventory absorption rather than retail churn.", "forced_counterparty": "Short-horizon retail chasers and benchmark-aware funds that wait for headline confirmation or breakout tape, plus passive liquidity sellers during quiet accumulation.", "data_requirements": "[\"daily amount\",\"circ_market_cap\",\"ai_infra universe membership/status\",\"factor correlation vs kshadow_5 and existing amount/turnover stability sleeves\",\"beta-hedged sleeve attribution\"]", "failure_mode": "It should fail in policy/headline-driven burst regimes where one-day speculative spikes lead returns, or in broad liquidity stress when all float-normalized activity collapses together and the signal becomes marketwide rather than stock-specific.", "report_contract": "setup_overlay", "ai_supercycle_layer": "ai_networking_optical_cpo", "supply_chain_hypothesis": "Candidate optical interconnect/CPO bottleneck names may show quiet float-normalized participation before source-reviewed customer/order evidence is fully recognized by the tape.", "relationship_evidence_required": "true", "money_readiness": "research_only", "decision": "revert", "session_branch": "main", "base_ref": "origin/main", "merge_base": "630e0dd16b5d38cb718e990195890edf7504d2e6", "head_commit": "630e0dd16b5d38cb718e990195890edf7504d2e6"}
