{"ts": "2026-05-18T06:56:45.563809+08:00", "session_id": "20260518_060002_cd0c45", "market": "cn", "formula": "rank(ts_mean(amount,20)/(ts_std(amount,20)+0.01)-ret_5d)", "name": "stable_amount_pullback_v2", "is_ic": 0.0, "is_ic_ir": 0.0, "is_sharpe": 0.0, "is_turnover": 0.0, "is_monotonicity": 0.0, "gates": "FAIL", "status": "reverted", "eval_seconds": 20.4, "sleeve_id": "cn_ai_infra_absorption", "mispricing_source": "Short-horizon profit taking discounts names where institutional sponsorship is still visible in stable traded amount, so price mean-reverts upward as the pullback digests.", "forced_counterparty": "retail traders and short-horizon momentum accounts reducing risk after recent weakness", "data_requirements": "[\"daily amount history\",\"forward 10d/20d return attribution\",\"beta-hedged sleeve PnL\",\"correlation vs existing amount_stability_20 and kshadow_5\"]", "failure_mode": "Stops working when pullbacks reflect true fundamental de-rating or when market regime shifts to indiscriminate liquidity unwind where stable amount is distribution rather than absorption.", "report_contract": "setup_overlay", "ai_supercycle_layer": "ai_chip_equipment_materials_packaging", "supply_chain_hypothesis": "Tape should surface accumulation in AI-infra bottleneck suppliers during temporary pullbacks, especially equipment/material/packaging names repriced by capex-cycle expectations.", "relationship_evidence_required": "true", "money_readiness": "research_only", "decision": "revert", "session_branch": "main", "base_ref": "origin/main", "merge_base": "76df81759b87ae939b7f4b094587247ae237c342", "head_commit": "76df81759b87ae939b7f4b094587247ae237c342"}
{"ts": "2026-05-18T06:56:45.563809+08:00", "session_id": "20260518_060002_cd0c45", "market": "cn", "formula": "rank(ts_mean(log(amount),20) - ts_std(log(amount),20))", "name": "log_amount_stability_20", "is_ic": 0.0, "is_ic_ir": 0.0, "is_sharpe": 0.0, "is_turnover": 0.0, "is_monotonicity": 0.0, "gates": "FAIL", "status": "reverted", "eval_seconds": 102.6, "sleeve_id": "cn_ai_infra_accumulation", "mispricing_source": "Underreaction to steady institutional accumulation in tight-float AI-infra names; the market overpays attention to noisy breakout tape and underweights orderly participation persistence.", "forced_counterparty": "Retail swing traders taking quick profits and benchmark-constrained managers who cannot add exposure as quickly as informed accumulators.", "data_requirements": "[\"daily amount for backtest\",\"validated ai_infra CN universe membership\",\"benchmark beta-hedge return series\",\"rolling sleeve correlation/residual risk attribution\",\"quarterly backlog/capex/gross-margin filings before production promotion\"]", "failure_mode": "Fails in retail blowoff or policy-beta melt-up regimes where noisy high-turnover speculation dominates and orderly accumulation stops being the scarce signal.", "report_contract": "fresh_buy_gate", "ai_supercycle_layer": "ai_chip_equipment_materials_packaging", "supply_chain_hypothesis": "Domestic AI chip equipment/materials/packaging bottlenecks should exhibit smooth amount accumulation ahead of explicit order/backlog confirmation in filings.", "relationship_evidence_required": "true", "money_readiness": "money_candidate", "decision": "revert", "session_branch": "main", "base_ref": "origin/main", "merge_base": "76df81759b87ae939b7f4b094587247ae237c342", "head_commit": "76df81759b87ae939b7f4b094587247ae237c342"}
{"ts": "2026-05-18T06:56:45.563809+08:00", "session_id": "20260518_060002_cd0c45", "market": "cn", "formula": "rank(ts_mean(turnover_rate,20)/(ts_std(delta(turnover_rate,5),20)+0.01))", "name": "weekly_turnover_drift_stability_20", "is_ic": 0.0, "is_ic_ir": 0.0, "is_sharpe": 0.0, "is_turnover": 0.0, "is_monotonicity": 0.0, "gates": "FAIL", "status": "reverted", "eval_seconds": 211.3, "sleeve_id": "cn_ai_infra_flow_quality", "mispricing_source": "Patient accumulation in float-constrained AI-infra names is underreacted to; the market overweights noisy turnover spikes and underweights orderly flow persistence.", "forced_counterparty": "retail theme chasers and benchmarked funds constrained by liquidity and position limits", "data_requirements": "[\"daily price and turnover_rate are sufficient for IS test\", \"before promotion require AI-universe source-review tags, beta-hedged sleeve PnL, residual risk attribution, and correlation vs existing sleeves\"]", "failure_mode": "This stops working in policy-beta or liquidity-mania regimes when violent turnover expansion, not orderly absorption, drives the next leg of returns.", "report_contract": "research_only", "ai_supercycle_layer": "none", "supply_chain_hypothesis": "Cross-layer AI-infra bottleneck names with real supercycle exposure should show orderly float-turnover absorption before consensus fully prices the demand path; no specific supplier/customer claim is inferred from tape alone.", "relationship_evidence_required": "true", "money_readiness": "research_only", "decision": "revert", "session_branch": "main", "base_ref": "origin/main", "merge_base": "76df81759b87ae939b7f4b094587247ae237c342", "head_commit": "76df81759b87ae939b7f4b094587247ae237c342"}
{"ts": "2026-05-18T14:56:05.857628+08:00", "session_id": "20260518_140003_036b53", "market": "cn", "formula": "rank(market_cap/circ_market_cap)*rank(ts_min(turnover_rate,20)/ts_mean(turnover_rate,20))", "name": "tight_float_turnover_floor_20", "is_ic": 0.0, "is_ic_ir": 0.0, "is_sharpe": 0.0, "is_turnover": 0.0, "is_monotonicity": 0.0, "gates": "FAIL", "status": "reverted", "eval_seconds": 216.5, "sleeve_id": "daily_flow_absorption", "mispricing_source": "A-share retail and benchmark-constrained funds overreact to bursty thematic tape and underreact to scarce-float names being accumulated gradually; this is supply-scarcity plus participation-floor alpha, not a high-correlation variant of a price-only shadow factor.", "forced_counterparty": "retail theme chasers, benchmark/rebalance-constrained long-only funds, and liquidity-motivated sellers", "data_requirements": "[\"current CN daily_basic fields are sufficient for prototype: market_cap, circ_market_cap, turnover_rate\", \"beta-hedged attribution vs 000300.SH and 399006.SZ\", \"rolling corr vs promoted CN sleeves including kshadow_5\", \"ai_infra universe/source-review status before any name-specific supply-chain narrative\"]", "failure_mode": "Fails in policy-beta melt-up or forced liquidation regimes where turnover floors reflect crowding, trapped liquidity, or exits rather than informed accumulation; also weakens if free-float scarcity is just an illiquidity proxy.", "report_contract": "setup_overlay", "ai_supercycle_layer": "ai_chip_equipment_materials_packaging", "supply_chain_hypothesis": "Within the validated CN AI universe, D1-D3 bottleneck equipment/materials/packaging names with tighter float and persistent turnover floors may be getting accumulated ahead of explicit order, backlog, or capex confirmation.", "relationship_evidence_required": "true", "money_readiness": "research_only", "decision": "revert", "session_branch": "main", "base_ref": "origin/main", "merge_base": "89f7b3a20c7d57ca0056b8bff0a3403328f00c52", "head_commit": "89f7b3a20c7d57ca0056b8bff0a3403328f00c52"}
{"ts": "2026-05-18T14:56:05.857628+08:00", "session_id": "20260518_140003_036b53", "market": "cn", "formula": "rank(ts_mean(amount,20)/ts_std(amount,20))*rank(ret_20d-ret_5d)", "name": "stable_amount_leader_pullback_20", "is_ic": 0.0, "is_ic_ir": 0.0, "is_sharpe": 0.0, "is_turnover": 0.0, "is_monotonicity": 0.0, "gates": "FAIL", "status": "reverted", "eval_seconds": 72.8, "sleeve_id": "cn_ai_infra_leadership_pullback", "mispricing_source": "Short-horizon retail and T+1 profit-takers sell shallow pullbacks, while benchmarked institutions accumulate AI bottleneck names gradually and cannot complete sizing in one session.", "forced_counterparty": "retail momentum chasers and short-horizon profit-takers", "data_requirements": "[\"daily amount and returns (available)\", \"benchmark beta/residual attribution vs 000300.SH and 399006.SZ\", \"sleeve correlation ledger vs promoted factors\", \"source-review evidence before any supplier/customer interpretation\"]", "failure_mode": "Fails when the regime flips to broad mean reversion, or when stable amount reflects distribution from trapped holders rather than institutional absorption.", "report_contract": "fresh_buy_gate", "ai_supercycle_layer": "ai_chip_equipment_materials_packaging", "supply_chain_hypothesis": "Domestic semiconductor equipment/materials/packaging bottleneck candidates should show stable capital absorption and buy-the-dip leadership before downstream AI capex confirmation is fully priced.", "relationship_evidence_required": "true", "money_readiness": "money_candidate", "decision": "revert", "session_branch": "main", "base_ref": "origin/main", "merge_base": "89f7b3a20c7d57ca0056b8bff0a3403328f00c52", "head_commit": "89f7b3a20c7d57ca0056b8bff0a3403328f00c52"}
{"ts": "2026-05-18T14:56:05.857628+08:00", "session_id": "20260518_140003_036b53", "market": "cn", "formula": "rank(-ts_corr(ret_1d,shift(ret_1d,1),20))*rank(-(ts_max(turnover_rate,20)/ts_mean(turnover_rate,20)))", "name": "anti_autocorr_turnover_spike_quiet_20", "is_ic": 0.0, "is_ic_ir": 0.0, "is_sharpe": 0.0, "is_turnover": 0.0, "is_monotonicity": 0.0, "gates": "FAIL", "status": "reverted", "eval_seconds": 98.8, "sleeve_id": "cn_ai_flow_absorption", "mispricing_source": "A-share retail and fast money overreact to short-term tape, while benchmarked institutions accumulate AI bottleneck names gradually to avoid impact; low spike turnover distinguishes absorption from narrative squeeze and should be less correlated than a pure price trend factor.", "forced_counterparty": "retail momentum chasers and liquidity-constrained managers de-risking on weak prints", "data_requirements": "[current daily price+daily_basic data is sufficient for IS test, but promotion needs beta-hedged sleeve attribution, rolling IC decay, sleeve drawdown, and corr vs existing amount/turnover stability factors]", "failure_mode": "Stops working when the market regime rewards high-turnover narrative breakouts and penalizes calm sponsorship, or when turnover spikes become informed rather than speculative.", "report_contract": "setup_overlay", "ai_supercycle_layer": "ai_networking_optical_cpo", "supply_chain_hypothesis": "May surface optical/interconnect bottleneck names being accumulated ahead of datacenter build-cycle confirmation, but the exact supplier/customer linkage is not verified by this tape-only signal.", "relationship_evidence_required": "true", "money_readiness": "research_only", "decision": "revert", "session_branch": "main", "base_ref": "origin/main", "merge_base": "89f7b3a20c7d57ca0056b8bff0a3403328f00c52", "head_commit": "89f7b3a20c7d57ca0056b8bff0a3403328f00c52"}
{"ts": "2026-05-18T14:56:05.857628+08:00", "session_id": "20260518_140003_036b53", "market": "cn", "formula": "rank(ts_min(amount / circ_market_cap,20) / ts_mean(amount / circ_market_cap,20))", "name": "float_amount_floor_20", "is_ic": 0.0, "is_ic_ir": 0.0, "is_sharpe": 0.0, "is_turnover": 0.0, "is_monotonicity": 0.0, "gates": "FAIL", "status": "reverted", "eval_seconds": 186.1, "sleeve_id": "cn_ai_float_accumulation", "mispricing_source": "The market overweights visible turnover spikes and underweights quiet but persistent float-adjusted demand; this is a participation-floor signal, not a price-momentum clone.", "forced_counterparty": "Theme-chasing retail and short-horizon rotation accounts that sell into quiet days or only trade spikes; passive benchmark flows are mechanical rather than valuation-sensitive.", "data_requirements": "[\"current daily amount and circ_market_cap are sufficient for IS testing\",\"before promotion require long-minus-benchmark sleeve PnL, residual risk attribution, and correlation vs promoted sleeves\",\"any supplier/customer upgrade still needs filings, official PRs, transcripts, or verified news\"]", "failure_mode": "It should fail when policy/news shock days dominate the cross-section, or when broad speculative AI rallies keep even weak names on elevated floor turnover so base-demand no longer differentiates leaders.", "report_contract": "setup_overlay", "ai_supercycle_layer": "none", "supply_chain_hypothesis": "Persistent float-adjusted value-turnover floors may surface quietly accumulated CN AI-infra bottleneck names before order/news confirmation, but the exact upstream or downstream linkage is not asserted by this factor.", "relationship_evidence_required": "true", "money_readiness": "research_only", "decision": "revert", "session_branch": "main", "base_ref": "origin/main", "merge_base": "89f7b3a20c7d57ca0056b8bff0a3403328f00c52", "head_commit": "89f7b3a20c7d57ca0056b8bff0a3403328f00c52"}
{"ts": "2026-05-18T14:56:05.857628+08:00", "session_id": "20260518_140003_036b53", "market": "cn", "formula": "rank(ts_min(ts_sum(volume,5),20)/ts_std(ts_sum(volume,5),20))", "name": "weekly_volume_floorstd_20", "is_ic": 0.0, "is_ic_ir": 0.0, "is_sharpe": 0.0, "is_turnover": 0.0, "is_monotonicity": 0.0, "gates": "FAIL", "status": "reverted", "eval_seconds": 257.1, "sleeve_id": "weekly_participation_floor", "mispricing_source": "Slow diffusion of ownership-transfer information; this pays on stable weekly participation support, not on raw price momentum, simple reversal, or another close-shadow variant.", "forced_counterparty": "Retail theme chasers, benchmark/rebalance sellers, and liquidity-constrained long-only funds", "data_requirements": "[\"daily volume for prototype IS test\",\"beta-hedged sleeve attribution vs 000300.SH and 399006.SZ\",\"residual risk and correlation vs existing sleeves\",\"intraday order-flow or member-trade ledger before money-ready deployment\",\"primary-source filings/PRs/transcripts before attaching any supplier/customer claim\"]", "failure_mode": "It fails when a high weekly volume floor reflects crowding or distribution rather than sponsorship, or when the regime rewards fresh breakout volume spikes instead of quiet re-accumulation.", "report_contract": "setup_overlay", "ai_supercycle_layer": "ai_networking_optical_cpo", "supply_chain_hypothesis": "Validated CN optical/interconnect/CPO bottleneck names should maintain a persistent weekly participation floor as AI datacenter bandwidth capex diffuses into domestic suppliers before backlog or order evidence is fully reflected in filings.", "relationship_evidence_required": "true", "money_readiness": "research_only", "decision": "revert", "session_branch": "main", "base_ref": "origin/main", "merge_base": "89f7b3a20c7d57ca0056b8bff0a3403328f00c52", "head_commit": "89f7b3a20c7d57ca0056b8bff0a3403328f00c52"}
{"ts": "2026-05-18T14:56:05.857628+08:00", "session_id": "20260518_140003_036b53", "market": "cn", "formula": "rank(-ts_std(delta(amount/circ_market_cap,5),20))*rank(-ts_corr(ret_1d,shift(ret_1d,1),20))", "name": "weekly_floatchg_underreact_20", "is_ic": 0.0, "is_ic_ir": 0.0, "is_sharpe": 0.0, "is_turnover": 0.0, "is_monotonicity": 0.0, "gates": "FAIL", "status": "reverted", "eval_seconds": 177.1, "sleeve_id": "cn_ai_infra_flow_underreaction", "mispricing_source": "Slow institutional accumulation is masked by retail inventory recycling and benchmark-aware rebalancing, so the tape looks noisy even as sponsorship improves.", "forced_counterparty": "T+1 retail traders, short-horizon momentum chasers, and benchmark-constrained PMs trimming into strength", "data_requirements": "[\"daily OHLCV\",\"amount\",\"circ_market_cap\",\"benchmark beta/residual attribution vs 000300.SH and 399006.SZ\",\"corr check vs existing CN sleeves\",\"filings/news only if later claiming a specific supplier/customer link\"]", "failure_mode": "It stops working in one-way policy or news trend regimes where anti-autocorr disappears, or when flow becomes a speculative burst instead of clipped accumulation.", "report_contract": "research_only", "ai_supercycle_layer": "ai_networking_optical_cpo", "supply_chain_hypothesis": "Optical/CPO/fiber bottleneck names should show steady float-normalized weekly flow and choppy daily closes while long-only capital accumulates ahead of verified hyperscaler or datacenter capex confirmation.", "relationship_evidence_required": "true", "money_readiness": "research_only", "decision": "revert", "session_branch": "main", "base_ref": "origin/main", "merge_base": "89f7b3a20c7d57ca0056b8bff0a3403328f00c52", "head_commit": "89f7b3a20c7d57ca0056b8bff0a3403328f00c52"}
{"ts": "2026-05-18T14:56:05.857628+08:00", "session_id": "20260518_140003_036b53", "market": "cn", "formula": "rank(ts_min(turnover_rate,20)/ts_max(turnover_rate,20))*rank(-ts_corr(ret_1d,shift(ret_1d,1),20))", "name": "anti_autocorr_turnover_corridor_20", "is_ic": 0.0, "is_ic_ir": 0.0, "is_sharpe": 0.0, "is_turnover": 0.0, "is_monotonicity": 0.0, "gates": "FAIL", "status": "reverted", "eval_seconds": 190.9, "sleeve_id": "cn_ai_infra_flow_quality", "mispricing_source": "Day-to-day overreaction from theme-chasing and de-risking creates temporary price noise, while steady ownership in genuine AI-infra beneficiaries is revealed by a tight turnover corridor.", "forced_counterparty": "retail hot-money traders and benchmark-aware funds reacting to short-term theme swings", "data_requirements": "[\"daily OHLCV\",\"amount\",\"turnover_rate\",\"AI universe metadata for layer/depth attribution\",\"benchmark hedge ledger vs 000300.SH and 399006.SZ for residual alpha validation\"]", "failure_mode": "Fails in pure momentum or policy-gap regimes where turnover spikes are rewarded and absorbed reversals stop mean-reverting.", "report_contract": "setup_overlay", "ai_supercycle_layer": "ai_datacenter_edge_infra", "supply_chain_hypothesis": "CN datacenter buildout beneficiaries should show tight turnover corridors and absorbed reversals before official capex/order evidence is fully reflected in price.", "relationship_evidence_required": "true", "money_readiness": "research_only", "decision": "revert", "session_branch": "main", "base_ref": "origin/main", "merge_base": "89f7b3a20c7d57ca0056b8bff0a3403328f00c52", "head_commit": "89f7b3a20c7d57ca0056b8bff0a3403328f00c52"}
{"ts": "2026-05-18T14:56:05.857628+08:00", "session_id": "20260518_140003_036b53", "market": "cn", "formula": "rank(ts_min(turnover_rate,20)*ts_mean(turnover_rate,20)/ts_max(turnover_rate,20))", "name": "turnover_corridor_floor_20", "is_ic": 0.0, "is_ic_ir": 0.0, "is_sharpe": 0.0, "is_turnover": 0.0, "is_monotonicity": 0.0, "gates": "FAIL", "status": "reverted", "eval_seconds": 170.0, "sleeve_id": "cn_ai_infra_accumulation", "mispricing_source": "A-share participants overpay for obvious turnover spikes and underweight quiet, persistent absorption; this is a participation-corridor signal, not an upper-shadow or raw momentum clone.", "forced_counterparty": "Retail theme chasers, T+1 profit-takers, and benchmarked funds supplying liquidity during quiet consolidation", "data_requirements": "[\"daily turnover_rate (available)\", \"beta-hedged sleeve attribution vs 000300.SH and 399006.SZ\", \"rolling correlation vs promoted factors\", \"intraday/member-flow ledger before money-ready promotion\", \"ai_infra universe source-review status for any narrative attachment\"]", "failure_mode": "It should fail in rumor-squeeze or policy-shock regimes where unstable spike participation leads returns, or when low turnover dispersion reflects illiquidity/neglect instead of accumulation.", "report_contract": "setup_overlay", "ai_supercycle_layer": "ai_chip_equipment_materials_packaging", "supply_chain_hypothesis": "Validated domestic semicap/materials/packaging bottleneck names should show an orderly turnover corridor before backlog, capex, or customer evidence becomes obvious in filings and broader sell-side coverage.", "relationship_evidence_required": "true", "money_readiness": "research_only", "decision": "revert", "session_branch": "main", "base_ref": "origin/main", "merge_base": "89f7b3a20c7d57ca0056b8bff0a3403328f00c52", "head_commit": "89f7b3a20c7d57ca0056b8bff0a3403328f00c52"}
{"ts": "2026-05-18T14:56:05.857628+08:00", "session_id": "20260518_140003_036b53", "market": "cn", "formula": "rank(ret_20d) * rank(-ts_std(turnover_rate,20))", "name": "quiet_leadership_20", "is_ic": 0.0, "is_ic_ir": 0.0, "is_sharpe": 0.0, "is_turnover": 0.0, "is_monotonicity": 0.0, "gates": "FAIL", "status": "reverted", "eval_seconds": 147.4, "sleeve_id": "cn_ai_infra_quiet_leadership", "mispricing_source": "A-share news and source review usually lag real-money accumulation; quiet trending names are under-owned because there is no fresh headline, while capital keeps rotating out of them too early.", "forced_counterparty": "Short-horizon retail/hot-money traders recycling capital and benchmark-constrained domestic long-only funds that only add after trend and liquidity become obvious.", "data_requirements": "[\"daily turnover_rate\",\"daily ret_20d\",\"AI-infra canonical universe membership\",\"benchmark returns for beta-hedge attribution\",\"correlation panel vs kshadow_5 and amount_stability_20\"]", "failure_mode": "It should stop working in sharp mean-reversion or policy-headline burst regimes where high-churn catch-up names dominate and quiet leadership no longer signals informed accumulation.", "report_contract": "fresh_buy_gate", "ai_supercycle_layer": "ai_networking_optical_cpo", "supply_chain_hypothesis": "Quiet-flow leaders may be optical/interconnect bottlenecks inside the verified AI-infra universe, with accumulation preceding formal order or customer-source confirmation.", "relationship_evidence_required": "true", "money_readiness": "money_candidate", "decision": "revert", "session_branch": "main", "base_ref": "origin/main", "merge_base": "89f7b3a20c7d57ca0056b8bff0a3403328f00c52", "head_commit": "89f7b3a20c7d57ca0056b8bff0a3403328f00c52"}
