{"ts": "2026-05-29T08:08:43.492922+08:00", "session_id": "20260529_071202_4a3250", "market": "cn", "formula": "rank(-ts_std(amount,20)/(ts_mean(amount,20)+1))*rank(-ts_skew(amount,20))", "name": "quiet_amount_absorption_20", "is_ic": -0.0043, "is_ic_ir": -0.031, "is_sharpe": -3.295, "is_turnover": 0.167, "is_monotonicity": -0.75, "gates": "FAIL", "status": "reverted", "eval_seconds": 168.5, "sleeve_id": "cn_ai_flow_absorption", "mispricing_source": "Slow institutional re-rating of AI-infra bottlenecks shows up first in orderly cash trading, while headline-driven traders overpay for bursty days and underweight steady accumulation.", "forced_counterparty": "Retail theme chasers and benchmark-constrained managers who trade liquidity bursts or rebalance away from quiet names.", "data_requirements": "[\"daily amount and price are sufficient for IS test\",\"before promotion: beta-hedged sleeve PnL vs 000300.SH/399006.SZ, residual risk attribution, sleeve correlation to promoted factors, ai_infra source-review status\"]", "failure_mode": "It stops working when the regime is dominated by breakout chasing, policy headline spikes, or broad AI-theme deleveraging that overwhelms steady-flow accumulation.", "report_contract": "setup_overlay", "ai_supercycle_layer": "ai_chip_equipment_materials_packaging", "supply_chain_hypothesis": "Orderly amount absorption should preferentially surface domestic semicap/materials/packaging bottlenecks being accumulated ahead of explicit order, backlog, or capex confirmation; exact supplier/customer edges remain unverified.", "relationship_evidence_required": "true", "money_readiness": "research_only", "decision": "revert", "session_branch": "main", "base_ref": "origin/main", "merge_base": "c94ca064b4ac72dfdf1f906eaaf12dbbc0a6779a", "head_commit": "c94ca064b4ac72dfdf1f906eaaf12dbbc0a6779a"}
{"ts": "2026-05-29T08:08:43.492922+08:00", "session_id": "20260529_071202_4a3250", "market": "cn", "formula": "rank(-ts_corr(ret_5d, amount, 20))", "name": "ret5_amount_absorption_20", "is_ic": 0.0371, "is_ic_ir": 0.221, "is_sharpe": 0.035, "is_turnover": 0.152, "is_monotonicity": 0.8, "gates": "PASS", "status": "reverted", "eval_seconds": 168.5, "sleeve_id": "cn_ai_flow_absorption", "mispricing_source": "Short-horizon participants dump on 5-day weakness, but heavier trading during those drawdowns can reflect transfer from weak hands to patient capital; the cross-section underprices that absorption.", "forced_counterparty": "retail thematic traders, margin-constrained holders, and fast money reducing exposure after recent drawdowns", "data_requirements": "[\"daily ret_5d and amount\",\"AI-infra universe membership from ai_infra\",\"benchmark beta/residual risk attribution for deployment\",\"if later tied to a specific supplier/order thesis: filings/transcripts/official news for evidence\"]", "failure_mode": "It stops working when high amount on down moves reflects real distribution or broken fundamentals instead of absorption, especially in broad deleveraging or theme unwind regimes.", "report_contract": "action_overlay", "ai_supercycle_layer": "none", "supply_chain_hypothesis": "Orderly absorption after 5-day weakness should surface already-validated AI-infra bottleneck names across layers without asserting any new supplier/customer relationship.", "relationship_evidence_required": "false", "money_readiness": "research_only", "decision": "revert", "session_branch": "main", "base_ref": "origin/main", "merge_base": "c94ca064b4ac72dfdf1f906eaaf12dbbc0a6779a", "head_commit": "c94ca064b4ac72dfdf1f906eaaf12dbbc0a6779a", "oos": "FAIL", "checks_status": "skipped"}
{"ts": "2026-05-29T14:56:09.477144+08:00", "session_id": "20260529_140002_641f0b", "market": "cn", "formula": "rank(ts_corr(ret_1d, shift(ret_1d, 1), 20)) * rank(-ts_std(turnover_rate, 20) / (ts_std(turnover_rate, 120) + 0.01))", "name": "quiet_trend_turnover_regime_20_120", "is_ic": -0.0675, "is_ic_ir": -0.232, "is_sharpe": -5.781, "is_turnover": 0.183, "is_monotonicity": -0.6, "gates": "FAIL", "status": "reverted", "eval_seconds": 158.6, "sleeve_id": "cn_ai_tape_accumulation", "mispricing_source": "slow institutional accumulation and benchmark-constrained underreaction in AI bottleneck names, not a pure standalone price-momentum effect", "forced_counterparty": "retail theme chasers and benchmark-constrained active managers who cannot add full exposure immediately", "data_requirements": "[\"daily prices\",\"daily_basic.turnover_rate\",\"ai_infra BFS depth/layer metadata\",\"beta-hedged sleeve attribution vs 000300.SH and 399006.SZ\"]", "failure_mode": "fails in sharp mean-reversion regimes or policy/liquidity shocks where compressed turnover stops representing accumulation and just reflects inactivity", "report_contract": "setup_overlay", "ai_supercycle_layer": "ai_chip_equipment_materials_packaging", "supply_chain_hypothesis": "D1-D3 AI bottleneck suppliers in packaging/equipment should exhibit orderly trend persistence with compressed turnover before capex/order confirmation is fully visible in filings", "relationship_evidence_required": "true", "money_readiness": "research_only", "decision": "revert", "session_branch": "main", "base_ref": "origin/main", "merge_base": "c94ca064b4ac72dfdf1f906eaaf12dbbc0a6779a", "head_commit": "c94ca064b4ac72dfdf1f906eaaf12dbbc0a6779a"}
{"ts": "2026-05-29T14:56:09.477144+08:00", "session_id": "20260529_140002_641f0b", "market": "cn", "formula": "rank(ts_mean(amount/circ_market_cap,20)/ts_std(amount/circ_market_cap,20))", "name": "float_value_stability_20", "is_ic": -0.0422, "is_ic_ir": -0.16, "is_sharpe": -4.034, "is_turnover": 0.141, "is_monotonicity": -0.5, "gates": "FAIL", "status": "reverted", "eval_seconds": 166.8, "sleeve_id": "cn_aiinfra_flow_absorption", "mispricing_source": "Benchmarked real-money funds accumulate AI bottleneck exposure gradually under liquidity, T+1, and tracking-error constraints, while retail capital overpays for visible breakouts and underprices quiet absorption.", "forced_counterparty": "retail T+1 traders and liquidity-motivated sellers supplying stock into steady institutional accumulation", "data_requirements": "[\"current daily data is sufficient for IS test\",\"beta-hedged sleeve return series\",\"residual risk attribution\",\"sleeve correlation matrix vs promoted factors\"]", "failure_mode": "It stops working when AI-infra leadership becomes pure headline momentum or macro beta, so smooth flow no longer means informed accumulation and instead just reflects crowded defensiveness.", "report_contract": "setup_overlay", "ai_supercycle_layer": "ai_chip_equipment_materials_packaging", "supply_chain_hypothesis": "Domestic semicap/materials/packaging bottleneck names should show steady float-normalized value transfer before verified capex, order, or localization evidence is fully recognized.", "relationship_evidence_required": "true", "money_readiness": "research_only", "decision": "revert", "session_branch": "main", "base_ref": "origin/main", "merge_base": "c94ca064b4ac72dfdf1f906eaaf12dbbc0a6779a", "head_commit": "c94ca064b4ac72dfdf1f906eaaf12dbbc0a6779a"}
{"ts": "2026-05-29T14:56:09.477144+08:00", "session_id": "20260529_140002_641f0b", "market": "cn", "formula": "rank(ts_mean(amount,20)/ts_std(amount,20))*rank(-ts_std(turnover_rate,20))", "name": "steady_flow_low_churn_20", "is_ic": -0.053, "is_ic_ir": -0.182, "is_sharpe": -4.215, "is_turnover": 0.106, "is_monotonicity": -0.9, "gates": "FAIL", "status": "reverted", "eval_seconds": 61.4, "sleeve_id": "daily_flow_accumulation", "mispricing_source": "The market overprices bursty speculative turnover and underprices dull, persistent institutional absorption in scarce AI-infra capacity names.", "forced_counterparty": "Retail theme-rotators and benchmarked managers trimming or rotating inventory on short-horizon PnL pressure.", "data_requirements": "[\"daily amount\",\"daily turnover_rate\",\"beta-hedge attribution vs 000300.SH/399006.SZ\",\"cross-sleeve correlation matrix\",\"residual risk attribution\"]", "failure_mode": "It stops working when policy/news shocks dominate tape, or when high-turnover speculative bursts outperform steady accumulation regimes.", "report_contract": "setup_overlay", "ai_supercycle_layer": "ai_chip_equipment_materials_packaging", "supply_chain_hypothesis": "Domestic equipment, materials, and advanced-packaging bottleneck names tied to accelerator/memory localization should show steady large-amount absorption before fundamental confirmation is obvious.", "relationship_evidence_required": "true", "money_readiness": "research_only", "decision": "revert", "session_branch": "main", "base_ref": "origin/main", "merge_base": "c94ca064b4ac72dfdf1f906eaaf12dbbc0a6779a", "head_commit": "c94ca064b4ac72dfdf1f906eaaf12dbbc0a6779a"}
{"ts": "2026-05-29T14:56:09.477144+08:00", "session_id": "20260529_140002_641f0b", "market": "cn", "formula": "rank(ts_mean(amount/circ_market_cap,20)/ts_std(amount/circ_market_cap,20))*rank(-ts_corr(ret_1d,shift(ret_1d,1),20))", "name": "float_absorb_anti_autocorr_20", "is_ic": -0.0246, "is_ic_ir": -0.079, "is_sharpe": -2.878, "is_turnover": 0.18, "is_monotonicity": -0.25, "gates": "FAIL", "status": "reverted", "eval_seconds": 196.4, "sleeve_id": "daily_flow_overlay", "mispricing_source": "Underreaction to quiet sponsor accumulation in a retail-dominated market that prefers visible spikes over steady absorption.", "forced_counterparty": "Retail momentum chasers and benchmark/risk-budgeted holders rotating out of quiet names before the information is fully capitalized.", "data_requirements": "[\"daily OHLCV\", \"amount\", \"circ_market_cap\", \"AI universe membership + source-review status\", \"benchmark beta hedge and residual risk attribution\"]", "failure_mode": "Fails when the regime shifts to pure breakout chasing, so anti-autocorrelation stops signaling absorption and instead reflects genuine weakness, or when float flow is dominated by passive/basket rebalancing rather than stock-specific sponsorship.", "report_contract": "setup_overlay", "ai_supercycle_layer": "none", "supply_chain_hypothesis": "May surface CN AI-infra bottleneck names under steady accumulation before verified backlog/order evidence is public; no specific supplier/customer relationship is asserted by this factor alone.", "relationship_evidence_required": "true", "money_readiness": "research_only", "decision": "revert", "session_branch": "main", "base_ref": "origin/main", "merge_base": "c94ca064b4ac72dfdf1f906eaaf12dbbc0a6779a", "head_commit": "c94ca064b4ac72dfdf1f906eaaf12dbbc0a6779a"}
{"ts": "2026-05-29T14:56:09.477144+08:00", "session_id": "20260529_140002_641f0b", "market": "cn", "formula": "rank(ts_sum(amount/circ_market_cap,20)/ts_max(amount/circ_market_cap,20))", "name": "float_flow_uniformity_20", "is_ic": -0.0547, "is_ic_ir": -0.221, "is_sharpe": -4.207, "is_turnover": 0.156, "is_monotonicity": -0.4, "gates": "FAIL", "status": "reverted", "eval_seconds": 152.8, "sleeve_id": "cn_ai_flow_overlay", "mispricing_source": "The market overweights visible spike days and underweights quiet, repeated float absorption; this is a flow-uniformity sleeve, not a disguised price-momentum factor.", "forced_counterparty": "Retail theme chasers and short-horizon fast money who concentrate trading around catalysts, while liquidity-constrained institutions must accumulate gradually", "data_requirements": "[\"daily amount\",\"circ_market_cap\",\"canonical ai_infra universe membership\",\"factor correlation matrix vs promoted sleeves\",\"beta-hedged sleeve attribution\"]; supplier/customer claims still need filings or original-source confirmation", "failure_mode": "Stops working in headline-squeeze regimes where one-day crowding beats steady accumulation, or when unlocks/placements make float-based scaling noisy", "report_contract": "setup_overlay", "ai_supercycle_layer": "ai_datacenter_edge_infra", "supply_chain_hypothesis": "Persistent float-flow uniformity should surface CN datacenter, power, networking, and related buildout beneficiaries where institutions are positioning for AI capacity bottlenecks before hard evidence is fully reflected", "relationship_evidence_required": "true", "money_readiness": "research_only", "decision": "revert", "session_branch": "main", "base_ref": "origin/main", "merge_base": "c94ca064b4ac72dfdf1f906eaaf12dbbc0a6779a", "head_commit": "c94ca064b4ac72dfdf1f906eaaf12dbbc0a6779a"}
{"ts": "2026-05-29T14:56:09.477144+08:00", "session_id": "20260529_140002_641f0b", "market": "cn", "formula": "rank(ts_mean((close-open)/(high-low+0.01),20)*ts_mean(turnover_rate,20)/ts_max(turnover_rate,20))", "name": "orderly_body_nospike_20", "is_ic": -0.0285, "is_ic_ir": -0.096, "is_sharpe": -0.716, "is_turnover": 0.188, "is_monotonicity": 0.1, "gates": "FAIL", "status": "reverted", "eval_seconds": 223.3, "sleeve_id": "cn_ai_accumulation_overlay", "mispricing_source": "The market chases visible breakout volume, while steady accumulation with no turnover blowoff reprices more slowly and is easier for discretionary investors to ignore.", "forced_counterparty": "T+1 retail momentum chasers and benchmark-constrained mutual funds waiting for headline or order confirmation.", "data_requirements": "[\"current CN daily price + turnover_rate data\", \"AI universe membership and source-review status from ai_infra\", \"beta-hedged sleeve attribution and correlation check vs promoted factors before promotion\"]", "failure_mode": "It should fail in pure speculative melt-up regimes where turnover spikes keep working, or in sharp liquidity shocks where positive bodies become late-stage distribution rather than accumulation.", "report_contract": "setup_overlay", "ai_supercycle_layer": "ai_chip_equipment_materials_packaging", "supply_chain_hypothesis": "Verified D2-D3 domestic AI capex bottleneck names in equipment/materials/packaging should exhibit orderly positive closes without turnover spikes before backlog or order evidence is fully diffused into consensus.", "relationship_evidence_required": "true", "money_readiness": "research_only", "decision": "revert", "session_branch": "main", "base_ref": "origin/main", "merge_base": "c94ca064b4ac72dfdf1f906eaaf12dbbc0a6779a", "head_commit": "c94ca064b4ac72dfdf1f906eaaf12dbbc0a6779a"}
{"ts": "2026-05-29T14:56:09.477144+08:00", "session_id": "20260529_140002_641f0b", "market": "cn", "formula": "rank(ts_mean(amount/circ_market_cap,20)/ts_std(amount/circ_market_cap,20))*rank(-pct_change(close,10))", "name": "stable_float_pullback_10", "is_ic": -0.0335, "is_ic_ir": -0.128, "is_sharpe": -4.611, "is_turnover": 0.207, "is_monotonicity": -0.7, "gates": "FAIL", "status": "reverted", "eval_seconds": 164.6, "sleeve_id": "cn_ai_flow_pullback", "mispricing_source": "Short-horizon traders overreact to pullbacks, but stable float-normalized turnover signals persistent capital commitment; that makes this more than a plain reversal factor and should keep correlation below pure price sleeves.", "forced_counterparty": "retail momentum traders and benchmarked managers trimming on drawdown without updated supply-chain evidence", "data_requirements": "[\"current daily price/amount/circ_market_cap is sufficient for IS testing\", \"for promotion: ai_infra source-review status, sector breadth, beta-hedged sleeve attribution, and filings/backlog/capex/power-availability evidence for bottleneck interpretation\"]", "failure_mode": "It should fail when the market rewards unstable gap-up speculation and penalizes orderly pullback entries, or when broad liquidity stress forces institutions to sell their highest-quality AI-infra holdings.", "report_contract": "setup_overlay", "ai_supercycle_layer": "hard_assets_energy_heavy", "supply_chain_hypothesis": "Candidate CN power/grid/datacenter-heavy AI-infra beneficiaries should show stable float-normalized value traded while price digests over 10 days, consistent with institutional accumulation ahead of fully verified capex/order evidence.", "relationship_evidence_required": "true", "money_readiness": "research_only", "decision": "revert", "session_branch": "main", "base_ref": "origin/main", "merge_base": "c94ca064b4ac72dfdf1f906eaaf12dbbc0a6779a", "head_commit": "c94ca064b4ac72dfdf1f906eaaf12dbbc0a6779a"}
{"ts": "2026-05-29T14:56:09.477144+08:00", "session_id": "20260529_140002_641f0b", "market": "cn", "formula": "rank(-ts_skew(amount/circ_market_cap,20))", "name": "float_value_skew_20", "is_ic": -0.0601, "is_ic_ir": -0.26, "is_sharpe": -4.156, "is_turnover": 0.185, "is_monotonicity": -0.25, "gates": "FAIL", "status": "reverted", "eval_seconds": 118.3, "sleeve_id": "cn_ai_flow_quality", "mispricing_source": "Slow institutional accumulation is under-recognized because A-share attention is pulled toward visible spike days; steady absorption gets priced with a lag.", "forced_counterparty": "Retail theme chasers and benchmark-constrained mutual funds that react to turnover spikes and cannot fully build positions early without moving price.", "data_requirements": "[\"daily amount\",\"circ_market_cap\",\"CN benchmark returns for beta-hedged attribution\",\"existing sleeve correlation matrix\"]", "failure_mode": "It stops working when the tape becomes purely event-driven and one-day spike participation, not orderly absorption, is the dominant path to discovery.", "report_contract": "fresh_buy_gate", "ai_supercycle_layer": "ai_chip_equipment_materials_packaging", "supply_chain_hypothesis": "Domestic AI compute bottleneck names in packaging, testing, substrates, and equipment should show repeated float-adjusted value absorption before backlog and capex evidence is fully visible in filings.", "relationship_evidence_required": "true", "money_readiness": "money_candidate", "decision": "revert", "session_branch": "main", "base_ref": "origin/main", "merge_base": "c94ca064b4ac72dfdf1f906eaaf12dbbc0a6779a", "head_commit": "c94ca064b4ac72dfdf1f906eaaf12dbbc0a6779a"}
{"ts": "2026-05-29T14:56:09.477144+08:00", "session_id": "20260529_140002_641f0b", "market": "cn", "formula": "rank(-ts_corr(close,volume,20))*rank(ts_mean(turnover_rate,20)/ts_max(turnover_rate,20))", "name": "price_vol_turnover_evenness_20", "is_ic": -0.0383, "is_ic_ir": -0.145, "is_sharpe": -2.975, "is_turnover": 0.17, "is_monotonicity": -0.65, "gates": "FAIL", "status": "reverted", "eval_seconds": 158.8, "sleeve_id": "cn_ai_infra_accumulation", "mispricing_source": "Attention and mandate constraints push capital toward visible breakout days, so orderly accumulation in validated AI-infra names is underpriced; the turnover-evenness leg makes this distinct from a plain price factor.", "forced_counterparty": "Retail theme chasers and short-horizon liquidity providers who transact on spike days rather than warehouse quiet accumulation", "data_requirements": "[\"close\",\"volume\",\"turnover_rate\",\"AI universe membership from ai_infra\",\"beta/residual attribution vs 000300.SH and 399006.SZ before promotion\"]", "failure_mode": "This stops working in broad risk-on phases where single-day crowding and policy beta dominate, or when quiet tape reflects genuine demand exhaustion rather than accumulation.", "report_contract": "setup_overlay", "ai_supercycle_layer": "ai_chip_equipment_materials_packaging", "supply_chain_hypothesis": "Domestic AI chip equipment, materials, and advanced-packaging bottleneck names with verified D1-D3 dependency links should exhibit low-drama accumulation before order or capex confirmation becomes obvious in filings or earnings.", "relationship_evidence_required": "true", "money_readiness": "research_only", "decision": "revert", "session_branch": "main", "base_ref": "origin/main", "merge_base": "c94ca064b4ac72dfdf1f906eaaf12dbbc0a6779a", "head_commit": "c94ca064b4ac72dfdf1f906eaaf12dbbc0a6779a"}
{"ts": "2026-05-29T14:56:09.477144+08:00", "session_id": "20260529_140002_641f0b", "market": "cn", "formula": "rank(ts_mean(volume_ratio,20)/(ts_mean(abs(delta(volume_ratio,5)),20)+0.01))*rank(-ts_max(ret_1d,20))", "name": "low_lottery_weekly_relvol_smooth_20", "is_ic": 0.0391, "is_ic_ir": 0.22, "is_sharpe": -0.642, "is_turnover": 0.114, "is_monotonicity": 0.0, "gates": "PASS", "status": "reverted", "eval_seconds": 192.8, "sleeve_id": "cn_ai_infra_accumulation", "mispricing_source": "A-share attention and T+1 trading frictions reward bursty narrative chasing, so orderly accumulation in true bottleneck names is under-discounted by the cross-section.", "forced_counterparty": "benchmark-constrained long-only funds and short-horizon retail/theme traders who cannot or will not accumulate early except on obvious spike days", "data_requirements": "[\"daily OHLCV\", \"volume_ratio\", \"ai_infra CN universe membership/meta\", \"benchmark series for beta-hedged sleeve attribution\"]", "failure_mode": "It stops working when theme beta dominates stock selection and speculative limit-up bursts outperform orderly accumulation, or when volume_ratio becomes mechanically regime-shifted across the whole universe.", "report_contract": "setup_overlay", "ai_supercycle_layer": "ai_chip_equipment_materials_packaging", "supply_chain_hypothesis": "Domestic AI chip equipment/material/packaging bottleneck names should show persistent weekly participation with few lottery spikes before source-reviewed order/capex evidence becomes obvious to the market.", "relationship_evidence_required": "true", "money_readiness": "research_only", "decision": "revert", "session_branch": "main", "base_ref": "origin/main", "merge_base": "c94ca064b4ac72dfdf1f906eaaf12dbbc0a6779a", "head_commit": "c94ca064b4ac72dfdf1f906eaaf12dbbc0a6779a", "oos": "FAIL", "checks_status": "skipped"}
