{"ts": "2026-05-25T14:56:27.125102+08:00", "session_id": "20260525_140003_622c66", "market": "cn", "formula": "rank(-(ts_max(turnover_rate,20)/ts_sum(turnover_rate,20)))*rank(-pb)", "name": "cheap_even_turnover_20", "is_ic": -0.0081, "is_ic_ir": 0.0, "is_sharpe": -2.228, "is_turnover": 0.13, "is_monotonicity": -0.5, "gates": "FAIL", "status": "reverted", "eval_seconds": 145.5, "sleeve_id": "cn_flow_value_accumulation", "mispricing_source": "Retail theme trading overpays for single-spike attention, while steady low-multiple accumulators are ignored until orders, capex, or earnings confirm.", "forced_counterparty": "Short-horizon retail momentum traders and benchmark-aware funds that add liquidity on spike days but under-own quiet suppliers.", "data_requirements": "[\"daily CN features for IS test\",\"ai_infra universe membership and source-review status\",\"filings/transcripts/order-backlog/capex evidence before promotion\",\"beta-hedged sleeve attribution and correlation to existing sleeves\"]", "failure_mode": "Fails when one-day speculative spike leaders keep outperforming for weeks, or when low PB mostly identifies balance-sheet stress and value traps rather than under-owned AI-infra exposure.", "report_contract": "setup_overlay", "ai_supercycle_layer": "ai_chip_equipment_materials_packaging", "supply_chain_hypothesis": "Candidate domestic semicap, materials, and advanced-packaging bottleneck vendors may show distributed turnover before verified order or customer evidence is fully reflected in price.", "relationship_evidence_required": "true", "money_readiness": "research_only", "decision": "revert", "session_branch": "main", "base_ref": "origin/main", "merge_base": "c99187be1dc8d78a84147200981562efcde7b8d5", "head_commit": "c99187be1dc8d78a84147200981562efcde7b8d5"}
{"ts": "2026-05-25T14:56:27.125102+08:00", "session_id": "20260525_140003_622c66", "market": "cn", "formula": "rank(ts_mean(amount/circ_market_cap,40)/ts_std(amount/circ_market_cap,40))*rank(-clamp(ps_ttm,0.2,20))", "name": "float_flow_low_ps_40", "is_ic": 0.0052, "is_ic_ir": 0.022, "is_sharpe": -2.179, "is_turnover": 0.078, "is_monotonicity": -0.45, "gates": "FAIL", "status": "reverted", "eval_seconds": 256.0, "sleeve_id": "cn_ai_infra_value_flow", "mispricing_source": "Valuation plus steady float participation should surface real-capex beneficiaries without relying on recent price trend, so this is a value-accumulation sleeve rather than a high-correlation price-factor clone.", "forced_counterparty": "Retail concept chasers and benchmarked growth managers concentrated in liquid narrative leaders", "data_requirements": "[\"amount\",\"circ_market_cap\",\"ps_ttm\",\"current CN daily tape is sufficient for IS test\",\"filings/order/backlog evidence only if later attaching a named supplier claim\",\"beta-hedge attribution vs 000300.SH and 399006.SZ before promotion\"]", "failure_mode": "Fails when speculative momentum dominates valuation, or when low-PS names are cheap because demand is structurally impaired rather than temporarily under-recognized.", "report_contract": "setup_overlay", "ai_supercycle_layer": "hard_assets_energy_heavy", "supply_chain_hypothesis": "Steady float-flow in low-PS hard-asset AI-infra names may identify under-owned power, grid, cooling, and datacenter buildout capacity providers before utilization and AI order visibility are fully priced.", "relationship_evidence_required": "true", "money_readiness": "research_only", "decision": "revert", "session_branch": "main", "base_ref": "origin/main", "merge_base": "c99187be1dc8d78a84147200981562efcde7b8d5", "head_commit": "c99187be1dc8d78a84147200981562efcde7b8d5"}
{"ts": "2026-05-25T14:56:27.125102+08:00", "session_id": "20260525_140003_622c66", "market": "cn", "formula": "rank(ts_corr(turnover_rate, ret_5d, 20)) * rank(-clamp(pb, 1, 15))", "name": "cheap_flow_confirmation_20", "is_ic": -0.0007, "is_ic_ir": 0.008, "is_sharpe": -2.232, "is_turnover": 0.126, "is_monotonicity": -0.05, "gates": "FAIL", "status": "reverted", "eval_seconds": 142.0, "sleeve_id": "cn_ai_infra_value_flow", "mispricing_source": "Investors anchor on stale valuation and wait for tape confirmation before rerating AI-infra suppliers; positive return-turnover coupling marks early sponsorship that is not captured by pure price or pure value factors alone.", "forced_counterparty": "Underweight benchmarked mutual funds that must add only after confirmation, while retail traders and fast theme capital rotate into noisier downstream stories and leave quieter suppliers underowned.", "data_requirements": "[\"daily_basic pb and turnover_rate\", \"validated AI-universe membership/evidence card\", \"filings/transcripts/backlog-capex-margin data to separate real AI bottlenecks from cheap value traps\"]", "failure_mode": "This should fail when the market shifts into pure speculative beta where expensive story stocks lead regardless of valuation, or when low-PB names are cheap because of deteriorating fundamentals rather than delayed rerating.", "report_contract": "fresh_buy_gate", "ai_supercycle_layer": "none", "supply_chain_hypothesis": "none", "relationship_evidence_required": "false", "money_readiness": "money_candidate", "decision": "revert", "session_branch": "main", "base_ref": "origin/main", "merge_base": "c99187be1dc8d78a84147200981562efcde7b8d5", "head_commit": "c99187be1dc8d78a84147200981562efcde7b8d5"}
{"ts": "2026-05-25T14:56:27.125102+08:00", "session_id": "20260525_140003_622c66", "market": "cn", "formula": "rank(-pb) * rank(-(ts_std(amount,20)/ts_std(amount,60)))", "name": "cheap_amount_compress_20_60", "is_ic": 0.0037, "is_ic_ir": 0.021, "is_sharpe": -3.696, "is_turnover": 0.093, "is_monotonicity": -0.15, "gates": "FAIL", "status": "reverted", "eval_seconds": 237.8, "sleeve_id": "cn_ai_infra_value_flow", "mispricing_source": "A-share attention capital overpays for hot narrative spikes and underreacts when low-multiple AI-infra names transition from bursty turnover to steadier ownership.", "forced_counterparty": "retail theme chasers and benchmark-constrained managers tilted to high-multiple momentum leaders", "data_requirements": "[\"pb\",\"amount\",\"validated ai_infra CN universe membership\",\"beta-hedged sleeve attribution vs 000300.SH and 399006.SZ\",\"sleeve correlation and residual-risk attribution\"]", "failure_mode": "Fails when speculative high-turnover expansion is the rewarded regime, or when amount compression reflects dead liquidity/value traps rather than real absorption.", "report_contract": "setup_overlay", "ai_supercycle_layer": "hard_assets_energy_heavy", "supply_chain_hypothesis": "Validated CN datacenter/power/cooling/network buildout names should show quiet amount compression and low-PB rerating before backlog or order visibility is broadly recognized.", "relationship_evidence_required": "true", "money_readiness": "research_only", "decision": "revert", "session_branch": "main", "base_ref": "origin/main", "merge_base": "c99187be1dc8d78a84147200981562efcde7b8d5", "head_commit": "c99187be1dc8d78a84147200981562efcde7b8d5"}
{"ts": "2026-05-25T14:56:27.125102+08:00", "session_id": "20260525_140003_622c66", "market": "cn", "formula": "rank(ts_mean(turnover_rate,20)/ts_max(turnover_rate,20)) * rank(-pb)", "name": "cheap_distributed_turnover_20", "is_ic": -0.0081, "is_ic_ir": 0.0, "is_sharpe": -2.228, "is_turnover": 0.13, "is_monotonicity": -0.5, "gates": "FAIL", "status": "reverted", "eval_seconds": 213.7, "sleeve_id": "cn_flow_value_accumulation", "mispricing_source": "Slow institutional accumulation in under-owned AI-infra balance sheets is under-discounted because retail flow chases spike days and accounting/book-value anchors adjust more slowly than AI capex expectations.", "forced_counterparty": "Retail momentum traders and benchmarked managers who need breakout-style confirmation and avoid low-PB cyclical/infra names until earnings or policy headlines force re-entry.", "data_requirements": "[\"current daily data sufficient for IS test: turnover_rate,pb\",\"before promotion: beta-hedge return vs 000300.SH/399006.SZ, residual risk attribution, corr vs float_flow_low_pb_40 and turnover_stability_20, ai_infra evidence-status join\"]", "failure_mode": "It stops working if the regime rewards one-day speculative spikes over patient accumulation, or if low-PB AI-infra names become a crowded macro value trade and distributed turnover no longer signals hidden demand.", "report_contract": "fresh_buy_gate", "ai_supercycle_layer": "hard_assets_energy_heavy", "supply_chain_hypothesis": "Potentially surfaces grid, IDC shell/cooling, and other heavy-asset AI buildout beneficiaries where patient capital accumulates before backlog and capex linkage are explicit in filings.", "relationship_evidence_required": "true", "money_readiness": "money_candidate", "decision": "revert", "session_branch": "main", "base_ref": "origin/main", "merge_base": "c99187be1dc8d78a84147200981562efcde7b8d5", "head_commit": "c99187be1dc8d78a84147200981562efcde7b8d5"}
{"ts": "2026-05-25T14:56:27.125102+08:00", "session_id": "20260525_140003_622c66", "market": "cn", "formula": "rank(-pb)*rank(-ts_kurt(amount/circ_market_cap,40))", "name": "low_pb_low_burst_floatflow_40", "is_ic": 0.0195, "is_ic_ir": 0.101, "is_sharpe": -0.183, "is_turnover": 0.129, "is_monotonicity": 0.1, "gates": "FAIL", "status": "reverted", "eval_seconds": 112.5, "sleeve_id": "cn_ai_infra_quiet_accumulation", "mispricing_source": "Retail theme traders overpay for bursty attention spikes, while benchmarked long-only funds are slow to buy asset-heavy AI-infra names until evidence is obvious; that delay leaves quiet accumulation underpriced.", "forced_counterparty": "retail momentum chasers and benchmark-constrained mutual funds waiting for confirmed orders/backlog", "data_requirements": "[\"pb\",\"amount\",\"circ_market_cap\" daily history already available, \"benchmark beta/residual attribution vs 000300.SH/399006.SZ\", \"correlation vs promoted sleeves\", \"original-source filings/press releases/transcripts for any supplier or backlog claim\"]", "failure_mode": "If the market shifts into pure speculative squeeze leadership or policy/liquidity drives high-PB narrative names regardless of sponsorship quality, this quiet-value accumulation signal will lag.", "report_contract": "fresh_buy_gate", "ai_supercycle_layer": "hard_assets_energy_heavy", "supply_chain_hypothesis": "Capex-heavy domestic AI-infra bottlenecks should show quiet, non-bursty float turnover before source-confirmed订单/backlog rerates them.", "relationship_evidence_required": "true", "money_readiness": "money_candidate", "decision": "revert", "session_branch": "main", "base_ref": "origin/main", "merge_base": "c99187be1dc8d78a84147200981562efcde7b8d5", "head_commit": "c99187be1dc8d78a84147200981562efcde7b8d5"}
{"ts": "2026-05-25T14:56:27.125102+08:00", "session_id": "20260525_140003_622c66", "market": "cn", "formula": "rank(ret_20d - ret_5d) * rank(-ts_std(turnover_rate,20))", "name": "orderly_leader_pullback_20", "is_ic": -0.033, "is_ic_ir": -0.125, "is_sharpe": -2.979, "is_turnover": 0.188, "is_monotonicity": -0.35, "gates": "FAIL", "status": "reverted", "eval_seconds": 96.0, "sleeve_id": "ai_infra_cn_leadership_pullback", "mispricing_source": "The market over-discounts short-term cooling in prior leaders and underprices sticky institutional accumulation when turnover remains stable instead of euphoric.", "forced_counterparty": "Retail momentum traders and short-horizon funds that sell after the first pullback; benchmarked institutions that cannot complete positions in one rebalance window.", "data_requirements": "[\"daily OHLCV\", \"turnover_rate\", \"ai_infra universe membership\", \"benchmark beta-hedge attribution\", \"sleeve correlation/drawdown monitor\", \"original-source evidence cards before any supplier/customer claim is promoted\"]", "failure_mode": "This stops working in broad de-risking or policy-shock tape when stable turnover reflects absent demand rather than accumulation, or when the market flips into pure mean-reversion and punishes prior leaders.", "report_contract": "setup_overlay", "ai_supercycle_layer": "ai_chip_equipment_materials_packaging", "supply_chain_hypothesis": "Domestic AI hardware bottleneck suppliers that already showed 20-day leadership but are digesting gains on stable turnover are being accumulated ahead of the next capex and order-confirmation leg.", "relationship_evidence_required": "true", "money_readiness": "research_only", "decision": "revert", "session_branch": "main", "base_ref": "origin/main", "merge_base": "c99187be1dc8d78a84147200981562efcde7b8d5", "head_commit": "c99187be1dc8d78a84147200981562efcde7b8d5"}
{"ts": "2026-05-25T14:56:27.125102+08:00", "session_id": "20260525_140003_622c66", "market": "cn", "formula": "rank(-pb*ts_std(amount/circ_market_cap,40))", "name": "cheap_stable_floatflow_40", "is_ic": -0.0373, "is_ic_ir": -0.12, "is_sharpe": -4.439, "is_turnover": 0.036, "is_monotonicity": -0.45, "gates": "FAIL", "status": "reverted", "eval_seconds": 130.6, "sleeve_id": "cn_ai_infra_value_accumulation", "mispricing_source": "A-share capital overpays for visible breakout stories and underprices orderly accumulation in cheaper AI-infra suppliers; this is a valuation-plus-flow-stability sleeve, not a high-correlation price-momentum clone.", "forced_counterparty": "T+1 retail chasers and benchmark-hugging mutual funds crowded into liquid narrative leaders", "data_requirements": "[\"daily amount\",\"daily circ_market_cap\",\"daily pb\",\"benchmark beta/residual attribution\",\"filings/transcripts/backlog-capex-gross-margin checks for top-ranked names\"]", "failure_mode": "Fails when liquidity manias keep rewarding expensive high-beta leaders, or when low PB reflects genuine balance-sheet deterioration instead of delayed AI-capex recognition.", "report_contract": "setup_overlay", "ai_supercycle_layer": "ai_chip_equipment_materials_packaging", "supply_chain_hypothesis": "Quiet float-adjusted accumulation at low PB should surface domestic semiconductor equipment, materials, and advanced-packaging suppliers being pre-positioned for AI capex before revenue revisions catch up.", "relationship_evidence_required": "true", "money_readiness": "research_only", "decision": "revert", "session_branch": "main", "base_ref": "origin/main", "merge_base": "c99187be1dc8d78a84147200981562efcde7b8d5", "head_commit": "c99187be1dc8d78a84147200981562efcde7b8d5"}
{"ts": "2026-05-25T14:56:27.125102+08:00", "session_id": "20260525_140003_622c66", "market": "cn", "formula": "rank(-pb) * rank(-ts_std(pct_change(amount,5),20))", "name": "cheap_amount_growth_stability_20", "is_ic": 0.0185, "is_ic_ir": 0.1, "is_sharpe": -2.733, "is_turnover": 0.09, "is_monotonicity": 0.0, "gates": "FAIL", "status": "reverted", "eval_seconds": 175.4, "sleeve_id": "cn_ai_accumulation_value", "mispricing_source": "Valuation anchoring plus steady value-flow absorption; the market overpays for noisy AI themes and underprices slow-moving AI-infra capex beneficiaries.", "forced_counterparty": "Benchmark-aware PMs waiting for confirmed orders/earnings and retail momentum traders rotating toward higher-excitement names", "data_requirements": "[\"pb\",\"amount\",\"AI universe membership\",\"benchmark hedge series for 000300.SH/399006.SZ and sleeve correlation ledger before promotion\"]", "failure_mode": "Breaks in retail-mania or policy-squeeze regimes where bursty turnover leads, or when low PB is just distress rather than delayed AI capex exposure.", "report_contract": "action_overlay", "ai_supercycle_layer": "hard_assets_energy_heavy", "supply_chain_hypothesis": "Domestic power/grid, thermal-management, and datacenter physical-infra names tied to AI capacity buildout should show smooth amount accumulation before verified backlog/order disclosures.", "relationship_evidence_required": "true", "money_readiness": "research_only", "decision": "revert", "session_branch": "main", "base_ref": "origin/main", "merge_base": "c99187be1dc8d78a84147200981562efcde7b8d5", "head_commit": "c99187be1dc8d78a84147200981562efcde7b8d5"}
{"ts": "2026-05-25T14:56:27.125102+08:00", "session_id": "20260525_140003_622c66", "market": "cn", "formula": "rank(delta(amount / circ_market_cap, 20) / (abs(pb) + 0.1))", "name": "cheap_rising_floatflow_20", "is_ic": 0.0112, "is_ic_ir": 0.044, "is_sharpe": -2.554, "is_turnover": 0.445, "is_monotonicity": 0.55, "gates": "FAIL", "status": "reverted", "eval_seconds": 135.1, "sleeve_id": "cn_ai_hardasset_accumulation", "mispricing_source": "Slow diffusion of capex-cycle information and underreaction to steady float-flow improvement in low-PB AI-infra names.", "forced_counterparty": "Short-horizon retail traders and benchmarked growth/theme funds that rotate toward crowded high-multiple AI stories and under-own dull hard-asset beneficiaries.", "data_requirements": "[\"daily OHLCV + daily_basic for IS test\", \"ai_infra universe membership and source-review status\", \"filings/press releases/transcripts for capex, backlog, and order confirmation before production promotion\", \"beta-hedged sleeve attribution vs 000300.SH and 399006.SZ\"]", "failure_mode": "It stops working when low PB is mostly distress rather than hidden asset value, or when policy/speculative bursts dominate patient accumulation signals.", "report_contract": "setup_overlay", "ai_supercycle_layer": "hard_assets_energy_heavy", "supply_chain_hypothesis": "Candidate datacenter power, cooling, grid, cabinet, and other capex-heavy AI-infra suppliers are being accumulated ahead of visible order and utilization confirmation.", "relationship_evidence_required": "true", "money_readiness": "research_only", "decision": "revert", "session_branch": "main", "base_ref": "origin/main", "merge_base": "c99187be1dc8d78a84147200981562efcde7b8d5", "head_commit": "c99187be1dc8d78a84147200981562efcde7b8d5"}
{"ts": "2026-05-25T14:56:27.125102+08:00", "session_id": "20260525_140003_622c66", "market": "cn", "formula": "rank(ts_mean(amount,40)/(ts_std(amount,40)+1))*rank(-pb)", "name": "stable_amount_low_pb_40", "is_ic": 0.0309, "is_ic_ir": 0.158, "is_sharpe": -0.438, "is_turnover": 0.077, "is_monotonicity": -0.3, "gates": "FAIL", "status": "reverted", "eval_seconds": 101.1, "sleeve_id": "cn_ai_flow_value", "mispricing_source": "A-share attention clusters on noisy concept spikes, so steady-value AI infra leaders with persistent traded-value support remain underowned and rerate with a lag.", "forced_counterparty": "Retail theme-chasers and benchmark-aware holders rotating out of low-PB laggards before visible order confirmation", "data_requirements": "[\"daily amount\",\"pb\",\"benchmark-hedged sleeve return\",\"residual risk attribution\",\"top-name filings/backlog/capex/gross-margin checks\",\"source-review status from ai_infra\"]", "failure_mode": "This stops working when narrative squeeze regimes reward crowded high-beta breakouts over orderly accumulation, or when low PB is a genuine balance-sheet trap.", "report_contract": "action_overlay", "ai_supercycle_layer": "ai_chip_equipment_materials_packaging", "supply_chain_hypothesis": "May surface domestic-substitution chip equipment/material bottlenecks being accumulated ahead of verified AI capex or order evidence.", "relationship_evidence_required": "true", "money_readiness": "research_only", "decision": "revert", "session_branch": "main", "base_ref": "origin/main", "merge_base": "c99187be1dc8d78a84147200981562efcde7b8d5", "head_commit": "c99187be1dc8d78a84147200981562efcde7b8d5"}
{"ts": "2026-05-26T07:23:53.826949+08:00", "session_id": "20260526_062702_4e1ae2", "market": "cn", "formula": "rank(ts_corr(amount, shift(amount, 5), 20))*rank(-ts_max(ret_1d,20))", "name": "amt_persist_lowlottery_20", "is_ic": 0.038, "is_ic_ir": 0.222, "is_sharpe": -0.554, "is_turnover": 0.158, "is_monotonicity": -0.05, "gates": "PASS", "status": "reverted", "eval_seconds": 180.8, "sleeve_id": "ai_infra_accumulation_overlay", "mispricing_source": "Underreaction to steady institutional accumulation in scarce AI-infra names, combined with overpricing of lottery-like daily spikes.", "forced_counterparty": "T+1 retail theme chasers and benchmark-constrained mutual funds that must trade in clips rather than load full size early.", "data_requirements": "[\"current CN daily amount and ret_1d are sufficient for IS test\", \"before promotion: correlation vs promoted sleeves\", \"beta-hedged attribution vs 000300.SH and 399006.SZ\", \"source-reviewed AI-universe membership\"]", "failure_mode": "This stops working when policy-beta or limit-up speculation dominates steady accumulation, or when the AI capex cycle weakens and persistent flow no longer reflects informed demand.", "report_contract": "setup_overlay", "ai_supercycle_layer": "ai_chip_equipment_materials_packaging", "supply_chain_hypothesis": "Domestic AI bottleneck suppliers in equipment, materials, packaging, and testing get accumulated in recurring weekly clips before customer wins or backlog updates are fully reflected in tape consensus.", "relationship_evidence_required": "true", "money_readiness": "research_only", "decision": "revert", "session_branch": "main", "base_ref": "origin/main", "merge_base": "c99187be1dc8d78a84147200981562efcde7b8d5", "head_commit": "c99187be1dc8d78a84147200981562efcde7b8d5", "oos": "FAIL", "checks_status": "skipped"}
