{"ts": "2026-05-12T14:58:46.981474+08:00", "session_id": "20260512_140046_7f9cc0", "market": "cn", "formula": "rank(-ts_std(delta(log(amount/circ_market_cap),5),20))*rank(-ts_mean(high/low-1,20))", "name": "weekly_floatchg_lowlottery_20", "is_ic": 0.0417, "is_ic_ir": 0.257, "is_sharpe": 0.521, "is_turnover": 0.082, "is_monotonicity": -0.2, "gates": "PASS", "status": "checks_failed", "eval_seconds": 164.3, "sleeve_id": "daily_flow_overlay", "mispricing_source": "Underreaction to patient accumulation in float-tight names while attention and capital chase noisier high-range stocks.", "forced_counterparty": "retail momentum chasers and redemption-driven sellers providing liquidity without requiring immediate price impact", "data_requirements": "[\"high\",\"low\",\"amount\",\"circ_market_cap\"]", "failure_mode": "Fails in rumor-driven or limit-up regimes where speculative high-range bursts dominate and quiet accumulation stops leading.", "report_contract": "fresh_buy_gate", "ai_supercycle_layer": "ai_chip_equipment_materials_packaging", "supply_chain_hypothesis": "Within AI-infra candidates, bottleneck packaging/test, optical, or power-equipment names should show steady float-adjusted weekly flow with restrained intraday range before order visibility is public.", "relationship_evidence_required": "true", "money_readiness": "money_candidate", "decision": "revert", "session_branch": "main", "base_ref": "origin/main", "merge_base": "62e27b1718a9c8c7cee619126770fe57cd98d173", "head_commit": "62e27b1718a9c8c7cee619126770fe57cd98d173", "oos": "PASS", "checks_status": "failed"}
{"ts": "2026-05-12T14:58:46.981474+08:00", "session_id": "20260512_140046_7f9cc0", "market": "cn", "formula": "rank(ts_min(amount / circ_market_cap, 20) / ts_mean(amount / circ_market_cap, 60))", "name": "float_flow_floor_20_60", "is_ic": 0.0005, "is_ic_ir": -0.005, "is_sharpe": -1.971, "is_turnover": 0.094, "is_monotonicity": -0.05, "gates": "FAIL", "status": "reverted", "eval_seconds": 186.6, "sleeve_id": "float_flow_overlay", "mispricing_source": "Underreaction to durable base-flow improvement; the market notices spikes and stories faster than it prices steady absorption of float.", "forced_counterparty": "Retail spike-chasers and benchmarked managers who delay buying until visible breakout confirmation", "data_requirements": "[\"daily amount\",\"circ_market_cap\",\"optional sector map for residual risk attribution\",\"optional AI-theme labeling for discovery only\"]", "failure_mode": "Fails when broad policy beta or panic deleveraging dominates cross-section, or when elevated flow floors are driven by distribution rather than accumulation.", "report_contract": "fresh_buy_gate", "ai_supercycle_layer": "ai_chip_equipment_materials_packaging", "supply_chain_hypothesis": "If AI-infra bottleneck beneficiaries are present, they should show a rising floor in float-normalized traded value as institutions secure exposure before backlog and capex evidence fully enters consensus.", "relationship_evidence_required": "true", "money_readiness": "money_candidate", "decision": "revert", "session_branch": "main", "base_ref": "origin/main", "merge_base": "62e27b1718a9c8c7cee619126770fe57cd98d173", "head_commit": "62e27b1718a9c8c7cee619126770fe57cd98d173"}
{"ts": "2026-05-12T14:58:46.981474+08:00", "session_id": "20260512_140046_7f9cc0", "market": "cn", "formula": "rank(-ts_std(amount,20)/ts_std(amount,60))*rank(-(ts_max(turnover_rate,20)/ts_mean(turnover_rate,20)))", "name": "amount_compress_spike_share_20_60", "is_ic": 0.0251, "is_ic_ir": 0.245, "is_sharpe": -0.441, "is_turnover": 0.128, "is_monotonicity": 0.8, "gates": "PASS", "status": "candidate", "eval_seconds": 150.0, "sleeve_id": "daily_flow_stability_overlay", "mispricing_source": "The market overweights visible burst days and underweights steady post-spike absorption; persistent buyers hide in low-impact execution, so sponsorship quality is mispriced.", "forced_counterparty": "Retail theme chasers and benchmark-constrained holders trimming after excitement; neither optimizes 10-20 day residual alpha.", "data_requirements": "[\"current daily amount\",\"current daily turnover_rate\",\"standard beta/sector risk model downstream for hedging and residual attribution\"]", "failure_mode": "It should fail in pure narrative-chase regimes where one-day speculative bursts keep dominating price discovery, or in broad macro beta rallies where flow quality stops differentiating winners.", "report_contract": "fresh_buy_gate", "ai_supercycle_layer": "ai_chip_equipment_materials_packaging", "supply_chain_hypothesis": "Candidate AI packaging/equipment/materials bottleneck names should shift from bursty turnover to compressed, broad participation before consensus fully prices capacity tightness.", "relationship_evidence_required": "true", "money_readiness": "money_candidate", "decision": "candidate", "session_branch": "main", "base_ref": "origin/main", "merge_base": "62e27b1718a9c8c7cee619126770fe57cd98d173", "head_commit": "62e27b1718a9c8c7cee619126770fe57cd98d173"}
{"ts": "2026-05-13T14:57:16.348295+08:00", "session_id": "20260513_140001_b22859", "market": "cn", "formula": "rank(-ts_corr(close, delta(amount, 5), 20)) * rank(ts_min(turnover_rate,20)/ts_mean(turnover_rate,20))", "name": "price_flow_floor_absorb_20", "is_ic": 0.0, "is_ic_ir": 0.0, "is_sharpe": 0.0, "is_turnover": 0.0, "is_monotonicity": 0.0, "gates": "FAIL", "status": "reverted", "eval_seconds": 182.5, "sleeve_id": "cn_ai_flow_absorption", "mispricing_source": "The market overpays for visible spike days and underweights quieter accumulation; this sleeve looks for low price-to-cashflow elasticity plus a real participation floor, so it should be lower-corr than pure range or pure stability factors.", "forced_counterparty": "T+1 retail profit-takers and benchmarked funds waiting for confirmed order/policy headlines", "data_requirements": "[\"daily OHLCV\", \"amount\", \"turnover_rate\", \"ai_infra BFS/module/pool metadata\", \"beta-hedged sleeve attribution vs 000300.SH and 399006.SZ\"]", "failure_mode": "Fails in rumor-spike regimes where one-day turnover bursts dominate quiet accumulation, or when policy/news shocks overwhelm the tape so turnover floor no longer signals sponsorship.", "report_contract": "research_only", "ai_supercycle_layer": "ai_chip_equipment_materials_packaging", "supply_chain_hypothesis": "D2-D4 chip-equipment/materials/packaging names should show quiet price leadership with steady turnover floors before source-reviewed order, capex, or domestic-substitution evidence is fully priced.", "relationship_evidence_required": "true", "money_readiness": "research_only", "decision": "revert", "session_branch": "main", "base_ref": "origin/main", "merge_base": "53507f2f93b1d8e5cf801b42a52edbea3e9353eb", "head_commit": "3adfb8bbdd9630bca97e8ef5f05dc7964b23b34c"}
{"ts": "2026-05-13T14:57:16.348295+08:00", "session_id": "20260513_140001_b22859", "market": "cn", "formula": "rank(-ts_corr(amount, high / low - 1, 20))", "name": "amount_range_absorption_20", "is_ic": 0.0, "is_ic_ir": 0.0, "is_sharpe": 0.0, "is_turnover": 0.0, "is_monotonicity": 0.0, "gates": "FAIL", "status": "reverted", "eval_seconds": 117.0, "sleeve_id": "cn_ai_infra_accumulation", "mispricing_source": "Underreaction to quiet absorption; the market overweights flashy breakout bars and underweights steady high-amount, low-impact buying in pre-vetted AI-infra names.", "forced_counterparty": "Retail momentum traders and benchmark-constrained holders who rebalance on theme volatility rather than medium-horizon expected value", "data_requirements": "[\"daily amount\",\"high\",\"low\",\"ai_infra universe membership/source-review status\",\"beta-hedged sleeve attribution and residual risk ledger for deployment\"]", "failure_mode": "Fails when tight ranges are caused by illiquidity or trading constraints rather than absorption, or when policy/headline shock regimes dominate stock-specific tape.", "report_contract": "action_overlay", "ai_supercycle_layer": "ai_networking_optical_cpo", "supply_chain_hypothesis": "Potential optical interconnect/CPO bottleneck beneficiaries may be accumulated before customer-order evidence is fully source-reviewed, showing high amount with compressed daily range.", "relationship_evidence_required": "true", "money_readiness": "research_only", "decision": "revert", "session_branch": "main", "base_ref": "origin/main", "merge_base": "53507f2f93b1d8e5cf801b42a52edbea3e9353eb", "head_commit": "3adfb8bbdd9630bca97e8ef5f05dc7964b23b34c"}
{"ts": "2026-05-13T14:57:16.348295+08:00", "session_id": "20260513_140001_b22859", "market": "cn", "formula": "rank(ts_mean(if_then(ret_1d>0, amount, 0),20) / ts_mean(amount,20))", "name": "up_amount_share_20", "is_ic": 0.0, "is_ic_ir": 0.0, "is_sharpe": 0.0, "is_turnover": 0.0, "is_monotonicity": 0.0, "gates": "FAIL", "status": "compute_error", "eval_seconds": 132.3, "sleeve_id": "cn_ai_orderly_accumulation", "mispricing_source": "Benchmark-constrained funds and thematic allocators build AI-infra exposure gradually, and their buying shows up as repeated up-day cash participation before consensus fully reprices bottleneck names.", "forced_counterparty": "Retail T+1 profit-takers and legacy holders selling into strength; benchmark-hugging managers scaling too slowly to clear the mispricing immediately.", "data_requirements": "[\"daily OHLCV+amount\", \"ai_infra universe metadata (BFS depth/module/source-review)\", \"000300.SH and 399006.SZ returns for beta-hedged attribution\", \"original-source review for any specific supplier/customer/order claim\"]", "failure_mode": "It stops working when sector tape turns into policy-driven churn or crowded momentum, so up-day amount reflects exit liquidity instead of fresh sponsorship.", "report_contract": "setup_overlay", "ai_supercycle_layer": "ai_chip_equipment_materials_packaging", "supply_chain_hypothesis": "Candidate domestic-substitution bottleneck suppliers in equipment/materials/packaging should show persistent up-day cash dominance before confirmed order and capex disclosures.", "relationship_evidence_required": "true", "money_readiness": "research_only", "decision": "revert", "session_branch": "main", "base_ref": "origin/main", "merge_base": "53507f2f93b1d8e5cf801b42a52edbea3e9353eb", "head_commit": "3adfb8bbdd9630bca97e8ef5f05dc7964b23b34c"}
{"ts": "2026-05-13T14:57:16.348295+08:00", "session_id": "20260513_140001_b22859", "market": "cn", "formula": "rank(-ts_std(turnover_rate,20) / ts_mean(turnover_rate,20))", "name": "turnover_stability_20", "is_ic": 0.0, "is_ic_ir": 0.0, "is_sharpe": 0.0, "is_turnover": 0.0, "is_monotonicity": 0.0, "gates": "FAIL", "status": "reverted", "eval_seconds": 223.1, "sleeve_id": "cn_ai_flow_quality", "mispricing_source": "A-share ownership transfer is noisy and retail-dominated intraday, so the market underreacts to smooth multi-week turnover absorption; this is a flow-quality signal, not a recycled price-momentum signal.", "forced_counterparty": "short-term retail chasers and passive liquidity sellers feeding steady institutional demand", "data_requirements": "[\"none beyond daily turnover_rate for signal testing\",\"beta-hedged sleeve return\",\"residual risk attribution\",\"correlation vs existing sleeves\",\"ai_infra source-review status before production use\"]", "failure_mode": "It stops working when the tape is driven by policy/news gap-ups or retail mania, where bursty high-turnover names outperform and stable-turnover becomes just an illiquidity proxy.", "report_contract": "setup_overlay", "ai_supercycle_layer": "ai_chip_equipment_materials_packaging", "supply_chain_hypothesis": "Validated D2-D3 CN AI equipment/materials/packaging bottleneck names should show unusually stable turnover as institutions accumulate before source-reviewed capex/order evidence is fully reflected.", "relationship_evidence_required": "true", "money_readiness": "research_only", "decision": "revert", "session_branch": "main", "base_ref": "origin/main", "merge_base": "53507f2f93b1d8e5cf801b42a52edbea3e9353eb", "head_commit": "3adfb8bbdd9630bca97e8ef5f05dc7964b23b34c"}
{"ts": "2026-05-13T14:57:16.348295+08:00", "session_id": "20260513_140001_b22859", "market": "cn", "formula": "rank(ret_20d*ts_mean(turnover_rate,20)/(ts_max(turnover_rate,20)+0.01))", "name": "trend_even_turnover_20", "is_ic": 0.0, "is_ic_ir": 0.0, "is_sharpe": 0.0, "is_turnover": 0.0, "is_monotonicity": 0.0, "gates": "FAIL", "status": "reverted", "eval_seconds": 195.9, "sleeve_id": "cn_ai_infra_quality_momentum", "mispricing_source": "Raw momentum in A-shares is noisy, but leaders with low turnover concentration are underreacted institutional accumulation rather than retail climax; the market prices both together and underestimates persistence in the cleaner cohort.", "forced_counterparty": "retail theme chasers on turnover-climax days; benchmarked managers forced to add real leaders only after confirmation", "data_requirements": "[\"daily OHLCV\",\"turnover_rate\",\"AI universe membership/layer tags\",\"benchmark hedge attribution vs 000300.SH and 399006.SZ\",\"sleeve correlation/risk report\",\"source evidence cards before any supplier narrative\"]", "failure_mode": "It should fail when the market flips into sharp mean reversion or policy-driven one-day theme bursts, where turnover climax becomes a feature of true breakouts rather than crowding.", "report_contract": "setup_overlay", "ai_supercycle_layer": "ai_chip_equipment_materials_packaging", "supply_chain_hypothesis": "Domestic AI bottleneck suppliers in equipment/materials/packaging should show multi-week leadership with distributed turnover before verified order or capex evidence is widely recognized; theme-only followers should need single-day turnover blowoffs.", "relationship_evidence_required": "true", "money_readiness": "research_only", "decision": "revert", "session_branch": "main", "base_ref": "origin/main", "merge_base": "53507f2f93b1d8e5cf801b42a52edbea3e9353eb", "head_commit": "3adfb8bbdd9630bca97e8ef5f05dc7964b23b34c"}
{"ts": "2026-05-13T14:57:16.348295+08:00", "session_id": "20260513_140001_b22859", "market": "cn", "formula": "rank(ts_min(ts_sum(amount/circ_market_cap,5),20)/ts_max(ts_sum(amount/circ_market_cap,5),20))", "name": "weekly_float_corridor_20", "is_ic": 0.0, "is_ic_ir": 0.0, "is_sharpe": 0.0, "is_turnover": 0.0, "is_monotonicity": 0.0, "gates": "FAIL", "status": "reverted", "eval_seconds": 212.9, "sleeve_id": "cn_ai_flow_absorption", "mispricing_source": "Underreaction to patient float-normalized accumulation under T+1, benchmark frictions, and retail attention bias; this is flow-path quality, not a high-correlation clone of raw momentum, reversal, or simple liquidity level.", "forced_counterparty": "Retail lottery chasers and benchmark/rebalance/redemption-constrained funds supplying stock for non-alpha reasons.", "data_requirements": "[\"amount\",\"circ_market_cap\",\"ai_infra BFS depth/module/evidence tags\",\"benchmark return series for 000300.SH/399006.SZ hedge attribution\",\"existing sleeve correlation panel\",\"residual risk attribution\"]", "failure_mode": "Fails when policy/thematic momentum regimes reward bursty participation, or when stable float flow is just an illiquidity/large-cap parking effect rather than real accumulation.", "report_contract": "setup_overlay", "ai_supercycle_layer": "ai_datacenter_edge_infra", "supply_chain_hypothesis": "D2-D4 CN datacenter, IDC, telecom-power, and edge-infra enablers should show steady weekly float participation before backlog/capex evidence is fully recognized.", "relationship_evidence_required": "true", "money_readiness": "research_only", "decision": "revert", "session_branch": "main", "base_ref": "origin/main", "merge_base": "53507f2f93b1d8e5cf801b42a52edbea3e9353eb", "head_commit": "3adfb8bbdd9630bca97e8ef5f05dc7964b23b34c"}
{"ts": "2026-05-13T14:57:16.348295+08:00", "session_id": "20260513_140001_b22859", "market": "cn", "formula": "rank(ts_mean(amount/circ_market_cap,20)/(ts_std(ret_1d,20)+0.01))", "name": "float_absorption_20", "is_ic": 0.0, "is_ic_ir": 0.0, "is_sharpe": 0.0, "is_turnover": 0.0, "is_monotonicity": 0.0, "gates": "FAIL", "status": "reverted", "eval_seconds": 131.5, "sleeve_id": "cn_ai_flow_absorption", "mispricing_source": "The market underreacts to slow institutional accumulation in AI-infra bottleneck names because benchmarked managers scale in gradually and retail focuses on headline bursts rather than persistent absorption.", "forced_counterparty": "retail swing traders and benchmark-constrained mutual funds", "data_requirements": "[\"CN daily panel for IS test now\",\"promotion needs ai_infra source-review status, beta-hedged sleeve attribution, sleeve correlation matrix, and transaction-cost ledger\"]", "failure_mode": "It stops working when the theme shifts into gap-driven speculation or policy shock, where high trading value no longer reflects informed accumulation and low-vol absorption gives way to crowded unwind.", "report_contract": "setup_overlay", "ai_supercycle_layer": "ai_networking_optical_cpo", "supply_chain_hypothesis": "Persistent float-normalized flow should surface D2-D4 optical/connectivity bottleneck suppliers being accumulated ahead of verified capex or order disclosures.", "relationship_evidence_required": "true", "money_readiness": "research_only", "decision": "revert", "session_branch": "main", "base_ref": "origin/main", "merge_base": "53507f2f93b1d8e5cf801b42a52edbea3e9353eb", "head_commit": "3adfb8bbdd9630bca97e8ef5f05dc7964b23b34c"}
{"ts": "2026-05-13T14:57:16.348295+08:00", "session_id": "20260513_140001_b22859", "market": "cn", "formula": "-ts_corr(pct_change(turnover_rate,5),shift(pct_change(turnover_rate,5),5),20)+ts_mean((close-open)/(high-low+0.01),20)", "name": "turnchg_body_underreaction_20", "is_ic": 0.0, "is_ic_ir": 0.0, "is_sharpe": 0.0, "is_turnover": 0.0, "is_monotonicity": 0.0, "gates": "FAIL", "status": "reverted", "eval_seconds": 242.2, "sleeve_id": "cn_ai_flow_body_underreaction", "mispricing_source": "Order-slicing and benchmark frictions create slow recognition of accumulation in AI-infra leaders; this is not just a price factor because it needs both disciplined float rotation and persistent strong closes.", "forced_counterparty": "Retail swing traders taking quick profits and benchmarked long-only funds that can only add exposure gradually", "data_requirements": "[\"daily OHLC\",\"daily turnover_rate\",\"ai_infra universe membership/meta\",\"benchmark hedge attribution vs 000300.SH and 399006.SZ before promotion\",\"original-source verification before asserting any supplier/customer link\"]", "failure_mode": "It should break in headline-chasing or limit-up/limit-down regimes where turnover becomes one-sided and price gaps dominate orderly accumulation.", "report_contract": "fresh_buy_gate", "ai_supercycle_layer": "ai_networking_optical_cpo", "supply_chain_hypothesis": "If optical interconnect/CPO is the next AI bottleneck leg, CN optical-chain leaders should show non-self-reinforcing weekly turnover changes but persistent strong closes before explicit order/backlog confirmation.", "relationship_evidence_required": "true", "money_readiness": "money_candidate", "decision": "revert", "session_branch": "main", "base_ref": "origin/main", "merge_base": "53507f2f93b1d8e5cf801b42a52edbea3e9353eb", "head_commit": "3adfb8bbdd9630bca97e8ef5f05dc7964b23b34c"}
{"ts": "2026-05-13T14:57:16.348295+08:00", "session_id": "20260513_140001_b22859", "market": "cn", "formula": "rank(-ts_corr(ret_1d, shift(ret_1d, 1), 20)) * rank(-ts_std(turnover_rate, 20) / (ts_mean(turnover_rate, 20) + 0.01))", "name": "autocorr_smooth_turnover_20", "is_ic": 0.0, "is_ic_ir": 0.0, "is_sharpe": 0.0, "is_turnover": 0.0, "is_monotonicity": 0.0, "gates": "FAIL", "status": "reverted", "eval_seconds": 147.7, "sleeve_id": "cn_ai_float_absorption", "mispricing_source": "Underreaction to quiet institutional accumulation in tight-float AI names; noisy daily candles mask smooth ownership transfer until float tightens.", "forced_counterparty": "Retail T+1 theme traders and benchmarked managers rotating on headline windows.", "data_requirements": "[\"daily OHLCV\",\"turnover_rate\",\"benchmark hedge ledger vs 000300.SH and 399006.SZ\",\"sleeve correlation vs kshadow_5\",\"if tied to supplier thesis: evidence card plus filings/official releases\"]", "failure_mode": "It stops working in one-way retail squeeze or broad liquidation regimes, where stable turnover reflects neglect or indiscriminate de-risking rather than accumulation.", "report_contract": "research_only", "ai_supercycle_layer": "ai_chip_equipment_materials_packaging", "supply_chain_hypothesis": "Candidate domestic semiconductor equipment/materials/packaging bottlenecks tied to AI server and accelerator build-out should show float absorption before backlog recognition.", "relationship_evidence_required": "true", "money_readiness": "research_only", "decision": "revert", "session_branch": "main", "base_ref": "origin/main", "merge_base": "53507f2f93b1d8e5cf801b42a52edbea3e9353eb", "head_commit": "3adfb8bbdd9630bca97e8ef5f05dc7964b23b34c"}
