{"ts": "2026-05-25T07:23:06.199590+08:00", "session_id": "20260525_062703_ae377b", "market": "cn", "formula": "rank(-ts_std(amount,20))*rank(-pct_change(close,10))", "name": "amount_absorb_pullback_10", "is_ic": 0.0553, "is_ic_ir": 0.235, "is_sharpe": -0.332, "is_turnover": 0.191, "is_monotonicity": 0.55, "gates": "PASS", "status": "kept", "eval_seconds": 97.3, "sleeve_id": "cn_ai_absorption_pullback", "mispricing_source": "Short-horizon traders and theme chasers sell recent weakness, but slower allocators keep deploying into validated AI-infra leaders; stable traded value during a pullback is the tape footprint of that imbalance.", "forced_counterparty": "retail momentum traders, weak-hand thematic funds, and rebalance-driven sellers", "data_requirements": "[\"daily OHLCV+amount\", \"AI universe membership\", \"benchmark hedge attribution vs 000300.SH/399006.SZ\", \"sleeve correlation to promoted factors\", \"source-review evidence before any supplier/customer claim\"]", "failure_mode": "It fails when pullbacks are caused by genuine fundamental de-rating, or when market-wide liquidity stress makes stable amount reflect large-holder distribution instead of absorption.", "report_contract": "setup_overlay", "ai_supercycle_layer": "ai_chip_equipment_materials_packaging", "supply_chain_hypothesis": "Domestic semiconductor equipment/materials/packaging bottleneck names may show steady-value pullback absorption ahead of capex/order confirmation from downstream AI compute buildout.", "relationship_evidence_required": "true", "money_readiness": "research_only", "decision": "keep", "session_branch": "main", "base_ref": "origin/main", "merge_base": "c99187be1dc8d78a84147200981562efcde7b8d5", "head_commit": "c99187be1dc8d78a84147200981562efcde7b8d5", "oos": "PASS", "checks_status": "passed"}
{"ts": "2026-05-25T14:56:27.125102+08:00", "session_id": "20260525_140003_622c66", "market": "cn", "formula": "rank(ts_mean(amount,20)/(ts_std(amount,20)+1))*rank(-ts_std(volume_ratio,10))", "name": "stable_amount_quiet_flow", "is_ic": 0.0216, "is_ic_ir": 0.139, "is_sharpe": -2.514, "is_turnover": 0.159, "is_monotonicity": -0.5, "gates": "FAIL", "status": "reverted", "eval_seconds": 125.2, "sleeve_id": "cn_ai_flow_absorption", "mispricing_source": "Short-horizon participants extrapolate fading attention when daily participation noise compresses, while institutional capital keeps deploying into capacity-constrained AI names; the market underprices the continuation value of that quiet accumulation.", "forced_counterparty": "retail momentum traders, thematic hot-money accounts, and benchmarked funds rotating on very short performance windows", "data_requirements": "[\"daily OHLCV\", \"amount\", \"volume_ratio\", \"benchmark beta hedge attribution\", \"sleeve drawdown/correlation to promoted factors\", \"source-reviewed AI-universe metadata before any name-level AI supply-chain claim\"]", "failure_mode": "Stops working in broad liquidity squeezes, policy-shock tape, or pure speculative melt-up regimes where stable flow no longer means absorption and noisy breakout chasing dominates returns.", "report_contract": "setup_overlay", "ai_supercycle_layer": "ai_networking_optical_cpo", "supply_chain_hypothesis": "Optical interconnect, fiber, and CPO-adjacent CN names with real AI datacenter capex exposure should exhibit quiet flow absorption before backlog or order evidence is refreshed in public filings.", "relationship_evidence_required": "true", "money_readiness": "research_only", "decision": "revert", "session_branch": "main", "base_ref": "origin/main", "merge_base": "c99187be1dc8d78a84147200981562efcde7b8d5", "head_commit": "c99187be1dc8d78a84147200981562efcde7b8d5"}
{"ts": "2026-05-25T14:56:27.125102+08:00", "session_id": "20260525_140003_622c66", "market": "cn", "formula": "rank(ts_mean(amount / circ_market_cap, 20) / ts_std(amount / circ_market_cap, 20))", "name": "float_adjusted_amount_consistency_20", "is_ic": -0.0422, "is_ic_ir": -0.16, "is_sharpe": -4.034, "is_turnover": 0.141, "is_monotonicity": -0.5, "gates": "FAIL", "status": "reverted", "eval_seconds": 171.6, "sleeve_id": "cn_ai_flow_quality", "mispricing_source": "Underreaction to slow institutional position-building in scarce AI-infra names; this is participation-quality alpha, not a simple price-trend clone.", "forced_counterparty": "Retail T+1 churners and benchmark-aware funds rotating on headlines and liquidity windows.", "data_requirements": "[\"amount\",\"circ_market_cap\",\"daily returns for beta-hedged sleeve attribution\",\"correlation to existing promoted sleeves\",\"source-review evidence only if later narrative claims a specific supplier/customer link\"]", "failure_mode": "Breaks in policy/news squeeze regimes where one-day narrative bursts dominate tape, or if float-adjusted flow becomes a generic small-cap liquidity proxy instead of informed accumulation.", "report_contract": "setup_overlay", "ai_supercycle_layer": "none", "supply_chain_hypothesis": "Persistent float-adjusted absorption should surface candidate AI-infra bottleneck winners across compute, optical, packaging, and power adjacencies before specific order/backlog evidence is fully diffused.", "relationship_evidence_required": "true", "money_readiness": "research_only", "decision": "revert", "session_branch": "main", "base_ref": "origin/main", "merge_base": "c99187be1dc8d78a84147200981562efcde7b8d5", "head_commit": "c99187be1dc8d78a84147200981562efcde7b8d5"}
{"ts": "2026-05-25T14:56:27.125102+08:00", "session_id": "20260525_140003_622c66", "market": "cn", "formula": "rank(-ts_corr(ret_1d,shift(ret_1d,1),20))*rank(-ts_std(pct_change(amount,5),20))", "name": "anti_autocorr_weekly_amount_change_stability", "is_ic": 0.031, "is_ic_ir": 0.192, "is_sharpe": -0.562, "is_turnover": 0.165, "is_monotonicity": 0.05, "gates": "FAIL", "status": "reverted", "eval_seconds": 175.4, "sleeve_id": "cn_ai_flow_underreaction", "mispricing_source": "T+1 retail churn and benchmarked theme money overreact to noisy short bursts, while slower allocators accumulate AI-infra names through steadier weekly notional flow that is not immediately repriced.", "forced_counterparty": "retail round-trippers, weak-hand thematic funds, and benchmark-aware managers waiting for explicit confirmation", "data_requirements": "[\"daily ret_1d and amount for IS test\", \"AI universe membership\", \"beta-hedged attribution vs 000300.SH and 399006.SZ\", \"sleeve correlation matrix\", \"source-reviewed evidence before any supplier/customer claim\"]", "failure_mode": "It fails when the market shifts into a reflexive momentum regime where positive autocorrelation is rewarded, or when smooth weekly amount changes are distribution rather than accumulation.", "report_contract": "setup_overlay", "ai_supercycle_layer": "ai_chip_equipment_materials_packaging", "supply_chain_hypothesis": "Domestic semicap equipment, materials, and advanced packaging bottleneck names may show low daily return feedback and stable weekly amount-change patterns before source-reviewed downstream AI capex or order confirmation is fully priced.", "relationship_evidence_required": "true", "money_readiness": "research_only", "decision": "revert", "session_branch": "main", "base_ref": "origin/main", "merge_base": "c99187be1dc8d78a84147200981562efcde7b8d5", "head_commit": "c99187be1dc8d78a84147200981562efcde7b8d5"}
{"ts": "2026-05-25T14:56:27.125102+08:00", "session_id": "20260525_140003_622c66", "market": "cn", "formula": "rank(ts_mean(turnover_rate,20)/ts_std(turnover_rate,20))*rank(ret_20d-ret_5d)", "name": "stable_turnover_pullback_20", "is_ic": -0.054, "is_ic_ir": -0.192, "is_sharpe": -2.427, "is_turnover": 0.203, "is_monotonicity": -0.35, "gates": "FAIL", "status": "reverted", "eval_seconds": 109.6, "sleeve_id": "cn_ai_flow_accumulation", "mispricing_source": "The market underreacts to steady float recycling in AI-infra leaders and overreacts to brief consolidations inside a stronger 20-day trend.", "forced_counterparty": "Short-horizon retail profit-takers and benchmark-constrained mutual funds that cannot complete positions in one wave.", "data_requirements": "No extra non-daily data for IS testing; promotion needs sleeve correlation, beta-hedged attribution vs 000300.SH/399006.SZ, and residual risk tracking inside the validated AI universe.", "failure_mode": "Fails in headline-chasing melt-ups or panic unwinds when stable turnover reflects distribution, and in mean-reverting tape where 20-day leadership does not persist.", "report_contract": "setup_overlay", "ai_supercycle_layer": "ai_chip_equipment_materials_packaging", "supply_chain_hypothesis": "Validated domestic AI bottleneck names in equipment/materials/packaging should show turnover-backed pauses before the market fully reprices order transmission; exact supplier/customer links remain source-review items.", "relationship_evidence_required": "true", "money_readiness": "research_only", "decision": "revert", "session_branch": "main", "base_ref": "origin/main", "merge_base": "c99187be1dc8d78a84147200981562efcde7b8d5", "head_commit": "c99187be1dc8d78a84147200981562efcde7b8d5"}
{"ts": "2026-05-25T14:56:27.125102+08:00", "session_id": "20260525_140003_622c66", "market": "cn", "formula": "rank(ts_mean(amount/circ_market_cap,20))*rank(-pb)", "name": "float_flow_low_pb_20", "is_ic": 0.0459, "is_ic_ir": 0.198, "is_sharpe": 3.266, "is_turnover": 0.032, "is_monotonicity": 0.35, "gates": "FAIL", "status": "reverted", "eval_seconds": 116.1, "sleeve_id": "cn_ai_flow_value_overlay", "mispricing_source": "Benchmarked and retail capital tends to chase expensive narrative leaders, leaving low-multiple AI-infra hard-asset names underowned until flow persistence forces a rerating.", "forced_counterparty": "Retail momentum chasers and style-constrained managers rotating out of low-P/B asset-heavy names to fund high-beta story trades.", "data_requirements": "[\"source-reviewed ai_infra universe membership\",\"rolling correlation vs promoted factors\",\"beta-hedged sleeve PnL vs 000300.SH/399006.SZ\",\"size/style exposure attribution\",\"filings/backlog/capex evidence if used to argue bottleneck status\"]", "failure_mode": "It stops working when liquidity regimes reward pure narrative beta over balance-sheet rerating, or when low-P/B names are cheap for genuine non-AI balance-sheet stress.", "report_contract": "setup_overlay", "ai_supercycle_layer": "hard_assets_energy_heavy", "supply_chain_hypothesis": "May surface source-reviewed datacenter power, cooling, grid, and asset-heavy packaging/equipment suppliers where steady flow arrives before verified AI capex orders are fully priced.", "relationship_evidence_required": "true", "money_readiness": "research_only", "decision": "revert", "session_branch": "main", "base_ref": "origin/main", "merge_base": "c99187be1dc8d78a84147200981562efcde7b8d5", "head_commit": "c99187be1dc8d78a84147200981562efcde7b8d5"}
{"ts": "2026-05-25T14:56:27.125102+08:00", "session_id": "20260525_140003_622c66", "market": "cn", "formula": "rank(ts_mean(amount / circ_market_cap, 40) / (pb + 1))", "name": "float_flow_low_pb_40", "is_ic": 0.0479, "is_ic_ir": 0.212, "is_sharpe": 4.418, "is_turnover": 0.023, "is_monotonicity": 0.4, "gates": "PASS", "status": "reverted", "eval_seconds": 87.8, "sleeve_id": "cn_ai_infra_flow_value", "mispricing_source": "Reporting lag and thematic rotation create a window where steady accumulation shows up in float-adjusted trading value before fundamentals are repriced; this is a flow-plus-valuation signal, not a high-correlation price-chase variant.", "forced_counterparty": "Retail momentum traders and short-horizon theme allocators who exit quiet consolidations; benchmarked long-only managers who wait for visible confirmation before adding.", "data_requirements": "[\"daily amount\",\"circ_market_cap\",\"pb\",\"benchmark-hedged sleeve return\",\"residual risk attribution\",\"correlation vs existing promoted sleeves\",\"source-review evidence card if used to justify specific supplier status\"]", "failure_mode": "It breaks in speculative melt-up regimes where expensive leaders keep squeezing higher regardless of valuation, or in true value traps where low PB reflects deteriorating balance-sheet quality rather than overlooked AI demand.", "report_contract": "fresh_buy_gate", "ai_supercycle_layer": "ai_chip_equipment_materials_packaging", "supply_chain_hypothesis": "Orderly float-adjusted accumulation should preferentially surface domestic AI capex bottleneck beneficiaries in semiconductor equipment, materials, and advanced packaging before verified backlog/capex evidence is broadly priced.", "relationship_evidence_required": "true", "money_readiness": "money_candidate", "decision": "revert", "session_branch": "main", "base_ref": "origin/main", "merge_base": "c99187be1dc8d78a84147200981562efcde7b8d5", "head_commit": "c99187be1dc8d78a84147200981562efcde7b8d5", "oos": "FAIL", "checks_status": "skipped"}
{"ts": "2026-05-25T14:56:27.125102+08:00", "session_id": "20260525_140003_622c66", "market": "cn", "formula": "rank(ts_mean(amount/circ_market_cap,20)/ts_max(amount/circ_market_cap,20))*rank(-pct_change(close,10))", "name": "float_even_pullback_10", "is_ic": -0.0404, "is_ic_ir": -0.155, "is_sharpe": -5.322, "is_turnover": 0.222, "is_monotonicity": -0.6, "gates": "FAIL", "status": "reverted", "eval_seconds": 172.3, "sleeve_id": "cn_ai_absorption_pullback", "mispricing_source": "The market overweights recent price weakness and underweights steady free-float sponsorship during pullbacks; this is an accumulation-underreaction signal, not a naked reversal.", "forced_counterparty": "Retail theme traders and benchmarked mutual funds cutting recent losers or scaling too slowly under turnover/tracking-error constraints", "data_requirements": "[\"daily close\",\"daily amount\",\"circ_market_cap\",\"portfolio beta-hedge and residual attribution before promotion\",\"source-reviewed AI-universe membership for any supply-chain narrative\"]", "failure_mode": "Fails when pullbacks reflect real order/capex deterioration, or when a retail melt-up regime rewards bursty chase behavior over quiet absorption.", "report_contract": "setup_overlay", "ai_supercycle_layer": "ai_chip_equipment_materials_packaging", "supply_chain_hypothesis": "Domestic semiconductor equipment/materials/packaging bottleneck names may show orderly float-normalized pullback absorption before downstream capex and order evidence is revised into consensus.", "relationship_evidence_required": "true", "money_readiness": "research_only", "decision": "revert", "session_branch": "main", "base_ref": "origin/main", "merge_base": "c99187be1dc8d78a84147200981562efcde7b8d5", "head_commit": "c99187be1dc8d78a84147200981562efcde7b8d5"}
{"ts": "2026-05-25T14:56:27.125102+08:00", "session_id": "20260525_140003_622c66", "market": "cn", "formula": "rank(-ts_std(delta(log(amount/circ_market_cap),5),20))*rank(-ts_mean(high/low-1,20))", "name": "weekly_floatchg_lowlottery_20", "is_ic": -0.0727, "is_ic_ir": -0.235, "is_sharpe": -4.423, "is_turnover": 0.128, "is_monotonicity": -0.25, "gates": "FAIL", "status": "reverted", "eval_seconds": 168.8, "sleeve_id": "daily_flow_overlay", "mispricing_source": "Underreaction to patient accumulation in float-tight AI-infra names; this is not a high-correlation price clone because it uses float-adjusted flow smoothness plus low-range behavior rather than direction-only momentum or reversal.", "forced_counterparty": "Retail momentum chasers, theme tourists, and liquidity/rebalance sellers who supply stock into orderly accumulation", "data_requirements": "[\"amount\",\"circ_market_cap\",\"high\",\"low\"]; for promotion also require beta-hedged sleeve attribution and ai_infra source review for any supplier/order interpretation", "failure_mode": "Fails in rumor-driven, limit-up, or policy-shock regimes where bursty high-range names lead and quiet flow stops being informative", "report_contract": "fresh_buy_gate", "ai_supercycle_layer": "ai_chip_equipment_materials_packaging", "supply_chain_hypothesis": "Within AI-infra candidates, bottleneck packaging/test, optical, or power-equipment names should show steady float-adjusted weekly flow with restrained intraday range before order visibility is public", "relationship_evidence_required": "true", "money_readiness": "money_candidate", "decision": "revert", "session_branch": "main", "base_ref": "origin/main", "merge_base": "c99187be1dc8d78a84147200981562efcde7b8d5", "head_commit": "c99187be1dc8d78a84147200981562efcde7b8d5"}
{"ts": "2026-05-25T14:56:27.125102+08:00", "session_id": "20260525_140003_622c66", "market": "cn", "formula": "rank(ts_mean(volume_ratio,20)) * rank(-ts_std(ret_1d,20))", "name": "quiet_accumulation_participation_20", "is_ic": 0.0164, "is_ic_ir": 0.083, "is_sharpe": -1.862, "is_turnover": 0.111, "is_monotonicity": -0.25, "gates": "FAIL", "status": "reverted", "eval_seconds": 77.4, "sleeve_id": "daily_flow_accumulation", "mispricing_source": "Stealth accumulation in constrained AI-theme leaders is underreacted to because the tape looks boring on price but persistent on participation, so capital arrives before narrative confirmation is fully priced.", "forced_counterparty": "Retail momentum traders and benchmark-aware long-only funds that avoid adding before a visible breakout", "data_requirements": "[\"daily CN price/volume/daily_basic already available\",\"benchmark-hedged alpha and residual risk attribution before promotion\",\"correlation check vs amount_stability_20 and float_flow_low_pb_40\",\"if tied to supplier/order thesis: filings, official press releases, transcripts\"]", "failure_mode": "Stops working in panic/liquidity-shock regimes where elevated participation is distribution rather than accumulation, or in pure squeeze markets where high-vol breakout names dominate quiet leaders.", "report_contract": "setup_overlay", "ai_supercycle_layer": "ai_chip_equipment_materials_packaging", "supply_chain_hypothesis": "Domestic AI accelerator, HBM, and advanced packaging capex beneficiaries show steady abnormal participation before upstream order visibility is explicit in public sources.", "relationship_evidence_required": "true", "money_readiness": "research_only", "decision": "revert", "session_branch": "main", "base_ref": "origin/main", "merge_base": "c99187be1dc8d78a84147200981562efcde7b8d5", "head_commit": "c99187be1dc8d78a84147200981562efcde7b8d5"}
{"ts": "2026-05-25T14:56:27.125102+08:00", "session_id": "20260525_140003_622c66", "market": "cn", "formula": "rank(ts_std(amount,60)/ts_std(amount,20))*rank(-pct_change(close,10))", "name": "amount_compress_pullback_10", "is_ic": 0.0473, "is_ic_ir": 0.215, "is_sharpe": -0.737, "is_turnover": 0.204, "is_monotonicity": 0.3, "gates": "PASS", "status": "checks_failed", "eval_seconds": 132.5, "sleeve_id": "cn_ai_digestion_pullback", "mispricing_source": "Short-horizon traders sell recent weakness, while slower allocators keep building AI-capex exposure; recent amount compression relative to 60d marks quieter ownership transfer rather than a naked price-reversal bet.", "forced_counterparty": "T+1 retail momentum traders, theme-rotation funds, and benchmark/rebalance sellers", "data_requirements": "[\"close\",\"amount\"]; before promotion require beta-hedged sleeve attribution vs 000300.SH/399006.SZ, residual risk attribution, rolling corr vs promoted sleeves, and source-reviewed evidence before attaching any supplier/order narrative", "failure_mode": "Fails when pullbacks reflect genuine fundamental de-rating, or when low recent amount volatility is just illiquidity/stale trading instead of accumulation.", "report_contract": "setup_overlay", "ai_supercycle_layer": "ai_chip_equipment_materials_packaging", "supply_chain_hypothesis": "Within source-reviewed CN AI bottleneck names, semiconductor equipment/materials/advanced-packaging suppliers should show compressed traded-value volatility during 10-day pullbacks before capex/order recognition is fully priced.", "relationship_evidence_required": "true", "money_readiness": "research_only", "decision": "revert", "session_branch": "main", "base_ref": "origin/main", "merge_base": "c99187be1dc8d78a84147200981562efcde7b8d5", "head_commit": "c99187be1dc8d78a84147200981562efcde7b8d5", "oos": "PASS", "checks_status": "failed"}
