{"ts": "2026-05-18T14:56:05.857628+08:00", "session_id": "20260518_140003_036b53", "market": "cn", "formula": "rank(ts_mean(turnover_rate, 20) / ts_std(turnover_rate, 20))", "name": "turnover_stability_20", "is_ic": 0.0, "is_ic_ir": 0.0, "is_sharpe": 0.0, "is_turnover": 0.0, "is_monotonicity": 0.0, "gates": "FAIL", "status": "reverted", "eval_seconds": 201.0, "sleeve_id": "cn_ai_infra_flow_quality", "mispricing_source": "Daily cross-sectional models and discretionary traders overpay for visible spikes, while steady turnover in bottleneck names looks unexciting until orders, capex, or utilization narratives become obvious.", "forced_counterparty": "Retail momentum traders, T+1 constrained holders, and short-horizon funds rotating out of low-excitement names", "data_requirements": "[\"daily turnover_rate for IS test\", \"beta-hedged sleeve attribution vs 000300.SH and 399006.SZ\", \"factor correlation matrix vs existing sleeves\", \"source-review status from ai_infra universe before production use\"]", "failure_mode": "It stops working when theme-wide retail mania dominates tape or when low turnover stability is just illiquidity rather than absorption.", "report_contract": "setup_overlay", "ai_supercycle_layer": "ai_chip_equipment_materials_packaging", "supply_chain_hypothesis": "Reviewed domestic AI capex bottleneck suppliers may be accumulated steadily before backlog or customer confirmation is public; turnover stability is a tape clue for that repricing path, not proof of the relationship.", "relationship_evidence_required": "true", "money_readiness": "research_only", "decision": "revert", "session_branch": "main", "base_ref": "origin/main", "merge_base": "89f7b3a20c7d57ca0056b8bff0a3403328f00c52", "head_commit": "89f7b3a20c7d57ca0056b8bff0a3403328f00c52"}
{"ts": "2026-05-18T14:56:05.857628+08:00", "session_id": "20260518_140003_036b53", "market": "cn", "formula": "rank(ts_mean(amount/circ_market_cap,20)/(ts_std(volume_ratio,20)+0.01))", "name": "steady_float_absorption_20", "is_ic": 0.0, "is_ic_ir": 0.0, "is_sharpe": 0.0, "is_turnover": 0.0, "is_monotonicity": 0.0, "gates": "FAIL", "status": "reverted", "eval_seconds": 83.9, "sleeve_id": "cn_ai_infra_accumulation", "mispricing_source": "The factor targets sponsorship quality rather than raw momentum; the market underreacts to persistent float-adjusted value turnover when the tape looks boring and overreacts to episodic high-volume excitement.", "forced_counterparty": "Short-horizon retail theme chasers and benchmarked managers rotating into the loudest AI names rather than the steadiest accumulations.", "data_requirements": "[\"amount\",\"circ_market_cap\",\"volume_ratio\",\"benchmark series for hedge attribution vs 000300.SH/399006.SZ\",\"source-review docs before asserting any specific supplier/customer link\"]", "failure_mode": "It should decay in policy-shock or speculative mania regimes where abrupt volume spikes, not steady absorption, drive the next 10-20 trading days.", "report_contract": "fresh_buy_gate", "ai_supercycle_layer": "ai_networking_optical_cpo", "supply_chain_hypothesis": "Candidate AI-networking and optical bottleneck suppliers should exhibit steady float-adjusted cash absorption before verified order/backlog evidence becomes consensus.", "relationship_evidence_required": "true", "money_readiness": "money_candidate", "decision": "revert", "session_branch": "main", "base_ref": "origin/main", "merge_base": "89f7b3a20c7d57ca0056b8bff0a3403328f00c52", "head_commit": "89f7b3a20c7d57ca0056b8bff0a3403328f00c52"}
{"ts": "2026-05-18T14:56:05.857628+08:00", "session_id": "20260518_140003_036b53", "market": "cn", "formula": "rank(-ts_std(pct_change(amount/circ_market_cap,5),20))*rank(ts_mean(close/open,5))", "name": "weekly_floatflow_body_bias_20", "is_ic": 0.0, "is_ic_ir": 0.0, "is_sharpe": 0.0, "is_turnover": 0.0, "is_monotonicity": 0.0, "gates": "FAIL", "status": "reverted", "eval_seconds": 170.8, "sleeve_id": "cn_ai_flow_absorption", "mispricing_source": "The market underreacts to orderly float-normalized accumulation in strategic AI suppliers before backlog/order evidence is public; this is flow-quality plus body-bias, not a simple momentum clone.", "forced_counterparty": "T+1 retail swing sellers, benchmarked funds underweight smaller AI suppliers, and liquidity providers fading steady demand", "data_requirements": "[\"daily OHLCV\",\"amount\",\"circ_market_cap\",\"beta-hedged sleeve attribution vs 000300.SH and 399006.SZ\",\"correlation vs promoted sleeves\",\"optional intraday/L2 flow for execution refinement\",\"source-reviewed relationship evidence before any supplier/customer claim\"]", "failure_mode": "Fails in limit-up thematic melt-ups or macro risk-off deleveraging, when smooth float flow is just illiquidity or beta compression and body bias stops signaling real accumulation.", "report_contract": "fresh_buy_gate", "ai_supercycle_layer": "ai_chip_equipment_materials_packaging", "supply_chain_hypothesis": "Domestic AI chip-equipment and packaging bottleneck names can show steady float absorption before public backlog/order confirmation reaches consensus; this is a discovery hypothesis, not a verified relationship claim.", "relationship_evidence_required": "true", "money_readiness": "money_candidate", "decision": "revert", "session_branch": "main", "base_ref": "origin/main", "merge_base": "89f7b3a20c7d57ca0056b8bff0a3403328f00c52", "head_commit": "89f7b3a20c7d57ca0056b8bff0a3403328f00c52"}
{"ts": "2026-05-18T14:56:05.857628+08:00", "session_id": "20260518_140003_036b53", "market": "cn", "formula": "rank(-ts_corr((high-close)/(high-low+0.01),delta(amount/circ_market_cap,5),20))", "name": "float_shadow_absorb_20", "is_ic": 0.0, "is_ic_ir": 0.0, "is_sharpe": 0.0, "is_turnover": 0.0, "is_monotonicity": 0.0, "gates": "FAIL", "status": "reverted", "eval_seconds": 222.2, "sleeve_id": "cn_ai_tape_accumulation", "mispricing_source": "The market often confuses active thematic trading with distribution; this factor isolates cases where activity increases but intraday rejection falls, which is a sponsorship-quality signal rather than a plain price signal.", "forced_counterparty": "Retail momentum chasers and benchmarked managers trimming into liquidity spikes.", "data_requirements": "[\"daily OHLC+amount+circ_market_cap for IS test\",\"5m bar or closing-auction volume profile to confirm true absorption before promotion\",\"beta-hedged sleeve attribution vs 000300.SH and 399006.SZ\"]", "failure_mode": "It stops working when volume bursts are driven by one-off policy/news shocks and low upper shadows reflect gap-chasing instead of persistent institutional absorption.", "report_contract": "research_only", "ai_supercycle_layer": "none", "supply_chain_hypothesis": "Bottleneck AI-infra names with scarce float should show rising float-adjusted cash participation and shrinking upper-shadow rejection before broader order/backlog evidence is visible.", "relationship_evidence_required": "false", "money_readiness": "research_only", "decision": "revert", "session_branch": "main", "base_ref": "origin/main", "merge_base": "89f7b3a20c7d57ca0056b8bff0a3403328f00c52", "head_commit": "89f7b3a20c7d57ca0056b8bff0a3403328f00c52"}
{"ts": "2026-05-18T14:56:05.857628+08:00", "session_id": "20260518_140003_036b53", "market": "cn", "formula": "rank(ts_mean(amount,20)/(ts_mean(amount,60)+1))*rank(ret_20d-ret_5d)", "name": "amt_accel_pullback_20", "is_ic": 0.0, "is_ic_ir": 0.0, "is_sharpe": 0.0, "is_turnover": 0.0, "is_monotonicity": 0.0, "gates": "FAIL", "status": "reverted", "eval_seconds": 118.0, "sleeve_id": "daily_price_overlay", "mispricing_source": "Capital-throughput acceleration is a flow signal, not just a price signal; benchmarked and thematic funds often rebuild AI-infra exposure with delay after shallow pullbacks.", "forced_counterparty": "Retail profit-takers and benchmark rebalancers trimming recent winners", "data_requirements": "[\"daily amount and returns\", \"ai_infra reviewed CN universe membership\", \"beta-hedged sleeve PnL, residual risk, and sleeve-correlation attribution before promotion\"]", "failure_mode": "This stops working when amount acceleration is mostly exit liquidity or policy-driven blowoff demand rather than patient accumulation, especially during fast theme unwinds.", "report_contract": "fresh_buy_gate", "ai_supercycle_layer": "none", "supply_chain_hypothesis": "none", "relationship_evidence_required": "false", "money_readiness": "money_candidate", "decision": "revert", "session_branch": "main", "base_ref": "origin/main", "merge_base": "89f7b3a20c7d57ca0056b8bff0a3403328f00c52", "head_commit": "89f7b3a20c7d57ca0056b8bff0a3403328f00c52"}
{"ts": "2026-05-18T14:56:05.857628+08:00", "session_id": "20260518_140003_036b53", "market": "cn", "formula": "rank(-ts_corr(ret_1d,shift(ret_1d,1),20))*rank(ts_mean(amount,20)/ts_std(amount,20))", "name": "anti_autocorr_amount_evenness_20", "is_ic": 0.0, "is_ic_ir": 0.0, "is_sharpe": 0.0, "is_turnover": 0.0, "is_monotonicity": 0.0, "gates": "FAIL", "status": "reverted", "eval_seconds": 153.5, "sleeve_id": "cn_ai_absorption_overlay", "mispricing_source": "This monetizes participation-shape mispricing: weak hands and theme chasers create daily overshoot, while slower institutional buyers absorb supply without needing breakout volume. It is not just another price factor because the second leg requires stable capital commitment in amount, not raw momentum or reversal alone.", "forced_counterparty": "Retail theme chasers constrained by T+1, plus benchmarked long-only funds that wait for official confirmation before adding AI-infra names", "data_requirements": "[\"daily OHLCV + amount for first-pass test\",\"ai_infra universe metadata (layer/depth/pool/source-review status)\",\"intraday large-order flow or order-book imbalance to confirm true absorption before production use\",\"beta-hedged sleeve attribution vs 000300.SH and 399006.SZ\"]", "failure_mode": "It should break when the market shifts into one-way policy/news momentum or panic liquidation, because negative daily autocorrelation disappears and stable-amount names stop representing accumulation.", "report_contract": "research_only", "ai_supercycle_layer": "ai_networking_optical_cpo", "supply_chain_hypothesis": "Optical/fiber/CPO bottleneck names inside the validated AI universe should show repeated daily shakeouts but a persistent amount base as funds accumulate ahead of formally verified order and capex evidence.", "relationship_evidence_required": "true", "money_readiness": "research_only", "decision": "revert", "session_branch": "main", "base_ref": "origin/main", "merge_base": "89f7b3a20c7d57ca0056b8bff0a3403328f00c52", "head_commit": "89f7b3a20c7d57ca0056b8bff0a3403328f00c52"}
{"ts": "2026-05-18T14:56:05.857628+08:00", "session_id": "20260518_140003_036b53", "market": "cn", "formula": "rank(ts_mean(amount/circ_market_cap,20)/(ts_std(ret_1d,20)+0.01))", "name": "float_absorption_efficiency_20", "is_ic": 0.0, "is_ic_ir": 0.0, "is_sharpe": 0.0, "is_turnover": 0.0, "is_monotonicity": 0.0, "gates": "FAIL", "status": "reverted", "eval_seconds": 103.1, "sleeve_id": "cn_ai_infra_accumulation", "mispricing_source": "Underreaction to early AI capex bottleneck repricing; the market waits for explicit confirmation while informed capital accumulates quietly in liquid supply-chain names.", "forced_counterparty": "Retail T+1 traders and benchmark-constrained PMs who reduce or ignore low-excitement consolidations before headline confirmation.", "data_requirements": "[\"current CN daily price/volume/daily_basic are sufficient for signal research\",\"before promotion require beta-hedged sleeve PnL, residual risk attribution, drawdown, and correlation to existing sleeves\",\"if a named supplier/customer narrative is attached, require filings/press-release/transcript source review\"]", "failure_mode": "Fails when high float-normalized amount reflects distribution or de-risking instead of accumulation, or when volatility-shock/theme-rotation regimes dominate and low-vol absorption no longer leads price.", "report_contract": "fresh_buy_gate", "ai_supercycle_layer": "ai_networking_optical_cpo", "supply_chain_hypothesis": "D1-D3 AI interconnect and datacenter bottleneck suppliers in the validated CN universe should show quiet float absorption before explicit order visibility is fully priced.", "relationship_evidence_required": "true", "money_readiness": "money_candidate", "decision": "revert", "session_branch": "main", "base_ref": "origin/main", "merge_base": "89f7b3a20c7d57ca0056b8bff0a3403328f00c52", "head_commit": "89f7b3a20c7d57ca0056b8bff0a3403328f00c52"}
{"ts": "2026-05-18T14:56:05.857628+08:00", "session_id": "20260518_140003_036b53", "market": "cn", "formula": "rank(-ts_std(pct_change(turnover_rate,5),20))", "name": "turnover_growth_stability_20", "is_ic": 0.0, "is_ic_ir": 0.0, "is_sharpe": 0.0, "is_turnover": 0.0, "is_monotonicity": 0.0, "gates": "FAIL", "status": "reverted", "eval_seconds": 173.1, "sleeve_id": "daily_flow_underreaction", "mispricing_source": "The market overpays for visible turnover bursts and underreacts to steady participation paths that reflect patient accumulation.", "forced_counterparty": "Retail theme chasers and benchmark/redemption-constrained funds trading for liquidity or mandate reasons rather than 10-20 day alpha", "data_requirements": "[\"turnover_rate\",\"ai_infra universe tags\",\"beta-hedged sleeve attribution vs 000300.SH and 399006.SZ\",\"rolling corr vs kshadow_5\",\"sleeve drawdown and residual risk attribution\",\"filings/PRs/transcripts only if attaching supplier/order narrative\"]", "failure_mode": "Fails in policy-shock or speculative chase regimes where bursty turnover is genuinely informative, or when smooth turnover change is just illiquidity/neglect rather than accumulation.", "report_contract": "setup_overlay", "ai_supercycle_layer": "ai_chip_equipment_materials_packaging", "supply_chain_hypothesis": "Validated CN semicap, packaging, and test bottleneck names should show smoother weekly turnover-change paths than downstream narrative chasers while institutions accumulate ahead of source-reviewed order/backlog evidence.", "relationship_evidence_required": "true", "money_readiness": "research_only", "decision": "revert", "session_branch": "main", "base_ref": "origin/main", "merge_base": "89f7b3a20c7d57ca0056b8bff0a3403328f00c52", "head_commit": "89f7b3a20c7d57ca0056b8bff0a3403328f00c52"}
{"ts": "2026-05-18T14:56:05.857628+08:00", "session_id": "20260518_140003_036b53", "market": "cn", "formula": "rank(ts_mean(amount,20)/(ts_std(amount,20)+0.01))", "name": "amount_stability_ratio_20", "is_ic": 0.0, "is_ic_ir": 0.0, "is_sharpe": 0.0, "is_turnover": 0.0, "is_monotonicity": 0.0, "gates": "FAIL", "status": "reverted", "eval_seconds": 100.4, "sleeve_id": "cn_ai_flow_accumulation", "mispricing_source": "T+1 liquidity constraints force patient accumulation in scarce AI-infra names, and the market underreacts to that steady sponsorship until later fundamental confirmation.", "forced_counterparty": "Short-horizon retail momentum traders and benchmark-constrained holders rotating out of quiet consolidations.", "data_requirements": "[\"beta-hedged sleeve return\",\"residual return attribution\",\"corr vs existing sleeves\",\"sleeve drawdown\",\"AI-universe source-review status\",\"filings/press releases if mapping winners to specific optical/CPO relationships\"]", "failure_mode": "It stops working when rumor-driven speculative rotations or broad deleveraging make unstable high-churn names outperform steady institutional sponsorship.", "report_contract": "fresh_buy_gate", "ai_supercycle_layer": "ai_networking_optical_cpo", "supply_chain_hypothesis": "Stable amount accumulation may be front-running optical/fiber interconnect order visibility for AI datacenter buildouts.", "relationship_evidence_required": "true", "money_readiness": "money_candidate", "decision": "revert", "session_branch": "main", "base_ref": "origin/main", "merge_base": "89f7b3a20c7d57ca0056b8bff0a3403328f00c52", "head_commit": "89f7b3a20c7d57ca0056b8bff0a3403328f00c52"}
{"ts": "2026-05-18T14:56:05.857628+08:00", "session_id": "20260518_140003_036b53", "market": "cn", "formula": "rank(-ps_ttm) * rank(ts_mean(amount / circ_market_cap, 20))", "name": "float_value_absorption_20", "is_ic": 0.0, "is_ic_ir": 0.0, "is_sharpe": 0.0, "is_turnover": 0.0, "is_monotonicity": 0.0, "gates": "FAIL", "status": "reverted", "eval_seconds": 133.5, "sleeve_id": "cn_ai_infra_flow_value", "mispricing_source": "Slow recognition of AI capex/order transmission into lower-multiple infra names; cross-sectional valuation anchoring delays repricing even after steady capital absorption starts.", "forced_counterparty": "Benchmarked growth managers structurally underweight lower-PS hardware/infra names until revenue proof prints, while retail capital prefers higher-story, already-expensive theme names.", "data_requirements": "[\"daily amount\",\"circ_market_cap\",\"ps_ttm\",\"canonical ai_infra universe membership\",\"beta-hedged sleeve attribution vs 000300.SH/399006.SZ\"]", "failure_mode": "It stops working when high float-adjusted amount is distribution rather than accumulation, or when speculative high-PS momentum dominates fundamental rerating.", "report_contract": "setup_overlay", "ai_supercycle_layer": "none", "supply_chain_hypothesis": "none", "relationship_evidence_required": "false", "money_readiness": "research_only", "decision": "revert", "session_branch": "main", "base_ref": "origin/main", "merge_base": "89f7b3a20c7d57ca0056b8bff0a3403328f00c52", "head_commit": "89f7b3a20c7d57ca0056b8bff0a3403328f00c52"}
{"ts": "2026-05-18T14:56:05.857628+08:00", "session_id": "20260518_140003_036b53", "market": "cn", "formula": "rank(-ts_std(delta(log(amount),5),20))", "name": "weekly_log_amount_stability_20", "is_ic": 0.0, "is_ic_ir": 0.0, "is_sharpe": 0.0, "is_turnover": 0.0, "is_monotonicity": 0.0, "gates": "FAIL", "status": "reverted", "eval_seconds": 170.1, "sleeve_id": "cn_ai_infra_accumulation", "mispricing_source": "Patient accumulation in bottleneck AI-infra names is gradual, but A-share attention is dominated by short-horizon headline and spike chasing, so smooth value-flow gets underpriced until trend confirmation arrives.", "forced_counterparty": "short-horizon retail spike-chasers and benchmark-aware managers who only add after obvious breakouts", "data_requirements": "[\"daily OHLCV+amount for canonical CN AI universe\",\"ai_infra source-review status for ranked names\",\"beta-hedged sleeve attribution vs 000300.SH and 399006.SZ\",\"correlation check vs kshadow_5 and amount-stability family\"]", "failure_mode": "Fails in rumor-squeeze or macro deleveraging regimes where gap moves and forced liquidity dominate, so smooth flow no longer signals informed accumulation.", "report_contract": "setup_overlay", "ai_supercycle_layer": "ai_datacenter_edge_infra", "supply_chain_hypothesis": "Steady weekly value-flow can surface datacenter, interconnect, and power bottleneck names being accumulated before AI capex/order evidence is fully confirmed in filings or official releases.", "relationship_evidence_required": "true", "money_readiness": "research_only", "decision": "revert", "session_branch": "main", "base_ref": "origin/main", "merge_base": "89f7b3a20c7d57ca0056b8bff0a3403328f00c52", "head_commit": "89f7b3a20c7d57ca0056b8bff0a3403328f00c52"}
{"ts": "2026-05-18T14:56:05.857628+08:00", "session_id": "20260518_140003_036b53", "market": "cn", "formula": "rank((ts_std(amount,60)/ts_std(amount,20))/(ts_max(turnover_rate,20)/(ts_mean(turnover_rate,20)+0.01)))", "name": "quiet_amount_spikefree_compress_20_60", "is_ic": 0.0, "is_ic_ir": 0.0, "is_sharpe": 0.0, "is_turnover": 0.0, "is_monotonicity": 0.0, "gates": "FAIL", "status": "reverted", "eval_seconds": 215.6, "sleeve_id": "cn_aiinfra_accumulation", "mispricing_source": "Underreaction to quiet institutional accumulation; the market over-rewards noisy turnover bursts and underprices stable float absorption in bottleneck names.", "forced_counterparty": "Retail breakout chasers and benchmarked funds that wait for explicit news, orders, or earnings confirmation before adding.", "data_requirements": "[\"current daily amount and turnover_rate are sufficient for IS test\",\"before promotion: corr vs amount_stability_20 and turnover_stability_20\",\"beta-hedged sleeve attribution vs 000300.SH and 399006.SZ\",\"residual risk and drawdown by AI universe sub-pool\"]", "failure_mode": "Fails in policy-beta or retail-chasing regimes where turnover spikes carry true information, or in liquidity droughts where compressed amount reflects illiquidity rather than accumulation.", "report_contract": "setup_overlay", "ai_supercycle_layer": "none", "supply_chain_hypothesis": "Candidate AI-infra bottleneck suppliers are being accumulated before verified order/backlog evidence is visible in filings or official releases.", "relationship_evidence_required": "true", "money_readiness": "research_only", "decision": "revert", "session_branch": "main", "base_ref": "origin/main", "merge_base": "89f7b3a20c7d57ca0056b8bff0a3403328f00c52", "head_commit": "89f7b3a20c7d57ca0056b8bff0a3403328f00c52"}
