{"ts": "2026-05-11T14:56:11.601126+08:00", "session_id": "20260511_140003_5e5559", "market": "cn", "formula": "rank(ts_mean(volume_ratio,20)/ts_max(volume_ratio,20))*rank(-ts_max(ret_1d,20))", "name": "low_lottery_relvol_evenness_20", "is_ic": 0.0406, "is_ic_ir": 0.29, "is_sharpe": -0.328, "is_turnover": 0.108, "is_monotonicity": 0.0, "gates": "PASS", "status": "checks_failed", "eval_seconds": 274.3, "sleeve_id": "attention_avoidance_flow", "mispricing_source": "Attention-constrained retail capital chases bursty participation, while informed accumulation is sliced across days and gets underreacted to over the next 10-20 trading days.", "forced_counterparty": "retail attention traders chasing hot prints; secondarily flow-driven holders selling for liquidity rather than expected return", "data_requirements": "[\"volume_ratio\",\"ret_1d\"]", "failure_mode": "It weakens in mania or strong trend-chasing regimes where high-attention names keep outperforming and bursty participation no longer mean-reverts.", "report_contract": "fresh_buy_gate", "money_readiness": "money_candidate", "decision": "revert", "session_branch": "main", "base_ref": "origin/main", "merge_base": "62e27b1718a9c8c7cee619126770fe57cd98d173", "head_commit": "62e27b1718a9c8c7cee619126770fe57cd98d173", "oos": "PASS", "checks_status": "failed"}
{"ts": "2026-05-11T14:56:11.601126+08:00", "session_id": "20260511_140003_5e5559", "market": "cn", "formula": "rank(-ts_std(delta(amount/circ_market_cap,5),20))", "name": "weekly_floatflow_stability_20", "is_ic": 0.0253, "is_ic_ir": 0.151, "is_sharpe": -0.58, "is_turnover": 0.042, "is_monotonicity": -0.05, "gates": "FAIL", "status": "reverted", "eval_seconds": 168.1, "sleeve_id": "float_flow_evenness", "mispricing_source": "Underreaction to steady float-level absorption and sponsorship; the signal is about the path of participation per unit of float, not a repackaged short-horizon price factor.", "forced_counterparty": "none; the opposite side is mainly attention-constrained retail and liquidity-motivated traders who overpay for bursty names and neglect orderly ones", "data_requirements": "[\"amount\",\"circ_market_cap\"]", "failure_mode": "It should weaken in speculative squeeze regimes where unstable turnover bursts outperform orderly accumulation, or when float data quality degrades.", "report_contract": "fresh_buy_gate", "money_readiness": "money_candidate", "decision": "revert", "session_branch": "main", "base_ref": "origin/main", "merge_base": "62e27b1718a9c8c7cee619126770fe57cd98d173", "head_commit": "62e27b1718a9c8c7cee619126770fe57cd98d173"}
{"ts": "2026-05-11T14:56:11.601126+08:00", "session_id": "20260511_140003_5e5559", "market": "cn", "formula": "rank(-ts_kurt(amount,40))", "name": "amount_burstiness_40", "is_ic": -0.0058, "is_ic_ir": -0.061, "is_sharpe": -2.73, "is_turnover": 0.11, "is_monotonicity": 0.2, "gates": "FAIL", "status": "reverted", "eval_seconds": 144.3, "sleeve_id": "daily_flow_quality", "mispricing_source": "underreaction to steady capital accumulation and overreaction to episodic attention shocks; this is a flow-shape signal, not a high-correlation price-path variant", "forced_counterparty": "retail attention traders and open-end fund flow desks handling subscriptions/redemptions", "data_requirements": "[amount]", "failure_mode": "fails when bursty amount carries genuine new information in a strong trend regime, or when the signal degrades into a pure illiquidity proxy", "report_contract": "fresh_buy_gate", "money_readiness": "money_candidate", "decision": "revert", "session_branch": "main", "base_ref": "origin/main", "merge_base": "62e27b1718a9c8c7cee619126770fe57cd98d173", "head_commit": "62e27b1718a9c8c7cee619126770fe57cd98d173"}
{"ts": "2026-05-11T14:56:11.601126+08:00", "session_id": "20260511_140003_5e5559", "market": "cn", "formula": "rank(-pb) * rank(ts_mean(turnover_rate,20)/ts_max(turnover_rate,20))", "name": "cheap_turnover_uniform_20", "is_ic": 0.03, "is_ic_ir": 0.186, "is_sharpe": -0.685, "is_turnover": 0.091, "is_monotonicity": -0.1, "gates": "FAIL", "status": "reverted", "eval_seconds": 181.9, "sleeve_id": "valuation_flow_quality", "mispricing_source": "Retail/narrative capital overpays for spiky attention while benchmarked managers under-own boring low-PB names; this is a valuation-plus-flow concentration sleeve, not a close/volume correlation clone.", "forced_counterparty": "retail theme traders and benchmarked long-only managers with career-risk constraints", "data_requirements": "[\"pb\",\"turnover_rate\"]", "failure_mode": "Fails if low-PB becomes a crowded policy trade, if spiky turnover starts carrying genuine information instead of speculative noise, or if deep-value traps dominate the cheap leg.", "report_contract": "fresh_buy_gate", "money_readiness": "money_candidate", "decision": "revert", "session_branch": "main", "base_ref": "origin/main", "merge_base": "62e27b1718a9c8c7cee619126770fe57cd98d173", "head_commit": "62e27b1718a9c8c7cee619126770fe57cd98d173"}
{"ts": "2026-05-11T14:56:11.601126+08:00", "session_id": "20260511_140003_5e5559", "market": "cn", "formula": "rank(-ts_corr(amount/circ_market_cap,shift(amount/circ_market_cap,5),20))*rank(-ts_std(amount/circ_market_cap,20)/ts_mean(amount/circ_market_cap,20))", "name": "anti_autocorr_weekly_float_smooth_20", "is_ic": 0.0168, "is_ic_ir": 0.172, "is_sharpe": -0.316, "is_turnover": 0.161, "is_monotonicity": 0.55, "gates": "FAIL", "status": "reverted", "eval_seconds": 165.5, "sleeve_id": "weekly_flow_absorption", "mispricing_source": "Calendar-driven flow shocks and slow-moving capital create temporary overhangs; anti-persistent but orderly float-scaled flow signals absorption rather than crowding, which is different from pure price momentum/reversal.", "forced_counterparty": "Retail traders and benchmarked/redeeming funds that must trade around weekly liquidity windows", "data_requirements": "[\"amount\",\"circ_market_cap\"]", "failure_mode": "Breaks in one-way momentum/speculation regimes where persistent crowding is rewarded, or if float-scaled flow becomes a stale crowded screen itself.", "report_contract": "fresh_buy_gate", "money_readiness": "money_candidate", "decision": "revert", "session_branch": "main", "base_ref": "origin/main", "merge_base": "62e27b1718a9c8c7cee619126770fe57cd98d173", "head_commit": "62e27b1718a9c8c7cee619126770fe57cd98d173"}
{"ts": "2026-05-11T14:56:11.601126+08:00", "session_id": "20260511_140003_5e5559", "market": "cn", "formula": "rank(-ts_std(delta(log(amount),5),20))*rank(ts_mean(ts_sum(volume_ratio,5),20)/ts_max(ts_sum(volume_ratio,5),20))", "name": "log_amountchg_weekly_relvol_even_20", "is_ic": 0.0387, "is_ic_ir": 0.358, "is_sharpe": 1.832, "is_turnover": 0.102, "is_monotonicity": 0.15, "gates": "PASS", "status": "candidate", "eval_seconds": 154.2, "sleeve_id": "weekly_flow_underreaction", "mispricing_source": "Slow recognition of steady sponsorship and attention segmentation; this uses the time-shape of amount and relative participation, not raw trend, reversal, or close-volume correlation.", "forced_counterparty": "Retail attention chasers and benchmark/rebalance or redemption-driven funds trading for liquidity or mandate rather than 10-20 day alpha.", "data_requirements": "[\"amount\",\"volume_ratio\"]; for money-ready deployment, add intraday order-flow or member-trade ledger to distinguish true accumulation from dead illiquidity.", "failure_mode": "Fails when theme/policy momentum rewards bursty attention immediately, or when smooth amount and volume_ratio mainly reflect illiquidity stagnation rather than real accumulation.", "report_contract": "fresh_buy_gate", "money_readiness": "money_candidate", "decision": "candidate", "session_branch": "main", "base_ref": "origin/main", "merge_base": "62e27b1718a9c8c7cee619126770fe57cd98d173", "head_commit": "62e27b1718a9c8c7cee619126770fe57cd98d173"}
{"ts": "2026-05-11T14:56:11.601126+08:00", "session_id": "20260511_140003_5e5559", "market": "cn", "formula": "rank(-ts_std(delta(log(amount),5),20)) * rank(ts_mean(turnover_rate,20)/ts_max(turnover_rate,20))", "name": "log_amountchg_turnover_even_20", "is_ic": 0.0365, "is_ic_ir": 0.338, "is_sharpe": 0.952, "is_turnover": 0.113, "is_monotonicity": 0.35, "gates": "PASS", "status": "candidate", "eval_seconds": 202.2, "sleeve_id": "daily_flow_quality", "mispricing_source": "Underreaction to stealth accumulation and overreaction to visible turnover spikes; the signal targets participation-path quality, not a close-only price pattern.", "forced_counterparty": "Retail momentum chasers and benchmark/redemption-constrained funds that trade in bursts rather than drip orders evenly.", "data_requirements": "[\"amount\",\"turnover_rate\"]", "failure_mode": "Stops working when policy/news shock regimes dominate flow quality, or when bursty turnover becomes genuinely informed instead of a crowding artifact.", "report_contract": "fresh_buy_gate", "money_readiness": "money_candidate", "decision": "candidate", "session_branch": "main", "base_ref": "origin/main", "merge_base": "62e27b1718a9c8c7cee619126770fe57cd98d173", "head_commit": "62e27b1718a9c8c7cee619126770fe57cd98d173"}
{"ts": "2026-05-11T14:56:11.601126+08:00", "session_id": "20260511_140003_5e5559", "market": "cn", "formula": "rank(ts_min(ts_sum(amount/circ_market_cap,5),20)*ts_mean(ts_sum(turnover_rate,5),20)/(ts_max(ts_sum(amount/circ_market_cap,5),20)*ts_max(ts_sum(turnover_rate,5),20)))", "name": "float_support_turnover_even_20", "is_ic": 0.0282, "is_ic_ir": 0.284, "is_sharpe": 0.635, "is_turnover": 0.112, "is_monotonicity": 0.8, "gates": "PASS", "status": "candidate", "eval_seconds": 220.9, "sleeve_id": "weekly_float_share_absorption", "mispricing_source": "Retail attention overweights bursty participation and recent stories, while steady ownership transfer per unit of float is incorporated slowly.", "forced_counterparty": "Retail attention traders, plus benchmark/redemption-constrained long-only funds that must supply liquidity for mandate reasons rather than alpha timing.", "data_requirements": "[\"amount\",\"circ_market_cap\",\"turnover_rate\"]; intraday member/broker flow ledger is still required before money-ready deployment to distinguish true absorption from passive churn or dead liquidity.", "failure_mode": "Fails when smooth weekly flow mostly reflects illiquidity/passive index churn, or in policy/speculative regimes where bursty turnover leaders outperform and quiet absorption stops being rewarded.", "report_contract": "setup_overlay", "money_readiness": "research_only", "decision": "candidate", "session_branch": "main", "base_ref": "origin/main", "merge_base": "62e27b1718a9c8c7cee619126770fe57cd98d173", "head_commit": "62e27b1718a9c8c7cee619126770fe57cd98d173"}
{"ts": "2026-05-11T14:56:11.601126+08:00", "session_id": "20260511_140003_5e5559", "market": "cn", "formula": "rank(-ts_std(pct_change(amount/circ_market_cap,5),20))*rank(ts_mean((close-open)/(high-low+0.01),20))", "name": "weekly_floatchg_body_bias_20", "is_ic": 0.0415, "is_ic_ir": 0.247, "is_sharpe": 1.008, "is_turnover": 0.152, "is_monotonicity": 0.85, "gates": "PASS", "status": "checks_failed", "eval_seconds": 209.6, "sleeve_id": "float_flow_underreaction", "mispricing_source": "Underreaction to quiet float-normalized accumulation; retail attention capital prefers bursty lottery tapes, so steady sponsorship with mild closing pressure reprices only gradually.", "forced_counterparty": "retail attention traders and benchmark/redemption-constrained funds rotating or selling for mandate/liquidity reasons rather than 10-20 day alpha", "data_requirements": "[\"amount\",\"circ_market_cap\",\"open\",\"close\",\"high\",\"low\"]", "failure_mode": "Breaks in policy/headline momentum, price-limit, or illiquidity regimes where positive body bias reflects crowding or dead liquidity rather than informed absorption.", "report_contract": "fresh_buy_gate", "money_readiness": "money_candidate", "decision": "revert", "session_branch": "main", "base_ref": "origin/main", "merge_base": "62e27b1718a9c8c7cee619126770fe57cd98d173", "head_commit": "62e27b1718a9c8c7cee619126770fe57cd98d173", "oos": "PASS", "checks_status": "failed"}
{"ts": "2026-05-11T14:56:11.601126+08:00", "session_id": "20260511_140003_5e5559", "market": "cn", "formula": "rank(ts_mean(turnover_rate,20)/ts_max(turnover_rate,20))*rank(-ts_mean(volume_ratio,5))", "name": "uncrowded_turnover_evenness_20_5", "is_ic": 0.0338, "is_ic_ir": 0.309, "is_sharpe": -0.447, "is_turnover": 0.192, "is_monotonicity": 0.0, "gates": "PASS", "status": "candidate", "eval_seconds": 172.5, "sleeve_id": "daily_flow_quality", "mispricing_source": "Attention and lottery preference overprice turnover spikes; steady uncrowded participation gets recognized with a lag.", "forced_counterparty": "Short-horizon retail chasers and event-driven liquidity takers who concentrate in high-relvol names, plus benchmarked managers who ignore low-attention drifts.", "data_requirements": "[\"turnover_rate\",\"volume_ratio\"]", "failure_mode": "Fails in retail-mania or policy-beta regimes when crowded high-volume names lead, or if low volume_ratio simply identifies dead liquidity instead of patient accumulation.", "report_contract": "research_only", "money_readiness": "research_only", "decision": "candidate", "session_branch": "main", "base_ref": "origin/main", "merge_base": "62e27b1718a9c8c7cee619126770fe57cd98d173", "head_commit": "62e27b1718a9c8c7cee619126770fe57cd98d173"}
{"ts": "2026-05-11T14:56:11.601126+08:00", "session_id": "20260511_140003_5e5559", "market": "cn", "formula": "rank(-ts_corr(ret_1d,shift(ret_1d,1),20))*rank(ts_mean(ts_sum(amount/circ_market_cap,5),20)/ts_max(ts_sum(amount/circ_market_cap,5),20))", "name": "anti_autocorr_weekly_float_evenness_20", "is_ic": 0.0372, "is_ic_ir": 0.479, "is_sharpe": 3.218, "is_turnover": 0.171, "is_monotonicity": 0.45, "gates": "PASS", "status": "candidate", "eval_seconds": 132.4, "sleeve_id": "anti_autocorr_float_absorption", "mispricing_source": "Short-horizon price pressure gets overreacted to, while steady float-aware participation is underweighted; this is a flow-shape plus return-path sleeve, not another close-volume correlation or raw range factor.", "forced_counterparty": "retail attention traders, redemption-driven long-only sellers, benchmark/rebalance-constrained funds", "data_requirements": "[\"ret_1d\",\"amount\",\"circ_market_cap\"]; daily data is enough for research, but intraday/member-level flow is useful before money-ready deployment to separate real accumulation from passive churn", "failure_mode": "Fails in policy/theme momentum regimes where positive autocorrelation is informative, or when smooth float turnover is mostly dead illiquidity/passive flow rather than sponsorship", "report_contract": "fresh_buy_gate", "money_readiness": "money_candidate", "decision": "candidate", "session_branch": "main", "base_ref": "origin/main", "merge_base": "62e27b1718a9c8c7cee619126770fe57cd98d173", "head_commit": "62e27b1718a9c8c7cee619126770fe57cd98d173"}
{"ts": "2026-05-11T14:56:11.601126+08:00", "session_id": "20260511_140003_5e5559", "market": "cn", "formula": "rank(ts_mean(volume_ratio,5) / (1 + ts_std(volume_ratio,20)))", "name": "orderly_relvol_buildup_5_20", "is_ic": -0.0083, "is_ic_ir": -0.074, "is_sharpe": -2.986, "is_turnover": 0.199, "is_monotonicity": -0.05, "gates": "FAIL", "status": "reverted", "eval_seconds": 89.0, "sleeve_id": "daily_flow_overlay", "mispricing_source": "Slow-moving demand under implementation frictions; persistent abnormal participation is only gradually incorporated into prices.", "forced_counterparty": "none; structural constraint is benchmarked institutional execution spread across days under impact, T+1, and price-limit frictions", "data_requirements": "[\"daily volume_ratio for signal\", \"daily returns/close for beta hedge and residual risk attribution\"]", "failure_mode": "Fails when volume is dominated by headline/event bursts or broad liquidity beta, so smooth relative-volume buildup no longer distinguishes informed accumulation from indiscriminate crowding.", "report_contract": "setup_overlay", "money_readiness": "research_only", "decision": "revert", "session_branch": "main", "base_ref": "origin/main", "merge_base": "62e27b1718a9c8c7cee619126770fe57cd98d173", "head_commit": "62e27b1718a9c8c7cee619126770fe57cd98d173"}
{"ts": "2026-05-12T06:57:50.072917+08:00", "session_id": "20260512_060001_b3afec", "market": "cn", "formula": "rank(ts_mean(turnover_rate, 20) / log(circ_market_cap))", "name": "float_turnover_crowding_20", "is_ic": 0.0238, "is_ic_ir": 0.142, "is_sharpe": -0.74, "is_turnover": 0.02, "is_monotonicity": -0.2, "gates": "FAIL", "status": "reverted", "eval_seconds": 59.8, "sleeve_id": "liquidity_crowding_overlay", "mispricing_source": "Limited free float plus retail/theme-flow churn can push crowded names above fundamental clearing levels; the unwind happens when flow intensity normalizes.", "forced_counterparty": "Uneconomic retail attention traders and small theme funds that must stay engaged in the hottest, most tradable names.", "data_requirements": "[\"turnover_rate\", \"circ_market_cap\"]", "failure_mode": "Fails in policy/liquidity-driven speculative melt-ups where crowded small-float names keep receiving fresh inflows instead of mean-reverting.", "report_contract": "fresh_buy_gate", "money_readiness": "money_candidate", "decision": "revert", "session_branch": "main", "base_ref": "origin/main", "merge_base": "62e27b1718a9c8c7cee619126770fe57cd98d173", "head_commit": "62e27b1718a9c8c7cee619126770fe57cd98d173"}
{"ts": "2026-05-12T06:57:50.072917+08:00", "session_id": "20260512_060001_b3afec", "market": "cn", "formula": "rank(ts_mean(amount,20)/ts_std(amount,20)) * rank(-ret_20d)", "name": "amount_absorption_reversal_20", "is_ic": 0.0374, "is_ic_ir": 0.269, "is_sharpe": -0.964, "is_turnover": 0.154, "is_monotonicity": 0.0, "gates": "PASS", "status": "candidate", "eval_seconds": 97.9, "sleeve_id": "daily_flow_reversal", "mispricing_source": "Slow-moving capital underreacts to quiet accumulation; stable traded value during a drawdown signals absorption rather than panic, which is distinct from pure price momentum or short-horizon price-volume correlation.", "forced_counterparty": "retail/margin-constrained holders and redemption-driven sellers", "data_requirements": "[\"amount\",\"ret_20d\"]", "failure_mode": "It fails when the drawdown is information-driven and stable amount reflects informed distribution, or when broad deleveraging keeps forced selling active beyond the 10-20 day horizon.", "report_contract": "fresh_buy_gate", "money_readiness": "money_candidate", "decision": "candidate", "session_branch": "main", "base_ref": "origin/main", "merge_base": "62e27b1718a9c8c7cee619126770fe57cd98d173", "head_commit": "62e27b1718a9c8c7cee619126770fe57cd98d173"}
{"ts": "2026-05-12T06:57:50.072917+08:00", "session_id": "20260512_060001_b3afec", "market": "cn", "formula": "rank(ts_mean(amount / circ_market_cap,20) / ts_max(amount / circ_market_cap,20)) * rank(-ts_mean(abs(close / open - 1),10))", "name": "float_even_body_absorption_20", "is_ic": 0.0452, "is_ic_ir": 0.299, "is_sharpe": -0.716, "is_turnover": 0.15, "is_monotonicity": -0.05, "gates": "PASS", "status": "checks_failed", "eval_seconds": 181.1, "sleeve_id": "daily_flow_absorption", "mispricing_source": "Underreaction to quiet accumulation; this is not a close-volume correlation clone because it measures float-normalized flow evenness plus intraday body compression, not price-volume comovement.", "forced_counterparty": "Retail headline traders and liquidity-motivated sellers or rebalancers who provide stock into a persistent bid without demanding an immediate repricing", "data_requirements": "[\"amount\",\"circ_market_cap\",\"open\",\"close\"]", "failure_mode": "Fails when small bodies reflect illiquidity or price limits rather than absorption, or in fast policy/news regimes where information is impounded immediately and underreaction disappears.", "report_contract": "research_only", "money_readiness": "research_only", "decision": "revert", "session_branch": "main", "base_ref": "origin/main", "merge_base": "62e27b1718a9c8c7cee619126770fe57cd98d173", "head_commit": "62e27b1718a9c8c7cee619126770fe57cd98d173", "oos": "PASS", "checks_status": "failed"}
{"ts": "2026-05-12T06:57:50.072917+08:00", "session_id": "20260512_060001_b3afec", "market": "cn", "formula": "rank(-ts_max(ret_1d,20))*rank(ts_mean(turnover_rate,20)/ts_max(turnover_rate,20))", "name": "low_lottery_turnover_evenness_20", "is_ic": 0.0404, "is_ic_ir": 0.286, "is_sharpe": 0.21, "is_turnover": 0.112, "is_monotonicity": 0.0, "gates": "PASS", "status": "candidate", "eval_seconds": 225.3, "sleeve_id": "daily_ownership_transfer", "mispricing_source": "Retail lottery preference and spike-day attention overprice flashy names; boring names with even participation are under-owned, and this targets participation concentration rather than another close-volume correlation variant.", "forced_counterparty": "Retail spike chasers; long-only mutual funds and insurance accounts that must slice accumulation across many sessions", "data_requirements": "[\"ret_1d\",\"turnover_rate\"]", "failure_mode": "This stops working in momentum-chasing or policy-squeeze regimes where concentrated spike days carry real information and lottery demand remains rewarded.", "report_contract": "fresh_buy_gate", "money_readiness": "money_candidate", "decision": "candidate", "session_branch": "main", "base_ref": "origin/main", "merge_base": "62e27b1718a9c8c7cee619126770fe57cd98d173", "head_commit": "62e27b1718a9c8c7cee619126770fe57cd98d173"}
