{"ts": "2026-05-07T06:58:43.620034+08:00", "session_id": "20260507_060002_3ed25b", "market": "cn", "formula": "rank(ts_mean(amount/circ_market_cap,20)/ts_std(amount/circ_market_cap,20))*rank(-ts_corr(ret_1d,shift(ret_1d,1),20))", "name": "anti_autocorr_float_absorb_20", "is_ic": 0.0399, "is_ic_ir": 0.495, "is_sharpe": 3.724, "is_turnover": 0.166, "is_monotonicity": 0.35, "gates": "PASS", "status": "candidate", "eval_seconds": 175.2, "sleeve_id": "float_flow_underreaction", "mispricing_source": "Quiet float-normalized absorption is harder for attention-driven participants to price than bursty price moves; the anti-autocorr leg avoids crowded momentum tapes and focuses on hidden accumulation rather than breakout chasing.", "forced_counterparty": "Retail momentum chasers and liquidity-motivated sellers from rebalancing/unlock/exit flow who sell into steady bids without optimizing for medium-horizon alpha.", "data_requirements": "[\"amount\",\"circ_market_cap\",\"ret_1d\"]", "failure_mode": "Fails in speculative trend regimes where breakout continuation dominates mean reversion, or when float data is distorted by corporate actions and no longer reflects true tradable supply.", "report_contract": "fresh_buy_gate", "money_readiness": "money_candidate", "decision": "candidate", "session_branch": "main", "base_ref": "origin/main", "merge_base": "4613286185edb21bc292ba5db14282c0f26c8943", "head_commit": "4613286185edb21bc292ba5db14282c0f26c8943"}
{"ts": "2026-05-07T06:58:43.620034+08:00", "session_id": "20260507_060002_3ed25b", "market": "cn", "formula": "rank(-ts_corr(ret_1d,shift(ret_1d,1),20))*rank(ts_min(turnover_rate,20)/ts_max(turnover_rate,20))", "name": "anti_autocorr_turnover_corridor_20", "is_ic": 0.0383, "is_ic_ir": 0.49, "is_sharpe": 4.135, "is_turnover": 0.169, "is_monotonicity": 0.4, "gates": "PASS", "status": "candidate", "eval_seconds": 176.6, "sleeve_id": "daily_turnover_underreaction", "mispricing_source": "Slow underreaction to quiet accumulation; noisy retail prints mask the inventory transfer until stronger hands finish absorbing supply.", "forced_counterparty": "Retail chasers and T+1 constrained exit sellers; secondarily benchmarked funds trading for liquidity rather than alpha.", "data_requirements": "[\"close (for ret_1d)\", \"turnover_rate\"]", "failure_mode": "Fails in momentum-chasing/speculative regimes where return autocorr turns positive or turnover spikes break the corridor.", "report_contract": "fresh_buy_gate", "money_readiness": "money_candidate", "decision": "candidate", "session_branch": "main", "base_ref": "origin/main", "merge_base": "4613286185edb21bc292ba5db14282c0f26c8943", "head_commit": "4613286185edb21bc292ba5db14282c0f26c8943"}
{"ts": "2026-05-07T06:58:43.620034+08:00", "session_id": "20260507_060002_3ed25b", "market": "cn", "formula": "rank(-ts_corr(ret_1d,shift(ret_1d,1),20))*rank(ts_min(ts_sum(volume,5),20)/ts_std(ts_sum(volume,5),20))", "name": "anti_autocorr_weekly_volume_floorstd_20", "is_ic": 0.0381, "is_ic_ir": 0.46, "is_sharpe": 4.465, "is_turnover": 0.151, "is_monotonicity": 0.6, "gates": "PASS", "status": "candidate", "eval_seconds": 161.1, "sleeve_id": "anti_autocorr_participation_floor", "mispricing_source": "Underreaction to persistent sponsored participation masked by noisy daily mean reversion; distinct from surge-style volume factors because it rewards non-collapsing weekly flow support rather than bursts", "forced_counterparty": "short-horizon retail churn traders, benchmark/rebalance flows, and liquidity-motivated sellers", "data_requirements": "[\"ret_1d\",\"volume\"]; intraday order-flow or member-level trade ledger is still needed before money-ready deployment to verify true absorption", "failure_mode": "Fails when a high volume floor reflects crowding/distribution or one-way speculative momentum instead of informed sponsorship", "report_contract": "setup_overlay", "money_readiness": "research_only", "decision": "candidate", "session_branch": "main", "base_ref": "origin/main", "merge_base": "4613286185edb21bc292ba5db14282c0f26c8943", "head_commit": "4613286185edb21bc292ba5db14282c0f26c8943"}
{"ts": "2026-05-07T06:58:43.620034+08:00", "session_id": "20260507_060002_3ed25b", "market": "cn", "formula": "rank(-ts_max(ret_1d,20))*rank(-ts_std(delta(log(amount),5),20))", "name": "low_lottery_log_amount_smooth_20_5", "is_ic": 0.0437, "is_ic_ir": 0.289, "is_sharpe": 0.566, "is_turnover": 0.093, "is_monotonicity": -0.15, "gates": "PASS", "status": "checks_failed", "eval_seconds": 228.0, "sleeve_id": "weekly_flow_underreaction", "mispricing_source": "Attention-driven lottery demand overpays for recent one-day pops; this factor instead rewards quiet flow regularity, so it is not just another price-momentum variant.", "forced_counterparty": "Retail momentum chasers and benchmarked managers reacting to theme/limit-up activity instead of quietly accumulated names.", "data_requirements": "[\"ret_1d\",\"amount\"]", "failure_mode": "Fails when policy/thematic rallies reward lottery spikes directly, or when institutional accumulation turns bursty so smooth amount paths no longer separate informed flow from inactivity.", "report_contract": "fresh_buy_gate", "money_readiness": "money_candidate", "decision": "revert", "session_branch": "main", "base_ref": "origin/main", "merge_base": "4613286185edb21bc292ba5db14282c0f26c8943", "head_commit": "4613286185edb21bc292ba5db14282c0f26c8943", "oos": "PASS", "checks_status": "failed"}
{"ts": "2026-05-07T06:58:43.620034+08:00", "session_id": "20260507_060002_3ed25b", "market": "cn", "formula": "rank(-ts_corr(ret_1d,shift(ret_1d,1),20))*rank(ts_mean(amount,20)/ts_max(amount,20))", "name": "anti_autocorr_amount_evenness_20", "is_ic": 0.0366, "is_ic_ir": 0.475, "is_sharpe": 2.167, "is_turnover": 0.174, "is_monotonicity": 0.15, "gates": "PASS", "status": "candidate", "eval_seconds": 197.8, "sleeve_id": "stable_participation_absorption", "mispricing_source": "Patient buyers absorb episodic retail and liquidity-driven selling without needing breakout volume, so the market underreacts until available supply is exhausted.", "forced_counterparty": "Retail momentum/lottery traders and liquidity-motivated sellers from redemption or benchmark rebalancing", "data_requirements": "[\"ret_1d\",\"amount\"]", "failure_mode": "Fails in broad one-way momentum regimes or when even amount mostly reflects passive/index churn rather than informed accumulation.", "report_contract": "fresh_buy_gate", "money_readiness": "money_candidate", "decision": "candidate", "session_branch": "main", "base_ref": "origin/main", "merge_base": "4613286185edb21bc292ba5db14282c0f26c8943", "head_commit": "4613286185edb21bc292ba5db14282c0f26c8943"}
{"ts": "2026-05-07T06:58:43.620034+08:00", "session_id": "20260507_060002_3ed25b", "market": "cn", "formula": "rank(-ts_corr(ret_1d,shift(ret_1d,1),20))*rank(-ts_std(pct_change(amount,5),20))", "name": "anti_autocorr_weekly_amount_change_stability_20", "is_ic": 0.0415, "is_ic_ir": 0.449, "is_sharpe": 2.573, "is_turnover": 0.153, "is_monotonicity": 0.15, "gates": "PASS", "status": "checks_failed", "eval_seconds": 149.0, "sleeve_id": "anti_autocorr_flow_absorption", "mispricing_source": "underreaction to gradual capital absorption; this targets smoothness of flow changes rather than static liquidity level, so it is not just another plain amount-stability clone", "forced_counterparty": "retail attention traders and benchmark-constrained mutual funds reacting to headlines, subscriptions, and redemption flow rather than optimizing entry timing", "data_requirements": "[\"ret_1d\",\"amount\"]", "failure_mode": "breaks when the market shifts into one-way speculative momentum and bursty turnover is rewarded instead of penalized", "report_contract": "research_only", "money_readiness": "research_only", "decision": "revert", "session_branch": "main", "base_ref": "origin/main", "merge_base": "4613286185edb21bc292ba5db14282c0f26c8943", "head_commit": "4613286185edb21bc292ba5db14282c0f26c8943", "oos": "PASS", "checks_status": "failed"}
{"ts": "2026-05-07T06:58:43.620034+08:00", "session_id": "20260507_060002_3ed25b", "market": "cn", "formula": "rank(ts_std(turnover_rate,20)/ts_mean(turnover_rate,20))*rank(ps_ttm)", "name": "crowded_glamour_turnover_instability_20", "is_ic": 0.014, "is_ic_ir": 0.097, "is_sharpe": -2.175, "is_turnover": 0.088, "is_monotonicity": -0.55, "gates": "FAIL", "status": "reverted", "eval_seconds": 19.3, "sleeve_id": "valuation_crowding_reversal", "mispricing_source": "Retail attention and benchmark-aware growth chasing overpay for narrative-heavy names; unstable participation reveals fragile ownership rather than informed accumulation.", "forced_counterparty": "retail momentum chasers and benchmark-constrained managers who cannot easily avoid crowded glamour stocks", "data_requirements": "[turnover_rate, ps_ttm]", "failure_mode": "Works poorly in broad momentum/speculation regimes where expensive crowded stocks keep attracting incremental capital instead of mean-reverting.", "report_contract": "fresh_buy_gate", "money_readiness": "money_candidate", "decision": "revert", "session_branch": "main", "base_ref": "origin/main", "merge_base": "4613286185edb21bc292ba5db14282c0f26c8943", "head_commit": "4613286185edb21bc292ba5db14282c0f26c8943"}
{"ts": "2026-05-07T06:58:43.620034+08:00", "session_id": "20260507_060002_3ed25b", "market": "cn", "formula": "rank(-ts_corr(ret_1d,shift(ret_1d,1),20))*rank(-ts_std(pct_change(amount/circ_market_cap,5),20))", "name": "anti_autocorr_weekly_floatflow_smooth_20", "is_ic": 0.0396, "is_ic_ir": 0.457, "is_sharpe": 3.071, "is_turnover": 0.153, "is_monotonicity": 0.05, "gates": "PASS", "status": "candidate", "eval_seconds": 182.7, "sleeve_id": "float_flow_underreaction", "mispricing_source": "Slow ownership transfer hidden in smooth float-adjusted flow, not a simple past-price signal; the edge should be less correlated to pure momentum/reversal because it keys off flow path stability per unit of tradable float.", "forced_counterparty": "Retail churn and redemption/benchmark-constrained sellers providing stock mechanically, while institutions are execution-constrained and must slice orders over many days.", "data_requirements": "[\"ret_1d\",\"amount\",\"circ_market_cap\"]", "failure_mode": "Stops working when the tape becomes one-way momentum instead of mean-reverting, or when float-adjusted flow smoothness becomes crowded and no longer reflects private-information absorption.", "report_contract": "setup_overlay", "money_readiness": "research_only", "decision": "candidate", "session_branch": "main", "base_ref": "origin/main", "merge_base": "4613286185edb21bc292ba5db14282c0f26c8943", "head_commit": "4613286185edb21bc292ba5db14282c0f26c8943"}
{"ts": "2026-05-07T06:58:43.620034+08:00", "session_id": "20260507_060002_3ed25b", "market": "cn", "formula": "rank(-ts_corr(ret_1d,shift(ret_1d,1),20))*rank(ts_mean(ts_sum(turnover_rate,5),20)/ts_max(ts_sum(turnover_rate,5),20))", "name": "anti_autocorr_weekly_turnover_evenness_20", "is_ic": 0.0372, "is_ic_ir": 0.479, "is_sharpe": 3.253, "is_turnover": 0.17, "is_monotonicity": 0.5, "gates": "PASS", "status": "candidate", "eval_seconds": 131.4, "sleeve_id": "daily_flow_underreaction", "mispricing_source": "Slow institutional accumulation under participation constraints versus noisy retail attention that concentrates turnover into chase days; the market underprices the smoother demand path.", "forced_counterparty": "Retail momentum traders and benchmarked/redeeming funds that must trade around flows rather than alpha", "data_requirements": "[\"ret_1d\",\"turnover_rate\"]", "failure_mode": "Stops working when policy/news shocks dominate microstructure and turnover becomes regime-wide synchronized, making weekly evenness no longer informative.", "report_contract": "fresh_buy_gate", "money_readiness": "money_candidate", "decision": "candidate", "session_branch": "main", "base_ref": "origin/main", "merge_base": "4613286185edb21bc292ba5db14282c0f26c8943", "head_commit": "4613286185edb21bc292ba5db14282c0f26c8943"}
{"ts": "2026-05-07T06:58:43.620034+08:00", "session_id": "20260507_060002_3ed25b", "market": "cn", "formula": "rank(-ts_corr(ret_1d,shift(ret_1d,1),40))*rank(ts_min(turnover_rate,20)/ts_mean(turnover_rate,20))", "name": "anti_autocorr_turnover_floor_20", "is_ic": 0.0256, "is_ic_ir": 0.239, "is_sharpe": 0.328, "is_turnover": 0.147, "is_monotonicity": 0.6, "gates": "PASS", "status": "candidate", "eval_seconds": 188.0, "sleeve_id": "daily_flow_absorption", "mispricing_source": "Retail-dominated short-horizon overreaction plus VWAP/benchmark-constrained institutional buying slows incorporation of information into prices.", "forced_counterparty": "Retail theme traders and benchmarked funds forced to trade steadily rather than wait for ideal entry points", "data_requirements": "[\"ret_1d\",\"turnover_rate\"]", "failure_mode": "Breakout/event regimes where returns become positively autocorrelated, or when a steady turnover floor reflects illiquid stagnation instead of real absorption.", "report_contract": "fresh_buy_gate", "money_readiness": "money_candidate", "decision": "candidate", "session_branch": "main", "base_ref": "origin/main", "merge_base": "4613286185edb21bc292ba5db14282c0f26c8943", "head_commit": "4613286185edb21bc292ba5db14282c0f26c8943"}
{"ts": "2026-05-07T06:58:43.620034+08:00", "session_id": "20260507_060002_3ed25b", "market": "cn", "formula": "rank(ts_min(turnover_rate,20)/ts_mean(turnover_rate,20)/ts_std(open/close,20))", "name": "turnover_floor_body_stability_20", "is_ic": 0.0415, "is_ic_ir": 0.233, "is_sharpe": 0.116, "is_turnover": 0.1, "is_monotonicity": -0.1, "gates": "PASS", "status": "checks_failed", "eval_seconds": 184.9, "sleeve_id": "steady_turnover_absorption", "mispricing_source": "underreaction to quiet institutional accumulation hidden inside non-explosive daily price action", "forced_counterparty": "retail liquidity sellers and benchmark/rebalancing funds trading for mandate or cash-flow reasons rather than alpha", "data_requirements": "[turnover_rate, open, close]", "failure_mode": "breaks in speculative theme-chasing regimes where high turnover floors and tight bodies reflect crowding or price-limit behavior instead of accumulation", "report_contract": "fresh_buy_gate", "money_readiness": "money_candidate", "decision": "revert", "session_branch": "main", "base_ref": "origin/main", "merge_base": "4613286185edb21bc292ba5db14282c0f26c8943", "head_commit": "4613286185edb21bc292ba5db14282c0f26c8943", "oos": "PASS", "checks_status": "failed"}
{"ts": "2026-05-07T06:58:43.620034+08:00", "session_id": "20260507_060002_3ed25b", "market": "cn", "formula": "rank(-pb)*rank(-ts_std(pct_change(turnover_rate,5),20))", "name": "value_weekly_turnover_change_stability_20", "is_ic": 0.0337, "is_ic_ir": 0.207, "is_sharpe": 0.326, "is_turnover": 0.064, "is_monotonicity": 0.0, "gates": "PASS", "status": "candidate", "eval_seconds": 250.9, "sleeve_id": "value_flow_underreaction", "mispricing_source": "Neglected value names with smooth participation changes reflect gradual ownership transfer and delayed fundamental re-rating, rather than crowded momentum.", "forced_counterparty": "Retail lottery chasers and benchmark-constrained long-only funds that cannot aggressively add unpopular cheap names before confirmation", "data_requirements": "[\"pb\",\"turnover_rate\"] from daily data; derived 5d pct_change and 20d ts_std only", "failure_mode": "Fails when speculative junk-led rallies dominate or when low-PB names are true value traps and smooth turnover just reflects structural neglect", "report_contract": "setup_overlay", "money_readiness": "research_only", "decision": "candidate", "session_branch": "main", "base_ref": "origin/main", "merge_base": "4613286185edb21bc292ba5db14282c0f26c8943", "head_commit": "4613286185edb21bc292ba5db14282c0f26c8943"}
{"ts": "2026-05-07T06:58:43.620034+08:00", "session_id": "20260507_060002_3ed25b", "market": "cn", "formula": "rank(ts_min(amount/circ_market_cap,20)/ts_mean(amount/circ_market_cap,20))*rank(-ts_corr(ret_1d,shift(ret_1d,1),20))", "name": "anti_autocorr_float_floor_20", "is_ic": 0.0377, "is_ic_ir": 0.44, "is_sharpe": 1.595, "is_turnover": 0.178, "is_monotonicity": 0.4, "gates": "PASS", "status": "candidate", "eval_seconds": 203.0, "sleeve_id": "quiet_float_absorption", "mispricing_source": "steady float-normalized absorption is slow to enter prices because daily reversal noise masks institutional accumulation", "forced_counterparty": "retail traders and benchmark-constrained sellers exiting dull names into stronger narratives", "data_requirements": "[\"amount\",\"circ_market_cap\",\"ret_1d\"]", "failure_mode": "breaks in momentum-chasing or liquidation regimes where high turnover floors reflect crowding/distribution instead of patient absorption", "report_contract": "fresh_buy_gate", "money_readiness": "money_candidate", "decision": "candidate", "session_branch": "main", "base_ref": "origin/main", "merge_base": "4613286185edb21bc292ba5db14282c0f26c8943", "head_commit": "4613286185edb21bc292ba5db14282c0f26c8943"}
{"ts": "2026-05-07T06:58:43.620034+08:00", "session_id": "20260507_060002_3ed25b", "market": "cn", "formula": "rank(ts_corr(turnover_rate, abs(ret_1d), 20))", "name": "turnover_absret_corr_20", "is_ic": 0.0096, "is_ic_ir": 0.132, "is_sharpe": -0.446, "is_turnover": 0.171, "is_monotonicity": 0.45, "gates": "FAIL", "status": "reverted", "eval_seconds": 87.5, "sleeve_id": "daily_basic_flow_reactivity", "mispricing_source": "Transient crowding and impact from volatility-sensitive trading flow; this is a flow-reactivity signal, not a raw price-volatility clone.", "forced_counterparty": "Retail attention traders and benchmark-constrained funds reacting to news/liquidity bursts", "data_requirements": "[\"turnover_rate\",\"ret_1d\"]", "failure_mode": "Breaks in strong momentum/news regimes where turnover chasing reflects real information instead of temporary crowding", "report_contract": "research_only", "money_readiness": "research_only", "decision": "revert", "session_branch": "main", "base_ref": "origin/main", "merge_base": "4613286185edb21bc292ba5db14282c0f26c8943", "head_commit": "4613286185edb21bc292ba5db14282c0f26c8943"}
{"ts": "2026-05-07T06:58:43.620034+08:00", "session_id": "20260507_060002_3ed25b", "market": "cn", "formula": "rank(ts_mean(amount/circ_market_cap,20)/ts_max(amount/circ_market_cap,20))*rank(-ts_corr(ret_1d,shift(ret_1d,1),40))", "name": "anti_autocorr_float_peak_balance_20", "is_ic": 0.0244, "is_ic_ir": 0.266, "is_sharpe": 0.233, "is_turnover": 0.138, "is_monotonicity": 0.5, "gates": "PASS", "status": "candidate", "eval_seconds": 164.7, "sleeve_id": "float_absorption_overlay", "mispricing_source": "A-share retail flow and T+1 churn create temporary overhangs; distributed float turnover plus weak return feedback signals quiet absorption, not a raw price-trend variant.", "forced_counterparty": "retail theme chasers and liquidity-motivated sellers/rebalancers who trade on urgency rather than expected alpha", "data_requirements": "[\"amount\",\"circ_market_cap\",\"ret_1d\"]", "failure_mode": "Fails in tape-driven momentum or policy-beta melt-up regimes where one-day participation spikes and positive feedback become rewarded instead of penalized.", "report_contract": "fresh_buy_gate", "money_readiness": "money_candidate", "decision": "candidate", "session_branch": "main", "base_ref": "origin/main", "merge_base": "4613286185edb21bc292ba5db14282c0f26c8943", "head_commit": "4613286185edb21bc292ba5db14282c0f26c8943"}
{"ts": "2026-05-07T06:58:43.620034+08:00", "session_id": "20260507_060002_3ed25b", "market": "cn", "formula": "rank(-ts_corr(ret_1d, shift(ret_1d, 1), 20))*rank(ts_min(volume_ratio,5)/ts_mean(volume_ratio,20))", "name": "anti_autocorr_weekly_relvol_floor_20", "is_ic": 0.0185, "is_ic_ir": 0.23, "is_sharpe": -0.676, "is_turnover": 0.231, "is_monotonicity": 0.4, "gates": "PASS", "status": "candidate", "eval_seconds": 169.1, "sleeve_id": "stable_flow_absorption", "mispricing_source": "Attention-driven underreaction to orderly sponsorship; this is a participation-regularity signal rather than a raw price-momentum clone.", "forced_counterparty": "retail momentum churn and benchmark/rebalance flow traders", "data_requirements": "[\"ret_1d\",\"volume_ratio\"]", "failure_mode": "Fails in strong speculative momentum regimes where a high relvol floor reflects crowding/leadership instead of quiet absorption, or when anti-autocorrelation collapses.", "report_contract": "fresh_buy_gate", "money_readiness": "money_candidate", "decision": "candidate", "session_branch": "main", "base_ref": "origin/main", "merge_base": "4613286185edb21bc292ba5db14282c0f26c8943", "head_commit": "4613286185edb21bc292ba5db14282c0f26c8943"}
