{"base_ref": "origin/main", "checks_status": "failed", "decision": "revert", "eval_seconds": 155.7, "formula": "rank(-ts_corr(ret_1d, shift(ret_1d, 1), 20)) * rank(-ts_mean(abs(pct_change(amount, 5)), 20))", "gates": "PASS", "head_commit": "3c6b8dd92927b4a1164d8c6c9ade81297bf12c19", "is_ic": 0.0434, "is_ic_ir": 0.45, "is_monotonicity": 0.15, "is_sharpe": 2.914, "is_turnover": 0.153, "market": "cn", "merge_base": "3c6b8dd92927b4a1164d8c6c9ade81297bf12c19", "name": "anti_autocorr_amtflow_smooth_20", "oos": "PASS", "session_branch": "main", "session_id": "20260427_060002_ded4b4", "status": "checks_failed", "ts": "2026-04-27T06:56:08.587767+08:00"}
{"base_ref": "origin/main", "decision": "candidate", "eval_seconds": 122.1, "formula": "rank(-ts_corr(amount,shift(amount,1),20)+ts_mean(amount/circ_market_cap,20)/ts_max(amount/circ_market_cap,20))", "gates": "PASS", "head_commit": "3c6b8dd92927b4a1164d8c6c9ade81297bf12c19", "is_ic": 0.022, "is_ic_ir": 0.222, "is_monotonicity": 0.5, "is_sharpe": 0.093, "is_turnover": 0.151, "market": "cn", "merge_base": "3c6b8dd92927b4a1164d8c6c9ade81297bf12c19", "name": "anti_autocorr_float_evenness_20", "session_branch": "main", "session_id": "20260427_060002_ded4b4", "status": "candidate", "ts": "2026-04-27T06:56:08.587767+08:00"}
{"base_ref": "origin/main", "decision": "candidate", "eval_seconds": 166.9, "formula": "rank(-ts_corr(ret_1d,shift(ret_1d,1),20))*rank(ts_min(turnover_rate,20)/ts_max(turnover_rate,20))", "gates": "PASS", "head_commit": "3c6b8dd92927b4a1164d8c6c9ade81297bf12c19", "is_ic": 0.0383, "is_ic_ir": 0.49, "is_monotonicity": 0.4, "is_sharpe": 4.135, "is_turnover": 0.169, "market": "cn", "merge_base": "3c6b8dd92927b4a1164d8c6c9ade81297bf12c19", "name": "anti_autocorr_turnover_corridor_20", "session_branch": "main", "session_id": "20260427_060002_ded4b4", "status": "candidate", "ts": "2026-04-27T06:56:08.587767+08:00"}
{"base_ref": "origin/main", "decision": "candidate", "eval_seconds": 187.5, "formula": "rank(-ts_corr(turnover_rate,shift(turnover_rate,1),20))*rank(ts_min(turnover_rate,20)/ts_mean(turnover_rate,20))", "gates": "PASS", "head_commit": "3c6b8dd92927b4a1164d8c6c9ade81297bf12c19", "is_ic": 0.0233, "is_ic_ir": 0.203, "is_monotonicity": 0.8, "is_sharpe": -0.689, "is_turnover": 0.152, "market": "cn", "merge_base": "3c6b8dd92927b4a1164d8c6c9ade81297bf12c19", "name": "anti_autocorr_turnover_floor_20", "session_branch": "main", "session_id": "20260427_060002_ded4b4", "status": "candidate", "ts": "2026-04-27T06:56:08.587767+08:00"}
{"base_ref": "origin/main", "checks_status": "failed", "decision": "revert", "eval_seconds": 132.0, "formula": "rank(-ts_corr(ret_1d, shift(ret_1d, 1), 20)) * rank(-ts_std(pct_change(turnover_rate, 5), 20))", "gates": "PASS", "head_commit": "3c6b8dd92927b4a1164d8c6c9ade81297bf12c19", "is_ic": 0.0398, "is_ic_ir": 0.456, "is_monotonicity": 0.15, "is_sharpe": 3.198, "is_turnover": 0.154, "market": "cn", "merge_base": "3c6b8dd92927b4a1164d8c6c9ade81297bf12c19", "name": "anti_autocorr_turnover_growth_stability_20", "oos": "PASS", "session_branch": "main", "session_id": "20260427_060002_ded4b4", "status": "checks_failed", "ts": "2026-04-27T06:56:08.587767+08:00"}
{"base_ref": "origin/main", "decision": "revert", "eval_seconds": 165.7, "formula": "rank(ts_corr(ret_1d,shift(ret_1d,1),20))*rank(-ts_std(amount,20)/ts_std(amount,60))", "gates": "FAIL", "head_commit": "3c6b8dd92927b4a1164d8c6c9ade81297bf12c19", "is_ic": 0.0014, "is_ic_ir": -0.013, "is_monotonicity": 0.05, "is_sharpe": -2.378, "is_turnover": 0.168, "market": "cn", "merge_base": "3c6b8dd92927b4a1164d8c6c9ade81297bf12c19", "name": "autocorr_amount_compress_20_60", "session_branch": "main", "session_id": "20260427_060002_ded4b4", "status": "reverted", "ts": "2026-04-27T06:56:08.587767+08:00"}
{"base_ref": "origin/main", "decision": "revert", "eval_seconds": 124.3, "formula": "rank(ts_corr(ret_1d,shift(ret_1d,1),20))*rank(delta(ts_mean(turnover_rate,20),20)/(ts_std(turnover_rate,20)+0.01))", "gates": "FAIL", "head_commit": "3c6b8dd92927b4a1164d8c6c9ade81297bf12c19", "is_ic": -0.0189, "is_ic_ir": -0.19, "is_monotonicity": 0.0, "is_sharpe": -2.584, "is_turnover": 0.148, "market": "cn", "merge_base": "3c6b8dd92927b4a1164d8c6c9ade81297bf12c19", "name": "autocorr_turnover_growth_stability_20", "session_branch": "main", "session_id": "20260427_060002_ded4b4", "status": "reverted", "ts": "2026-04-27T06:56:08.587767+08:00"}
{"base_ref": "origin/main", "decision": "revert", "eval_seconds": 189.7, "formula": "rank((1/max(ps_ttm,1))/ts_std(amount/circ_market_cap,20))", "gates": "FAIL", "head_commit": "3c6b8dd92927b4a1164d8c6c9ade81297bf12c19", "is_ic": 0.0, "is_ic_ir": 0.0, "is_monotonicity": 0.0, "is_sharpe": 0.0, "is_turnover": 0.0, "market": "cn", "merge_base": "3c6b8dd92927b4a1164d8c6c9ade81297bf12c19", "name": "cheap_smooth_floatflow_20", "session_branch": "main", "session_id": "20260427_060002_ded4b4", "status": "compute_error", "ts": "2026-04-27T06:56:08.587767+08:00"}
{"base_ref": "origin/main", "decision": "candidate", "eval_seconds": 204.9, "formula": "rank(ts_min(amount,20)/ts_mean(amount,20)/log(circ_market_cap))", "gates": "PASS", "head_commit": "3c6b8dd92927b4a1164d8c6c9ade81297bf12c19", "is_ic": 0.0283, "is_ic_ir": 0.254, "is_monotonicity": 0.6, "is_sharpe": 0.058, "is_turnover": 0.139, "market": "cn", "merge_base": "3c6b8dd92927b4a1164d8c6c9ade81297bf12c19", "name": "float_adj_amount_floor_20", "session_branch": "main", "session_id": "20260427_060002_ded4b4", "status": "candidate", "ts": "2026-04-27T06:56:08.587767+08:00"}
{"base_ref": "origin/main", "checks_status": "failed", "decision": "revert", "eval_seconds": 209.7, "formula": "rank(-ts_mean(abs(pct_change(amount/circ_market_cap,5)),20))", "gates": "PASS", "head_commit": "3c6b8dd92927b4a1164d8c6c9ade81297bf12c19", "is_ic": 0.0385, "is_ic_ir": 0.357, "is_monotonicity": 0.1, "is_sharpe": 1.274, "is_turnover": 0.111, "market": "cn", "merge_base": "3c6b8dd92927b4a1164d8c6c9ade81297bf12c19", "name": "float_flow_smooth_20", "oos": "PASS", "session_branch": "main", "session_id": "20260427_060002_ded4b4", "status": "checks_failed", "ts": "2026-04-27T06:56:08.587767+08:00"}
{"base_ref": "origin/main", "decision": "revert", "eval_seconds": 56.2, "formula": "rank(-ts_corr(turnover_rate, abs(ret_1d), 20))", "gates": "FAIL", "head_commit": "3c6b8dd92927b4a1164d8c6c9ade81297bf12c19", "is_ic": 0.0096, "is_ic_ir": 0.132, "is_monotonicity": 0.45, "is_sharpe": -0.446, "is_turnover": 0.171, "market": "cn", "merge_base": "3c6b8dd92927b4a1164d8c6c9ade81297bf12c19", "name": "quiet_turnover_flow_20", "session_branch": "main", "session_id": "20260427_060002_ded4b4", "status": "reverted", "ts": "2026-04-27T06:56:08.587767+08:00"}
{"base_ref": "origin/main", "decision": "candidate", "eval_seconds": 138.1, "formula": "rank(-ts_corr(ret_5d, amount / circ_market_cap, 20))", "gates": "PASS", "head_commit": "3c6b8dd92927b4a1164d8c6c9ade81297bf12c19", "is_ic": 0.035, "is_ic_ir": 0.22, "is_monotonicity": 0.0, "is_sharpe": -0.263, "is_turnover": 0.127, "market": "cn", "merge_base": "3c6b8dd92927b4a1164d8c6c9ade81297bf12c19", "name": "ret5_floatflow_diverge_20", "session_branch": "main", "session_id": "20260427_060002_ded4b4", "status": "candidate", "ts": "2026-04-27T06:56:08.587767+08:00"}
{"base_ref": "origin/main", "decision": "candidate", "eval_seconds": 102.5, "formula": "rank(-ts_corr(ret_5d,turnover_rate,20))", "gates": "PASS", "head_commit": "3c6b8dd92927b4a1164d8c6c9ade81297bf12c19", "is_ic": 0.0353, "is_ic_ir": 0.221, "is_monotonicity": 0.05, "is_sharpe": -0.226, "is_turnover": 0.126, "market": "cn", "merge_base": "3c6b8dd92927b4a1164d8c6c9ade81297bf12c19", "name": "ret5_turnover_anticorr_20", "session_branch": "main", "session_id": "20260427_060002_ded4b4", "status": "candidate", "ts": "2026-04-27T06:56:08.587767+08:00"}
{"base_ref": "origin/main", "decision": "candidate", "eval_seconds": 208.6, "formula": "rank(ts_mean(amount,20)/ts_max(amount,20)/log(circ_market_cap))", "gates": "PASS", "head_commit": "3c6b8dd92927b4a1164d8c6c9ade81297bf12c19", "is_ic": 0.0289, "is_ic_ir": 0.399, "is_monotonicity": 0.8, "is_sharpe": 0.998, "is_turnover": 0.133, "market": "cn", "merge_base": "3c6b8dd92927b4a1164d8c6c9ade81297bf12c19", "name": "size_adj_amount_evenness_20", "session_branch": "main", "session_id": "20260427_060002_ded4b4", "status": "candidate", "ts": "2026-04-27T06:56:08.587767+08:00"}
{"base_ref": "origin/main", "decision": "revert", "eval_seconds": 284.2, "formula": "rank(ts_mean(turnover_rate,20)/(ts_max(volume_ratio,20)+0.1))", "gates": "FAIL", "head_commit": "3c6b8dd92927b4a1164d8c6c9ade81297bf12c19", "is_ic": -0.014, "is_ic_ir": -0.109, "is_monotonicity": 0.15, "is_sharpe": 0.631, "is_turnover": 0.038, "market": "cn", "merge_base": "3c6b8dd92927b4a1164d8c6c9ade81297bf12c19", "name": "steady_turnover_uncrowded_20", "session_branch": "main", "session_id": "20260427_060002_ded4b4", "status": "reverted", "ts": "2026-04-27T06:56:08.587767+08:00"}
{"base_ref": "origin/main", "decision": "revert", "eval_seconds": 88.2, "formula": "rank(ret_20d/ts_mean(abs(ret_1d),20))", "gates": "FAIL", "head_commit": "3c6b8dd92927b4a1164d8c6c9ade81297bf12c19", "is_ic": -0.0151, "is_ic_ir": -0.081, "is_monotonicity": 0.05, "is_sharpe": -0.65, "is_turnover": 0.179, "market": "cn", "merge_base": "3c6b8dd92927b4a1164d8c6c9ade81297bf12c19", "name": "trend_efficiency_20", "session_branch": "main", "session_id": "20260427_060002_ded4b4", "status": "reverted", "ts": "2026-04-27T06:56:08.587767+08:00"}
{"base_ref": "origin/main", "decision": "candidate", "eval_seconds": 195.3, "formula": "rank(ts_min(turnover_rate,20)/ts_max(turnover_rate,20))", "gates": "PASS", "head_commit": "3c6b8dd92927b4a1164d8c6c9ade81297bf12c19", "is_ic": 0.0327, "is_ic_ir": 0.338, "is_monotonicity": 0.65, "is_sharpe": 0.906, "is_turnover": 0.116, "market": "cn", "merge_base": "3c6b8dd92927b4a1164d8c6c9ade81297bf12c19", "name": "turnover_corridor_20", "session_branch": "main", "session_id": "20260427_060002_ded4b4", "status": "candidate", "ts": "2026-04-27T06:56:08.587767+08:00"}
{"base_ref": "origin/main", "decision": "revert", "eval_seconds": 147.7, "formula": "rank(ts_mean(turnover_rate,20)/ts_max(turnover_rate,60))", "gates": "FAIL", "head_commit": "3c6b8dd92927b4a1164d8c6c9ade81297bf12c19", "is_ic": -0.0184, "is_ic_ir": -0.123, "is_monotonicity": 0.0, "is_sharpe": -2.387, "is_turnover": 0.083, "market": "cn", "merge_base": "3c6b8dd92927b4a1164d8c6c9ade81297bf12c19", "name": "turnover_evenness_20_60", "session_branch": "main", "session_id": "20260427_060002_ded4b4", "status": "reverted", "ts": "2026-04-27T06:56:08.587767+08:00"}
{"base_ref": "origin/main", "decision": "candidate", "eval_seconds": 144.3, "formula": "rank(-ts_std(pct_change(turnover_rate,5),20))", "gates": "PASS", "head_commit": "3c6b8dd92927b4a1164d8c6c9ade81297bf12c19", "is_ic": 0.0344, "is_ic_ir": 0.341, "is_monotonicity": 0.15, "is_sharpe": 1.197, "is_turnover": 0.099, "market": "cn", "merge_base": "3c6b8dd92927b4a1164d8c6c9ade81297bf12c19", "name": "turnover_growth_stability_20", "session_branch": "main", "session_id": "20260427_060002_ded4b4", "status": "candidate", "ts": "2026-04-27T06:56:08.587767+08:00"}
{"base_ref": "origin/main", "decision": "candidate", "eval_seconds": 88.2, "formula": "rank(ts_mean(turnover_rate, 20) / ts_std(turnover_rate, 20))", "gates": "PASS", "head_commit": "3c6b8dd92927b4a1164d8c6c9ade81297bf12c19", "is_ic": 0.0374, "is_ic_ir": 0.373, "is_monotonicity": 0.7, "is_sharpe": 1.522, "is_turnover": 0.121, "market": "cn", "merge_base": "3c6b8dd92927b4a1164d8c6c9ade81297bf12c19", "name": "turnover_stability_20", "session_branch": "main", "session_id": "20260427_060002_ded4b4", "status": "candidate", "ts": "2026-04-27T06:56:08.587767+08:00"}
{"base_ref": "origin/main", "decision": "candidate", "eval_seconds": 76.8, "formula": "rank(ts_mean(turnover_rate,20)/ts_std(turnover_rate,20)-ts_corr(turnover_rate,shift(turnover_rate,1),20))", "gates": "PASS", "head_commit": "3c6b8dd92927b4a1164d8c6c9ade81297bf12c19", "is_ic": 0.0359, "is_ic_ir": 0.367, "is_monotonicity": 0.6, "is_sharpe": 1.849, "is_turnover": 0.123, "market": "cn", "merge_base": "3c6b8dd92927b4a1164d8c6c9ade81297bf12c19", "name": "turnover_stability_autorevert_20", "session_branch": "main", "session_id": "20260427_060002_ded4b4", "status": "candidate", "ts": "2026-04-27T06:56:08.587767+08:00"}
{"base_ref": "origin/main", "decision": "revert", "eval_seconds": 76.8, "formula": "rank(-ts_kurt(turnover_rate,20))", "gates": "FAIL", "head_commit": "3c6b8dd92927b4a1164d8c6c9ade81297bf12c19", "is_ic": 0.0062, "is_ic_ir": 0.079, "is_monotonicity": 0.45, "is_sharpe": -2.28, "is_turnover": 0.184, "market": "cn", "merge_base": "3c6b8dd92927b4a1164d8c6c9ade81297bf12c19", "name": "turnover_tail_quiet_20", "session_branch": "main", "session_id": "20260427_060002_ded4b4", "status": "reverted", "ts": "2026-04-27T06:56:08.587767+08:00"}
{"base_ref": "origin/main", "decision": "candidate", "eval_seconds": 97.4, "formula": "rank(ts_mean(volume_ratio,20))*rank(-ts_std(volume_ratio,20))", "gates": "PASS", "head_commit": "3c6b8dd92927b4a1164d8c6c9ade81297bf12c19", "is_ic": 0.0262, "is_ic_ir": 0.236, "is_monotonicity": -0.1, "is_sharpe": -0.652, "is_turnover": 0.103, "market": "cn", "merge_base": "3c6b8dd92927b4a1164d8c6c9ade81297bf12c19", "name": "volume_ratio_persistence_20", "session_branch": "main", "session_id": "20260427_060002_ded4b4", "status": "candidate", "ts": "2026-04-27T06:56:08.587767+08:00"}
{"base_ref": "origin/main", "decision": "revert", "eval_seconds": 90.4, "formula": "rank(ts_std(amount, 60) / ts_std(amount, 20)) * rank(ts_mean(close / high, 20))", "gates": "FAIL", "head_commit": "9dc8642c007751102b6291de6c7b382457b6b750", "is_ic": 0.026, "is_ic_ir": 0.149, "is_monotonicity": -0.55, "is_sharpe": -2.657, "is_turnover": 0.107, "market": "cn", "merge_base": "9dc8642c007751102b6291de6c7b382457b6b750", "name": "amount_compress_close_quality_20_60", "session_branch": "main", "session_id": "20260427_140002_cda48d", "status": "reverted", "ts": "2026-04-27T14:55:49.794775+08:00"}
{"base_ref": "origin/main", "decision": "candidate", "eval_seconds": 116.6, "formula": "rank(ts_std(amount,60)/ts_std(amount,20)*ts_sum(turnover_rate,20)/ts_max(turnover_rate,20))", "gates": "PASS", "head_commit": "9dc8642c007751102b6291de6c7b382457b6b750", "is_ic": 0.0302, "is_ic_ir": 0.285, "is_monotonicity": 0.65, "is_sharpe": 1.454, "is_turnover": 0.114, "market": "cn", "merge_base": "9dc8642c007751102b6291de6c7b382457b6b750", "name": "amount_compress_even_turnover_20_60", "session_branch": "main", "session_id": "20260427_140002_cda48d", "status": "candidate", "ts": "2026-04-27T14:55:49.794775+08:00"}
{"base_ref": "origin/main", "decision": "candidate", "eval_seconds": 63.3, "formula": "rank((ts_mean(amount,20)/ts_std(amount,20))/(ts_mean(amount,60)/ts_std(amount,60)))", "gates": "PASS", "head_commit": "9dc8642c007751102b6291de6c7b382457b6b750", "is_ic": 0.0258, "is_ic_ir": 0.22, "is_monotonicity": 0.65, "is_sharpe": 2.419, "is_turnover": 0.127, "market": "cn", "merge_base": "9dc8642c007751102b6291de6c7b382457b6b750", "name": "amount_stability_improve_20_60", "session_branch": "main", "session_id": "20260427_140002_cda48d", "status": "candidate", "ts": "2026-04-27T14:55:49.794775+08:00"}
{"base_ref": "origin/main", "decision": "candidate", "eval_seconds": 90.5, "formula": "rank(ts_mean(amount,20)/ts_std(amount,20)-ts_corr(amount,shift(amount,1),20))", "gates": "PASS", "head_commit": "9dc8642c007751102b6291de6c7b382457b6b750", "is_ic": 0.0379, "is_ic_ir": 0.35, "is_monotonicity": 0.45, "is_sharpe": 1.038, "is_turnover": 0.119, "market": "cn", "merge_base": "9dc8642c007751102b6291de6c7b382457b6b750", "name": "anti_autocorr_amount_stability_20", "session_branch": "main", "session_id": "20260427_140002_cda48d", "status": "candidate", "ts": "2026-04-27T14:55:49.794775+08:00"}
{"base_ref": "origin/main", "decision": "candidate", "eval_seconds": 106.6, "formula": "rank(ts_mean(close/high,20))*rank(-ts_corr(ret_1d,shift(ret_1d,1),20))", "gates": "PASS", "head_commit": "9dc8642c007751102b6291de6c7b382457b6b750", "is_ic": 0.0378, "is_ic_ir": 0.267, "is_monotonicity": 0.0, "is_sharpe": 0.22, "is_turnover": 0.145, "market": "cn", "merge_base": "9dc8642c007751102b6291de6c7b382457b6b750", "name": "anti_autocorr_close_quality_20", "session_branch": "main", "session_id": "20260427_140002_cda48d", "status": "candidate", "ts": "2026-04-27T14:55:49.794775+08:00"}
{"base_ref": "origin/main", "decision": "candidate", "eval_seconds": 155.8, "formula": "rank(-ts_corr(ret_1d,shift(ret_1d,1),40))*rank(ts_min(amount/circ_market_cap,20)/ts_max(amount/circ_market_cap,20))", "gates": "PASS", "head_commit": "9dc8642c007751102b6291de6c7b382457b6b750", "is_ic": 0.0262, "is_ic_ir": 0.259, "is_monotonicity": 0.35, "is_sharpe": 0.509, "is_turnover": 0.134, "market": "cn", "merge_base": "9dc8642c007751102b6291de6c7b382457b6b750", "name": "anti_autocorr_float_corridor_20", "session_branch": "main", "session_id": "20260427_140002_cda48d", "status": "candidate", "ts": "2026-04-27T14:55:49.794775+08:00"}
{"base_ref": "origin/main", "decision": "candidate", "eval_seconds": 105.6, "formula": "rank(-ts_corr(ret_1d,shift(ret_1d,1),20))*rank(ts_min(amount/circ_market_cap,20)/ts_mean(amount/circ_market_cap,20))", "gates": "PASS", "head_commit": "9dc8642c007751102b6291de6c7b382457b6b750", "is_ic": 0.0377, "is_ic_ir": 0.44, "is_monotonicity": 0.4, "is_sharpe": 1.595, "is_turnover": 0.178, "market": "cn", "merge_base": "9dc8642c007751102b6291de6c7b382457b6b750", "name": "anti_autocorr_float_even_flow_20", "session_branch": "main", "session_id": "20260427_140002_cda48d", "status": "candidate", "ts": "2026-04-27T14:55:49.794775+08:00"}
{"base_ref": "origin/main", "decision": "candidate", "eval_seconds": 205.9, "formula": "rank(-ts_corr(ret_1d,shift(ret_1d,1),20))*rank(ts_min(amount/circ_market_cap,20)/ts_mean(amount/circ_market_cap,20))", "gates": "PASS", "head_commit": "9dc8642c007751102b6291de6c7b382457b6b750", "is_ic": 0.0377, "is_ic_ir": 0.44, "is_monotonicity": 0.4, "is_sharpe": 1.595, "is_turnover": 0.178, "market": "cn", "merge_base": "9dc8642c007751102b6291de6c7b382457b6b750", "name": "anti_autocorr_float_floor_20", "session_branch": "main", "session_id": "20260427_140002_cda48d", "status": "candidate", "ts": "2026-04-27T14:55:49.794775+08:00"}
{"base_ref": "origin/main", "checks_status": "failed", "decision": "revert", "eval_seconds": 92.4, "formula": "rank(-ts_corr(ret_1d,shift(ret_1d,1),20))*rank(ts_mean(amount/circ_market_cap,20)/ts_std(amount/circ_market_cap,20))", "gates": "PASS", "head_commit": "9dc8642c007751102b6291de6c7b382457b6b750", "is_ic": 0.0399, "is_ic_ir": 0.495, "is_monotonicity": 0.35, "is_sharpe": 3.724, "is_turnover": 0.166, "market": "cn", "merge_base": "9dc8642c007751102b6291de6c7b382457b6b750", "name": "anti_autocorr_float_flow_smooth_20", "oos": "PASS", "session_branch": "main", "session_id": "20260427_140002_cda48d", "status": "checks_failed", "ts": "2026-04-27T14:55:49.794775+08:00"}
{"base_ref": "origin/main", "decision": "candidate", "eval_seconds": 189.4, "formula": "rank(-ts_corr(ret_1d,shift(ret_1d,1),20))*rank(ts_std(amount/circ_market_cap,60)/ts_std(amount/circ_market_cap,20))", "gates": "PASS", "head_commit": "9dc8642c007751102b6291de6c7b382457b6b750", "is_ic": 0.0362, "is_ic_ir": 0.271, "is_monotonicity": 0.45, "is_sharpe": 1.478, "is_turnover": 0.164, "market": "cn", "merge_base": "9dc8642c007751102b6291de6c7b382457b6b750", "name": "anti_autocorr_floatflow_compress_20_60", "session_branch": "main", "session_id": "20260427_140002_cda48d", "status": "candidate", "ts": "2026-04-27T14:55:49.794775+08:00"}
{"base_ref": "origin/main", "decision": "candidate", "eval_seconds": 203.1, "formula": "rank(-ts_std(delta(log(amount),5),20))*rank(-ts_corr(ret_1d,shift(ret_1d,1),40))", "gates": "PASS", "head_commit": "9dc8642c007751102b6291de6c7b382457b6b750", "is_ic": 0.0319, "is_ic_ir": 0.337, "is_monotonicity": 0.05, "is_sharpe": 1.438, "is_turnover": 0.125, "market": "cn", "merge_base": "9dc8642c007751102b6291de6c7b382457b6b750", "name": "anti_autocorr_logflow_stability_20_5", "session_branch": "main", "session_id": "20260427_140002_cda48d", "status": "candidate", "ts": "2026-04-27T14:55:49.794775+08:00"}
{"base_ref": "origin/main", "decision": "candidate", "eval_seconds": 94.6, "formula": "rank(-ts_corr(ret_1d, shift(ret_1d,1), 40)) * rank(-(ts_max(turnover_rate,20) / ts_mean(turnover_rate,20)))", "gates": "PASS", "head_commit": "9dc8642c007751102b6291de6c7b382457b6b750", "is_ic": 0.0244, "is_ic_ir": 0.265, "is_monotonicity": 0.25, "is_sharpe": -0.08, "is_turnover": 0.14, "market": "cn", "merge_base": "9dc8642c007751102b6291de6c7b382457b6b750", "name": "anti_autocorr_turnover_spike_20", "session_branch": "main", "session_id": "20260427_140002_cda48d", "status": "candidate", "ts": "2026-04-27T14:55:49.794775+08:00"}
{"base_ref": "origin/main", "decision": "revert", "eval_seconds": 145.3, "formula": "rank(ts_corr(ret_1d,shift(ret_1d,1),20))*rank(ts_mean(amount/circ_market_cap,20)/ts_max(amount/circ_market_cap,20))", "gates": "FAIL", "head_commit": "9dc8642c007751102b6291de6c7b382457b6b750", "is_ic": 0.0026, "is_ic_ir": -0.015, "is_monotonicity": 0.15, "is_sharpe": -4.875, "is_turnover": 0.175, "market": "cn", "merge_base": "9dc8642c007751102b6291de6c7b382457b6b750", "name": "autocorr_float_even_flow_20", "session_branch": "main", "session_id": "20260427_140002_cda48d", "status": "reverted", "ts": "2026-04-27T14:55:49.794775+08:00"}
