{"ts": "2026-05-12T14:58:46.981474+08:00", "session_id": "20260512_140046_7f9cc0", "market": "cn", "formula": "rank(-(ts_max(turnover_rate,20)/ts_sum(turnover_rate,20)))*rank(ts_mean(close/open-1,20))", "name": "turnover_spike_body_bias_20", "is_ic": 0.0124, "is_ic_ir": 0.079, "is_sharpe": -0.426, "is_turnover": 0.17, "is_monotonicity": 0.65, "gates": "FAIL", "status": "reverted", "eval_seconds": 193.4, "sleeve_id": "daily_price_overlay", "mispricing_source": "The market overweights obvious headline spike days and underweights slow supply absorption visible in repeated positive intraday closes with non-concentrated participation.", "forced_counterparty": "benchmark/rebalance sellers and short-horizon retail momentum traders", "data_requirements": "current CN daily fields only: [turnover_rate, close, open]; optional industry/theme labels for AI-sleeve attribution", "failure_mode": "Fails in event-driven melt-up regimes where one-day turnover spikes carry real information and diffuse accumulation stops mattering.", "report_contract": "fresh_buy_gate", "ai_supercycle_layer": "ai_datacenter_edge_infra", "supply_chain_hypothesis": "candidate datacenter power/cooling/network/connectivity beneficiaries should exhibit broad multi-session accumulation instead of single-day speculative turnover bursts", "relationship_evidence_required": "true", "money_readiness": "money_candidate", "decision": "revert", "session_branch": "main", "base_ref": "origin/main", "merge_base": "62e27b1718a9c8c7cee619126770fe57cd98d173", "head_commit": "62e27b1718a9c8c7cee619126770fe57cd98d173"}
{"ts": "2026-05-12T14:58:46.981474+08:00", "session_id": "20260512_140046_7f9cc0", "market": "cn", "formula": "rank(ts_mean(amount/circ_market_cap,20)/ts_max(amount/circ_market_cap,20)-ts_corr(amount/circ_market_cap,abs(ret_1d),20))", "name": "float_even_impact_disconnect_20", "is_ic": 0.0191, "is_ic_ir": 0.281, "is_sharpe": 1.341, "is_turnover": 0.156, "is_monotonicity": 0.6, "gates": "PASS", "status": "candidate", "eval_seconds": 227.4, "sleeve_id": "float_flow_absorption", "mispricing_source": "Slow underreaction to steady float-adjusted ownership transfer with muted price impact; this is a flow-shape/impact-efficiency sleeve, not another close-volume-correlation price factor.", "forced_counterparty": "Retail theme/lottery traders and benchmarked or redemption-driven long-only funds that trade for attention, liquidity, or mandate rather than 10-20 day alpha.", "data_requirements": "[\"amount\",\"circ_market_cap\",\"ret_1d\"]; daily beta hedge and residual risk model for portfolio use; intraday/member-level flow ledger is still needed before calling the absorption story money-ready.", "failure_mode": "Fails in policy/headline momentum regimes where bursty high-attention names lead, or when smooth float flow is mostly dead liquidity/passive churn rather than real accumulation.", "report_contract": "research_only", "ai_supercycle_layer": "ai_chip_equipment_materials_packaging", "supply_chain_hypothesis": "If domestic AI-capex bottlenecks are forming, upstream equipment/materials/advanced-packaging names should show steady float-normalized flow with muted daily impact before order visibility is fully recognized in price.", "relationship_evidence_required": "true", "money_readiness": "research_only", "decision": "candidate", "session_branch": "main", "base_ref": "origin/main", "merge_base": "62e27b1718a9c8c7cee619126770fe57cd98d173", "head_commit": "62e27b1718a9c8c7cee619126770fe57cd98d173"}
{"ts": "2026-05-12T14:58:46.981474+08:00", "session_id": "20260512_140046_7f9cc0", "market": "cn", "formula": "rank(ts_std(delta(turnover_rate,5),60)/ts_std(delta(turnover_rate,5),20))*rank(ts_min(ts_sum(amount/circ_market_cap,5),20)/ts_std(ts_sum(amount/circ_market_cap,5),20))", "name": "turnshock_compress_float_floor_20_60", "is_ic": 0.0253, "is_ic_ir": 0.283, "is_sharpe": 1.443, "is_turnover": 0.097, "is_monotonicity": 0.65, "gates": "PASS", "status": "candidate", "eval_seconds": 236.6, "sleeve_id": "weekly_float_supply_lockup", "mispricing_source": "Post-churn supply lockup and slow underreaction to steady sponsorship; this is a turnover-regime plus float-support sleeve, not another close-volume correlation or naked price reversal factor.", "forced_counterparty": "retail theme chasers, redemption-driven sellers, and benchmark/rebalance-constrained long-only funds", "data_requirements": "[\"amount\",\"turnover_rate\",\"circ_market_cap\"]; daily data is sufficient for research and beta-hedged portfolio construction, but AI-theme mapping needs external company classification if used as an AI discovery sleeve.", "failure_mode": "Fails in one-way momentum or policy-beta regimes where turnover compression just reflects dead liquidity, or when steady float flow is passive churn rather than real accumulation.", "report_contract": "fresh_buy_gate", "ai_supercycle_layer": "ai_compute_accelerators", "supply_chain_hypothesis": "Capacity-constrained AI hardware and adjacent infrastructure beneficiaries should show post-spike turnover compression while maintaining a stable float-flow floor as weak hands exit and institutions keep absorbing stock.", "relationship_evidence_required": "true", "money_readiness": "money_candidate", "decision": "candidate", "session_branch": "main", "base_ref": "origin/main", "merge_base": "62e27b1718a9c8c7cee619126770fe57cd98d173", "head_commit": "62e27b1718a9c8c7cee619126770fe57cd98d173"}
{"ts": "2026-05-12T14:58:46.981474+08:00", "session_id": "20260512_140046_7f9cc0", "market": "cn", "formula": "rank(ts_min(ts_sum(volume_ratio,5),20)/ts_std(ts_sum(volume_ratio,5),20))", "name": "weekly_relvol_floorstd_20", "is_ic": 0.031, "is_ic_ir": 0.322, "is_sharpe": 2.047, "is_turnover": 0.093, "is_monotonicity": 0.45, "gates": "PASS", "status": "candidate", "eval_seconds": 159.2, "sleeve_id": "weekly_relvol_support", "mispricing_source": "Underreaction to steady abnormal participation and overreaction to salient volume bursts; this is a flow-shape sleeve rather than a close-volume correlation clone.", "forced_counterparty": "retail attention traders chasing spike-volume tapes; benchmarked and redemption-driven long-only sellers supplying stock for mandate or liquidity reasons", "data_requirements": "[\"volume_ratio for signal\",\"daily returns/close for beta hedge and residual risk attribution\",\"intraday order-flow or broker/member trade ledger required before money-ready deployment to separate true accumulation from smooth distribution or dead liquidity\"]", "failure_mode": "Fails in policy/speculative breakout regimes where bursty relative-volume expansion carries real information, or when smooth relative volume mostly reflects illiquidity/passive churn rather than accumulation.", "report_contract": "research_only", "ai_supercycle_layer": "ai_chip_equipment_materials_packaging", "supply_chain_hypothesis": "If AI capex is diffusing into domestic tool/material/advanced-packaging bottlenecks, beneficiaries should show persistent abnormal relative-volume floors before consensus fully rerates the group.", "relationship_evidence_required": "true", "money_readiness": "research_only", "decision": "candidate", "session_branch": "main", "base_ref": "origin/main", "merge_base": "62e27b1718a9c8c7cee619126770fe57cd98d173", "head_commit": "62e27b1718a9c8c7cee619126770fe57cd98d173"}
{"ts": "2026-05-12T14:58:46.981474+08:00", "session_id": "20260512_140046_7f9cc0", "market": "cn", "formula": "rank(ret_20d-ret_5d)*rank(ts_mean(turnover_rate,20)/ts_std(turnover_rate,20))", "name": "leader_pullback_turnover_corridor_20", "is_ic": 0.0228, "is_ic_ir": 0.146, "is_sharpe": 0.082, "is_turnover": 0.179, "is_monotonicity": 0.85, "gates": "FAIL", "status": "reverted", "eval_seconds": 192.9, "sleeve_id": "daily_price_flow_overlay", "mispricing_source": "Underreaction to orderly institutional accumulation after shallow weekly pullbacks inside established 20-day leadership.", "forced_counterparty": "Short-horizon retail profit-takers and benchmarked managers who must add exposure incrementally rather than all at once.", "data_requirements": "[\"close\",\"ret_5d\",\"ret_20d\",\"turnover_rate\"]", "failure_mode": "Fails in broad speculative melt-ups or hard risk-off breaks where weekly pullbacks are genuine distribution and stable turnover no longer signals absorption.", "report_contract": "fresh_buy_gate", "ai_supercycle_layer": "ai_chip_equipment_materials_packaging", "supply_chain_hypothesis": "Candidate semiconductor equipment/materials/advanced-packaging names with real AI capex order visibility should show 20-day leadership and only shallow 5-day pullbacks while turnover stays orderly.", "relationship_evidence_required": "true", "money_readiness": "money_candidate", "decision": "revert", "session_branch": "main", "base_ref": "origin/main", "merge_base": "62e27b1718a9c8c7cee619126770fe57cd98d173", "head_commit": "62e27b1718a9c8c7cee619126770fe57cd98d173"}
{"ts": "2026-05-12T14:58:46.981474+08:00", "session_id": "20260512_140046_7f9cc0", "market": "cn", "formula": "rank(ts_min(volume_ratio,5)/ts_std(volume_ratio,20))*rank(ts_min(amount/circ_market_cap,20)/ts_mean(amount/circ_market_cap,20))", "name": "weekly_relvol_float_floor_20", "is_ic": 0.0292, "is_ic_ir": 0.281, "is_sharpe": -0.585, "is_turnover": 0.153, "is_monotonicity": 0.35, "gates": "PASS", "status": "candidate", "eval_seconds": 213.4, "sleeve_id": "steady_flow_absorption", "mispricing_source": "The market overweights visible spike days and headlines but underweights sustained participation geometry; this is a flow-absorption signal, not a high-correlation price-momentum variant.", "forced_counterparty": "Retail theme chasers, legacy holders selling inventory gradually, and benchmarked long-only funds that must scale in slowly", "data_requirements": "[\"volume_ratio\",\"amount\",\"circ_market_cap\"]; AI supplier/customer labeling, if used, needs filings, official releases, or transcripts", "failure_mode": "It fails when elevated relative-volume floors reflect crowded speculative churn instead of informed accumulation, or when liquidity dries up and the floor no longer represents sponsorship.", "report_contract": "fresh_buy_gate", "ai_supercycle_layer": "ai_chip_equipment_materials_packaging", "supply_chain_hypothesis": "Candidate AI equipment, materials, packaging, or testing bottlenecks should show sustained weekly participation and a firm float-absorption floor before downstream demand is obvious in consensus.", "relationship_evidence_required": "true", "money_readiness": "money_candidate", "decision": "candidate", "session_branch": "main", "base_ref": "origin/main", "merge_base": "62e27b1718a9c8c7cee619126770fe57cd98d173", "head_commit": "62e27b1718a9c8c7cee619126770fe57cd98d173"}
{"ts": "2026-05-12T14:58:46.981474+08:00", "session_id": "20260512_140046_7f9cc0", "market": "cn", "formula": "rank(-ts_corr(amount/circ_market_cap,abs(ret_1d),20))*rank(ts_mean(amount/circ_market_cap,20)/ts_max(amount/circ_market_cap,20))", "name": "float_absret_even_20", "is_ic": 0.0222, "is_ic_ir": 0.349, "is_sharpe": 0.075, "is_turnover": 0.157, "is_monotonicity": 0.7, "gates": "PASS", "status": "candidate", "eval_seconds": 196.6, "sleeve_id": "daily_float_absorption", "mispricing_source": "Underreaction to low-impact, float-normalized ownership transfer; the edge comes from flow shape and absorption, not from a high-correlation price-only signal.", "forced_counterparty": "Retail attention traders, redemption-driven sellers, and benchmark/rebalance-constrained long-only funds", "data_requirements": "[\"amount\",\"circ_market_cap\",\"ret_1d\"]; daily data is enough for IS testing, but intraday/member-level flow is needed before money-ready deployment to separate true accumulation from passive churn", "failure_mode": "Fails in policy/theme momentum regimes where bursty high-attention names keep leading, or when smooth float-normalized flow mostly reflects dead illiquidity/passive index churn rather than informed accumulation", "report_contract": "fresh_buy_gate", "ai_supercycle_layer": "ai_chip_equipment_materials_packaging", "supply_chain_hypothesis": "Candidate domestic AI equipment/materials/advanced-packaging bottlenecks should exhibit steady float-normalized accumulation with muted daily impact before order visibility is fully reflected in price; no specific supplier/customer link is asserted", "relationship_evidence_required": "true", "money_readiness": "money_candidate", "decision": "candidate", "session_branch": "main", "base_ref": "origin/main", "merge_base": "62e27b1718a9c8c7cee619126770fe57cd98d173", "head_commit": "62e27b1718a9c8c7cee619126770fe57cd98d173"}
{"ts": "2026-05-12T14:58:46.981474+08:00", "session_id": "20260512_140046_7f9cc0", "market": "cn", "formula": "rank(-ts_std(pct_change(amount,5),20))*rank(ts_min(turnover_rate,20)/ts_mean(turnover_rate,20))", "name": "weekly_amount_floor_stability_20", "is_ic": 0.0364, "is_ic_ir": 0.348, "is_sharpe": 0.898, "is_turnover": 0.119, "is_monotonicity": 0.05, "gates": "PASS", "status": "checks_failed", "eval_seconds": 200.5, "sleeve_id": "daily_price_overlay", "mispricing_source": "The market overreacts to visible volume spikes and underprices steady replenishment of demand; smooth cash participation with a turnover floor captures underreaction to accumulation.", "forced_counterparty": "Retail theme traders and benchmarked holders who supply stock incrementally instead of fully arbitraging gradual information diffusion.", "data_requirements": "Base factor uses current daily data only: [amount, turnover_rate]. AI tagging needs external industry mapping plus filings/press/news to verify any supplier or capacity claim.", "failure_mode": "It stops working in liquidation or pure chase regimes where turnover floors reflect crowded exits and smooth weekly amount changes no longer signal informed accumulation.", "report_contract": "fresh_buy_gate", "ai_supercycle_layer": "ai_chip_equipment_materials_packaging", "supply_chain_hypothesis": "If AI hardware capacity is tightening, semicap and advanced-packaging beneficiaries should show smooth weekly cash participation with a persistent turnover floor before explicit order news confirms the bottleneck.", "relationship_evidence_required": "true", "money_readiness": "money_candidate", "decision": "revert", "session_branch": "main", "base_ref": "origin/main", "merge_base": "62e27b1718a9c8c7cee619126770fe57cd98d173", "head_commit": "62e27b1718a9c8c7cee619126770fe57cd98d173", "oos": "PASS", "checks_status": "failed"}
{"ts": "2026-05-12T14:58:46.981474+08:00", "session_id": "20260512_140046_7f9cc0", "market": "cn", "formula": "rank(ts_min(ts_sum(amount/circ_market_cap,5),20)/ts_std(ts_sum(amount/circ_market_cap,5),20))*rank(ts_mean(turnover_rate,20)/ts_max(turnover_rate,20))", "name": "weekly_float_floor_turnover_even_20", "is_ic": 0.0312, "is_ic_ir": 0.32, "is_sharpe": 1.046, "is_turnover": 0.104, "is_monotonicity": 0.6, "gates": "PASS", "status": "candidate", "eval_seconds": 213.1, "sleeve_id": "weekly_float_share_absorption", "mispricing_source": "Slow underreaction to steady float-scaled absorption; the market overweights bursty high-salience flow and underprices quiet ownership transfer.", "forced_counterparty": "Retail attention chasers and benchmark/redemption-constrained long-only sellers", "data_requirements": "[\"amount\",\"circ_market_cap\",\"turnover_rate\"]; intraday/member flow ledger would be needed before calling dead-liquidity cases money-ready", "failure_mode": "Breaks when smooth flow is mostly illiquidity/passive churn, or when policy/speculative regimes reward bursty turnover leaders immediately", "report_contract": "setup_overlay", "ai_supercycle_layer": "ai_datacenter_edge_infra", "supply_chain_hypothesis": "If AI datacenter and adjacent infra capex are tightening domestic capacity, beneficiaries should show a persistent weekly float-flow floor and non-spiky turnover before the narrative fully broadens", "relationship_evidence_required": "true", "money_readiness": "research_only", "decision": "candidate", "session_branch": "main", "base_ref": "origin/main", "merge_base": "62e27b1718a9c8c7cee619126770fe57cd98d173", "head_commit": "62e27b1718a9c8c7cee619126770fe57cd98d173"}
{"ts": "2026-05-12T14:58:46.981474+08:00", "session_id": "20260512_140046_7f9cc0", "market": "cn", "formula": "rank(ts_corr(ret_1d,shift(ret_1d,1),20))*rank(-ts_std(delta(log(amount),5),20))", "name": "autocorr_weekly_logamt_smooth_20", "is_ic": 0.0163, "is_ic_ir": 0.139, "is_sharpe": -2.891, "is_turnover": 0.166, "is_monotonicity": -0.4, "gates": "FAIL", "status": "reverted", "eval_seconds": 164.4, "sleeve_id": "cn_flow_persistence_20d", "mispricing_source": "Underreaction to gradual informed accumulation; this is not a close-volume-corr variant because it keys on return-path persistence gated by weekly flow smoothness.", "forced_counterparty": "Retail mean-reverters, short-horizon profit takers, and benchmarked funds that must add exposure incrementally", "data_requirements": "[\"ret_1d\",\"amount\",\"optional industry/AI-theme map for residual risk attribution and theme attribution only\"]", "failure_mode": "Fails in gap-driven mania or broad deleveraging regimes where smooth flow no longer indicates informed accumulation and return autocorr flips sign.", "report_contract": "fresh_buy_gate", "ai_supercycle_layer": "ai_chip_equipment_materials_packaging", "supply_chain_hypothesis": "If domestic AI capex bottlenecks are binding, packaging/equipment/material beneficiaries should show steady weekly amount transfer plus short-horizon return persistence before broader retail participation.", "relationship_evidence_required": "true", "money_readiness": "money_candidate", "decision": "revert", "session_branch": "main", "base_ref": "origin/main", "merge_base": "62e27b1718a9c8c7cee619126770fe57cd98d173", "head_commit": "62e27b1718a9c8c7cee619126770fe57cd98d173"}
{"ts": "2026-05-12T14:58:46.981474+08:00", "session_id": "20260512_140046_7f9cc0", "market": "cn", "formula": "rank(ts_mean(amount, 20) / circ_market_cap) * rank(-ts_std(turnover_rate, 20))", "name": "float_absorb_turn_smooth_20", "is_ic": 0.0074, "is_ic_ir": 0.054, "is_sharpe": -3.662, "is_turnover": 0.077, "is_monotonicity": -0.2, "gates": "FAIL", "status": "reverted", "eval_seconds": 106.9, "sleeve_id": "daily_flow_absorption", "mispricing_source": "Slow price discovery around steady float absorption; the signal comes from value traded versus free float and turnover smoothness, not a recycled short-horizon price pattern.", "forced_counterparty": "redemption-driven sellers, passive rebalance flow, and retail traders selling dull tapes before the accumulation is fully recognized", "data_requirements": "[\"amount\",\"turnover_rate\",\"circ_market_cap\"]", "failure_mode": "Breaks in panic/liquidity-shock regimes where smooth turnover means neglect, or in speculative tapes where spiky crowding outperforms steady accumulation.", "report_contract": "fresh_buy_gate", "ai_supercycle_layer": "none", "supply_chain_hypothesis": "none", "relationship_evidence_required": "false", "money_readiness": "money_candidate", "decision": "revert", "session_branch": "main", "base_ref": "origin/main", "merge_base": "62e27b1718a9c8c7cee619126770fe57cd98d173", "head_commit": "62e27b1718a9c8c7cee619126770fe57cd98d173"}
{"ts": "2026-05-12T14:58:46.981474+08:00", "session_id": "20260512_140046_7f9cc0", "market": "cn", "formula": "rank(ts_corr(ret_1d, shift(ret_1d, 1), 20)) * rank(ts_mean(amount,20)/ts_max(amount,20))", "name": "autocorr_amount_evenness_20", "is_ic": 0.0076, "is_ic_ir": 0.039, "is_sharpe": -4.707, "is_turnover": 0.176, "is_monotonicity": 0.05, "gates": "FAIL", "status": "reverted", "eval_seconds": 172.2, "sleeve_id": "daily_price_overlay", "mispricing_source": "Underreaction to persistent sponsorship; the edge comes from flow quality, not raw momentum, because continuation only scores when trading cash is evenly spread instead of spike-driven.", "forced_counterparty": "retail attention traders taking quick profits and short-horizon managers rotating away from quiet leaders before the trend is fully priced", "data_requirements": "Current daily CN data is sufficient for backtest: [ret_1d, amount]. AI-supercycle attribution later needs sector mapping plus filings/official disclosures to verify any supplier or customer link.", "failure_mode": "This should weaken in sharp mean-reversion or policy-shock regimes where positive autocorr flips sign, and in retail mania phases where even cash participation becomes broad speculative churn rather than informed accumulation.", "report_contract": "fresh_buy_gate", "ai_supercycle_layer": "ai_chip_equipment_materials_packaging", "supply_chain_hypothesis": "Domestic AI compute capex bottleneck beneficiaries in equipment, materials, packaging, or testing should show steady cash participation and trend persistence before backlog/order evidence is obvious in lagging news.", "relationship_evidence_required": "true", "money_readiness": "money_candidate", "decision": "revert", "session_branch": "main", "base_ref": "origin/main", "merge_base": "62e27b1718a9c8c7cee619126770fe57cd98d173", "head_commit": "62e27b1718a9c8c7cee619126770fe57cd98d173"}
