{"ts": "2026-05-15T14:57:53.935894+08:00", "session_id": "20260515_140003_9fafac", "market": "cn", "formula": "rank(ts_min(ts_sum(turnover_rate,5),20)/ts_max(ts_sum(turnover_rate,5),20))", "name": "weekly_turnover_corridor_20", "is_ic": 0.0, "is_ic_ir": 0.0, "is_sharpe": 0.0, "is_turnover": 0.0, "is_monotonicity": 0.0, "gates": "FAIL", "status": "reverted", "eval_seconds": 264.2, "sleeve_id": "cn_tape_leadership_continuation", "mispricing_source": "The market overreacts to visible turnover spikes and underprices quiet inventory absorption; this is participation-quality alpha, not a high-correlation clone of a pure price factor.", "forced_counterparty": "T+1 retail momentum chasers and headline-driven thematic traders, plus benchmarked funds rotating on liquidity bursts.", "data_requirements": "[\"daily turnover_rate history (available)\", \"AI-universe source-review status per ticker\", \"beta-hedged sleeve attribution vs 000300.SH and 399006.SZ before promotion\"]", "failure_mode": "It breaks in straight-line momentum or panic-liquidity regimes when turnover spikes carry real information and steady turnover simply marks laggards or illiquidity.", "report_contract": "setup_overlay", "ai_supercycle_layer": "none", "supply_chain_hypothesis": "High-corridor names are candidate D1-D3 AI-infra bottleneck suppliers under quiet accumulation before order/backlog evidence is fully reflected.", "relationship_evidence_required": "true", "money_readiness": "research_only", "decision": "revert", "session_branch": "main", "base_ref": "origin/main", "merge_base": "630e0dd16b5d38cb718e990195890edf7504d2e6", "head_commit": "630e0dd16b5d38cb718e990195890edf7504d2e6"}
{"ts": "2026-05-15T14:57:53.935894+08:00", "session_id": "20260515_140003_9fafac", "market": "cn", "formula": "rank(ret_20) * rank(ts_mean(amount,20) / ts_std(amount,20))", "name": "trend_amount_stability_20", "is_ic": 0.0, "is_ic_ir": 0.0, "is_sharpe": 0.0, "is_turnover": 0.0, "is_monotonicity": 0.0, "gates": "FAIL", "status": "compute_error", "eval_seconds": 114.6, "sleeve_id": "cn_ai_orderly_accumulation", "mispricing_source": "The market underreacts to boring, persistent accumulation in AI-infra beneficiaries because retail attention chases spikey themes and waits for headline confirmation.", "forced_counterparty": "Retail momentum traders rotating into higher-volatility themes; benchmarked funds that add only after trend confirmation", "data_requirements": "[\"current CN daily price+amount data for IS test\", \"factor correlation vs kshadow_5 and amount_stability_20\", \"beta-hedged sleeve attribution vs CN benchmarks before promotion\"]", "failure_mode": "Stops working in rumor-driven melt-up or sharp mean-reversion regimes where bursty speculative turnover beats orderly accumulation.", "report_contract": "research_only", "ai_supercycle_layer": "ai_chip_equipment_materials_packaging", "supply_chain_hypothesis": "D1-D3 domestic AI chip equipment/materials/packaging bottleneck names are being accumulated ahead of fully source-verified capex/order confirmation.", "relationship_evidence_required": "true", "money_readiness": "research_only", "decision": "revert", "session_branch": "main", "base_ref": "origin/main", "merge_base": "630e0dd16b5d38cb718e990195890edf7504d2e6", "head_commit": "630e0dd16b5d38cb718e990195890edf7504d2e6"}
{"ts": "2026-05-15T14:57:53.935894+08:00", "session_id": "20260515_140003_9fafac", "market": "cn", "formula": "rank(-ts_std(amount / circ_market_cap,20) / ts_std(amount / circ_market_cap,60))", "name": "float_flow_compress_20_60", "is_ic": 0.0, "is_ic_ir": 0.0, "is_sharpe": 0.0, "is_turnover": 0.0, "is_monotonicity": 0.0, "gates": "FAIL", "status": "reverted", "eval_seconds": 175.7, "sleeve_id": "cn_ai_flow_quality", "mispricing_source": "T+1 retail trading and theme-chasing create attention bursts, but institutions in constrained AI-infra names usually build positions gradually; the market underprices the information in orderly float absorption because confirmation from filings, backlog, or policy headlines arrives later.", "forced_counterparty": "Short-horizon retail theme traders and liquidity-driven funds that must recycle capital after volume spikes; benchmark-aware institutions that cannot instantly reach target size in tighter-float names.", "data_requirements": "[\"daily amount\",\"daily circ_market_cap\",\"benchmark beta/residual attribution vs 000300.SH and 399006.SZ\",\"sleeve correlation vs kshadow_5 and existing flow sleeves\",\"original-source filings/press releases if any surfaced name is later framed as a validated AI supplier/customer\"]", "failure_mode": "It stops working in indiscriminate liquidity meltdowns or late-stage momentum frenzies, when lower recent flow volatility reflects dead liquidity or when the market rewards high-churn speculation instead of orderly accumulation.", "report_contract": "fresh_buy_gate", "ai_supercycle_layer": "ai_chip_equipment_materials_packaging", "supply_chain_hypothesis": "Candidate bottleneck equipment/materials/packaging names should show float-adjusted flow compression as strategic capital accumulates ahead of official order, capex, or localization confirmation.", "relationship_evidence_required": "true", "money_readiness": "money_candidate", "decision": "revert", "session_branch": "main", "base_ref": "origin/main", "merge_base": "630e0dd16b5d38cb718e990195890edf7504d2e6", "head_commit": "630e0dd16b5d38cb718e990195890edf7504d2e6"}
{"ts": "2026-05-18T06:56:45.563809+08:00", "session_id": "20260518_060002_cd0c45", "market": "cn", "formula": "rank(ret_20d / (ts_std(turnover_rate,20) + 0.01))", "name": "orderly_turnover_leader_20", "is_ic": 0.0, "is_ic_ir": 0.0, "is_sharpe": 0.0, "is_turnover": 0.0, "is_monotonicity": 0.0, "gates": "FAIL", "status": "reverted", "eval_seconds": 106.5, "sleeve_id": "cn_ai_infra_accumulation", "mispricing_source": "Benchmark-constrained funds scale into AI bottlenecks gradually, while retail flow creates bursty turnover; conditioning momentum on orderly turnover isolates incomplete institutional accumulation rather than a generic price chase.", "forced_counterparty": "Retail theme traders and generalist funds that cannot warehouse niche AI-infra exposure early", "data_requirements": "`[\"daily OHLCV + turnover_rate for the 49-name CN AI universe\",\"000300.SH and 399006.SZ returns for beta-hedged attribution\",\"source-reviewed filings/official PRs if any optical/CPO bottleneck claim is promoted beyond discovery\"]`", "failure_mode": "It should fail when AI themes shift into broad speculative rotation and bursty turnover is rewarded, or when turnover volatility mainly proxies illiquidity instead of accumulation quality.", "report_contract": "fresh_buy_gate", "ai_supercycle_layer": "ai_networking_optical_cpo", "supply_chain_hypothesis": "Offshore AI training capex should first tighten optical interconnect and CPO bottlenecks, and CN names in that lane may show orderly 20-day leadership before backlog or order evidence is fully visible in filings.", "relationship_evidence_required": "true", "money_readiness": "money_candidate", "decision": "revert", "session_branch": "main", "base_ref": "origin/main", "merge_base": "76df81759b87ae939b7f4b094587247ae237c342", "head_commit": "76df81759b87ae939b7f4b094587247ae237c342"}
{"ts": "2026-05-18T06:56:45.563809+08:00", "session_id": "20260518_060002_cd0c45", "market": "cn", "formula": "rank(-ts_corr(ret_5d, delta(amount,5), 20)) * rank(ts_min(turnover_rate,20) / ts_max(turnover_rate,20))", "name": "weekly_amount_absorb_turncorr_20", "is_ic": 0.0, "is_ic_ir": 0.0, "is_sharpe": 0.0, "is_turnover": 0.0, "is_monotonicity": 0.0, "gates": "FAIL", "status": "reverted", "eval_seconds": 209.5, "sleeve_id": "cn_ai_flow_underreaction", "mispricing_source": "Flow-price underreaction inside validated AI-infra leaders; accumulation shows up in amount and turnover behavior before it is fully reflected in price.", "forced_counterparty": "Short-horizon retail/theme traders and benchmark-aware funds that cut quiet names before price confirmation.", "data_requirements": "[\"current daily CN tape is enough for IS test\", \"before promotion: sleeve correlation vs kshadow_5 and current promoted sleeves\", \"beta-hedged residual attribution vs 000300.SH and 399006.SZ\", \"filings/press releases/transcripts if report text claims orders, customers, or supplier links\"]", "failure_mode": "Fails when broad liquidity stress or euphoric theme chasing turns rising amount on weak returns into distribution rather than absorption, or when turnover corridors compress across the whole theme.", "report_contract": "setup_overlay", "ai_supercycle_layer": "ai_networking_optical_cpo", "supply_chain_hypothesis": "Candidate optical/CPO and interconnect bottleneck suppliers may show steady absorption before verified datacenter capex or order evidence reaches the tape.", "relationship_evidence_required": "true", "money_readiness": "research_only", "decision": "revert", "session_branch": "main", "base_ref": "origin/main", "merge_base": "76df81759b87ae939b7f4b094587247ae237c342", "head_commit": "76df81759b87ae939b7f4b094587247ae237c342"}
{"ts": "2026-05-18T06:56:45.563809+08:00", "session_id": "20260518_060002_cd0c45", "market": "cn", "formula": "rank(ts_corr(ret_1d,shift(ret_1d,1),20))*rank(-ts_mean(volume_ratio,5))", "name": "quiet_autocorr_leader_20", "is_ic": 0.0, "is_ic_ir": 0.0, "is_sharpe": 0.0, "is_turnover": 0.0, "is_monotonicity": 0.0, "gates": "FAIL", "status": "reverted", "eval_seconds": 241.1, "sleeve_id": "cn_ai_quiet_accumulation", "mispricing_source": "Slow diffusion of AI-capex and order evidence, plus PM/risk rules that demand obvious turnover confirmation, leave quietly trending leaders underpriced.", "forced_counterparty": "Short-horizon mean-reversion desks and T+1 retail swing traders who fade serial up-days without visible crowd participation.", "data_requirements": "[\"daily CN price/volume/daily_basic for signal test\",\"benchmark hedge attribution vs 000300.SH and 399006.SZ for residual sleeve return\",\"filings or official press releases if winners are tagged as optical/CPO or datacenter suppliers\"]", "failure_mode": "Fails in breakout-chasing regimes where crowded high-volume names keep leading and quiet trend persistence stops being rewarded.", "report_contract": "setup_overlay", "ai_supercycle_layer": "ai_networking_optical_cpo", "supply_chain_hypothesis": "Quiet interconnect and optical bottleneck names may show persistent low-attention accumulation before verified AI-cluster order news is fully reflected in price.", "relationship_evidence_required": "true", "money_readiness": "research_only", "decision": "revert", "session_branch": "main", "base_ref": "origin/main", "merge_base": "76df81759b87ae939b7f4b094587247ae237c342", "head_commit": "76df81759b87ae939b7f4b094587247ae237c342"}
{"ts": "2026-05-18T06:56:45.563809+08:00", "session_id": "20260518_060002_cd0c45", "market": "cn", "formula": "rank(-ts_corr(ret_1d,shift(ret_1d,1),20))*rank(-(ts_max(turnover_rate,20)/ts_mean(turnover_rate,20)))", "name": "anti_autocorr_turnover_spike_20", "is_ic": 0.0, "is_ic_ir": 0.0, "is_sharpe": 0.0, "is_turnover": 0.0, "is_monotonicity": 0.0, "gates": "FAIL", "status": "reverted", "eval_seconds": 143.6, "sleeve_id": "cn_ai_flow_absorption", "mispricing_source": "Retail theme chasing and headline-driven turnover bursts overreact in the short run, while slower institutional accumulation is only recognized after several sessions of stable tape.", "forced_counterparty": "Short-horizon retail momentum traders and benchmark-aware funds that must react to thematic volume spikes despite poor entry quality", "data_requirements": "[\"daily ret_1d and turnover_rate are sufficient for prototype IS test\",\"ai_infra BFS depth/module/pool tags for sleeve attribution\",\"beta-hedged attribution vs 000300.SH and 399006.SZ before promotion\",\"original filings/press releases if any supplier/customer claim is attached to selected names\"]", "failure_mode": "It should fail in mania or policy-shock regimes where one-shot turnover spikes lead instead of orderly accumulation, or when the AI book becomes a pure high-beta chase and short-horizon mean reversion disappears.", "report_contract": "setup_overlay", "ai_supercycle_layer": "ai_networking_optical_cpo", "supply_chain_hypothesis": "Domestic optical/CPO bottleneck names should exhibit low spike turnover and fast dip absorption before hyperscaler capex demand is fully reflected in reported backlog and revenue.", "relationship_evidence_required": "true", "money_readiness": "research_only", "decision": "revert", "session_branch": "main", "base_ref": "origin/main", "merge_base": "76df81759b87ae939b7f4b094587247ae237c342", "head_commit": "76df81759b87ae939b7f4b094587247ae237c342"}
{"ts": "2026-05-18T06:56:45.563809+08:00", "session_id": "20260518_060002_cd0c45", "market": "cn", "formula": "rank(ts_mean(amount,20)/(ts_std(amount,20)+1))*rank(ret_20d-ret_5d)", "name": "orderly_amount_pullback_20", "is_ic": 0.0, "is_ic_ir": 0.0, "is_sharpe": 0.0, "is_turnover": 0.0, "is_monotonicity": 0.0, "gates": "FAIL", "status": "reverted", "eval_seconds": 107.3, "sleeve_id": "daily_price_overlay", "mispricing_source": "A-share AI themes reprice through waves of headline chasing and T+1 profit-taking, while benchmarked institutions add exposure more slowly; steady amount during a weekly pullback can mark absorption before the next leg higher.", "forced_counterparty": "short-horizon retail and fast-money thematic traders taking profits after recent gains", "data_requirements": "[\"daily price/amount already available\", \"before promotion: sleeve correlation, beta-hedged return, residual risk attribution\", \"if used with any supply-chain narrative: source-reviewed universe/evidence card confirmation\"]", "failure_mode": "It stops working when the market shifts into broad mean-reversion or policy/liquidity shock regimes where stable amount no longer signals sponsorship and 20-day winners become crowded exits.", "report_contract": "setup_overlay", "ai_supercycle_layer": "ai_networking_optical_cpo", "supply_chain_hypothesis": "Potential CN AI interconnect/optical bottleneck names should show stable amount-backed monthly leadership with brief weekly pullbacks before order/news confirmation is fully reflected in price.", "relationship_evidence_required": "true", "money_readiness": "research_only", "decision": "revert", "session_branch": "main", "base_ref": "origin/main", "merge_base": "76df81759b87ae939b7f4b094587247ae237c342", "head_commit": "76df81759b87ae939b7f4b094587247ae237c342"}
{"ts": "2026-05-18T06:56:45.563809+08:00", "session_id": "20260518_060002_cd0c45", "market": "cn", "formula": "rank(ts_mean(amount/circ_market_cap,20))*rank(ret_20d-ret_5d)", "name": "float_amount_pullback_20", "is_ic": 0.0, "is_ic_ir": 0.0, "is_sharpe": 0.0, "is_turnover": 0.0, "is_monotonicity": 0.0, "gates": "FAIL", "status": "reverted", "eval_seconds": 129.4, "sleeve_id": "cn_ai_infra_accumulation_pullback", "mispricing_source": "The market underprices continuation when float-normalized capital participation stays elevated while fast money exits on a short pullback.", "forced_counterparty": "Retail theme traders and redemption-constrained benchmark funds trimming after recent weakness", "data_requirements": "Current daily amount, circ_market_cap, and return data are sufficient for IS; promotion needs beta-hedged sleeve attribution, factor-correlation tracking, and ai_infra source-review status before production use.", "failure_mode": "It stops working when elevated amount becomes exit liquidity in a blow-off or macro deleveraging regime, or when the tape shifts from trend continuation to broad mean reversion.", "report_contract": "fresh_buy_gate", "ai_supercycle_layer": "ai_chip_equipment_materials_packaging", "supply_chain_hypothesis": "Orderly float-normalized turnover should surface domestic packaging, testing, and equipment bottleneck names being accumulated ahead of accelerator, memory, and datacenter capex confirmation.", "relationship_evidence_required": "true", "money_readiness": "money_candidate", "decision": "revert", "session_branch": "main", "base_ref": "origin/main", "merge_base": "76df81759b87ae939b7f4b094587247ae237c342", "head_commit": "76df81759b87ae939b7f4b094587247ae237c342"}
{"ts": "2026-05-18T06:56:45.563809+08:00", "session_id": "20260518_060002_cd0c45", "market": "cn", "formula": "rank(-ts_corr(ret_5d, amount / circ_market_cap, 20))", "name": "ret5_floatflow_diverge_20", "is_ic": 0.0, "is_ic_ir": 0.0, "is_sharpe": 0.0, "is_turnover": 0.0, "is_monotonicity": 0.0, "gates": "FAIL", "status": "reverted", "eval_seconds": 220.3, "sleeve_id": "cn_ai_pullback_absorption", "mispricing_source": "The market overreacts to visible 5-day weakness and underreacts to persistent float-adjusted sponsorship; this is an absorption signal, not a high-correlation clone of raw momentum or shadow-price factors.", "forced_counterparty": "T+1 retail profit-takers and benchmarked managers trimming or delaying adds during thematic pullbacks.", "data_requirements": "[\"ret_5d\",\"amount\",\"circ_market_cap\",\"verified CN AI-universe membership\",\"beta-hedged sleeve attribution before promotion\"]", "failure_mode": "It fails when return/float-flow decoupling is caused by trapped illiquidity, limit-up/limit-down mechanics, or theme-wide deleveraging instead of real accumulation.", "report_contract": "fresh_buy_gate", "ai_supercycle_layer": "none", "supply_chain_hypothesis": "Within the verified CN AI-infra universe, D2-D4 bottleneck suppliers should show pullback absorption before source-reviewed demand evidence is fully reflected in price.", "relationship_evidence_required": "true", "money_readiness": "money_candidate", "decision": "revert", "session_branch": "main", "base_ref": "origin/main", "merge_base": "76df81759b87ae939b7f4b094587247ae237c342", "head_commit": "76df81759b87ae939b7f4b094587247ae237c342"}
{"ts": "2026-05-18T06:56:45.563809+08:00", "session_id": "20260518_060002_cd0c45", "market": "cn", "formula": "rank(ts_mean(amount,20)/(ts_std(amount,20)+1))*rank(-ps_ttm)", "name": "stable_amount_value_20", "is_ic": 0.0, "is_ic_ir": 0.0, "is_sharpe": 0.0, "is_turnover": 0.0, "is_monotonicity": 0.0, "gates": "FAIL", "status": "reverted", "eval_seconds": 101.7, "sleeve_id": "cn_ai_infra_repricing", "mispricing_source": "A-share theme capital usually overpays for obvious AI narrative leaders first; cheaper picks-and-shovels names with orderly sponsorship reprice with a lag as benchmarked funds add exposure.", "forced_counterparty": "retail momentum chasers and benchmark-constrained long-only managers who are late to accumulate less glamorous AI-infra enablers", "data_requirements": "[\"daily CN tape + amount + ps_ttm\", \"benchmark-hedged sleeve attribution\", \"correlation to existing sleeves\", \"if promoted: filings/order disclosures to verify capex-bottleneck linkage\"]", "failure_mode": "It should fail in speculative melt-up regimes where expensive narrative beta dominates and valuation discipline stops mattering, or if stable amount merely reflects passive holding in ex-growth incumbents.", "report_contract": "fresh_buy_gate", "ai_supercycle_layer": "ai_chip_equipment_materials_packaging", "supply_chain_hypothesis": "domestic equipment/material/packaging names with steady value sponsorship are being repriced as second-wave AI capex beneficiaries after frontline compute winners", "relationship_evidence_required": "true", "money_readiness": "money_candidate", "decision": "revert", "session_branch": "main", "base_ref": "origin/main", "merge_base": "76df81759b87ae939b7f4b094587247ae237c342", "head_commit": "76df81759b87ae939b7f4b094587247ae237c342"}
{"ts": "2026-05-18T06:56:45.563809+08:00", "session_id": "20260518_060002_cd0c45", "market": "cn", "formula": "rank(-ts_corr(ret_1d,shift(ret_1d,1),20))*rank(ts_min(turnover_rate,20)/ts_mean(turnover_rate,20))", "name": "anti_autocorr_turnover_floor_20", "is_ic": 0.0, "is_ic_ir": 0.0, "is_sharpe": 0.0, "is_turnover": 0.0, "is_monotonicity": 0.0, "gates": "FAIL", "status": "reverted", "eval_seconds": 154.5, "sleeve_id": "cn_ai_infra_absorption", "mispricing_source": "Underreaction to steady sponsor accumulation inside crowded AI themes; this keys off participation quality plus dip-buying behavior, not a simple momentum or shadow-price variant.", "forced_counterparty": "Retail T+1 theme traders and short-horizon momentum capital that must recycle liquidity around AI headlines", "data_requirements": "[\"current CN daily price/volume/amount/turnover_rate is enough for IS\",\"before promotion: beta-hedged sleeve attribution, residual risk/correlation vs existing sleeves, and original-source evidence for any inferred AI order or supplier link\"]", "failure_mode": "The edge should weaken in one-way breakout regimes with no pullback absorption, or when policy/liquidity shocks lift turnover floors across the whole theme indiscriminately.", "report_contract": "fresh_buy_gate", "ai_supercycle_layer": "ai_networking_optical_cpo", "supply_chain_hypothesis": "Candidate optical/CPO and high-speed interconnect bottleneck names should show stable participation-floor absorption before explicit backlog or order confirmation from domestic AI datacenter build-outs.", "relationship_evidence_required": "true", "money_readiness": "money_candidate", "decision": "revert", "session_branch": "main", "base_ref": "origin/main", "merge_base": "76df81759b87ae939b7f4b094587247ae237c342", "head_commit": "76df81759b87ae939b7f4b094587247ae237c342"}
