{"ts": "2026-05-26T14:56:45.533513+08:00", "session_id": "20260526_140002_5486d2", "market": "cn", "formula": "rank(-(ts_max(turnover_rate,20)/ts_sum(turnover_rate,20)))*rank(-ts_mean(high/low,10))", "name": "steady_turnover_absorption_20", "is_ic": -0.0823, "is_ic_ir": -0.272, "is_sharpe": -4.981, "is_turnover": 0.161, "is_monotonicity": -0.75, "gates": "FAIL", "status": "reverted", "eval_seconds": 147.6, "sleeve_id": "daily_flow_absorption", "mispricing_source": "Slow institutional accumulation in validated AI-infra names is masked by disclosure lag and retail attention to headline spikes, so steady absorption is underpriced versus obvious breakout days.", "forced_counterparty": "Retail theme chasers and short-horizon T+1 traders who rotate into visible spike names and provide liquidity in quieter accumulation names", "data_requirements": "[\"daily OHLC+turnover_rate sufficient for IS test\", \"before promotion: rolling corr to active sleeves, beta-hedged residual return attribution, sleeve drawdown stats inside CN AI universe\", \"any supplier/customer interpretation still needs filings/official releases\"]", "failure_mode": "It stops working when the market shifts to gap-driven policy/news trading, or when narrow ranges reflect dead liquidity rather than institutional absorption.", "report_contract": "setup_overlay", "ai_supercycle_layer": "ai_chip_equipment_materials_packaging", "supply_chain_hypothesis": "Candidate domestic AI bottleneck suppliers in equipment/materials/packaging may show quiet float absorption before explicit backlog or capex-chain confirmation; use the factor to surface names, not to assert relationships.", "relationship_evidence_required": "true", "money_readiness": "research_only", "decision": "revert", "session_branch": "main", "base_ref": "origin/main", "merge_base": "c99187be1dc8d78a84147200981562efcde7b8d5", "head_commit": "c99187be1dc8d78a84147200981562efcde7b8d5"}
{"ts": "2026-05-26T14:56:45.533513+08:00", "session_id": "20260526_140002_5486d2", "market": "cn", "formula": "rank(ts_mean(amount/circ_market_cap,20)/ts_std(amount/circ_market_cap,20))", "name": "float_turnover_stability_20", "is_ic": -0.0422, "is_ic_ir": -0.16, "is_sharpe": -4.034, "is_turnover": 0.141, "is_monotonicity": -0.5, "gates": "FAIL", "status": "reverted", "eval_seconds": 134.2, "sleeve_id": "aiinfra_float_absorption", "mispricing_source": "Delayed recognition of AI-infra bottlenecks in CN means accumulation shows up in float-normalized flow before fundamentals are fully accepted into consensus.", "forced_counterparty": "Benchmarked long-only funds and legacy holders who underweight capex-heavy AI-infra names until hard evidence prints, plus retail traders supplying liquidity into repeated small pullbacks.", "data_requirements": "[\"amount\",\"circ_market_cap\",\"AI universe membership/layer tags\",\"factor correlation vs promoted sleeves\",\"beta-hedged attribution vs 000300.SH/399006.SZ and residual risk/capacity report\"]", "failure_mode": "Fails when the market shifts to policy-gap or retail-spike regimes where one-day bursts dominate and steady float absorption no longer predicts follow-through.", "report_contract": "setup_overlay", "ai_supercycle_layer": "ai_chip_equipment_materials_packaging", "supply_chain_hypothesis": "Domestic semiconductor equipment/materials and advanced-packaging names may be experiencing steady float absorption ahead of source-confirmed fab tool, packaging, or optical interconnect order visibility.", "relationship_evidence_required": "true", "money_readiness": "research_only", "decision": "revert", "session_branch": "main", "base_ref": "origin/main", "merge_base": "c99187be1dc8d78a84147200981562efcde7b8d5", "head_commit": "c99187be1dc8d78a84147200981562efcde7b8d5"}
{"ts": "2026-05-26T14:56:45.533513+08:00", "session_id": "20260526_140002_5486d2", "market": "cn", "formula": "rank(ts_mean(amount,20)/ts_std(amount,20)/log(circ_market_cap))", "name": "float_adj_amount_stability_20", "is_ic": -0.0304, "is_ic_ir": -0.112, "is_sharpe": -3.688, "is_turnover": 0.136, "is_monotonicity": -0.55, "gates": "FAIL", "status": "reverted", "eval_seconds": 141.5, "sleeve_id": "daily_flow_overlay", "mispricing_source": "Delayed recognition of AI-capex bottleneck exposure in smaller-float suppliers; the market underprices persistent accumulation because confirmation from filings, capex plans, and customer ramps arrives with lag.", "forced_counterparty": "Benchmarked long-only funds and legacy industrial holders who cannot size aggressively into smaller-float AI names until liquidity and evidence are more obvious", "data_requirements": "[\"rolling corr vs amount_stability_20 and current promoted price sleeves\",\"beta-hedged sleeve return vs 000300.SH and 399006.SZ\",\"execution slippage/turnover ledger vs 0.3% round-trip cost\",\"ai_infra source-review/evidence-card status for any supply-chain claim\"]", "failure_mode": "It stops working when the signal collapses into a pure small-cap beta trade, or when policy/liquidity shocks turn the tape into retail chase instead of patient accumulation.", "report_contract": "action_overlay", "ai_supercycle_layer": "ai_chip_equipment_materials_packaging", "supply_chain_hypothesis": "D2-D3 CN equipment/materials/packaging names with constrained float are being accumulated ahead of verified capex, packaging, and datacenter bottleneck evidence.", "relationship_evidence_required": "true", "money_readiness": "research_only", "decision": "revert", "session_branch": "main", "base_ref": "origin/main", "merge_base": "c99187be1dc8d78a84147200981562efcde7b8d5", "head_commit": "c99187be1dc8d78a84147200981562efcde7b8d5"}
{"ts": "2026-05-26T14:56:45.533513+08:00", "session_id": "20260526_140002_5486d2", "market": "cn", "formula": "rank(ts_mean(amount,20)/ts_max(amount,20))*rank(-ts_mean((high-low)/close,10))", "name": "amount_peak_absorption_20", "is_ic": 0.0348, "is_ic_ir": 0.173, "is_sharpe": -1.809, "is_turnover": 0.14, "is_monotonicity": -0.25, "gates": "FAIL", "status": "reverted", "eval_seconds": 192.4, "sleeve_id": "daily_flow_absorption", "mispricing_source": "Cross-sectional underreaction to persistent capital commitment in AI-infra names; this is a participation-path signal plus tape compression, not a high-correlation clone of existing pure price or candle factors.", "forced_counterparty": "Retail chasers and benchmarked managers rotating into hotter themes and supplying stock during quiet digestion", "data_requirements": "[\"daily OHLCV\",\"amount\",\"ai_infra universe metadata\",\"000300.SH/399006.SZ hedge series\",\"sleeve correlation and residual-risk attribution ledger\"]", "failure_mode": "It breaks when the market is dominated by one-day policy/speculative bursts or indiscriminate beta, so quiet high-participation tape no longer signals informed accumulation.", "report_contract": "setup_overlay", "ai_supercycle_layer": "none", "supply_chain_hypothesis": "Should surface whichever CN AI-infra bottleneck cohort is under quiet institutional accumulation after initial discovery; tape alone does not prove a specific supplier/customer link.", "relationship_evidence_required": "true", "money_readiness": "research_only", "decision": "revert", "session_branch": "main", "base_ref": "origin/main", "merge_base": "c99187be1dc8d78a84147200981562efcde7b8d5", "head_commit": "c99187be1dc8d78a84147200981562efcde7b8d5"}
{"ts": "2026-05-26T14:56:45.533513+08:00", "session_id": "20260526_140002_5486d2", "market": "cn", "formula": "rank(decay_linear(amount / circ_market_cap, 20)) * rank(-ps_ttm)", "name": "decayed_capvel_low_ps", "is_ic": 0.0495, "is_ic_ir": 0.18, "is_sharpe": 2.042, "is_turnover": 0.028, "is_monotonicity": 0.15, "gates": "FAIL", "status": "reverted", "eval_seconds": 125.5, "sleeve_id": "cn_aiinfra_flow_value", "mispricing_source": "Benchmark-constrained funds and confirmation-biased allocators often wait for filings, backlog proof, or policy follow-through, while retail holders sell early strength; that leaves under-owned AI-infra suppliers mispriced even as float-normalized flow builds.", "forced_counterparty": "Retail T+1 profit-takers and benchmarked long-only funds that cannot pre-position aggressively in mid-cap AI-infra suppliers before headline confirmation.", "data_requirements": "[\"amount\",\"circ_market_cap\",\"ps_ttm\"]; for promotion also require long-alpha vs beta-hedge attribution, sleeve correlation matrix, and current ai_infra source-review status.", "failure_mode": "It stops working when low-PS names are cheap for fundamental deterioration, or when flow is driven by headline/speculative spikes rather than steady accumulation, turning capital velocity into crowding.", "report_contract": "fresh_buy_gate", "ai_supercycle_layer": "none", "supply_chain_hypothesis": "Cross-layer AI-infra bottleneck suppliers inside the validated CN universe may be accumulated before customer capex, order visibility, or supply-chain importance is fully recognized in price.", "relationship_evidence_required": "true", "money_readiness": "money_candidate", "decision": "revert", "session_branch": "main", "base_ref": "origin/main", "merge_base": "c99187be1dc8d78a84147200981562efcde7b8d5", "head_commit": "c99187be1dc8d78a84147200981562efcde7b8d5"}
{"ts": "2026-05-26T14:56:45.533513+08:00", "session_id": "20260526_140002_5486d2", "market": "cn", "formula": "rank(-ps_ttm)*rank(ts_mean(turnover_rate,20)/ts_max(turnover_rate,20))", "name": "cheap_even_turnover_20", "is_ic": -0.0143, "is_ic_ir": -0.042, "is_sharpe": -1.457, "is_turnover": 0.121, "is_monotonicity": -0.25, "gates": "FAIL", "status": "reverted", "eval_seconds": 173.7, "sleeve_id": "cn_aiinfra_value_accumulation", "mispricing_source": "Narrative crowding pushes capital into expensive headline AI names, while quieter but cheaper infrastructure suppliers reprice later once steady sponsorship tightens float.", "forced_counterparty": "Retail momentum traders and benchmark-aware funds crowded into liquid/high-story leaders", "data_requirements": "[\"point-in-time ps_ttm from daily_basic\",\"daily turnover_rate history\",\"beta-hedged sleeve return and residual risk attribution before promotion\",\"source-review evidence if any specific supplier/customer claim is attached\"]", "failure_mode": "Stops working in pure momentum/policy-beta melt-ups where expensive leaders keep outrunning valuation, or if turnover evenness collapses into simple illiquidity rather than accumulation.", "report_contract": "setup_overlay", "ai_supercycle_layer": "ai_chip_equipment_materials_packaging", "supply_chain_hypothesis": "Domestic AI compute equipment/material suppliers with still-undemanding sales multiples and steady turnover are being accumulated ahead of fully verified order/backlog repricing.", "relationship_evidence_required": "true", "money_readiness": "research_only", "decision": "revert", "session_branch": "main", "base_ref": "origin/main", "merge_base": "c99187be1dc8d78a84147200981562efcde7b8d5", "head_commit": "c99187be1dc8d78a84147200981562efcde7b8d5"}
{"ts": "2026-05-26T14:56:45.533513+08:00", "session_id": "20260526_140002_5486d2", "market": "cn", "formula": "rank(-(ts_max(turnover_rate,20)/ts_mean(turnover_rate,20)))", "name": "turnover_spike_ratio_20", "is_ic": -0.0557, "is_ic_ir": -0.225, "is_sharpe": -3.806, "is_turnover": 0.155, "is_monotonicity": -0.3, "gates": "FAIL", "status": "reverted", "eval_seconds": 124.3, "sleeve_id": "cn_ai_quiet_accumulation", "mispricing_source": "A-share thematic traders and liquidity-sensitive fast money crowd into visible turnover bursts, while quieter accumulation in validated AI-infra names is underreacted; this is a turnover-extremes sleeve, not a near-duplicate of existing candle or reversal price factors.", "forced_counterparty": "retail theme chasers and benchmarked fast-money desks that must trade the most liquid spikes", "data_requirements": "[\"daily turnover_rate history already available\", \"validated CN AI-infra universe membership\", \"post-pass correlation check vs promoted sleeves\", \"beta-hedged sleeve and residual-risk attribution before promotion\"]", "failure_mode": "It fails when turnover spikes start reflecting true new information about earnings/orders/policy rather than speculative crowding, or when the whole AI theme enters a broad momentum melt-up.", "report_contract": "setup_overlay", "ai_supercycle_layer": "none", "supply_chain_hypothesis": "Within the validated CN AI-infra universe, quiet-turnover names are more likely to be early-stage bottleneck suppliers or enablers being accumulated before the narrative becomes fully crowded.", "relationship_evidence_required": "true", "money_readiness": "research_only", "decision": "revert", "session_branch": "main", "base_ref": "origin/main", "merge_base": "c99187be1dc8d78a84147200981562efcde7b8d5", "head_commit": "c99187be1dc8d78a84147200981562efcde7b8d5"}
{"ts": "2026-05-26T14:56:45.533513+08:00", "session_id": "20260526_140002_5486d2", "market": "cn", "formula": "rank(ts_mean(amount/circ_market_cap,20)/ts_std(amount/circ_market_cap,20))*rank(-ps_ttm)", "name": "low_ps_float_absorption_20", "is_ic": -0.0027, "is_ic_ir": -0.001, "is_sharpe": -2.665, "is_turnover": 0.115, "is_monotonicity": -0.35, "gates": "FAIL", "status": "reverted", "eval_seconds": 253.6, "sleeve_id": "cn_ai_absorption_value", "mispricing_source": "Diffusion lag from headline AI names into second-line enablers; benchmarked and retail flows crowd into glamour leaders, leaving cheaper supply-chain beneficiaries underowned until backlog/capex evidence is explicit.", "forced_counterparty": "Theme-chasing retail and benchmark-aware funds concentrated in liquid high-PS AI leaders", "data_requirements": "[\"current CN daily features are sufficient for IS test\",\"beta-hedged sleeve return and residual risk attribution before promotion\",\"correlation check versus existing amount/turnover stability sleeves\",\"if used outside validated universe, filings/PRs/transcripts needed to verify AI supply-chain role\"]", "failure_mode": "Fails in manic narrative regimes where high-PS leaders keep extending regardless of valuation, or when ps_ttm is stale/misleading around major earnings resets and capital absorption is just defensive liquidity.", "report_contract": "fresh_buy_gate", "ai_supercycle_layer": "ai_chip_equipment_materials_packaging", "supply_chain_hypothesis": "As AI capex diffuses from front-end demand into domestic enabling layers, cheaper equipment/materials/packaging names with steady float absorption are being accumulated ahead of fully verified order translation.", "relationship_evidence_required": "true", "money_readiness": "money_candidate", "decision": "revert", "session_branch": "main", "base_ref": "origin/main", "merge_base": "c99187be1dc8d78a84147200981562efcde7b8d5", "head_commit": "c99187be1dc8d78a84147200981562efcde7b8d5"}
{"ts": "2026-05-26T14:56:45.533513+08:00", "session_id": "20260526_140002_5486d2", "market": "cn", "formula": "rank(ts_std(amount / circ_market_cap,120) / ts_std(amount / circ_market_cap,20)) * rank(-ps_ttm)", "name": "float_cv_improve_low_ps_120_20", "is_ic": -0.0043, "is_ic_ir": -0.029, "is_sharpe": -4.019, "is_turnover": 0.062, "is_monotonicity": -0.4, "gates": "FAIL", "status": "reverted", "eval_seconds": 201.8, "sleeve_id": "daily_price_overlay", "mispricing_source": "Slow fundamental recognition in AI capex chains leaves cheap but newly well-absorbed names under-owned until backlog/order evidence becomes obvious.", "forced_counterparty": "Benchmarked growth funds and short-horizon retail traders who avoid low-PS heavy-asset names before visible earnings/news confirmation.", "data_requirements": "[\"daily amount/circ_market_cap/ps_ttm for ranking\", \"beta-hedged sleeve attribution vs 000300.SH and 399006.SZ\", \"correlation check vs existing amount-stability sleeves\", \"filings/official press releases/transcripts for any supplier/customer interpretation\"]", "failure_mode": "It stops working when the market pays only for immediate narrative momentum, or when stable traded-value improvement reflects passive index flow/liquidity events rather than genuine accumulation.", "report_contract": "setup_overlay", "ai_supercycle_layer": "hard_assets_energy_heavy", "supply_chain_hypothesis": "Low-PS CN AI-infra names whose float-adjusted capital velocity has recently stabilized may be upstream capacity/buildout beneficiaries moving from radar to funded deployment, but exact bottleneck and customer links still need source review.", "relationship_evidence_required": "true", "money_readiness": "research_only", "decision": "revert", "session_branch": "main", "base_ref": "origin/main", "merge_base": "c99187be1dc8d78a84147200981562efcde7b8d5", "head_commit": "c99187be1dc8d78a84147200981562efcde7b8d5"}
{"ts": "2026-05-26T14:56:45.533513+08:00", "session_id": "20260526_140002_5486d2", "market": "cn", "formula": "rank(ts_mean(amount,20)/(ts_std(amount,20)+1))*rank(-pb)", "name": "stable_amount_low_pb", "is_ic": 0.0106, "is_ic_ir": 0.085, "is_sharpe": -1.978, "is_turnover": 0.105, "is_monotonicity": -0.2, "gates": "FAIL", "status": "reverted", "eval_seconds": 113.4, "sleeve_id": "cn_ai_infra_value_absorption", "mispricing_source": "Headline-chasing capital overpays for obvious AI beta and underprices duller hard-asset enablers until primary-source evidence confirms the capex cycle; this is a flow-plus-valuation lag, not a recycled pure price factor.", "forced_counterparty": "Benchmark-constrained mutual funds and short-horizon retail traders rotating into high-velocity narrative names", "data_requirements": "[\"daily amount\",\"pb\",\"beta-hedged sleeve attribution vs 000300.SH and 399006.SZ\",\"sleeve correlation to promoted factors\",\"primary-source backlog/order/filing evidence before any supplier claim is upgraded\"]", "failure_mode": "It stops working when AI capex breadth narrows, `pb` no longer anchors downside, or steady amount mainly reflects defensive large-cap parking instead of informed accumulation.", "report_contract": "setup_overlay", "ai_supercycle_layer": "hard_assets_energy_heavy", "supply_chain_hypothesis": "D2-D3 datacenter, power, cooling, and other hard-asset AI bottleneck suppliers should show steady capital absorption before backlog confirmation appears in primary sources.", "relationship_evidence_required": "true", "money_readiness": "research_only", "decision": "revert", "session_branch": "main", "base_ref": "origin/main", "merge_base": "c99187be1dc8d78a84147200981562efcde7b8d5", "head_commit": "c99187be1dc8d78a84147200981562efcde7b8d5"}
{"ts": "2026-05-26T14:56:45.533513+08:00", "session_id": "20260526_140002_5486d2", "market": "cn", "formula": "rank(decay_exp(amount/circ_market_cap,20))*rank(-ps_ttm)", "name": "exp_float_capvel_low_ps", "is_ic": 0.0418, "is_ic_ir": 0.167, "is_sharpe": 1.12, "is_turnover": 0.024, "is_monotonicity": 0.25, "gates": "FAIL", "status": "reverted", "eval_seconds": 114.7, "sleeve_id": "cn_ai_capacity_repricing", "mispricing_source": "A-share participants often chase downstream narrative beta and react slowly to steady capital absorption in upstream AI-capex names; low PS helps isolate under-owned repricing candidates instead of crowded concept leaders.", "forced_counterparty": "short-horizon retail traders and benchmarked long-only funds that wait for earnings/order confirmation before adding mid-cap upstream suppliers", "data_requirements": "[\"current CN daily panel only for signal computation\",\"beta-hedged sleeve attribution and correlation report before promotion\",\"original-source filings/PRs/transcripts if any bottleneck or supplier claim is upgraded from discovery to evidence\"]", "failure_mode": "stops working when AI-capex names become consensus crowded trades, or when PS dispersion no longer proxies for skepticism because speculative theme rotation dominates fundamental anchoring", "report_contract": "fresh_buy_gate", "ai_supercycle_layer": "ai_chip_equipment_materials_packaging", "supply_chain_hypothesis": "upstream semicap, materials, packaging, or optical suppliers with persistent free-float capital velocity and still-cheap sales multiples are being accumulated ahead of verified order-cycle confirmation", "relationship_evidence_required": "true", "money_readiness": "money_candidate", "decision": "revert", "session_branch": "main", "base_ref": "origin/main", "merge_base": "c99187be1dc8d78a84147200981562efcde7b8d5", "head_commit": "c99187be1dc8d78a84147200981562efcde7b8d5"}
