{"ts": "2026-05-22T07:22:04.701442+08:00", "session_id": "20260522_062703_274f5a", "market": "cn", "formula": "rank(ts_min(ts_sum(turnover_rate,5),20)/ts_std(ts_sum(turnover_rate,5),20))", "name": "weekly_turnover_floorstd_20", "is_ic": -0.0372, "is_ic_ir": -0.151, "is_sharpe": -3.141, "is_turnover": 0.111, "is_monotonicity": -0.5, "gates": "FAIL", "status": "reverted", "eval_seconds": 178.9, "sleeve_id": "cn_ai_participation_stability", "mispricing_source": "The market overweights bursty theme turnover and underweights repeated weekly participation support; this is a participation-shape sleeve, not a close-only momentum clone.", "forced_counterparty": "Retail theme chasers, plus benchmark- and redemption-constrained long-only funds trading for liquidity or mandate rather than 10-20 day alpha", "data_requirements": "[\"daily turnover_rate\",\"ai_infra universe membership + source-review status\",\"000300.SH and 399006.SZ hedge series\",\"corr vs turnover_stability_20 and amount_stability_20\",\"intraday/member-flow ledger before money-ready promotion\"]", "failure_mode": "Fails when speculative high-churn regimes reward turnover spikes, or when a stable weekly turnover floor reflects passive illiquidity/distribution rather than patient accumulation.", "report_contract": "research_only", "ai_supercycle_layer": "ai_chip_equipment_materials_packaging", "supply_chain_hypothesis": "Domestic semicap, materials, packaging, and test bottleneck names should show a stable weekly participation floor before verified backlog/order evidence is fully trusted by the market.", "relationship_evidence_required": "true", "money_readiness": "research_only", "decision": "revert", "session_branch": "main", "base_ref": "origin/main", "merge_base": "c550618668ba3d3ec82401f36dd85be095d0fc92", "head_commit": "c550618668ba3d3ec82401f36dd85be095d0fc92"}
{"ts": "2026-05-22T07:22:04.701442+08:00", "session_id": "20260522_062703_274f5a", "market": "cn", "formula": "rank(-ts_std(amount,20)/ts_mean(amount,20))*rank(ts_mean(volume_ratio,20))", "name": "stable_abnormal_flow_20", "is_ic": -0.0017, "is_ic_ir": -0.011, "is_sharpe": -2.319, "is_turnover": 0.133, "is_monotonicity": -0.45, "gates": "FAIL", "status": "reverted", "eval_seconds": 70.4, "sleeve_id": "daily_price_overlay", "mispricing_source": "The market underweights orderly accumulation because it is less visually salient than limit-up style momentum; AI-infra repricing often starts with steady abnormal turnover before fundamentals are broadly believed.", "forced_counterparty": "Short-horizon retail swing traders and benchmark-aware funds that wait for explicit confirmation, supplying stock into a persistent but non-explosive bid.", "data_requirements": "[\"daily OHLCV\",\"amount\",\"volume_ratio\",\"benchmark beta-hedge attribution\",\"sleeve correlation to existing promoted factors\",\"source-review status from ai_infra for production promotion\"]", "failure_mode": "Fails when AI themes become pure retail momentum regimes where explosive turnover beats orderly accumulation, or when liquidity broadens indiscriminately and `volume_ratio` stops distinguishing true leaders.", "report_contract": "setup_overlay", "ai_supercycle_layer": "ai_chip_equipment_materials_packaging", "supply_chain_hypothesis": "Orderly abnormal flow should surface bottleneck CN suppliers in packaging/testing/equipment that are being accumulated before explicit domestic AI capex or customer-win confirmation.", "relationship_evidence_required": "true", "money_readiness": "research_only", "decision": "revert", "session_branch": "main", "base_ref": "origin/main", "merge_base": "c550618668ba3d3ec82401f36dd85be095d0fc92", "head_commit": "c550618668ba3d3ec82401f36dd85be095d0fc92"}
{"ts": "2026-05-22T07:22:04.701442+08:00", "session_id": "20260522_062703_274f5a", "market": "cn", "formula": "rank(ts_mean(amount,10)/ts_mean(amount,40))*rank(ret_20d-ret_5d)", "name": "funded_pause_reaccel_20", "is_ic": -0.0417, "is_ic_ir": -0.198, "is_sharpe": -1.683, "is_turnover": 0.163, "is_monotonicity": -0.3, "gates": "FAIL", "status": "reverted", "eval_seconds": 104.8, "sleeve_id": "cn_ai_flow_continuation", "mispricing_source": "Short-horizon sellers monetize weekly gains, while thematic and industrial capital scale into AI-infra leaders over multiple weeks; the market underprices re-acceleration after a controlled pause when traded value stays above baseline.", "forced_counterparty": "Retail traders constrained by T+1 and benchmarked PMs that de-risk after short pullbacks or cannot add fast enough in liquid AI-theme rotations.", "data_requirements": "[\"daily OHLCV\",\"amount\",\"20d hold-period pnl after 30bp round-trip cost\",\"factor correlation matrix vs promoted sleeves\",\"beta-hedged sleeve attribution\",\"ai_infra source_review_status and BFS depth/module tags\"]", "failure_mode": "Fails when the regime shifts from trend continuation to broad mean reversion, or when elevated amount reflects distribution/speculative churn instead of accumulation.", "report_contract": "setup_overlay", "ai_supercycle_layer": "none", "supply_chain_hypothesis": "Within source-reviewed CN D1-D3 AI-infra names, sustained amount through a 5-day pause marks bottleneck suppliers or capacity enablers being accumulated ahead of fuller backlog/order recognition.", "relationship_evidence_required": "true", "money_readiness": "research_only", "decision": "revert", "session_branch": "main", "base_ref": "origin/main", "merge_base": "c550618668ba3d3ec82401f36dd85be095d0fc92", "head_commit": "c550618668ba3d3ec82401f36dd85be095d0fc92"}
{"ts": "2026-05-22T07:22:04.701442+08:00", "session_id": "20260522_062703_274f5a", "market": "cn", "formula": "rank(-ts_corr(ret_1d,shift(ret_1d,1),20))*rank(-ts_mean(abs(delta(volume_ratio,1)),20))", "name": "anti_autocorr_relvol_smooth_20", "is_ic": 0.0196, "is_ic_ir": 0.116, "is_sharpe": -2.54, "is_turnover": 0.172, "is_monotonicity": 0.0, "gates": "FAIL", "status": "reverted", "eval_seconds": 218.7, "sleeve_id": "cn_ai_underreaction_overlay", "mispricing_source": "Underreaction to steady sponsorship inside the validated AI-infra universe; relative-volume path smoothness captures accumulation quality rather than simple momentum or reversal.", "forced_counterparty": "Retail theme chasers and redemption/benchmark-constrained mutual funds that recycle inventory around policy and headline bursts.", "data_requirements": "[\"daily price/volume/daily_basic fields already available\",\"benchmark hedge attribution vs 000300.SH and 399006.SZ\",\"sleeve correlation and residual-risk attribution before promotion\"]", "failure_mode": "Fails in policy-frenzy or one-way breakout regimes where spiky crowd participation and positive autocorrelation are rewarded more than quiet absorption.", "report_contract": "setup_overlay", "ai_supercycle_layer": "ai_chip_equipment_materials_packaging", "supply_chain_hypothesis": "Within the CN AI-infra universe, genuine D1-D3 bottleneck suppliers should show smoother abnormal participation and choppy day-to-day price absorption before order/backlog evidence is fully recognized.", "relationship_evidence_required": "true", "money_readiness": "research_only", "decision": "revert", "session_branch": "main", "base_ref": "origin/main", "merge_base": "c550618668ba3d3ec82401f36dd85be095d0fc92", "head_commit": "c550618668ba3d3ec82401f36dd85be095d0fc92"}
{"ts": "2026-05-22T07:22:04.701442+08:00", "session_id": "20260522_062703_274f5a", "market": "cn", "formula": "rank(-ps_ttm)*rank(ts_mean(amount,20)/ts_std(amount,20))", "name": "value_sponsored_amount_20", "is_ic": 0.0057, "is_ic_ir": 0.041, "is_sharpe": -2.026, "is_turnover": 0.11, "is_monotonicity": -0.25, "gates": "FAIL", "status": "reverted", "eval_seconds": 92.9, "sleeve_id": "cn_ai_value_flow", "mispricing_source": "This is a valuation-plus-sponsorship rerating sleeve, not another pure price signal; A-share investors often overpay visible AI narratives and underreact to quieter suppliers that show repeated monetary accumulation at undemanding sales multiples.", "forced_counterparty": "retail theme-chasers and benchmarked long-only managers waiting for earnings confirmation", "data_requirements": "[\"daily CN price/volume/daily_basic is sufficient for IS test\",\"beta-hedged sleeve PnL\",\"residual risk attribution\",\"rolling correlation vs promoted sleeves\",\"original-source evidence before any supplier/customer claim is promoted\"]", "failure_mode": "It stops working if low ps_ttm is mostly distress rather than underowned AI optionality, or if the regime becomes a pure liquidity melt-up where expensive headline leaders keep absorbing all marginal flows.", "report_contract": "setup_overlay", "ai_supercycle_layer": "ai_chip_equipment_materials_packaging", "supply_chain_hypothesis": "Domestic AI accelerator, wafer-fab, and advanced packaging buildouts should pull through equipment/material suppliers that are still cheap on sales but already showing steady monetary sponsorship.", "relationship_evidence_required": "true", "money_readiness": "research_only", "decision": "revert", "session_branch": "main", "base_ref": "origin/main", "merge_base": "c550618668ba3d3ec82401f36dd85be095d0fc92", "head_commit": "c550618668ba3d3ec82401f36dd85be095d0fc92"}
{"ts": "2026-05-22T07:22:04.701442+08:00", "session_id": "20260522_062703_274f5a", "market": "cn", "formula": "rank(ts_mean(amount,20)/circ_market_cap)*rank(ret_20d-ret_5d)", "name": "float_sponsorship_pullback_20", "is_ic": -0.0076, "is_ic_ir": -0.039, "is_sharpe": 0.524, "is_turnover": 0.162, "is_monotonicity": 0.0, "gates": "FAIL", "status": "reverted", "eval_seconds": 106.2, "sleeve_id": "cn_ai_infra_accumulation", "mispricing_source": "A-share retail profit-taking and benchmark-constrained PM underweights cause underreaction to persistent sponsorship in AI-infra leaders, so trend continuation survives shallow pullbacks.", "forced_counterparty": "T+1 retail profit-takers and benchmarked funds trimming winners to manage tracking error", "data_requirements": "[\"daily OHLCV\",\"amount\",\"circ_market_cap\",\"AI-universe membership/source-review status\",\"beta-hedged return and residual risk attribution vs 000300.SH and 399006.SZ\",\"sleeve correlation matrix\"]", "failure_mode": "Fails in liquidity shocks or late-stage blow-offs where high value turnover is distribution rather than accumulation, and in fast-rotation tape where 10-20 day trend persistence breaks down.", "report_contract": "fresh_buy_gate", "ai_supercycle_layer": "ai_chip_equipment_materials_packaging", "supply_chain_hypothesis": "Domestic equipment/materials/packaging names exposed to accelerator and advanced-memory capex bottlenecks should exhibit persistent float-normalized sponsorship, with shallow 5-day pullbacks as supply is absorbed.", "relationship_evidence_required": "true", "money_readiness": "money_candidate", "decision": "revert", "session_branch": "main", "base_ref": "origin/main", "merge_base": "c550618668ba3d3ec82401f36dd85be095d0fc92", "head_commit": "c550618668ba3d3ec82401f36dd85be095d0fc92"}
{"ts": "2026-05-22T07:22:04.701442+08:00", "session_id": "20260522_062703_274f5a", "market": "cn", "formula": "rank(ts_min(turnover_rate,20) / ts_std(close / open - 1, 20))", "name": "turnover_floor_body_stability_20", "is_ic": -0.011, "is_ic_ir": -0.049, "is_sharpe": -0.867, "is_turnover": 0.081, "is_monotonicity": -0.5, "gates": "FAIL", "status": "reverted", "eval_seconds": 217.1, "sleeve_id": "cn_ai_infra_accumulation", "mispricing_source": "Disclosure lag and benchmark frictions let institutions accumulate bottleneck names gradually; a persistent turnover floor plus low intraday body noise indicates supply absorption instead of retail lottery trading.", "forced_counterparty": "Short-horizon retail traders and benchmarked funds underweight smaller AI-infra bottlenecks, plus redemption-driven sellers providing inventory on quiet days.", "data_requirements": "[\"daily CN tape already available\",\"ai_infra source-reviewed universe membership/status\",\"sleeve correlation vs promoted factors\",\"beta-hedged and residual attribution vs 000300.SH and 399006.SZ\"]", "failure_mode": "Fails in broad risk-on chase regimes where noisy high-beta spikes dominate quiet sponsorship, or in indiscriminate de-risking when turnover floors disappear across the whole AI basket.", "report_contract": "fresh_buy_gate", "ai_supercycle_layer": "none", "supply_chain_hypothesis": "Source-reviewed D1-D3 AI bottleneck suppliers in the CN universe should show this turnover-floor plus tight-body pattern before backlog, capex, or order evidence is fully priced.", "relationship_evidence_required": "true", "money_readiness": "money_candidate", "decision": "revert", "session_branch": "main", "base_ref": "origin/main", "merge_base": "c550618668ba3d3ec82401f36dd85be095d0fc92", "head_commit": "c550618668ba3d3ec82401f36dd85be095d0fc92"}
{"ts": "2026-05-22T07:22:04.701442+08:00", "session_id": "20260522_062703_274f5a", "market": "cn", "formula": "rank(-ts_corr(turnover_rate,shift(turnover_rate,5),20))", "name": "weekly_turnover_anti_autocorr_20", "is_ic": -0.0149, "is_ic_ir": -0.057, "is_sharpe": -3.183, "is_turnover": 0.193, "is_monotonicity": -0.45, "gates": "FAIL", "status": "reverted", "eval_seconds": 153.2, "sleeve_id": "cn_ai_flow_underreaction", "mispricing_source": "Retail and theme money extrapolate visible turnover spikes, while institutions accumulate on quieter weeks; the market underprices that orderly de-crowding in turnover.", "forced_counterparty": "retail momentum traders, theme-chasing active funds, benchmark rebalancers", "data_requirements": "[\"current daily turnover_rate is sufficient for IS test\",\"promotion requires factor corr vs existing sleeves, beta-hedged return, and residual risk attribution\",\"if surfaced names are described as AI bottleneck suppliers/customers, verify via filings, official PRs, or transcripts\"]", "failure_mode": "This stops working in headline-chasing melt-up regimes where serial turnover spikes keep being rewarded, or in liquidity-stress regimes where quiet turnover reflects distribution rather than absorption.", "report_contract": "research_only", "ai_supercycle_layer": "ai_chip_equipment_materials_packaging", "supply_chain_hypothesis": "Domestic AI-capex bottleneck names in semiconductor equipment/materials/packaging should exhibit staggered weekly float absorption before explicit order, utilization, or localization evidence is fully recognized.", "relationship_evidence_required": "true", "money_readiness": "research_only", "decision": "revert", "session_branch": "main", "base_ref": "origin/main", "merge_base": "c550618668ba3d3ec82401f36dd85be095d0fc92", "head_commit": "c550618668ba3d3ec82401f36dd85be095d0fc92"}
{"ts": "2026-05-22T07:22:04.701442+08:00", "session_id": "20260522_062703_274f5a", "market": "cn", "formula": "rank(ret_20d-ret_5d)*rank(-(ts_max(turnover_rate,20)/ts_sum(turnover_rate,20)))", "name": "broad_participation_reset_20", "is_ic": -0.066, "is_ic_ir": -0.249, "is_sharpe": -3.459, "is_turnover": 0.202, "is_monotonicity": -0.2, "gates": "FAIL", "status": "reverted", "eval_seconds": 202.8, "sleeve_id": "ai_infra_cn_leadership_reset", "mispricing_source": "A-share thematic capital often overpays for single-day AI narratives, then de-risks quickly; institutions that still need AI exposure accumulate validated suppliers during quiet pullbacks, so broad-participation resets should outperform.", "forced_counterparty": "short-horizon retail chasers and fast theme funds forced to trade around T+1 liquidity and risk limits", "data_requirements": "[\"No extra daily inputs for IS test\",\"corr_vs_promoted_sleeves\",\"beta_hedged_alpha_vs_000300.SH_and_399006.SZ\",\"residual_risk_attribution\",\"source-reviewed evidence cards before any supplier/customer claim is promoted\"]", "failure_mode": "This stops working when AI tape becomes pure one-day policy/news squeeze, or when concentrated spike participation is actually the correct leadership signal rather than exhaustion.", "report_contract": "setup_overlay", "ai_supercycle_layer": "ai_chip_equipment_materials_packaging", "supply_chain_hypothesis": "Candidate domestic AI capex bottleneck names in equipment/materials/packaging should surface when the market rotates from one-day concept spikes toward broader accumulation ahead of verified order visibility.", "relationship_evidence_required": "true", "money_readiness": "research_only", "decision": "revert", "session_branch": "main", "base_ref": "origin/main", "merge_base": "c550618668ba3d3ec82401f36dd85be095d0fc92", "head_commit": "c550618668ba3d3ec82401f36dd85be095d0fc92"}
{"ts": "2026-05-22T07:22:04.701442+08:00", "session_id": "20260522_062703_274f5a", "market": "cn", "formula": "rank(ts_std(amount/circ_market_cap,60)/ts_std(amount/circ_market_cap,20))*rank(-ts_mean(high/low-1,10))", "name": "float_flow_compress_quiet_20_60", "is_ic": -0.0961, "is_ic_ir": -0.297, "is_sharpe": -5.849, "is_turnover": 0.134, "is_monotonicity": -0.75, "gates": "FAIL", "status": "reverted", "eval_seconds": 142.5, "sleeve_id": "cn_ai_flow_absorption", "mispricing_source": "Short-horizon traders extrapolate low excitement and sell into quiet tape, while slower institutions accumulate bottleneck enablers gradually before order/capex confirmation is fully priced.", "forced_counterparty": "retail hot-money accounts and benchmark-constrained managers who reduce dull names during low-volatility pauses", "data_requirements": "[daily amount, circ_market_cap, high, low, long-alpha vs beta-hedge return series, sleeve correlation, residual risk attribution]; filings/news only if any specific supplier or customer claim is later promoted", "failure_mode": "It fails in broad risk-off or liquidity-starved regimes where tight ranges reflect indifference and illiquidity, not accumulation.", "report_contract": "setup_overlay", "ai_supercycle_layer": "ai_chip_equipment_materials_packaging", "supply_chain_hypothesis": "Domestic semicap and advanced-packaging bottleneck names can show float-flow compression and tight-range absorption before capex/order confirmation becomes consensus.", "relationship_evidence_required": "true", "money_readiness": "research_only", "decision": "revert", "session_branch": "main", "base_ref": "origin/main", "merge_base": "c550618668ba3d3ec82401f36dd85be095d0fc92", "head_commit": "c550618668ba3d3ec82401f36dd85be095d0fc92"}
{"ts": "2026-05-22T07:22:04.701442+08:00", "session_id": "20260522_062703_274f5a", "market": "cn", "formula": "rank(-ts_corr(amount / circ_market_cap, high / low - 1, 20))", "name": "float_range_absorption_20", "is_ic": 0.0035, "is_ic_ir": 0.018, "is_sharpe": -0.061, "is_turnover": 0.188, "is_monotonicity": 0.3, "gates": "FAIL", "status": "reverted", "eval_seconds": 146.0, "sleeve_id": "cn_ai_infra_accumulation", "mispricing_source": "Float-scaled accumulation is hard to distinguish from ordinary churn in A-shares, so narrow-float AI infra leaders can be under-owned even while real buying is already absorbing supply.", "forced_counterparty": "Short-horizon retail traders and profit-takers supplying inventory; benchmark-aware managers underweight the theme and must add slowly.", "data_requirements": "[\"daily amount\",\"daily circ_market_cap\",\"daily high/low\",\"AI-infra universe membership\",\"sleeve beta/correlation attribution vs CN benchmarks before promotion\"]", "failure_mode": "Fails when broad speculative breakout regimes reward noisy range expansion, or when compressed range reflects illiquidity/stagnation rather than accumulation.", "report_contract": "setup_overlay", "ai_supercycle_layer": "ai_chip_equipment_materials_packaging", "supply_chain_hypothesis": "Candidate bottleneck equipment/materials/packaging names are being accumulated ahead of source-reviewed order, utilization, or capex confirmation.", "relationship_evidence_required": "true", "money_readiness": "research_only", "decision": "revert", "session_branch": "main", "base_ref": "origin/main", "merge_base": "c550618668ba3d3ec82401f36dd85be095d0fc92", "head_commit": "c550618668ba3d3ec82401f36dd85be095d0fc92"}
{"ts": "2026-05-22T07:22:04.701442+08:00", "session_id": "20260522_062703_274f5a", "market": "cn", "formula": "rank(ts_mean(amount,20)/ts_std(amount,20))*rank(-ts_mean(volume_ratio,5))", "name": "stable_amount_quiet_participation_20", "is_ic": 0.0132, "is_ic_ir": 0.079, "is_sharpe": -2.676, "is_turnover": 0.192, "is_monotonicity": -0.6, "gates": "FAIL", "status": "reverted", "eval_seconds": 122.2, "sleeve_id": "daily_flow_overlay", "mispricing_source": "A-share thematic traders anchor on noisy volume spikes; they underreact when abnormal participation fades but steady cash throughput shows institutions are still building positions.", "forced_counterparty": "Short-horizon retail chasers and benchmarked funds rotating to fresher themes, leaving stock behind during quiet consolidation.", "data_requirements": "[\"daily OHLCV\",\"daily_basic amount\",\"daily volume_ratio\",\"sleeve correlation vs promoted factors\",\"beta-hedged sleeve return and residual risk attribution\"]", "failure_mode": "It stops working when the regime shifts to fast mean-reversion or event-driven breakout tape, where low volume reflects genuine demand exhaustion rather than float absorption.", "report_contract": "setup_overlay", "ai_supercycle_layer": "ai_chip_equipment_materials_packaging", "supply_chain_hypothesis": "Verified CN D1-D3 AI bottleneck suppliers in equipment/materials/advanced packaging should exhibit quiet float absorption before order or backlog evidence is fully repriced by the market.", "relationship_evidence_required": "true", "money_readiness": "research_only", "decision": "revert", "session_branch": "main", "base_ref": "origin/main", "merge_base": "c550618668ba3d3ec82401f36dd85be095d0fc92", "head_commit": "c550618668ba3d3ec82401f36dd85be095d0fc92"}
