{"ts": "2026-05-19T07:24:13.107689+08:00", "session_id": "20260519_062703_3d7e37", "market": "cn", "formula": "rank(ts_mean(amount/circ_market_cap,20)/ts_std(turnover_rate,20))", "name": "float_absorption_quality_20", "is_ic": 0.0, "is_ic_ir": 0.0, "is_sharpe": 0.0, "is_turnover": 0.0, "is_monotonicity": 0.0, "gates": "FAIL", "status": "reverted", "eval_seconds": 84.6, "sleeve_id": "daily_flow_overlay", "mispricing_source": "The market underreacts to float-normalized accumulation in AI bottleneck names because quiet absorption lacks headline catalysts and is not captured by plain return-based momentum.", "forced_counterparty": "Benchmarked funds and liquidity-constrained holders that trim or avoid smaller-float suppliers, plus retail traders who rotate out of non-explosive consolidations", "data_requirements": "[\"daily amount\",\"turnover_rate\",\"circ_market_cap\",\"ai_infra universe metadata\",\"benchmark series for 000300.SH and 399006.SZ beta-hedge attribution\"]", "failure_mode": "It stops working when AI themes become pure limit-up retail speculation, when float supply expands via placements/unlocks, or when policy/macros dominate stock-specific accumulation.", "report_contract": "fresh_buy_gate", "ai_supercycle_layer": "ai_chip_equipment_materials_packaging", "supply_chain_hypothesis": "Domestic AI bottleneck suppliers in equipment/materials/packaging should show persistent float absorption before downstream accelerator, server, or optical buildout evidence is fully recognized.", "relationship_evidence_required": "true", "money_readiness": "money_candidate", "decision": "revert", "session_branch": "main", "base_ref": "origin/main", "merge_base": "cba2bf7038911f7fc6f17786240fd0ea6749fcda", "head_commit": "cba2bf7038911f7fc6f17786240fd0ea6749fcda"}
{"ts": "2026-05-19T07:24:13.107689+08:00", "session_id": "20260519_062703_3d7e37", "market": "cn", "formula": "rank(ts_mean(amount/circ_market_cap,20)/ts_std(amount/circ_market_cap,20))", "name": "float_flow_stability_20", "is_ic": 0.0, "is_ic_ir": 0.0, "is_sharpe": 0.0, "is_turnover": 0.0, "is_monotonicity": 0.0, "gates": "FAIL", "status": "reverted", "eval_seconds": 95.9, "sleeve_id": "cn_ai_flow_quality", "mispricing_source": "This captures sponsorship and inventory absorption rather than recent price trend or candle shape, so it is not just a high-correlation variant of kshadow_5; the edge comes from slow institutional reweighting into scarce AI-infra capacity names.", "forced_counterparty": "Benchmark-constrained domestic funds underweight niche suppliers, plus T+1 retail capital that rotates out of quiet names before the sponsorship signal is fully priced.", "data_requirements": "[\"daily amount\",\"circ_market_cap\",\"validated AI-universe membership\",\"benchmark hedge series for beta-adjusted sleeve attribution\",\"filings/press releases/transcripts if using the signal to claim a specific bottleneck supplier relationship\"]", "failure_mode": "It stops working when the AI theme becomes a broad speculative beta trade or when news-spike chasing dominates steady accumulation, making quiet participation no longer informative.", "report_contract": "fresh_buy_gate", "ai_supercycle_layer": "ai_chip_equipment_materials_packaging", "supply_chain_hypothesis": "Domestic advanced-packaging, equipment, and materials bottlenecks should show steady float-normalized accumulation before official capex, order, or qualification confirmation, so the factor should surface those leaders inside the validated AI universe.", "relationship_evidence_required": "true", "money_readiness": "money_candidate", "decision": "revert", "session_branch": "main", "base_ref": "origin/main", "merge_base": "cba2bf7038911f7fc6f17786240fd0ea6749fcda", "head_commit": "cba2bf7038911f7fc6f17786240fd0ea6749fcda"}
{"ts": "2026-05-19T07:24:13.107689+08:00", "session_id": "20260519_062703_3d7e37", "market": "cn", "formula": "rank(-ts_std(delta(log(amount),5),20))", "name": "log_amount_change_stability_20_5", "is_ic": 0.0, "is_ic_ir": 0.0, "is_sharpe": 0.0, "is_turnover": 0.0, "is_monotonicity": 0.0, "gates": "FAIL", "status": "reverted", "eval_seconds": 124.9, "sleeve_id": "cn_ai_flow_accumulation", "mispricing_source": "The market overpays for noisy turnover bursts and underreacts to orderly value-flow persistence in bottleneck names being accumulated ahead of broader recognition.", "forced_counterparty": "Retail T+1 theme traders, short-horizon liquidity providers, and benchmark-constrained domestic long-only funds that rotate on headlines instead of medium-horizon inventory absorption.", "data_requirements": "[\"daily amount is sufficient for IS test\",\"before promotion require beta-hedged sleeve return vs 000300.SH and 399006.SZ\",\"rolling corr vs kshadow_5 and current flow sleeves\",\"residual risk attribution by AI layer/BFS depth\",\"original filings/press releases if later attaching supplier/order claims\"]", "failure_mode": "It should fail in rumor-squeeze or macro-liquidity unwind regimes where smooth amount reflects neglect or trapped liquidity rather than informed accumulation.", "report_contract": "setup_overlay", "ai_supercycle_layer": "ai_chip_equipment_materials_packaging", "supply_chain_hypothesis": "Candidate domestic semicap/materials/packaging bottleneck names may show steady weekly value-flow accumulation before verified order, backlog, or localization evidence reaches filings and official releases.", "relationship_evidence_required": "true", "money_readiness": "research_only", "decision": "revert", "session_branch": "main", "base_ref": "origin/main", "merge_base": "cba2bf7038911f7fc6f17786240fd0ea6749fcda", "head_commit": "cba2bf7038911f7fc6f17786240fd0ea6749fcda"}
{"ts": "2026-05-19T07:24:13.107689+08:00", "session_id": "20260519_062703_3d7e37", "market": "cn", "formula": "rank((ret_20d - ret_5d) / (ts_std(turnover_rate,20) + 0.01))", "name": "lead_pullback_turnover_20", "is_ic": 0.0, "is_ic_ir": 0.0, "is_sharpe": 0.0, "is_turnover": 0.0, "is_monotonicity": 0.0, "gates": "FAIL", "status": "reverted", "eval_seconds": 94.2, "sleeve_id": "cn_ai_infra_leadership_pullback", "mispricing_source": "Benchmark-constrained institutions add AI bottleneck exposure gradually, while short-horizon A-share traders sell after a brief cooling period; stable turnover suggests supply is being absorbed rather than distributed.", "forced_counterparty": "T+1 retail profit-takers and benchmarked managers waiting for confirmation", "data_requirements": "[\"daily CN OHLCV+turnover_rate on promoted AI-infra universe\", \"benchmark beta/residual attribution vs 000300.SH and 399006.SZ\", \"sleeve correlation check vs kshadow_5 and amount_stability_20 family before promotion\"]", "failure_mode": "It should fail when the market shifts from orderly leadership to retail blow-off or policy-shock rotation, where low turnover reflects illiquidity and 5-day pullbacks become true trend breaks.", "report_contract": "setup_overlay", "ai_supercycle_layer": "ai_networking_optical_cpo", "supply_chain_hypothesis": "Optical/interconnect bottleneck candidates that keep 20-day leadership but digest with stable float turnover are being accumulated ahead of harder order/capex confirmation.", "relationship_evidence_required": "true", "money_readiness": "research_only", "decision": "revert", "session_branch": "main", "base_ref": "origin/main", "merge_base": "cba2bf7038911f7fc6f17786240fd0ea6749fcda", "head_commit": "cba2bf7038911f7fc6f17786240fd0ea6749fcda"}
{"ts": "2026-05-19T07:24:13.107689+08:00", "session_id": "20260519_062703_3d7e37", "market": "cn", "formula": "rank(ts_mean(turnover_rate,20)/ts_max(turnover_rate,20))", "name": "turnover_evenness_20", "is_ic": 0.0, "is_ic_ir": 0.0, "is_sharpe": 0.0, "is_turnover": 0.0, "is_monotonicity": 0.0, "gates": "FAIL", "status": "reverted", "eval_seconds": 179.1, "sleeve_id": "cn_ai_flow_quality", "mispricing_source": "T+1 retail chase flow overprices single-day attention spikes and underprices slow accumulation; the market is late to reward steady participation before order/capex evidence is obvious.", "forced_counterparty": "short-horizon retail/event chasers and benchmark-constrained active funds that cannot fully pre-position in less liquid bottleneck names", "data_requirements": "[\"daily OHLCV\",\"daily_basic.turnover_rate\",\"ai_infra universe membership\",\"beta-hedged sleeve attribution vs 000300.SH and 399006.SZ before promotion\"]", "failure_mode": "It stops working when one-day turnover spikes carry genuine new information and keep trending, or when thematic liquidity is so broad that even turnover no longer distinguishes accumulation from crowded consensus.", "report_contract": "fresh_buy_gate", "ai_supercycle_layer": "ai_chip_equipment_materials_packaging", "supply_chain_hypothesis": "Within CN AI chip equipment/materials/packaging names, sustained even turnover may flag upstream bottleneck suppliers being accumulated ahead of verified downstream accelerator and datacenter demand confirmation.", "relationship_evidence_required": "true", "money_readiness": "money_candidate", "decision": "revert", "session_branch": "main", "base_ref": "origin/main", "merge_base": "cba2bf7038911f7fc6f17786240fd0ea6749fcda", "head_commit": "cba2bf7038911f7fc6f17786240fd0ea6749fcda"}
{"ts": "2026-05-19T07:24:13.107689+08:00", "session_id": "20260519_062703_3d7e37", "market": "cn", "formula": "rank(-ts_corr(ret_1d,shift(ret_1d,1),20))*rank(-ts_std(turnover_rate,20)/(ts_mean(turnover_rate,20)+0.01))", "name": "anti_autocorr_turnover_stability_20", "is_ic": 0.0, "is_ic_ir": 0.0, "is_sharpe": 0.0, "is_turnover": 0.0, "is_monotonicity": 0.0, "gates": "FAIL", "status": "reverted", "eval_seconds": 109.8, "sleeve_id": "cn_ai_accumulation_overlay", "mispricing_source": "Short-horizon inventory is being transferred to patient buyers; the turnover-stability leg filters out speculative churn, so this is not just another pure price-momentum or candle-shape variant.", "forced_counterparty": "Retail hot-money traders, T+1 profit-takers, and liquidity-driven benchmark rebalancers", "data_requirements": "[\"daily ret_1d\",\"daily turnover_rate\",\"AI universe membership/status\",\"portfolio beta-hedge and residual risk attribution before promotion\"]", "failure_mode": "It should stop working when the market shifts into broad speculative chase or panic liquidation, where turnover spikes and one-day reversals no longer reflect quiet accumulation.", "report_contract": "setup_overlay", "ai_supercycle_layer": "ai_chip_equipment_materials_packaging", "supply_chain_hypothesis": "Domestic AI bottleneck equipment/materials/packaging names should show dip-buying with stable float churn before order, capex, or localization evidence is fully reflected in price.", "relationship_evidence_required": "true", "money_readiness": "research_only", "decision": "revert", "session_branch": "main", "base_ref": "origin/main", "merge_base": "cba2bf7038911f7fc6f17786240fd0ea6749fcda", "head_commit": "cba2bf7038911f7fc6f17786240fd0ea6749fcda"}
{"ts": "2026-05-19T07:24:13.107689+08:00", "session_id": "20260519_062703_3d7e37", "market": "cn", "formula": "rank(ts_mean(amount/circ_market_cap,20)/ts_std(amount/circ_market_cap,20))*rank(-ts_corr(close,delta(amount,5),20))", "name": "float_absorb_price_lag_20", "is_ic": 0.0, "is_ic_ir": 0.0, "is_sharpe": 0.0, "is_turnover": 0.0, "is_monotonicity": 0.0, "gates": "FAIL", "status": "reverted", "eval_seconds": 211.2, "sleeve_id": "daily_price_overlay", "mispricing_source": "Flow-price underreaction in limited-float AI-infra names; this is a float-normalized absorption signal, not a simple momentum or candle-shape variant.", "forced_counterparty": "Retail momentum traders and benchmark-aware long-only funds that trim or ignore flat-tape names until the breakout is already visible", "data_requirements": "[\"daily close/high/low/amount/circ_market_cap\",\"canonical ai_infra CN universe membership\",\"benchmark beta and residual risk attribution vs 000300.SH/399006.SZ before promotion\"]", "failure_mode": "Fails in headline-driven squeeze regimes where price gaps immediately on news, or when amount changes are dominated by short-lived thematic rotation instead of informed accumulation.", "report_contract": "fresh_buy_gate", "ai_supercycle_layer": "ai_chip_equipment_materials_packaging", "supply_chain_hypothesis": "Domestic semicap and advanced-packaging bottleneck suppliers may show float-stable absorption before backlog or order visibility is obvious in filings and official disclosures.", "relationship_evidence_required": "true", "money_readiness": "money_candidate", "decision": "revert", "session_branch": "main", "base_ref": "origin/main", "merge_base": "cba2bf7038911f7fc6f17786240fd0ea6749fcda", "head_commit": "cba2bf7038911f7fc6f17786240fd0ea6749fcda"}
{"ts": "2026-05-19T07:24:13.107689+08:00", "session_id": "20260519_062703_3d7e37", "market": "cn", "formula": "rank(-(ts_max(turnover_rate,20)/(ts_mean(turnover_rate,20)+0.01)))", "name": "turnover_spike_ratio_20", "is_ic": 0.0, "is_ic_ir": 0.0, "is_sharpe": 0.0, "is_turnover": 0.0, "is_monotonicity": 0.0, "gates": "FAIL", "status": "reverted", "eval_seconds": 161.2, "sleeve_id": "daily_flow_quality_overlay", "mispricing_source": "Retail theme-chasing overpays for one-day turnover spikes, while patient institutional accumulation in validated AI-infra names happens across many sessions and is under-rewarded by the market.", "forced_counterparty": "Short-horizon retail chasers and benchmark-constrained holders trimming into strength or supplying liquidity mechanically after spike days.", "data_requirements": "[\"daily turnover_rate on the validated CN ai_infra universe\",\"beta-hedged sleeve attribution vs 000300.SH/399006.SZ\",\"residual risk attribution and sleeve drawdown\",\"correlation check vs promoted factors\",\"filings/news only if later attaching a specific supplier/customer claim\"]", "failure_mode": "It stops working when the regime rewards blow-off momentum, or when turnover spikes reflect real fundamental repricing rather than speculative churn, making concentrated participation informative instead of bearish.", "report_contract": "setup_overlay", "ai_supercycle_layer": "ai_chip_equipment_materials_packaging", "supply_chain_hypothesis": "Candidate D1-D3 domestic chip-equipment, materials, and packaging bottleneck names should show lower turnover-spike concentration when institutions are positioning ahead of later capex/order confirmation; no specific relationship is asserted yet.", "relationship_evidence_required": "true", "money_readiness": "research_only", "decision": "revert", "session_branch": "main", "base_ref": "origin/main", "merge_base": "cba2bf7038911f7fc6f17786240fd0ea6749fcda", "head_commit": "cba2bf7038911f7fc6f17786240fd0ea6749fcda"}
{"ts": "2026-05-19T07:24:13.107689+08:00", "session_id": "20260519_062703_3d7e37", "market": "cn", "formula": "rank(ts_mean(turnover_rate,20)/ts_max(turnover_rate,20))*rank(-ts_corr(ret_1d,shift(ret_1d,1),20))", "name": "anti_autocorr_turnover_evenness_20", "is_ic": 0.0, "is_ic_ir": 0.0, "is_sharpe": 0.0, "is_turnover": 0.0, "is_monotonicity": 0.0, "gates": "FAIL", "status": "reverted", "eval_seconds": 158.6, "sleeve_id": "cn_ai_flow_underreaction", "mispricing_source": "Retail-dominated flow and benchmarked managers underreact to orderly accumulation in AI-infra names, so absorption shows up in tape before consensus reprices it.", "forced_counterparty": "retail round-trippers, momentum chasers, and mandate-driven rebalance flow", "data_requirements": "[\"current CN daily fields only for IS test\",\"correlation check vs kshadow_5 and turnover_stability_20\",\"beta-hedged sleeve attribution vs 000300.SH and 399006.SZ before promotion\"]", "failure_mode": "It stops working in one-way policy-beta or speculative blowoff regimes, where even turnover reflects crowding instead of accumulation and negative autocorr disappears.", "report_contract": "setup_overlay", "ai_supercycle_layer": "ai_chip_equipment_materials_packaging", "supply_chain_hypothesis": "Candidate domestic AI equipment/materials bottleneck names may show steady float absorption and dip-buying before verified order or backlog evidence is public.", "relationship_evidence_required": "true", "money_readiness": "research_only", "decision": "revert", "session_branch": "main", "base_ref": "origin/main", "merge_base": "cba2bf7038911f7fc6f17786240fd0ea6749fcda", "head_commit": "cba2bf7038911f7fc6f17786240fd0ea6749fcda"}
{"ts": "2026-05-19T07:24:13.107689+08:00", "session_id": "20260519_062703_3d7e37", "market": "cn", "formula": "rank((ret_20d-ret_5d)/(ts_std(amount,20)+1))", "name": "orderly_leadership_amount_20", "is_ic": 0.0, "is_ic_ir": 0.0, "is_sharpe": 0.0, "is_turnover": 0.0, "is_monotonicity": 0.0, "gates": "FAIL", "status": "reverted", "eval_seconds": 109.8, "sleeve_id": "cn_ai_infra_accumulation", "mispricing_source": "Slow institutional reweighting into AI-capex beneficiaries meets short-horizon profit taking; orderly amount during a shallow pause signals under-recognized accumulation rather than exhausted momentum.", "forced_counterparty": "Retail chasers and short-horizon traders who de-risk after a brief stall; benchmarked managers who cannot complete reweights immediately.", "data_requirements": "[\"daily OHLCV+amount\",\"ai_infra CN universe membership and source-review status\",\"000300.SH/399006.SZ benchmark returns for beta-hedged attribution\",\"existing sleeve correlation ledger\"]", "failure_mode": "It breaks in policy-headline melt-up or broad small-cap lottery regimes where unstable speculative flows dominate and 5-day pullbacks no longer separate accumulation from distribution.", "report_contract": "fresh_buy_gate", "ai_supercycle_layer": "ai_chip_equipment_materials_packaging", "supply_chain_hypothesis": "CN AI chip equipment/materials/packaging bottleneck names showing orderly 20-day leadership and low amount volatility are being accumulated ahead of verified datacenter and accelerator capex translation into orders.", "relationship_evidence_required": "true", "money_readiness": "money_candidate", "decision": "revert", "session_branch": "main", "base_ref": "origin/main", "merge_base": "cba2bf7038911f7fc6f17786240fd0ea6749fcda", "head_commit": "cba2bf7038911f7fc6f17786240fd0ea6749fcda"}
{"ts": "2026-05-19T07:24:13.107689+08:00", "session_id": "20260519_062703_3d7e37", "market": "cn", "formula": "rank((ret_20d-ret_5d)/(ts_std(amount,20)/ts_mean(amount,20)+0.01))", "name": "stable_amount_trend_gap_20", "is_ic": 0.0, "is_ic_ir": 0.0, "is_sharpe": 0.0, "is_turnover": 0.0, "is_monotonicity": 0.0, "gates": "FAIL", "status": "reverted", "eval_seconds": 66.4, "sleeve_id": "cn_ai_infra_accumulation", "mispricing_source": "Slow institutions build positions over weeks in scarce AI-infra names, while short-horizon traders misread quiet consolidations as loss of momentum.", "forced_counterparty": "Retail momentum chasers and benchmark-constrained managers who cannot add size during low-excitement pullbacks", "data_requirements": "[\"daily benchmark returns for 000300.SH/399006.SZ\", \"beta-hedged sleeve PnL and drawdown ledger\", \"rolling corr to promoted sleeves\", \"source-review status for top-ranked AI-infra names\"]", "failure_mode": "Fails when the market shifts to pure speculative burst chasing, or when stable amount reflects illiquidity rather than sponsored accumulation.", "report_contract": "research_only", "ai_supercycle_layer": "ai_chip_equipment_materials_packaging", "supply_chain_hypothesis": "Domestic semicap/materials/packaging bottleneck names should show orderly medium-term accumulation before order visibility is obvious in public evidence.", "relationship_evidence_required": "false", "money_readiness": "research_only", "decision": "revert", "session_branch": "main", "base_ref": "origin/main", "merge_base": "cba2bf7038911f7fc6f17786240fd0ea6749fcda", "head_commit": "cba2bf7038911f7fc6f17786240fd0ea6749fcda"}
{"ts": "2026-05-19T07:24:13.107689+08:00", "session_id": "20260519_062703_3d7e37", "market": "cn", "formula": "rank(ts_min(turnover_rate,20)/(ts_max(turnover_rate,20)+0.01))", "name": "turnover_corridor_20", "is_ic": 0.0, "is_ic_ir": 0.0, "is_sharpe": 0.0, "is_turnover": 0.0, "is_monotonicity": 0.0, "gates": "FAIL", "status": "reverted", "eval_seconds": 183.2, "sleeve_id": "cn_ai_participation_quality", "mispricing_source": "Attention-driven A-share flows chase turnover spikes and neglect names where sponsorship stays steady through dull sessions; this is a participation-shape signal, not a candle or momentum clone.", "forced_counterparty": "Retail theme chasers and short-horizon funds that must buy headline liquidity and sell quiet consolidations", "data_requirements": "[\"daily turnover_rate history\",\"AI universe membership/source-review status\",\"beta-hedged attribution vs 000300.SH and 399006.SZ\",\"correlation to existing sleeves including kshadow_5\"]", "failure_mode": "It weakens in true discovery or manic breakout regimes when turnover spikes carry real information, or when market-wide liquidity stress compresses turnover for the whole universe.", "report_contract": "setup_overlay", "ai_supercycle_layer": "none", "supply_chain_hypothesis": "none", "relationship_evidence_required": "false", "money_readiness": "research_only", "decision": "revert", "session_branch": "main", "base_ref": "origin/main", "merge_base": "cba2bf7038911f7fc6f17786240fd0ea6749fcda", "head_commit": "cba2bf7038911f7fc6f17786240fd0ea6749fcda"}
