{"ts": "2026-05-11T06:56:38.409230+08:00", "session_id": "20260511_060043_a5d430", "market": "cn", "formula": "rank(-ts_std(open/close,20))*rank(ts_mean(amount/circ_market_cap,20)/ts_max(amount/circ_market_cap,20))", "name": "float_body_balance_20", "is_ic": 0.0394, "is_ic_ir": 0.253, "is_sharpe": -0.182, "is_turnover": 0.108, "is_monotonicity": -0.05, "gates": "PASS", "status": "candidate", "eval_seconds": 228.5, "sleeve_id": "execution_absorption_overlay", "mispricing_source": "Slow underreaction to steady float reallocation with low intraday body dispersion; this is an execution-quality sleeve, not a close-volume correlation clone or raw range-volatility variant.", "forced_counterparty": "retail day traders, redemption-driven funds, and benchmark rebalancers", "data_requirements": "[open, close, amount, circ_market_cap]", "failure_mode": "Fails in event-driven gap regimes, limit-up/limit-down clusters, or one-way momentum tapes where low body variance reflects illiquidity or distribution rather than accumulation.", "report_contract": "setup_overlay", "money_readiness": "research_only", "decision": "candidate", "session_branch": "main", "base_ref": "origin/main", "merge_base": "62e27b1718a9c8c7cee619126770fe57cd98d173", "head_commit": "62e27b1718a9c8c7cee619126770fe57cd98d173"}
{"ts": "2026-05-11T06:56:38.409230+08:00", "session_id": "20260511_060043_a5d430", "market": "cn", "formula": "rank(ts_min(ts_sum(amount/circ_market_cap,5),20)/ts_std(ts_sum(amount/circ_market_cap,5),20))*rank(ts_mean(ts_sum(volume,5),20)/ts_max(ts_sum(volume,5),20))", "name": "float_support_weekly_volume_evenness_20", "is_ic": 0.0282, "is_ic_ir": 0.29, "is_sharpe": 0.727, "is_turnover": 0.106, "is_monotonicity": 0.7, "gates": "PASS", "status": "candidate", "eval_seconds": 184.5, "sleeve_id": "weekly_float_share_absorption", "mispricing_source": "Underreaction to quiet ownership transfer; unlike `vpcorr_5` or `d2_10_513`, this is a pure flow-shape sleeve with no price input, so it should be less redundant than another price-response factor.", "forced_counterparty": "Retail attention chasers and benchmark/redemption-constrained long-only funds trading for liquidity or mandate reasons rather than 10-20 day alpha.", "data_requirements": "[\"amount\",\"circ_market_cap\",\"volume\"]; intraday member/order-flow ledger is still needed before money-ready deployment to distinguish true accumulation from stagnant illiquidity.", "failure_mode": "It fails when smooth flow mainly reflects dead liquidity, or when policy/theme regimes reward bursty high-turnover leaders so steady float support stops being informative.", "report_contract": "setup_overlay", "money_readiness": "research_only", "decision": "candidate", "session_branch": "main", "base_ref": "origin/main", "merge_base": "62e27b1718a9c8c7cee619126770fe57cd98d173", "head_commit": "62e27b1718a9c8c7cee619126770fe57cd98d173"}
{"ts": "2026-05-11T06:56:38.409230+08:00", "session_id": "20260511_060043_a5d430", "market": "cn", "formula": "rank(-ts_std(delta(log(amount),5),20))*rank(ts_mean((close-open)/(high-low+0.01),20))", "name": "log_amountchg_body_bias_20", "is_ic": 0.0451, "is_ic_ir": 0.259, "is_sharpe": 1.098, "is_turnover": 0.153, "is_monotonicity": 0.55, "gates": "PASS", "status": "checks_failed", "eval_seconds": 207.8, "sleeve_id": "daily_flow_quality", "mispricing_source": "Slow institutional accumulation in low-attention names is recognized with a lag, while bursty attention capital overpays for obvious moves elsewhere.", "forced_counterparty": "Retail attention traders and benchmarked/theme-rotating funds that underweight dull, steadily absorbed names", "data_requirements": "[\"amount\",\"open\",\"close\",\"high\",\"low\"]", "failure_mode": "Breaks in gap-driven or policy/headline-led tape where overnight information dominates intraday absorption, or when apparent smooth amount is just illiquidity rather than sponsorship.", "report_contract": "fresh_buy_gate", "money_readiness": "money_candidate", "decision": "revert", "session_branch": "main", "base_ref": "origin/main", "merge_base": "62e27b1718a9c8c7cee619126770fe57cd98d173", "head_commit": "62e27b1718a9c8c7cee619126770fe57cd98d173", "oos": "PASS", "checks_status": "failed"}
{"ts": "2026-05-11T06:56:38.409230+08:00", "session_id": "20260511_060043_a5d430", "market": "cn", "formula": "rank(-ts_corr(ret_1d,shift(ret_1d,1),20))*rank(ts_min(ts_sum(amount/circ_market_cap,5),20)/ts_std(ts_sum(amount/circ_market_cap,5),20))", "name": "anti_autocorr_weekly_float_floorstd_20", "is_ic": 0.0367, "is_ic_ir": 0.44, "is_sharpe": 3.947, "is_turnover": 0.151, "is_monotonicity": 0.6, "gates": "PASS", "status": "candidate", "eval_seconds": 169.0, "sleeve_id": "anti_autocorr_float_absorption", "mispricing_source": "Slow underreaction to steady float-normalized sponsorship after temporary liquidity shocks; attention capital reacts to visible price action, not quiet inventory transfer.", "forced_counterparty": "redemption-driven long-only funds, benchmark rebalancers, and retail attention traders", "data_requirements": "[\"ret_1d\",\"amount\",\"circ_market_cap\"]; daily data is enough for research, but intraday/member-level flow would improve money-readiness validation", "failure_mode": "Stops working when positive return autocorrelation dominates, or when smooth float flow is mostly dead illiquidity/passive index flow rather than real accumulation.", "report_contract": "fresh_buy_gate", "money_readiness": "money_candidate", "decision": "candidate", "session_branch": "main", "base_ref": "origin/main", "merge_base": "62e27b1718a9c8c7cee619126770fe57cd98d173", "head_commit": "62e27b1718a9c8c7cee619126770fe57cd98d173"}
{"ts": "2026-05-11T06:56:38.409230+08:00", "session_id": "20260511_060043_a5d430", "market": "cn", "formula": "rank(-ts_max(ret_1d,20))*rank(ts_min(ts_sum(amount/circ_market_cap,5),20)/ts_max(ts_sum(amount/circ_market_cap,5),20))", "name": "low_lottery_weekly_float_corridor_20", "is_ic": 0.0381, "is_ic_ir": 0.248, "is_sharpe": 0.226, "is_turnover": 0.097, "is_monotonicity": -0.05, "gates": "PASS", "status": "candidate", "eval_seconds": 195.0, "sleeve_id": "cn_float_underreaction", "mispricing_source": "Retail convexity preference underprices boring sponsorship; steady float absorption reprices slowly under T+1 and benchmarked-manager frictions.", "forced_counterparty": "Retail lottery chasers and benchmarked/rebalancing sellers providing steady stock supply", "data_requirements": "[\"ret_1d\",\"amount\",\"circ_market_cap\"]; downstream beta hedge plus size/liquidity risk attribution required", "failure_mode": "Fails when policy/speculative tapes reward lottery tails, or when weekly float corridor degenerates into a pure illiquidity proxy rather than accumulation", "report_contract": "setup_overlay", "money_readiness": "research_only", "decision": "candidate", "session_branch": "main", "base_ref": "origin/main", "merge_base": "62e27b1718a9c8c7cee619126770fe57cd98d173", "head_commit": "62e27b1718a9c8c7cee619126770fe57cd98d173"}
{"ts": "2026-05-11T06:56:38.409230+08:00", "session_id": "20260511_060043_a5d430", "market": "cn", "formula": "rank(-(ts_max(turnover_rate,20)/ts_sum(turnover_rate,20)))*rank(-ts_corr(ret_1d,shift(ret_1d,1),40))", "name": "steady_flow_anti_autocorr_20_40", "is_ic": 0.0244, "is_ic_ir": 0.265, "is_sharpe": -0.08, "is_turnover": 0.14, "is_monotonicity": 0.25, "gates": "PASS", "status": "candidate", "eval_seconds": 96.1, "sleeve_id": "steady_flow_meanrevert", "mispricing_source": "Retail/theme traders create bursty attention days, while institutions working inventory across many sessions induce mild return reversals before the position is fully reflected in price.", "forced_counterparty": "Retail attention chasers and benchmarked managers trading around subscription/redemption liquidity windows", "data_requirements": "[\"turnover_rate\",\"ret_1d\"]", "failure_mode": "Fails in strong momentum/attention regimes where turnover spikes carry genuine information and positive autocorrelation dominates, or if market execution becomes uniformly smoothed across the cross-section.", "report_contract": "fresh_buy_gate", "money_readiness": "money_candidate", "decision": "candidate", "session_branch": "main", "base_ref": "origin/main", "merge_base": "62e27b1718a9c8c7cee619126770fe57cd98d173", "head_commit": "62e27b1718a9c8c7cee619126770fe57cd98d173"}
{"ts": "2026-05-11T06:56:38.409230+08:00", "session_id": "20260511_060043_a5d430", "market": "cn", "formula": "rank(ts_mean(volume_ratio,20)/ts_max(volume_ratio,20))*rank(-ts_std(close/open-1,20))", "name": "relvol_even_body_stability_20", "is_ic": 0.0411, "is_ic_ir": 0.264, "is_sharpe": -0.21, "is_turnover": 0.106, "is_monotonicity": -0.05, "gates": "PASS", "status": "checks_failed", "eval_seconds": 236.5, "sleeve_id": "daily_flow_underreaction", "mispricing_source": "Underreaction to orderly participation; this is driven by steady relative attention and candle stability, not raw trend, range expansion, or close-volume correlation.", "forced_counterparty": "Liquidity-motivated sellers; retail traders are uneconomic counterparties because they prefer bursty tapes and lottery-like names.", "data_requirements": "[\"open\",\"close\",\"volume_ratio\"]", "failure_mode": "Fails when bursty momentum is rewarded immediately, or when policy/news shocks dominate slow accumulation effects.", "report_contract": "fresh_buy_gate", "money_readiness": "money_candidate", "decision": "revert", "session_branch": "main", "base_ref": "origin/main", "merge_base": "62e27b1718a9c8c7cee619126770fe57cd98d173", "head_commit": "62e27b1718a9c8c7cee619126770fe57cd98d173", "oos": "PASS", "checks_status": "failed"}
{"ts": "2026-05-11T06:56:38.409230+08:00", "session_id": "20260511_060043_a5d430", "market": "cn", "formula": "rank(ts_corr(ret_1d, shift(ret_1d, 1), 20)) * rank(ts_std(delta(turnover_rate, 5), 60) / ts_std(delta(turnover_rate, 5), 20))", "name": "trend_turnshock_compress_20_60", "is_ic": 0.0075, "is_ic_ir": 0.062, "is_sharpe": -1.74, "is_turnover": 0.164, "is_monotonicity": 0.0, "gates": "FAIL", "status": "reverted", "eval_seconds": 235.2, "sleeve_id": "daily_trend_flow_overlay", "mispricing_source": "Slow information diffusion and price-limit/friction-driven underreaction; the turnover-shock compression term makes this a flow-regime signal, not a high-correlation clone of price momentum or price-volume correlation.", "forced_counterparty": "Benchmarked rebalancers and liquidity-motivated retail traders who supply stock during gradual trends without demanding immediate price clearing.", "data_requirements": "[\"ret_1d\", \"turnover_rate\"]", "failure_mode": "It should stop working in event-driven tapes where turnover shocks rise on real news, or in retail mania regimes where noisy high-shock names lead instead of orderly trend names.", "report_contract": "setup_overlay", "money_readiness": "research_only", "decision": "revert", "session_branch": "main", "base_ref": "origin/main", "merge_base": "62e27b1718a9c8c7cee619126770fe57cd98d173", "head_commit": "62e27b1718a9c8c7cee619126770fe57cd98d173"}
{"ts": "2026-05-11T06:56:38.409230+08:00", "session_id": "20260511_060043_a5d430", "market": "cn", "formula": "rank(ts_min(ts_sum(amount/circ_market_cap,5),20)/ts_std(ts_sum(amount/circ_market_cap,5),20)-ts_corr(ret_1d,shift(ret_1d,1),20))", "name": "weekly_float_floorstd_underreaction_20", "is_ic": 0.0257, "is_ic_ir": 0.271, "is_sharpe": 1.72, "is_turnover": 0.1, "is_monotonicity": 0.3, "gates": "PASS", "status": "candidate", "eval_seconds": 167.0, "sleeve_id": "float_flow_underreaction", "mispricing_source": "Slow ownership transfer under T+1 and attention bias; institutions slice orders across days while the market overweights noisy daily prints and underprices steady float-normalized sponsorship.", "forced_counterparty": "retail attention traders, redemption-driven sellers, benchmark/rebalance-constrained long-only funds", "data_requirements": "[\"ret_1d\",\"amount\",\"circ_market_cap\"]; intraday order-flow or broker/member trade ledger is still needed before money-ready deployment to separate true accumulation from passive churn", "failure_mode": "Fails in policy/theme momentum regimes where positive autocorrelation is informative, or when stable float-normalized flow is just illiquidity/passive index churn rather than informed sponsorship.", "report_contract": "setup_overlay", "money_readiness": "research_only", "decision": "candidate", "session_branch": "main", "base_ref": "origin/main", "merge_base": "62e27b1718a9c8c7cee619126770fe57cd98d173", "head_commit": "62e27b1718a9c8c7cee619126770fe57cd98d173"}
{"ts": "2026-05-11T14:56:11.601126+08:00", "session_id": "20260511_140003_5e5559", "market": "cn", "formula": "rank(ts_mean(turnover_rate,20) / ts_std(turnover_rate,20))", "name": "turnover_stability_20", "is_ic": 0.0374, "is_ic_ir": 0.373, "is_sharpe": 1.522, "is_turnover": 0.121, "is_monotonicity": 0.7, "gates": "PASS", "status": "candidate", "eval_seconds": 73.9, "sleeve_id": "daily_participation_stability", "mispricing_source": "Attention-driven overpricing of turnover bursts; slow institutional accumulation gets incorporated more gradually than speculative demand shocks.", "forced_counterparty": "Retail theme chasers and flow-driven momentum accounts crowding into high-turnover names despite weak medium-term payoff.", "data_requirements": "[\"turnover_rate daily history\", \"20-day lookback\", \"standard beta hedge and residual risk model on portfolio construction side\"]", "failure_mode": "Stops working in broad speculative momentum regimes where high-turnover names keep trending instead of mean-reverting, or if turnover spikes start reflecting real information diffusion rather than noise.", "report_contract": "fresh_buy_gate", "money_readiness": "money_candidate", "decision": "candidate", "session_branch": "main", "base_ref": "origin/main", "merge_base": "62e27b1718a9c8c7cee619126770fe57cd98d173", "head_commit": "62e27b1718a9c8c7cee619126770fe57cd98d173"}
{"ts": "2026-05-11T14:56:11.601126+08:00", "session_id": "20260511_140003_5e5559", "market": "cn", "formula": "rank(ts_std(amount,60) / ts_std(decay_linear(amount,5),20))", "name": "amount_quiet_compress_20_60", "is_ic": 0.0301, "is_ic_ir": 0.252, "is_sharpe": 2.728, "is_turnover": 0.105, "is_monotonicity": 0.8, "gates": "PASS", "status": "candidate", "eval_seconds": 209.4, "sleeve_id": "daily_flow_compression", "mispricing_source": "Slow recognition of post-crowding flow compression; this is a money-flow regime signal rather than a high-correlation variant of an existing price factor.", "forced_counterparty": "attention-driven retail and calendar-rebalancing institutions that trade liquidity bursts but do not pay for quiet re-accumulation", "data_requirements": "[amount]", "failure_mode": "Fails when turnover spikes carry real information and leadership stays in crowded high-attention names, so quiet names remain ignored.", "report_contract": "fresh_buy_gate", "money_readiness": "money_candidate", "decision": "candidate", "session_branch": "main", "base_ref": "origin/main", "merge_base": "62e27b1718a9c8c7cee619126770fe57cd98d173", "head_commit": "62e27b1718a9c8c7cee619126770fe57cd98d173"}
{"ts": "2026-05-11T14:56:11.601126+08:00", "session_id": "20260511_140003_5e5559", "market": "cn", "formula": "rank(-ts_std(delta(log(amount),5),20))", "name": "log_amount_change_stability_20_5", "is_ic": 0.0396, "is_ic_ir": 0.342, "is_sharpe": 1.229, "is_turnover": 0.104, "is_monotonicity": 0.05, "gates": "PASS", "status": "checks_failed", "eval_seconds": 128.1, "sleeve_id": "flow_path_smoothness", "mispricing_source": "Second-order flow smoothness captures gradual absorption rather than raw price momentum or raw amount level, so it should be less collinear with existing price-correlation sleeves.", "forced_counterparty": "Retail theme chasers and benchmarked liquidity traders who transact for attention/rebalancing rather than alpha", "data_requirements": "[\"amount\"] daily CN traded value only", "failure_mode": "Stops working in policy/news shock regimes or retail-mania tapes where sudden flow spikes carry real information instead of temporary crowding", "report_contract": "fresh_buy_gate", "money_readiness": "money_candidate", "decision": "revert", "session_branch": "main", "base_ref": "origin/main", "merge_base": "62e27b1718a9c8c7cee619126770fe57cd98d173", "head_commit": "62e27b1718a9c8c7cee619126770fe57cd98d173", "oos": "PASS", "checks_status": "failed"}
{"ts": "2026-05-11T14:56:11.601126+08:00", "session_id": "20260511_140003_5e5559", "market": "cn", "formula": "rank(-ts_corr(ret_1d,shift(ret_1d,1),20))*rank(ts_mean(ts_sum(amount,5),20)/ts_max(ts_sum(amount,5),20))", "name": "anti_autocorr_weekly_amount_evenness_20", "is_ic": 0.0367, "is_ic_ir": 0.473, "is_sharpe": 3.934, "is_turnover": 0.167, "is_monotonicity": 0.35, "gates": "PASS", "status": "candidate", "eval_seconds": 149.1, "sleeve_id": "daily_flow_underreaction", "mispricing_source": "Order-splitting institutions create smooth weekly notional flow while retail traders overreact day to day; this is not just another price factor because the edge comes from flow evenness interacting with anti-autocorr, not from raw trend or reversal alone.", "forced_counterparty": "Retail punters and redemption/benchmark-driven sellers who supply liquidity into noisy daily reversals.", "data_requirements": "[\"ret_1d\",\"amount\"]", "failure_mode": "Fails in strong breakout/momentum regimes where concentrated flow spikes are rewarded and daily mean reversion stops masking accumulation.", "report_contract": "fresh_buy_gate", "money_readiness": "money_candidate", "decision": "candidate", "session_branch": "main", "base_ref": "origin/main", "merge_base": "62e27b1718a9c8c7cee619126770fe57cd98d173", "head_commit": "62e27b1718a9c8c7cee619126770fe57cd98d173"}
{"ts": "2026-05-11T14:56:11.601126+08:00", "session_id": "20260511_140003_5e5559", "market": "cn", "formula": "rank(-ts_corr(ret_1d,shift(ret_1d,1),20)) * rank(-ts_mean(volume_ratio,5))", "name": "low_lottery_uncrowded_20_5", "is_ic": 0.0336, "is_ic_ir": 0.321, "is_sharpe": 1.308, "is_turnover": 0.208, "is_monotonicity": 0.05, "gates": "PASS", "status": "candidate", "eval_seconds": 212.4, "sleeve_id": "behavioral_attention_flow", "mispricing_source": "lottery preference and attention chasing make high-visibility, serial-move names too expensive, leaving dull low-attention names underowned", "forced_counterparty": "retail day traders and benchmark-aware fast money that need recent action/liquidity confirmation", "data_requirements": "[ret_1d, volume_ratio]", "failure_mode": "breaks in speculative mania regimes where attention spikes keep compounding, or when low volume_ratio is just deteriorating relevance/illiquidity rather than quiet accumulation", "report_contract": "fresh_buy_gate", "money_readiness": "money_candidate", "decision": "candidate", "session_branch": "main", "base_ref": "origin/main", "merge_base": "62e27b1718a9c8c7cee619126770fe57cd98d173", "head_commit": "62e27b1718a9c8c7cee619126770fe57cd98d173"}
{"ts": "2026-05-11T14:56:11.601126+08:00", "session_id": "20260511_140003_5e5559", "market": "cn", "formula": "rank(-ts_corr(amount / circ_market_cap, high / low - 1, 20))", "name": "float_range_absorption_20", "is_ic": 0.0182, "is_ic_ir": 0.233, "is_sharpe": -1.567, "is_turnover": 0.169, "is_monotonicity": 0.55, "gates": "PASS", "status": "candidate", "eval_seconds": 175.7, "sleeve_id": "float_absorption_overlay", "mispricing_source": "Underreaction to low-impact accumulation; this is a flow-impact efficiency signal, not just a price-level variant.", "forced_counterparty": "Retail sellers and liquidity-needing holders exiting into patient institutional bids", "data_requirements": "[amount, circ_market_cap, high, low]", "failure_mode": "It breaks when tight ranges come from trading frictions or dead liquidity rather than absorption, or when speculative churn dominates float turnover.", "report_contract": "fresh_buy_gate", "money_readiness": "money_candidate", "decision": "candidate", "session_branch": "main", "base_ref": "origin/main", "merge_base": "62e27b1718a9c8c7cee619126770fe57cd98d173", "head_commit": "62e27b1718a9c8c7cee619126770fe57cd98d173"}
{"ts": "2026-05-11T14:56:11.601126+08:00", "session_id": "20260511_140003_5e5559", "market": "cn", "formula": "rank(-ts_mean(abs(delta(turnover_rate,5)),20))*rank(ts_mean(close/open-1,20))", "name": "turnover_body_bias_20_5", "is_ic": 0.0183, "is_ic_ir": 0.092, "is_sharpe": -1.808, "is_turnover": 0.136, "is_monotonicity": -0.05, "gates": "FAIL", "status": "reverted", "eval_seconds": 162.0, "sleeve_id": "daily_flow_underreaction", "mispricing_source": "Slow-diffusion accumulation by schedule-constrained buyers; the edge comes from flow regularity plus mild intraday buy pressure, not from being another range-vol or volume-price-correlation clone.", "forced_counterparty": "Benchmarked mutual funds and rebalance sellers exiting gradually, plus retail day traders supplying liquidity because the tape looks too quiet to arbitrage aggressively.", "data_requirements": "[\"turnover_rate\",\"open\",\"close\"]", "failure_mode": "Fails when smooth turnover mostly reflects dormancy rather than accumulation, or when gap/news-driven tape dominates intraday closes and body bias stops mapping to real buying pressure.", "report_contract": "fresh_buy_gate", "money_readiness": "money_candidate", "decision": "revert", "session_branch": "main", "base_ref": "origin/main", "merge_base": "62e27b1718a9c8c7cee619126770fe57cd98d173", "head_commit": "62e27b1718a9c8c7cee619126770fe57cd98d173"}
