{"ts": "2026-05-26T07:23:53.826949+08:00", "session_id": "20260526_062702_4e1ae2", "market": "cn", "formula": "rank(ts_mean(amount,20)/circ_market_cap)*rank(-ts_std(turnover_rate,20))", "name": "float_absorb_stable_20", "is_ic": 0.0029, "is_ic_ir": 0.011, "is_sharpe": -1.327, "is_turnover": 0.128, "is_monotonicity": 0.05, "gates": "FAIL", "status": "reverted", "eval_seconds": 69.9, "sleeve_id": "cn_ai_flow_accumulation", "mispricing_source": "Quiet institutional accumulation is underpriced because retail attention decays during low-noise consolidations, and non-specialist funds cannot size into smaller AI-infra names without moving price.", "forced_counterparty": "Retail theme traders and redemption-constrained generalist funds that sell or avoid low-excitement consolidation periods", "data_requirements": "[\"current CN daily fields only for signal generation\",\"factor correlation check vs promoted sleeves\",\"beta-hedged attribution vs 000300.SH and 399006.SZ before promotion\"]", "failure_mode": "It stops working in indiscriminate theme-chasing or broad liquidity unwind regimes, where high capital intensity simply marks crowding and turnover stability breaks as exits become one-sided.", "report_contract": "fresh_buy_gate", "ai_supercycle_layer": "none", "supply_chain_hypothesis": "Cross-layer AI-infra bottleneck leaders in the reviewed universe should show float absorption before backlog/order confirmation is obvious in public narrative.", "relationship_evidence_required": "false", "money_readiness": "money_candidate", "decision": "revert", "session_branch": "main", "base_ref": "origin/main", "merge_base": "c99187be1dc8d78a84147200981562efcde7b8d5", "head_commit": "c99187be1dc8d78a84147200981562efcde7b8d5"}
{"ts": "2026-05-26T07:23:53.826949+08:00", "session_id": "20260526_062702_4e1ae2", "market": "cn", "formula": "rank(ts_mean(turnover_rate,20)/ts_max(turnover_rate,20))", "name": "turnover_evenness_20", "is_ic": -0.0557, "is_ic_ir": -0.225, "is_sharpe": -3.806, "is_turnover": 0.155, "is_monotonicity": -0.3, "gates": "FAIL", "status": "reverted", "eval_seconds": 149.3, "sleeve_id": "cn_ai_flow_quality", "mispricing_source": "A-share AI narratives are crowded by short-horizon thematic capital; gradual accumulation is underreacted because benchmarked longs and T+1 frictions slow price discovery.", "forced_counterparty": "retail hot-money accounts and fast theme chasers concentrated in headline-driven spike days", "data_requirements": "[\"current CN daily price/amount/turnover_rate data is sufficient for IS test\",\"before promotion require sleeve correlation vs existing promoted factors plus beta-hedged attribution vs 000300.SH and 399006.SZ\",\"any supplier/order interpretation must come from ai_infra source review\"]", "failure_mode": "It stops working when policy/rumor regimes reward one-day turnover spikes with persistent follow-through, or when broad liquidity makes weak-hand participation indistinguishable from institutional accumulation.", "report_contract": "action_overlay", "ai_supercycle_layer": "ai_chip_equipment_materials_packaging", "supply_chain_hypothesis": "Candidate AI capex bottleneck names in domestic semicap/materials/advanced-packaging should show even float rotation before filings fully confirm backlog, while non-bottleneck story names should show turnover concentrated in spike days.", "relationship_evidence_required": "true", "money_readiness": "research_only", "decision": "revert", "session_branch": "main", "base_ref": "origin/main", "merge_base": "c99187be1dc8d78a84147200981562efcde7b8d5", "head_commit": "c99187be1dc8d78a84147200981562efcde7b8d5"}
{"ts": "2026-05-26T07:23:53.826949+08:00", "session_id": "20260526_062702_4e1ae2", "market": "cn", "formula": "rank(ts_min(amount/(circ_market_cap+1),20)/ts_mean(amount/(circ_market_cap+1),20))", "name": "float_flow_floor_20", "is_ic": -0.0234, "is_ic_ir": -0.097, "is_sharpe": -3.767, "is_turnover": 0.159, "is_monotonicity": 0.2, "gates": "FAIL", "status": "reverted", "eval_seconds": 184.6, "sleeve_id": "cn_ai_infra_flow_quality", "mispricing_source": "The market overreacts to bursty theme days and underprices steady ownership transfer; this is a flow-floor sleeve, not a recent-return or simple price-trend clone.", "forced_counterparty": "Retail theme chasers and benchmark-constrained managers who trim quiet names for liquidity or short-term relative performance", "data_requirements": "[\"current CN daily amount and circ_market_cap are sufficient for IS test\",\"before promotion require beta-hedged sleeve attribution and residual risk stats\",\"check correlation versus amount_stability_20 and turnover_stability_20\",\"use ai_infra universe metadata for BFS/module narrative only\"]", "failure_mode": "It should fail when policy/news shock regimes reward bursty speculative rotation or limit-up chains, because one-day crowding overwhelms the steady-absorption signal.", "report_contract": "setup_overlay", "ai_supercycle_layer": "ai_chip_equipment_materials_packaging", "supply_chain_hypothesis": "Domestic chip equipment/materials/advanced-packaging bottleneck names should show a stable float-flow floor before validated order, capex, or localization evidence becomes consensus.", "relationship_evidence_required": "true", "money_readiness": "research_only", "decision": "revert", "session_branch": "main", "base_ref": "origin/main", "merge_base": "c99187be1dc8d78a84147200981562efcde7b8d5", "head_commit": "c99187be1dc8d78a84147200981562efcde7b8d5"}
{"ts": "2026-05-26T07:23:53.826949+08:00", "session_id": "20260526_062702_4e1ae2", "market": "cn", "formula": "rank(-ps_ttm)*rank(ts_mean(amount,20)/circ_market_cap)", "name": "cheap_float_accum_20", "is_ic": 0.0474, "is_ic_ir": 0.183, "is_sharpe": 1.353, "is_turnover": 0.031, "is_monotonicity": 0.3, "gates": "FAIL", "status": "reverted", "eval_seconds": 85.8, "sleeve_id": "cn_ai_infra_value_flow", "mispricing_source": "Narrative crowding leaves lower-multiple infrastructure names under-owned; float-normalized cash turnover detects sponsorship before consensus fully rerates them.", "forced_counterparty": "Benchmarked thematic investors and retail momentum traders who prefer high-beta/high-PS AI stories and under-allocate to slower-rerating infra suppliers.", "data_requirements": "[\"daily amount\",\"ps_ttm\",\"circ_market_cap\",\"benchmark hedge return series\",\"sleeve correlation panel\",\"filings/transcripts for backlog-capex confirmation before promotion\"]", "failure_mode": "It breaks when low PS is a value trap from real demand deterioration, or when amount rises because of distribution/speculative churn rather than accumulation.", "report_contract": "fresh_buy_gate", "ai_supercycle_layer": "hard_assets_energy_heavy", "supply_chain_hypothesis": "Within the source-reviewed CN AI universe, power/datacenter/equipment enablers should rerate first when float-normalized cash turnover rises despite still-cheap sales multiples.", "relationship_evidence_required": "true", "money_readiness": "money_candidate", "decision": "revert", "session_branch": "main", "base_ref": "origin/main", "merge_base": "c99187be1dc8d78a84147200981562efcde7b8d5", "head_commit": "c99187be1dc8d78a84147200981562efcde7b8d5"}
{"ts": "2026-05-26T07:23:53.826949+08:00", "session_id": "20260526_062702_4e1ae2", "market": "cn", "formula": "rank(-ts_std(amount,20)/ts_mean(amount,20))*rank(-pct_change(close,10))", "name": "amount_cv_pullback_10", "is_ic": 0.0359, "is_ic_ir": 0.184, "is_sharpe": -2.117, "is_turnover": 0.211, "is_monotonicity": -0.15, "gates": "FAIL", "status": "reverted", "eval_seconds": 188.5, "sleeve_id": "cn_ai_absorption_pullback", "mispricing_source": "This is a conditioned pullback factor, not a naked reversal factor; it pays when the market extrapolates a 10-day drawdown but ignores stable cash-turnover sponsorship that signals underreaction rather than broken demand.", "forced_counterparty": "retail momentum traders, fast theme rotators, benchmark/rebalance sellers", "data_requirements": "[\"daily OHLCV+amount for IS test\",\"AI-infra universe membership from ai_infra\",\"beta-hedged sleeve attribution vs 000300.SH and 399006.SZ\",\"rolling correlation to promoted factors\",\"residual risk attribution\",\"if top names imply supplier/customer claims, require filings/press releases/transcripts before promotion\"]", "failure_mode": "It stops working when pullbacks reflect genuine order/capex deterioration, or when macro liquidity stress turns stable amount into a stale-liquidity signal instead of absorption.", "report_contract": "setup_overlay", "ai_supercycle_layer": "ai_chip_equipment_materials_packaging", "supply_chain_hypothesis": "Source-reviewed domestic semiconductor equipment, materials, and advanced-packaging bottleneck names may show orderly 10-day pullback absorption before downstream AI capex or order recognition is fully priced.", "relationship_evidence_required": "true", "money_readiness": "research_only", "decision": "revert", "session_branch": "main", "base_ref": "origin/main", "merge_base": "c99187be1dc8d78a84147200981562efcde7b8d5", "head_commit": "c99187be1dc8d78a84147200981562efcde7b8d5"}
{"ts": "2026-05-26T07:23:53.826949+08:00", "session_id": "20260526_062702_4e1ae2", "market": "cn", "formula": "rank(ts_mean(amount / circ_market_cap,20) / ts_std(amount / circ_market_cap,20)) * rank(-ts_mean(high / low - 1,10))", "name": "float_quiet_absorption_20", "is_ic": -0.0644, "is_ic_ir": -0.207, "is_sharpe": -4.859, "is_turnover": 0.142, "is_monotonicity": -0.45, "gates": "FAIL", "status": "reverted", "eval_seconds": 228.9, "sleeve_id": "cn_ai_infra_accumulation", "mispricing_source": "Slow institutional accumulation in constrained-float AI bottlenecks versus fast retail/theme de-risking; this is not just a price factor because it requires stable float-normalized cash absorption, not simple momentum or reversal.", "forced_counterparty": "retail theme traders, short-horizon prop money, and benchmarked funds trimming into calm tape", "data_requirements": "[\"daily amount,circ_market_cap,high,low for CN AI-infra universe\",\"ai_infra source-review status/BFS metadata for portfolio eligibility\",\"beta-hedged sleeve attribution vs 000300.SH and 399006.SZ before promotion\"]", "failure_mode": "It stops working when narrow ranges reflect dead liquidity instead of absorption, or when policy/news shock regimes dominate tape and overwhelm slow accumulation.", "report_contract": "setup_overlay", "ai_supercycle_layer": "ai_chip_equipment_materials_packaging", "supply_chain_hypothesis": "Bottleneck equipment/materials/advanced-packaging suppliers in the AI capex chain should show float-normalized absorption before the next order-book repricing leg.", "relationship_evidence_required": "true", "money_readiness": "research_only", "decision": "revert", "session_branch": "main", "base_ref": "origin/main", "merge_base": "c99187be1dc8d78a84147200981562efcde7b8d5", "head_commit": "c99187be1dc8d78a84147200981562efcde7b8d5"}
{"ts": "2026-05-26T07:23:53.826949+08:00", "session_id": "20260526_062702_4e1ae2", "market": "cn", "formula": "rank(ts_mean(amount,20)/ts_std(amount,20)/ps_ttm)", "name": "stable_amount_ps_20", "is_ic": 0.0132, "is_ic_ir": 0.07, "is_sharpe": -1.542, "is_turnover": 0.054, "is_monotonicity": -0.45, "gates": "FAIL", "status": "reverted", "eval_seconds": 148.5, "sleeve_id": "cn_ai_infra_value_absorption", "mispricing_source": "AI-capex bottleneck repricing diffuses slowly in A-shares; long-horizon funds scale into cheaper infrastructure names before consensus upgrades, while the market overpays for hotter narrative names.", "forced_counterparty": "retail theme-chasers and benchmarked mutual funds constrained by tracking error and confirmation bias", "data_requirements": "[\"daily CN features already available\",\"ai_infra universe membership + source-review status\",\"rolling corr vs amount_stability_20 and cheap_float_accum_20\",\"beta-hedged sleeve return and residual risk attribution\"]", "failure_mode": "Fails when low-PS names are cheap for real fundamental reasons, or when speculative high-multiple AI names dominate and valuation discipline stops mattering.", "report_contract": "setup_overlay", "ai_supercycle_layer": "ai_chip_equipment_materials_packaging", "supply_chain_hypothesis": "Domestic AI semiconductor equipment, materials, and packaging bottleneck names should show steady yuan-turnover support relative to valuation before verified order/backlog upgrades are fully priced.", "relationship_evidence_required": "true", "money_readiness": "research_only", "decision": "revert", "session_branch": "main", "base_ref": "origin/main", "merge_base": "c99187be1dc8d78a84147200981562efcde7b8d5", "head_commit": "c99187be1dc8d78a84147200981562efcde7b8d5"}
{"ts": "2026-05-26T07:23:53.826949+08:00", "session_id": "20260526_062702_4e1ae2", "market": "cn", "formula": "rank(ts_mean(volume_ratio,20)/(ts_std(volume_ratio,20)+0.01))", "name": "vratio_persistence_20", "is_ic": 0.0104, "is_ic_ir": 0.069, "is_sharpe": -1.538, "is_turnover": 0.127, "is_monotonicity": -0.2, "gates": "FAIL", "status": "reverted", "eval_seconds": 88.5, "sleeve_id": "cn_ai_flow_accumulation", "mispricing_source": "The market overreacts to single-day spikes but underreacts to steady multi-week participation; persistent abnormal relative volume is a slow footprint of institutional accumulation in scarce AI-infra leaders.", "forced_counterparty": "Retail hot-money and short-horizon rotation funds that exit after the first spike, while benchmark-constrained allocators add only gradually.", "data_requirements": "[daily OHLCV and daily_basic are sufficient for IS test; before promotion require beta-hedged sleeve attribution, factor correlation vs promoted sleeves, and ai_infra source-review status; any supplier/customer claim needs filings, official PRs, or transcripts]", "failure_mode": "It stops working in rumor-squeeze regimes where relative volume reflects one-off distribution, or in broad beta melt-ups where abnormal participation no longer separates leaders from the pack.", "report_contract": "setup_overlay", "ai_supercycle_layer": "ai_chip_equipment_materials_packaging", "supply_chain_hypothesis": "Persistent relative-volume participation should surface domestic semicap equipment, materials, and advanced-packaging bottleneck names before earnings or news fully confirm the rerating.", "relationship_evidence_required": "true", "money_readiness": "research_only", "decision": "revert", "session_branch": "main", "base_ref": "origin/main", "merge_base": "c99187be1dc8d78a84147200981562efcde7b8d5", "head_commit": "c99187be1dc8d78a84147200981562efcde7b8d5"}
{"ts": "2026-05-26T07:23:53.826949+08:00", "session_id": "20260526_062702_4e1ae2", "market": "cn", "formula": "rank(ts_corr(ret_1d,shift(ret_1d,1),20))*rank(-ts_std(turnover_rate,20)/(ts_std(turnover_rate,120)+0.01))", "name": "autocorr_turnover_compress_20_120", "is_ic": -0.0675, "is_ic_ir": -0.232, "is_sharpe": -5.781, "is_turnover": 0.183, "is_monotonicity": -0.6, "gates": "FAIL", "status": "reverted", "eval_seconds": 120.5, "sleeve_id": "cn_ai_infra_flow_quality", "mispricing_source": "Underreaction to incremental AI-capex leadership inside validated AI-infra names; the market is slow to reprice steady winners when participation is orderly, so this should be less correlated to simple price-level momentum/reversal factors.", "forced_counterparty": "Short-horizon retail traders and liquidity desks fading slow grind-ups; benchmarked long-only managers waiting for liquidity and earnings confirmation before adding.", "data_requirements": "[\"daily OHLCV\",\"turnover_rate\",\"ai_infra universe membership/BFS metadata for attribution\"]; before treating top ranks as bottleneck leaders, add source-reviewed filings/transcripts/order evidence plus beta-hedged sleeve and residual-risk attribution.", "failure_mode": "Breaks when AI themes become policy headline squeezes or retail blow-off regimes, where high autocorr reflects crowding instead of accumulation and turnover compression no longer signals informed sponsorship.", "report_contract": "action_overlay", "ai_supercycle_layer": "ai_chip_equipment_materials_packaging", "supply_chain_hypothesis": "Domestic D1-D3 chip equipment, materials, and advanced-packaging names should be the first CN bucket where steady return persistence with compressed turnover appears as AI capex bottlenecks are repriced before broad confirmation.", "relationship_evidence_required": "true", "money_readiness": "research_only", "decision": "revert", "session_branch": "main", "base_ref": "origin/main", "merge_base": "c99187be1dc8d78a84147200981562efcde7b8d5", "head_commit": "c99187be1dc8d78a84147200981562efcde7b8d5"}
{"ts": "2026-05-26T07:23:53.826949+08:00", "session_id": "20260526_062702_4e1ae2", "market": "cn", "formula": "rank(ts_argmin(low,30)-ts_argmax(high,30))*rank(ts_mean(turnover_rate,20)/(ts_std(turnover_rate,20)+0.01))", "name": "orderly_breakout_turnstable_30", "is_ic": -0.0072, "is_ic_ir": -0.022, "is_sharpe": -1.631, "is_turnover": 0.177, "is_monotonicity": 0.15, "gates": "FAIL", "status": "reverted", "eval_seconds": 195.7, "sleeve_id": "cn_ai_leadership_overlay", "mispricing_source": "Underreaction to orderly accumulation in AI bottleneck leaders; the market overpays for noisy spikes and underprices steady float handover during consolidations.", "forced_counterparty": "Retail profit-takers and benchmark-constrained managers who wait for news or earnings confirmation before adding.", "data_requirements": "[\"daily OHLC\",\"turnover_rate\",\"AI universe membership/source-review status\",\"beta-hedged residual attribution vs 000300.SH and 399006.SZ\",\"correlation to promoted sleeves before promotion\"]", "failure_mode": "Fails in violent mean-reversion or rumor-spike regimes where recent highs are exhaustion moves and steady turnover reflects distribution rather than absorption.", "report_contract": "setup_overlay", "ai_supercycle_layer": "ai_chip_equipment_materials_packaging", "supply_chain_hypothesis": "CN AI semicap/materials/packaging bottleneck names should show orderly breakout plus even turnover before order or capex evidence is fully priced; exact supplier or customer edges still need source review.", "relationship_evidence_required": "true", "money_readiness": "research_only", "decision": "revert", "session_branch": "main", "base_ref": "origin/main", "merge_base": "c99187be1dc8d78a84147200981562efcde7b8d5", "head_commit": "c99187be1dc8d78a84147200981562efcde7b8d5"}
{"ts": "2026-05-26T07:23:53.826949+08:00", "session_id": "20260526_062702_4e1ae2", "market": "cn", "formula": "rank(-ts_corr(ret_1d, shift(ret_1d, 1), 40))", "name": "anti_autocorr_40", "is_ic": -0.0018, "is_ic_ir": -0.009, "is_sharpe": -1.503, "is_turnover": 0.128, "is_monotonicity": 0.2, "gates": "FAIL", "status": "reverted", "eval_seconds": 149.2, "sleeve_id": "cn_ai_tape_absorption", "mispricing_source": "T+1 trading, liquidity slicing, and benchmark-aware execution create underreaction in bottleneck AI names; this measures return path structure rather than price level, so it should be less correlated than standard momentum/reversal factors.", "forced_counterparty": "short-horizon retail chasers and mandate-constrained holders trimming after 1-day pops", "data_requirements": "[\"current daily CN fields are enough for IS test\", \"production needs beta-hedged sleeve attribution vs 000300.SH/399006.SZ\", \"correlation to existing sleeves\", \"AI subtheme breadth if available\"]", "failure_mode": "Fails in gap-driven policy/news regimes where moves become one-way and daily serial correlation reflects genuine trend persistence rather than supply absorption.", "report_contract": "setup_overlay", "ai_supercycle_layer": "ai_chip_equipment_materials_packaging", "supply_chain_hypothesis": "Cross-layer AI bottleneck suppliers may show this anti-autocorrelated absorption pattern before source-reviewed order/capex evidence is fully recognized by the market.", "relationship_evidence_required": "true", "money_readiness": "research_only", "decision": "revert", "session_branch": "main", "base_ref": "origin/main", "merge_base": "c99187be1dc8d78a84147200981562efcde7b8d5", "head_commit": "c99187be1dc8d78a84147200981562efcde7b8d5"}
