{"ts": "2026-05-01T06:57:42.863289+08:00", "session_id": "20260501_060002_1da543", "market": "cn", "formula": "rank(-ts_corr(turnover_rate, ret_5d, 20) * ts_mean(turnover_rate, 20))", "name": "anti_chase_turnover_20", "is_ic": 0.0359, "is_ic_ir": 0.203, "is_sharpe": -0.859, "is_turnover": 0.097, "is_monotonicity": 0.0, "gates": "PASS", "status": "candidate", "eval_seconds": 107.9, "decision": "candidate", "session_branch": "main", "base_ref": "origin/main", "merge_base": "7e71edc0d50443d3db4f0dd72c25238cd7ac1282", "head_commit": "7e71edc0d50443d3db4f0dd72c25238cd7ac1282"}
{"ts": "2026-05-01T06:57:42.863289+08:00", "session_id": "20260501_060002_1da543", "market": "cn", "formula": "rank(-ts_corr(volume_ratio,shift(volume_ratio,5),20))*rank(ts_mean(volume_ratio,20)/ts_max(volume_ratio,20))", "name": "anti_autocorr_weekly_relvol_evenness_20", "is_ic": 0.014, "is_ic_ir": 0.149, "is_sharpe": -2.275, "is_turnover": 0.171, "is_monotonicity": 0.2, "gates": "FAIL", "status": "reverted", "eval_seconds": 142.5, "decision": "revert", "session_branch": "main", "base_ref": "origin/main", "merge_base": "7e71edc0d50443d3db4f0dd72c25238cd7ac1282", "head_commit": "7e71edc0d50443d3db4f0dd72c25238cd7ac1282"}
{"ts": "2026-05-01T06:57:42.863289+08:00", "session_id": "20260501_060002_1da543", "market": "cn", "formula": "rank(ts_mean(amount/market_cap,20)/ts_max(amount/market_cap,20)-ts_corr(amount/market_cap,shift(amount/market_cap,5),20))", "name": "anti_autocorr_mcap_flow_evenness_20", "is_ic": -0.0022, "is_ic_ir": -0.039, "is_sharpe": -4.063, "is_turnover": 0.173, "is_monotonicity": 0.0, "gates": "FAIL", "status": "reverted", "eval_seconds": 222.3, "decision": "revert", "session_branch": "main", "base_ref": "origin/main", "merge_base": "7e71edc0d50443d3db4f0dd72c25238cd7ac1282", "head_commit": "7e71edc0d50443d3db4f0dd72c25238cd7ac1282"}
{"ts": "2026-05-01T06:57:42.863289+08:00", "session_id": "20260501_060002_1da543", "market": "cn", "formula": "rank(-ts_corr(ret_1d,shift(ret_1d,1),20))*rank(-ts_mean(high/low-1,10))", "name": "anti_autocorr_low_range_20", "is_ic": 0.0442, "is_ic_ir": 0.345, "is_sharpe": 1.062, "is_turnover": 0.149, "is_monotonicity": 0.0, "gates": "PASS", "status": "reverted", "eval_seconds": 113.3, "decision": "revert", "session_branch": "main", "base_ref": "origin/main", "merge_base": "7e71edc0d50443d3db4f0dd72c25238cd7ac1282", "head_commit": "7e71edc0d50443d3db4f0dd72c25238cd7ac1282", "oos": "FAIL", "checks_status": "skipped"}
{"ts": "2026-05-01T06:57:42.863289+08:00", "session_id": "20260501_060002_1da543", "market": "cn", "formula": "rank(ts_std(amount / circ_market_cap,60) / ts_std(amount / circ_market_cap,20)) * rank(-ts_mean(high / low - 1,10))", "name": "float_compress_absorb_20_60", "is_ic": 0.0386, "is_ic_ir": 0.228, "is_sharpe": -1.3, "is_turnover": 0.112, "is_monotonicity": -0.35, "gates": "PASS", "status": "reverted", "eval_seconds": 208.7, "decision": "revert", "session_branch": "main", "base_ref": "origin/main", "merge_base": "7e71edc0d50443d3db4f0dd72c25238cd7ac1282", "head_commit": "7e71edc0d50443d3db4f0dd72c25238cd7ac1282", "oos": "FAIL", "checks_status": "skipped"}
{"ts": "2026-05-01T06:57:42.863289+08:00", "session_id": "20260501_060002_1da543", "market": "cn", "formula": "rank(-ts_corr(ret_1d,shift(ret_1d,1),20))*rank(ts_min(turnover_rate,20)/ts_mean(turnover_rate,20))", "name": "anti_autocorr_turnover_floor_20", "is_ic": 0.0379, "is_ic_ir": 0.443, "is_sharpe": 1.599, "is_turnover": 0.177, "is_monotonicity": 0.45, "gates": "PASS", "status": "candidate", "eval_seconds": 213.6, "decision": "candidate", "session_branch": "main", "base_ref": "origin/main", "merge_base": "7e71edc0d50443d3db4f0dd72c25238cd7ac1282", "head_commit": "7e71edc0d50443d3db4f0dd72c25238cd7ac1282"}
{"ts": "2026-05-01T06:57:42.863289+08:00", "session_id": "20260501_060002_1da543", "market": "cn", "formula": "rank(-ts_skew(amount/circ_market_cap,20))", "name": "anti_crowding_float_skew_20", "is_ic": 0.0146, "is_ic_ir": 0.171, "is_sharpe": -1.293, "is_turnover": 0.173, "is_monotonicity": 0.75, "gates": "FAIL", "status": "reverted", "eval_seconds": 93.2, "decision": "revert", "session_branch": "main", "base_ref": "origin/main", "merge_base": "7e71edc0d50443d3db4f0dd72c25238cd7ac1282", "head_commit": "7e71edc0d50443d3db4f0dd72c25238cd7ac1282"}
{"ts": "2026-05-01T06:57:42.863289+08:00", "session_id": "20260501_060002_1da543", "market": "cn", "formula": "rank(-ts_std(delta(log(amount),5),20))", "name": "log_amount_change_stability_20_5", "is_ic": 0.0396, "is_ic_ir": 0.342, "is_sharpe": 1.229, "is_turnover": 0.104, "is_monotonicity": 0.05, "gates": "PASS", "status": "checks_failed", "eval_seconds": 266.7, "decision": "revert", "session_branch": "main", "base_ref": "origin/main", "merge_base": "7e71edc0d50443d3db4f0dd72c25238cd7ac1282", "head_commit": "7e71edc0d50443d3db4f0dd72c25238cd7ac1282", "oos": "PASS", "checks_status": "failed"}
{"ts": "2026-05-01T06:57:42.863289+08:00", "session_id": "20260501_060002_1da543", "market": "cn", "formula": "rank(-ts_corr(ret_1d,shift(ret_1d,1),20))*rank(ts_min(turnover_rate,20)/ts_max(turnover_rate,20))", "name": "anti_autocorr_turnover_corridor_20", "is_ic": 0.0383, "is_ic_ir": 0.49, "is_sharpe": 4.135, "is_turnover": 0.169, "is_monotonicity": 0.4, "gates": "PASS", "status": "candidate", "eval_seconds": 179.7, "decision": "candidate", "session_branch": "main", "base_ref": "origin/main", "merge_base": "7e71edc0d50443d3db4f0dd72c25238cd7ac1282", "head_commit": "7e71edc0d50443d3db4f0dd72c25238cd7ac1282"}
{"ts": "2026-05-01T06:57:42.863289+08:00", "session_id": "20260501_060002_1da543", "market": "cn", "formula": "rank(-ts_corr(turnover_rate,shift(turnover_rate,1),20))*rank(-(ts_max(turnover_rate,20)/ts_sum(turnover_rate,20)))", "name": "anti_autocorr_turnover_spike_share_20", "is_ic": 0.0241, "is_ic_ir": 0.278, "is_sharpe": 0.354, "is_turnover": 0.147, "is_monotonicity": 0.45, "gates": "PASS", "status": "candidate", "eval_seconds": 145.5, "decision": "candidate", "session_branch": "main", "base_ref": "origin/main", "merge_base": "7e71edc0d50443d3db4f0dd72c25238cd7ac1282", "head_commit": "7e71edc0d50443d3db4f0dd72c25238cd7ac1282"}
{"ts": "2026-05-01T14:57:22.537793+08:00", "session_id": "20260501_140002_c67156", "market": "cn", "formula": "rank(ts_mean(turnover_rate, 20) / ts_std(turnover_rate, 20))", "name": "turnover_stability_20", "is_ic": 0.0374, "is_ic_ir": 0.373, "is_sharpe": 1.522, "is_turnover": 0.121, "is_monotonicity": 0.7, "gates": "PASS", "status": "candidate", "eval_seconds": 30.3, "decision": "candidate", "session_branch": "main", "base_ref": "origin/main", "merge_base": "7e71edc0d50443d3db4f0dd72c25238cd7ac1282", "head_commit": "7e71edc0d50443d3db4f0dd72c25238cd7ac1282"}
{"ts": "2026-05-01T14:57:22.537793+08:00", "session_id": "20260501_140002_c67156", "market": "cn", "formula": "rank(-ts_corr(ret_1d,shift(ret_1d,1),20))*rank(ts_min(turnover_rate,20)/ts_max(turnover_rate,20))", "name": "anti_autocorr_turnover_corridor_20", "is_ic": 0.0383, "is_ic_ir": 0.49, "is_sharpe": 4.135, "is_turnover": 0.169, "is_monotonicity": 0.4, "gates": "PASS", "status": "candidate", "eval_seconds": 130.4, "decision": "candidate", "session_branch": "main", "base_ref": "origin/main", "merge_base": "7e71edc0d50443d3db4f0dd72c25238cd7ac1282", "head_commit": "7e71edc0d50443d3db4f0dd72c25238cd7ac1282"}
{"ts": "2026-05-01T14:57:22.537793+08:00", "session_id": "20260501_140002_c67156", "market": "cn", "formula": "rank(-ts_corr(ret_1d,shift(ret_1d,1),20))*rank(ts_mean(ts_sum(amount,5),20)/ts_max(ts_sum(amount,5),20))", "name": "anti_autocorr_weekly_amount_evenness_20", "is_ic": 0.0367, "is_ic_ir": 0.473, "is_sharpe": 3.934, "is_turnover": 0.167, "is_monotonicity": 0.35, "gates": "PASS", "status": "candidate", "eval_seconds": 134.9, "decision": "candidate", "session_branch": "main", "base_ref": "origin/main", "merge_base": "7e71edc0d50443d3db4f0dd72c25238cd7ac1282", "head_commit": "7e71edc0d50443d3db4f0dd72c25238cd7ac1282"}
{"ts": "2026-05-01T14:57:22.537793+08:00", "session_id": "20260501_140002_c67156", "market": "cn", "formula": "rank(close/ts_max(close,20))*rank(ts_mean(amount,20)/ts_std(amount,20))", "name": "orderly_highs_amount_20", "is_ic": 0.0359, "is_ic_ir": 0.217, "is_sharpe": -0.446, "is_turnover": 0.162, "is_monotonicity": 0.15, "gates": "PASS", "status": "candidate", "eval_seconds": 41.9, "decision": "candidate", "session_branch": "main", "base_ref": "origin/main", "merge_base": "7e71edc0d50443d3db4f0dd72c25238cd7ac1282", "head_commit": "7e71edc0d50443d3db4f0dd72c25238cd7ac1282"}
{"ts": "2026-05-01T14:57:22.537793+08:00", "session_id": "20260501_140002_c67156", "market": "cn", "formula": "rank(-ts_corr(ret_1d,shift(ret_1d,1),20))*rank(-ts_std(open/close,20))", "name": "anti_autocorr_openclose_stability_20", "is_ic": 0.0413, "is_ic_ir": 0.328, "is_sharpe": 0.877, "is_turnover": 0.151, "is_monotonicity": 0.0, "gates": "PASS", "status": "checks_failed", "eval_seconds": 185.1, "decision": "revert", "session_branch": "main", "base_ref": "origin/main", "merge_base": "7e71edc0d50443d3db4f0dd72c25238cd7ac1282", "head_commit": "7e71edc0d50443d3db4f0dd72c25238cd7ac1282", "oos": "PASS", "checks_status": "failed"}
{"ts": "2026-05-01T14:57:22.537793+08:00", "session_id": "20260501_140002_c67156", "market": "cn", "formula": "rank(-ts_corr(volume_ratio, shift(volume_ratio, 5), 20)) * rank(ts_mean(volume_ratio, 20) / ts_max(volume_ratio, 20))", "name": "anti_autocorr_weekly_relvol_evenness_20", "is_ic": 0.014, "is_ic_ir": 0.149, "is_sharpe": -2.275, "is_turnover": 0.171, "is_monotonicity": 0.2, "gates": "FAIL", "status": "reverted", "eval_seconds": 116.9, "decision": "revert", "session_branch": "main", "base_ref": "origin/main", "merge_base": "7e71edc0d50443d3db4f0dd72c25238cd7ac1282", "head_commit": "7e71edc0d50443d3db4f0dd72c25238cd7ac1282"}
{"ts": "2026-05-01T14:57:22.537793+08:00", "session_id": "20260501_140002_c67156", "market": "cn", "formula": "rank(-ts_corr(ret_1d,shift(ret_1d,1),20))*rank(-ts_corr(ret_5d,amount/circ_market_cap,20))", "name": "anti_autocorr_ret5_floatflow_diverge_20", "is_ic": 0.0367, "is_ic_ir": 0.307, "is_sharpe": 1.183, "is_turnover": 0.172, "is_monotonicity": 0.15, "gates": "PASS", "status": "candidate", "eval_seconds": 264.4, "decision": "candidate", "session_branch": "main", "base_ref": "origin/main", "merge_base": "7e71edc0d50443d3db4f0dd72c25238cd7ac1282", "head_commit": "7e71edc0d50443d3db4f0dd72c25238cd7ac1282"}
{"ts": "2026-05-01T14:57:22.537793+08:00", "session_id": "20260501_140002_c67156", "market": "cn", "formula": "rank(-ret_20d)*rank(ts_mean(amount,20)/ts_std(amount,20))", "name": "stable_amount_reversal_20", "is_ic": 0.0374, "is_ic_ir": 0.269, "is_sharpe": -0.964, "is_turnover": 0.154, "is_monotonicity": 0.0, "gates": "PASS", "status": "candidate", "eval_seconds": 47.4, "decision": "candidate", "session_branch": "main", "base_ref": "origin/main", "merge_base": "7e71edc0d50443d3db4f0dd72c25238cd7ac1282", "head_commit": "7e71edc0d50443d3db4f0dd72c25238cd7ac1282"}
{"ts": "2026-05-01T14:57:22.537793+08:00", "session_id": "20260501_140002_c67156", "market": "cn", "formula": "rank(ts_min(amount/circ_market_cap,20)/ts_mean(amount/circ_market_cap,20))", "name": "float_flow_floor_20", "is_ic": 0.03, "is_ic_ir": 0.273, "is_sharpe": -0.926, "is_turnover": 0.14, "is_monotonicity": 0.75, "gates": "PASS", "status": "candidate", "eval_seconds": 92.4, "decision": "candidate", "session_branch": "main", "base_ref": "origin/main", "merge_base": "7e71edc0d50443d3db4f0dd72c25238cd7ac1282", "head_commit": "7e71edc0d50443d3db4f0dd72c25238cd7ac1282"}
{"ts": "2026-05-01T14:57:22.537793+08:00", "session_id": "20260501_140002_c67156", "market": "cn", "formula": "rank(-ts_corr(ret_1d,shift(ret_1d,1),20))*rank(ts_mean(amount/circ_market_cap,20)/ts_max(amount/circ_market_cap,20))", "name": "anti_autocorr_float_evenness_20", "is_ic": 0.0336, "is_ic_ir": 0.46, "is_sharpe": 2.602, "is_turnover": 0.174, "is_monotonicity": 0.25, "gates": "PASS", "status": "candidate", "eval_seconds": 186.0, "decision": "candidate", "session_branch": "main", "base_ref": "origin/main", "merge_base": "7e71edc0d50443d3db4f0dd72c25238cd7ac1282", "head_commit": "7e71edc0d50443d3db4f0dd72c25238cd7ac1282"}
{"ts": "2026-05-01T14:57:22.537793+08:00", "session_id": "20260501_140002_c67156", "market": "cn", "formula": "rank(ts_mean(amount,20)/ts_std(amount,20))*rank(-pb)", "name": "stable_amount_value_20", "is_ic": 0.0372, "is_ic_ir": 0.209, "is_sharpe": -0.227, "is_turnover": 0.08, "is_monotonicity": -0.05, "gates": "PASS", "status": "candidate", "eval_seconds": 36.2, "decision": "candidate", "session_branch": "main", "base_ref": "origin/main", "merge_base": "7e71edc0d50443d3db4f0dd72c25238cd7ac1282", "head_commit": "7e71edc0d50443d3db4f0dd72c25238cd7ac1282"}
{"ts": "2026-05-01T14:57:22.537793+08:00", "session_id": "20260501_140002_c67156", "market": "cn", "formula": "rank(ts_mean(amount/circ_market_cap,20)/ts_std(amount/circ_market_cap,20))*rank(-ts_std(close/open-1,20))", "name": "quiet_float_openclose_20", "is_ic": 0.0435, "is_ic_ir": 0.264, "is_sharpe": -0.064, "is_turnover": 0.103, "is_monotonicity": 0.0, "gates": "PASS", "status": "checks_failed", "eval_seconds": 167.0, "decision": "revert", "session_branch": "main", "base_ref": "origin/main", "merge_base": "7e71edc0d50443d3db4f0dd72c25238cd7ac1282", "head_commit": "7e71edc0d50443d3db4f0dd72c25238cd7ac1282", "oos": "PASS", "checks_status": "failed"}
{"ts": "2026-05-01T14:57:22.537793+08:00", "session_id": "20260501_140002_c67156", "market": "cn", "formula": "rank(ts_min(ts_sum(amount/circ_market_cap,5),20)/ts_mean(ts_sum(amount/circ_market_cap,5),20)-ts_corr(ret_1d,shift(ret_1d,1),20))", "name": "weekly_float_floor_underreaction_20", "is_ic": 0.0371, "is_ic_ir": 0.446, "is_sharpe": 4.045, "is_turnover": 0.175, "is_monotonicity": 0.55, "gates": "PASS", "status": "candidate", "eval_seconds": 188.2, "decision": "candidate", "session_branch": "main", "base_ref": "origin/main", "merge_base": "7e71edc0d50443d3db4f0dd72c25238cd7ac1282", "head_commit": "7e71edc0d50443d3db4f0dd72c25238cd7ac1282"}
{"ts": "2026-05-01T14:57:22.537793+08:00", "session_id": "20260501_140002_c67156", "market": "cn", "formula": "rank(ts_mean(amount/circ_market_cap,20)/ts_max(amount/circ_market_cap,20))*rank(-ret_5d)", "name": "float_peak_balance_underreaction_20", "is_ic": 0.0245, "is_ic_ir": 0.166, "is_sharpe": -2.317, "is_turnover": 0.278, "is_monotonicity": 0.85, "gates": "FAIL", "status": "reverted", "eval_seconds": 138.1, "decision": "revert", "session_branch": "main", "base_ref": "origin/main", "merge_base": "7e71edc0d50443d3db4f0dd72c25238cd7ac1282", "head_commit": "7e71edc0d50443d3db4f0dd72c25238cd7ac1282"}
{"ts": "2026-05-01T14:57:22.537793+08:00", "session_id": "20260501_140002_c67156", "market": "cn", "formula": "rank(-ts_corr(ret_5d, amount / circ_market_cap, 20))", "name": "ret5_floatflow_diverge_20", "is_ic": 0.035, "is_ic_ir": 0.22, "is_sharpe": -0.263, "is_turnover": 0.127, "is_monotonicity": 0.0, "gates": "PASS", "status": "candidate", "eval_seconds": 154.2, "decision": "candidate", "session_branch": "main", "base_ref": "origin/main", "merge_base": "7e71edc0d50443d3db4f0dd72c25238cd7ac1282", "head_commit": "7e71edc0d50443d3db4f0dd72c25238cd7ac1282"}
{"ts": "2026-05-01T14:57:22.537793+08:00", "session_id": "20260501_140002_c67156", "market": "cn", "formula": "rank(ts_mean(amount,20)/ts_std(amount,20))*rank(-ret_20d)", "name": "stable_amount_underreaction_20", "is_ic": 0.0374, "is_ic_ir": 0.269, "is_sharpe": -0.964, "is_turnover": 0.154, "is_monotonicity": 0.0, "gates": "PASS", "status": "candidate", "eval_seconds": 16.8, "decision": "candidate", "session_branch": "main", "base_ref": "origin/main", "merge_base": "7e71edc0d50443d3db4f0dd72c25238cd7ac1282", "head_commit": "7e71edc0d50443d3db4f0dd72c25238cd7ac1282"}
{"ts": "2026-05-01T14:57:22.537793+08:00", "session_id": "20260501_140002_c67156", "market": "cn", "formula": "rank(-pb)*rank(ts_mean(ts_sum(amount/circ_market_cap,5),20)/ts_max(ts_sum(amount/circ_market_cap,5),20))", "name": "value_weekly_float_evenness_20", "is_ic": 0.0296, "is_ic_ir": 0.174, "is_sharpe": -0.082, "is_turnover": 0.089, "is_monotonicity": -0.15, "gates": "FAIL", "status": "reverted", "eval_seconds": 207.3, "decision": "revert", "session_branch": "main", "base_ref": "origin/main", "merge_base": "7e71edc0d50443d3db4f0dd72c25238cd7ac1282", "head_commit": "7e71edc0d50443d3db4f0dd72c25238cd7ac1282"}
{"ts": "2026-05-01T14:57:22.537793+08:00", "session_id": "20260501_140002_c67156", "market": "cn", "formula": "rank(ts_min(amount / circ_market_cap, 5) / ts_mean(amount / circ_market_cap, 20))", "name": "weekly_float_floor_5_20", "is_ic": -0.0037, "is_ic_ir": -0.072, "is_sharpe": -4.971, "is_turnover": 0.256, "is_monotonicity": -0.15, "gates": "FAIL", "status": "reverted", "eval_seconds": 211.6, "decision": "revert", "session_branch": "main", "base_ref": "origin/main", "merge_base": "7e71edc0d50443d3db4f0dd72c25238cd7ac1282", "head_commit": "7e71edc0d50443d3db4f0dd72c25238cd7ac1282"}
{"ts": "2026-05-01T14:57:22.537793+08:00", "session_id": "20260501_140002_c67156", "market": "cn", "formula": "rank(ts_mean(amount,20)/ts_std(amount,20))*rank(-ts_corr(ret_5d,turnover_rate,20))", "name": "stable_amount_flow_absorb_20", "is_ic": 0.0422, "is_ic_ir": 0.281, "is_sharpe": 0.5, "is_turnover": 0.129, "is_monotonicity": 0.3, "gates": "PASS", "status": "checks_failed", "eval_seconds": 113.2, "decision": "revert", "session_branch": "main", "base_ref": "origin/main", "merge_base": "7e71edc0d50443d3db4f0dd72c25238cd7ac1282", "head_commit": "7e71edc0d50443d3db4f0dd72c25238cd7ac1282", "oos": "PASS", "checks_status": "failed"}
{"ts": "2026-05-01T14:57:22.537793+08:00", "session_id": "20260501_140002_c67156", "market": "cn", "formula": "rank(-ts_corr(ret_1d,shift(ret_1d,1),20))*rank(ts_min(ts_sum(amount,5),20)/ts_max(ts_sum(amount,5),20))", "name": "anti_autocorr_weekly_amount_corridor_20", "is_ic": 0.0367, "is_ic_ir": 0.439, "is_sharpe": 4.248, "is_turnover": 0.159, "is_monotonicity": 0.3, "gates": "PASS", "status": "candidate", "eval_seconds": 115.0, "decision": "candidate", "session_branch": "main", "base_ref": "origin/main", "merge_base": "7e71edc0d50443d3db4f0dd72c25238cd7ac1282", "head_commit": "7e71edc0d50443d3db4f0dd72c25238cd7ac1282"}
{"ts": "2026-05-01T14:57:22.537793+08:00", "session_id": "20260501_140002_c67156", "market": "cn", "formula": "rank(-ts_corr(ret_1d,shift(ret_1d,1),20))*rank(-ts_std(delta(log(amount/circ_market_cap),5),20))", "name": "anti_autocorr_log_floatflow_change_20_5", "is_ic": 0.0393, "is_ic_ir": 0.436, "is_sharpe": 3.133, "is_turnover": 0.157, "is_monotonicity": 0.3, "gates": "PASS", "status": "candidate", "eval_seconds": 237.4, "decision": "candidate", "session_branch": "main", "base_ref": "origin/main", "merge_base": "7e71edc0d50443d3db4f0dd72c25238cd7ac1282", "head_commit": "7e71edc0d50443d3db4f0dd72c25238cd7ac1282"}
{"ts": "2026-05-01T14:57:22.537793+08:00", "session_id": "20260501_140002_c67156", "market": "cn", "formula": "rank(-ts_corr(ret_1d,shift(ret_1d,1),20))*rank(-(ts_max(ts_sum(amount/circ_market_cap,5),20)/ts_sum(ts_sum(amount/circ_market_cap,5),20)))", "name": "anti_autocorr_weekly_float_spike_share_20", "is_ic": 0.0372, "is_ic_ir": 0.479, "is_sharpe": 3.218, "is_turnover": 0.171, "is_monotonicity": 0.45, "gates": "PASS", "status": "candidate", "eval_seconds": 165.2, "decision": "candidate", "session_branch": "main", "base_ref": "origin/main", "merge_base": "7e71edc0d50443d3db4f0dd72c25238cd7ac1282", "head_commit": "7e71edc0d50443d3db4f0dd72c25238cd7ac1282"}
{"ts": "2026-05-01T14:57:22.537793+08:00", "session_id": "20260501_140002_c67156", "market": "cn", "formula": "rank(ts_min(ts_sum(amount/circ_market_cap,5),20)/ts_mean(ts_sum(amount/circ_market_cap,5),20)-ts_corr(ret_5d,amount/circ_market_cap,20))", "name": "weekly_float_floor_ret5_gap_20", "is_ic": 0.0392, "is_ic_ir": 0.244, "is_sharpe": 0.106, "is_turnover": 0.121, "is_monotonicity": 0.2, "gates": "PASS", "status": "candidate", "eval_seconds": 244.7, "decision": "candidate", "session_branch": "main", "base_ref": "origin/main", "merge_base": "7e71edc0d50443d3db4f0dd72c25238cd7ac1282", "head_commit": "7e71edc0d50443d3db4f0dd72c25238cd7ac1282"}
{"ts": "2026-05-01T14:57:22.537793+08:00", "session_id": "20260501_140002_c67156", "market": "cn", "formula": "rank(-ts_corr(ret_1d,shift(ret_1d,1),20))*rank(ts_min(ts_sum(amount/market_cap,5),20)/ts_max(ts_sum(amount/market_cap,5),20))", "name": "anti_autocorr_weekly_mcapflow_corridor_20", "is_ic": 0.0384, "is_ic_ir": 0.456, "is_sharpe": 3.503, "is_turnover": 0.161, "is_monotonicity": 0.5, "gates": "PASS", "status": "candidate", "eval_seconds": 211.3, "decision": "candidate", "session_branch": "main", "base_ref": "origin/main", "merge_base": "7e71edc0d50443d3db4f0dd72c25238cd7ac1282", "head_commit": "7e71edc0d50443d3db4f0dd72c25238cd7ac1282"}
{"ts": "2026-05-04T06:56:44.512068+08:00", "session_id": "20260504_060002_ba5d5e", "market": "cn", "formula": "rank(-ts_std(turnover_rate, 20) / ts_mean(turnover_rate, 20))", "name": "turnover_stability_20", "is_ic": 0.0374, "is_ic_ir": 0.373, "is_sharpe": 1.522, "is_turnover": 0.121, "is_monotonicity": 0.7, "gates": "PASS", "status": "candidate", "eval_seconds": 73.0, "decision": "candidate", "session_branch": "main", "base_ref": "origin/main", "merge_base": "7e71edc0d50443d3db4f0dd72c25238cd7ac1282", "head_commit": "7e71edc0d50443d3db4f0dd72c25238cd7ac1282"}
