{"ts": "2026-05-14T06:57:17.389776+08:00", "session_id": "20260514_060003_7f53cb", "market": "cn", "formula": "rank(ts_mean(amount / circ_market_cap,20) / ts_std(amount / circ_market_cap,20))", "name": "float_amount_stability_20", "is_ic": 0.0, "is_ic_ir": 0.0, "is_sharpe": 0.0, "is_turnover": 0.0, "is_monotonicity": 0.0, "gates": "FAIL", "status": "reverted", "eval_seconds": 222.4, "sleeve_id": "cn_ai_accumulation_overlay", "mispricing_source": "Retail and fast-money theme traders overpay for noisy turnover spikes and underweight quiet inventory absorption in float-constrained AI-infra names; this is a flow-scarcity signal, not a close cousin of the existing wick-based price factor.", "forced_counterparty": "Retail momentum chasers and benchmarked managers rebalancing around headline-driven volume bursts", "data_requirements": "[\"current daily amount and circ_market_cap are sufficient for IS testing\",\"before promotion require beta-hedged sleeve return, residual risk attribution, and correlation vs active sleeves\"]", "failure_mode": "It stops working when the market shifts into pure policy/headline lottery trading, or when float-adjusted amount mostly becomes a static size proxy instead of a dynamic accumulation signal.", "report_contract": "research_only", "ai_supercycle_layer": "ai_datacenter_edge_infra", "supply_chain_hypothesis": "Datacenter, optical, and power bottleneck names receiving real AI capex should exhibit steadier float-adjusted value turnover before the order cycle is fully reflected in price.", "relationship_evidence_required": "false", "money_readiness": "research_only", "decision": "revert", "session_branch": "main", "base_ref": "origin/main", "merge_base": "7e34f69c6d80fac556ec0c4417978d3bf014bde7", "head_commit": "7e34f69c6d80fac556ec0c4417978d3bf014bde7"}
{"ts": "2026-05-14T06:57:17.389776+08:00", "session_id": "20260514_060003_7f53cb", "market": "cn", "formula": "rank(-ts_corr(close/open-1,amount/circ_market_cap,20))", "name": "quiet_body_floatflow_decorr_20", "is_ic": 0.0, "is_ic_ir": 0.0, "is_sharpe": 0.0, "is_turnover": 0.0, "is_monotonicity": 0.0, "gates": "FAIL", "status": "reverted", "eval_seconds": 181.3, "sleeve_id": "float_flow_absorption", "mispricing_source": "The market overprices loud high-turnover breakout days and underreacts to names whose intraday strength requires little float turnover; this is a price-impact/ownership-quality signal, not a raw momentum or upper-shadow clone.", "forced_counterparty": "T+1 retail profit-takers, benchmark/rebalance sellers, and liquidity-motivated holders", "data_requirements": "[\"open\",\"close\",\"amount\",\"circ_market_cap\"]; for promotion also require 000300.SH/399006.SZ beta-hedge returns, residual risk attribution, sleeve correlation matrix, and primary-source filings/PRs/transcripts before attaching any supplier/customer claim", "failure_mode": "Fails in policy/headline breakout or panic-liquidity regimes when heavy turnover with strong closes carries genuine information, or when quiet strong closes are just illiquid marking-up rather than real accumulation", "report_contract": "setup_overlay", "ai_supercycle_layer": "ai_chip_equipment_materials_packaging", "supply_chain_hypothesis": "Domestic AI equipment/materials/packaging bottleneck names should show strong closes on modest float-normalized cash turnover as institutions secure scarce exposure before order, backlog, or capex evidence becomes consensus", "relationship_evidence_required": "true", "money_readiness": "research_only", "decision": "revert", "session_branch": "main", "base_ref": "origin/main", "merge_base": "7e34f69c6d80fac556ec0c4417978d3bf014bde7", "head_commit": "7e34f69c6d80fac556ec0c4417978d3bf014bde7"}
{"ts": "2026-05-14T06:57:17.389776+08:00", "session_id": "20260514_060003_7f53cb", "market": "cn", "formula": "rank(ret_20d / (ts_mean(turnover_rate, 20) + 0.01))", "name": "leader_float_efficiency_20", "is_ic": 0.0, "is_ic_ir": 0.0, "is_sharpe": 0.0, "is_turnover": 0.0, "is_monotonicity": 0.0, "gates": "FAIL", "status": "reverted", "eval_seconds": 85.1, "sleeve_id": "cn_ai_infra_leadership", "mispricing_source": "Information diffusion and benchmark frictions cause validated AI-infra winners with tight float supply to keep repricing after the first move; the market underestimates how long steady institutional absorption can sustain leadership.", "forced_counterparty": "Benchmark-constrained mutual funds and short-horizon retail sellers who must trim or cannot fully chase low-float AI leaders", "data_requirements": "[\"Current CN daily price/volume/daily_basic data is sufficient for IS test\", \"For promotion require beta-hedged attribution vs 000300.SH/399006.SZ\", \"Need current sleeve correlation matrix and drawdown attribution before capital allocation\"]", "failure_mode": "It breaks when turnover compression comes from illiquidity or trading halts rather than accumulation, or when the AI capex narrative shifts from scarcity/leadership to broad speculative rotation.", "report_contract": "fresh_buy_gate", "ai_supercycle_layer": "ai_datacenter_edge_infra", "supply_chain_hypothesis": "Datacenter/server/network bottleneck beneficiaries inside the validated AI-infra universe should show the strongest return-per-turnover leadership as capex expectations diffuse from core compute demand into domestic infrastructure suppliers.", "relationship_evidence_required": "true", "money_readiness": "money_candidate", "decision": "revert", "session_branch": "main", "base_ref": "origin/main", "merge_base": "7e34f69c6d80fac556ec0c4417978d3bf014bde7", "head_commit": "7e34f69c6d80fac556ec0c4417978d3bf014bde7"}
{"ts": "2026-05-14T06:57:17.389776+08:00", "session_id": "20260514_060003_7f53cb", "market": "cn", "formula": "rank(-ts_corr(ret_1d,shift(ret_1d,1),20))*rank(-ts_std(delta(turnover_rate,5),20))", "name": "anti_autocorr_weekly_turnchg_evenness", "is_ic": 0.0, "is_ic_ir": 0.0, "is_sharpe": 0.0, "is_turnover": 0.0, "is_monotonicity": 0.0, "gates": "FAIL", "status": "reverted", "eval_seconds": 228.0, "sleeve_id": "cn_aiinfra_flow_quality", "mispricing_source": "Underreaction to slow institutional sponsorship in AI-theme leaders; breakout-chasing flows ignore names where ownership is improving without obvious price acceleration.", "forced_counterparty": "Retail T+1 theme traders and benchmark-constrained funds trimming into minor strength or reacting to daily noise.", "data_requirements": "[\"daily ret_1d and turnover_rate\", \"beta-hedged sleeve return vs 000300.SH and 399006.SZ\", \"factor corr vs kshadow_5 and turnover_stability_20\", \"AI-universe layer/source-review tags\", \"original filings or press releases if a bottleneck-supplier claim is promoted\"]", "failure_mode": "It should fail in high-beta chase regimes where bursty turnover and one-way momentum dominate, or if low weekly turnover-change volatility is just illiquidity rather than accumulation.", "report_contract": "setup_overlay", "ai_supercycle_layer": "ai_networking_optical_cpo", "supply_chain_hypothesis": "Candidate optical/interconnect bottleneck suppliers in the CN AI universe may be under quiet accumulation before verified order or capex evidence reaches filings and mainstream news.", "relationship_evidence_required": "true", "money_readiness": "research_only", "decision": "revert", "session_branch": "main", "base_ref": "origin/main", "merge_base": "7e34f69c6d80fac556ec0c4417978d3bf014bde7", "head_commit": "7e34f69c6d80fac556ec0c4417978d3bf014bde7"}
{"ts": "2026-05-14T06:57:17.389776+08:00", "session_id": "20260514_060003_7f53cb", "market": "cn", "formula": "rank(ts_mean(amount/circ_market_cap,20)/clamp(pb,0.1,999))", "name": "float_value_absorption_20", "is_ic": 0.0, "is_ic_ir": 0.0, "is_sharpe": 0.0, "is_turnover": 0.0, "is_monotonicity": 0.0, "gates": "FAIL", "status": "reverted", "eval_seconds": 113.1, "sleeve_id": "cn_ai_absorption_value", "mispricing_source": "A-share theme trading tends to overpay visible leaders and under-own duller infra enablers; steady float-scaled cash turnover reveals accumulation, while low PB leaves rerating room once AI capex breadth becomes harder to ignore.", "forced_counterparty": "theme-chasing retail and short-horizon benchmarked managers who avoid low-multiple heavy-asset names until price confirmation is already obvious", "data_requirements": "[\"daily price/volume/daily_basic (available)\", \"filings/backlog/capex/gross margin/FCF to separate real AI beneficiaries from value traps\", \"beta-hedged and residual-risk attribution vs 000300.SH and 399006.SZ before promotion\"]", "failure_mode": "This stops working if turnover is mostly speculative recycling instead of absorption, or if low PB correctly reflects balance-sheet stress, weak orders, or policy/regulatory overhang.", "report_contract": "research_only", "ai_supercycle_layer": "hard_assets_energy_heavy", "supply_chain_hypothesis": "datacenter power, cooling, optical, equipment, and other heavy-asset AI buildout beneficiaries can rerate late after persistent float absorption signals that procurement certainty is diffusing beyond the obvious compute winners", "relationship_evidence_required": "true", "money_readiness": "research_only", "decision": "revert", "session_branch": "main", "base_ref": "origin/main", "merge_base": "7e34f69c6d80fac556ec0c4417978d3bf014bde7", "head_commit": "7e34f69c6d80fac556ec0c4417978d3bf014bde7"}
{"ts": "2026-05-14T06:57:17.389776+08:00", "session_id": "20260514_060003_7f53cb", "market": "cn", "formula": "rank(-ts_std(amount,20)/ts_mean(amount,20))", "name": "amount_evenness_20", "is_ic": 0.0, "is_ic_ir": 0.0, "is_sharpe": 0.0, "is_turnover": 0.0, "is_monotonicity": 0.0, "gates": "FAIL", "status": "reverted", "eval_seconds": 23.0, "sleeve_id": "cn_ai_flow_accumulation", "mispricing_source": "Slow-moving capital and benchmark-aware allocators accumulate bottleneck exposure gradually, while retail participants underreact to quiet flow persistence because there is no obvious headline or breakout signal.", "forced_counterparty": "Retail traders and short-horizon liquidity providers who sell into steady demand without fully pricing medium-horizon inventory absorption.", "data_requirements": "[\"daily amount history\",\"beta-hedged sleeve attribution vs 000300.SH/399006.SZ\",\"correlation to existing amount_stability_20 implementation\",\"capacity and turnover cost check\"]", "failure_mode": "It stops working when the market regime shifts to headline-driven broad beta or when stable amount merely reflects illiquidity instead of informed accumulation.", "report_contract": "setup_overlay", "ai_supercycle_layer": "ai_chip_equipment_materials_packaging", "supply_chain_hypothesis": "Quiet accumulation should surface in domestic AI bottleneck manufacturers where policy/fundamental demand reprices before fully confirmed order evidence reaches the tape.", "relationship_evidence_required": "true", "money_readiness": "research_only", "decision": "revert", "session_branch": "main", "base_ref": "origin/main", "merge_base": "7e34f69c6d80fac556ec0c4417978d3bf014bde7", "head_commit": "7e34f69c6d80fac556ec0c4417978d3bf014bde7"}
{"ts": "2026-05-14T06:57:17.389776+08:00", "session_id": "20260514_060003_7f53cb", "market": "cn", "formula": "rank(ts_mean(amount/circ_market_cap,20)/ts_std(amount/circ_market_cap,20)/ts_max(turnover_rate,20))", "name": "float_absorption_no_spike_20", "is_ic": 0.0, "is_ic_ir": 0.0, "is_sharpe": 0.0, "is_turnover": 0.0, "is_monotonicity": 0.0, "gates": "FAIL", "status": "reverted", "eval_seconds": 161.0, "sleeve_id": "cn_ai_accumulation", "mispricing_source": "Underreaction to steady institutional accumulation in float-constrained AI-infra suppliers; the market overweights noisy high-turnover breakout days and underweights orderly multi-week absorption.", "forced_counterparty": "Benchmark-constrained domestic mutual funds that cannot size into smaller suppliers early, plus retail swing traders providing liquidity into steady bids", "data_requirements": "[\"daily amount\",\"daily circ_market_cap\",\"daily turnover_rate\",\"benchmark returns for 000300.SH and 399006.SZ for beta-hedged attribution\",\"sleeve correlation/drawdown report\",\"source-review evidence before asserting any supplier/customer link\"]", "failure_mode": "It stops working when theme liquidity becomes purely speculative and one-day turnover spikes, not quiet absorption, drive returns; it also weakens if free-float metrics become stale after placements/unlocks.", "report_contract": "setup_overlay", "ai_supercycle_layer": "ai_chip_equipment_materials_packaging", "supply_chain_hypothesis": "Candidate AI capex bottleneck suppliers in equipment/materials/packaging should show steady float-adjusted value absorption without crowding spikes before filings or official order evidence upgrades consensus.", "relationship_evidence_required": "true", "money_readiness": "research_only", "decision": "revert", "session_branch": "main", "base_ref": "origin/main", "merge_base": "7e34f69c6d80fac556ec0c4417978d3bf014bde7", "head_commit": "7e34f69c6d80fac556ec0c4417978d3bf014bde7"}
{"ts": "2026-05-14T06:57:17.389776+08:00", "session_id": "20260514_060003_7f53cb", "market": "cn", "formula": "rank(-ts_std(turnover_rate, 20) / ts_mean(turnover_rate, 20))", "name": "turnover_stability_20", "is_ic": 0.0, "is_ic_ir": 0.0, "is_sharpe": 0.0, "is_turnover": 0.0, "is_monotonicity": 0.0, "gates": "FAIL", "status": "reverted", "eval_seconds": 106.9, "sleeve_id": "cn_ai_turnover_absorption", "mispricing_source": "Slow institutional absorption and delayed recognition of float scarcity in AI-theme leaders create underreaction after noisy retail rotation.", "forced_counterparty": "retail theme chasers, short-horizon liquidity traders, and benchmark-aware PMs rotating on headline cadence", "data_requirements": "[\"turnover_rate daily history\",\"AI universe membership/source-review status\",\"beta-hedge attribution versus 000300.SH and 399006.SZ for portfolio promotion\"]", "failure_mode": "Stops working when the market shifts into broad speculative churn where high-turnover burst leaders dominate, or when policy/liquidity shocks force indiscriminate de-risking across the whole AI sleeve.", "report_contract": "setup_overlay", "ai_supercycle_layer": "ai_networking_optical_cpo", "supply_chain_hypothesis": "Candidate optical interconnect/CPO bottleneck names in the CN AI universe should show compressed turnover as strong hands absorb float ahead of verified order or capex evidence.", "relationship_evidence_required": "true", "money_readiness": "research_only", "decision": "revert", "session_branch": "main", "base_ref": "origin/main", "merge_base": "7e34f69c6d80fac556ec0c4417978d3bf014bde7", "head_commit": "7e34f69c6d80fac556ec0c4417978d3bf014bde7"}
{"ts": "2026-05-14T06:57:17.389776+08:00", "session_id": "20260514_060003_7f53cb", "market": "cn", "formula": "rank(ret_20d - ret_5d) * rank(-ts_mean(turnover_rate, 5))", "name": "trend_pullback_coolturn_20_5", "is_ic": 0.0, "is_ic_ir": 0.0, "is_sharpe": 0.0, "is_turnover": 0.0, "is_monotonicity": 0.0, "gates": "FAIL", "status": "reverted", "eval_seconds": 68.4, "sleeve_id": "cn_ai_leadership_pullback", "mispricing_source": "A-share thematic leaders are often under-owned until performance pressure forces re-entry; a shallow reset with low turnover suggests inventory is not being distributed, so the next 10-20 day leg is underpriced.", "forced_counterparty": "Short-horizon retail traders and benchmarked PMs who trim on recent weakness or sell for liquidity, then re-enter after trend confirmation.", "data_requirements": "[daily OHLCV, turnover_rate, AI-universe membership/status, benchmark returns for 000300.SH and 399006.SZ, sleeve correlation ledger, beta-hedge and residual attribution]", "failure_mode": "Fails in broad mean-reversion regimes, policy-shock rotations, or late-stage blowoff moves where low turnover reflects fading interest instead of orderly absorption.", "report_contract": "setup_overlay", "ai_supercycle_layer": "none", "supply_chain_hypothesis": "Cross-layer AI-infra bottleneck names with real order visibility should show orderly 20-day leadership and low-turnover 5-day pullbacks before continuation.", "relationship_evidence_required": "true", "money_readiness": "research_only", "decision": "revert", "session_branch": "main", "base_ref": "origin/main", "merge_base": "7e34f69c6d80fac556ec0c4417978d3bf014bde7", "head_commit": "7e34f69c6d80fac556ec0c4417978d3bf014bde7"}
{"ts": "2026-05-14T06:57:17.389776+08:00", "session_id": "20260514_060003_7f53cb", "market": "cn", "formula": "rank(ts_min(ts_sum(amount/circ_market_cap,5),20)/ts_std(ts_sum(amount/circ_market_cap,5),20))*rank(ts_mean(turnover_rate,20)/ts_max(turnover_rate,20))", "name": "weekly_float_floor_turnover_even_20", "is_ic": 0.0, "is_ic_ir": 0.0, "is_sharpe": 0.0, "is_turnover": 0.0, "is_monotonicity": 0.0, "gates": "FAIL", "status": "reverted", "eval_seconds": 95.3, "sleeve_id": "weekly_float_share_absorption", "mispricing_source": "The payoff comes from underreaction to steady ownership transfer per unit of tradable float; this is flow-path quality, not a close-only momentum or candle-shape clone like `kshadow_5`.", "forced_counterparty": "Retail theme chasers, redemption-driven sellers, and benchmark-constrained long-only funds trading for liquidity or mandate rather than 10-20 day alpha.", "data_requirements": "[\"amount\",\"circ_market_cap\",\"turnover_rate\",\"beta-hedged sleeve attribution vs 000300.SH and 399006.SZ\",\"residual risk attribution\",\"cross-sleeve correlation panel\",\"source-review evidence cards before attaching any supplier/customer narrative\"]", "failure_mode": "It should fail in policy-gap or speculative squeeze regimes where bursty turnover is genuinely informative, or when smooth flow mainly reflects dead illiquidity/passive churn instead of real accumulation.", "report_contract": "setup_overlay", "ai_supercycle_layer": "ai_chip_equipment_materials_packaging", "supply_chain_hypothesis": "Candidate domestic AI semiconductor equipment, materials, packaging, and testing bottlenecks should show a persistent weekly float-flow floor with non-spiky turnover before verified order, backlog, or capex evidence is fully priced.", "relationship_evidence_required": "true", "money_readiness": "research_only", "decision": "revert", "session_branch": "main", "base_ref": "origin/main", "merge_base": "7e34f69c6d80fac556ec0c4417978d3bf014bde7", "head_commit": "7e34f69c6d80fac556ec0c4417978d3bf014bde7"}
{"ts": "2026-05-14T06:57:17.389776+08:00", "session_id": "20260514_060003_7f53cb", "market": "cn", "formula": "rank(ts_mean(close/open,20)*ts_min(amount/circ_market_cap,20)/ts_mean(amount/circ_market_cap,20))", "name": "float_floor_body_bias_20", "is_ic": 0.0, "is_ic_ir": 0.0, "is_sharpe": 0.0, "is_turnover": 0.0, "is_monotonicity": 0.0, "gates": "FAIL", "status": "reverted", "eval_seconds": 210.0, "sleeve_id": "cn_ai_infra_accumulation", "mispricing_source": "Lagging public evidence and constrained liquidity let informed buyers absorb supply over many sessions; the signal mixes participation floor with body quality, so it is not just a high-correlation variant of an existing shadow-price factor.", "forced_counterparty": "Retail theme traders taking quick profits and benchmarked managers that cannot fully own thinner bottleneck names early", "data_requirements": "[\"current daily close/open/amount/circ_market_cap are sufficient for IS testing\", \"for promotion require beta-hedged sleeve attribution vs 000300.SH and 399006.SZ plus residual-risk and corr-to-kshadow_5 checks\", \"if mapped to specific suppliers/customers, add filings/press releases/transcripts from ai_infra source review\"]", "failure_mode": "Fails in rumor-gap or policy-beta melt-up regimes where opening gaps dominate steady accumulation, or when activity floor reflects distribution/crowding instead of real ownership transfer.", "report_contract": "research_only", "ai_supercycle_layer": "ai_chip_equipment_materials_packaging", "supply_chain_hypothesis": "Domestic AI chip equipment/materials/packaging bottleneck names should show persistent float-participation floors and positive bodies before verified backlog/order evidence is fully published.", "relationship_evidence_required": "true", "money_readiness": "research_only", "decision": "revert", "session_branch": "main", "base_ref": "origin/main", "merge_base": "7e34f69c6d80fac556ec0c4417978d3bf014bde7", "head_commit": "7e34f69c6d80fac556ec0c4417978d3bf014bde7"}
