{"ts": "2026-05-22T07:22:04.701442+08:00", "session_id": "20260522_062703_274f5a", "market": "cn", "formula": "rank((-ps_ttm)/(0.01+ts_std(turnover_rate,20)))", "name": "stable_turnover_value_repricing_20", "is_ic": 0.0472, "is_ic_ir": 0.185, "is_sharpe": 2.304, "is_turnover": 0.04, "is_monotonicity": 0.35, "gates": "FAIL", "status": "reverted", "eval_seconds": 96.2, "sleeve_id": "ai_infra_cn_accumulation", "mispricing_source": "Valuation anchoring keeps hard-asset AI suppliers cheap while patient capital accumulates gradually; the market overpays for noisy thematic attention and underprices steady sponsorship in less flashy names.", "forced_counterparty": "Retail theme chasers and benchmarked managers who wait for explicit quarterly proof instead of pre-positioning in quietly sponsored suppliers.", "data_requirements": "[\"IS backtest uses current fields only: ps_ttm, turnover_rate\", \"for promotion: sleeve correlation vs promoted factors, beta-hedged residual return attribution\", \"if interpreted as supplier/order discovery: filings, official press releases, transcripts, backlog/capex evidence from ai_infra source review\"]", "failure_mode": "It stops working when cheap AI-infra names are cheap for valid reasons such as order miss, margin compression, or credit stress, and in momentum-led tape where unstable high-multiple leaders keep winning.", "report_contract": "setup_overlay", "ai_supercycle_layer": "ai_chip_equipment_materials_packaging", "supply_chain_hypothesis": "Domestic chip equipment/materials/packaging suppliers may be quietly accumulated ahead of verified AI capex localization and bottleneck order flow.", "relationship_evidence_required": "true", "money_readiness": "research_only", "decision": "revert", "session_branch": "main", "base_ref": "origin/main", "merge_base": "c550618668ba3d3ec82401f36dd85be095d0fc92", "head_commit": "c550618668ba3d3ec82401f36dd85be095d0fc92"}
{"ts": "2026-05-22T07:22:04.701442+08:00", "session_id": "20260522_062703_274f5a", "market": "cn", "formula": "rank(ts_mean(amount,20)/ts_std(amount,20))*rank(-ps_ttm)", "name": "stable_amount_low_ps_20", "is_ic": 0.0057, "is_ic_ir": 0.041, "is_sharpe": -2.026, "is_turnover": 0.11, "is_monotonicity": -0.25, "gates": "FAIL", "status": "reverted", "eval_seconds": 83.6, "sleeve_id": "cn_ai_infra_value_accumulation", "mispricing_source": "Quiet sponsorship of liquid but still-cheap AI-infra names is slower to arbitrage than pure price momentum, because valuation skepticism delays capital reallocation even after accumulation starts.", "forced_counterparty": "benchmark-constrained mutual funds and retail turnover chasers", "data_requirements": "[\"daily OHLCV\", \"daily_basic amount\", \"daily_basic ps_ttm\", \"beta-hedged sleeve PnL\", \"rolling sleeve correlation and residual risk attribution\"]", "failure_mode": "This stops working when the market shifts to indiscriminate high-multiple narrative chasing, or when low-PS names are cheap for fundamental deterioration rather than delayed AI-capex repricing.", "report_contract": "fresh_buy_gate", "ai_supercycle_layer": "ai_chip_equipment_materials_packaging", "supply_chain_hypothesis": "Domestic AI hardware bottleneck beneficiaries may show stable value absorption before verified order, backlog, or customer-win evidence is fully reflected in consensus.", "relationship_evidence_required": "true", "money_readiness": "money_candidate", "decision": "revert", "session_branch": "main", "base_ref": "origin/main", "merge_base": "c550618668ba3d3ec82401f36dd85be095d0fc92", "head_commit": "c550618668ba3d3ec82401f36dd85be095d0fc92"}
{"ts": "2026-05-22T07:22:04.701442+08:00", "session_id": "20260522_062703_274f5a", "market": "cn", "formula": "rank(-pb) * rank(-ret_5d * ts_mean(turnover_rate,20) / (ts_std(turnover_rate,20)+0.1))", "name": "value_stable_turnover_pullback_5_20", "is_ic": 0.041, "is_ic_ir": 0.166, "is_sharpe": -0.452, "is_turnover": 0.267, "is_monotonicity": 0.0, "gates": "FAIL", "status": "reverted", "eval_seconds": 157.0, "sleeve_id": "cn_ai_infra_pullback_overlay", "mispricing_source": "Orderly participation during a short pullback signals accumulation that is not fully incorporated because fast money sells weakness while slower fundamental capital needs time to validate the story.", "forced_counterparty": "T+1 retail profit-takers, momentum chasers cutting near-term losers, and benchmarked funds mechanically trimming recent underperformers.", "data_requirements": "`[available now: close/open/high/low/ret_5d/turnover_rate/pb; before promotion: factor-vs-benchmark hedge attribution vs 000300.SH/399006.SZ, sleeve correlation to promoted factors, ai_infra source-review status/evidence cards for any supplier or demand-chain claim]`", "failure_mode": "Fails in broad liquidity panics or speculative melt-up regimes where unstable high-turnover names outperform and PB stops acting as a credible anchor.", "report_contract": "setup_overlay", "ai_supercycle_layer": "ai_networking_optical_cpo", "supply_chain_hypothesis": "Candidate optical/CPO/fiber bottleneck names may show orderly pullbacks with stable float turnover before formal order, ASP, or capacity evidence is widely recognized.", "relationship_evidence_required": "true", "money_readiness": "research_only", "decision": "revert", "session_branch": "main", "base_ref": "origin/main", "merge_base": "c550618668ba3d3ec82401f36dd85be095d0fc92", "head_commit": "c550618668ba3d3ec82401f36dd85be095d0fc92"}
{"ts": "2026-05-22T07:22:04.701442+08:00", "session_id": "20260522_062703_274f5a", "market": "cn", "formula": "rank(ts_mean(turnover_rate,20)/(ts_std(turnover_rate,20)*max(pb,0.1)))*rank(-ts_mean(high/low,10))", "name": "quiet_value_turnover_stability_20", "is_ic": 0.0, "is_ic_ir": 0.0, "is_sharpe": 0.0, "is_turnover": 0.0, "is_monotonicity": 0.0, "gates": "FAIL", "status": "compute_error", "eval_seconds": 232.5, "sleeve_id": "cn_ai_infra_accumulation", "mispricing_source": "Slow institutional accumulation in under-owned AI buildout beneficiaries is not captured by pure price factors; the signal needs stable participation and a valuation anchor, not just past returns.", "forced_counterparty": "Retail theme-rotators and short-horizon momentum desks that abandon quiet consolidations; specialist AI funds are liquidity-constrained buyers rather than instant repricers.", "data_requirements": "[daily OHLCV, amount, turnover_rate, pb already available for IS; before promotion require beta-hedged sleeve PnL, residual risk attribution, and corr check vs amount_stability_20 and turnover_stability_20; any supplier/order claim needs filings or official releases]", "failure_mode": "Fails when AI leadership shifts to pure high-beta breakout chasing, or when low PB reflects real balance-sheet deterioration rather than temporary skepticism about AI capex conversion.", "report_contract": "setup_overlay", "ai_supercycle_layer": "hard_assets_energy_heavy", "supply_chain_hypothesis": "Candidate domestic hard-asset beneficiaries of AI datacenter buildout may show quiet, stable-turnover accumulation before power, cooling, or equipment orders are obvious in reported evidence.", "relationship_evidence_required": "true", "money_readiness": "research_only", "decision": "revert", "session_branch": "main", "base_ref": "origin/main", "merge_base": "c550618668ba3d3ec82401f36dd85be095d0fc92", "head_commit": "c550618668ba3d3ec82401f36dd85be095d0fc92"}
{"ts": "2026-05-22T07:22:04.701442+08:00", "session_id": "20260522_062703_274f5a", "market": "cn", "formula": "rank(-ps_ttm)*rank(-(ts_max(turnover_rate,20)/ts_mean(turnover_rate,20)))", "name": "value_turnover_spike_quiet_20", "is_ic": -0.0143, "is_ic_ir": -0.042, "is_sharpe": -1.457, "is_turnover": 0.121, "is_monotonicity": -0.25, "gates": "FAIL", "status": "reverted", "eval_seconds": 119.0, "sleeve_id": "cn_ai_infra_accumulation", "mispricing_source": "A-share capital often crowds into already-hot AI leaders and neglects cheaper bottleneck suppliers until later disclosures make the demand visible, leaving a repricing gap in orderly, under-spiky names.", "forced_counterparty": "retail theme chasers and benchmarked mutual funds that are pushed toward liquid, already-active winners", "data_requirements": "[\"IS backtest on current daily data\",\"pre-promotion corr check vs promoted factors\",\"beta-hedged sleeve PnL and residual risk attribution\",\"ai_infra source-review status for any supplier/customer narrative used in reporting\"]", "failure_mode": "It stops working when speculative leadership keeps broadening and high-turnover winners continue to dominate, or when low PS correctly reflects deteriorating demand rather than delayed recognition.", "report_contract": "research_only", "ai_supercycle_layer": "ai_chip_equipment_materials_packaging", "supply_chain_hypothesis": "Within validated CN semiconductor equipment/materials/packaging names, low-PS stocks with suppressed turnover spikes are candidate bottleneck suppliers being accumulated before order-book confirmation.", "relationship_evidence_required": "true", "money_readiness": "research_only", "decision": "revert", "session_branch": "main", "base_ref": "origin/main", "merge_base": "c550618668ba3d3ec82401f36dd85be095d0fc92", "head_commit": "c550618668ba3d3ec82401f36dd85be095d0fc92"}
{"ts": "2026-05-22T14:55:41.759860+08:00", "session_id": "20260522_140003_ff19e4", "market": "cn", "formula": "rank(ts_mean(turnover_rate,20)/(ts_std(turnover_rate,20)+0.01))", "name": "turnover_stability_20", "is_ic": -0.0357, "is_ic_ir": -0.134, "is_sharpe": -3.408, "is_turnover": 0.133, "is_monotonicity": -0.3, "gates": "FAIL", "status": "reverted", "eval_seconds": 125.6, "sleeve_id": "cn_ai_flow_accumulation", "mispricing_source": "The market overreacts to explosive theme spikes but underprices steady sponsorship; this is a flow-persistence signal, not another short-horizon price reversal or candle-shape variant.", "forced_counterparty": "Retail T+1 traders and benchmark-constrained funds that either sell slow grinders too early or cannot complete desired size immediately", "data_requirements": "[\"turnover_rate daily history\",\"ai_infra CN universe membership\",\"benchmark-hedged sleeve return\",\"rolling correlation vs promoted factors\",\"turnover and cost attribution\"]", "failure_mode": "It stops working when AI-theme tape becomes purely speculative and stable turnover no longer reflects informed accumulation, or when the signal collapses into crowded benchmark beta.", "report_contract": "setup_overlay", "ai_supercycle_layer": "ai_networking_optical_cpo", "supply_chain_hypothesis": "Orderly turnover may surface optical interconnect/CPO bandwidth bottleneck names being accumulated ahead of verified datacenter networking orders and capex spillover.", "relationship_evidence_required": "true", "money_readiness": "research_only", "decision": "revert", "session_branch": "main", "base_ref": "origin/main", "merge_base": "c99187be1dc8d78a84147200981562efcde7b8d5", "head_commit": "c99187be1dc8d78a84147200981562efcde7b8d5"}
{"ts": "2026-05-22T14:55:41.759860+08:00", "session_id": "20260522_140003_ff19e4", "market": "cn", "formula": "rank(ts_min(amount,20)/ts_mean(amount,20))*rank(-ts_std(volume_ratio,20))", "name": "amount_floor_relvol_calm_20", "is_ic": 0.0286, "is_ic_ir": 0.18, "is_sharpe": -1.287, "is_turnover": 0.132, "is_monotonicity": 0.0, "gates": "FAIL", "status": "reverted", "eval_seconds": 178.5, "sleeve_id": "cn_ai_flow_quality", "mispricing_source": "A-share thematic capital overpays for noisy breakout participation and underreacts to validated AI-infra names that keep a steady cash-flow floor without attention-grabbing volume shocks.", "forced_counterparty": "Retail AI-theme chasers and fast-money breakout funds", "data_requirements": "[\"current daily amount and volume_ratio are sufficient for IS test\",\"for promotion: beta-hedged sleeve PnL, residual risk attribution, and correlation vs amount_stability_20 plus current promoted sleeves\"]", "failure_mode": "Fails in policy-gap or limit-up mania when one-day participation spikes are the true leadership signal, or when a high amount floor is driven by passive rebalance/liquidity artifacts instead of accumulation.", "report_contract": "research_only", "ai_supercycle_layer": "ai_datacenter_edge_infra", "supply_chain_hypothesis": "Should preferentially surface validated CN datacenter, power, cooling, and optical bottleneck enablers being accumulated before capex/order evidence is fully reflected in price.", "relationship_evidence_required": "true", "money_readiness": "research_only", "decision": "revert", "session_branch": "main", "base_ref": "origin/main", "merge_base": "c99187be1dc8d78a84147200981562efcde7b8d5", "head_commit": "c99187be1dc8d78a84147200981562efcde7b8d5"}
{"ts": "2026-05-22T14:55:41.759860+08:00", "session_id": "20260522_140003_ff19e4", "market": "cn", "formula": "rank(ts_min(turnover_rate,20)/ts_mean(turnover_rate,20))", "name": "turnover_floor_ratio_20", "is_ic": -0.025, "is_ic_ir": -0.103, "is_sharpe": -3.659, "is_turnover": 0.159, "is_monotonicity": 0.15, "gates": "FAIL", "status": "reverted", "eval_seconds": 120.5, "sleeve_id": "cn_ai_flow_quality", "mispricing_source": "The market over-rewards visible burst days and underprices persistent sponsorship; a stable turnover floor reflects slower institutional inventory transfer that is not captured by existing price-path factors.", "forced_counterparty": "Retail chasers and short-horizon momentum traders who sell back on quiet days; benchmarked funds rebalancing around liquidity windows.", "data_requirements": "[\"turnover_rate daily history\",\"AI-infra universe membership\",\"post-promotion beta/residual attribution vs 000300.SH and 399006.SZ\",\"sleeve correlation to existing factors\"]", "failure_mode": "It stops working if sector trading becomes uniformly hot and every AI name carries an elevated turnover floor, or if returns become dominated by one-off rumor/event spikes instead of persistent accumulation.", "report_contract": "research_only", "ai_supercycle_layer": "none", "supply_chain_hypothesis": "none", "relationship_evidence_required": "false", "money_readiness": "research_only", "decision": "revert", "session_branch": "main", "base_ref": "origin/main", "merge_base": "c99187be1dc8d78a84147200981562efcde7b8d5", "head_commit": "c99187be1dc8d78a84147200981562efcde7b8d5"}
{"ts": "2026-05-22T14:55:41.759860+08:00", "session_id": "20260522_140003_ff19e4", "market": "cn", "formula": "zscore(ts_mean(amount/circ_market_cap,20))-zscore(ts_std(amount/circ_market_cap,20))", "name": "float_amount_stability_20", "is_ic": -0.0069, "is_ic_ir": -0.034, "is_sharpe": -1.998, "is_turnover": 0.126, "is_monotonicity": -0.45, "gates": "FAIL", "status": "reverted", "eval_seconds": 74.3, "sleeve_id": "cn_ai_infra_flow_accumulation", "mispricing_source": "Slow-moving capital accumulates float-constrained AI-infra leaders before fundamental confirmation is obvious, while the market underreacts to stable notional absorption.", "forced_counterparty": "Retail profit-takers, liquidity-needing funds, and benchmark-insensitive sellers", "data_requirements": "[\"daily amount\",\"circ_market_cap\",\"beta-hedged sleeve attribution\",\"factor correlation matrix\",\"source-reviewed AI universe membership\",\"filings/press releases if any supplier or order claim is later attached\"]", "failure_mode": "It stops working when high amount reflects speculative distribution or policy-chasing bursts rather than accumulation, especially during broad deleveraging.", "report_contract": "research_only", "ai_supercycle_layer": "ai_chip_equipment_materials_packaging", "supply_chain_hypothesis": "Candidate domestic AI capex bottleneck names in equipment, materials, and advanced packaging should show stable float-adjusted value turnover before order visibility and localization demand are fully recognized.", "relationship_evidence_required": "true", "money_readiness": "research_only", "decision": "revert", "session_branch": "main", "base_ref": "origin/main", "merge_base": "c99187be1dc8d78a84147200981562efcde7b8d5", "head_commit": "c99187be1dc8d78a84147200981562efcde7b8d5"}
{"ts": "2026-05-22T14:55:41.759860+08:00", "session_id": "20260522_140003_ff19e4", "market": "cn", "formula": "rank(ts_mean(amount/circ_market_cap,20)/ts_max(amount/circ_market_cap,20))*rank(-ts_std(close/open-1,20))", "name": "float_peak_body_stability_20", "is_ic": -0.0806, "is_ic_ir": -0.267, "is_sharpe": -6.073, "is_turnover": 0.154, "is_monotonicity": -0.7, "gates": "FAIL", "status": "reverted", "eval_seconds": 247.9, "sleeve_id": "cn_ai_orderly_accumulation", "mispricing_source": "T+1 retail churn and catalyst-driven discretionary PMs underprice orderly float absorption when it is not accompanied by headline volume spikes; this is a flow-path signal rather than a pure price-level factor.", "forced_counterparty": "short-horizon retail traders and benchmarked managers waiting for explicit confirmation", "data_requirements": "[\"daily close/open/amount/circ_market_cap for IS test\",\"AI-universe membership and source-review status for tradable eligibility\",\"beta-hedged sleeve return, residual attribution, and sleeve correlation before promotion\",\"filings/PRs/transcripts only if a specific supplier/customer claim is made\"]", "failure_mode": "fails in gap-driven thematic chase regimes, or when stable float flow is mostly illiquidity/no-attention rather than informed accumulation", "report_contract": "setup_overlay", "ai_supercycle_layer": "ai_chip_equipment_materials_packaging", "supply_chain_hypothesis": "Domestic AI capex bottleneck suppliers may be accumulated through steady float turnover and calm intraday bodies before packaging/equipment/order evidence is formally confirmed.", "relationship_evidence_required": "true", "money_readiness": "research_only", "decision": "revert", "session_branch": "main", "base_ref": "origin/main", "merge_base": "c99187be1dc8d78a84147200981562efcde7b8d5", "head_commit": "c99187be1dc8d78a84147200981562efcde7b8d5"}
{"ts": "2026-05-22T14:55:41.759860+08:00", "session_id": "20260522_140003_ff19e4", "market": "cn", "formula": "rank(ts_mean(amount,20)/ts_std(amount,20))", "name": "amount_persistence_20", "is_ic": 0.0149, "is_ic_ir": 0.099, "is_sharpe": -1.952, "is_turnover": 0.128, "is_monotonicity": -0.15, "gates": "FAIL", "status": "reverted", "eval_seconds": 142.1, "sleeve_id": "cn_ai_flow_accumulation", "mispricing_source": "The market underreacts to persistent cash commitment inside AI-infra names because attention is captured by breakout candles and lagging headlines; this factor targets flow quality rather than raw price momentum.", "forced_counterparty": "Retail theme traders and short-horizon mutual funds rotating on recent leaderboard performance and redemption pressure.", "data_requirements": "[\"daily amount history\",\"AI-universe membership/source-review status\",\"factor correlation matrix vs promoted sleeves\",\"long alpha vs beta-hedge and residual risk attribution before promotion\"]", "failure_mode": "It stops working in pure sentiment squeeze regimes where spiky turnover and limit-up chasing dominate, or when broad liquidity drains turn steady-flow names into value traps.", "report_contract": "setup_overlay", "ai_supercycle_layer": "hard_assets_energy_heavy", "supply_chain_hypothesis": "Orderly amount persistence should surface datacenter, power, and other heavy AI-infrastructure bottleneck beneficiaries before backlog or capex evidence is fully reflected in prices.", "relationship_evidence_required": "true", "money_readiness": "research_only", "decision": "revert", "session_branch": "main", "base_ref": "origin/main", "merge_base": "c99187be1dc8d78a84147200981562efcde7b8d5", "head_commit": "c99187be1dc8d78a84147200981562efcde7b8d5"}
{"ts": "2026-05-22T14:55:41.759860+08:00", "session_id": "20260522_140003_ff19e4", "market": "cn", "formula": "rank(-ps_ttm) * rank(ts_mean(turnover_rate,20)/ts_std(turnover_rate,20))", "name": "low_ps_steady_turnover_20", "is_ic": -0.0021, "is_ic_ir": 0.002, "is_sharpe": -2.558, "is_turnover": 0.111, "is_monotonicity": -0.35, "gates": "FAIL", "status": "reverted", "eval_seconds": 186.7, "sleeve_id": "daily_flow_value_overlay", "mispricing_source": "A-share capital often overpays for high-PS AI concept leaders and underprices lower-multiple infrastructure enablers until earnings revision and source-confirmed demand arrive; steady turnover is the tape signature of patient accumulation.", "forced_counterparty": "Retail theme chasers and benchmark-aware growth managers who are structurally pushed toward liquid narrative winners rather than low-multiple capex suppliers before confirmation.", "data_requirements": "[\"ps_ttm\",\"turnover_rate\",\"ai_infra universe membership\",\"beta-hedged sleeve attribution\",\"correlation to existing promoted sleeves\",\"filings/press releases/transcripts for any claimed supplier or order relationship\"]", "failure_mode": "It stops working when speculative momentum dominates valuation for a long stretch, or when low-PS names are cheap because of genuine demand deterioration, balance-sheet stress, or policy/regulatory overhang.", "report_contract": "setup_overlay", "ai_supercycle_layer": "ai_datacenter_edge_infra", "supply_chain_hypothesis": "Steady-turnover, low-PS names inside the AI universe may surface under-owned datacenter, cooling, fiber, and related infrastructure enablers before verified capex or order evidence is fully reflected.", "relationship_evidence_required": "true", "money_readiness": "research_only", "decision": "revert", "session_branch": "main", "base_ref": "origin/main", "merge_base": "c99187be1dc8d78a84147200981562efcde7b8d5", "head_commit": "c99187be1dc8d78a84147200981562efcde7b8d5"}
