{"ts": "2026-05-28T14:56:22.652239+08:00", "session_id": "20260528_140003_a6f06a", "market": "cn", "formula": "rank(ts_mean(amount,20)/ts_std(amount,20))*rank(ret_20d-ret_5d)", "name": "stable_amount_leader_reset_20", "is_ic": -0.0132, "is_ic_ir": -0.079, "is_sharpe": -3.853, "is_turnover": 0.203, "is_monotonicity": -0.85, "gates": "FAIL", "status": "reverted", "eval_seconds": 115.9, "sleeve_id": "cn_ai_flow_reset", "mispricing_source": "Thematic retail exits and benchmark-lagged institutional re-entry create underpricing during controlled pullbacks; the amount-stability term makes this different from a generic price-only reversal.", "forced_counterparty": "Short-horizon retail and fast-money thematic traders de-risk on pullbacks; benchmark-constrained funds that wait for confirmation delay their buying.", "data_requirements": "[\"amount\",\"ret_5d\",\"ret_20d\",\"ai_infra BFS/layer tags for slicing\",\"benchmark hedge attribution\",\"sleeve correlation and residual risk attribution\"]", "failure_mode": "Fails when AI theme breadth collapses or stable amount is distribution/liquidity recycling instead of accumulation; also weak in broad mean-reversion regimes where 20-day leadership is not rewarded.", "report_contract": "setup_overlay", "ai_supercycle_layer": "ai_networking_optical_cpo", "supply_chain_hypothesis": "Optical/CPO interconnect bottleneck names tied to AI cluster scaling should exhibit sponsored-flow pullbacks before filings or company guidance fully confirm order conversion.", "relationship_evidence_required": "true", "money_readiness": "research_only", "decision": "revert", "session_branch": "main", "base_ref": "origin/main", "merge_base": "e23d553d30623951cda2e54c387d49e2cd55c5a2", "head_commit": "e23d553d30623951cda2e54c387d49e2cd55c5a2"}
{"ts": "2026-05-28T14:56:22.652239+08:00", "session_id": "20260528_140003_a6f06a", "market": "cn", "formula": "rank(-(ts_max(turnover_rate,20)/ts_mean(turnover_rate,20)))*rank(-ts_std(close/open,20))", "name": "turnover_spike_body_stability_20", "is_ic": -0.0824, "is_ic_ir": -0.27, "is_sharpe": -5.836, "is_turnover": 0.151, "is_monotonicity": -0.8, "gates": "FAIL", "status": "reverted", "eval_seconds": 232.0, "sleeve_id": "ai_infra_cn_flow_overlay", "mispricing_source": "A-share theme rotation and T+1 retail profit-taking create temporary supply, while patient institutions absorb stock gradually; the market underreacts when sponsorship is even rather than spike-driven.", "forced_counterparty": "retail momentum traders and benchmarked funds trimming risk into short-term weakness", "data_requirements": "[\"daily turnover_rate/open/close\",\"source-reviewed AI-universe membership\",\"corr to promoted sleeves\",\"beta-hedged residual attribution vs 000300.SH and 399006.SZ\"]", "failure_mode": "It should break in policy-shock or broad deleveraging regimes, where calm turnover/body behavior reflects illiquidity and buyer absence rather than sponsorship.", "report_contract": "setup_overlay", "ai_supercycle_layer": "ai_networking_optical_cpo", "supply_chain_hypothesis": "Candidate D1-D3 optical/CPO and interconnect bottleneck names should show quiet multi-day turnover distribution and orderly candles before relative outperformance, but any supplier/customer claim still needs original-source verification.", "relationship_evidence_required": "true", "money_readiness": "research_only", "decision": "revert", "session_branch": "main", "base_ref": "origin/main", "merge_base": "e23d553d30623951cda2e54c387d49e2cd55c5a2", "head_commit": "e23d553d30623951cda2e54c387d49e2cd55c5a2"}
{"ts": "2026-05-28T14:56:22.652239+08:00", "session_id": "20260528_140003_a6f06a", "market": "cn", "formula": "rank(-circ_market_cap)*rank(-ts_std(amount,20)/ts_mean(amount,20))", "name": "float_scarcity_amount_stability_20", "is_ic": 0.019, "is_ic_ir": 0.163, "is_sharpe": -1.059, "is_turnover": 0.102, "is_monotonicity": 0.0, "gates": "FAIL", "status": "reverted", "eval_seconds": 83.6, "sleeve_id": "cn_ai_infra_accumulation", "mispricing_source": "Underreaction to accumulation in float-scarce AI-infra bottleneck names; benchmarked capital prefers larger liquid leaders, leaving quieter upstream names mispriced until evidence is widely recognized.", "forced_counterparty": "Benchmark-constrained mutual funds and impatient retail holders", "data_requirements": "[\"amount\",\"circ_market_cap\",\"AI universe membership\",\"beta-hedge attribution vs 000300.SH/399006.SZ\",\"source-review evidence before tagging winners as bottleneck suppliers\"]", "failure_mode": "Fails when small-float AI names become crowded consensus trades, or in liquidity shocks where stable amount reflects illiquidity/stagnation rather than sponsorship.", "report_contract": "setup_overlay", "ai_supercycle_layer": "ai_chip_equipment_materials_packaging", "supply_chain_hypothesis": "Quietly accumulated small-float equipment/materials suppliers can be early bottleneck beneficiaries of AI capex before customer/order evidence is fully diffused through the market.", "relationship_evidence_required": "true", "money_readiness": "research_only", "decision": "revert", "session_branch": "main", "base_ref": "origin/main", "merge_base": "e23d553d30623951cda2e54c387d49e2cd55c5a2", "head_commit": "e23d553d30623951cda2e54c387d49e2cd55c5a2"}
{"ts": "2026-05-28T14:56:22.652239+08:00", "session_id": "20260528_140003_a6f06a", "market": "cn", "formula": "rank(-clamp(ps_ttm,0,20))*rank(-ts_std(delta(amount,5),20)/ts_mean(amount,20))", "name": "low_ps_amountchg_stability_20", "is_ic": -0.005, "is_ic_ir": 0.0, "is_sharpe": -3.719, "is_turnover": 0.101, "is_monotonicity": -0.4, "gates": "FAIL", "status": "reverted", "eval_seconds": 181.8, "sleeve_id": "cn_ai_infra_flow_value", "mispricing_source": "A-share funds often wait for explicit evidence before adding upstream AI-infra exposure, while retail T+1 supply keeps quietly accumulated names mispriced for several weeks.", "forced_counterparty": "Benchmark-hugging institutions waiting for confirmation and T+1 retail profit-takers selling into quiet accumulation", "data_requirements": "[\"daily_basic ps_ttm\",\"daily amount\",\"factor correlation vs promoted sleeves\",\"beta-hedged sleeve return and residual risk attribution vs 000300.SH and 399006.SZ\",\"source-review evidence before any new supplier/customer labeling\"]", "failure_mode": "Fails when speculative narrative beta dominates valuation discipline, or when policy/event shocks turn orderly accumulation into one-off volume spikes.", "report_contract": "fresh_buy_gate", "ai_supercycle_layer": "ai_chip_equipment_materials_packaging", "supply_chain_hypothesis": "Domestic AI chip equipment/materials/packaging names with cheap sales multiples and smooth amount-change sponsorship may be getting accumulated ahead of visible accelerator and datacenter capex confirmation.", "relationship_evidence_required": "true", "money_readiness": "money_candidate", "decision": "revert", "session_branch": "main", "base_ref": "origin/main", "merge_base": "e23d553d30623951cda2e54c387d49e2cd55c5a2", "head_commit": "e23d553d30623951cda2e54c387d49e2cd55c5a2"}
{"ts": "2026-05-28T14:56:22.652239+08:00", "session_id": "20260528_140003_a6f06a", "market": "cn", "formula": "rank((ts_mean(turnover_rate,20)/ts_max(turnover_rate,20))/ps_ttm)", "name": "low_ps_spike_calm_20", "is_ic": 0.0218, "is_ic_ir": 0.107, "is_sharpe": 0.225, "is_turnover": 0.045, "is_monotonicity": -0.05, "gates": "FAIL", "status": "reverted", "eval_seconds": 154.7, "sleeve_id": "cn_ai_bottleneck_repricing", "mispricing_source": "Slow diffusion of real AI-demand evidence into second-line suppliers; crowded capital pays up for story-rich leaders first and leaves calmer, cheaper names under-owned.", "forced_counterparty": "Thematic retail and benchmark-constrained managers who chase liquid high-PS AI names and become sellers after peak-turnover bursts.", "data_requirements": "[\"current daily turnover_rate and ps_ttm are enough for IS test\", \"before promotion: verified filings/transcripts on AI orders, backlog, capex, gross margin durability, and beta-hedged residual attribution vs CN benchmarks\"]", "failure_mode": "This stops working when liquidity/policy squeezes reward expensive narrative beta regardless of valuation, or when low ps_ttm reflects genuine revenue-quality deterioration instead of neglect.", "report_contract": "setup_overlay", "ai_supercycle_layer": "ai_chip_equipment_materials_packaging", "supply_chain_hypothesis": "Under-owned domestic equipment/materials/advanced-packaging suppliers are being accumulated ahead of verified AI capex spillover from accelerator, memory, and optical buildouts.", "relationship_evidence_required": "true", "money_readiness": "research_only", "decision": "revert", "session_branch": "main", "base_ref": "origin/main", "merge_base": "e23d553d30623951cda2e54c387d49e2cd55c5a2", "head_commit": "e23d553d30623951cda2e54c387d49e2cd55c5a2"}
{"ts": "2026-05-28T14:56:22.652239+08:00", "session_id": "20260528_140003_a6f06a", "market": "cn", "formula": "rank(-ts_corr(close, amount, 20)) * rank(ts_mean(amount,20) / ts_std(amount,20))", "name": "amount_absorption_corr_20", "is_ic": 0.0269, "is_ic_ir": 0.171, "is_sharpe": -1.395, "is_turnover": 0.146, "is_monotonicity": -0.1, "gates": "FAIL", "status": "reverted", "eval_seconds": 183.9, "sleeve_id": "cn_ai_infra_accumulation", "mispricing_source": "Slow institutional accumulation in thematic AI-infra leaders is underpriced because benchmarked funds scale in gradually while retail holders provide liquidity on weak days.", "forced_counterparty": "Retail swing traders and open-end funds facing redemption or benchmark-tracking constraints", "data_requirements": "[\"daily close\",\"daily amount\",\"AI-infra universe membership\",\"benchmark beta hedge attribution\",\"factor correlation vs promoted sleeves\"]", "failure_mode": "Breaks in policy-gap or liquidation regimes where heavy amount on down days reflects distribution, not absorption.", "report_contract": "setup_overlay", "ai_supercycle_layer": "none", "supply_chain_hypothesis": "none", "relationship_evidence_required": "false", "money_readiness": "research_only", "decision": "revert", "session_branch": "main", "base_ref": "origin/main", "merge_base": "e23d553d30623951cda2e54c387d49e2cd55c5a2", "head_commit": "e23d553d30623951cda2e54c387d49e2cd55c5a2"}
{"ts": "2026-05-28T14:56:22.652239+08:00", "session_id": "20260528_140003_a6f06a", "market": "cn", "formula": "rank(-ts_std(turnover_rate,20)/ts_mean(turnover_rate,20))*rank(-ts_rank(close,10))", "name": "stable_turnover_pullback_10", "is_ic": -0.0229, "is_ic_ir": -0.088, "is_sharpe": -3.426, "is_turnover": 0.32, "is_monotonicity": -0.7, "gates": "FAIL", "status": "reverted", "eval_seconds": 192.0, "sleeve_id": "daily_price_overlay", "mispricing_source": "T+1 retail and fast theme money sell recent underperformers mechanically, while institutional sponsorship exits more slowly; stable turnover filters for names where ownership is not actually breaking.", "forced_counterparty": "Retail momentum traders and benchmarked theme funds facing daily PnL/redemption pressure", "data_requirements": "Daily OHLCV + turnover_rate are enough for IS testing; production promotion still needs ai_infra evidence status, sleeve correlation matrix, and beta-hedged residual return attribution versus CN benchmarks.", "failure_mode": "This stops working in broad momentum-chasing regimes where pullbacks keep cascading, or when stable turnover reflects true demand absence rather than absorption.", "report_contract": "setup_overlay", "ai_supercycle_layer": "none", "supply_chain_hypothesis": "Validated AI-infra bottleneck names can show orderly pullbacks with unchanged ownership churn before the next repricing leg; no specific supplier/customer claim is asserted.", "relationship_evidence_required": "false", "money_readiness": "research_only", "decision": "revert", "session_branch": "main", "base_ref": "origin/main", "merge_base": "e23d553d30623951cda2e54c387d49e2cd55c5a2", "head_commit": "e23d553d30623951cda2e54c387d49e2cd55c5a2"}
{"ts": "2026-05-28T14:56:22.652239+08:00", "session_id": "20260528_140003_a6f06a", "market": "cn", "formula": "rank(ts_min(turnover_rate,20)/ts_max(turnover_rate,20))", "name": "turnover_corridor_20", "is_ic": -0.0561, "is_ic_ir": -0.216, "is_sharpe": -5.1, "is_turnover": 0.141, "is_monotonicity": -0.7, "gates": "FAIL", "status": "reverted", "eval_seconds": 255.1, "sleeve_id": "cn_ai_flow_quality", "mispricing_source": "A-share AI names are often over-owned by short-horizon hot money on spike days and under-owned by slower allocators building positions over many sessions; turnover corridor measures participation quality, not price direction, so it should be less correlated to the current price/candle sleeves.", "forced_counterparty": "Retail theme-chasers and short-horizon momentum traders who crowd visible turnover spikes, then unwind quickly because of T+1, stop-loss, and mandate constraints.", "data_requirements": "[\"daily turnover_rate history\",\"validated AI universe membership plus BFS/source-review status\",\"beta-hedged sleeve attribution vs 000300.SH and 399006.SZ\",\"optional intraday large-order flow before promotion beyond setup use\"]", "failure_mode": "It should fail in rumor-driven or broad liquidity melt-up regimes where one-day turnover spikes are real leadership ignition rather than weak-hand churn, and in liquidity shock regimes where steady participation no longer implies sponsorship.", "report_contract": "setup_overlay", "ai_supercycle_layer": "ai_chip_equipment_materials_packaging", "supply_chain_hypothesis": "Inside CN AI-infra names, this should preferentially surface domestic equipment/material/packaging bottleneck candidates being accumulated before backlog, capex, or customer-win evidence is fully recognized by the tape.", "relationship_evidence_required": "true", "money_readiness": "research_only", "decision": "revert", "session_branch": "main", "base_ref": "origin/main", "merge_base": "e23d553d30623951cda2e54c387d49e2cd55c5a2", "head_commit": "e23d553d30623951cda2e54c387d49e2cd55c5a2"}
{"ts": "2026-05-28T14:56:22.652239+08:00", "session_id": "20260528_140003_a6f06a", "market": "cn", "formula": "rank(-ts_max(ret_1d,20))*rank(-ts_std(delta(turnover_rate,5),20))", "name": "low_lottery_weekly_turnover_smooth_20", "is_ic": -0.0548, "is_ic_ir": -0.164, "is_sharpe": -4.349, "is_turnover": 0.074, "is_monotonicity": -0.35, "gates": "FAIL", "status": "reverted", "eval_seconds": 181.9, "sleeve_id": "daily_flow_quality_overlay", "mispricing_source": "The market overreacts to visible AI-theme spikes and underreacts to orderly accumulation; T+1 trading, benchmark friction, and retail attention delay repricing in quietly sponsored leaders.", "forced_counterparty": "Retail theme chasers and short-horizon momentum funds concentrated in high-amplitude concept names.", "data_requirements": "[\"current daily data is sufficient for IS test\",\"post-test need sleeve beta/residual attribution vs 000300.SH and 399006.SZ\",\"check correlation vs existing amount/turnover sleeves\",\"require ai_infra source-review status before attaching any supplier/customer narrative\"]", "failure_mode": "It fails in rumor-driven squeeze regimes where lottery-like concept spikes dominate steady accumulators, or when policy/liquidity shocks reward turnover bursts over smooth sponsorship.", "report_contract": "fresh_buy_gate", "ai_supercycle_layer": "ai_chip_equipment_materials_packaging", "supply_chain_hypothesis": "Bottleneck AI-infra equipment, materials, and packaging suppliers should be accumulated through steady turnover migration before orders, capex, or customer confirmations are fully reflected in filings and news.", "relationship_evidence_required": "true", "money_readiness": "money_candidate", "decision": "revert", "session_branch": "main", "base_ref": "origin/main", "merge_base": "e23d553d30623951cda2e54c387d49e2cd55c5a2", "head_commit": "e23d553d30623951cda2e54c387d49e2cd55c5a2"}
{"ts": "2026-05-28T14:56:22.652239+08:00", "session_id": "20260528_140003_a6f06a", "market": "cn", "formula": "rank(-ts_corr(ret_1d, shift(ret_1d, 1), 20)) * rank(ts_mean(amount / circ_market_cap,20) / ts_max(amount / circ_market_cap,20))", "name": "autocorr_float_peak_balance_20", "is_ic": -0.0399, "is_ic_ir": -0.135, "is_sharpe": -2.623, "is_turnover": 0.187, "is_monotonicity": -0.45, "gates": "FAIL", "status": "reverted", "eval_seconds": 114.3, "sleeve_id": "cn_ai_flow_absorption", "mispricing_source": "Underreaction to gradual institutional accumulation in capped-float AI-infra leaders; the market overreacts to noisy daily reversals and underweights steady participation quality.", "forced_counterparty": "T+1 retail profit-takers and liquidity-constrained benchmark/thematic funds trading around rebalance windows", "data_requirements": "[\"daily OHLCV\",\"amount\",\"circ_market_cap\",\"existing sleeve correlation matrix\",\"beta-hedged sleeve PnL and residual attribution\",\"ai_infra source-review status for ranked names\"]", "failure_mode": "It stops working in one-way retail squeeze regimes or macro de-risking phases where returns become positively autocorrelated and participation concentrates into event spikes.", "report_contract": "setup_overlay", "ai_supercycle_layer": "ai_chip_equipment_materials_packaging", "supply_chain_hypothesis": "Domestic D1-D3 semiconductor equipment/material bottleneck names should show orderly float-adjusted accumulation before fundamental evidence fully diffuses into prices.", "relationship_evidence_required": "true", "money_readiness": "research_only", "decision": "revert", "session_branch": "main", "base_ref": "origin/main", "merge_base": "e23d553d30623951cda2e54c387d49e2cd55c5a2", "head_commit": "e23d553d30623951cda2e54c387d49e2cd55c5a2"}
{"ts": "2026-05-28T14:56:22.652239+08:00", "session_id": "20260528_140003_a6f06a", "market": "cn", "formula": "rank(ts_mean(amount/circ_market_cap,20))*rank(-ts_std(amount/circ_market_cap,20))", "name": "float_flow_stability_20", "is_ic": -0.0008, "is_ic_ir": -0.005, "is_sharpe": -1.212, "is_turnover": 0.122, "is_monotonicity": 0.0, "gates": "FAIL", "status": "reverted", "eval_seconds": 86.8, "sleeve_id": "cn_ai_infra_flow_accumulation", "mispricing_source": "The payoff comes from underreaction to persistent sponsorship in float-adjusted flow; retail attention and fast money overpay for spikes, while steady accumulation is slower to be capitalized.", "forced_counterparty": "Retail speculators and mandate-constrained holders rotating toward higher-turnover themes", "data_requirements": "[\"current daily amount and circ_market_cap are sufficient for IS test\",\"before promotion require beta-hedged sleeve attribution vs 000300.SH/399006.SZ and correlation to existing sleeves\",\"ai_infra source-review status for any supplier interpretation\"]", "failure_mode": "This should fail in policy/liquidity chase regimes where unstable high-beta squeezes dominate, or in broad deleveraging when stable flow is just passive churn rather than informed accumulation.", "report_contract": "setup_overlay", "ai_supercycle_layer": "ai_chip_equipment_materials_packaging", "supply_chain_hypothesis": "Persistent float-normalized sponsorship may surface first in domestic substitute chip-equipment/materials/packaging names when upstream accelerator and memory bottlenecks trigger local capex substitution.", "relationship_evidence_required": "true", "money_readiness": "research_only", "decision": "revert", "session_branch": "main", "base_ref": "origin/main", "merge_base": "e23d553d30623951cda2e54c387d49e2cd55c5a2", "head_commit": "e23d553d30623951cda2e54c387d49e2cd55c5a2"}
{"ts": "2026-05-28T14:56:22.652239+08:00", "session_id": "20260528_140003_a6f06a", "market": "cn", "formula": "rank(ts_corr(ret_1d, shift(ret_1d, 1), 20) / (ts_std(turnover_rate, 20) + 0.01))", "name": "ret_autocorr_turnover_calm_20", "is_ic": -0.0155, "is_ic_ir": -0.056, "is_sharpe": -2.873, "is_turnover": 0.184, "is_monotonicity": 0.15, "gates": "FAIL", "status": "reverted", "eval_seconds": 219.1, "sleeve_id": "cn_ai_infra_tape_regime", "mispricing_source": "A-share AI themes often transition from noisy retail discovery to quieter institutional sponsorship; this factor isolates that handoff instead of just buying raw momentum, so it should be less collinear with the existing reversal and candle-price sleeves.", "forced_counterparty": "retail theme-chasers and short-horizon swing desks unwinding after turnover spikes; benchmarked funds forced to trim crowding on volatility", "data_requirements": "[\"current daily CN price and turnover_rate data are sufficient for signal test\", \"beta-hedge attribution vs 000300.SH and 399006.SZ\", \"correlation check vs promoted sleeves\", \"filings/press releases/transcripts if used to turn any supplier or order thesis into evidence\"]", "failure_mode": "It stops working when turnover calm reflects illiquidity or risk-off withdrawal instead of sponsorship, or when policy/news shocks force the market back into mean-reverting headline trading.", "report_contract": "action_overlay", "ai_supercycle_layer": "ai_chip_equipment_materials_packaging", "supply_chain_hypothesis": "Domestic AI capex bottleneck names in equipment, materials, and packaging should show orderly return persistence only after weak-hand turnover clears, which is the tape footprint of early sponsor accumulation before order visibility is fully repriced.", "relationship_evidence_required": "true", "money_readiness": "research_only", "decision": "revert", "session_branch": "main", "base_ref": "origin/main", "merge_base": "e23d553d30623951cda2e54c387d49e2cd55c5a2", "head_commit": "e23d553d30623951cda2e54c387d49e2cd55c5a2"}
