{"base_ref": "origin/main", "decision": "candidate", "eval_seconds": 162.7, "formula": "rank(-ts_std(pct_change(amount/circ_market_cap,5),20))", "gates": "PASS", "head_commit": "425c0a450ff7a22c8988215ab8e26acdf2764522", "is_ic": 0.034, "is_ic_ir": 0.338, "is_monotonicity": 0.15, "is_sharpe": 1.1, "is_turnover": 0.099, "market": "cn", "merge_base": "425c0a450ff7a22c8988215ab8e26acdf2764522", "name": "floatflow_growth_stability_20", "session_branch": "main", "session_id": "20260428_060002_dc8b1a", "status": "candidate", "ts": "2026-04-28T06:57:23.183701+08:00"}
{"base_ref": "origin/main", "decision": "candidate", "eval_seconds": 165.1, "formula": "rank(-ts_std(pct_change(amount,5),20))*rank(ts_min(amount/circ_market_cap,20)/ts_mean(amount/circ_market_cap,20))", "gates": "PASS", "head_commit": "425c0a450ff7a22c8988215ab8e26acdf2764522", "is_ic": 0.0364, "is_ic_ir": 0.346, "is_monotonicity": 0.0, "is_sharpe": 0.843, "is_turnover": 0.12, "market": "cn", "merge_base": "425c0a450ff7a22c8988215ab8e26acdf2764522", "name": "smooth_float_floor_20", "session_branch": "main", "session_id": "20260428_060002_dc8b1a", "status": "candidate", "ts": "2026-04-28T06:57:23.183701+08:00"}
{"base_ref": "origin/main", "decision": "candidate", "eval_seconds": 46.2, "formula": "rank(-ts_std(turnover_rate,20)/ts_mean(turnover_rate,20))", "gates": "PASS", "head_commit": "425c0a450ff7a22c8988215ab8e26acdf2764522", "is_ic": 0.0374, "is_ic_ir": 0.373, "is_monotonicity": 0.7, "is_sharpe": 1.522, "is_turnover": 0.121, "market": "cn", "merge_base": "425c0a450ff7a22c8988215ab8e26acdf2764522", "name": "turnover_stability_20", "session_branch": "main", "session_id": "20260428_060002_dc8b1a", "status": "candidate", "ts": "2026-04-28T06:57:23.183701+08:00"}
{"base_ref": "origin/main", "decision": "revert", "eval_seconds": 155.8, "formula": "rank(-ps_ttm * ts_std(volume_ratio, 20))", "gates": "FAIL", "head_commit": "425c0a450ff7a22c8988215ab8e26acdf2764522", "is_ic": -0.0027, "is_ic_ir": -0.015, "is_monotonicity": -0.5, "is_sharpe": -2.486, "is_turnover": 0.039, "market": "cn", "merge_base": "425c0a450ff7a22c8988215ab8e26acdf2764522", "name": "value_participation_stability_20", "session_branch": "main", "session_id": "20260428_060002_dc8b1a", "status": "reverted", "ts": "2026-04-28T06:57:23.183701+08:00"}
{"base_ref": "origin/main", "decision": "candidate", "eval_seconds": 138.6, "formula": "rank(-ts_std(ts_sum(amount/circ_market_cap,5),20)/ts_mean(ts_sum(amount/circ_market_cap,5),20))", "gates": "PASS", "head_commit": "425c0a450ff7a22c8988215ab8e26acdf2764522", "is_ic": 0.0259, "is_ic_ir": 0.263, "is_monotonicity": 0.95, "is_sharpe": 0.732, "is_turnover": 0.098, "market": "cn", "merge_base": "425c0a450ff7a22c8988215ab8e26acdf2764522", "name": "weekly_float_flow_stability_20", "session_branch": "main", "session_id": "20260428_060002_dc8b1a", "status": "candidate", "ts": "2026-04-28T06:57:23.183701+08:00"}
{"base_ref": "origin/main", "decision": "candidate", "eval_seconds": 163.4, "formula": "rank(ts_std(pct_change(amount,5),60)/ts_std(pct_change(amount,5),20))", "gates": "PASS", "head_commit": "045149116d9be75dd5909df255ae8b49b5753fa6", "is_ic": 0.0207, "is_ic_ir": 0.28, "is_monotonicity": -0.05, "is_sharpe": 1.956, "is_turnover": 0.103, "market": "cn", "merge_base": "045149116d9be75dd5909df255ae8b49b5753fa6", "name": "amount_growth_compress_20_60", "session_branch": "main", "session_id": "20260428_140002_78c607", "status": "candidate", "ts": "2026-04-28T14:55:55.453916+08:00"}
{"base_ref": "origin/main", "decision": "candidate", "eval_seconds": 149.8, "formula": "rank(-ts_corr(ret_1d,shift(ret_1d,1),20))*rank(ts_mean(amount,20)/ts_max(amount,20))", "gates": "PASS", "head_commit": "045149116d9be75dd5909df255ae8b49b5753fa6", "is_ic": 0.0366, "is_ic_ir": 0.475, "is_monotonicity": 0.15, "is_sharpe": 2.167, "is_turnover": 0.174, "market": "cn", "merge_base": "045149116d9be75dd5909df255ae8b49b5753fa6", "name": "anti_autocorr_amount_peak_balance_20", "session_branch": "main", "session_id": "20260428_140002_78c607", "status": "candidate", "ts": "2026-04-28T14:55:55.453916+08:00"}
{"base_ref": "origin/main", "decision": "candidate", "eval_seconds": 107.7, "formula": "rank(-ts_corr(ret_1d,shift(ret_1d,1),20))*rank(ts_min(amount/circ_market_cap,20)/ts_max(amount/circ_market_cap,20))", "gates": "PASS", "head_commit": "045149116d9be75dd5909df255ae8b49b5753fa6", "is_ic": 0.0379, "is_ic_ir": 0.485, "is_monotonicity": 0.4, "is_sharpe": 4.003, "is_turnover": 0.169, "market": "cn", "merge_base": "045149116d9be75dd5909df255ae8b49b5753fa6", "name": "anti_autocorr_float_corridor_20", "session_branch": "main", "session_id": "20260428_140002_78c607", "status": "candidate", "ts": "2026-04-28T14:55:55.453916+08:00"}
{"base_ref": "origin/main", "decision": "candidate", "eval_seconds": 137.9, "formula": "rank(-ts_corr(ret_1d,shift(ret_1d,1),20))*rank(ts_min(amount/circ_market_cap,20)/ts_mean(amount/circ_market_cap,20))", "gates": "PASS", "head_commit": "045149116d9be75dd5909df255ae8b49b5753fa6", "is_ic": 0.0377, "is_ic_ir": 0.44, "is_monotonicity": 0.4, "is_sharpe": 1.595, "is_turnover": 0.178, "market": "cn", "merge_base": "045149116d9be75dd5909df255ae8b49b5753fa6", "name": "anti_autocorr_float_floor_20", "session_branch": "main", "session_id": "20260428_140002_78c607", "status": "candidate", "ts": "2026-04-28T14:55:55.453916+08:00"}
{"base_ref": "origin/main", "decision": "candidate", "eval_seconds": 125.1, "formula": "rank(-ts_corr(ret_1d,shift(ret_1d,1),20))*rank(ts_mean(amount/circ_market_cap,20)/ts_max(amount/circ_market_cap,20))", "gates": "PASS", "head_commit": "045149116d9be75dd5909df255ae8b49b5753fa6", "is_ic": 0.0336, "is_ic_ir": 0.46, "is_monotonicity": 0.25, "is_sharpe": 2.602, "is_turnover": 0.174, "market": "cn", "merge_base": "045149116d9be75dd5909df255ae8b49b5753fa6", "name": "anti_autocorr_float_peak_balance_20", "session_branch": "main", "session_id": "20260428_140002_78c607", "status": "candidate", "ts": "2026-04-28T14:55:55.453916+08:00"}
{"base_ref": "origin/main", "checks_status": "failed", "decision": "revert", "eval_seconds": 153.0, "formula": "rank(-ts_corr(ret_1d, shift(ret_1d,1),20))*rank(-ts_std(open/close,20))", "gates": "PASS", "head_commit": "045149116d9be75dd5909df255ae8b49b5753fa6", "is_ic": 0.0413, "is_ic_ir": 0.328, "is_monotonicity": 0.0, "is_sharpe": 0.877, "is_turnover": 0.151, "market": "cn", "merge_base": "045149116d9be75dd5909df255ae8b49b5753fa6", "name": "anti_autocorr_openclose_stability_20", "oos": "PASS", "session_branch": "main", "session_id": "20260428_140002_78c607", "status": "checks_failed", "ts": "2026-04-28T14:55:55.453916+08:00"}
{"base_ref": "origin/main", "decision": "candidate", "eval_seconds": 147.5, "formula": "rank(-ts_corr(ret_1d,shift(ret_1d,1),20))*rank(ts_std(volume_ratio,60)/ts_std(volume_ratio,20))", "gates": "PASS", "head_commit": "045149116d9be75dd5909df255ae8b49b5753fa6", "is_ic": 0.0275, "is_ic_ir": 0.208, "is_monotonicity": 0.0, "is_sharpe": 0.554, "is_turnover": 0.173, "market": "cn", "merge_base": "045149116d9be75dd5909df255ae8b49b5753fa6", "name": "anti_autocorr_relvol_compress_20_60", "session_branch": "main", "session_id": "20260428_140002_78c607", "status": "candidate", "ts": "2026-04-28T14:55:55.453916+08:00"}
{"base_ref": "origin/main", "decision": "candidate", "eval_seconds": 113.0, "formula": "rank(-ts_corr(ret_1d, shift(ret_1d, 1), 20))*rank(ts_min(volume_ratio,20)/ts_max(volume_ratio,20))", "gates": "PASS", "head_commit": "045149116d9be75dd5909df255ae8b49b5753fa6", "is_ic": 0.0339, "is_ic_ir": 0.416, "is_monotonicity": 0.0, "is_sharpe": 2.188, "is_turnover": 0.167, "market": "cn", "merge_base": "045149116d9be75dd5909df255ae8b49b5753fa6", "name": "anti_autocorr_relvol_corridor_20", "session_branch": "main", "session_id": "20260428_140002_78c607", "status": "candidate", "ts": "2026-04-28T14:55:55.453916+08:00"}
{"base_ref": "origin/main", "decision": "candidate", "eval_seconds": 172.4, "formula": "rank(-ts_corr(ret_1d, shift(ret_1d,1),20))*rank(ts_mean(volume_ratio,20)/ts_max(volume_ratio,20))", "gates": "PASS", "head_commit": "045149116d9be75dd5909df255ae8b49b5753fa6", "is_ic": 0.0331, "is_ic_ir": 0.425, "is_monotonicity": 0.05, "is_sharpe": 1.823, "is_turnover": 0.17, "market": "cn", "merge_base": "045149116d9be75dd5909df255ae8b49b5753fa6", "name": "anti_autocorr_relvol_peak_balance_20", "session_branch": "main", "session_id": "20260428_140002_78c607", "status": "candidate", "ts": "2026-04-28T14:55:55.453916+08:00"}
{"base_ref": "origin/main", "decision": "candidate", "eval_seconds": 130.1, "formula": "rank(-ts_corr(ret_1d, shift(ret_1d,1),20))*rank(-ts_std(delta(volume_ratio,5),20))", "gates": "PASS", "head_commit": "045149116d9be75dd5909df255ae8b49b5753fa6", "is_ic": 0.038, "is_ic_ir": 0.428, "is_monotonicity": 0.1, "is_sharpe": 3.631, "is_turnover": 0.154, "market": "cn", "merge_base": "045149116d9be75dd5909df255ae8b49b5753fa6", "name": "anti_autocorr_relvol_weekly_smooth_20", "session_branch": "main", "session_id": "20260428_140002_78c607", "status": "candidate", "ts": "2026-04-28T14:55:55.453916+08:00"}
{"base_ref": "origin/main", "decision": "candidate", "eval_seconds": 191.7, "formula": "rank(-ts_corr(ret_1d,shift(ret_1d,1),20))*rank(ts_min(turnover_rate,20)/ts_max(turnover_rate,20))", "gates": "PASS", "head_commit": "045149116d9be75dd5909df255ae8b49b5753fa6", "is_ic": 0.0383, "is_ic_ir": 0.49, "is_monotonicity": 0.4, "is_sharpe": 4.135, "is_turnover": 0.169, "market": "cn", "merge_base": "045149116d9be75dd5909df255ae8b49b5753fa6", "name": "anti_autocorr_turnover_corridor_20", "session_branch": "main", "session_id": "20260428_140002_78c607", "status": "candidate", "ts": "2026-04-28T14:55:55.453916+08:00"}
{"base_ref": "origin/main", "decision": "candidate", "eval_seconds": 117.1, "formula": "rank(-ts_corr(ret_1d,shift(ret_1d,1),20))*rank(ts_min(turnover_rate,20)/ts_mean(turnover_rate,20))", "gates": "PASS", "head_commit": "045149116d9be75dd5909df255ae8b49b5753fa6", "is_ic": 0.0379, "is_ic_ir": 0.443, "is_monotonicity": 0.45, "is_sharpe": 1.599, "is_turnover": 0.177, "market": "cn", "merge_base": "045149116d9be75dd5909df255ae8b49b5753fa6", "name": "anti_autocorr_turnover_floor_20", "session_branch": "main", "session_id": "20260428_140002_78c607", "status": "candidate", "ts": "2026-04-28T14:55:55.453916+08:00"}
{"base_ref": "origin/main", "decision": "candidate", "eval_seconds": 102.7, "formula": "rank(-ts_corr(ret_1d,shift(ret_1d,1),40))*rank(ts_mean(turnover_rate,20)/ts_max(turnover_rate,20))", "gates": "PASS", "head_commit": "045149116d9be75dd5909df255ae8b49b5753fa6", "is_ic": 0.0244, "is_ic_ir": 0.265, "is_monotonicity": 0.25, "is_sharpe": -0.08, "is_turnover": 0.14, "market": "cn", "merge_base": "045149116d9be75dd5909df255ae8b49b5753fa6", "name": "anti_autocorr_turnover_peak_balance_20", "session_branch": "main", "session_id": "20260428_140002_78c607", "status": "candidate", "ts": "2026-04-28T14:55:55.453916+08:00"}
{"base_ref": "origin/main", "checks_status": "failed", "decision": "revert", "eval_seconds": 116.8, "formula": "rank(-ts_corr(ret_1d,shift(ret_1d,1),20))*rank(-ts_std(turnover_rate,20)/ts_mean(turnover_rate,20))", "gates": "PASS", "head_commit": "045149116d9be75dd5909df255ae8b49b5753fa6", "is_ic": 0.0403, "is_ic_ir": 0.497, "is_monotonicity": 0.35, "is_sharpe": 3.701, "is_turnover": 0.166, "market": "cn", "merge_base": "045149116d9be75dd5909df255ae8b49b5753fa6", "name": "anti_autocorr_turnover_stability_20", "oos": "PASS", "session_branch": "main", "session_id": "20260428_140002_78c607", "status": "checks_failed", "ts": "2026-04-28T14:55:55.453916+08:00"}
{"base_ref": "origin/main", "decision": "candidate", "eval_seconds": 179.6, "formula": "rank(-ts_corr(ret_1d, shift(ret_1d, 1), 20))*rank(-ts_mean(volume_ratio, 5))", "gates": "PASS", "head_commit": "045149116d9be75dd5909df255ae8b49b5753fa6", "is_ic": 0.0336, "is_ic_ir": 0.321, "is_monotonicity": 0.05, "is_sharpe": 1.308, "is_turnover": 0.208, "market": "cn", "merge_base": "045149116d9be75dd5909df255ae8b49b5753fa6", "name": "anti_autocorr_uncrowded_20", "session_branch": "main", "session_id": "20260428_140002_78c607", "status": "candidate", "ts": "2026-04-28T14:55:55.453916+08:00"}
{"base_ref": "origin/main", "decision": "candidate", "eval_seconds": 121.5, "formula": "rank(-ts_corr(ret_1d,shift(ret_1d,1),20))*rank(ts_min(ts_sum(amount,5),20)/ts_max(ts_sum(amount,5),20))", "gates": "PASS", "head_commit": "045149116d9be75dd5909df255ae8b49b5753fa6", "is_ic": 0.0367, "is_ic_ir": 0.439, "is_monotonicity": 0.3, "is_sharpe": 4.248, "is_turnover": 0.159, "market": "cn", "merge_base": "045149116d9be75dd5909df255ae8b49b5753fa6", "name": "anti_autocorr_weekly_amount_corridor_20", "session_branch": "main", "session_id": "20260428_140002_78c607", "status": "candidate", "ts": "2026-04-28T14:55:55.453916+08:00"}
{"base_ref": "origin/main", "checks_status": "failed", "decision": "revert", "eval_seconds": 164.7, "formula": "rank(-ts_corr(ret_1d,shift(ret_1d,1),20))*rank(-ts_std(pct_change(amount,5),20))", "gates": "PASS", "head_commit": "045149116d9be75dd5909df255ae8b49b5753fa6", "is_ic": 0.0415, "is_ic_ir": 0.449, "is_monotonicity": 0.15, "is_sharpe": 2.573, "is_turnover": 0.153, "market": "cn", "merge_base": "045149116d9be75dd5909df255ae8b49b5753fa6", "name": "anti_autocorr_weekly_amount_stability_20", "oos": "PASS", "session_branch": "main", "session_id": "20260428_140002_78c607", "status": "checks_failed", "ts": "2026-04-28T14:55:55.453916+08:00"}
{"base_ref": "origin/main", "decision": "candidate", "eval_seconds": 126.6, "formula": "rank(-ts_corr(ret_1d,shift(ret_1d,1),20))*rank(-ts_std(ts_sum(amount/circ_market_cap,5),20)/ts_mean(ts_sum(amount/circ_market_cap,5),20))", "gates": "PASS", "head_commit": "045149116d9be75dd5909df255ae8b49b5753fa6", "is_ic": 0.0361, "is_ic_ir": 0.448, "is_monotonicity": 0.45, "is_sharpe": 3.214, "is_turnover": 0.151, "market": "cn", "merge_base": "045149116d9be75dd5909df255ae8b49b5753fa6", "name": "anti_autocorr_weekly_float_stability_20", "session_branch": "main", "session_id": "20260428_140002_78c607", "status": "candidate", "ts": "2026-04-28T14:55:55.453916+08:00"}
{"base_ref": "origin/main", "decision": "revert", "eval_seconds": 121.0, "formula": "rank(-ts_corr(ret_1d,5hift(ret_1d,5),20))*rank(-(ts_max(turnover_rate,20)/ts_mean(turnover_rate,20)))", "gates": "FAIL", "head_commit": "045149116d9be75dd5909df255ae8b49b5753fa6", "is_ic": 0.0, "is_ic_ir": 0.0, "is_monotonicity": 0.0, "is_sharpe": 0.0, "is_turnover": 0.0, "market": "cn", "merge_base": "045149116d9be75dd5909df255ae8b49b5753fa6", "name": "anti_autocorr_weekly_nospike_20", "session_branch": "main", "session_id": "20260428_140002_78c607", "status": "compute_error", "ts": "2026-04-28T14:55:55.453916+08:00"}
{"base_ref": "origin/main", "decision": "candidate", "eval_seconds": 148.9, "formula": "rank(-ts_corr(ret_1d,shift(ret_1d,1),20))*rank(ts_min(ts_sum(turnover_rate,5),20)/ts_max(ts_sum(turnover_rate,5),20))", "gates": "PASS", "head_commit": "045149116d9be75dd5909df255ae8b49b5753fa6", "is_ic": 0.0379, "is_ic_ir": 0.454, "is_monotonicity": 0.5, "is_sharpe": 3.641, "is_turnover": 0.162, "market": "cn", "merge_base": "045149116d9be75dd5909df255ae8b49b5753fa6", "name": "anti_autocorr_weekly_turnover_corridor_20", "session_branch": "main", "session_id": "20260428_140002_78c607", "status": "candidate", "ts": "2026-04-28T14:55:55.453916+08:00"}
{"base_ref": "origin/main", "decision": "candidate", "eval_seconds": 193.5, "formula": "rank(ts_mean(amount/circ_market_cap,20)/ts_std(amount/circ_market_cap,20)-ts_corr(amount/circ_market_cap,shift(amount/circ_market_cap,1),20))", "gates": "PASS", "head_commit": "045149116d9be75dd5909df255ae8b49b5753fa6", "is_ic": 0.0353, "is_ic_ir": 0.362, "is_monotonicity": 0.6, "is_sharpe": 1.523, "is_turnover": 0.124, "market": "cn", "merge_base": "045149116d9be75dd5909df255ae8b49b5753fa6", "name": "float_stability_autorevert_20", "session_branch": "main", "session_id": "20260428_140002_78c607", "status": "candidate", "ts": "2026-04-28T14:55:55.453916+08:00"}
{"base_ref": "origin/main", "decision": "candidate", "eval_seconds": 155.3, "formula": "rank(-ts_std(amount / circ_market_cap, 20) / ts_std(amount / circ_market_cap, 60))", "gates": "PASS", "head_commit": "045149116d9be75dd5909df255ae8b49b5753fa6", "is_ic": 0.0325, "is_ic_ir": 0.304, "is_monotonicity": 0.65, "is_sharpe": 2.538, "is_turnover": 0.111, "market": "cn", "merge_base": "045149116d9be75dd5909df255ae8b49b5753fa6", "name": "floatflow_compress_20_60", "session_branch": "main", "session_id": "20260428_140002_78c607", "status": "candidate", "ts": "2026-04-28T14:55:55.453916+08:00"}
{"base_ref": "origin/main", "decision": "revert", "eval_seconds": 80.4, "formula": "rank(ret_20d-ret_5d)*rank(ts_mean(amount,20)/ts_std(amount,20))", "gates": "FAIL", "head_commit": "045149116d9be75dd5909df255ae8b49b5753fa6", "is_ic": 0.0263, "is_ic_ir": 0.17, "is_monotonicity": 0.8, "is_sharpe": -0.097, "is_turnover": 0.178, "market": "cn", "merge_base": "045149116d9be75dd5909df255ae8b49b5753fa6", "name": "orderly_trend_amtstab_20", "session_branch": "main", "session_id": "20260428_140002_78c607", "status": "reverted", "ts": "2026-04-28T14:55:55.453916+08:00"}
{"base_ref": "origin/main", "decision": "revert", "eval_seconds": 129.4, "formula": "rank(-ts_corr(turnover_rate,shift(turnover_rate,5),20))*rank(ts_min(amount,20)/ts_mean(amount,20))", "gates": "FAIL", "head_commit": "045149116d9be75dd5909df255ae8b49b5753fa6", "is_ic": 0.0121, "is_ic_ir": 0.097, "is_monotonicity": 0.1, "is_sharpe": -2.558, "is_turnover": 0.165, "market": "cn", "merge_base": "045149116d9be75dd5909df255ae8b49b5753fa6", "name": "weekly_turnover_autorevert_amtfloor_20", "session_branch": "main", "session_id": "20260428_140002_78c607", "status": "reverted", "ts": "2026-04-28T14:55:55.453916+08:00"}
{"base_ref": "origin/main", "decision": "revert", "eval_seconds": 74.2, "formula": "rank(-ts_kurt(amount, 20))", "gates": "FAIL", "head_commit": "be22710e9483cb7074b0286e64c8e8b58951ab75", "is_ic": 0.0088, "is_ic_ir": 0.1, "is_monotonicity": 0.7, "is_sharpe": -2.237, "is_turnover": 0.184, "market": "cn", "merge_base": "be22710e9483cb7074b0286e64c8e8b58951ab75", "name": "amount_tail_evenness_20", "session_branch": "main", "session_id": "20260429_060001_1474fc", "status": "reverted", "ts": "2026-04-29T06:56:06.160302+08:00"}
{"base_ref": "origin/main", "decision": "revert", "eval_seconds": 225.4, "formula": "rank(-ts_corr(ret_1d,shift(ret_1d,1),20))*rank(ts_std(pct_change(amount,5),60)/ts_std(pct_change(amount,5),20))", "gates": "FAIL", "head_commit": "be22710e9483cb7074b0286e64c8e8b58951ab75", "is_ic": 0.0251, "is_ic_ir": 0.169, "is_monotonicity": 0.05, "is_sharpe": 0.096, "is_turnover": 0.164, "market": "cn", "merge_base": "be22710e9483cb7074b0286e64c8e8b58951ab75", "name": "anti_autocorr_amtgrowth_compress_20_60", "session_branch": "main", "session_id": "20260429_060001_1474fc", "status": "reverted", "ts": "2026-04-29T06:56:06.160302+08:00"}
{"base_ref": "origin/main", "decision": "candidate", "eval_seconds": 138.0, "formula": "rank(-ts_corr(ret_1d,shift(ret_1d,1),40))*rank(ts_mean(amount/circ_market_cap,20)/ts_max(amount/circ_market_cap,20))", "gates": "PASS", "head_commit": "be22710e9483cb7074b0286e64c8e8b58951ab75", "is_ic": 0.0244, "is_ic_ir": 0.266, "is_monotonicity": 0.5, "is_sharpe": 0.233, "is_turnover": 0.138, "market": "cn", "merge_base": "be22710e9483cb7074b0286e64c8e8b58951ab75", "name": "anti_autocorr_float_evenness_20", "session_branch": "main", "session_id": "20260429_060001_1474fc", "status": "candidate", "ts": "2026-04-29T06:56:06.160302+08:00"}
{"base_ref": "origin/main", "decision": "revert", "eval_seconds": 96.7, "formula": "rank(-ts_corr(turnover_rate,shift(turnover_rate,5),20))*rank(ts_min(amount,20)/ts_max(amount,20))", "gates": "FAIL", "head_commit": "be22710e9483cb7074b0286e64c8e8b58951ab75", "is_ic": 0.0152, "is_ic_ir": 0.145, "is_monotonicity": 0.15, "is_sharpe": -0.693, "is_turnover": 0.16, "market": "cn", "merge_base": "be22710e9483cb7074b0286e64c8e8b58951ab75", "name": "anti_autocorr_turnover_amount_evenness_20", "session_branch": "main", "session_id": "20260429_060001_1474fc", "status": "reverted", "ts": "2026-04-29T06:56:06.160302+08:00"}
{"base_ref": "origin/main", "decision": "revert", "eval_seconds": 139.3, "formula": "rank(-ts_corr(ts_sum(amount,5),shift(ts_sum(amount,5),5),20))*rank(ts_min(ts_sum(amount,5),20)/ts_max(ts_sum(amount,5),20))", "gates": "FAIL", "head_commit": "be22710e9483cb7074b0286e64c8e8b58951ab75", "is_ic": 0.0009, "is_ic_ir": -0.022, "is_monotonicity": -0.1, "is_sharpe": -2.643, "is_turnover": 0.124, "market": "cn", "merge_base": "be22710e9483cb7074b0286e64c8e8b58951ab75", "name": "anti_autocorr_weekly_amount_corridor_20", "session_branch": "main", "session_id": "20260429_060001_1474fc", "status": "reverted", "ts": "2026-04-29T06:56:06.160302+08:00"}
{"base_ref": "origin/main", "decision": "candidate", "eval_seconds": 176.6, "formula": "rank(-ts_corr(ret_1d,shift(ret_1d,1),20))*rank(ts_mean(ts_sum(amount,5),20)/ts_max(ts_sum(amount,5),20))", "gates": "PASS", "head_commit": "be22710e9483cb7074b0286e64c8e8b58951ab75", "is_ic": 0.0367, "is_ic_ir": 0.473, "is_monotonicity": 0.35, "is_sharpe": 3.934, "is_turnover": 0.167, "market": "cn", "merge_base": "be22710e9483cb7074b0286e64c8e8b58951ab75", "name": "anti_autocorr_weekly_amount_evenness_20", "session_branch": "main", "session_id": "20260429_060001_1474fc", "status": "candidate", "ts": "2026-04-29T06:56:06.160302+08:00"}
