{"base_ref": "origin/main", "decision": "revert", "eval_seconds": 175.5, "formula": "rank(ts_corr(ret_1d,shift(ret_1d,1),20)*ts_std(turnover_rate,60)/ts_std(turnover_rate,20))", "gates": "FAIL", "head_commit": "9dc8642c007751102b6291de6c7b382457b6b750", "is_ic": -0.028, "is_ic_ir": -0.163, "is_monotonicity": 0.0, "is_sharpe": -3.521, "is_turnover": 0.181, "market": "cn", "merge_base": "9dc8642c007751102b6291de6c7b382457b6b750", "name": "autocorr_turnover_compress_20_60", "session_branch": "main", "session_id": "20260427_140002_cda48d", "status": "reverted", "ts": "2026-04-27T14:55:49.794775+08:00"}
{"base_ref": "origin/main", "decision": "candidate", "eval_seconds": 111.6, "formula": "rank(ts_std(amount / circ_market_cap, 60) / ts_std(amount / circ_market_cap, 20)) * rank(-ts_max(turnover_rate,20) / ts_sum(turnover_rate,20))", "gates": "PASS", "head_commit": "9dc8642c007751102b6291de6c7b382457b6b750", "is_ic": 0.0221, "is_ic_ir": 0.223, "is_monotonicity": 0.75, "is_sharpe": -0.77, "is_turnover": 0.13, "market": "cn", "merge_base": "9dc8642c007751102b6291de6c7b382457b6b750", "name": "float_compress_even_turnover_20_60", "session_branch": "main", "session_id": "20260427_140002_cda48d", "status": "candidate", "ts": "2026-04-27T14:55:49.794775+08:00"}
{"base_ref": "origin/main", "decision": "candidate", "eval_seconds": 129.8, "formula": "rank(ts_mean(amount/circ_market_cap,20)/ts_max(amount/circ_market_cap,20))", "gates": "PASS", "head_commit": "9dc8642c007751102b6291de6c7b382457b6b750", "is_ic": 0.0285, "is_ic_ir": 0.322, "is_monotonicity": 0.85, "is_sharpe": 0.375, "is_turnover": 0.133, "market": "cn", "merge_base": "9dc8642c007751102b6291de6c7b382457b6b750", "name": "float_even_flow_20", "session_branch": "main", "session_id": "20260427_140002_cda48d", "status": "candidate", "ts": "2026-04-27T14:55:49.794775+08:00"}
{"base_ref": "origin/main", "decision": "candidate", "eval_seconds": 112.0, "formula": "rank(ts_std(amount/circ_market_cap,60)/ts_std(amount/circ_market_cap,20))", "gates": "PASS", "head_commit": "9dc8642c007751102b6291de6c7b382457b6b750", "is_ic": 0.0325, "is_ic_ir": 0.304, "is_monotonicity": 0.65, "is_sharpe": 2.538, "is_turnover": 0.111, "market": "cn", "merge_base": "9dc8642c007751102b6291de6c7b382457b6b750", "name": "float_flow_compress_20_60", "session_branch": "main", "session_id": "20260427_140002_cda48d", "status": "candidate", "ts": "2026-04-27T14:55:49.794775+08:00"}
{"base_ref": "origin/main", "decision": "candidate", "eval_seconds": 141.7, "formula": "rank(ts_min(amount / circ_market_cap,20) / ts_max(amount / circ_market_cap,20))", "gates": "PASS", "head_commit": "9dc8642c007751102b6291de6c7b382457b6b750", "is_ic": 0.0321, "is_ic_ir": 0.333, "is_monotonicity": 0.75, "is_sharpe": 0.676, "is_turnover": 0.116, "market": "cn", "merge_base": "9dc8642c007751102b6291de6c7b382457b6b750", "name": "float_flow_corridor_20", "session_branch": "main", "session_id": "20260427_140002_cda48d", "status": "candidate", "ts": "2026-04-27T14:55:49.794775+08:00"}
{"base_ref": "origin/main", "checks_status": "failed", "decision": "revert", "eval_seconds": 142.3, "formula": "rank(-ts_mean(abs(pct_change(amount/circ_market_cap,5)),20))", "gates": "PASS", "head_commit": "9dc8642c007751102b6291de6c7b382457b6b750", "is_ic": 0.0385, "is_ic_ir": 0.357, "is_monotonicity": 0.1, "is_sharpe": 1.274, "is_turnover": 0.111, "market": "cn", "merge_base": "9dc8642c007751102b6291de6c7b382457b6b750", "name": "float_flow_smooth_20", "oos": "PASS", "session_branch": "main", "session_id": "20260427_140002_cda48d", "status": "checks_failed", "ts": "2026-04-27T14:55:49.794775+08:00"}
{"base_ref": "origin/main", "decision": "revert", "eval_seconds": 93.7, "formula": "rank(-ts_kurt(amount/circ_market_cap,40))", "gates": "FAIL", "head_commit": "9dc8642c007751102b6291de6c7b382457b6b750", "is_ic": -0.0086, "is_ic_ir": -0.086, "is_monotonicity": 0.25, "is_sharpe": -2.599, "is_turnover": 0.108, "market": "cn", "merge_base": "9dc8642c007751102b6291de6c7b382457b6b750", "name": "float_flow_tail_stability_40", "session_branch": "main", "session_id": "20260427_140002_cda48d", "status": "reverted", "ts": "2026-04-27T14:55:49.794775+08:00"}
{"base_ref": "origin/main", "checks_status": "skipped", "decision": "revert", "eval_seconds": 147.9, "formula": "rank(ts_std(amount,60)/ts_std(amount,20)/log(circ_market_cap))", "gates": "PASS", "head_commit": "9dc8642c007751102b6291de6c7b382457b6b750", "is_ic": 0.0398, "is_ic_ir": 0.334, "is_monotonicity": 0.8, "is_sharpe": 3.709, "is_turnover": 0.102, "market": "cn", "merge_base": "9dc8642c007751102b6291de6c7b382457b6b750", "name": "float_quiet_compress_20_60", "oos": "FAIL", "session_branch": "main", "session_id": "20260427_140002_cda48d", "status": "reverted", "ts": "2026-04-27T14:55:49.794775+08:00"}
{"base_ref": "origin/main", "decision": "revert", "eval_seconds": 65.2, "formula": "rank(-pb)*rank(-ts_std(turnover_rate,20))", "gates": "FAIL", "head_commit": "9dc8642c007751102b6291de6c7b382457b6b750", "is_ic": 0.0353, "is_ic_ir": 0.165, "is_monotonicity": -0.2, "is_sharpe": -0.069, "is_turnover": 0.033, "market": "cn", "merge_base": "9dc8642c007751102b6291de6c7b382457b6b750", "name": "pb_turnover_stability_20", "session_branch": "main", "session_id": "20260427_140002_cda48d", "status": "reverted", "ts": "2026-04-27T14:55:49.794775+08:00"}
{"base_ref": "origin/main", "decision": "revert", "eval_seconds": 84.5, "formula": "rank(-ts_corr(amount/circ_market_cap,abs(ret_1d),20))", "gates": "FAIL", "head_commit": "9dc8642c007751102b6291de6c7b382457b6b750", "is_ic": 0.008, "is_ic_ir": 0.112, "is_monotonicity": 0.5, "is_sharpe": -0.925, "is_turnover": 0.172, "market": "cn", "merge_base": "9dc8642c007751102b6291de6c7b382457b6b750", "name": "quiet_absorption_corr_20", "session_branch": "main", "session_id": "20260427_140002_cda48d", "status": "reverted", "ts": "2026-04-27T14:55:49.794775+08:00"}
{"base_ref": "origin/main", "decision": "revert", "eval_seconds": 83.6, "formula": "ts_mean(amount/circ_market_cap,20)-ts_std(amount/circ_market_cap,20)-ts_corr(ret_5d,volume_ratio,20)", "gates": "FAIL", "head_commit": "9dc8642c007751102b6291de6c7b382457b6b750", "is_ic": 0.0269, "is_ic_ir": 0.196, "is_monotonicity": 0.2, "is_sharpe": -0.31, "is_turnover": 0.126, "market": "cn", "merge_base": "9dc8642c007751102b6291de6c7b382457b6b750", "name": "quiet_float_accum_20", "session_branch": "main", "session_id": "20260427_140002_cda48d", "status": "reverted", "ts": "2026-04-27T14:55:49.794775+08:00"}
{"base_ref": "origin/main", "decision": "candidate", "eval_seconds": 163.4, "formula": "rank(-ts_corr(ret_5d, amount/circ_market_cap,20))", "gates": "PASS", "head_commit": "9dc8642c007751102b6291de6c7b382457b6b750", "is_ic": 0.035, "is_ic_ir": 0.22, "is_monotonicity": 0.0, "is_sharpe": -0.263, "is_turnover": 0.127, "market": "cn", "merge_base": "9dc8642c007751102b6291de6c7b382457b6b750", "name": "ret5_float_flow_underreaction_20", "session_branch": "main", "session_id": "20260427_140002_cda48d", "status": "candidate", "ts": "2026-04-27T14:55:49.794775+08:00"}
{"base_ref": "origin/main", "decision": "revert", "eval_seconds": 20.2, "formula": "rank(-ret_20d)*rank(-ts_std(turnover_rate,20))", "gates": "FAIL", "head_commit": "9dc8642c007751102b6291de6c7b382457b6b750", "is_ic": 0.0311, "is_ic_ir": 0.193, "is_monotonicity": 0.0, "is_sharpe": -1.046, "is_turnover": 0.13, "market": "cn", "merge_base": "9dc8642c007751102b6291de6c7b382457b6b750", "name": "stable_turnover_reversal_20", "session_branch": "main", "session_id": "20260427_140002_cda48d", "status": "reverted", "ts": "2026-04-27T14:55:49.794775+08:00"}
{"base_ref": "origin/main", "decision": "revert", "eval_seconds": 146.0, "formula": "rank(-ts_corr(delta(turnover_rate,5), shift(delta(turnover_rate,5),5),20))", "gates": "FAIL", "head_commit": "9dc8642c007751102b6291de6c7b382457b6b750", "is_ic": -0.0048, "is_ic_ir": -0.051, "is_monotonicity": -0.45, "is_sharpe": -4.784, "is_turnover": 0.195, "market": "cn", "merge_base": "9dc8642c007751102b6291de6c7b382457b6b750", "name": "turnover_growth_anti_autocorr_20", "session_branch": "main", "session_id": "20260427_140002_cda48d", "status": "reverted", "ts": "2026-04-27T14:55:49.794775+08:00"}
{"base_ref": "origin/main", "decision": "candidate", "eval_seconds": 20.9, "formula": "rank(ts_mean(turnover_rate,20)/ts_std(turnover_rate,20))", "gates": "PASS", "head_commit": "9dc8642c007751102b6291de6c7b382457b6b750", "is_ic": 0.0374, "is_ic_ir": 0.373, "is_monotonicity": 0.7, "is_sharpe": 1.522, "is_turnover": 0.121, "market": "cn", "merge_base": "9dc8642c007751102b6291de6c7b382457b6b750", "name": "turnover_quality_20", "session_branch": "main", "session_id": "20260427_140002_cda48d", "status": "candidate", "ts": "2026-04-27T14:55:49.794775+08:00"}
{"base_ref": "origin/main", "decision": "candidate", "eval_seconds": 45.8, "formula": "rank(-ts_std(turnover_rate,20)/ts_mean(turnover_rate,20))", "gates": "PASS", "head_commit": "9dc8642c007751102b6291de6c7b382457b6b750", "is_ic": 0.0374, "is_ic_ir": 0.373, "is_monotonicity": 0.7, "is_sharpe": 1.522, "is_turnover": 0.121, "market": "cn", "merge_base": "9dc8642c007751102b6291de6c7b382457b6b750", "name": "turnover_stability_cv_20", "session_branch": "main", "session_id": "20260427_140002_cda48d", "status": "candidate", "ts": "2026-04-27T14:55:49.794775+08:00"}
{"base_ref": "origin/main", "decision": "candidate", "eval_seconds": 147.9, "formula": "rank(-ts_corr(ret_1d,shift(ret_1d,1),20))*rank(ts_std(amount,60)/ts_std(decay_linear(amount,5),20))", "gates": "PASS", "head_commit": "425c0a450ff7a22c8988215ab8e26acdf2764522", "is_ic": 0.0334, "is_ic_ir": 0.23, "is_monotonicity": 0.25, "is_sharpe": 0.999, "is_turnover": 0.158, "market": "cn", "merge_base": "425c0a450ff7a22c8988215ab8e26acdf2764522", "name": "anti_autocorr_amt_quiet_compress_20_60", "session_branch": "main", "session_id": "20260428_060002_dc8b1a", "status": "candidate", "ts": "2026-04-28T06:57:23.183701+08:00"}
{"base_ref": "origin/main", "decision": "revert", "eval_seconds": 170.8, "formula": "rank(-ts_corr(pct_change(amount,5), shift(pct_change(amount,5),5), 20))", "gates": "FAIL", "head_commit": "425c0a450ff7a22c8988215ab8e26acdf2764522", "is_ic": -0.0004, "is_ic_ir": 0.004, "is_monotonicity": 0.15, "is_sharpe": -4.199, "is_turnover": 0.178, "market": "cn", "merge_base": "425c0a450ff7a22c8988215ab8e26acdf2764522", "name": "anti_autocorr_amtflow_weekly_20", "session_branch": "main", "session_id": "20260428_060002_dc8b1a", "status": "reverted", "ts": "2026-04-28T06:57:23.183701+08:00"}
{"base_ref": "origin/main", "decision": "candidate", "eval_seconds": 150.5, "formula": "rank(-ts_corr(ret_1d,shift(ret_1d,1),20))*rank(ts_mean(amount/circ_market_cap,20)/ts_max(amount/circ_market_cap,20))", "gates": "PASS", "head_commit": "425c0a450ff7a22c8988215ab8e26acdf2764522", "is_ic": 0.0336, "is_ic_ir": 0.46, "is_monotonicity": 0.25, "is_sharpe": 2.602, "is_turnover": 0.174, "market": "cn", "merge_base": "425c0a450ff7a22c8988215ab8e26acdf2764522", "name": "anti_autocorr_float_evenness_20", "session_branch": "main", "session_id": "20260428_060002_dc8b1a", "status": "candidate", "ts": "2026-04-28T06:57:23.183701+08:00"}
{"base_ref": "origin/main", "decision": "candidate", "eval_seconds": 166.0, "formula": "rank(-ts_corr(turnover_rate,shift(turnover_rate,1),20))*rank(ts_min(amount/circ_market_cap,20)/ts_mean(amount/circ_market_cap,20))", "gates": "PASS", "head_commit": "425c0a450ff7a22c8988215ab8e26acdf2764522", "is_ic": 0.0231, "is_ic_ir": 0.201, "is_monotonicity": 0.6, "is_sharpe": -0.765, "is_turnover": 0.152, "market": "cn", "merge_base": "425c0a450ff7a22c8988215ab8e26acdf2764522", "name": "anti_autocorr_float_floor_20", "session_branch": "main", "session_id": "20260428_060002_dc8b1a", "status": "candidate", "ts": "2026-04-28T06:57:23.183701+08:00"}
{"base_ref": "origin/main", "checks_status": "failed", "decision": "revert", "eval_seconds": 109.3, "formula": "rank(-ts_corr(ret_1d,shift(ret_1d,1),20))*rank(ts_mean(amount/circ_market_cap,20)/ts_std(amount/circ_market_cap,20))", "gates": "PASS", "head_commit": "425c0a450ff7a22c8988215ab8e26acdf2764522", "is_ic": 0.0399, "is_ic_ir": 0.495, "is_monotonicity": 0.35, "is_sharpe": 3.724, "is_turnover": 0.166, "market": "cn", "merge_base": "425c0a450ff7a22c8988215ab8e26acdf2764522", "name": "anti_autocorr_float_stability_20", "oos": "PASS", "session_branch": "main", "session_id": "20260428_060002_dc8b1a", "status": "checks_failed", "ts": "2026-04-28T06:57:23.183701+08:00"}
{"base_ref": "origin/main", "checks_status": "failed", "decision": "revert", "eval_seconds": 142.0, "formula": "rank(-ts_corr(ret_1d,shift(ret_1d,1),20))*rank(-ts_mean(abs(pct_change(amount/circ_market_cap,5)),20))", "gates": "PASS", "head_commit": "425c0a450ff7a22c8988215ab8e26acdf2764522", "is_ic": 0.0419, "is_ic_ir": 0.448, "is_monotonicity": 0.15, "is_sharpe": 3.319, "is_turnover": 0.157, "market": "cn", "merge_base": "425c0a450ff7a22c8988215ab8e26acdf2764522", "name": "anti_autocorr_floatflow_weekly_smooth_20", "oos": "PASS", "session_branch": "main", "session_id": "20260428_060002_dc8b1a", "status": "checks_failed", "ts": "2026-04-28T06:57:23.183701+08:00"}
{"base_ref": "origin/main", "decision": "candidate", "eval_seconds": 148.0, "formula": "rank(-ts_corr(ret_1d, shift(ret_1d, 1), 20)) * rank(ts_min(volume_ratio, 20) / ts_max(volume_ratio, 20))", "gates": "PASS", "head_commit": "425c0a450ff7a22c8988215ab8e26acdf2764522", "is_ic": 0.0339, "is_ic_ir": 0.416, "is_monotonicity": 0.0, "is_sharpe": 2.188, "is_turnover": 0.167, "market": "cn", "merge_base": "425c0a450ff7a22c8988215ab8e26acdf2764522", "name": "anti_autocorr_relvol_corridor_20", "session_branch": "main", "session_id": "20260428_060002_dc8b1a", "status": "candidate", "ts": "2026-04-28T06:57:23.183701+08:00"}
{"base_ref": "origin/main", "decision": "candidate", "eval_seconds": 115.3, "formula": "rank(-ts_corr(ret_1d,shift(ret_1d,1),20))*rank(ts_mean(volume_ratio,20)/ts_max(volume_ratio,20))", "gates": "PASS", "head_commit": "425c0a450ff7a22c8988215ab8e26acdf2764522", "is_ic": 0.0331, "is_ic_ir": 0.425, "is_monotonicity": 0.05, "is_sharpe": 1.823, "is_turnover": 0.17, "market": "cn", "merge_base": "425c0a450ff7a22c8988215ab8e26acdf2764522", "name": "anti_autocorr_relvol_evenness_20", "session_branch": "main", "session_id": "20260428_060002_dc8b1a", "status": "candidate", "ts": "2026-04-28T06:57:23.183701+08:00"}
{"base_ref": "origin/main", "decision": "candidate", "eval_seconds": 148.9, "formula": "rank(-ts_corr(ret_1d,shift(ret_1d,1),20))*rank(ts_min(volume_ratio,20)/ts_mean(volume_ratio,20))", "gates": "PASS", "head_commit": "425c0a450ff7a22c8988215ab8e26acdf2764522", "is_ic": 0.0303, "is_ic_ir": 0.341, "is_monotonicity": 0.25, "is_sharpe": 0.947, "is_turnover": 0.18, "market": "cn", "merge_base": "425c0a450ff7a22c8988215ab8e26acdf2764522", "name": "anti_autocorr_relvol_floor_20", "session_branch": "main", "session_id": "20260428_060002_dc8b1a", "status": "candidate", "ts": "2026-04-28T06:57:23.183701+08:00"}
{"base_ref": "origin/main", "checks_status": "failed", "decision": "revert", "eval_seconds": 148.2, "formula": "rank(-ts_corr(ret_1d,shift(ret_1d,1),20))*rank(-ts_mean(abs(delta(volume_ratio,5)),20))", "gates": "PASS", "head_commit": "425c0a450ff7a22c8988215ab8e26acdf2764522", "is_ic": 0.0408, "is_ic_ir": 0.446, "is_monotonicity": 0.15, "is_sharpe": 3.163, "is_turnover": 0.155, "market": "cn", "merge_base": "425c0a450ff7a22c8988215ab8e26acdf2764522", "name": "anti_autocorr_relvol_weekly_smooth_20", "oos": "PASS", "session_branch": "main", "session_id": "20260428_060002_dc8b1a", "status": "checks_failed", "ts": "2026-04-28T06:57:23.183701+08:00"}
{"base_ref": "origin/main", "decision": "candidate", "eval_seconds": 146.3, "formula": "rank(-ts_corr(ret_1d, shift(ret_1d, 1), 20)) * rank(-ts_std(turnover_rate, 20) / ts_std(turnover_rate, 60))", "gates": "PASS", "head_commit": "425c0a450ff7a22c8988215ab8e26acdf2764522", "is_ic": 0.0361, "is_ic_ir": 0.27, "is_monotonicity": 0.3, "is_sharpe": 1.591, "is_turnover": 0.165, "market": "cn", "merge_base": "425c0a450ff7a22c8988215ab8e26acdf2764522", "name": "anti_autocorr_turnover_compress_20_60", "session_branch": "main", "session_id": "20260428_060002_dc8b1a", "status": "candidate", "ts": "2026-04-28T06:57:23.183701+08:00"}
{"base_ref": "origin/main", "decision": "candidate", "eval_seconds": 83.9, "formula": "rank(-(ts_max(turnover_rate,20)/ts_sum(turnover_rate,20)))*rank(-ts_corr(ret_1d,shift(ret_1d,1),40))", "gates": "PASS", "head_commit": "425c0a450ff7a22c8988215ab8e26acdf2764522", "is_ic": 0.0244, "is_ic_ir": 0.265, "is_monotonicity": 0.25, "is_sharpe": -0.08, "is_turnover": 0.14, "market": "cn", "merge_base": "425c0a450ff7a22c8988215ab8e26acdf2764522", "name": "anti_autocorr_turnover_evenness_20", "session_branch": "main", "session_id": "20260428_060002_dc8b1a", "status": "candidate", "ts": "2026-04-28T06:57:23.183701+08:00"}
{"base_ref": "origin/main", "decision": "candidate", "eval_seconds": 129.7, "formula": "rank(-ts_corr(ret_1d,shift(ret_1d,1),20))*rank(ts_min(turnover_rate,20)/ts_mean(turnover_rate,20))", "gates": "PASS", "head_commit": "425c0a450ff7a22c8988215ab8e26acdf2764522", "is_ic": 0.0379, "is_ic_ir": 0.443, "is_monotonicity": 0.45, "is_sharpe": 1.599, "is_turnover": 0.177, "market": "cn", "merge_base": "425c0a450ff7a22c8988215ab8e26acdf2764522", "name": "anti_autocorr_turnover_floor_20", "session_branch": "main", "session_id": "20260428_060002_dc8b1a", "status": "candidate", "ts": "2026-04-28T06:57:23.183701+08:00"}
{"base_ref": "origin/main", "decision": "candidate", "eval_seconds": 81.2, "formula": "rank(-ts_corr(ret_1d, shift(ret_1d, 1), 40)) * rank(-(ts_max(turnover_rate, 20) / ts_sum(turnover_rate, 20)))", "gates": "PASS", "head_commit": "425c0a450ff7a22c8988215ab8e26acdf2764522", "is_ic": 0.0244, "is_ic_ir": 0.265, "is_monotonicity": 0.25, "is_sharpe": -0.08, "is_turnover": 0.14, "market": "cn", "merge_base": "425c0a450ff7a22c8988215ab8e26acdf2764522", "name": "anti_autocorr_turnover_spike_share_20", "session_branch": "main", "session_id": "20260428_060002_dc8b1a", "status": "candidate", "ts": "2026-04-28T06:57:23.183701+08:00"}
{"base_ref": "origin/main", "decision": "revert", "eval_seconds": 198.8, "formula": "rank(ts_mean(close/high,20))*rank(-ts_corr(turnover_rate,shift(turnover_rate,1),20))", "gates": "FAIL", "head_commit": "425c0a450ff7a22c8988215ab8e26acdf2764522", "is_ic": 0.0226, "is_ic_ir": 0.137, "is_monotonicity": -0.2, "is_sharpe": -1.203, "is_turnover": 0.134, "market": "cn", "merge_base": "425c0a450ff7a22c8988215ab8e26acdf2764522", "name": "bullish_close_turnover_decorr_20", "session_branch": "main", "session_id": "20260428_060002_dc8b1a", "status": "reverted", "ts": "2026-04-28T06:57:23.183701+08:00"}
{"base_ref": "origin/main", "decision": "revert", "eval_seconds": 194.8, "formula": "rank(ts_min(amount/circ_market_cap,20)/ts_max(amount/circ_market_cap,20)-ts_corr(amount/circ_market_cap,shift(amount/circ_market_cap,1),20))", "gates": "FAIL", "head_commit": "425c0a450ff7a22c8988215ab8e26acdf2764522", "is_ic": 0.021, "is_ic_ir": 0.199, "is_monotonicity": 0.5, "is_sharpe": 0.229, "is_turnover": 0.152, "market": "cn", "merge_base": "425c0a450ff7a22c8988215ab8e26acdf2764522", "name": "float_flow_corridor_autorevert_20", "session_branch": "main", "session_id": "20260428_060002_dc8b1a", "status": "reverted", "ts": "2026-04-28T06:57:23.183701+08:00"}
{"base_ref": "origin/main", "decision": "candidate", "eval_seconds": 116.6, "formula": "rank(ts_mean(amount/circ_market_cap,20)/ts_max(amount/circ_market_cap,20))", "gates": "PASS", "head_commit": "425c0a450ff7a22c8988215ab8e26acdf2764522", "is_ic": 0.0285, "is_ic_ir": 0.322, "is_monotonicity": 0.85, "is_sharpe": 0.375, "is_turnover": 0.133, "market": "cn", "merge_base": "425c0a450ff7a22c8988215ab8e26acdf2764522", "name": "float_flow_evenness_20", "session_branch": "main", "session_id": "20260428_060002_dc8b1a", "status": "candidate", "ts": "2026-04-28T06:57:23.183701+08:00"}
{"base_ref": "origin/main", "decision": "candidate", "eval_seconds": 66.2, "formula": "rank(ts_mean(amount / circ_market_cap,20) / ts_std(amount / circ_market_cap,20))", "gates": "PASS", "head_commit": "425c0a450ff7a22c8988215ab8e26acdf2764522", "is_ic": 0.0367, "is_ic_ir": 0.369, "is_monotonicity": 0.7, "is_sharpe": 1.412, "is_turnover": 0.12, "market": "cn", "merge_base": "425c0a450ff7a22c8988215ab8e26acdf2764522", "name": "float_normalized_amount_stability_20", "session_branch": "main", "session_id": "20260428_060002_dc8b1a", "status": "candidate", "ts": "2026-04-28T06:57:23.183701+08:00"}
{"base_ref": "origin/main", "decision": "candidate", "eval_seconds": 114.3, "formula": "rank(-ts_corr(amount / circ_market_cap, high / low, 20))", "gates": "PASS", "head_commit": "425c0a450ff7a22c8988215ab8e26acdf2764522", "is_ic": 0.0182, "is_ic_ir": 0.233, "is_monotonicity": 0.55, "is_sharpe": -1.567, "is_turnover": 0.169, "market": "cn", "merge_base": "425c0a450ff7a22c8988215ab8e26acdf2764522", "name": "float_range_absorption_20", "session_branch": "main", "session_id": "20260428_060002_dc8b1a", "status": "candidate", "ts": "2026-04-28T06:57:23.183701+08:00"}
{"base_ref": "origin/main", "decision": "revert", "eval_seconds": 189.8, "formula": "rank((ts_mean(amount/circ_market_cap,20)/ts_std(amount/circ_market_cap,20))*(-ts_corr(volume_ratio,shift(volume_ratio,5),20)))", "gates": "FAIL", "head_commit": "425c0a450ff7a22c8988215ab8e26acdf2764522", "is_ic": -0.007, "is_ic_ir": -0.073, "is_monotonicity": -0.5, "is_sharpe": -3.784, "is_turnover": 0.181, "market": "cn", "merge_base": "425c0a450ff7a22c8988215ab8e26acdf2764522", "name": "float_stable_relvol_antiac_20", "session_branch": "main", "session_id": "20260428_060002_dc8b1a", "status": "reverted", "ts": "2026-04-28T06:57:23.183701+08:00"}
