{"ts": "2026-05-20T07:23:20.341546+08:00", "session_id": "20260520_062702_8909c7", "market": "cn", "formula": "rank(ret_20d-ret_5d) * rank(-(ts_std(turnover_rate,20)/(ts_mean(turnover_rate,20)+0.01)))", "name": "leader_pullback_turncv_20", "is_ic": -0.0027, "is_ic_ir": -0.008, "is_sharpe": 6.162, "is_turnover": 0.196, "is_monotonicity": 0.9, "gates": "FAIL", "status": "reverted", "eval_seconds": 118.9, "sleeve_id": "cn_ai_leadership_pullback", "mispricing_source": "Short-horizon sellers react to the pullback, but stable turnover dispersion implies strong-hand sponsorship remains, so price overshoots downward relative to persistent thematic demand.", "forced_counterparty": "theme-chasing retail and benchmarked long-only funds trimming recent winners on 5-day weakness", "data_requirements": "[\"current CN daily tape is sufficient for IS test\",\"before promotion: hedge attribution vs 000300.SH and 399006.SZ\",\"rolling corr vs promoted sleeves\",\"sleeve drawdown and turnover-cost ledger\"]", "failure_mode": "It stops working when low-churn pullbacks no longer mean absorption and instead reflect genuine demand deterioration or collapsing AI capex expectations.", "report_contract": "setup_overlay", "ai_supercycle_layer": "ai_chip_equipment_materials_packaging", "supply_chain_hypothesis": "Domestic AI chip equipment and advanced-packaging bottleneck names should display orderly leader pullbacks when capital rotates but the capacity-scarcity narrative is intact; this is a discovery hypothesis, not validated evidence.", "relationship_evidence_required": "true", "money_readiness": "research_only", "decision": "revert", "session_branch": "main", "base_ref": "origin/main", "merge_base": "b127bcb38ef90487e053bb7009fa8bafbe89687b", "head_commit": "b127bcb38ef90487e053bb7009fa8bafbe89687b"}
{"ts": "2026-05-20T07:23:20.341546+08:00", "session_id": "20260520_062702_8909c7", "market": "cn", "formula": "rank(ret_20d - ret_5d) * rank(-ts_corr(ret_1d, turnover_rate, 20))", "name": "leader_pullback_flowdecouple_20", "is_ic": -0.0708, "is_ic_ir": -0.23, "is_sharpe": 1.589, "is_turnover": 0.219, "is_monotonicity": 0.1, "gates": "FAIL", "status": "reverted", "eval_seconds": 95.0, "sleeve_id": "cn_ai_infra_tape_accumulation", "mispricing_source": "The market overreacts to short-horizon cooling in AI-theme names and underprices orderly institutional absorption in genuine leaders.", "forced_counterparty": "Retail momentum chasers and benchmark-hugging managers with short evaluation windows who sell/trim when turnover no longer confirms upside.", "data_requirements": "[\"daily OHLCV\", \"turnover_rate\", \"AI-infra universe membership\", \"factor correlation matrix vs promoted sleeves\", \"beta-hedged sleeve attribution vs 000300.SH and 399006.SZ\"]", "failure_mode": "Fails when the regime rewards only explosive high-turnover breakouts, or when theme liquidity collapses and 20-day leadership stops carrying informational value.", "report_contract": "setup_overlay", "ai_supercycle_layer": "ai_chip_equipment_materials_packaging", "supply_chain_hypothesis": "Domestic AI chip equipment/material packaging bottlenecks should show month-long leadership with shallow pullbacks and muted turnover-response before fundamental order evidence is fully recognized.", "relationship_evidence_required": "true", "money_readiness": "research_only", "decision": "revert", "session_branch": "main", "base_ref": "origin/main", "merge_base": "b127bcb38ef90487e053bb7009fa8bafbe89687b", "head_commit": "b127bcb38ef90487e053bb7009fa8bafbe89687b"}
{"ts": "2026-05-20T07:23:20.341546+08:00", "session_id": "20260520_062702_8909c7", "market": "cn", "formula": "rank(ret_20d) * rank(-ret_5d) * rank(-ts_skew(turnover_rate, 20))", "name": "leader_pullback_turnover_skew_20", "is_ic": 0.0, "is_ic_ir": 0.0, "is_sharpe": 0.0, "is_turnover": 0.0, "is_monotonicity": 0.0, "gates": "FAIL", "status": "reverted", "eval_seconds": 106.4, "sleeve_id": "cn_ai_infra_leader_pullback", "mispricing_source": "Short-horizon de-risking after AI theme bursts creates temporary pullbacks, while suppressed turnover skew indicates the float is not being broadly distributed; this targets flow asymmetry, not just another price-level momentum signal.", "forced_counterparty": "T+1 retail profit-takers, fast theme rotators, and benchmarked funds trimming recent winners into liquidity windows", "data_requirements": "[daily close/high/low/turnover_rate for IS test, benchmark hedge attribution vs 000300.SH and 399006.SZ, sleeve correlation matrix, residual risk attribution, realized turnover cost by holding bucket]", "failure_mode": "It stops working when speculative blow-off regimes dominate and turnover spikes become confirming rather than bearish, or when AI-infra breadth collapses and 20-day leaders no longer mean-revert only shallowly.", "report_contract": "research_only", "ai_supercycle_layer": "ai_chip_equipment_materials_packaging", "supply_chain_hypothesis": "Domestic AI hardware bottleneck names that hold medium-term leadership through low-churn pullbacks are being accumulated ahead of source-reviewed order/backlog or capex confirmation.", "relationship_evidence_required": "true", "money_readiness": "research_only", "decision": "revert", "session_branch": "main", "base_ref": "origin/main", "merge_base": "b127bcb38ef90487e053bb7009fa8bafbe89687b", "head_commit": "b127bcb38ef90487e053bb7009fa8bafbe89687b"}
{"ts": "2026-05-20T07:23:20.341546+08:00", "session_id": "20260520_062702_8909c7", "market": "cn", "formula": "rank(ret_20d-ret_5d)*rank(ts_mean(amount/circ_market_cap,20)/ts_max(amount/circ_market_cap,20))", "name": "leader_pullback_float_even_20", "is_ic": 0.0069, "is_ic_ir": 0.021, "is_sharpe": 6.364, "is_turnover": 0.181, "is_monotonicity": 0.7, "gates": "FAIL", "status": "reverted", "eval_seconds": 179.7, "sleeve_id": "cn_ai_orderly_pullback", "mispricing_source": "A-share thematic traders overreact to short pullbacks and anchor on headline volatility, while benchmark-constrained institutions accumulate AI leaders more gradually; the float-evenness leg targets that under-recognized accumulation rather than raw momentum.", "forced_counterparty": "T+1 retail momentum traders and benchmarked funds cutting risk after short-term drawdowns", "data_requirements": "[\"current daily data is sufficient for IS test\",\"ai_infra universe metadata for BFS/module/pool filtering\",\"pre-promotion hedge-adjusted sleeve PnL, residual risk attribution, and factor-correlation matrix\"]", "failure_mode": "This stops working in indiscriminate risk-on manias or policy shock regimes where blow-off turnover is rewarded and orderly pullback quality no longer differentiates winners.", "report_contract": "setup_overlay", "ai_supercycle_layer": "none", "supply_chain_hypothesis": "The signal is meant to surface validated CN AI-infra bottleneck names showing orderly post-run accumulation during pullbacks; any specific supplier/customer interpretation still needs source review.", "relationship_evidence_required": "true", "money_readiness": "research_only", "decision": "revert", "session_branch": "main", "base_ref": "origin/main", "merge_base": "b127bcb38ef90487e053bb7009fa8bafbe89687b", "head_commit": "b127bcb38ef90487e053bb7009fa8bafbe89687b"}
{"ts": "2026-05-20T07:23:20.341546+08:00", "session_id": "20260520_062702_8909c7", "market": "cn", "formula": "rank(ret_20d)*rank(-ret_5d)*rank(-ts_std(volume_ratio,20))", "name": "leader_pullback_vrstd_20", "is_ic": 0.0086, "is_ic_ir": 0.054, "is_sharpe": -2.772, "is_turnover": 0.282, "is_monotonicity": -0.2, "gates": "FAIL", "status": "reverted", "eval_seconds": 141.2, "sleeve_id": "ai_infra_leader_pullback", "mispricing_source": "Short-term profit-taking temporarily depresses price in AI-infra leaders, while slower institutional accumulation keeps participation orderly; the market underreacts to that distinction.", "forced_counterparty": "T+1 retail swing traders and theme-chasing fast money that de-risk on the first pullback regardless of medium-term supply-chain scarcity", "data_requirements": "[\"current CN daily fields are sufficient for IS test\",\"before promotion: sleeve correlation vs promoted factors, beta-hedged residual attribution, drawdown by AI layer/BFS depth, capacity check inside 中国资产池\"]", "failure_mode": "Fails when the pullback is driven by real negative information or regime-wide liquidity withdrawal, where low relative-volume volatility means no bid support rather than quiet absorption.", "report_contract": "fresh_buy_gate", "ai_supercycle_layer": "none", "supply_chain_hypothesis": "none", "relationship_evidence_required": "false", "money_readiness": "money_candidate", "decision": "revert", "session_branch": "main", "base_ref": "origin/main", "merge_base": "b127bcb38ef90487e053bb7009fa8bafbe89687b", "head_commit": "b127bcb38ef90487e053bb7009fa8bafbe89687b"}
{"ts": "2026-05-20T07:23:20.341546+08:00", "session_id": "20260520_062702_8909c7", "market": "cn", "formula": "rank(ret_20d / (ts_std(turnover_rate, 20) + 0.01))", "name": "leader_turnover_efficiency_20", "is_ic": 0.0793, "is_ic_ir": 0.263, "is_sharpe": 9.362, "is_turnover": 0.183, "is_monotonicity": 1.0, "gates": "PASS", "status": "reverted", "eval_seconds": 123.4, "sleeve_id": "cn_ai_infra_leadership", "mispricing_source": "The market overpays for loud high-churn concept trades and underprices persistence in orderly leaders where benchmarked institutions are still building exposure.", "forced_counterparty": "Short-horizon retail/theme traders and benchmark-constrained funds that cannot scale mid-cap bottleneck names quickly", "data_requirements": "[\"daily close/return/turnover_rate\", \"factor correlation vs promoted sleeves\", \"beta-hedged sleeve attribution vs 000300.SH and 399006.SZ\", \"post-cost turnover check at 10d/20d holding horizons\"]", "failure_mode": "It stops working when the regime shifts to rumor/policy squeeze trading, where high-turnover speculative names dominate and orderly accumulation no longer predicts continuation.", "report_contract": "fresh_buy_gate", "ai_supercycle_layer": "ai_chip_equipment_materials_packaging", "supply_chain_hypothesis": "Orderly medium-term leadership should surface domestic semiconductor equipment/materials/packaging names repricing as downstream AI accelerator and datacenter capex tightens bottlenecks.", "relationship_evidence_required": "true", "money_readiness": "money_candidate", "decision": "revert", "session_branch": "main", "base_ref": "origin/main", "merge_base": "b127bcb38ef90487e053bb7009fa8bafbe89687b", "head_commit": "b127bcb38ef90487e053bb7009fa8bafbe89687b", "oos": "FAIL", "checks_status": "skipped"}
{"ts": "2026-05-20T07:23:20.341546+08:00", "session_id": "20260520_062702_8909c7", "market": "cn", "formula": "rank((ret_20d-ret_5d)*ts_min(turnover_rate,20)/ts_mean(turnover_rate,20))", "name": "leader_pullback_turnfloor_20", "is_ic": 0.0829, "is_ic_ir": 0.232, "is_sharpe": 4.516, "is_turnover": 0.221, "is_monotonicity": 0.9, "gates": "PASS", "status": "reverted", "eval_seconds": 191.9, "sleeve_id": "cn_tape_leadership_continuation", "mispricing_source": "The market often misreads shallow consolidations in specialist AI-infra leaders as exhaustion; short-horizon traders sell the pause, while informed buyers keep a steady baseline bid underneath. This is not just a price-rank clone because it requires both prior leadership and persistent baseline churn, not a one-day breakout.", "forced_counterparty": "Retail T+1/T+3 profit-takers and benchmark-hugging funds that trim on pauses or cannot add until later order/news confirmation", "data_requirements": "[\"daily price and turnover data for IS test\", \"beta hedge and residual return attribution vs 000300.SH and 399006.SZ\", \"sleeve correlation to existing CN factors\", \"filings/official PRs/transcripts before turning any supplier/backlog story into production evidence\"]", "failure_mode": "It fails when the whole AI basket is in indiscriminate policy/liquidity beta mode, or when the pullback reflects real demand deterioration rather than orderly digestion; then turnover floor measures crowding, not sponsorship.", "report_contract": "setup_overlay", "ai_supercycle_layer": "ai_chip_equipment_materials_packaging", "supply_chain_hypothesis": "Orderly leader pullbacks with a firm participation floor should preferentially surface packaging/equipment/material bottleneck names being accumulated ahead of visible order-book confirmation.", "relationship_evidence_required": "true", "money_readiness": "research_only", "decision": "revert", "session_branch": "main", "base_ref": "origin/main", "merge_base": "b127bcb38ef90487e053bb7009fa8bafbe89687b", "head_commit": "b127bcb38ef90487e053bb7009fa8bafbe89687b", "oos": "FAIL", "checks_status": "skipped"}
{"ts": "2026-05-20T07:23:20.341546+08:00", "session_id": "20260520_062702_8909c7", "market": "cn", "formula": "rank(ret_20d-ret_5d)*rank(ts_min(volume_ratio,20)/ts_max(volume_ratio,20))", "name": "leader_pullback_relvol_even_20", "is_ic": -0.0095, "is_ic_ir": -0.053, "is_sharpe": -2.55, "is_turnover": 0.21, "is_monotonicity": -0.55, "gates": "FAIL", "status": "reverted", "eval_seconds": 196.4, "sleeve_id": "cn_ai_leader_reaccumulation", "mispricing_source": "The market over-penalizes short-horizon cooling inside theme leaders and underprices orderly re-accumulation when volume stays even instead of collapsing.", "forced_counterparty": "retail theme chasers and benchmark-constrained funds", "data_requirements": "[\"daily OHLCV\",\"volume_ratio\",\"AI-infra universe membership\",\"benchmark hedge ledger vs 000300.SH/399006.SZ\",\"sleeve correlation and residual-risk attribution before promotion\"]", "failure_mode": "Fails when pullbacks reflect real demand deterioration, or when the regime rewards one-day speculative spikes over steady leadership.", "report_contract": "fresh_buy_gate", "ai_supercycle_layer": "ai_chip_equipment_materials_packaging", "supply_chain_hypothesis": "Verified AI bottleneck suppliers in semicap, packaging, and optical links should keep medium-term leadership and even participation through shallow pullbacks before continuation.", "relationship_evidence_required": "true", "money_readiness": "money_candidate", "decision": "revert", "session_branch": "main", "base_ref": "origin/main", "merge_base": "b127bcb38ef90487e053bb7009fa8bafbe89687b", "head_commit": "b127bcb38ef90487e053bb7009fa8bafbe89687b"}
{"ts": "2026-05-20T07:23:20.341546+08:00", "session_id": "20260520_062702_8909c7", "market": "cn", "formula": "rank((ret_20d-ret_5d)*ts_min(turnover_rate,20)/(ts_std(turnover_rate,20)+0.01))", "name": "leader_turnfloor_efficiency_20", "is_ic": 0.0838, "is_ic_ir": 0.244, "is_sharpe": 4.805, "is_turnover": 0.228, "is_monotonicity": 1.0, "gates": "PASS", "status": "reverted", "eval_seconds": 144.7, "sleeve_id": "cn_ai_pullback_absorption", "mispricing_source": "The market overreacts to shallow weekly pullbacks inside AI-theme leaders and underweights the information in a stable turnover floor, so orderly re-accumulation is not fully priced over the next 10-20 trading days.", "forced_counterparty": "T+1 retail profit-takers and benchmark-constrained long-only funds that scale into AI names only after confirmation", "data_requirements": "[\"close\",\"ret_5d\",\"ret_20d\",\"turnover_rate\",\"beta-hedged sleeve attribution vs 000300.SH and 399006.SZ\",\"factor correlation to promoted sleeves\"]; any supplier/customer/order claim still needs filings, official PRs, transcripts, or verified news", "failure_mode": "It breaks when low turnover volatility reflects illiquidity or demand exhaustion instead of absorption, or when regime shifts to policy-gap/speculative melt-up where spike participation is bullish rather than a warning.", "report_contract": "fresh_buy_gate", "ai_supercycle_layer": "ai_chip_equipment_materials_packaging", "supply_chain_hypothesis": "Validated CN semicap, materials, packaging, and testing bottleneck names should hold a firmer turnover floor during 5-day pullbacks when AI capex transmission is real, surfacing leadership continuation before harder order evidence is fully reflected.", "relationship_evidence_required": "true", "money_readiness": "money_candidate", "decision": "revert", "session_branch": "main", "base_ref": "origin/main", "merge_base": "b127bcb38ef90487e053bb7009fa8bafbe89687b", "head_commit": "b127bcb38ef90487e053bb7009fa8bafbe89687b", "oos": "FAIL", "checks_status": "skipped"}
{"ts": "2026-05-20T07:23:20.341546+08:00", "session_id": "20260520_062702_8909c7", "market": "cn", "formula": "rank(ret_20d-ret_5d)*rank(ts_min(turnover_rate,20)/ts_mean(turnover_rate,20))", "name": "leader_pullback_floor_spread_20", "is_ic": -0.0282, "is_ic_ir": -0.091, "is_sharpe": 3.901, "is_turnover": 0.227, "is_monotonicity": 0.6, "gates": "FAIL", "status": "reverted", "eval_seconds": 146.7, "sleeve_id": "cn_ai_leadership_flow", "mispricing_source": "Short-horizon theme traders monetize pullbacks, while benchmark-constrained institutions under-own niche AI bottleneck names and cannot close the gap immediately; the defended turnover floor filters out one-off speculative spikes.", "forced_counterparty": "T+1 retail profit-takers and benchmark-hugging mutual funds that are slow to add smaller thematic winners", "data_requirements": "[\"CN daily OHLCV\",\"turnover_rate\",\"AI-infra universe membership/BFS tags\",\"beta-hedge ledger vs 000300.SH and 399006.SZ\",\"rolling sleeve correlation and residual risk attribution\"]", "failure_mode": "Stops working when the market shifts to broad mean reversion or when AI-theme leaders lose sponsorship and the turnover floor breaks during pullbacks.", "report_contract": "fresh_buy_gate", "ai_supercycle_layer": "none", "supply_chain_hypothesis": "Cross-layer CN AI-infra bottleneck names with ongoing capex/order repricing should show defended turnover floors during brief pullbacks; no specific supplier/customer edge is asserted by the formula itself.", "relationship_evidence_required": "true", "money_readiness": "money_candidate", "decision": "revert", "session_branch": "main", "base_ref": "origin/main", "merge_base": "b127bcb38ef90487e053bb7009fa8bafbe89687b", "head_commit": "b127bcb38ef90487e053bb7009fa8bafbe89687b"}
{"ts": "2026-05-20T07:23:20.341546+08:00", "session_id": "20260520_062702_8909c7", "market": "cn", "formula": "rank(ret_20d-ret_5d)*rank(ts_min(turnover_rate,20)/(ts_std(turnover_rate,20)+0.01))", "name": "leader_pullback_turnfloorstd_20", "is_ic": -0.0185, "is_ic_ir": -0.057, "is_sharpe": 5.238, "is_turnover": 0.198, "is_monotonicity": 0.7, "gates": "FAIL", "status": "reverted", "eval_seconds": 146.9, "sleeve_id": "cn_ai_pullback_absorption", "mispricing_source": "The market underreacts to orderly re-accumulation after shallow pullbacks, because short-horizon participants read the pause as fatigue while the defended turnover floor signals ongoing sponsorship rather than dead liquidity.", "forced_counterparty": "T+1 retail profit-takers, redemption/rebalance sellers, and benchmark-constrained long-only funds that add only after confirmation", "data_requirements": "[\"validated CN AI universe join from ai_infra\", \"daily ret_20d/ret_5d/turnover_rate\", \"beta-hedged sleeve attribution vs 000300.SH and 399006.SZ\", \"rolling correlation vs promoted and active sleeves\", \"intraday/member-level flow ledger before calling the absorption story money-ready\"]", "failure_mode": "Fails in rumor-squeeze or policy-liquidity chase regimes where one-way high-churn momentum wins, or in risk-off deleveraging when a turnover floor reflects trapped distribution instead of accumulation.", "report_contract": "setup_overlay", "ai_supercycle_layer": "ai_chip_equipment_materials_packaging", "supply_chain_hypothesis": "Domestic semicap, materials, packaging, and test names closest to AI accelerator and memory capex bottlenecks should show defended turnover floors during 5-day digestion while retaining 20-day leadership before verified order or capex evidence is fully priced.", "relationship_evidence_required": "true", "money_readiness": "research_only", "decision": "revert", "session_branch": "main", "base_ref": "origin/main", "merge_base": "b127bcb38ef90487e053bb7009fa8bafbe89687b", "head_commit": "b127bcb38ef90487e053bb7009fa8bafbe89687b"}
