{"ts": "2026-05-26T14:56:45.533513+08:00", "session_id": "20260526_140002_5486d2", "market": "cn", "formula": "rank(-ret_5d)*rank(-ts_std(amount/circ_market_cap,20))", "name": "float_absorption_pullback_20", "is_ic": -0.0181, "is_ic_ir": -0.067, "is_sharpe": -3.498, "is_turnover": 0.255, "is_monotonicity": 0.0, "gates": "FAIL", "status": "reverted", "eval_seconds": 112.2, "sleeve_id": "cn_ai_flow_reversal", "mispricing_source": "Orderly float-normalized turnover during a short pullback signals inventory transfer from impatient holders to stronger hands; this is a sponsorship/ownership-transfer signal, not just another standalone price reversal factor.", "forced_counterparty": "Retail/theme traders and short-horizon public funds forced to de-risk or rotate after recent drawdowns; benchmark-constrained institutions that cannot instantly fill desired exposure.", "data_requirements": "[\"daily amount and circ_market_cap history for factor test\",\"ai_infra BFS/module/source-review tags for universe scoping\",\"beta-hedged attribution vs 000300.SH and 399006.SZ\",\"filings/press releases/transcripts verifying AI capex or supply-chain linkage before production use\"]", "failure_mode": "Fails when pullbacks reflect genuine demand/backlog deterioration instead of weak-hand liquidation, or when the regime shifts to momentum-chasing where recent losers keep underperforming.", "report_contract": "setup_overlay", "ai_supercycle_layer": "ai_datacenter_edge_infra", "supply_chain_hypothesis": "Datacenter, optical, cooling, PCB, and power-infra bottleneck names tied to AI buildout should show steady float absorption on short pullbacks before the next leg higher.", "relationship_evidence_required": "true", "money_readiness": "research_only", "decision": "revert", "session_branch": "main", "base_ref": "origin/main", "merge_base": "c99187be1dc8d78a84147200981562efcde7b8d5", "head_commit": "c99187be1dc8d78a84147200981562efcde7b8d5"}
{"ts": "2026-05-26T14:56:45.533513+08:00", "session_id": "20260526_140002_5486d2", "market": "cn", "formula": "rank(-ts_corr(ret_1d,shift(ret_1d,1),20))*rank(ts_mean(turnover_rate,20)/ts_max(turnover_rate,20))", "name": "anti_autocorr_turnover_peak_balance_20", "is_ic": -0.041, "is_ic_ir": -0.137, "is_sharpe": -2.877, "is_turnover": 0.191, "is_monotonicity": -0.45, "gates": "FAIL", "status": "reverted", "eval_seconds": 132.7, "sleeve_id": "cn_ai_flow_absorption", "mispricing_source": "Liquidity segmentation and T+1 behavior let retail and short-horizon accounts overreact day to day, while benchmarked institutions must accumulate gradually; this is a flow-shape signal, not a simple momentum/reversal clone of existing price factors.", "forced_counterparty": "Retail liquidity takers, short-horizon reversal traders, and funds forced to trade around redemptions or benchmark rebalancing", "data_requirements": "[\"Current CN daily tape is sufficient for IS test\",\"Before promotion require ai_infra universe membership/source-review status\",\"Before production require beta-hedged sleeve attribution, residual risk attribution, and corr vs existing sleeves\"]", "failure_mode": "It stops working when the market shifts into gap-driven retail chase or policy beta, where steady turnover no longer means accumulation and negative autocorrelation just reflects noisy churn.", "report_contract": "setup_overlay", "ai_supercycle_layer": "ai_chip_equipment_materials_packaging", "supply_chain_hypothesis": "Domestic AI hardware bottleneck names can show steady turnover absorption before capex/order evidence is fully reflected in price, especially in equipment, materials, and advanced packaging lanes.", "relationship_evidence_required": "true", "money_readiness": "research_only", "decision": "revert", "session_branch": "main", "base_ref": "origin/main", "merge_base": "c99187be1dc8d78a84147200981562efcde7b8d5", "head_commit": "c99187be1dc8d78a84147200981562efcde7b8d5"}
{"ts": "2026-05-26T14:56:45.533513+08:00", "session_id": "20260526_140002_5486d2", "market": "cn", "formula": "rank(ts_mean(amount,20)/circ_market_cap)*rank(-ts_std(ret_1d,20))", "name": "capital_velocity_lowvol_20", "is_ic": -0.0115, "is_ic_ir": -0.052, "is_sharpe": -3.841, "is_turnover": 0.09, "is_monotonicity": -0.15, "gates": "FAIL", "status": "reverted", "eval_seconds": 116.6, "sleeve_id": "cn_ai_accumulation_overlay", "mispricing_source": "The market underreacts when serious capital commits through steady float absorption instead of headline breakout candles, so quiet leaders stay underowned for the next 10-20 trading days.", "forced_counterparty": "Short-horizon retail traders and benchmark-constrained managers rotating away from low-volatility consolidations into noisier high-excitement names", "data_requirements": "[\"daily amount\",\"circ_market_cap\",\"ret_1d\",\"ai_infra layer/depth metadata for post-rank attribution\",\"beta-hedge and sleeve-correlation attribution before promotion\"]", "failure_mode": "It stops working in panic/liquidity-spike regimes where low volatility reflects lack of demand rather than absorption, or when policy-beta squeezes dominate stock-specific accumulation.", "report_contract": "setup_overlay", "ai_supercycle_layer": "ai_chip_equipment_materials_packaging", "supply_chain_hypothesis": "Domestic AI chip equipment, materials, and advanced-packaging beneficiaries should show steady float absorption before earnings visibly confirm accelerator-capex and localization bottlenecks.", "relationship_evidence_required": "true", "money_readiness": "research_only", "decision": "revert", "session_branch": "main", "base_ref": "origin/main", "merge_base": "c99187be1dc8d78a84147200981562efcde7b8d5", "head_commit": "c99187be1dc8d78a84147200981562efcde7b8d5"}
{"ts": "2026-05-26T14:56:45.533513+08:00", "session_id": "20260526_140002_5486d2", "market": "cn", "formula": "rank(ts_mean(amount/market_cap,20))*rank(-ps_ttm)", "name": "value_backed_capital_intensity_20", "is_ic": 0.0418, "is_ic_ir": 0.152, "is_sharpe": 1.665, "is_turnover": 0.027, "is_monotonicity": 0.0, "gates": "FAIL", "status": "reverted", "eval_seconds": 87.2, "sleeve_id": "cn_ai_infra_repricing", "mispricing_source": "Slow fundamental rerating of operationally important but optically cheap AI-infra names; capital arrives before consensus narrative and benchmark weights catch up.", "forced_counterparty": "Retail theme chasers and benchmark-constrained funds that avoid low-PS capex-heavy suppliers until evidence is obvious", "data_requirements": "[\"daily CN price/volume/daily_basic for IS test\", \"benchmark beta-hedge and residual attribution for promotion\", \"source-review evidence cards before any supplier/customer narrative is upgraded\"]", "failure_mode": "Fails when low-PS high-value-turnover names are being distributed due to deteriorating fundamentals, or in pure momentum/speculative regimes where expensive leaders keep absorbing flows.", "report_contract": "research_only", "ai_supercycle_layer": "ai_chip_equipment_materials_packaging", "supply_chain_hypothesis": "Domestic semicap, packaging, and materials bottlenecks should attract sustained capital before verified order and capex evidence is fully priced.", "relationship_evidence_required": "true", "money_readiness": "research_only", "decision": "revert", "session_branch": "main", "base_ref": "origin/main", "merge_base": "c99187be1dc8d78a84147200981562efcde7b8d5", "head_commit": "c99187be1dc8d78a84147200981562efcde7b8d5"}
{"ts": "2026-05-26T14:56:45.533513+08:00", "session_id": "20260526_140002_5486d2", "market": "cn", "formula": "rank(ts_mean(ts_sum(amount,5),20)/ts_max(ts_sum(amount,5),20))*rank(-pct_change(close,10))", "name": "weekly_amount_even_pullback_10", "is_ic": 0.0358, "is_ic_ir": 0.185, "is_sharpe": -1.408, "is_turnover": 0.217, "is_monotonicity": -0.05, "gates": "FAIL", "status": "reverted", "eval_seconds": 163.6, "sleeve_id": "cn_ai_absorption_pullback", "mispricing_source": "T+1 retail and benchmark-constrained funds react to recent price weakness faster than they update on slow ownership transfer, so orderly weekly cash turnover during a dip is mispriced as “no catalyst” instead of accumulation.", "forced_counterparty": "retail momentum traders, theme-rotation funds, and rebalance/redeeming long-only sellers", "data_requirements": "[\"daily close\",\"daily amount\",\"ai_infra universe membership\",\"beta-hedged sleeve attribution vs 000300.SH and 399006.SZ\",\"rolling correlation vs amount_absorb_pullback_10 and smooth_amount_pullback_5\",\"source-reviewed evidence before any supplier/customer narrative\"]", "failure_mode": "It stops working when the pullback reflects real order/capex deterioration, or when steady weekly amount is just passive liquidity in a broad de-risking regime rather than accumulation.", "report_contract": "setup_overlay", "ai_supercycle_layer": "ai_networking_optical_cpo", "supply_chain_hypothesis": "Source-reviewed CN optical interconnect/CPO bottleneck names may show orderly weekly notional participation through 10-day pullbacks before AI-cluster networking capex and order evidence is fully reflected in price.", "relationship_evidence_required": "true", "money_readiness": "research_only", "decision": "revert", "session_branch": "main", "base_ref": "origin/main", "merge_base": "c99187be1dc8d78a84147200981562efcde7b8d5", "head_commit": "c99187be1dc8d78a84147200981562efcde7b8d5"}
{"ts": "2026-05-26T14:56:45.533513+08:00", "session_id": "20260526_140002_5486d2", "market": "cn", "formula": "rank(ts_mean(amount,20)/(ts_std(amount,20)*clamp(ps_ttm,1,100)))", "name": "stable_flow_low_ps_20", "is_ic": 0.0129, "is_ic_ir": 0.069, "is_sharpe": -1.425, "is_turnover": 0.064, "is_monotonicity": -0.35, "gates": "FAIL", "status": "reverted", "eval_seconds": 142.9, "sleeve_id": "ai_infra_value_absorption", "mispricing_source": "The market chases loud AI beta and underreacts to quieter bottleneck names where capital is accumulating steadily but valuation has not fully repriced.", "forced_counterparty": "Retail concept chasers and benchmark-constrained managers anchored to liquid headline AI names.", "data_requirements": "[\"current CN daily fields for IS test\",\"beta-hedged sleeve attribution vs 000300.SH and 399006.SZ\",\"rolling correlation to promoted sleeves\",\"standard ai_infra source-review status for ranked names\"]", "failure_mode": "It should weaken in narrative melt-up regimes where expensive leaders keep rerating regardless of valuation, or when low ps_ttm reflects real demand impairment rather than under-recognition.", "report_contract": "setup_overlay", "ai_supercycle_layer": "ai_chip_equipment_materials_packaging", "supply_chain_hypothesis": "Domestic equipment, materials, and advanced-packaging bottlenecks already inside the validated AI-infra universe should attract steady accumulation before the market fully rerates their AI capex exposure.", "relationship_evidence_required": "false", "money_readiness": "research_only", "decision": "revert", "session_branch": "main", "base_ref": "origin/main", "merge_base": "c99187be1dc8d78a84147200981562efcde7b8d5", "head_commit": "c99187be1dc8d78a84147200981562efcde7b8d5"}
{"ts": "2026-05-26T14:56:45.533513+08:00", "session_id": "20260526_140002_5486d2", "market": "cn", "formula": "rank(ts_mean(amount/circ_market_cap,20)/ts_std(amount/circ_market_cap,20))*rank(-ret_5d)", "name": "stable_float_reentry_5", "is_ic": -0.0176, "is_ic_ir": -0.066, "is_sharpe": -3.115, "is_turnover": 0.269, "is_monotonicity": -0.5, "gates": "FAIL", "status": "reverted", "eval_seconds": 131.5, "sleeve_id": "cn_ai_flow_reentry", "mispricing_source": "Slow institutional accumulation in scarce AI-infra float versus fast retail and short-horizon risk reduction during pullbacks leaves temporarily underpriced leaders.", "forced_counterparty": "Retail momentum traders and short-horizon swing funds taking profits or cutting risk into shallow drawdowns.", "data_requirements": "[\"existing CN daily panel: amount,circ_market_cap,ret_5d\", \"beta-hedged sleeve return and residual risk attribution before promotion\"]", "failure_mode": "It stops working when pullbacks reflect true distribution or sector-wide de-rating rather than temporary profit-taking, especially in non-trending or liquidity-shock regimes.", "report_contract": "setup_overlay", "ai_supercycle_layer": "ai_networking_optical_cpo", "supply_chain_hypothesis": "Stable float absorption on pullbacks may surface domestic optical/interconnect bottleneck names being accumulated ahead of confirmed AI capex orders.", "relationship_evidence_required": "true", "money_readiness": "research_only", "decision": "revert", "session_branch": "main", "base_ref": "origin/main", "merge_base": "c99187be1dc8d78a84147200981562efcde7b8d5", "head_commit": "c99187be1dc8d78a84147200981562efcde7b8d5"}
{"ts": "2026-05-26T14:56:45.533513+08:00", "session_id": "20260526_140002_5486d2", "market": "cn", "formula": "rank(ts_mean(amount / circ_market_cap, 20)) * rank(-ps_ttm)", "name": "capint_low_ps_20", "is_ic": 0.0481, "is_ic_ir": 0.176, "is_sharpe": 1.927, "is_turnover": 0.026, "is_monotonicity": 0.35, "gates": "FAIL", "status": "reverted", "eval_seconds": 160.3, "sleeve_id": "cn_ai_capital_rotation", "mispricing_source": "The market is slow to capitalize AI-capex optionality in lower-multiple suppliers, so sustained capital commitment shows up in tape before the narrative and sell-side revisions catch up.", "forced_counterparty": "Retail traders selling slow names for faster leaders; benchmark-constrained funds that cannot add aggressively until revenue evidence is obvious.", "data_requirements": "[\"daily amount\",\"circ_market_cap\",\"ps_ttm\",\"AI universe BFS/module tags for post-rank attribution\",\"benchmark hedge series for residual return attribution\",\"rolling correlation to existing sleeves\"]", "failure_mode": "This stops working when speculative high-PS momentum dominates the tape, or when low ps_ttm reflects real demand deterioration rather than temporary disbelief.", "report_contract": "setup_overlay", "ai_supercycle_layer": "ai_chip_equipment_materials_packaging", "supply_chain_hypothesis": "Domestic semiconductor equipment, materials, and advanced-packaging names tied to accelerator and memory capex should exhibit persistent value-turnover absorption before sales multiples rerate.", "relationship_evidence_required": "true", "money_readiness": "research_only", "decision": "revert", "session_branch": "main", "base_ref": "origin/main", "merge_base": "c99187be1dc8d78a84147200981562efcde7b8d5", "head_commit": "c99187be1dc8d78a84147200981562efcde7b8d5"}
{"ts": "2026-05-26T14:56:45.533513+08:00", "session_id": "20260526_140002_5486d2", "market": "cn", "formula": "rank(ts_corr(ret_1d,shift(ret_1d,1),20))*rank(-ts_std(turnover_rate,20)/(ts_std(turnover_rate,120)+0.01))", "name": "autocorr_turnover_compress_20", "is_ic": -0.0675, "is_ic_ir": -0.232, "is_sharpe": -5.781, "is_turnover": 0.183, "is_monotonicity": -0.6, "gates": "FAIL", "status": "reverted", "eval_seconds": 203.5, "sleeve_id": "daily_price_overlay", "mispricing_source": "The market underreacts when leadership persistence improves at the same time crowding volatility falls; this captures orderly accumulation rather than a plain momentum or reversal level effect.", "forced_counterparty": "Benchmark-constrained long-only funds that must scale positions slowly under liquidity/risk limits, plus short-horizon retail traders who sell low-excitement drift for faster stories.", "data_requirements": "[\"ret_1d\",\"turnover_rate\",\"benchmark beta-hedge return series\",\"sleeve residual risk attribution ledger\"]", "failure_mode": "It should stop working in rumor-driven full-beta melt-up/meltdown regimes where turnover volatility rises everywhere and return autocorrelation either collapses or flips into mean reversion.", "report_contract": "research_only", "ai_supercycle_layer": "ai_chip_equipment_materials_packaging", "supply_chain_hypothesis": "Domestic AI capex bottleneck suppliers should show persistent markup with compressed turnover-vol before orders, backlog, or capex beneficiaries are fully recognized in fundamentals.", "relationship_evidence_required": "true", "money_readiness": "research_only", "decision": "revert", "session_branch": "main", "base_ref": "origin/main", "merge_base": "c99187be1dc8d78a84147200981562efcde7b8d5", "head_commit": "c99187be1dc8d78a84147200981562efcde7b8d5"}
{"ts": "2026-05-26T14:56:45.533513+08:00", "session_id": "20260526_140002_5486d2", "market": "cn", "formula": "ts_mean(amount / circ_market_cap, 20) / (max(pb, 0) + 1)", "name": "float_capint_low_pb_20", "is_ic": 0.0, "is_ic_ir": 0.0, "is_sharpe": 0.0, "is_turnover": 0.0, "is_monotonicity": 0.0, "gates": "FAIL", "status": "compute_error", "eval_seconds": 104.8, "sleeve_id": "cn_ai_hardasset_accumulation", "mispricing_source": "AI-capex and bottleneck repricing diffuses slowly into A-share hard-asset names, while float absorption shows up in cash turnover before consensus fundamental revisions.", "forced_counterparty": "Benchmark-constrained and redemption-driven holders supplying stock despite improving accumulation", "data_requirements": "[\"current daily fields suffice for signal calc\", \"filings/official PRs/transcripts for any supplier or order claim\", \"beta-hedged sleeve attribution and residual risk ledger before promotion\"]", "failure_mode": "It stops working when low-PB names are cheap for genuine balance-sheet stress, or when AI leadership shifts to asset-light segments where book value is not a useful anchor.", "report_contract": "setup_overlay", "ai_supercycle_layer": "hard_assets_energy_heavy", "supply_chain_hypothesis": "Candidate accumulation in CN AI hard-asset enablers across power/grid, optical-datacenter buildout, and equipment/material packaging chains before order visibility is fully consensus.", "relationship_evidence_required": "true", "money_readiness": "research_only", "decision": "revert", "session_branch": "main", "base_ref": "origin/main", "merge_base": "c99187be1dc8d78a84147200981562efcde7b8d5", "head_commit": "c99187be1dc8d78a84147200981562efcde7b8d5"}
{"ts": "2026-05-26T14:56:45.533513+08:00", "session_id": "20260526_140002_5486d2", "market": "cn", "formula": "rank(-ts_mean(abs(pct_change(amount/circ_market_cap,5)),20))*rank(-ret_5d)", "name": "floatflow_smooth_pullback_5", "is_ic": -0.0252, "is_ic_ir": -0.097, "is_sharpe": -4.091, "is_turnover": 0.27, "is_monotonicity": -0.05, "gates": "FAIL", "status": "reverted", "eval_seconds": 176.8, "sleeve_id": "cn_ai_float_flow_overlay", "mispricing_source": "The market overreacts to a weak week but underreacts to continued float-normalized cash absorption; this is a sponsorship-quality underreaction sleeve, not a naked price-reversal clone.", "forced_counterparty": "Retail T+1 theme chasers, redemption-driven sellers, and benchmark-constrained mutual funds that cut recent losers or cannot build full size early in smaller bottleneck names.", "data_requirements": "[\"IS test uses amount,circ_market_cap,ret_5d only\",\"before promotion: beta-hedged return and residual-risk attribution vs 000300.SH and 399006.SZ\",\"rolling corr vs smooth_amount_pullback_5 and promoted price factors\",\"ai_infra BFS/module/evidence-status join; filings/PRs/transcripts before any supplier/customer claim\"]", "failure_mode": "It fails when smooth float-normalized flow is just illiquidity rather than accumulation, or when the 5-day drawdown reflects real order/capex deterioration instead of temporary de-risking.", "report_contract": "setup_overlay", "ai_supercycle_layer": "ai_chip_equipment_materials_packaging", "supply_chain_hypothesis": "Domestic AI semiconductor equipment, materials, and advanced-packaging bottleneck names should hold smoother float-normalized flow through short pullbacks while patient capital accumulates ahead of source-reviewed order or capex confirmation.", "relationship_evidence_required": "true", "money_readiness": "research_only", "decision": "revert", "session_branch": "main", "base_ref": "origin/main", "merge_base": "c99187be1dc8d78a84147200981562efcde7b8d5", "head_commit": "c99187be1dc8d78a84147200981562efcde7b8d5"}
