{"ts": "2026-05-18T06:56:45.563809+08:00", "session_id": "20260518_060002_cd0c45", "market": "cn", "formula": "rank(ts_mean(turnover_rate,20)/ts_max(turnover_rate,20))", "name": "turnover_evenness_20", "is_ic": 0.0, "is_ic_ir": 0.0, "is_sharpe": 0.0, "is_turnover": 0.0, "is_monotonicity": 0.0, "gates": "FAIL", "status": "reverted", "eval_seconds": 153.3, "sleeve_id": "cn_ai_infra_flow_quality", "mispricing_source": "Retail theme chasing and short-horizon fast money create concentrated turnover bursts that look strong on the tape but leave supply overhang; quieter institutional accumulation is slower to be priced because it is less visually salient than breakout price action.", "forced_counterparty": "Short-horizon retail momentum traders and liquidity-recycling benchmark funds that must transact around theme spikes rather than wait for orderly accumulation.", "data_requirements": "[\"daily turnover_rate\", \"ai_infra universe metadata for layer/depth/pool tagging\", \"beta-hedged sleeve return and residual risk attribution before promotion\"]", "failure_mode": "It stops working if the market regime rewards extreme theme crowding and turnover spikes become genuine continuation rather than exhaustion/supply-overhang signals.", "report_contract": "fresh_buy_gate", "ai_supercycle_layer": "ai_datacenter_edge_infra", "supply_chain_hypothesis": "Real datacenter, server, cooling, and related infra beneficiaries should attract persistent two-way institutional participation before fundamentals are fully visible, while narrative-only names are more likely to trade as one-day turnover spikes.", "relationship_evidence_required": "true", "money_readiness": "money_candidate", "decision": "revert", "session_branch": "main", "base_ref": "origin/main", "merge_base": "76df81759b87ae939b7f4b094587247ae237c342", "head_commit": "76df81759b87ae939b7f4b094587247ae237c342"}
{"ts": "2026-05-18T06:56:45.563809+08:00", "session_id": "20260518_060002_cd0c45", "market": "cn", "formula": "rank(ts_min(amount/circ_market_cap,20)/ts_max(amount/circ_market_cap,20))", "name": "float_flow_floor_peak_20", "is_ic": 0.0, "is_ic_ir": 0.0, "is_sharpe": 0.0, "is_turnover": 0.0, "is_monotonicity": 0.0, "gates": "FAIL", "status": "reverted", "eval_seconds": 178.9, "sleeve_id": "cn_ai_infra_baseflow", "mispricing_source": "The market overweights visible spike-volume narratives and underweights continuous base-flow absorption; float normalization makes this a participation-quality signal rather than a simple size or candle-shape factor.", "forced_counterparty": "Short-horizon retail chasers and catalyst-driven holders who sell or ignore quiet names until a headline or breakout appears.", "data_requirements": "[\"daily amount\",\"circ_market_cap\",\"AI universe membership from ai_infra\",\"beta-hedged sleeve attribution vs 000300.SH/399006.SZ before promotion\",\"source evidence only if narrative later claims a specific supplier/customer link\"]", "failure_mode": "It should decay when policy/news shock regimes reward one-day burst volume over quiet accumulation, or when suspensions/illiquidity make the 20-day minimum mechanically noisy.", "report_contract": "fresh_buy_gate", "ai_supercycle_layer": "ai_chip_equipment_materials_packaging", "supply_chain_hypothesis": "Domestic AI bottleneck names in equipment/materials/advanced packaging should show persistent float-adjusted baseflow before source-confirmed order, capex, or backlog disclosures.", "relationship_evidence_required": "true", "money_readiness": "money_candidate", "decision": "revert", "session_branch": "main", "base_ref": "origin/main", "merge_base": "76df81759b87ae939b7f4b094587247ae237c342", "head_commit": "76df81759b87ae939b7f4b094587247ae237c342"}
{"ts": "2026-05-18T06:56:45.563809+08:00", "session_id": "20260518_060002_cd0c45", "market": "cn", "formula": "rank(-ts_max(ret_1d,20))*rank(ts_mean(turnover_rate,20)/ts_max(turnover_rate,20))", "name": "low_lottery_turnover_evenness_20", "is_ic": 0.0, "is_ic_ir": 0.0, "is_sharpe": 0.0, "is_turnover": 0.0, "is_monotonicity": 0.0, "gates": "FAIL", "status": "reverted", "eval_seconds": 166.1, "sleeve_id": "daily_price_overlay", "mispricing_source": "Lottery-preference overpricing of flashy spike days and underreaction to quiet institutional ownership transfer in validated AI-infra names.", "forced_counterparty": "Retail theme chasers and short-horizon de-riskers who rotate toward recent spike names; benchmarked funds that must scale into desired names slowly rather than crossing the spread aggressively.", "data_requirements": "[\"ret_1d and turnover_rate daily history are sufficient for first-pass IS testing\", \"ai_infra universe membership and source-review status for trading eligibility\", \"portfolio beta/residual attribution vs 000300.SH and 399006.SZ before promotion\"]", "failure_mode": "Fails in policy-squeeze or clean breakout regimes where concentrated spike days carry real information and even turnover just proxies for dull liquidity.", "report_contract": "setup_overlay", "ai_supercycle_layer": "ai_chip_equipment_materials_packaging", "supply_chain_hypothesis": "Validated CN semicap, materials, packaging, and test names with real AI capex exposure should show quiet non-lottery tape and even turnover before backlog or qualification evidence is fully priced.", "relationship_evidence_required": "true", "money_readiness": "research_only", "decision": "revert", "session_branch": "main", "base_ref": "origin/main", "merge_base": "76df81759b87ae939b7f4b094587247ae237c342", "head_commit": "76df81759b87ae939b7f4b094587247ae237c342"}
{"ts": "2026-05-18T06:56:45.563809+08:00", "session_id": "20260518_060002_cd0c45", "market": "cn", "formula": "rank(ret_20d/(ts_std(turnover_rate,20)+0.01))", "name": "stable_churn_momo_20", "is_ic": 0.0, "is_ic_ir": 0.0, "is_sharpe": 0.0, "is_turnover": 0.0, "is_monotonicity": 0.0, "gates": "FAIL", "status": "reverted", "eval_seconds": 131.7, "sleeve_id": "cn_ai_leadership_continuation", "mispricing_source": "Slow institutional accumulation and benchmark-driven reallocation into AI leaders, while the market overpays for noisy short-horizon turnover bursts and underreacts to orderly demand.", "forced_counterparty": "Short-horizon retail profit-takers and fast theme rotators operating under T+1 and attention constraints.", "data_requirements": "[\"daily close\",\"daily turnover_rate\",\"CN AI universe membership\",\"CN benchmark series for beta-hedge attribution\",\"rolling sleeve correlation and residual risk attribution\"]", "failure_mode": "Fails in rumor-squeeze regimes where high-churn speculation dominates, or in broad mean-reversion tapes where 20-day leadership stops persisting.", "report_contract": "fresh_buy_gate", "ai_supercycle_layer": "ai_datacenter_edge_infra", "supply_chain_hypothesis": "Candidate discovery only: orderly 20-day leadership with low turnover dispersion should surface datacenter, optical, server, and power-delivery bottleneck names before the broader market fully reprices AI capex propagation.", "relationship_evidence_required": "true", "money_readiness": "money_candidate", "decision": "revert", "session_branch": "main", "base_ref": "origin/main", "merge_base": "76df81759b87ae939b7f4b094587247ae237c342", "head_commit": "76df81759b87ae939b7f4b094587247ae237c342"}
{"ts": "2026-05-18T06:56:45.563809+08:00", "session_id": "20260518_060002_cd0c45", "market": "cn", "formula": "rank((ts_mean(amount,20)/ts_std(amount,20))*(ret_20d-ret_5d))", "name": "stable_amount_digest_20", "is_ic": 0.0, "is_ic_ir": 0.0, "is_sharpe": 0.0, "is_turnover": 0.0, "is_monotonicity": 0.0, "gates": "FAIL", "status": "reverted", "eval_seconds": 76.8, "sleeve_id": "cn_ai_accumulation_pullback", "mispricing_source": "A-share retail and benchmarked funds overreact to recent 5-day softness, while stable 20-day amount indicates institutional accumulation in AI-capex leaders; this targets accumulation quality rather than a pure price-momentum clone.", "forced_counterparty": "short-horizon retail profit-takers and benchmark-constrained managers trimming after near-term drawdowns", "data_requirements": "[\"daily amount and return history for factor calc\",\"beta-hedged sleeve attribution vs 000300.SH and 399006.SZ before promotion\",\"filings/PRs/transcripts if any optical/CPO order claim is attached\"]", "failure_mode": "It stops working when stable amount is just passive liquidity in large caps, or when the market shifts from AI bottleneck stock-picking to indiscriminate macro beta/risk-off selling.", "report_contract": "fresh_buy_gate", "ai_supercycle_layer": "ai_networking_optical_cpo", "supply_chain_hypothesis": "If AI cluster capex is tightening optical interconnect and CPO delivery, CN optical/fiber names should show steady-amount pullback accumulation before public order confirmation.", "relationship_evidence_required": "true", "money_readiness": "money_candidate", "decision": "revert", "session_branch": "main", "base_ref": "origin/main", "merge_base": "76df81759b87ae939b7f4b094587247ae237c342", "head_commit": "76df81759b87ae939b7f4b094587247ae237c342"}
{"ts": "2026-05-18T06:56:45.563809+08:00", "session_id": "20260518_060002_cd0c45", "market": "cn", "formula": "rank(-ts_std(delta(log(amount), 5), 20))", "name": "log_amount_change_stability_20_5", "is_ic": 0.0, "is_ic_ir": 0.0, "is_sharpe": 0.0, "is_turnover": 0.0, "is_monotonicity": 0.0, "gates": "FAIL", "status": "reverted", "eval_seconds": 145.8, "sleeve_id": "cn_ai_flow_quality", "mispricing_source": "The market underreacts to slow institutional accumulation and overreacts to bursty attention spikes, so steady flow quality is underpriced in the daily cross-section.", "forced_counterparty": "Retail momentum chasers and benchmark-constrained allocators trading around liquidity windows", "data_requirements": "[\"daily price+amount for CN AI-universe names\",\"beta-hedge attribution vs 000300.SH and 399006.SZ\",\"sleeve correlation to existing factors\",\"evidence cards/relationship ledger if used to claim specific domestic-substitution links\"]", "failure_mode": "It stops working when policy/headline bursts dominate tape and orderly accumulation no longer leads returns, or when stable amount mostly reflects illiquidity instead of sponsorship.", "report_contract": "fresh_buy_gate", "ai_supercycle_layer": "ai_chip_equipment_materials_packaging", "supply_chain_hypothesis": "Domestic AI chip-equipment/materials/packaging bottlenecks should show smooth amount repricing before explicit order, earnings, or policy confirmation.", "relationship_evidence_required": "true", "money_readiness": "money_candidate", "decision": "revert", "session_branch": "main", "base_ref": "origin/main", "merge_base": "76df81759b87ae939b7f4b094587247ae237c342", "head_commit": "76df81759b87ae939b7f4b094587247ae237c342"}
{"ts": "2026-05-18T06:56:45.563809+08:00", "session_id": "20260518_060002_cd0c45", "market": "cn", "formula": "rank(ts_std(amount,60)/ts_std(decay_linear(amount,5),20))", "name": "amount_quiet_compress_20_60", "is_ic": 0.0, "is_ic_ir": 0.0, "is_sharpe": 0.0, "is_turnover": 0.0, "is_monotonicity": 0.0, "gates": "FAIL", "status": "reverted", "eval_seconds": 191.3, "sleeve_id": "cn_ai_flow_regime", "mispricing_source": "The market overpays for obvious AI-theme bursts and underprices the quieter re-accumulation phase because it lacks headline confirmation and is slower for fast capital to arbitrage.", "forced_counterparty": "theme-chasing retail and benchmarked managers forced to de-risk after volatility spikes", "data_requirements": "[\"daily amount is sufficient for IS test\", \"for promotion require ai_infra source-review status, sleeve correlation vs existing factors, and beta-hedged attribution vs 000300.SH/399006.SZ/399006.SZ proxies\"]", "failure_mode": "It fails if lower recent amount volatility reflects demand evaporation rather than absorption, or if the regime rewards still-crowded high-turnover squeeze leaders.", "report_contract": "setup_overlay", "ai_supercycle_layer": "none", "supply_chain_hypothesis": "Cross-layer D1-D3 AI bottleneck suppliers often trade through a noisy discovery burst, then enter a quiet float-absorption phase before the next capex or order repricing; this factor is meant to surface that phase without asserting any unverified supplier link.", "relationship_evidence_required": "true", "money_readiness": "research_only", "decision": "revert", "session_branch": "main", "base_ref": "origin/main", "merge_base": "76df81759b87ae939b7f4b094587247ae237c342", "head_commit": "76df81759b87ae939b7f4b094587247ae237c342"}
{"ts": "2026-05-18T06:56:45.563809+08:00", "session_id": "20260518_060002_cd0c45", "market": "cn", "formula": "rank(ts_mean(turnover_rate,20)/ts_max(turnover_rate,20))*rank(close/ts_max(high,20))", "name": "even_turnover_nearhigh_20", "is_ic": 0.0, "is_ic_ir": 0.0, "is_sharpe": 0.0, "is_turnover": 0.0, "is_monotonicity": 0.0, "gates": "FAIL", "status": "reverted", "eval_seconds": 142.4, "sleeve_id": "cn_ai_accumulation_overlay", "mispricing_source": "Slow inventory transfer into scarce-float AI-infra leaders is underreacted to because the tape looks “quiet” during shallow consolidations even though sponsorship is persistent.", "forced_counterparty": "Retail spike-chasers and short-horizon traders who sell or rotate after turnover bursts, providing liquidity during orderly digestion.", "data_requirements": "[\"turnover_rate\",\"close\",\"high\",\"ai_infra universe membership\",\"000300.SH/399006.SZ benchmark series for beta-hedged and residual attribution\"]", "failure_mode": "Fails in violent mean-reversion or pure limit-up speculation regimes, where near-high positioning becomes crowded and stable turnover no longer signals informed accumulation.", "report_contract": "fresh_buy_gate", "ai_supercycle_layer": "none", "supply_chain_hypothesis": "Orderly float-turnover absorption should preferentially surface AI-infra bottleneck leaders across the current CN universe before verified order/backlog evidence is fully reflected in price.", "relationship_evidence_required": "true", "money_readiness": "money_candidate", "decision": "revert", "session_branch": "main", "base_ref": "origin/main", "merge_base": "76df81759b87ae939b7f4b094587247ae237c342", "head_commit": "76df81759b87ae939b7f4b094587247ae237c342"}
{"ts": "2026-05-18T06:56:45.563809+08:00", "session_id": "20260518_060002_cd0c45", "market": "cn", "formula": "rank(-ps_ttm)*rank(ret_20d-ret_5d)", "name": "value_digest_leader_20", "is_ic": 0.0, "is_ic_ir": 0.0, "is_sharpe": 0.0, "is_turnover": 0.0, "is_monotonicity": 0.0, "gates": "FAIL", "status": "reverted", "eval_seconds": 103.6, "sleeve_id": "cn_ai_infra_rotation", "mispricing_source": "Benchmark and retail capital overpay for the most visible AI concept leaders, while cheaper but still tape-resilient supply-chain names rerate with a lag as evidence spreads.", "forced_counterparty": "benchmark-constrained growth funds concentrated in high-PS headline leaders; retail T+1 traders exiting mild pullbacks", "data_requirements": "[\"current daily OHLCV + ps_ttm suffice for IS test\", \"before promotion require beta-hedged sleeve PnL, residual risk attribution, sleeve correlation, and ai_infra source-review status\"]", "failure_mode": "Fails in speculative melt-up regimes where expensive leaders keep widening multiples, or in broad risk-off tape where 20-day leadership no longer reflects persistent AI demand.", "report_contract": "fresh_buy_gate", "ai_supercycle_layer": "ai_chip_equipment_materials_packaging", "supply_chain_hypothesis": "D1 compute spending should diffuse into cheaper D2-D4 domestic equipment/materials/packaging names after short pullbacks, creating delayed rerating inside the validated AI-infra universe.", "relationship_evidence_required": "true", "money_readiness": "money_candidate", "decision": "revert", "session_branch": "main", "base_ref": "origin/main", "merge_base": "76df81759b87ae939b7f4b094587247ae237c342", "head_commit": "76df81759b87ae939b7f4b094587247ae237c342"}
{"ts": "2026-05-18T06:56:45.563809+08:00", "session_id": "20260518_060002_cd0c45", "market": "cn", "formula": "rank(-ts_corr(ret_1d,shift(ret_1d,1),20))*rank(ts_mean((high-close)/(high-low+0.01),5))", "name": "autocorr_kshadow_absorb_20_5", "is_ic": 0.0, "is_ic_ir": 0.0, "is_sharpe": 0.0, "is_turnover": 0.0, "is_monotonicity": 0.0, "gates": "FAIL", "status": "reverted", "eval_seconds": 133.7, "sleeve_id": "cn_ai_tape_absorption", "mispricing_source": "Forced short-horizon selling creates visible upper shadows, but weak follow-through reveals absorption; this is not just another price factor because it requires both intraday supply pressure and failed day-to-day continuation.", "forced_counterparty": "Retail T+1 profit-takers, margin-linked sellers, and benchmarked long-only funds trimming on noisy tape", "data_requirements": "[\"daily OHLCV\",\"beta-hedged sleeve attribution vs 000300.SH and 399006.SZ\",\"rolling correlation vs kshadow_5 and other promoted CN sleeves\",\"residual risk attribution by AI module/BFS depth\",\"source-review status before any name-specific supply-chain narrative\"]", "failure_mode": "It fails in one-way breakout or panic/liquidation regimes where upper wicks reflect true distribution and negative autocorrelation is just macro whipsaw rather than informed absorption.", "report_contract": "setup_overlay", "ai_supercycle_layer": "ai_chip_equipment_materials_packaging", "supply_chain_hypothesis": "Validated D1-D3 domestic AI hardware bottleneck names can show repeated intraday profit-taking absorption before backlog, order, or capex evidence is fully capitalized by the tape.", "relationship_evidence_required": "true", "money_readiness": "research_only", "decision": "revert", "session_branch": "main", "base_ref": "origin/main", "merge_base": "76df81759b87ae939b7f4b094587247ae237c342", "head_commit": "76df81759b87ae939b7f4b094587247ae237c342"}
{"ts": "2026-05-18T06:56:45.563809+08:00", "session_id": "20260518_060002_cd0c45", "market": "cn", "formula": "rank(ts_mean(amount/circ_market_cap,20))-rank(ts_std(amount/circ_market_cap,20))", "name": "float_absorption_stability_20", "is_ic": 0.0, "is_ic_ir": 0.0, "is_sharpe": 0.0, "is_turnover": 0.0, "is_monotonicity": 0.0, "gates": "FAIL", "status": "reverted", "eval_seconds": 124.9, "sleeve_id": "cn_ai_infra_flow_overlay", "mispricing_source": "A-share participants overreact to noisy headline spikes, while slower institutional accumulation in validated AI-infra names is underpriced until tape strength persists and evidence catches up.", "forced_counterparty": "Retail theme traders and benchmark-aware long-only funds that must provide liquidity during rebalances or quick profit-taking.", "data_requirements": "[\"daily OHLCV\",\"amount\",\"circ_market_cap\",\"ai_infra universe/source-review status\",\"000001.SH/399001.SZ/399006.SZ/000300.SH benchmark series for beta-hedged attribution\",\"official filings/press releases before asserting supplier-customer links\"]", "failure_mode": "It fails if the signal collapses into a small-cap illiquidity screen or if policy/news shocks drive gap repricing that bypasses gradual absorption.", "report_contract": "fresh_buy_gate", "ai_supercycle_layer": "ai_chip_equipment_materials_packaging", "supply_chain_hypothesis": "Domestic tool, material, and advanced-packaging bottleneck names tied to accelerator capacity expansion should show steady float absorption before backlog conversion is fully recognized.", "relationship_evidence_required": "true", "money_readiness": "money_candidate", "decision": "revert", "session_branch": "main", "base_ref": "origin/main", "merge_base": "76df81759b87ae939b7f4b094587247ae237c342", "head_commit": "76df81759b87ae939b7f4b094587247ae237c342"}
{"ts": "2026-05-18T06:56:45.563809+08:00", "session_id": "20260518_060002_cd0c45", "market": "cn", "formula": "rank(-ts_corr(ret_1d,shift(ret_1d,1),20))*rank(ts_mean(turnover_rate,20)/ts_std(turnover_rate,20))", "name": "anti_autocorr_turnover_absorb_20", "is_ic": 0.0, "is_ic_ir": 0.0, "is_sharpe": 0.0, "is_turnover": 0.0, "is_monotonicity": 0.0, "gates": "FAIL", "status": "reverted", "eval_seconds": 105.9, "sleeve_id": "cn_ai_flow_absorption", "mispricing_source": "Short-horizon retail and fast-money flows overreact to daily moves, while slower institutional capital accumulates verified AI-infra names in an orderly way; this is a flow-quality sleeve, not a candle-shape clone of `kshadow_5`.", "forced_counterparty": "Retail T+1 churn and thematic momentum accounts that must recycle inventory quickly after headline-driven moves", "data_requirements": "[\"daily ret_1d and turnover_rate history\",\"AI-universe membership/evidence-card status\",\"benchmark beta-hedge and residual-return attribution\",\"sleeve correlation vs existing promoted factors\"]", "failure_mode": "Stops working in one-way momentum or policy-liquidity regimes where positive autocorrelation dominates and stable turnover reflects crowding instead of absorption.", "report_contract": "action_overlay", "ai_supercycle_layer": "ai_networking_optical_cpo", "supply_chain_hypothesis": "Within the verified CN AI-infra universe, optical/interconnect bottleneck names should show anti-autocorrelated pullbacks with stable turnover when global AI datacenter capex is being accumulated through the tape.", "relationship_evidence_required": "true", "money_readiness": "research_only", "decision": "revert", "session_branch": "main", "base_ref": "origin/main", "merge_base": "76df81759b87ae939b7f4b094587247ae237c342", "head_commit": "76df81759b87ae939b7f4b094587247ae237c342"}
