{"ts": "2026-04-30T14:56:48.184268+08:00", "session_id": "20260430_140017_d1f7c5", "market": "cn", "formula": "rank(-ts_corr(ret_1d,shift(ret_1d,1),20))*rank(ts_min(turnover_rate,20)/ts_max(turnover_rate,20))", "name": "anti_autocorr_turnover_corridor_20", "is_ic": 0.0383, "is_ic_ir": 0.49, "is_sharpe": 4.135, "is_turnover": 0.169, "is_monotonicity": 0.4, "gates": "PASS", "status": "checks_failed", "eval_seconds": 136.5, "decision": "revert", "session_branch": "main", "base_ref": "origin/main", "merge_base": "7e71edc0d50443d3db4f0dd72c25238cd7ac1282", "head_commit": "7e71edc0d50443d3db4f0dd72c25238cd7ac1282", "oos": "PASS", "checks_status": "failed"}
{"ts": "2026-04-30T14:56:48.184268+08:00", "session_id": "20260430_140017_d1f7c5", "market": "cn", "formula": "rank(ts_mean(ts_sum(amount/circ_market_cap,5),20)/ts_max(ts_sum(amount/circ_market_cap,5),20))", "name": "weekly_float_evenness_20", "is_ic": 0.0274, "is_ic_ir": 0.299, "is_sharpe": 0.473, "is_turnover": 0.129, "is_monotonicity": 0.9, "gates": "PASS", "status": "candidate", "eval_seconds": 189.2, "decision": "candidate", "session_branch": "main", "base_ref": "origin/main", "merge_base": "7e71edc0d50443d3db4f0dd72c25238cd7ac1282", "head_commit": "7e71edc0d50443d3db4f0dd72c25238cd7ac1282"}
{"ts": "2026-04-30T14:56:48.184268+08:00", "session_id": "20260430_140017_d1f7c5", "market": "cn", "formula": "rank(-ts_corr(ret_1d,shift(ret_1d,1),20))*rank(ts_min(ts_sum(volume_ratio,5),20)/ts_mean(ts_sum(volume_ratio,5),20))", "name": "anti_autocorr_weekly_relvol_floor_20", "is_ic": 0.0371, "is_ic_ir": 0.434, "is_sharpe": 3.783, "is_turnover": 0.162, "is_monotonicity": 0.35, "gates": "PASS", "status": "candidate", "eval_seconds": 80.0, "decision": "candidate", "session_branch": "main", "base_ref": "origin/main", "merge_base": "7e71edc0d50443d3db4f0dd72c25238cd7ac1282", "head_commit": "7e71edc0d50443d3db4f0dd72c25238cd7ac1282"}
{"ts": "2026-04-30T14:56:48.184268+08:00", "session_id": "20260430_140017_d1f7c5", "market": "cn", "formula": "rank(-ts_corr(ret_1d,shift(ret_1d,1),40))*rank(ts_min(ts_sum(volume_ratio,5),20)/ts_mean(ts_sum(volume_ratio,5),20))", "name": "anti_autocorr40_weekly_relvol_floor_20", "is_ic": 0.0279, "is_ic_ir": 0.286, "is_sharpe": 2.125, "is_turnover": 0.132, "is_monotonicity": 0.3, "gates": "PASS", "status": "candidate", "eval_seconds": 168.4, "decision": "candidate", "session_branch": "main", "base_ref": "origin/main", "merge_base": "7e71edc0d50443d3db4f0dd72c25238cd7ac1282", "head_commit": "7e71edc0d50443d3db4f0dd72c25238cd7ac1282"}
{"ts": "2026-04-30T14:56:48.184268+08:00", "session_id": "20260430_140017_d1f7c5", "market": "cn", "formula": "rank(-ts_corr(ret_1d,shift(ret_1d,1),40))*rank(ts_min(ts_sum(amount/circ_market_cap,5),20)/ts_mean(ts_sum(amount/circ_market_cap,5),20))", "name": "anti_autocorr40_weekly_floatflow_floor_20", "is_ic": 0.0253, "is_ic_ir": 0.241, "is_sharpe": 1.898, "is_turnover": 0.133, "is_monotonicity": 0.5, "gates": "PASS", "status": "candidate", "eval_seconds": 136.8, "decision": "candidate", "session_branch": "main", "base_ref": "origin/main", "merge_base": "7e71edc0d50443d3db4f0dd72c25238cd7ac1282", "head_commit": "7e71edc0d50443d3db4f0dd72c25238cd7ac1282"}
{"ts": "2026-04-30T14:56:48.184268+08:00", "session_id": "20260430_140017_d1f7c5", "market": "cn", "formula": "rank(-pb)*rank(-ts_std(amount,20)/ts_mean(amount,20))", "name": "pb_amount_stability_20", "is_ic": 0.0372, "is_ic_ir": 0.209, "is_sharpe": -0.227, "is_turnover": 0.08, "is_monotonicity": -0.05, "gates": "PASS", "status": "candidate", "eval_seconds": 95.0, "decision": "candidate", "session_branch": "main", "base_ref": "origin/main", "merge_base": "7e71edc0d50443d3db4f0dd72c25238cd7ac1282", "head_commit": "7e71edc0d50443d3db4f0dd72c25238cd7ac1282"}
{"ts": "2026-04-30T14:56:48.184268+08:00", "session_id": "20260430_140017_d1f7c5", "market": "cn", "formula": "rank(-ts_corr(ret_1d,shift(ret_1d,1),20))*rank(ts_min(ts_sum(amount/circ_market_cap,5),20)/ts_mean(ts_sum(amount/circ_market_cap,5),20))", "name": "anti_autocorr_weekly_floatflow_floor_20", "is_ic": 0.036, "is_ic_ir": 0.398, "is_sharpe": 3.528, "is_turnover": 0.166, "is_monotonicity": 0.6, "gates": "PASS", "status": "candidate", "eval_seconds": 222.1, "decision": "candidate", "session_branch": "main", "base_ref": "origin/main", "merge_base": "7e71edc0d50443d3db4f0dd72c25238cd7ac1282", "head_commit": "7e71edc0d50443d3db4f0dd72c25238cd7ac1282"}
{"ts": "2026-04-30T14:56:48.184268+08:00", "session_id": "20260430_140017_d1f7c5", "market": "cn", "formula": "rank(-ts_corr(ret_1d,shift(ret_1d,1),20))*rank(-ts_std(ts_sum(amount,5),20)/ts_mean(ts_sum(amount,5),20))", "name": "anti_autocorr_weekly_amount_level_stability_20", "is_ic": 0.0345, "is_ic_ir": 0.431, "is_sharpe": 3.463, "is_turnover": 0.15, "is_monotonicity": 0.25, "gates": "PASS", "status": "candidate", "eval_seconds": 237.8, "decision": "candidate", "session_branch": "main", "base_ref": "origin/main", "merge_base": "7e71edc0d50443d3db4f0dd72c25238cd7ac1282", "head_commit": "7e71edc0d50443d3db4f0dd72c25238cd7ac1282"}
{"ts": "2026-04-30T14:56:48.184268+08:00", "session_id": "20260430_140017_d1f7c5", "market": "cn", "formula": "rank(-ts_corr(ret_1d,shift(ret_1d,1),20))*rank(ts_mean(ts_sum(turnover_rate,5),20)/ts_max(ts_sum(turnover_rate,5),20))", "name": "anti_autocorr_weekly_turnover_evenness_20", "is_ic": 0.0372, "is_ic_ir": 0.479, "is_sharpe": 3.253, "is_turnover": 0.17, "is_monotonicity": 0.5, "gates": "PASS", "status": "candidate", "eval_seconds": 110.6, "decision": "candidate", "session_branch": "main", "base_ref": "origin/main", "merge_base": "7e71edc0d50443d3db4f0dd72c25238cd7ac1282", "head_commit": "7e71edc0d50443d3db4f0dd72c25238cd7ac1282"}
{"ts": "2026-04-30T14:56:48.184268+08:00", "session_id": "20260430_140017_d1f7c5", "market": "cn", "formula": "rank(-ts_corr(ret_1d,shift(ret_1d,1),20))*rank(ts_mean(ts_sum(amount,5),20)/ts_max(ts_sum(amount,5),20))", "name": "anti_autocorr_weekly_amount_evenness_20", "is_ic": 0.0367, "is_ic_ir": 0.473, "is_sharpe": 3.934, "is_turnover": 0.167, "is_monotonicity": 0.35, "gates": "PASS", "status": "candidate", "eval_seconds": 110.3, "decision": "candidate", "session_branch": "main", "base_ref": "origin/main", "merge_base": "7e71edc0d50443d3db4f0dd72c25238cd7ac1282", "head_commit": "7e71edc0d50443d3db4f0dd72c25238cd7ac1282"}
{"ts": "2026-04-30T14:56:48.184268+08:00", "session_id": "20260430_140017_d1f7c5", "market": "cn", "formula": "rank(-ts_corr(ret_1d,shift(ret_1d,1),20))*rank(-ts_std(ts_sum(open/close,5),20)/ts_mean(ts_sum(open/close,5),20))", "name": "anti_autocorr_weekly_openclose_stability_20", "is_ic": 0.0333, "is_ic_ir": 0.321, "is_sharpe": 1.404, "is_turnover": 0.142, "is_monotonicity": -0.05, "gates": "PASS", "status": "candidate", "eval_seconds": 120.8, "decision": "candidate", "session_branch": "main", "base_ref": "origin/main", "merge_base": "7e71edc0d50443d3db4f0dd72c25238cd7ac1282", "head_commit": "7e71edc0d50443d3db4f0dd72c25238cd7ac1282"}
{"ts": "2026-04-30T14:56:48.184268+08:00", "session_id": "20260430_140017_d1f7c5", "market": "cn", "formula": "rank(-ts_corr(ret_1d,shift(ret_1d,1),20))*rank(ts_min(amount/circ_market_cap,20)/ts_mean(amount/circ_market_cap,20))", "name": "anti_autocorr_float_floor_20", "is_ic": 0.0377, "is_ic_ir": 0.44, "is_sharpe": 1.595, "is_turnover": 0.178, "is_monotonicity": 0.4, "gates": "PASS", "status": "candidate", "eval_seconds": 104.3, "decision": "candidate", "session_branch": "main", "base_ref": "origin/main", "merge_base": "7e71edc0d50443d3db4f0dd72c25238cd7ac1282", "head_commit": "7e71edc0d50443d3db4f0dd72c25238cd7ac1282"}
{"ts": "2026-04-30T14:56:48.184268+08:00", "session_id": "20260430_140017_d1f7c5", "market": "cn", "formula": "rank(-ts_corr(ret_1d,shift(ret_1d,1),20))*rank(ts_min(ts_sum(amount,5),20)/ts_mean(ts_sum(amount,5),20))", "name": "anti_autocorr_weekly_amount_floor_20", "is_ic": 0.0348, "is_ic_ir": 0.392, "is_sharpe": 2.992, "is_turnover": 0.164, "is_monotonicity": 0.15, "gates": "PASS", "status": "candidate", "eval_seconds": 167.1, "decision": "candidate", "session_branch": "main", "base_ref": "origin/main", "merge_base": "7e71edc0d50443d3db4f0dd72c25238cd7ac1282", "head_commit": "7e71edc0d50443d3db4f0dd72c25238cd7ac1282"}
{"ts": "2026-04-30T14:56:48.184268+08:00", "session_id": "20260430_140017_d1f7c5", "market": "cn", "formula": "rank(ts_min(turnover_rate, 20) / ts_mean(turnover_rate, 20)) * rank(-ret_5d)", "name": "turnover_floor_reversal_20", "is_ic": 0.0249, "is_ic_ir": 0.152, "is_sharpe": -2.664, "is_turnover": 0.277, "is_monotonicity": 0.35, "gates": "FAIL", "status": "reverted", "eval_seconds": 114.8, "decision": "revert", "session_branch": "main", "base_ref": "origin/main", "merge_base": "7e71edc0d50443d3db4f0dd72c25238cd7ac1282", "head_commit": "7e71edc0d50443d3db4f0dd72c25238cd7ac1282"}
{"ts": "2026-04-30T14:56:48.184268+08:00", "session_id": "20260430_140017_d1f7c5", "market": "cn", "formula": "rank(-ts_corr(ret_1d,shift(ret_1d,1),20))*rank(ts_min(volume_ratio,20)/ts_max(volume_ratio,20))", "name": "anti_autocorr_relvol_corridor_20", "is_ic": 0.0339, "is_ic_ir": 0.416, "is_sharpe": 2.188, "is_turnover": 0.167, "is_monotonicity": 0.0, "gates": "PASS", "status": "candidate", "eval_seconds": 150.2, "decision": "candidate", "session_branch": "main", "base_ref": "origin/main", "merge_base": "7e71edc0d50443d3db4f0dd72c25238cd7ac1282", "head_commit": "7e71edc0d50443d3db4f0dd72c25238cd7ac1282"}
{"ts": "2026-04-30T14:56:48.184268+08:00", "session_id": "20260430_140017_d1f7c5", "market": "cn", "formula": "rank(-ts_corr(ret_1d, shift(ret_1d,1),20)) * rank(-ts_max(ret_1d,20))", "name": "autocorr_low_lottery_20", "is_ic": 0.0444, "is_ic_ir": 0.374, "is_sharpe": 0.945, "is_turnover": 0.152, "is_monotonicity": 0.05, "gates": "PASS", "status": "checks_failed", "eval_seconds": 179.2, "decision": "revert", "session_branch": "main", "base_ref": "origin/main", "merge_base": "7e71edc0d50443d3db4f0dd72c25238cd7ac1282", "head_commit": "7e71edc0d50443d3db4f0dd72c25238cd7ac1282", "oos": "PASS", "checks_status": "failed"}
{"ts": "2026-04-30T14:56:48.184268+08:00", "session_id": "20260430_140017_d1f7c5", "market": "cn", "formula": "rank(-ts_corr(ret_1d,shift(ret_1d,1),20))*rank(-ts_mean(abs(delta(volume_ratio,5)),20))", "name": "anti_autocorr_relvol_change_smooth_20", "is_ic": 0.0408, "is_ic_ir": 0.446, "is_sharpe": 3.163, "is_turnover": 0.155, "is_monotonicity": 0.15, "gates": "PASS", "status": "checks_failed", "eval_seconds": 197.1, "decision": "revert", "session_branch": "main", "base_ref": "origin/main", "merge_base": "7e71edc0d50443d3db4f0dd72c25238cd7ac1282", "head_commit": "7e71edc0d50443d3db4f0dd72c25238cd7ac1282", "oos": "PASS", "checks_status": "failed"}
{"ts": "2026-04-30T14:56:48.184268+08:00", "session_id": "20260430_140017_d1f7c5", "market": "cn", "formula": "rank(-ts_corr(ret_1d,shift(ret_1d,1),20))*rank(ts_mean(ts_sum(volume_ratio,5),20)/ts_max(ts_sum(volume_ratio,5),20))", "name": "anti_autocorr_weekly_relvol_evenness_20", "is_ic": 0.0362, "is_ic_ir": 0.466, "is_sharpe": 2.861, "is_turnover": 0.162, "is_monotonicity": 0.3, "gates": "PASS", "status": "candidate", "eval_seconds": 149.2, "decision": "candidate", "session_branch": "main", "base_ref": "origin/main", "merge_base": "7e71edc0d50443d3db4f0dd72c25238cd7ac1282", "head_commit": "7e71edc0d50443d3db4f0dd72c25238cd7ac1282"}
{"ts": "2026-04-30T14:56:48.184268+08:00", "session_id": "20260430_140017_d1f7c5", "market": "cn", "formula": "rank(-ts_corr(ret_1d,shift(ret_1d,1),20))*rank(-ts_std(delta(turnover_rate,5),20)/ts_std(delta(turnover_rate,5),60))", "name": "anti_autocorr_turnshock_compress_20_60", "is_ic": 0.0258, "is_ic_ir": 0.182, "is_sharpe": 0.35, "is_turnover": 0.16, "is_monotonicity": 0.0, "gates": "FAIL", "status": "reverted", "eval_seconds": 172.3, "decision": "revert", "session_branch": "main", "base_ref": "origin/main", "merge_base": "7e71edc0d50443d3db4f0dd72c25238cd7ac1282", "head_commit": "7e71edc0d50443d3db4f0dd72c25238cd7ac1282"}
{"ts": "2026-04-30T14:56:48.184268+08:00", "session_id": "20260430_140017_d1f7c5", "market": "cn", "formula": "rank(-ts_corr(ret_1d,shift(ret_1d,1),20))*rank(-ts_std(ts_sum(volume_ratio,5),20)/ts_mean(ts_sum(volume_ratio,5),20))", "name": "anti_autocorr_weekly_relvol_stability_20", "is_ic": 0.035, "is_ic_ir": 0.445, "is_sharpe": 3.792, "is_turnover": 0.147, "is_monotonicity": 0.3, "gates": "PASS", "status": "candidate", "eval_seconds": 153.8, "decision": "candidate", "session_branch": "main", "base_ref": "origin/main", "merge_base": "7e71edc0d50443d3db4f0dd72c25238cd7ac1282", "head_commit": "7e71edc0d50443d3db4f0dd72c25238cd7ac1282"}
{"ts": "2026-04-30T14:56:48.184268+08:00", "session_id": "20260430_140017_d1f7c5", "market": "cn", "formula": "rank(-ts_std(ts_mean(close/open,5),20))", "name": "weekly_openclose_stability_20", "is_ic": 0.0342, "is_ic_ir": 0.225, "is_sharpe": 0.277, "is_turnover": 0.078, "is_monotonicity": 0.0, "gates": "PASS", "status": "candidate", "eval_seconds": 128.5, "decision": "candidate", "session_branch": "main", "base_ref": "origin/main", "merge_base": "7e71edc0d50443d3db4f0dd72c25238cd7ac1282", "head_commit": "7e71edc0d50443d3db4f0dd72c25238cd7ac1282"}
{"ts": "2026-04-30T14:56:48.184268+08:00", "session_id": "20260430_140017_d1f7c5", "market": "cn", "formula": "rank(-ts_corr(ret_1d,shift(ret_1d,1),40))*rank(ts_min(ts_sum(turnover_rate,5),20)/ts_mean(ts_sum(turnover_rate,5),20))", "name": "anti_autocorr40_weekly_turnover_floor_20", "is_ic": 0.0252, "is_ic_ir": 0.24, "is_sharpe": 1.887, "is_turnover": 0.134, "is_monotonicity": 0.45, "gates": "PASS", "status": "candidate", "eval_seconds": 168.8, "decision": "candidate", "session_branch": "main", "base_ref": "origin/main", "merge_base": "7e71edc0d50443d3db4f0dd72c25238cd7ac1282", "head_commit": "7e71edc0d50443d3db4f0dd72c25238cd7ac1282"}
{"ts": "2026-04-30T14:56:48.184268+08:00", "session_id": "20260430_140017_d1f7c5", "market": "cn", "formula": "rank(-ts_corr(ret_1d,shift(ret_1d,1),20))*rank(-ts_std(ts_sum(turnover_rate,5),20)/ts_mean(ts_sum(turnover_rate,5),20))", "name": "anti_autocorr_weekly_turnover_stability_20", "is_ic": 0.0362, "is_ic_ir": 0.448, "is_sharpe": 3.558, "is_turnover": 0.151, "is_monotonicity": 0.65, "gates": "PASS", "status": "candidate", "eval_seconds": 108.8, "decision": "candidate", "session_branch": "main", "base_ref": "origin/main", "merge_base": "7e71edc0d50443d3db4f0dd72c25238cd7ac1282", "head_commit": "7e71edc0d50443d3db4f0dd72c25238cd7ac1282"}
{"ts": "2026-05-01T06:57:42.863289+08:00", "session_id": "20260501_060002_1da543", "market": "cn", "formula": "rank(-ts_mean(abs(pct_change(amount / circ_market_cap, 5)), 20))", "name": "float_weekly_flow_smooth_20", "is_ic": 0.0385, "is_ic_ir": 0.357, "is_sharpe": 1.274, "is_turnover": 0.111, "is_monotonicity": 0.1, "gates": "PASS", "status": "candidate", "eval_seconds": 170.1, "decision": "candidate", "session_branch": "main", "base_ref": "origin/main", "merge_base": "7e71edc0d50443d3db4f0dd72c25238cd7ac1282", "head_commit": "7e71edc0d50443d3db4f0dd72c25238cd7ac1282"}
{"ts": "2026-05-01T06:57:42.863289+08:00", "session_id": "20260501_060002_1da543", "market": "cn", "formula": "rank(ts_mean(amount / circ_market_cap, 20) / ts_std(amount / circ_market_cap, 20))", "name": "float_liquidity_stability_20", "is_ic": 0.0367, "is_ic_ir": 0.369, "is_sharpe": 1.412, "is_turnover": 0.12, "is_monotonicity": 0.7, "gates": "PASS", "status": "candidate", "eval_seconds": 36.1, "decision": "candidate", "session_branch": "main", "base_ref": "origin/main", "merge_base": "7e71edc0d50443d3db4f0dd72c25238cd7ac1282", "head_commit": "7e71edc0d50443d3db4f0dd72c25238cd7ac1282"}
{"ts": "2026-05-01T06:57:42.863289+08:00", "session_id": "20260501_060002_1da543", "market": "cn", "formula": "rank(-ts_corr(ret_1d,shift(ret_1d,1),20))*rank(ts_min(ts_sum(turnover_rate,5),20)/ts_max(ts_sum(turnover_rate,5),20))", "name": "anti_autocorr_weekly_turnover_corridor_20", "is_ic": 0.0379, "is_ic_ir": 0.454, "is_sharpe": 3.641, "is_turnover": 0.162, "is_monotonicity": 0.5, "gates": "PASS", "status": "candidate", "eval_seconds": 52.7, "decision": "candidate", "session_branch": "main", "base_ref": "origin/main", "merge_base": "7e71edc0d50443d3db4f0dd72c25238cd7ac1282", "head_commit": "7e71edc0d50443d3db4f0dd72c25238cd7ac1282"}
{"ts": "2026-05-01T06:57:42.863289+08:00", "session_id": "20260501_060002_1da543", "market": "cn", "formula": "rank(ts_std(amount / circ_market_cap, 60) / ts_std(amount / circ_market_cap, 20))", "name": "float_vol_compress_20_60", "is_ic": 0.0325, "is_ic_ir": 0.304, "is_sharpe": 2.538, "is_turnover": 0.111, "is_monotonicity": 0.65, "gates": "PASS", "status": "candidate", "eval_seconds": 200.2, "decision": "candidate", "session_branch": "main", "base_ref": "origin/main", "merge_base": "7e71edc0d50443d3db4f0dd72c25238cd7ac1282", "head_commit": "7e71edc0d50443d3db4f0dd72c25238cd7ac1282"}
{"ts": "2026-05-01T06:57:42.863289+08:00", "session_id": "20260501_060002_1da543", "market": "cn", "formula": "rank(-ts_corr(ret_1d, shift(ret_1d, 1), 20)) * rank(-(ts_max(amount,20)/ts_sum(amount,20)))", "name": "anti_autocorr_amount_spike_share_20", "is_ic": 0.0366, "is_ic_ir": 0.475, "is_sharpe": 2.167, "is_turnover": 0.174, "is_monotonicity": 0.15, "gates": "PASS", "status": "candidate", "eval_seconds": 187.7, "decision": "candidate", "session_branch": "main", "base_ref": "origin/main", "merge_base": "7e71edc0d50443d3db4f0dd72c25238cd7ac1282", "head_commit": "7e71edc0d50443d3db4f0dd72c25238cd7ac1282"}
{"ts": "2026-05-01T06:57:42.863289+08:00", "session_id": "20260501_060002_1da543", "market": "cn", "formula": "rank(pb)*rank(ts_mean(turnover_rate,5)/ts_mean(turnover_rate,20))", "name": "crowded_value_turnover_20", "is_ic": 0.024, "is_ic_ir": 0.14, "is_sharpe": -1.925, "is_turnover": 0.147, "is_monotonicity": -0.1, "gates": "FAIL", "status": "reverted", "eval_seconds": 54.0, "decision": "revert", "session_branch": "main", "base_ref": "origin/main", "merge_base": "7e71edc0d50443d3db4f0dd72c25238cd7ac1282", "head_commit": "7e71edc0d50443d3db4f0dd72c25238cd7ac1282"}
{"ts": "2026-05-01T06:57:42.863289+08:00", "session_id": "20260501_060002_1da543", "market": "cn", "formula": "rank(-ts_corr(ret_5d, turnover_rate, 20))", "name": "uncrowded_return_turnover_20", "is_ic": 0.0353, "is_ic_ir": 0.221, "is_sharpe": -0.226, "is_turnover": 0.126, "is_monotonicity": 0.05, "gates": "PASS", "status": "candidate", "eval_seconds": 52.1, "decision": "candidate", "session_branch": "main", "base_ref": "origin/main", "merge_base": "7e71edc0d50443d3db4f0dd72c25238cd7ac1282", "head_commit": "7e71edc0d50443d3db4f0dd72c25238cd7ac1282"}
{"ts": "2026-05-01T06:57:42.863289+08:00", "session_id": "20260501_060002_1da543", "market": "cn", "formula": "rank(-ts_corr(ret_1d,shift(ret_1d,1),20))*rank(-ts_std(ts_sum(turnover_rate,5),20)/ts_std(ts_sum(turnover_rate,5),60))", "name": "anti_autocorr_weekly_turnover_compress_20_60", "is_ic": 0.0302, "is_ic_ir": 0.194, "is_sharpe": 1.075, "is_turnover": 0.153, "is_monotonicity": 0.75, "gates": "FAIL", "status": "reverted", "eval_seconds": 171.0, "decision": "revert", "session_branch": "main", "base_ref": "origin/main", "merge_base": "7e71edc0d50443d3db4f0dd72c25238cd7ac1282", "head_commit": "7e71edc0d50443d3db4f0dd72c25238cd7ac1282"}
{"ts": "2026-05-01T06:57:42.863289+08:00", "session_id": "20260501_060002_1da543", "market": "cn", "formula": "rank(-ts_corr(volume_ratio,shift(volume_ratio,5),20)*ts_min(turnover_rate,20)/ts_mean(turnover_rate,20))", "name": "anti_autocorr_weekly_relvol_turnfloor_20", "is_ic": -0.008, "is_ic_ir": -0.083, "is_sharpe": -3.716, "is_turnover": 0.18, "is_monotonicity": -0.45, "gates": "FAIL", "status": "reverted", "eval_seconds": 138.7, "decision": "revert", "session_branch": "main", "base_ref": "origin/main", "merge_base": "7e71edc0d50443d3db4f0dd72c25238cd7ac1282", "head_commit": "7e71edc0d50443d3db4f0dd72c25238cd7ac1282"}
{"ts": "2026-05-01T06:57:42.863289+08:00", "session_id": "20260501_060002_1da543", "market": "cn", "formula": "rank(ts_mean(amount,20)/ts_std(amount,20)-ts_mean(amount,60)/ts_std(amount,60))", "name": "amount_stability_improve_20_60", "is_ic": 0.0227, "is_ic_ir": 0.194, "is_sharpe": 1.273, "is_turnover": 0.135, "is_monotonicity": 0.8, "gates": "FAIL", "status": "reverted", "eval_seconds": 112.2, "decision": "revert", "session_branch": "main", "base_ref": "origin/main", "merge_base": "7e71edc0d50443d3db4f0dd72c25238cd7ac1282", "head_commit": "7e71edc0d50443d3db4f0dd72c25238cd7ac1282"}
{"ts": "2026-05-01T06:57:42.863289+08:00", "session_id": "20260501_060002_1da543", "market": "cn", "formula": "rank(-ts_corr(ret_1d,shift(ret_1d,1),20))*rank(ts_min(amount/circ_market_cap,20)/ts_max(amount/circ_market_cap,20))", "name": "anti_autocorr_float_corridor_20", "is_ic": 0.0379, "is_ic_ir": 0.485, "is_sharpe": 4.003, "is_turnover": 0.169, "is_monotonicity": 0.4, "gates": "PASS", "status": "candidate", "eval_seconds": 172.4, "decision": "candidate", "session_branch": "main", "base_ref": "origin/main", "merge_base": "7e71edc0d50443d3db4f0dd72c25238cd7ac1282", "head_commit": "7e71edc0d50443d3db4f0dd72c25238cd7ac1282"}
{"ts": "2026-05-01T06:57:42.863289+08:00", "session_id": "20260501_060002_1da543", "market": "cn", "formula": "rank(-ts_corr(ret_1d, shift(ret_1d, 1), 20)) * rank(ts_mean(amount / circ_market_cap, 20) / ts_max(amount / circ_market_cap, 20))", "name": "anti_autocorr_float_peak_balance_20", "is_ic": 0.0336, "is_ic_ir": 0.46, "is_sharpe": 2.602, "is_turnover": 0.174, "is_monotonicity": 0.25, "gates": "PASS", "status": "candidate", "eval_seconds": 115.9, "decision": "candidate", "session_branch": "main", "base_ref": "origin/main", "merge_base": "7e71edc0d50443d3db4f0dd72c25238cd7ac1282", "head_commit": "7e71edc0d50443d3db4f0dd72c25238cd7ac1282"}
