{"ts": "2026-05-07T14:56:07.370888+08:00", "session_id": "20260507_140002_35890e", "market": "cn", "formula": "rank(ts_std(ts_sum(turnover_rate,5),60)/ts_std(ts_sum(turnover_rate,5),20))*rank(ts_corr(ret_1d,shift(ret_1d,1),20))", "name": "weekly_turnover_compress_autocorr_20_60", "is_ic": -0.002, "is_ic_ir": -0.025, "is_sharpe": -1.968, "is_turnover": 0.16, "is_monotonicity": 0.0, "gates": "FAIL", "status": "reverted", "eval_seconds": 221.5, "sleeve_id": "flow_persistence_regime", "mispricing_source": "Order-splitting and T+1/retail attention frictions make information diffuse over 10-20 days; compressed weekly turnover suggests supply is being absorbed without broad speculative participation.", "forced_counterparty": "benchmarked/redeeming funds and liquidity-needing retail holders who trade for mandate or cash-flow reasons rather than alpha", "data_requirements": "[\"turnover_rate\",\"ret_1d\"]", "failure_mode": "Fails in broad speculative bursts or policy-driven tape shifts where turnover compression no longer signals absorption and short-term return autocorrelation flips sign.", "report_contract": "fresh_buy_gate", "money_readiness": "money_candidate", "decision": "revert", "session_branch": "main", "base_ref": "origin/main", "merge_base": "7e986da0e351c2b41b5c9cb4f629494d55e1981c", "head_commit": "7e986da0e351c2b41b5c9cb4f629494d55e1981c"}
{"ts": "2026-05-07T14:56:07.370888+08:00", "session_id": "20260507_140002_35890e", "market": "cn", "formula": "rank(ts_min(ts_sum(amount/circ_market_cap,5),20)/ts_mean(ts_sum(amount/circ_market_cap,5),20))", "name": "weekly_float_flow_floor_20", "is_ic": 0.0249, "is_ic_ir": 0.221, "is_sharpe": 0.307, "is_turnover": 0.117, "is_monotonicity": 0.35, "gates": "PASS", "status": "candidate", "eval_seconds": 145.8, "sleeve_id": "weekly_float_flow_floor", "mispricing_source": "Underreaction to persistent float-normalized accumulation; this is a participation-floor signal, not a raw price or volume-spike variant.", "forced_counterparty": "impatient retail sellers and redemption-driven holders", "data_requirements": "[\"amount\",\"circ_market_cap\"]", "failure_mode": "Stops working if passive/index rebalances or policy-event bursts dominate flow, or if the market shifts to spike-chasing momentum where steady sponsorship is ignored.", "report_contract": "fresh_buy_gate", "money_readiness": "money_candidate", "decision": "candidate", "session_branch": "main", "base_ref": "origin/main", "merge_base": "7e986da0e351c2b41b5c9cb4f629494d55e1981c", "head_commit": "7e986da0e351c2b41b5c9cb4f629494d55e1981c"}
{"ts": "2026-05-07T14:56:07.370888+08:00", "session_id": "20260507_140002_35890e", "market": "cn", "formula": "rank(ts_min(amount/circ_market_cap,20)/ts_std(amount/circ_market_cap,20))*rank(-ts_corr(ret_1d,shift(ret_1d,1),40))", "name": "anti_autocorr_float_floorstd_20", "is_ic": 0.0285, "is_ic_ir": 0.262, "is_sharpe": 1.026, "is_turnover": 0.133, "is_monotonicity": 0.4, "gates": "PASS", "status": "candidate", "eval_seconds": 236.7, "sleeve_id": "float_flow_absorption", "mispricing_source": "Float-normalized baseline participation captures non-price-sensitive accumulation; the anti-autocorr leg filters for names where tape noise still masks that sponsorship, so this is not just another price-only reversal factor.", "forced_counterparty": "T+1 retail churners and benchmark-constrained funds meeting rebalances or redemptions", "data_requirements": "[\"amount\",\"circ_market_cap\",\"ret_1d\"]", "failure_mode": "Fails when stable float turnover is just illiquidity instead of sponsorship, or when the market shifts into a momentum regime where positive autocorr reflects genuine revaluation", "report_contract": "fresh_buy_gate", "money_readiness": "money_candidate", "decision": "candidate", "session_branch": "main", "base_ref": "origin/main", "merge_base": "7e986da0e351c2b41b5c9cb4f629494d55e1981c", "head_commit": "7e986da0e351c2b41b5c9cb4f629494d55e1981c"}
{"ts": "2026-05-08T06:55:28.203414+08:00", "session_id": "20260508_060002_187722", "market": "cn", "formula": "rank(-ts_corr(ret_1d,shift(ret_1d,1),20))*rank(ts_min(turnover_rate,20)/ts_max(turnover_rate,20))", "name": "turnover_floor_underreaction_20", "is_ic": 0.0383, "is_ic_ir": 0.49, "is_sharpe": 4.135, "is_turnover": 0.169, "is_monotonicity": 0.4, "gates": "PASS", "status": "candidate", "eval_seconds": 160.2, "sleeve_id": "daily_flow_underreaction", "mispricing_source": "Slow institutional accumulation in liquid names meets short-horizon retail overreaction; the turnover floor captures steady sponsorship, and anti-autocorr captures temporary inventory-driven reversals that mean-revert over the 10-20d horizon.", "forced_counterparty": "short-horizon retail punters and liquidity-motivated benchmark/redemption sellers", "data_requirements": "[\"ret_1d\",\"turnover_rate\",\"20d lookback\"]", "failure_mode": "Stops working if A-share flow becomes more trend-chasing than mean-reverting, or if steady-turnover names become crowded quality/defensive proxies with no residual underreaction.", "report_contract": "fresh_buy_gate", "money_readiness": "money_candidate", "decision": "candidate", "session_branch": "main", "base_ref": "origin/main", "merge_base": "7e986da0e351c2b41b5c9cb4f629494d55e1981c", "head_commit": "7e986da0e351c2b41b5c9cb4f629494d55e1981c"}
{"ts": "2026-05-08T06:55:28.203414+08:00", "session_id": "20260508_060002_187722", "market": "cn", "formula": "rank(-ts_std(turnover_rate,20)/ts_mean(turnover_rate,20))*rank(ts_mean(volume_ratio,20)/ts_max(volume_ratio,20))", "name": "steady_turnover_relvol_evenness_20", "is_ic": 0.0335, "is_ic_ir": 0.342, "is_sharpe": 1.123, "is_turnover": 0.121, "is_monotonicity": 0.35, "gates": "PASS", "status": "candidate", "eval_seconds": 167.3, "sleeve_id": "daily_flow_evenness", "mispricing_source": "quiet ownership transfer and slow information diffusion in under-attended names", "forced_counterparty": "retail attention-chasers and benchmarked funds concentrating liquidity in crowded names", "data_requirements": "[\"daily turnover_rate\",\"daily volume_ratio\"]", "failure_mode": "fails in crowding or squeeze regimes where spiky attention is rewarded and quiet participation stops leading price", "report_contract": "fresh_buy_gate", "money_readiness": "money_candidate", "decision": "candidate", "session_branch": "main", "base_ref": "origin/main", "merge_base": "7e986da0e351c2b41b5c9cb4f629494d55e1981c", "head_commit": "7e986da0e351c2b41b5c9cb4f629494d55e1981c"}
{"ts": "2026-05-08T06:55:28.203414+08:00", "session_id": "20260508_060002_187722", "market": "cn", "formula": "rank(pb)*rank(ts_mean(turnover_rate,20)/log(circ_market_cap))", "name": "pb_float_crowding_20", "is_ic": 0.0221, "is_ic_ir": 0.111, "is_sharpe": -0.657, "is_turnover": 0.018, "is_monotonicity": -0.2, "gates": "FAIL", "status": "reverted", "eval_seconds": 96.6, "sleeve_id": "valuation_float_crowding", "mispricing_source": "Retail attention and thematic chasing overpay for scarce float in expensive names, while valuation-based arbitrage is slow because it lacks a hard near-term catalyst.", "forced_counterparty": "Retail theme traders and benchmarked long-only funds that must hold liquid story stocks despite crowded free float.", "data_requirements": "[\"pb\",\"turnover_rate\",\"circ_market_cap\"]", "failure_mode": "Fails in liquidity-driven speculative regimes when crowded expensive stocks keep squeezing and valuation does not re-anchor within the 10-20 day horizon.", "report_contract": "risk_warning", "money_readiness": "research_only", "decision": "revert", "session_branch": "main", "base_ref": "origin/main", "merge_base": "7e986da0e351c2b41b5c9cb4f629494d55e1981c", "head_commit": "7e986da0e351c2b41b5c9cb4f629494d55e1981c"}
{"ts": "2026-05-08T06:55:28.203414+08:00", "session_id": "20260508_060002_187722", "market": "cn", "formula": "rank(-ts_max(ret_1d,20))*rank(-ts_std(delta(turnover_rate,5),20))", "name": "low_lottery_weekly_turnchg_smooth_20", "is_ic": 0.0319, "is_ic_ir": 0.175, "is_sharpe": -0.034, "is_turnover": 0.059, "is_monotonicity": -0.05, "gates": "FAIL", "status": "reverted", "eval_seconds": 203.1, "sleeve_id": "quiet_flow_underreaction", "mispricing_source": "Attention segmentation and hidden order-splitting; this is a participation-path plus lottery-avoidance signal, not another price-trend or price-volume-correlation clone.", "forced_counterparty": "retail lottery chasers and benchmark-constrained mutual funds executing inventory transfers without alpha timing", "data_requirements": "[\"ret_1d\",\"turnover_rate\"]", "failure_mode": "It should weaken in theme-chasing or policy-squeeze regimes where high-lottery names keep trending and smooth turnover simply reflects broad illiquidity rather than accumulation.", "report_contract": "fresh_buy_gate", "money_readiness": "money_candidate", "decision": "revert", "session_branch": "main", "base_ref": "origin/main", "merge_base": "7e986da0e351c2b41b5c9cb4f629494d55e1981c", "head_commit": "7e986da0e351c2b41b5c9cb4f629494d55e1981c"}
{"ts": "2026-05-08T06:55:28.203414+08:00", "session_id": "20260508_060002_187722", "market": "cn", "formula": "rank(-ts_corr(ret_1d,shift(ret_1d,1),20))*rank(-ts_std(pct_change(amount,5),20))", "name": "anti_autocorr_weekly_amount_change_stability_20", "is_ic": 0.0415, "is_ic_ir": 0.449, "is_sharpe": 2.573, "is_turnover": 0.153, "is_monotonicity": 0.15, "gates": "PASS", "status": "checks_failed", "eval_seconds": 238.4, "sleeve_id": "anti_autocorr_flow_absorption", "mispricing_source": "Second-order flow-path underreaction; this measures smoothness of weekly capital transfer, not raw momentum, reversal, or plain amount-stability level, so it should be less redundant than another price-volume correlation factor.", "forced_counterparty": "retail attention traders and benchmark-constrained mutual funds trading around subscriptions, redemptions, and headlines rather than medium-horizon alpha", "data_requirements": "[\"ret_1d\",\"amount\"]; for money-ready deployment, add intraday order-flow or member-level trade ledger to verify true absorption vs passive crowding", "failure_mode": "breaks in one-way policy/speculative momentum regimes where bursty turnover is genuinely informative and return autocorrelation turns positive", "report_contract": "research_only", "money_readiness": "research_only", "decision": "revert", "session_branch": "main", "base_ref": "origin/main", "merge_base": "7e986da0e351c2b41b5c9cb4f629494d55e1981c", "head_commit": "7e986da0e351c2b41b5c9cb4f629494d55e1981c", "oos": "PASS", "checks_status": "failed"}
{"ts": "2026-05-08T06:55:28.203414+08:00", "session_id": "20260508_060002_187722", "market": "cn", "formula": "rank(ts_min(ts_sum(amount/circ_market_cap,5),20)/ts_std(ts_sum(amount/circ_market_cap,5),20))", "name": "weekly_float_floorstd_20", "is_ic": 0.0264, "is_ic_ir": 0.258, "is_sharpe": 1.03, "is_turnover": 0.097, "is_monotonicity": 0.65, "gates": "PASS", "status": "candidate", "eval_seconds": 180.7, "sleeve_id": "weekly_float_absorption", "mispricing_source": "Slow diffusion of information from steady float-normalized sponsorship; the market reacts more to noisy price moves than to persistent non-collapsing flow support.", "forced_counterparty": "retail attention/lottery traders and benchmarked or redemption-driven long-only funds rotating for non-alpha liquidity reasons", "data_requirements": "[\"amount\",\"circ_market_cap\"]", "failure_mode": "Breaks in policy/thematic momentum regimes where bursty participation is rewarded, or when passive/index flow dominates float turnover so steady support no longer signals informed accumulation.", "report_contract": "fresh_buy_gate", "money_readiness": "money_candidate", "decision": "candidate", "session_branch": "main", "base_ref": "origin/main", "merge_base": "7e986da0e351c2b41b5c9cb4f629494d55e1981c", "head_commit": "7e986da0e351c2b41b5c9cb4f629494d55e1981c"}
{"ts": "2026-05-08T06:55:28.203414+08:00", "session_id": "20260508_060002_187722", "market": "cn", "formula": "rank(-ts_std(delta(turnover_rate,5),20)/ts_mean(turnover_rate,20))*rank(-ts_std(close/open-1,20))", "name": "weekly_turnchg_body_stability_20", "is_ic": 0.0397, "is_ic_ir": 0.237, "is_sharpe": -0.113, "is_turnover": 0.093, "is_monotonicity": 0.0, "gates": "PASS", "status": "checks_failed", "eval_seconds": 201.0, "sleeve_id": "daily_flow_absorption", "mispricing_source": "Retail attention is drawn to noisy return spikes, not to smooth participation-path information; gradual benchmark-constrained accumulation shows up first in steadier weekly turnover changes and quieter intraday bodies, so this is flow-quality rather than a close-volume price clone.", "forced_counterparty": "Retail swing traders and liquidity-motivated sellers; institutions that must rebalance gradually instead of taking the whole position at once.", "data_requirements": "[\"turnover_rate\",\"open\",\"close\"]", "failure_mode": "It should stop working in policy-shock or speculative beta-chasing regimes, where orderly low-noise absorption no longer signals latent demand and attention-driven names lead.", "report_contract": "fresh_buy_gate", "money_readiness": "money_candidate", "decision": "revert", "session_branch": "main", "base_ref": "origin/main", "merge_base": "7e986da0e351c2b41b5c9cb4f629494d55e1981c", "head_commit": "7e986da0e351c2b41b5c9cb4f629494d55e1981c", "oos": "PASS", "checks_status": "failed"}
{"ts": "2026-05-08T06:55:28.203414+08:00", "session_id": "20260508_060002_187722", "market": "cn", "formula": "rank(ts_std(delta(turnover_rate,5),60)/ts_std(delta(turnover_rate,5),20))", "name": "weekly_turnshock_compress_20_60", "is_ic": 0.0293, "is_ic_ir": 0.343, "is_sharpe": 2.615, "is_turnover": 0.101, "is_monotonicity": 0.0, "gates": "PASS", "status": "candidate", "eval_seconds": 208.5, "sleeve_id": "daily_participation_regime", "mispricing_source": "Retail attention bursts create temporary turnover shocks; when those shocks calm, T+1, shorting frictions, and gradual institutional re-risking delay full price adjustment.", "forced_counterparty": "Retail punters and benchmark-constrained rebalancers trading around attention or policy bursts rather than expected return.", "data_requirements": "[\"turnover_rate\"]", "failure_mode": "Fails in persistent momentum or policy-driven attention regimes where high turnover shocks reflect real information arrival, not noise unwinding.", "report_contract": "fresh_buy_gate", "money_readiness": "money_candidate", "decision": "candidate", "session_branch": "main", "base_ref": "origin/main", "merge_base": "7e986da0e351c2b41b5c9cb4f629494d55e1981c", "head_commit": "7e986da0e351c2b41b5c9cb4f629494d55e1981c"}
{"ts": "2026-05-08T06:55:28.203414+08:00", "session_id": "20260508_060002_187722", "market": "cn", "formula": "rank(ts_mean(ts_sum(amount/circ_market_cap,5),20)/ts_max(ts_sum(amount/circ_market_cap,5),20))*rank(-ts_std((close-open)/(high-low+0.01),20))", "name": "weekly_float_body_quiet_20", "is_ic": 0.0301, "is_ic_ir": 0.204, "is_sharpe": -0.124, "is_turnover": 0.161, "is_monotonicity": -0.1, "gates": "PASS", "status": "candidate", "eval_seconds": 191.4, "sleeve_id": "quiet_float_absorption", "mispricing_source": "Slow institutional absorption is not fully impounded because attention-driven traders anchor on exciting price action, not steady float consumption.", "forced_counterparty": "Retail theme chasers and benchmarked managers needing immediate liquidity; both are uneconomic providers of stock to quiet accumulators.", "data_requirements": "[\"open\",\"high\",\"low\",\"close\",\"amount\",\"circ_market_cap\"]", "failure_mode": "Fails in speculation-led melt-up regimes where noisy high-body names lead and quiet flow no longer indicates underownership.", "report_contract": "fresh_buy_gate", "money_readiness": "money_candidate", "decision": "candidate", "session_branch": "main", "base_ref": "origin/main", "merge_base": "7e986da0e351c2b41b5c9cb4f629494d55e1981c", "head_commit": "7e986da0e351c2b41b5c9cb4f629494d55e1981c"}
{"ts": "2026-05-08T06:55:28.203414+08:00", "session_id": "20260508_060002_187722", "market": "cn", "formula": "rank(ts_mean(ts_sum(volume,5),20)/ts_max(ts_sum(volume,5),20))", "name": "weekly_volume_evenness_20", "is_ic": 0.0294, "is_ic_ir": 0.322, "is_sharpe": 0.321, "is_turnover": 0.127, "is_monotonicity": 0.95, "gates": "PASS", "status": "candidate", "eval_seconds": 214.7, "sleeve_id": "weekly_share_flow_quality", "mispricing_source": "Slow ownership transfer under retail attention bias and T+1 frictions; distinct from existing price-volume correlation factors because it uses only the time-shape of share turnover, not price response.", "forced_counterparty": "retail attention traders chasing spike-volume names; benchmark/rebalance and redemption-driven funds trading for mandate or liquidity rather than medium-horizon alpha", "data_requirements": "[\"volume\"] for research; intraday order-flow or member-level trade ledger is still needed before money-ready deployment to separate accumulation from distribution", "failure_mode": "Fails when smooth volume mainly reflects stagnant illiquidity, or when policy/speculative regimes reward bursty high-volume leaders so spike suppression becomes a negative.", "report_contract": "setup_overlay", "money_readiness": "research_only", "decision": "candidate", "session_branch": "main", "base_ref": "origin/main", "merge_base": "7e986da0e351c2b41b5c9cb4f629494d55e1981c", "head_commit": "7e986da0e351c2b41b5c9cb4f629494d55e1981c"}
{"ts": "2026-05-08T06:55:28.203414+08:00", "session_id": "20260508_060002_187722", "market": "cn", "formula": "rank(-ts_std(pct_change(amount / circ_market_cap,5),20))", "name": "float_weekly_flow_change_stability_20", "is_ic": 0.034, "is_ic_ir": 0.338, "is_sharpe": 1.1, "is_turnover": 0.099, "is_monotonicity": 0.15, "gates": "PASS", "status": "candidate", "eval_seconds": 181.1, "sleeve_id": "float_flow_overlay", "mispricing_source": "patient accumulation is only partially impounded because daily price discovery is dominated by lottery-style attention and short-horizon flow shocks", "forced_counterparty": "retail hot-money rotators and benchmark/rebalance sellers providing stock mechanically", "data_requirements": "[\"amount\",\"circ_market_cap\"]", "failure_mode": "fails when market-wide theme chasing overwhelms stock-specific flow quality, or when float scarcity stops differentiating names", "report_contract": "fresh_buy_gate", "money_readiness": "money_candidate", "decision": "candidate", "session_branch": "main", "base_ref": "origin/main", "merge_base": "7e986da0e351c2b41b5c9cb4f629494d55e1981c", "head_commit": "7e986da0e351c2b41b5c9cb4f629494d55e1981c"}
{"ts": "2026-05-08T06:55:28.203414+08:00", "session_id": "20260508_060002_187722", "market": "cn", "formula": "rank(ts_std(pct_change(amount,5),60)/ts_std(pct_change(amount,5),20))", "name": "amt_growth_compress_20_60", "is_ic": 0.0207, "is_ic_ir": 0.28, "is_sharpe": 1.956, "is_turnover": 0.103, "is_monotonicity": -0.05, "gates": "PASS", "status": "candidate", "eval_seconds": 215.9, "sleeve_id": "flow_regime_compression", "mispricing_source": "attention-driven overreaction in flow, followed by slow institutional absorption and delayed repricing", "forced_counterparty": "retail attention-chasers and redemption/margin-driven sellers", "data_requirements": "[\"amount\"]", "failure_mode": "fails in broad breakout/liquidity-frenzy regimes where expanding flow is the signal and compressed flow just means neglect", "report_contract": "fresh_buy_gate", "money_readiness": "money_candidate", "decision": "candidate", "session_branch": "main", "base_ref": "origin/main", "merge_base": "7e986da0e351c2b41b5c9cb4f629494d55e1981c", "head_commit": "7e986da0e351c2b41b5c9cb4f629494d55e1981c"}
{"ts": "2026-05-08T06:55:28.203414+08:00", "session_id": "20260508_060002_187722", "market": "cn", "formula": "rank(ts_std(delta(amount,5),60)/ts_std(delta(amount,5),20)/log(circ_market_cap))", "name": "smallfloat_weekly_flow_compress_20_60", "is_ic": 0.0395, "is_ic_ir": 0.346, "is_sharpe": 2.979, "is_turnover": 0.095, "is_monotonicity": 0.15, "gates": "PASS", "status": "reverted", "eval_seconds": 205.1, "sleeve_id": "weekly_flow_regime", "mispricing_source": "The market reacts to visible price moves faster than to the quieter information in shrinking weekly trading shocks; once bursty flow normalizes, prices often lag the clearing of supply overhang.", "forced_counterparty": "Retail theme chasers and redemption-constrained small funds who trade in bursts; benchmarked long-only managers are slow to add after the flow regime has already improved.", "data_requirements": "[\"amount\",\"circ_market_cap\"]", "failure_mode": "Fails in broad speculative chase regimes where persistent high weekly flow shocks keep being rewarded, or in illiquid small-cap droughts where low recent shock just means neglect.", "report_contract": "fresh_buy_gate", "money_readiness": "money_candidate", "decision": "revert", "session_branch": "main", "base_ref": "origin/main", "merge_base": "7e986da0e351c2b41b5c9cb4f629494d55e1981c", "head_commit": "7e986da0e351c2b41b5c9cb4f629494d55e1981c", "oos": "FAIL", "checks_status": "skipped"}
