{"ts": "2026-05-27T16:52:40.668961+08:00", "session_id": "20260527_155704_44d2b7", "market": "cn", "formula": "rank(-ts_std(pct_change(amount,5),20))", "name": "amount_growth_stability_20", "is_ic": 0.0401, "is_ic_ir": 0.249, "is_sharpe": 0.39, "is_turnover": 0.103, "is_monotonicity": 0.15, "gates": "PASS", "status": "reverted", "eval_seconds": 164.0, "sleeve_id": "daily_flow_overlay", "mispricing_source": "The market overpays for visible breakout volume and underreacts to quiet, persistent capital deployment; this is a flow-path signal, not just another price momentum/reversal variant.", "forced_counterparty": "Retail theme chasers and benchmarked managers who add only after headline confirmation, creating jagged flow rather than smooth accumulation.", "data_requirements": "[\"daily amount\",\"AI universe membership + BFS metadata\",\"sleeve correlation vs existing promoted factors\",\"beta-hedged attribution vs 000300.SH/399001.SZ\",\"if used to assert supplier/customer bottlenecks: filings, official PRs, transcripts\"]", "failure_mode": "Stops working in blow-off momentum or policy-liquidity shock regimes where one-day speculative bursts dominate and smooth accumulation no longer predicts follow-through.", "report_contract": "action_overlay", "ai_supercycle_layer": "ai_chip_equipment_materials_packaging", "supply_chain_hypothesis": "Upstream CN equipment, materials, and advanced-packaging names leveraged to AI capex localization should show smoother weekly amount growth than downstream narrative beta when real bottlenecks are being accumulated.", "relationship_evidence_required": "true", "money_readiness": "research_only", "decision": "revert", "session_branch": "main", "base_ref": "origin/main", "merge_base": "71f9dffaddd84ccee1dd8922a9e618b8a3724187", "head_commit": "71f9dffaddd84ccee1dd8922a9e618b8a3724187", "oos": "FAIL", "checks_status": "skipped"}
{"ts": "2026-05-27T16:52:40.668961+08:00", "session_id": "20260527_155704_44d2b7", "market": "cn", "formula": "rank(-pb)*rank(ts_min(amount/circ_market_cap,20)/ts_mean(amount/circ_market_cap,20))", "name": "pb_float_flow_floor_20", "is_ic": 0.0076, "is_ic_ir": 0.021, "is_sharpe": -2.009, "is_turnover": 0.133, "is_monotonicity": -0.05, "gates": "FAIL", "status": "reverted", "eval_seconds": 207.6, "sleeve_id": "cn_aiinfra_flow_value", "mispricing_source": "Quiet underreaction in asset-heavy AI-infra beneficiaries where sponsorship builds gradually but discretionary capital waits for headline confirmation.", "forced_counterparty": "Benchmarked mutual funds and retail breakout chasers that avoid flat-tape, low-PB names until the story is obvious.", "data_requirements": "[\"CN daily price/daily_basic for prototype\",\"ai_infra universe/source-review status before production ranking\",\"beta-hedged sleeve attribution vs 000300.SH/399006.SZ\",\"correlation to promoted sleeves\"]", "failure_mode": "Fails in speculative squeeze regimes where one-off volume spikes and high-multiple narrative names dominate, or when low PB mostly reflects genuine balance-sheet stress rather than delayed AI-capex repricing.", "report_contract": "setup_overlay", "ai_supercycle_layer": "hard_assets_energy_heavy", "supply_chain_hypothesis": "Within the reviewed CN AI-infra universe, power/grid/datacenter/equipment names with persistent float-flow floors are being accumulated ahead of visible AI capex/order confirmation.", "relationship_evidence_required": "false", "money_readiness": "research_only", "decision": "revert", "session_branch": "main", "base_ref": "origin/main", "merge_base": "71f9dffaddd84ccee1dd8922a9e618b8a3724187", "head_commit": "71f9dffaddd84ccee1dd8922a9e618b8a3724187"}
{"ts": "2026-05-27T16:52:40.668961+08:00", "session_id": "20260527_155704_44d2b7", "market": "cn", "formula": "rank(ts_mean(amount/circ_market_cap,20)/ts_std(amount/circ_market_cap,20))", "name": "float_flow_stability_20", "is_ic": -0.0422, "is_ic_ir": -0.16, "is_sharpe": -4.034, "is_turnover": 0.141, "is_monotonicity": -0.5, "gates": "FAIL", "status": "reverted", "eval_seconds": 151.6, "sleeve_id": "daily_flow_overlay", "mispricing_source": "The market overreacts to obvious high-turnover excitement and underreacts to slow ownership migration in constrained-float AI names; smooth float flow is a quieter accumulation signal.", "forced_counterparty": "Retail theme chasers and liquidity-needing holders selling into steady institutional demand", "data_requirements": "Current backtest only needs [amount, circ_market_cap]; before promotion to book require beta-hedged sleeve return, cross-sleeve correlation, and residual risk attribution.", "failure_mode": "Fails in panic/liquidity-shock regimes where steady flow reflects illiquidity or trapped holders rather than patient accumulation.", "report_contract": "action_overlay", "ai_supercycle_layer": "none", "supply_chain_hypothesis": "Inside the source-reviewed CN AI-infra universe, D1-D3 bottleneck suppliers being accumulated ahead of broader recognition should show stable float-normalized trading before verified order/backlog evidence becomes consensus.", "relationship_evidence_required": "true", "money_readiness": "research_only", "decision": "revert", "session_branch": "main", "base_ref": "origin/main", "merge_base": "71f9dffaddd84ccee1dd8922a9e618b8a3724187", "head_commit": "71f9dffaddd84ccee1dd8922a9e618b8a3724187"}
{"ts": "2026-05-27T16:52:40.668961+08:00", "session_id": "20260527_155704_44d2b7", "market": "cn", "formula": "rank(ts_std(pct_change(amount,5),60)/ts_std(pct_change(amount,5),20))", "name": "weekly_amount_change_compress_20_60", "is_ic": 0.0361, "is_ic_ir": 0.228, "is_sharpe": 1.742, "is_turnover": 0.101, "is_monotonicity": 0.1, "gates": "PASS", "status": "candidate", "eval_seconds": 212.8, "sleeve_id": "daily_flow_compression", "mispricing_source": "The market overreacts to noisy volume bursts and underweights the informational value of sponsorship becoming smoother; this is a flow-regime signal, not a high-correlation clone of existing price momentum/reversal factors.", "forced_counterparty": "T+1 retail chasers and short-horizon funds reducing exposure after prior turnover shocks", "data_requirements": "[\"daily amount history (available)\", \"correlation check vs amount_stability_20 and promoted price sleeves\", \"beta-hedged sleeve attribution vs 000300.SH/399006.SZ\", \"source-reviewed filings/news if any specific supplier/customer claim is later attached\"]", "failure_mode": "It should underperform in squeeze-led rumor regimes where explosive turnover is the alpha, or when broad beta/state-policy bursts dominate stock-specific accumulation.", "report_contract": "setup_overlay", "ai_supercycle_layer": "ai_networking_optical_cpo", "supply_chain_hypothesis": "Potential optical/CPO bottleneck names may transition from rumor-driven turnover spikes to compressed weekly flow changes before verified order evidence is public.", "relationship_evidence_required": "true", "money_readiness": "research_only", "decision": "candidate", "session_branch": "main", "base_ref": "origin/main", "merge_base": "71f9dffaddd84ccee1dd8922a9e618b8a3724187", "head_commit": "71f9dffaddd84ccee1dd8922a9e618b8a3724187"}
{"ts": "2026-05-27T16:52:40.668961+08:00", "session_id": "20260527_155704_44d2b7", "market": "cn", "formula": "rank(ts_mean(turnover_rate,20)/ts_std(turnover_rate,20))", "name": "steady_turnover_ratio_20", "is_ic": -0.0432, "is_ic_ir": -0.164, "is_sharpe": -4.008, "is_turnover": 0.14, "is_monotonicity": -0.5, "gates": "FAIL", "status": "reverted", "eval_seconds": 149.9, "sleeve_id": "daily_flow_overlay", "mispricing_source": "Underreaction to float-constrained accumulation in AI-infra leaders; stable turnover captures sponsorship quality before fundamentals are fully capitalized.", "forced_counterparty": "Redemption-driven mutual funds, short-horizon retail traders, and benchmarked holders who provide liquidity for non-fundamental reasons.", "data_requirements": "[\"daily price\",\"daily_basic.turnover_rate\",\"beta-hedged sleeve attribution\",\"correlation vs amount_stability_20 and promoted price sleeves\",\"capacity/impact estimate at 0.3% round-trip\",\"source-review evidence before any supplier/customer narrative\"]", "failure_mode": "Fails when turnover stability reflects neglect instead of accumulation, especially in broad liquidity shocks, policy-risk unwind, or after the sleeve becomes crowded.", "report_contract": "fresh_buy_gate", "ai_supercycle_layer": "ai_chip_equipment_materials_packaging", "supply_chain_hypothesis": "Domestic AI bottleneck equipment/materials/packaging names should show steady float turnover as specialist capital accumulates scarce substitutes before verified capex or order evidence is fully priced.", "relationship_evidence_required": "true", "money_readiness": "money_candidate", "decision": "revert", "session_branch": "main", "base_ref": "origin/main", "merge_base": "71f9dffaddd84ccee1dd8922a9e618b8a3724187", "head_commit": "71f9dffaddd84ccee1dd8922a9e618b8a3724187"}
{"ts": "2026-05-27T16:52:40.668961+08:00", "session_id": "20260527_155704_44d2b7", "market": "cn", "formula": "rank(ts_mean(amount,20)/(ts_std(amount,20)+1))*rank(-ret_5d)", "name": "amount_stable_pullback_20_5", "is_ic": 0.0303, "is_ic_ir": 0.167, "is_sharpe": -2.417, "is_turnover": 0.271, "is_monotonicity": 0.15, "gates": "FAIL", "status": "reverted", "eval_seconds": 80.6, "sleeve_id": "cn_ai_flow_pullback", "mispricing_source": "Short-horizon theme traders overreact to recent weakness, while slower institutional allocators continue accumulating sponsored AI-infra leaders; the market underprices the persistence of that sponsorship.", "forced_counterparty": "Retail theme chasers, weak-hand momentum accounts, and mandate-constrained funds reducing exposure after 1-week drawdowns", "data_requirements": "[\"daily OHLCV+amount on CN AI-infra universe\", \"benchmark returns vs 000300.SH/399006.SZ for beta-hedged sleeve attribution\", \"live sleeve correlation to promoted factors before promotion\"]", "failure_mode": "It breaks when stable amount reflects distribution instead of accumulation, especially during theme-wide de-risking or policy shock regimes where dips do not mean-revert.", "report_contract": "setup_overlay", "ai_supercycle_layer": "none", "supply_chain_hypothesis": "none", "relationship_evidence_required": "false", "money_readiness": "research_only", "decision": "revert", "session_branch": "main", "base_ref": "origin/main", "merge_base": "71f9dffaddd84ccee1dd8922a9e618b8a3724187", "head_commit": "71f9dffaddd84ccee1dd8922a9e618b8a3724187"}
{"ts": "2026-05-27T16:52:40.668961+08:00", "session_id": "20260527_155704_44d2b7", "market": "cn", "formula": "rank(ts_std(pct_change(amount,5),60)/ts_std(pct_change(amount,5),20))*rank(-ts_max(turnover_rate,20)/ts_sum(turnover_rate,20))", "name": "weekly_amt_turn_uniform_20_60", "is_ic": -0.0332, "is_ic_ir": -0.144, "is_sharpe": -3.006, "is_turnover": 0.153, "is_monotonicity": -0.25, "gates": "FAIL", "status": "reverted", "eval_seconds": 266.8, "sleeve_id": "cn_ai_flow_absorption", "mispricing_source": "Distributed accumulation inside the reviewed AI universe is underreacted because headline traders wait for visible price breakouts, while this factor measures quiet flow compression and non-spiky participation instead of return level.", "forced_counterparty": "Retail chasers and liquidity-needing holders who transact in bursts; long-only institutions building AI exposure cannot reveal full size aggressively and therefore accumulate across many sessions.", "data_requirements": "[\"current daily amount and turnover_rate for IS evaluation\",\"benchmark series for beta-hedged attribution vs 000300.SH and 399006.SZ\",\"sleeve correlation and turnover-cost ledger before promotion\"]", "failure_mode": "It should stop working in news-gap or policy-chase regimes where winners rerate through one-off turnover spikes, or when very low turnover reflects neglect and liquidity drought rather than absorption.", "report_contract": "setup_overlay", "ai_supercycle_layer": "ai_chip_equipment_materials_packaging", "supply_chain_hypothesis": "Capacity-tight equipment, materials, and advanced-packaging names should show compressed weekly amount shocks with evenly distributed turnover before order/backlog evidence is fully reflected in price.", "relationship_evidence_required": "true", "money_readiness": "research_only", "decision": "revert", "session_branch": "main", "base_ref": "origin/main", "merge_base": "71f9dffaddd84ccee1dd8922a9e618b8a3724187", "head_commit": "71f9dffaddd84ccee1dd8922a9e618b8a3724187"}
{"ts": "2026-05-27T16:52:40.668961+08:00", "session_id": "20260527_155704_44d2b7", "market": "cn", "formula": "rank(ts_std(pct_change(amount,5),60)-ts_std(pct_change(amount,5),20))*rank(-ts_mean(high/low-1,10))", "name": "quiet_weekly_amount_compress_20_60", "is_ic": 0.0544, "is_ic_ir": 0.265, "is_sharpe": -0.925, "is_turnover": 0.118, "is_monotonicity": 0.05, "gates": "PASS", "status": "reverted", "eval_seconds": 224.8, "sleeve_id": "cn_ai_flow_absorption", "mispricing_source": "The market overreacts to noisy headline rotation and underprices slow accumulation in real AI-capex beneficiaries; this is a flow-structure signal, not a pure price-trend clone.", "forced_counterparty": "retail theme rotators and short-horizon managers constrained by T+1, benchmark pressure, and quarter-end ranking", "data_requirements": "[\"current CN daily OHLCV+amount is sufficient for IS test\",\"promotion requires beta-hedged sleeve attribution vs 000300.SH/399006.SZ\",\"any named supplier/customer/order thesis needs filings, official releases, or transcripts\"]", "failure_mode": "It should decay when AI trading becomes purely gap-driven/news-driven, or when tight ranges reflect illiquidity and risk aversion rather than accumulation.", "report_contract": "setup_overlay", "ai_supercycle_layer": "none", "supply_chain_hypothesis": "Potential bottleneck suppliers inside the validated AI-infra universe should show quiet weekly amount compression before order/capex repricing, but tape alone does not identify which relationship is real.", "relationship_evidence_required": "true", "money_readiness": "research_only", "decision": "revert", "session_branch": "main", "base_ref": "origin/main", "merge_base": "71f9dffaddd84ccee1dd8922a9e618b8a3724187", "head_commit": "71f9dffaddd84ccee1dd8922a9e618b8a3724187", "oos": "FAIL", "checks_status": "skipped"}
{"ts": "2026-05-27T16:52:40.668961+08:00", "session_id": "20260527_155704_44d2b7", "market": "cn", "formula": "rank(ts_corr(ret_1d, shift(ret_1d, 1), 20)) * rank(ts_std(turnover_rate,60)/ts_std(turnover_rate,20))", "name": "autocorr_turn_compress_20_60", "is_ic": -0.0173, "is_ic_ir": -0.08, "is_sharpe": -1.033, "is_turnover": 0.195, "is_monotonicity": 0.05, "gates": "FAIL", "status": "reverted", "eval_seconds": 265.1, "sleeve_id": "cn_ai_infra_orderly_trend", "mispricing_source": "Underreaction to orderly accumulation; the market pays more attention to single-day breakout stories than to persistent multi-day buying with declining churn.", "forced_counterparty": "Retail concept traders and benchmark-constrained mutual funds that sell or underweight mid-cap supply-chain names until confirmation is obvious", "data_requirements": "[\"daily OHLCV\", \"turnover_rate\", \"AI universe membership/source-review status\", \"benchmark beta and residual return attribution ledger\"]", "failure_mode": "Fails in mean-reverting or policy-whipsaw tape, or when leadership becomes crowded and turnover volatility re-expands into blowoff behavior.", "report_contract": "fresh_buy_gate", "ai_supercycle_layer": "ai_chip_equipment_materials_packaging", "supply_chain_hypothesis": "Domestic semiconductor equipment, materials, and advanced-packaging bottleneck names should exhibit orderly return persistence plus turnover compression before capex/order evidence is fully reflected in price.", "relationship_evidence_required": "true", "money_readiness": "money_candidate", "decision": "revert", "session_branch": "main", "base_ref": "origin/main", "merge_base": "71f9dffaddd84ccee1dd8922a9e618b8a3724187", "head_commit": "71f9dffaddd84ccee1dd8922a9e618b8a3724187"}
{"ts": "2026-05-27T16:52:40.668961+08:00", "session_id": "20260527_155704_44d2b7", "market": "cn", "formula": "rank(ts_mean(amount,20)/(ts_std(amount,20)+1))*rank(ret_20d-ret_5d)", "name": "stable_amount_trend_pause_20", "is_ic": -0.0132, "is_ic_ir": -0.079, "is_sharpe": -3.851, "is_turnover": 0.203, "is_monotonicity": -0.85, "gates": "FAIL", "status": "reverted", "eval_seconds": 102.1, "sleeve_id": "cn_ai_infra_accumulation", "mispricing_source": "Slow ownership transfer is underpriced because the market overweights short-term pullbacks and underweights persistent medium-horizon demand visible in stable amount.", "forced_counterparty": "Retail profit-takers and benchmark-constrained active funds that wait for clearer confirmation before adding exposure.", "data_requirements": "[\"daily amount and return history for CN AI-universe names\",\"benchmark hedge ledger vs 000300.SH and 399006.SZ\",\"rolling correlation panel vs promoted factors\",\"residual risk attribution by AI module/BFS depth\"]", "failure_mode": "Stops working when tape is dominated by rumor-driven one-day bursts or broad beta shocks, so stable amount no longer distinguishes informed accumulation from passive or panic flow.", "report_contract": "research_only", "ai_supercycle_layer": "ai_chip_equipment_materials_packaging", "supply_chain_hypothesis": "Domestic AI packaging/testing/equipment bottleneck names with verified D2-D3 exposure should show steady amount accumulation and controlled price pauses before order evidence is fully recognized.", "relationship_evidence_required": "true", "money_readiness": "research_only", "decision": "revert", "session_branch": "main", "base_ref": "origin/main", "merge_base": "71f9dffaddd84ccee1dd8922a9e618b8a3724187", "head_commit": "71f9dffaddd84ccee1dd8922a9e618b8a3724187"}
{"ts": "2026-05-27T16:52:40.668961+08:00", "session_id": "20260527_155704_44d2b7", "market": "cn", "formula": "rank(ts_std(amount,60)/ts_std(amount,20))*rank(-ts_std((close-open)/(high-low+0.01),20))", "name": "amount_compress_body_stability_20_60", "is_ic": 0.0055, "is_ic_ir": 0.035, "is_sharpe": -2.391, "is_turnover": 0.174, "is_monotonicity": -0.4, "gates": "FAIL", "status": "reverted", "eval_seconds": 219.8, "sleeve_id": "cn_ai_infra_flow_absorption", "mispricing_source": "A-share retail/theme capital overreacts to daily tape and supplies liquidity into patient institutional accumulation; orderly execution in real AI bottleneck names is only incorporated gradually, so the payoff comes from underreaction rather than a simple beta or momentum clone.", "forced_counterparty": "retail momentum traders and short-horizon thematic funds that must churn around daily noise, plus T+1-constrained holders exiting weak sessions", "data_requirements": "[\"daily OHLC+amount in CN universe (available)\", \"AI-infra universe membership/source-review status from ai_infra before production use\", \"beta-hedged sleeve attribution, residual risk, and correlation-to-existing-sleeves report before promotion\"]", "failure_mode": "It should decay when headline-driven speculation and limit-up chasing dominate orderly accumulation, or when liquidity shocks reward noisy high-body-vol names instead of sponsored leaders.", "report_contract": "action_overlay", "ai_supercycle_layer": "ai_chip_equipment_materials_packaging", "supply_chain_hypothesis": "Domestic AI chip equipment, materials, and advanced packaging candidates likely to relieve compute bottlenecks are accumulated in a quieter tape before verified backlog/order evidence is fully visible.", "relationship_evidence_required": "true", "money_readiness": "research_only", "decision": "revert", "session_branch": "main", "base_ref": "origin/main", "merge_base": "71f9dffaddd84ccee1dd8922a9e618b8a3724187", "head_commit": "71f9dffaddd84ccee1dd8922a9e618b8a3724187"}
{"ts": "2026-05-27T16:52:40.668961+08:00", "session_id": "20260527_155704_44d2b7", "market": "cn", "formula": "rank(ret_20d-ret_5d)*rank(-(ts_mean(turnover_rate,5)-ts_mean(turnover_rate,20)))", "name": "leader_cooldown_turn_20_5", "is_ic": -0.0139, "is_ic_ir": -0.047, "is_sharpe": -2.069, "is_turnover": 0.253, "is_monotonicity": -0.5, "gates": "FAIL", "status": "reverted", "eval_seconds": 116.3, "sleeve_id": "cn_ai_leadership_cooldown", "mispricing_source": "A-share thematic capital often overreacts to the first breakout, then underprices secondary continuation when turnover fades but price leadership remains intact.", "forced_counterparty": "short-horizon retail and hot-money rotation accounts that must recycle capital after the first spike", "data_requirements": "[\"daily CN price/turnover_rate history\",\"ai_infra CN universe membership and source-review status\",\"benchmark beta/residual attribution vs 000300.SH and 399006.SZ\",\"correlation check vs promoted sleeves\"]", "failure_mode": "It stops working when lower turnover means genuine demand evaporation or when policy/liquidity shocks break leadership across the whole AI complex.", "report_contract": "setup_overlay", "ai_supercycle_layer": "ai_networking_optical_cpo", "supply_chain_hypothesis": "Tape should preferentially surface optical interconnect/CPO/fiber bottleneck names that remain 20-day leaders even as 5-day turnover cools after the first repricing wave.", "relationship_evidence_required": "true", "money_readiness": "research_only", "decision": "revert", "session_branch": "main", "base_ref": "origin/main", "merge_base": "71f9dffaddd84ccee1dd8922a9e618b8a3724187", "head_commit": "71f9dffaddd84ccee1dd8922a9e618b8a3724187"}
