{"ts": "2026-05-21T07:23:35.085723+08:00", "session_id": "20260521_062702_1a7736", "market": "cn", "formula": "rank(-ts_std(amount,20)/(ts_std(amount,60)+1))*rank(-(ts_max(turnover_rate,20)/(ts_mean(turnover_rate,20)+0.01)))", "name": "flow_spike_compress_20_60", "is_ic": -0.0444, "is_ic_ir": -0.157, "is_sharpe": 0.347, "is_turnover": 0.144, "is_monotonicity": 0.6, "gates": "FAIL", "status": "reverted", "eval_seconds": 183.7, "sleeve_id": "cn_ai_flow_accumulation", "mispricing_source": "A-share participants anchor on visible turnover spikes and headline heat, so they underreact to orderly post-spike flow compression that often precedes the next leg in AI-infra leadership.", "forced_counterparty": "T+1 retail momentum traders and small theme funds with ranking pressure who chase turnover spikes and de-risk during quiet digestion", "data_requirements": "[\"Current CN daily amount and turnover_rate are sufficient for IS test\",\"Before promotion: beta-hedged sleeve attribution vs 000300.SH and 399006.SZ\",\"Before promotion: factor correlation vs amount_stability_20,narrow_range_10,ret_vol_diverge_20\",\"Any named supplier/customer explanation needs filings, official PRs, transcripts, or ai_infra evidence cards\"]", "failure_mode": "It stops working in rumor-driven melt-up regimes where the winners are the names with fresh turnover spikes, or in broad de-risking when quiet tape reflects absent bids rather than absorbed supply.", "report_contract": "setup_overlay", "ai_supercycle_layer": "ai_chip_equipment_materials_packaging", "supply_chain_hypothesis": "If valid, this should surface domestic AI bottleneck names in equipment, materials, and advanced packaging where informed capital accumulates before backlog or customer evidence becomes explicit in filings.", "relationship_evidence_required": "true", "money_readiness": "research_only", "decision": "revert", "session_branch": "main", "base_ref": "origin/main", "merge_base": "2eab9f478b0dc49677cbf8591dc6f306dae18a0f", "head_commit": "2eab9f478b0dc49677cbf8591dc6f306dae18a0f"}
{"ts": "2026-05-21T07:23:35.085723+08:00", "session_id": "20260521_062702_1a7736", "market": "cn", "formula": "rank(ts_mean(amount,20)/circ_market_cap)*rank(-ts_std(ret_1d,20))", "name": "float_absorption_calm_20", "is_ic": -0.0736, "is_ic_ir": -0.319, "is_sharpe": -8.403, "is_turnover": 0.071, "is_monotonicity": -0.7, "gates": "FAIL", "status": "reverted", "eval_seconds": 105.7, "sleeve_id": "cn_ai_accumulation", "mispricing_source": "Hidden institutional accumulation and retail underreaction; the market discounts calm tape as \"no catalyst\" even when float is being absorbed.", "forced_counterparty": "Retail swing traders and short-horizon theme funds taking profits or rotating on headlines; liquidity-constrained holders selling into steady bids.", "data_requirements": "[\"daily OHLCV\",\"amount\",\"circ_market_cap\",\"ai_infra universe metadata\",\"benchmark returns for beta-hedge attribution\"]", "failure_mode": "Fails in liquidity panics or headline-squeeze regimes where calm tape means no demand rather than absorption, and decays once it becomes a crowded liquidity screen.", "report_contract": "research_only", "ai_supercycle_layer": "ai_chip_equipment_materials_packaging", "supply_chain_hypothesis": "Domestic AI-capex bottleneck suppliers in equipment, materials, and advanced packaging should show steady float absorption before backlog or order confirmation appears in filings.", "relationship_evidence_required": "true", "money_readiness": "research_only", "decision": "revert", "session_branch": "main", "base_ref": "origin/main", "merge_base": "2eab9f478b0dc49677cbf8591dc6f306dae18a0f", "head_commit": "2eab9f478b0dc49677cbf8591dc6f306dae18a0f"}
{"ts": "2026-05-21T07:23:35.085723+08:00", "session_id": "20260521_062702_1a7736", "market": "cn", "formula": "rank(-ts_corr(ret_1d,shift(ret_1d,1),20))*rank(ts_min(turnover_rate,20)/ts_max(turnover_rate,20))", "name": "anti_autocorr_turnover_corridor_20", "is_ic": -0.0336, "is_ic_ir": -0.127, "is_sharpe": 4.006, "is_turnover": 0.181, "is_monotonicity": 0.9, "gates": "FAIL", "status": "reverted", "eval_seconds": 192.9, "sleeve_id": "cn_ai_flow_underreaction", "mispricing_source": "The market overprices noisy 1-day reversals and underprices steady multi-day absorption visible in participation stability rather than price trend alone.", "forced_counterparty": "Retail momentum traders and benchmark-constrained funds trading around flows rather than intrinsic AI-cycle exposure", "data_requirements": "[\"daily OHLCV\",\"turnover_rate\",\"AI-universe membership\",\"beta-hedged sleeve attribution\",\"correlation-to-existing-sleeves report\"]", "failure_mode": "Fails in one-way speculative melt-ups or panic deleveraging, when turnover expands directionally and daily reversals no longer proxy accumulation.", "report_contract": "action_overlay", "ai_supercycle_layer": "ai_chip_equipment_materials_packaging", "supply_chain_hypothesis": "Within validated CN AI-infra names, upstream bottleneck equipment/material suppliers should show steady turnover corridors before order or capex evidence is fully reflected in price.", "relationship_evidence_required": "true", "money_readiness": "research_only", "decision": "revert", "session_branch": "main", "base_ref": "origin/main", "merge_base": "2eab9f478b0dc49677cbf8591dc6f306dae18a0f", "head_commit": "2eab9f478b0dc49677cbf8591dc6f306dae18a0f"}
{"ts": "2026-05-21T07:23:35.085723+08:00", "session_id": "20260521_062702_1a7736", "market": "cn", "formula": "rank(-ts_corr(ret_5d,shift(ret_5d,5),20))*rank(-ts_std(amount,20)/ts_mean(amount,20))", "name": "weekly_recycle_amount_stability_20", "is_ic": 0.0055, "is_ic_ir": 0.039, "is_sharpe": -1.931, "is_turnover": 0.165, "is_monotonicity": 0.0, "gates": "FAIL", "status": "reverted", "eval_seconds": 228.9, "sleeve_id": "cn_ai_infra_absorption", "mispricing_source": "T+1 theme churn and short-horizon profit-taking create temporary weekly reversals, while stable amount indicates patient capital is still building exposure rather than exiting.", "forced_counterparty": "retail T+1 traders, short-horizon theme funds, and benchmarked managers trimming volatility", "data_requirements": "[\"daily close/ret_5d\",\"daily amount\",\"AI-infra universe membership and source-review status\",\"portfolio beta-hedge and residual risk attribution before promotion\"]", "failure_mode": "It stops working when weekly pullbacks reflect real order or capex disappointment, or when market-wide liquidity stress turns stable amount into trapped supply instead of absorption.", "report_contract": "setup_overlay", "ai_supercycle_layer": "ai_networking_optical_cpo", "supply_chain_hypothesis": "Verified optical-module, CPO, fiber, and interconnect names tied to AI datacenter buildouts should show weekly recycling around a steady accumulation base before the market fully prices the bottleneck.", "relationship_evidence_required": "true", "money_readiness": "research_only", "decision": "revert", "session_branch": "main", "base_ref": "origin/main", "merge_base": "2eab9f478b0dc49677cbf8591dc6f306dae18a0f", "head_commit": "2eab9f478b0dc49677cbf8591dc6f306dae18a0f"}
{"ts": "2026-05-21T07:23:35.085723+08:00", "session_id": "20260521_062702_1a7736", "market": "cn", "formula": "rank(ts_mean(amount / circ_market_cap,20) / ts_max(amount / circ_market_cap,20))", "name": "float_uniform_absorb_20", "is_ic": -0.008, "is_ic_ir": -0.032, "is_sharpe": 5.608, "is_turnover": 0.138, "is_monotonicity": 1.0, "gates": "FAIL", "status": "reverted", "eval_seconds": 108.8, "sleeve_id": "cn_ai_float_absorption", "mispricing_source": "The market overprices visible spike days and underprices slow multi-day float absorption by informed capital in scarce AI supply-chain names.", "forced_counterparty": "retail theme chasers and benchmark-constrained managers who trade around liquidity bursts instead of warehousing inventory across multiple sessions", "data_requirements": "[\"daily amount\",\"circ_market_cap\",\"ai_infra validated universe membership/status\",\"benchmark hedge attribution vs 000300.SH and 399006.SZ\",\"sleeve correlation matrix vs existing promoted factors\"]", "failure_mode": "Stops working when the regime shifts from accumulation to distribution, or when speculative blowoff/liquidity events dominate steady institutional buying.", "report_contract": "fresh_buy_gate", "ai_supercycle_layer": "ai_chip_equipment_materials_packaging", "supply_chain_hypothesis": "candidate bottleneck AI component/equipment names with scarce tradable float are being accumulated before capex/order evidence is fully reflected", "relationship_evidence_required": "true", "money_readiness": "money_candidate", "decision": "revert", "session_branch": "main", "base_ref": "origin/main", "merge_base": "2eab9f478b0dc49677cbf8591dc6f306dae18a0f", "head_commit": "2eab9f478b0dc49677cbf8591dc6f306dae18a0f"}
{"ts": "2026-05-21T07:23:35.085723+08:00", "session_id": "20260521_062702_1a7736", "market": "cn", "formula": "rank(ret_20d - ret_5d) * rank(-(ts_mean(turnover_rate,5) / (ts_mean(turnover_rate,20) + 0.01)))", "name": "leadership_pullback_turnover_cool", "is_ic": 0.0273, "is_ic_ir": 0.087, "is_sharpe": 0.499, "is_turnover": 0.247, "is_monotonicity": 0.3, "gates": "FAIL", "status": "reverted", "eval_seconds": 130.8, "sleeve_id": "cn_ai_infra_pullback_reentry", "mispricing_source": "Fast-money participants dump recent winners as turnover cools, while institutions cannot instantly complete accumulation in mid-cap AI-infra names; conditioning on turnover cooling makes this a sponsorship/reentry signal rather than a raw momentum clone.", "forced_counterparty": "short-horizon retail/theme traders and benchmark-constrained institutions rebalancing around liquidity limits", "data_requirements": "[\"current CN daily bars and daily_basic turnover_rate are sufficient for backtest\", \"before promotion: beta-hedged sleeve attribution vs 000300.SH and 399006.SZ\", \"for any supplier/customer claim: filings, official PRs, transcripts\"]", "failure_mode": "It stops working when turnover compression reflects real demand exhaustion or when market regime shifts to indiscriminate beta chasing where noisy high-turnover breakouts dominate quiet pullback entries.", "report_contract": "setup_overlay", "ai_supercycle_layer": "ai_chip_equipment_materials_packaging", "supply_chain_hypothesis": "Candidate domestic semicap/materials/advanced-packaging bottleneck names for AI capex rerate first, then show low-turnover pullbacks as float is absorbed ahead of renewed order repricing.", "relationship_evidence_required": "true", "money_readiness": "research_only", "decision": "revert", "session_branch": "main", "base_ref": "origin/main", "merge_base": "2eab9f478b0dc49677cbf8591dc6f306dae18a0f", "head_commit": "2eab9f478b0dc49677cbf8591dc6f306dae18a0f"}
{"ts": "2026-05-21T07:23:35.085723+08:00", "session_id": "20260521_062702_1a7736", "market": "cn", "formula": "rank(ts_mean(turnover_rate,20)/ts_max(turnover_rate,20))", "name": "turnover_evenness_20", "is_ic": -0.0095, "is_ic_ir": -0.037, "is_sharpe": 6.448, "is_turnover": 0.137, "is_monotonicity": 0.6, "gates": "FAIL", "status": "reverted", "eval_seconds": 107.3, "sleeve_id": "cn_ai_participation_quality", "mispricing_source": "The market overreacts to visible AI-theme turnover spikes and underprices quieter ownership transfer that has not yet been fully recognized in fundamentals.", "forced_counterparty": "Headline-chasing retail and short-horizon thematic funds reacting to AI policy/news bursts", "data_requirements": "[\"daily turnover_rate history for IS test\", \"benchmark beta/residual attribution vs 000300.SH and 399006.SZ\", \"live correlation monitor versus existing sleeves\", \"AI-layer breadth data before production sizing\"]", "failure_mode": "Stops working in policy-squeeze or limit-up regimes where spike-day participation keeps trending instead of exhausting demand.", "report_contract": "setup_overlay", "ai_supercycle_layer": "ai_chip_equipment_materials_packaging", "supply_chain_hypothesis": "Candidate domestic bottleneck leaders in advanced packaging, testing, and related materials should show even float rotation before fundamentals catch up, rather than one-day speculative turnover bursts.", "relationship_evidence_required": "true", "money_readiness": "research_only", "decision": "revert", "session_branch": "main", "base_ref": "origin/main", "merge_base": "2eab9f478b0dc49677cbf8591dc6f306dae18a0f", "head_commit": "2eab9f478b0dc49677cbf8591dc6f306dae18a0f"}
{"ts": "2026-05-21T07:23:35.085723+08:00", "session_id": "20260521_062702_1a7736", "market": "cn", "formula": "rank(-ts_max(turnover_rate,20)/ts_sum(turnover_rate,20))", "name": "turnover_spike_share_20", "is_ic": -0.0095, "is_ic_ir": -0.037, "is_sharpe": 6.448, "is_turnover": 0.137, "is_monotonicity": 0.6, "gates": "FAIL", "status": "reverted", "eval_seconds": 162.5, "sleeve_id": "cn_ai_infra_flow_uniformity", "mispricing_source": "T+1 and retail-dominated chasing create one-day turnover bursts that overshoot fair value; steady absorption is slower to price and is not just a high-correlation variant of the existing price trend/reversal sleeves because it measures participation concentration, not return path.", "forced_counterparty": "retail momentum chasers and benchmark/rebalance flows that must trade the headline session", "data_requirements": "current CN daily tape, `turnover_rate`, and AI-universe membership are sufficient for IS; promotion needs beta-hedged sleeve attribution and correlation checks versus promoted sleeves", "failure_mode": "It weakens in broad policy-beta melt-ups or true event regimes where one-day turnover spikes carry durable information rather than distribution risk.", "report_contract": "setup_overlay", "ai_supercycle_layer": "none", "supply_chain_hypothesis": "Within the AI-infra universe, orderly non-spike turnover should surface bottleneck names being accumulated before order/backlog evidence is broadly recognized; no specific supplier/customer relationship is asserted.", "relationship_evidence_required": "false", "money_readiness": "research_only", "decision": "revert", "session_branch": "main", "base_ref": "origin/main", "merge_base": "2eab9f478b0dc49677cbf8591dc6f306dae18a0f", "head_commit": "2eab9f478b0dc49677cbf8591dc6f306dae18a0f"}
{"ts": "2026-05-21T07:23:35.085723+08:00", "session_id": "20260521_062702_1a7736", "market": "cn", "formula": "rank(-ts_std(pct_change(amount/circ_market_cap,5),20))*rank(-ts_max(ret_1d,20))", "name": "float_weekly_flow_lowlottery_20", "is_ic": -0.0983, "is_ic_ir": -0.303, "is_sharpe": -3.268, "is_turnover": 0.104, "is_monotonicity": -0.1, "gates": "FAIL", "status": "reverted", "eval_seconds": 108.5, "sleeve_id": "float_flow_underreaction", "mispricing_source": "The payoff comes from underreaction to steady float-level accumulation and overpayment for attention-driven one-day pops; this is a flow-path inefficiency, not a plain 20/60-day price reversal clone.", "forced_counterparty": "Retail momentum chasers, theme traders anchored to limit-up style bursts, and redemption/benchmark-constrained funds that must sell liquid AI names on weak short-term tape.", "data_requirements": "[\"amount\",\"circ_market_cap\",\"ret_1d\",\"AI universe module/depth metadata\",\"benchmark hedge attribution vs 000300.SH/399006.SZ\",\"sleeve correlation and residual risk attribution before promotion\"]", "failure_mode": "It stops working in one-way policy/liquidity melt-up regimes where bursty participation is genuinely informative, or if float-normalized flow smoothness collapses into a large-cap liquidity proxy.", "report_contract": "research_only", "ai_supercycle_layer": "ai_chip_equipment_materials_packaging", "supply_chain_hypothesis": "AI bottleneck suppliers in equipment/materials/packaging should show steadier float-level accumulation and fewer lottery spikes than downstream theme-chasing names during capex repricing phases.", "relationship_evidence_required": "true", "money_readiness": "research_only", "decision": "revert", "session_branch": "main", "base_ref": "origin/main", "merge_base": "2eab9f478b0dc49677cbf8591dc6f306dae18a0f", "head_commit": "2eab9f478b0dc49677cbf8591dc6f306dae18a0f"}
{"ts": "2026-05-21T07:23:35.085723+08:00", "session_id": "20260521_062702_1a7736", "market": "cn", "formula": "rank(-ts_corr(ret_1d,shift(ret_1d,1),20))*rank(-ts_std(pct_change(turnover_rate,5),20))", "name": "anti_autocorr_turnover_recycle_smooth", "is_ic": 0.0109, "is_ic_ir": 0.04, "is_sharpe": 3.283, "is_turnover": 0.178, "is_monotonicity": 0.6, "gates": "FAIL", "status": "reverted", "eval_seconds": 194.5, "sleeve_id": "cn_ai_flow_recycle_overlay", "mispricing_source": "Short-horizon theme traders read daily reversals as failed moves, while slower capital keeps absorbing AI bottleneck names in smooth weekly clips that daily prices only partially reflect.", "forced_counterparty": "T+1 retail traders and VWAP-constrained institutional execution desks that must trade incrementally rather than warehouse inventory.", "data_requirements": "[\"daily OHLCV\",\"amount\",\"turnover_rate\",\"intraday VWAP or order-book imbalance ledger before production promotion\",\"beta-hedged sleeve attribution vs 000300.SH and 399006.SZ\"]", "failure_mode": "It stops working in one-way squeeze or panic regimes where return autocorrelation is no longer negative and turnover changes gap abruptly, or when smooth turnover merely reflects illiquidity instead of real accumulation.", "report_contract": "research_only", "ai_supercycle_layer": "ai_chip_equipment_materials_packaging", "supply_chain_hypothesis": "Candidate semicap, optical, and packaging bottleneck suppliers tied to accelerator and datacenter capex should show orderly float recycling before backlog confirmation reaches filings and source review.", "relationship_evidence_required": "true", "money_readiness": "research_only", "decision": "revert", "session_branch": "main", "base_ref": "origin/main", "merge_base": "2eab9f478b0dc49677cbf8591dc6f306dae18a0f", "head_commit": "2eab9f478b0dc49677cbf8591dc6f306dae18a0f"}
{"ts": "2026-05-21T07:23:35.085723+08:00", "session_id": "20260521_062702_1a7736", "market": "cn", "formula": "ts_std(amount,60)/ts_std(decay_linear(amount,5),20)-ts_corr(amount,high/low-1,20)", "name": "amount_range_compress_absorb_20_60", "is_ic": 0.0321, "is_ic_ir": 0.177, "is_sharpe": 1.415, "is_turnover": 0.109, "is_monotonicity": 0.5, "gates": "FAIL", "status": "reverted", "eval_seconds": 231.8, "sleeve_id": "cn_ai_infra_absorption", "mispricing_source": "Impact-constrained institutions accumulate real AI-infra winners gradually, while T+1 retail and thematic fast money anchor on obvious breakout volume and underprice quiet replenishment after the hype burst.", "forced_counterparty": "short-horizon thematic traders, T+1 retail chasers, and de-risking holders exiting after spike days", "data_requirements": "[\"daily OHLCV\",\"amount\",\"ai_infra reviewed CN universe membership\",\"benchmark beta/hedge attribution vs 000300.SH and 399006.SZ\"]", "failure_mode": "It stops working in broad speculative melt-ups where widening range plus noisy volume is rewarded, or in liquidity-stress regimes where amount compression means demand disappeared rather than supply was absorbed.", "report_contract": "setup_overlay", "ai_supercycle_layer": "ai_chip_equipment_materials_packaging", "supply_chain_hypothesis": "Already-reviewed domestic AI hardware bottleneck suppliers should show post-spike cash-flow compression plus range absorption before downstream capex/order confirmation is fully reflected; no new supplier/customer relationship is asserted here.", "relationship_evidence_required": "false", "money_readiness": "research_only", "decision": "revert", "session_branch": "main", "base_ref": "origin/main", "merge_base": "2eab9f478b0dc49677cbf8591dc6f306dae18a0f", "head_commit": "2eab9f478b0dc49677cbf8591dc6f306dae18a0f"}
{"ts": "2026-05-21T07:23:35.085723+08:00", "session_id": "20260521_062702_1a7736", "market": "cn", "formula": "rank(ret_20d-ret_5d)*rank(-ts_std(amount/circ_market_cap,20))", "name": "leadership_pullback_floatflow_stable", "is_ic": -0.0401, "is_ic_ir": -0.14, "is_sharpe": 1.629, "is_turnover": 0.188, "is_monotonicity": 0.3, "gates": "FAIL", "status": "reverted", "eval_seconds": 71.0, "sleeve_id": "cn_ai_leadership_consolidation", "mispricing_source": "The market overreacts to short pullbacks inside genuine AI-capex leadership while underweight institutions keep accumulating through steady float-scaled flow; the interaction is not just a raw price factor because it requires both trend persistence and stable sponsorship.", "forced_counterparty": "Short-horizon retail profit-takers and benchmark-constrained managers trimming recent winners for risk-control rather than fundamental deterioration", "data_requirements": "[\"daily close/ret_5d/ret_20d/amount/circ_market_cap for factor test\", \"before promotion: sleeve correlation, beta-hedged attribution, residual risk attribution\", \"if used to claim bottleneck supplier status: filings, customer announcements, transcripts\"]", "failure_mode": "This stops working in sharp mean-reversion regimes, policy-led de-rating waves, or when stable amount reflects illiquidity/exit blockage instead of accumulation.", "report_contract": "setup_overlay", "ai_supercycle_layer": "ai_chip_equipment_materials_packaging", "supply_chain_hypothesis": "Potential semicap/materials/packaging bottleneck names that hold medium-term leadership while float-scaled flow stays stable on shallow pullbacks are being accumulated ahead of delayed capex/order confirmation.", "relationship_evidence_required": "true", "money_readiness": "research_only", "decision": "revert", "session_branch": "main", "base_ref": "origin/main", "merge_base": "2eab9f478b0dc49677cbf8591dc6f306dae18a0f", "head_commit": "2eab9f478b0dc49677cbf8591dc6f306dae18a0f"}
