{"ts": "2026-05-21T07:23:35.085723+08:00", "session_id": "20260521_062702_1a7736", "market": "cn", "formula": "rank(ts_mean(amount,20)/(ts_std(amount,20)+1))*rank(-ps_ttm)", "name": "stable_flow_low_ps", "is_ic": 0.0015, "is_ic_ir": 0.007, "is_sharpe": -1.217, "is_turnover": 0.098, "is_monotonicity": 0.0, "gates": "FAIL", "status": "reverted", "eval_seconds": 112.2, "sleeve_id": "cn_ai_value_flow", "mispricing_source": "Gradual institutional accumulation in cheaper AI-infra names is underreacted because most investors wait for explicit order or capacity confirmation.", "forced_counterparty": "Retail breakout chasers and benchmarked managers who avoid lower-multiple, lower-narrative suppliers until the story is obvious.", "data_requirements": "[\"none for signal calc\",\"beta-hedged sleeve PnL\",\"sleeve correlation vs existing factors\",\"ai_infra source-review status\",\"filings/transcripts if any order/backlog claim is attached\"]", "failure_mode": "It stops working when low ps_ttm mainly reflects real demand deterioration or when theme-wide momentum overwhelms valuation discipline.", "report_contract": "fresh_buy_gate", "ai_supercycle_layer": "ai_chip_equipment_materials_packaging", "supply_chain_hypothesis": "Signal should be strongest in CN AI hardware, equipment, and materials names where sticky flow arrives before reported capex or order leverage is broadly believed.", "relationship_evidence_required": "true", "money_readiness": "money_candidate", "decision": "revert", "session_branch": "main", "base_ref": "origin/main", "merge_base": "2eab9f478b0dc49677cbf8591dc6f306dae18a0f", "head_commit": "2eab9f478b0dc49677cbf8591dc6f306dae18a0f"}
{"ts": "2026-05-21T07:23:35.085723+08:00", "session_id": "20260521_062702_1a7736", "market": "cn", "formula": "rank(-ts_std(turnover_rate,20)/(ts_mean(turnover_rate,20)+0.01))", "name": "turnover_stability_20", "is_ic": -0.0281, "is_ic_ir": -0.104, "is_sharpe": 3.158, "is_turnover": 0.12, "is_monotonicity": 0.6, "gates": "FAIL", "status": "reverted", "eval_seconds": 176.0, "sleeve_id": "cn_ai_flow_stability", "mispricing_source": "Retail theme chasing and T+1 churn make the market overreact to visible spikes and underprice quiet ownership transfer; this is a liquidity-supply/holder-quality signal, not a candle or return-shape clone.", "forced_counterparty": "Short-horizon retail rotators and event-driven liquidity takers who must recycle inventory on headlines and theme switches", "data_requirements": "[\"daily_basic.turnover_rate\",\"ai_infra universe membership + source-review status\",\"benchmark hedge series for 000300.SH/399006.SZ residual attribution\"]", "failure_mode": "Stops working when policy/news shock regimes reward high-churn breakout names, or when broad AI de-crowding forces indiscriminate liquidation across the whole sleeve.", "report_contract": "fresh_buy_gate", "ai_supercycle_layer": "none", "supply_chain_hypothesis": "AI-infra names sitting in real bottleneck modules should show steady float absorption before consensus fully prices the demand pull-through; exact module exposure must come from ai_infra metadata, not this formula.", "relationship_evidence_required": "true", "money_readiness": "money_candidate", "decision": "revert", "session_branch": "main", "base_ref": "origin/main", "merge_base": "2eab9f478b0dc49677cbf8591dc6f306dae18a0f", "head_commit": "2eab9f478b0dc49677cbf8591dc6f306dae18a0f"}
{"ts": "2026-05-21T07:23:35.085723+08:00", "session_id": "20260521_062702_1a7736", "market": "cn", "formula": "rank(-ts_corr(ret_1d,shift(ret_1d,1),20))*rank(-ts_max(ret_1d,20))", "name": "autocorr_low_lottery_20", "is_ic": 0.033, "is_ic_ir": 0.182, "is_sharpe": -1.355, "is_turnover": 0.163, "is_monotonicity": 0.1, "gates": "FAIL", "status": "reverted", "eval_seconds": 110.2, "sleeve_id": "cn_ai_leadership_path_quality", "mispricing_source": "Path-quality underreaction, not raw trend; it captures supply absorption and avoidance of lottery-demand names, so it should be less collinear than simple momentum/reversal factors.", "forced_counterparty": "Retail thematic chasers and T+1 constrained short-horizon funds that chase conspicuous spike days and rotate out of smoother grinders.", "data_requirements": "[\"current daily price data is sufficient for IS test\",\"before promotion require sleeve beta-hedge return, rolling correlation vs promoted sleeves, and residual drawdown attribution\"]", "failure_mode": "Stops working in rumor/gap-driven tape where one-day spikes, limit-up chains, or policy headlines dominate steady accumulation and overwhelm path-quality signals.", "report_contract": "action_overlay", "ai_supercycle_layer": "none", "supply_chain_hypothesis": "none", "relationship_evidence_required": "false", "money_readiness": "research_only", "decision": "revert", "session_branch": "main", "base_ref": "origin/main", "merge_base": "2eab9f478b0dc49677cbf8591dc6f306dae18a0f", "head_commit": "2eab9f478b0dc49677cbf8591dc6f306dae18a0f"}
{"ts": "2026-05-21T07:23:35.085723+08:00", "session_id": "20260521_062702_1a7736", "market": "cn", "formula": "rank(-ts_corr(ret_1d,shift(ret_1d,1),20))*rank(-ts_std(amount,20)/(ts_mean(amount,20)+1))", "name": "autocorr_smooth_amount_20", "is_ic": 0.0159, "is_ic_ir": 0.102, "is_sharpe": -2.208, "is_turnover": 0.176, "is_monotonicity": -0.3, "gates": "FAIL", "status": "reverted", "eval_seconds": 104.9, "sleeve_id": "cn_ai_infra_accumulation", "mispricing_source": "Retail attention crowds into noisy breakout names, while benchmarked institutions accumulate liquid AI-infra leaders gradually; the market underreacts to smooth capital commitment when the tape itself looks unexciting.", "forced_counterparty": "retail theme chasers, short-horizon liquidity providers, and benchmark-constrained holders rotating out of “slow” names", "data_requirements": "[\"close\",\"ret_1d\",\"amount\",\"AI universe membership\",\"beta-hedged sleeve attribution vs 000300.SH/399006.SZ\",\"correlation to existing promoted sleeves\"]", "failure_mode": "It should fail in straight-line momentum or policy-pulse regimes where noisy positive-autocorr breakouts dominate quiet accumulation, or if amount stability collapses into a pure size/liquidity proxy.", "report_contract": "setup_overlay", "ai_supercycle_layer": "none", "supply_chain_hypothesis": "Quiet accumulation should preferentially surface already-validated AI-infra bottleneck leaders before the market fully prices the next order/capex leg.", "relationship_evidence_required": "true", "money_readiness": "research_only", "decision": "revert", "session_branch": "main", "base_ref": "origin/main", "merge_base": "2eab9f478b0dc49677cbf8591dc6f306dae18a0f", "head_commit": "2eab9f478b0dc49677cbf8591dc6f306dae18a0f"}
{"ts": "2026-05-21T07:23:35.085723+08:00", "session_id": "20260521_062702_1a7736", "market": "cn", "formula": "rank(-ts_corr(ret_5d, turnover_rate, 20))", "name": "orderly_turnover_divergence_20", "is_ic": -0.0142, "is_ic_ir": -0.057, "is_sharpe": -1.514, "is_turnover": 0.149, "is_monotonicity": 0.1, "gates": "FAIL", "status": "reverted", "eval_seconds": 201.9, "sleeve_id": "daily_price_overlay", "mispricing_source": "Cross-sectional underreaction to supply absorption; this is a turnover-return relationship signal, not a high-correlation variant of price level, candlestick shape, or simple reversal.", "forced_counterparty": "Retail momentum traders and liquidity-needing sellers who sell pullbacks and chase strength, leaving patient capital to absorb stock from weak hands.", "data_requirements": "Current CN daily features are sufficient for IS; before promotion require `ai_infra` universe membership/status, sleeve beta-hedge attribution vs `000300.SH`/`399006.SZ`, and correlation to active sleeves.", "failure_mode": "It stops working in panic/liquidity-stress regimes where high turnover on down moves is true distribution, or in mania regimes where genuine leaders need expanding turnover on the way up.", "report_contract": "setup_overlay", "ai_supercycle_layer": "none", "supply_chain_hypothesis": "Candidate AI-infra bottleneck leaders should show orderly pullback absorption inside the validated universe before lagging news confirms repricing; no specific supplier/customer relationship is asserted.", "relationship_evidence_required": "false", "money_readiness": "research_only", "decision": "revert", "session_branch": "main", "base_ref": "origin/main", "merge_base": "2eab9f478b0dc49677cbf8591dc6f306dae18a0f", "head_commit": "2eab9f478b0dc49677cbf8591dc6f306dae18a0f"}
{"ts": "2026-05-21T07:23:35.085723+08:00", "session_id": "20260521_062702_1a7736", "market": "cn", "formula": "rank(ts_mean(amount,20)/(ts_std(amount,20)+1))*rank(-delta(turnover_rate,20))", "name": "stable_amount_turnover_drain", "is_ic": -0.0304, "is_ic_ir": -0.114, "is_sharpe": 1.888, "is_turnover": 0.299, "is_monotonicity": 0.7, "gates": "FAIL", "status": "reverted", "eval_seconds": 94.7, "sleeve_id": "cn_ai_flow_absorption", "mispricing_source": "Retail/theme capital extrapolates visible volume spikes and tends to abandon names once turnover cools, while longer-horizon allocators keep deploying capital steadily; the tape underreacts to that ownership transfer.", "forced_counterparty": "Headline-chasing retail and short-horizon T+1 swing traders who recycle positions when churn drops and immediate excitement fades", "data_requirements": "[\"existing CN daily amount and turnover_rate are sufficient for IS test\",\"promotion requires AI-universe membership/evidence status, benchmark hedge attribution vs 000300.SH and 399006.SZ, and sleeve correlation tracking\"]", "failure_mode": "It fails when turnover compression reflects genuine demand exhaustion or illiquidity rather than absorption, especially after theme breaks or in broad liquidity contraction.", "report_contract": "setup_overlay", "ai_supercycle_layer": "ai_chip_equipment_materials_packaging", "supply_chain_hypothesis": "Candidate D2-D4 CN AI bottleneck suppliers in chip equipment/materials/packaging see quiet float absorption ahead of confirmed backlog and capex recognition.", "relationship_evidence_required": "true", "money_readiness": "research_only", "decision": "revert", "session_branch": "main", "base_ref": "origin/main", "merge_base": "2eab9f478b0dc49677cbf8591dc6f306dae18a0f", "head_commit": "2eab9f478b0dc49677cbf8591dc6f306dae18a0f"}
{"ts": "2026-05-21T07:23:35.085723+08:00", "session_id": "20260521_062702_1a7736", "market": "cn", "formula": "rank(ts_corr(ret_1d,shift(ret_1d,1),20))*rank(-ts_std(turnover_rate,20)/(ts_std(turnover_rate,120)+0.01))", "name": "ret_autocorr_turn_regime_20", "is_ic": 0.0, "is_ic_ir": 0.0, "is_sharpe": 0.0, "is_turnover": 0.0, "is_monotonicity": 0.0, "gates": "FAIL", "status": "reverted", "eval_seconds": 96.1, "sleeve_id": "cn_ai_leadership_overlay", "mispricing_source": "The market overpays for visible spike-day excitement and underprices orderly sponsored trends where turnover noise is falling, so persistent AI-infra leaders are not fully recognized until later.", "forced_counterparty": "retail theme chasers, T+1 fast money, and benchmark-constrained long-only managers that cannot build bottleneck positions early", "data_requirements": "[\"current CN daily fields are sufficient for IS test\",\"before promotion require beta-hedged sleeve attribution vs 000300.SH and 399006.SZ\",\"rolling correlation vs promoted sleeves and amount_stability_20 family\",\"ai_infra pool/depth/source-review tags for sub-universe cuts\",\"any supplier/customer claim still needs filings/press releases/transcripts/evidence cards\"]", "failure_mode": "It stops working in rumor-driven mean-reversion or policy-gap regimes where daily autocorrelation flips sign, or in liquidity stress when lower turnover volatility reflects absence of bids rather than stronger sponsorship.", "report_contract": "setup_overlay", "ai_supercycle_layer": "ai_chip_equipment_materials_packaging", "supply_chain_hypothesis": "Domestic D1-D3 chip equipment, materials, and advanced-packaging bottleneck names should show orderly serial return persistence with quieter turnover before capex, order, or customer evidence is fully trusted by the market.", "relationship_evidence_required": "true", "money_readiness": "research_only", "decision": "revert", "session_branch": "main", "base_ref": "origin/main", "merge_base": "2eab9f478b0dc49677cbf8591dc6f306dae18a0f", "head_commit": "2eab9f478b0dc49677cbf8591dc6f306dae18a0f"}
{"ts": "2026-05-21T07:23:35.085723+08:00", "session_id": "20260521_062702_1a7736", "market": "cn", "formula": "rank(ts_mean(amount,20)/(ts_std(amount,20)+1))*rank(ret_20d-ret_5d)", "name": "stable_amount_leadership_reset", "is_ic": -0.01, "is_ic_ir": -0.057, "is_sharpe": -3.413, "is_turnover": 0.204, "is_monotonicity": -0.9, "gates": "FAIL", "status": "reverted", "eval_seconds": 95.0, "sleeve_id": "cn_ai_infra_pullback_accumulation", "mispricing_source": "Short-horizon traders read the recent dip as trend failure, but stable traded value implies sponsorship is still present; this is a flow-quality plus lifecycle-entry signal, not just another raw price-reversal factor.", "forced_counterparty": "Retail swing traders and benchmark-aware funds trimming recent winners to manage T+1 liquidity and short-term tracking-error optics", "data_requirements": "[\"close/open/high/low/volume/amount\",\"AI-universe membership with module/depth labels\",\"rolling beta and sleeve-correlation attribution\",\"filings/press releases only if later mapped to specific optical/CPO order claims\"]", "failure_mode": "It stops working when AI themes turn into one-day policy/headline regimes or broad deleveraging, because stable amount can then mean distribution rather than accumulation and 5-day weakness becomes real trend decay.", "report_contract": "setup_overlay", "ai_supercycle_layer": "ai_networking_optical_cpo", "supply_chain_hypothesis": "Verified optical/interconnect names exposed to AI-cluster bandwidth bottlenecks should show orderly value absorption during 5-day pullbacks before backlog or order confirmation is fully priced.", "relationship_evidence_required": "true", "money_readiness": "research_only", "decision": "revert", "session_branch": "main", "base_ref": "origin/main", "merge_base": "2eab9f478b0dc49677cbf8591dc6f306dae18a0f", "head_commit": "2eab9f478b0dc49677cbf8591dc6f306dae18a0f"}
{"ts": "2026-05-21T07:23:35.085723+08:00", "session_id": "20260521_062702_1a7736", "market": "cn", "formula": "rank(-ts_std(clamp(pct_change(amount,5),-1,1),20))", "name": "weekly_amount_change_stability_20", "is_ic": 0.0355, "is_ic_ir": 0.228, "is_sharpe": -0.45, "is_turnover": 0.13, "is_monotonicity": 0.05, "gates": "PASS", "status": "reverted", "eval_seconds": 158.0, "sleeve_id": "cn_ai_infra_accumulation", "mispricing_source": "Gradual institutional accumulation in capacity-constrained AI-infra names is underpriced because daily noise traders focus on spikes and headlines, while this factor measures flow smoothness rather than past price direction or candlestick shape.", "forced_counterparty": "Benchmark-hugging mutual funds that cannot concentrate early in smaller bottleneck names, plus retail momentum traders who provide intermittent liquidity on noisy days.", "data_requirements": "[\"daily OHLCV\",\"amount\",\"AI-infra universe membership/source-review status\",\"benchmark hedge series vs 000300.SH and 399006.SZ\",\"sleeve correlation and residual risk attribution\"]", "failure_mode": "It stops working when theme-wide policy/news shocks synchronize volume across the whole book, or when low amount-change volatility is just an illiquidity artifact rather than real accumulation.", "report_contract": "setup_overlay", "ai_supercycle_layer": "ai_chip_equipment_materials_packaging", "supply_chain_hypothesis": "Domestic semicap, materials, and advanced-packaging bottleneck names should exhibit smoother week-over-week traded-amount changes while institutions accumulate ahead of backlog or localization confirmation.", "relationship_evidence_required": "true", "money_readiness": "research_only", "decision": "revert", "session_branch": "main", "base_ref": "origin/main", "merge_base": "2eab9f478b0dc49677cbf8591dc6f306dae18a0f", "head_commit": "2eab9f478b0dc49677cbf8591dc6f306dae18a0f", "oos": "FAIL", "checks_status": "skipped"}
{"ts": "2026-05-21T14:55:05.681559+08:00", "session_id": "20260521_140002_d2b4fa", "market": "cn", "formula": "rank(-ts_corr(ret_1d,shift(ret_1d,1),20))*rank(ts_min(amount/circ_market_cap,20)/ts_mean(amount/circ_market_cap,20))", "name": "anti_autocorr_float_floor_20", "is_ic": -0.0189, "is_ic_ir": -0.071, "is_sharpe": -2.24, "is_turnover": 0.198, "is_monotonicity": -0.55, "gates": "FAIL", "status": "reverted", "eval_seconds": 165.9, "sleeve_id": "cn_aiinfra_flow_underreaction", "mispricing_source": "The market overweights visible price spikes and underweights persistent inventory transfer in scarce-float AI names; this factor targets names where demand stays present on quiet days before narrative confirmation.", "forced_counterparty": "Retail swing traders and benchmark-constrained mutual funds that sell chop or stay underweight specialized AI-infra suppliers until the story is obvious.", "data_requirements": "[\"ret_1d\",\"amount\",\"circ_market_cap\",\"ai_infra universe membership and layer tags\",\"benchmark beta-hedged sleeve attribution\",\"existing-sleeve correlation history\",\"sector breadth by AI layer\",\"optional moneyflow/margin data for confirmation before money-ready\"]", "failure_mode": "It should fail in liquidity-stress or full-theme blowoff regimes, when a persistent flow floor reflects crowding/exit friction instead of informed accumulation.", "report_contract": "setup_overlay", "ai_supercycle_layer": "ai_networking_optical_cpo", "supply_chain_hypothesis": "Candidate CN optical/interconnect bottleneck names inside the reviewed AI universe may show a persistent float-normalized trading floor before official order or capex confirmation is broadly recognized.", "relationship_evidence_required": "true", "money_readiness": "research_only", "decision": "revert", "session_branch": "main", "base_ref": "origin/main", "merge_base": "c550618668ba3d3ec82401f36dd85be095d0fc92", "head_commit": "c550618668ba3d3ec82401f36dd85be095d0fc92"}
{"ts": "2026-05-21T14:55:05.681559+08:00", "session_id": "20260521_140002_d2b4fa", "market": "cn", "formula": "rank(-ts_corr(ret_1d,shift(ret_1d,1),20))*rank(-(ts_max(turnover_rate,20)/ts_mean(turnover_rate,20)))", "name": "anti_autocorr_turnover_spike_20", "is_ic": -0.041, "is_ic_ir": -0.137, "is_sharpe": -2.877, "is_turnover": 0.191, "is_monotonicity": -0.45, "gates": "FAIL", "status": "reverted", "eval_seconds": 144.0, "sleeve_id": "daily_price_overlay", "mispricing_source": "Underreaction from steady absorption in constrained-float names; this is a participation-shape signal, not just another pure price or candlestick factor.", "forced_counterparty": "short-horizon retail momentum traders and benchmarked managers forced to trade around visible volume spikes rather than accumulate quietly", "data_requirements": "[\"daily tape testable now\",\"before money-ready: intraday volume curve, northbound/broker flow, block-trade or large-order ledger, beta-hedged residual attribution by sleeve\"]", "failure_mode": "It should stop working in broad speculative melt-ups where crowding spikes are rewarded instead of penalized, or in panic/liquidity shock regimes where negative autocorr just reflects distress.", "report_contract": "setup_overlay", "ai_supercycle_layer": "none", "supply_chain_hypothesis": "validated AI-infra bottleneck candidates should show steady float turnover with limited spike days before fundamentals or source-reviewed demand evidence are broadly recognized", "relationship_evidence_required": "false", "money_readiness": "research_only", "decision": "revert", "session_branch": "main", "base_ref": "origin/main", "merge_base": "c550618668ba3d3ec82401f36dd85be095d0fc92", "head_commit": "c550618668ba3d3ec82401f36dd85be095d0fc92"}
{"ts": "2026-05-21T14:55:05.681559+08:00", "session_id": "20260521_140002_d2b4fa", "market": "cn", "formula": "rank(ts_mean(amount/circ_market_cap,20))*rank(-ts_std(turnover_rate,20))", "name": "float_absorb_stable_20", "is_ic": -0.0009, "is_ic_ir": -0.005, "is_sharpe": -1.329, "is_turnover": 0.119, "is_monotonicity": -0.05, "gates": "FAIL", "status": "reverted", "eval_seconds": 105.3, "sleeve_id": "cn_ai_flow_accumulation", "mispricing_source": "The market underreacts to steady ownership transfer into AI bottleneck names because most participants wait for explicit order/backlog proof; stable float absorption reveals sponsorship earlier than fundamentals are published.", "forced_counterparty": "short-term retail traders and liquidity-motivated legacy holders providing stock; benchmark-constrained institutions that must scale slowly rather than chase immediately", "data_requirements": "[\"current CN daily amount\",\"circ_market_cap\",\"turnover_rate\",\"benchmark beta/residual attribution vs 000300.SH and 399006.SZ before promotion\"]", "failure_mode": "It should weaken when theme rotation becomes one-day speculative churn, or when policy/news shocks dominate and stable accumulation no longer leads forward returns.", "report_contract": "setup_overlay", "ai_supercycle_layer": "ai_chip_equipment_materials_packaging", "supply_chain_hypothesis": "Domestic semi-equipment, materials, and advanced-packaging bottleneck names should show persistent float absorption before verified backlog or customer disclosures appear.", "relationship_evidence_required": "true", "money_readiness": "research_only", "decision": "revert", "session_branch": "main", "base_ref": "origin/main", "merge_base": "c550618668ba3d3ec82401f36dd85be095d0fc92", "head_commit": "c550618668ba3d3ec82401f36dd85be095d0fc92"}
