{"ts": "2026-05-20T14:55:34.707427+08:00", "session_id": "20260520_140002_6d34ae", "market": "cn", "formula": "rank(ret_20d-ret_5d)*rank(-ts_corr(turnover_rate,ret_1d,20))", "name": "leader_absorption_pullback_20", "is_ic": -0.0777, "is_ic_ir": -0.265, "is_sharpe": 0.519, "is_turnover": 0.22, "is_monotonicity": 0.1, "gates": "FAIL", "status": "reverted", "eval_seconds": 98.4, "sleeve_id": "cn_ai_optical_bottleneck_pullback", "mispricing_source": "Short-horizon traders extrapolate recent weakness and sell into digestion, while institutional buyers accumulate bottleneck names without chasing strength.", "forced_counterparty": "Retail momentum traders and benchmarked thematic funds trimming into drawdown and T+1 liquidity pressure.", "data_requirements": "[\"CN daily price/turnover fields\",\"ai_infra layer/depth tags to restrict to verified AI-infra names\",\"benchmark hedge and sleeve-correlation ledger before promotion\"]", "failure_mode": "Fails when down-day turnover is true distribution or macro deleveraging rather than absorption; also weaker in one-way melt-up regimes with no pullback entry edge.", "report_contract": "setup_overlay", "ai_supercycle_layer": "ai_networking_optical_cpo", "supply_chain_hypothesis": "Verified optical/CPO and interconnect bottleneck suppliers should reassert leadership after shallow pullbacks as AI datacenter capex expectations pull forward.", "relationship_evidence_required": "true", "money_readiness": "research_only", "decision": "revert", "session_branch": "main", "base_ref": "origin/main", "merge_base": "2eab9f478b0dc49677cbf8591dc6f306dae18a0f", "head_commit": "2eab9f478b0dc49677cbf8591dc6f306dae18a0f"}
{"ts": "2026-05-20T14:55:34.707427+08:00", "session_id": "20260520_140002_6d34ae", "market": "cn", "formula": "rank(ts_corr(amount,ret_1d,20))*rank(-ts_std(volume_ratio,20))", "name": "cash_upday_stability_20", "is_ic": 0.0062, "is_ic_ir": 0.041, "is_sharpe": -2.518, "is_turnover": 0.175, "is_monotonicity": -0.3, "gates": "FAIL", "status": "reverted", "eval_seconds": 110.1, "sleeve_id": "cn_ai_flow_accumulation", "mispricing_source": "Benchmark-constrained and underweight funds re-rate verified AI-infra exposure gradually; tape underreacts because order/capex confirmation arrives later than the cash-accumulation phase.", "forced_counterparty": "T+1 retail traders and short-horizon profit takers supplying liquidity during orderly accumulation; generalist managers who rebalance slowly.", "data_requirements": "[\"daily OHLCV\",\"amount\",\"volume_ratio\",\"beta-hedged sleeve attribution\",\"factor correlation matrix vs promoted sleeves\",\"filings/transcripts/order announcements if used to assert bottleneck relationships\"]", "failure_mode": "Fails in rumor-chasing regimes where cash-on-up-days is driven by speculative bursts, or in deleveraging markets where orderly accumulation stops and liquidity demand dominates fundamentals.", "report_contract": "fresh_buy_gate", "ai_supercycle_layer": "ai_chip_equipment_materials_packaging", "supply_chain_hypothesis": "Domestic AI packaging/equipment bottleneck names may exhibit steady cash-on-up-days accumulation before official AI capex, capacity, or order disclosures confirm the demand path.", "relationship_evidence_required": "true", "money_readiness": "money_candidate", "decision": "revert", "session_branch": "main", "base_ref": "origin/main", "merge_base": "2eab9f478b0dc49677cbf8591dc6f306dae18a0f", "head_commit": "2eab9f478b0dc49677cbf8591dc6f306dae18a0f"}
{"ts": "2026-05-20T14:55:34.707427+08:00", "session_id": "20260520_140002_6d34ae", "market": "cn", "formula": "rank(ts_mean(amount/circ_market_cap,20)/ts_std(amount/circ_market_cap,20))*rank(ts_mean(close/open-1,10))", "name": "float_body_accumulation_20", "is_ic": 0.043, "is_ic_ir": 0.158, "is_sharpe": 3.227, "is_turnover": 0.207, "is_monotonicity": 0.8, "gates": "FAIL", "status": "reverted", "eval_seconds": 103.0, "sleeve_id": "cn_ai_flow_absorption", "mispricing_source": "A-share retail and fast money underreact to patient institutional accumulation in scarce AI-infra names; float-adjusted flow stays persistent while closes keep finishing above opens before evidence is widely recognized.", "forced_counterparty": "redemption-driven mutual funds and headline-chasing retail traders", "data_requirements": "[\"daily amount/open/close/circ_market_cap in CN AI universe\",\"factor correlation vs stable_float_flow_20 and quiet_amount_absorption_20\",\"beta-hedged sleeve attribution vs 000300.SH and 399006.SZ\",\"ai_infra source-review status before production promotion\"]", "failure_mode": "It stops working when the regime becomes pure one-day speculation or policy-beta chasing, so steady float flow no longer indicates informed accumulation and intraday body just reflects crowded momentum.", "report_contract": "setup_overlay", "ai_supercycle_layer": "ai_chip_equipment_materials_packaging", "supply_chain_hypothesis": "Candidate domestic semicap and advanced-packaging bottleneck names should show stable float-adjusted absorption and positive body bias before official capex/order confirmation.", "relationship_evidence_required": "true", "money_readiness": "research_only", "decision": "revert", "session_branch": "main", "base_ref": "origin/main", "merge_base": "2eab9f478b0dc49677cbf8591dc6f306dae18a0f", "head_commit": "2eab9f478b0dc49677cbf8591dc6f306dae18a0f"}
{"ts": "2026-05-20T14:55:34.707427+08:00", "session_id": "20260520_140002_6d34ae", "market": "cn", "formula": "rank(ts_min(turnover_rate,20)/ts_std(turnover_rate,20))*rank(ts_mean((close-open)/(high-low+0.01),5))", "name": "turnover_floor_body_bias_20", "is_ic": -0.0489, "is_ic_ir": -0.174, "is_sharpe": 1.831, "is_turnover": 0.314, "is_monotonicity": 0.3, "gates": "FAIL", "status": "reverted", "eval_seconds": 214.8, "sleeve_id": "cn_ai_accumulation_overlay", "mispricing_source": "Slow institutional accumulation is not fully reflected by simple momentum screens; this factor measures persistent sponsorship plus tape confirmation rather than chasing headline spikes.", "forced_counterparty": "Retail event-chasers and short-horizon liquidity providers selling into steady bids", "data_requirements": "[\"daily OHLCV\",\"amount\",\"turnover_rate\",\"portfolio beta-hedge and residual-risk attribution vs 000300.SH/399006.SZ before promotion\"]", "failure_mode": "It breaks when stable turnover floors become crowded exit liquidity, or when policy/headline gaps dominate tape so body bias no longer reflects real accumulation.", "report_contract": "setup_overlay", "ai_supercycle_layer": "ai_chip_equipment_materials_packaging", "supply_chain_hypothesis": "Candidate discovery signal for domestic AI compute packaging/equipment bottleneck names where staged sponsorship appears before verified order or capex evidence is fully priced.", "relationship_evidence_required": "true", "money_readiness": "research_only", "decision": "revert", "session_branch": "main", "base_ref": "origin/main", "merge_base": "2eab9f478b0dc49677cbf8591dc6f306dae18a0f", "head_commit": "2eab9f478b0dc49677cbf8591dc6f306dae18a0f"}
{"ts": "2026-05-20T14:55:34.707427+08:00", "session_id": "20260520_140002_6d34ae", "market": "cn", "formula": "rank(-ts_std(delta(log(amount/circ_market_cap),5),20))*rank(-ts_std(close/open-1,20))", "name": "weekly_logfloat_body_stability_20", "is_ic": -0.1311, "is_ic_ir": -0.363, "is_sharpe": -5.251, "is_turnover": 0.1, "is_monotonicity": -0.4, "gates": "FAIL", "status": "reverted", "eval_seconds": 297.6, "sleeve_id": "daily_flow_overlay", "mispricing_source": "Underreaction to patient ownership transfer in AI-infra leaders; this is a flow-path and tape-quality signal, not a high-correlation clone of raw momentum or the existing close-rank factor.", "forced_counterparty": "Retail theme chasers and redemption/benchmark-constrained holders who only react to visible price expansion and supply stock into steady bids", "data_requirements": "Base signal uses current daily data only: [amount, circ_market_cap, open, close]. Promotion to money-ready sleeve needs beta-hedge and residual attribution vs CN benchmarks plus correlation checks against existing flow sleeves.", "failure_mode": "Fails in rumor/limit-up regimes or broad liquidation tapes where calm bodies reflect lack of participation rather than informed accumulation", "report_contract": "fresh_buy_gate", "ai_supercycle_layer": "ai_chip_equipment_materials_packaging", "supply_chain_hypothesis": "If accelerator capacity remains constrained, advanced-packaging and semicap enablers in the CN AI chain should show smooth float-adjusted accumulation and orderly candles before explicit order/backlog evidence is public", "relationship_evidence_required": "true", "money_readiness": "money_candidate", "decision": "revert", "session_branch": "main", "base_ref": "origin/main", "merge_base": "2eab9f478b0dc49677cbf8591dc6f306dae18a0f", "head_commit": "2eab9f478b0dc49677cbf8591dc6f306dae18a0f"}
{"ts": "2026-05-20T14:55:34.707427+08:00", "session_id": "20260520_140002_6d34ae", "market": "cn", "formula": "rank(ts_mean(volume_ratio,20)/ts_max(volume_ratio,20))*rank(-ts_mean(high/low-1,10))", "name": "relvol_even_quiet_range_20", "is_ic": 0.041, "is_ic_ir": 0.206, "is_sharpe": -1.641, "is_turnover": 0.142, "is_monotonicity": -0.2, "gates": "PASS", "status": "checks_failed", "eval_seconds": 196.7, "sleeve_id": "daily_price_overlay", "mispricing_source": "A-share thematic traders overpay for breakout candles and volume spikes, while steady accumulation without dramatic tape gets underreacted.", "forced_counterparty": "retail day traders and short-horizon theme rotators who supply liquidity when tape looks “too quiet”", "data_requirements": "[\"current daily OHLCV+volume_ratio is sufficient for IS test\",\"deployment needs sleeve beta hedge stats, residual risk attribution, and correlation to existing turnover/amount sleeves\",\"any supplier/customer interpretation still needs source-reviewed filings/news\"]", "failure_mode": "It should fail in squeeze/chase regimes where high-range breakout names dominate and quiet accumulation stops being rewarded.", "report_contract": "setup_overlay", "ai_supercycle_layer": "ai_chip_equipment_materials_packaging", "supply_chain_hypothesis": "Domestic AI bottleneck equipment/material/packaging names may show steady relative-volume sponsorship with low intraday volatility before verified order/backlog evidence is public.", "relationship_evidence_required": "true", "money_readiness": "research_only", "decision": "revert", "session_branch": "main", "base_ref": "origin/main", "merge_base": "2eab9f478b0dc49677cbf8591dc6f306dae18a0f", "head_commit": "2eab9f478b0dc49677cbf8591dc6f306dae18a0f", "oos": "PASS", "checks_status": "failed"}
{"ts": "2026-05-20T14:55:34.707427+08:00", "session_id": "20260520_140002_6d34ae", "market": "cn", "formula": "rank(ts_std(amount,60)/ts_std(amount,20))*rank(ts_mean(volume_ratio,20)/ts_max(volume_ratio,20))", "name": "amount_compress_relvol_even_20_60", "is_ic": 0.021, "is_ic_ir": 0.13, "is_sharpe": -0.668, "is_turnover": 0.142, "is_monotonicity": 0.0, "gates": "FAIL", "status": "reverted", "eval_seconds": 157.6, "sleeve_id": "cn_ai_flow_accumulation", "mispricing_source": "Short-horizon AI-theme capital exits after spikes, but slower institutional buyers accumulate bottleneck names in small clips; the market underreacts because the flow looks calm rather than dramatic.", "forced_counterparty": "Retail momentum chasers and benchmarked managers de-risking extended AI-theme positions", "data_requirements": "[\"current daily CN fields are sufficient for factor test\", \"ai_infra universe membership plus source-review status\", \"beta/residual attribution vs 000300.SH and 399006.SZ before production\", \"if used to assert bottleneck exposure, verify with filings/press releases/transcripts/verified news\"]", "failure_mode": "It stops working in tape regimes dominated by policy-gap chasing or indiscriminate liquidity stress, where one-day turnover spikes outperform steady accumulation and flow compression no longer signals informed buying.", "report_contract": "setup_overlay", "ai_supercycle_layer": "ai_chip_equipment_materials_packaging", "supply_chain_hypothesis": "D1-D3 semiconductor equipment/materials/packaging bottleneck names should show flow compression plus even participation before capex or order evidence is fully priced.", "relationship_evidence_required": "true", "money_readiness": "research_only", "decision": "revert", "session_branch": "main", "base_ref": "origin/main", "merge_base": "2eab9f478b0dc49677cbf8591dc6f306dae18a0f", "head_commit": "2eab9f478b0dc49677cbf8591dc6f306dae18a0f"}
{"ts": "2026-05-20T14:55:34.707427+08:00", "session_id": "20260520_140002_6d34ae", "market": "cn", "formula": "rank(ts_corr(ret_5d,turnover_rate,20))*rank(ts_min(turnover_rate,20)/ts_mean(turnover_rate,20))", "name": "turnover_floor_return_alignment_20", "is_ic": -0.0094, "is_ic_ir": -0.043, "is_sharpe": 3.219, "is_turnover": 0.186, "is_monotonicity": 0.7, "gates": "FAIL", "status": "reverted", "eval_seconds": 159.1, "sleeve_id": "cn_ai_infra_sponsorship", "mispricing_source": "The market underreacts to quiet, sponsored consolidations in AI-infra names because visible theme heat is lower on pullbacks even when the underlying holder base is improving.", "forced_counterparty": "T+1 retail momentum traders and benchmark-constrained long-only managers who chase headline strength but do not accumulate during low-turnover digestion", "data_requirements": "[\"Current CN daily close/ret_5d/turnover_rate is sufficient for IS test\",\"Before promotion: beta-hedged sleeve attribution vs 000300.SH and 399006.SZ\",\"Sleeve correlation matrix vs existing promoted factors\",\"Any named supplier/customer explanation requires ai_infra source review\"]", "failure_mode": "It stops working in retail-mania or policy-rumor regimes where the winners are the stocks with explosive turnover on the way up, or in broad de-risking when low-turnover pullbacks reflect absence of bids rather than absorption.", "report_contract": "setup_overlay", "ai_supercycle_layer": "ai_chip_equipment_materials_packaging", "supply_chain_hypothesis": "If valid, this should surface domestic AI bottleneck names in equipment/materials/advanced packaging where institutions build positions before backlog, capex, or customer confirmation becomes explicit in filings.", "relationship_evidence_required": "true", "money_readiness": "research_only", "decision": "revert", "session_branch": "main", "base_ref": "origin/main", "merge_base": "2eab9f478b0dc49677cbf8591dc6f306dae18a0f", "head_commit": "2eab9f478b0dc49677cbf8591dc6f306dae18a0f"}
{"ts": "2026-05-20T14:55:34.707427+08:00", "session_id": "20260520_140002_6d34ae", "market": "cn", "formula": "rank(-ts_corr(ret_5d,pct_change(turnover_rate,5),20))*rank(-ts_std(close/open,20))", "name": "turnchg_openclose_absorb_20", "is_ic": -0.1473, "is_ic_ir": -0.439, "is_sharpe": -11.623, "is_turnover": 0.143, "is_monotonicity": -1.0, "gates": "FAIL", "status": "reverted", "eval_seconds": 185.5, "sleeve_id": "cn_ai_accumulation_quality", "mispricing_source": "The market overreacts to noisy breakout days and underprices slow institutional accumulation in thematic AI-infra leaders when turnover changes are absorbed without disorderly intraday action.", "forced_counterparty": "Retail hot-money, short-horizon mean-reverters, and benchmarked funds supplying liquidity while larger investors scale in gradually", "data_requirements": "Current daily tape is sufficient for discovery; before promotion require sleeve correlation vs existing factors, beta-hedged attribution vs 000300.SH/399006.SZ, residual risk/drawdown stats, and ai_infra source-review metadata if any bottleneck/supplier narrative is attached", "failure_mode": "Fails in rumor-driven chase regimes or deleveraging tapes where rising turnover reflects distribution instead of absorption and close/open stability loses information", "report_contract": "setup_overlay", "ai_supercycle_layer": "ai_chip_equipment_materials_packaging", "supply_chain_hypothesis": "Candidate CN semiconductor equipment/materials/packaging bottleneck names should show absorbed float-turnover increases and stable intraday closes before backlog/capex evidence is fully priced", "relationship_evidence_required": "true", "money_readiness": "research_only", "decision": "revert", "session_branch": "main", "base_ref": "origin/main", "merge_base": "2eab9f478b0dc49677cbf8591dc6f306dae18a0f", "head_commit": "2eab9f478b0dc49677cbf8591dc6f306dae18a0f"}
{"ts": "2026-05-21T07:23:35.085723+08:00", "session_id": "20260521_062702_1a7736", "market": "cn", "formula": "rank(-ts_std(delta(turnover_rate,5),20))*rank(ts_mean((close-open)/(high-low+0.01),20))", "name": "weekly_turnchg_body_absorb_20", "is_ic": -0.0659, "is_ic_ir": -0.233, "is_sharpe": 6.047, "is_turnover": 0.177, "is_monotonicity": 0.7, "gates": "FAIL", "status": "reverted", "eval_seconds": 154.9, "sleeve_id": "cn_aiinfra_flow_absorption", "mispricing_source": "Patient institutional accumulation shows up in stable participation-change paths and firm close location while the market waits for headline, order, or policy confirmation.", "forced_counterparty": "Retail T+1 traders and benchmarked sector-rotation funds that sell or ignore names without immediate breakout confirmation.", "data_requirements": "[\"CN daily OHLCV\",\"daily turnover_rate\",\"ai_infra universe depth/module/pool tags\",\"benchmark beta/residual attribution for hedge sizing\",\"original-source review only if a specific supplier/customer narrative is attached\"]", "failure_mode": "It stops working in gap-chasing policy mania or liquidation regimes, when turnover spikes and close-location no longer separates accumulation from noisy speculation.", "report_contract": "setup_overlay", "ai_supercycle_layer": "ai_chip_equipment_materials_packaging", "supply_chain_hypothesis": "Domestic AI equipment and advanced packaging bottleneck names with verified ties to accelerator and datacenter capex should show calm weekly turnover absorption before public order confirmation.", "relationship_evidence_required": "true", "money_readiness": "research_only", "decision": "revert", "session_branch": "main", "base_ref": "origin/main", "merge_base": "2eab9f478b0dc49677cbf8591dc6f306dae18a0f", "head_commit": "2eab9f478b0dc49677cbf8591dc6f306dae18a0f"}
{"ts": "2026-05-21T07:23:35.085723+08:00", "session_id": "20260521_062702_1a7736", "market": "cn", "formula": "rank(-pb)*rank(ts_min(turnover_rate,20)/ts_mean(turnover_rate,20))", "name": "pb_turnover_floor_20", "is_ic": -0.0734, "is_ic_ir": -0.313, "is_sharpe": -8.855, "is_turnover": 0.13, "is_monotonicity": -0.9, "gates": "FAIL", "status": "reverted", "eval_seconds": 98.0, "sleeve_id": "cn_ai_infra_value_flow", "mispricing_source": "Slow recognition of capex-cycle beneficiaries inside the AI chain; capital crowds into expensive narrative leaders and leaves cheaper steady-flow names under-owned.", "forced_counterparty": "Retail theme chasers and benchmark-aware managers forced into liquid headline names rather than duller asset-heavy enablers", "data_requirements": "[\"current daily_basic fields are enough for IS test\",\"for promotion: filings/transcripts/backlog/capex to verify AI-order capture\",\"portfolio beta and residual attribution vs 000300.SH and 399006.SZ\"]", "failure_mode": "It stops working when speculative AI momentum overwhelms valuation discipline, or when PB is distorted by one-off balance-sheet events.", "report_contract": "setup_overlay", "ai_supercycle_layer": "hard_assets_energy_heavy", "supply_chain_hypothesis": "Capital-intensive AI infrastructure enablers are quietly accumulated before datacenter, power, or localization capex evidence is fully reflected in price.", "relationship_evidence_required": "true", "money_readiness": "research_only", "decision": "revert", "session_branch": "main", "base_ref": "origin/main", "merge_base": "2eab9f478b0dc49677cbf8591dc6f306dae18a0f", "head_commit": "2eab9f478b0dc49677cbf8591dc6f306dae18a0f"}
{"ts": "2026-05-21T07:23:35.085723+08:00", "session_id": "20260521_062702_1a7736", "market": "cn", "formula": "rank(ts_mean(amount,20)/ts_std(amount,20))*rank(ts_mean(turnover_rate,20)/ts_mean(turnover_rate,5))", "name": "stable_amount_lockup_20", "is_ic": -0.0202, "is_ic_ir": -0.073, "is_sharpe": 2.401, "is_turnover": 0.179, "is_monotonicity": 0.9, "gates": "FAIL", "status": "reverted", "eval_seconds": 160.2, "sleeve_id": "cn_ai_accumulation", "mispricing_source": "The market underreacts to quiet accumulation in validated AI-infra leaders because attention is pulled toward noisier high-turnover themes, while this signal captures committed capital before explicit catalyst recognition.", "forced_counterparty": "Retail theme-chasers and liquidity-constrained mutual funds rotating or redeeming out of consolidating names.", "data_requirements": "[\"daily amount\",\"daily turnover_rate\",\"CN benchmark returns for beta-hedge attribution\",\"existing sleeve correlation matrix\"]; any supplier/order interpretation still requires ai_infra source review and evidence cards", "failure_mode": "It stops working when leadership shifts to pure speculative breakout regimes, or when stable amount mostly reflects passive mega-cap liquidity rather than real float absorption.", "report_contract": "action_overlay", "ai_supercycle_layer": "ai_chip_equipment_materials_packaging", "supply_chain_hypothesis": "Quiet accumulation should surface first in domestic AI compute, packaging, and equipment bottleneck names before verified order or backlog evidence is broadly disseminated.", "relationship_evidence_required": "true", "money_readiness": "research_only", "decision": "revert", "session_branch": "main", "base_ref": "origin/main", "merge_base": "2eab9f478b0dc49677cbf8591dc6f306dae18a0f", "head_commit": "2eab9f478b0dc49677cbf8591dc6f306dae18a0f"}
