{"ts": "2026-05-19T14:57:21.606121+08:00", "session_id": "20260519_140003_acf528", "market": "cn", "formula": "rank(-ts_corr(ret_1d,shift(ret_1d,1),20))*rank(-(ts_max(turnover_rate,20)/ts_mean(turnover_rate,20)))", "name": "anti_autocorr_turnover_spike_share_20", "is_ic": -0.0144, "is_ic_ir": -0.052, "is_sharpe": 5.552, "is_turnover": 0.2, "is_monotonicity": 0.9, "gates": "FAIL", "status": "reverted", "eval_seconds": 209.5, "sleeve_id": "cn_ai_flow_absorption", "mispricing_source": "The market overpays for visible one-day AI-theme bursts and underprices quieter names where sponsorship is persistent but not headline-driven; this is a flow-quality signal, not a pure price-trend clone.", "forced_counterparty": "Benchmarked thematic funds and ETF-related allocators that must scale into AI-capex exposure gradually, plus short-term retail/news chasers who provide liquidity around shallow shakeouts.", "data_requirements": "[\"daily OHLCV\",\"amount\",\"turnover_rate\",\"AI-universe membership\",\"post-backtest beta-hedge return and residual risk attribution\"]; any specific supplier/customer narrative still needs filings, press releases, or transcripts.", "failure_mode": "It stops working in policy-squeeze or retail-mania regimes where one-day turnover spikes keep leading returns, or in broad liquidity stress when stable participation no longer signals sponsorship.", "report_contract": "fresh_buy_gate", "ai_supercycle_layer": "ai_chip_equipment_materials_packaging", "supply_chain_hypothesis": "Within the reviewed CN AI universe, this should preferentially surface bottleneck semiconductor equipment/materials/packaging names being accumulated ahead of downstream accelerator and datacenter buildouts.", "relationship_evidence_required": "true", "money_readiness": "money_candidate", "decision": "revert", "session_branch": "main", "base_ref": "origin/main", "merge_base": "b127bcb38ef90487e053bb7009fa8bafbe89687b", "head_commit": "b127bcb38ef90487e053bb7009fa8bafbe89687b"}
{"ts": "2026-05-19T14:57:21.606121+08:00", "session_id": "20260519_140003_acf528", "market": "cn", "formula": "rank(ret_20d) * rank(ts_mean(turnover_rate,20)/ts_mean(turnover_rate,5))", "name": "leader_turnover_dryup_20", "is_ic": 0.0435, "is_ic_ir": 0.138, "is_sharpe": 0.553, "is_turnover": 0.247, "is_monotonicity": 0.8, "gates": "FAIL", "status": "reverted", "eval_seconds": 110.5, "sleeve_id": "cn_ai_leader_absorption", "mispricing_source": "A-share thematic leaders are often mispriced during low-activity consolidations because fast-money flow chases volume and underweights names whose float has tightened after an initial advance.", "forced_counterparty": "short-horizon retail momentum traders, leveraged theme accounts, and benchmarked PMs who cannot warehouse quiet consolidations", "data_requirements": "[\"daily price/return data\",\"daily turnover_rate\",\"AI-universe membership mask\",\"beta-hedged sleeve attribution and sleeve-correlation report before promotion\"]", "failure_mode": "It stops working when turnover dry-up reflects collapsing demand rather than absorption, especially in broad risk-off or post-theme-break regimes where prior leaders lose narrative sponsorship.", "report_contract": "setup_overlay", "ai_supercycle_layer": "ai_chip_equipment_materials_packaging", "supply_chain_hypothesis": "Domestic AI bottleneck equipment/material names that already led over the last month and then show turnover dry-up are being accumulated ahead of downstream capex, packaging, or optical-link order confirmation.", "relationship_evidence_required": "true", "money_readiness": "research_only", "decision": "revert", "session_branch": "main", "base_ref": "origin/main", "merge_base": "b127bcb38ef90487e053bb7009fa8bafbe89687b", "head_commit": "b127bcb38ef90487e053bb7009fa8bafbe89687b"}
{"ts": "2026-05-19T14:57:21.606121+08:00", "session_id": "20260519_140003_acf528", "market": "cn", "formula": "rank(-ts_std(amount,20)/ts_mean(amount,20))*rank(ret_20d-ret_5d)", "name": "stable_amount_pullback_20", "is_ic": -0.0086, "is_ic_ir": -0.049, "is_sharpe": -3.244, "is_turnover": 0.204, "is_monotonicity": -0.85, "gates": "FAIL", "status": "reverted", "eval_seconds": 23.8, "sleeve_id": "cn_ai_leadership_reaccel", "mispricing_source": "Medium-horizon capital reallocators underreact to the difference between orderly institutional absorption and noisy retail pullbacks, so temporary weakness in stable-flow leaders is mispriced.", "forced_counterparty": "Retail momentum traders and short-horizon funds reducing exposure after near-term weakness; benchmarked managers who cannot add quickly outside rebalance windows.", "data_requirements": "[] for factor test; before promotion, require long alpha vs beta-hedge attribution, sleeve correlation, and AI-universe source-review status from `ai_infra`", "failure_mode": "Fails when stable trading value reflects exhaustion/illiquidity rather than accumulation, or when the market regime rewards pure breakout chasing over pullback continuation.", "report_contract": "setup_overlay", "ai_supercycle_layer": "ai_chip_equipment_materials_packaging", "supply_chain_hypothesis": "Orderly capital absorption should cluster in domestic AI bottleneck suppliers where localization and capex cycles keep medium-term demand expectations anchored.", "relationship_evidence_required": "true", "money_readiness": "research_only", "decision": "revert", "session_branch": "main", "base_ref": "origin/main", "merge_base": "b127bcb38ef90487e053bb7009fa8bafbe89687b", "head_commit": "b127bcb38ef90487e053bb7009fa8bafbe89687b"}
{"ts": "2026-05-19T14:57:21.606121+08:00", "session_id": "20260519_140003_acf528", "market": "cn", "formula": "rank(-ts_std(delta(log(amount),5),20))*rank(ts_min(turnover_rate,20)/ts_mean(turnover_rate,20))", "name": "flow_floor_corridor_20", "is_ic": -0.0553, "is_ic_ir": -0.209, "is_sharpe": 0.577, "is_turnover": 0.135, "is_monotonicity": 0.6, "gates": "FAIL", "status": "reverted", "eval_seconds": 181.8, "sleeve_id": "cn_ai_infra_accumulation", "mispricing_source": "A-share investors underreact to steady real-money accumulation because it looks dull on the tape; this uses value-flow path smoothness and a participation floor, not a high-correlation price-only signal.", "forced_counterparty": "Retail momentum traders and benchmarked funds that sell or ignore low-excitement consolidations until a later confirmation move.", "data_requirements": "[\"daily OHLCV\",\"daily_basic amount\",\"daily_basic turnover_rate\",\"ai_infra universe layer/evidence metadata\",\"beta-hedge attribution vs 000300.SH and 399006.SZ\"]", "failure_mode": "It stops working in headline-driven, gap-heavy regimes where speculative turnover spikes dominate and quiet accumulation is no longer the marginal price setter.", "report_contract": "setup_overlay", "ai_supercycle_layer": "ai_chip_equipment_materials_packaging", "supply_chain_hypothesis": "Candidate bottleneck repricing in domestic semiconductor equipment, materials, and advanced-packaging names; steady value-flow plus a turnover floor can surface pre-consensus order absorption.", "relationship_evidence_required": "true", "money_readiness": "research_only", "decision": "revert", "session_branch": "main", "base_ref": "origin/main", "merge_base": "b127bcb38ef90487e053bb7009fa8bafbe89687b", "head_commit": "b127bcb38ef90487e053bb7009fa8bafbe89687b"}
{"ts": "2026-05-19T14:57:21.606121+08:00", "session_id": "20260519_140003_acf528", "market": "cn", "formula": "rank(-(ts_max(turnover_rate,20)/ts_mean(turnover_rate,20)))*rank(-ts_mean(high/low-1,10))", "name": "turnover_spike_absorption_20", "is_ic": -0.1315, "is_ic_ir": -0.378, "is_sharpe": -2.832, "is_turnover": 0.166, "is_monotonicity": -0.1, "gates": "FAIL", "status": "reverted", "eval_seconds": 172.5, "sleeve_id": "cn_ai_quiet_absorption", "mispricing_source": "Underreaction to stealth institutional accumulation in validated AI-infra names; the market overweights noisy breakout confirmation and underweights orderly absorption.", "forced_counterparty": "Retail attention traders and benchmark-constrained funds that rotate toward high-volume confirmation and away from quiet, low-range names.", "data_requirements": "[\"daily price/volume/daily_basic already sufficient for signal eval\",\"beta-hedged sleeve attribution vs 000300.SH and 399006.SZ\",\"sleeve correlation/drawdown stats\",\"filings/press releases/transcripts before any bottleneck supplier claim is promoted\"]", "failure_mode": "Fails in speculative burst regimes where turnover spikes are the only path to repricing, or in broad mean-reversion tapes where quiet low-range names are simply stale liquidity traps.", "report_contract": "setup_overlay", "ai_supercycle_layer": "ai_chip_equipment_materials_packaging", "supply_chain_hypothesis": "Potential domestic AI hardware bottleneck suppliers are accumulated on quiet tape before capex/order visibility becomes consensus.", "relationship_evidence_required": "true", "money_readiness": "research_only", "decision": "revert", "session_branch": "main", "base_ref": "origin/main", "merge_base": "b127bcb38ef90487e053bb7009fa8bafbe89687b", "head_commit": "b127bcb38ef90487e053bb7009fa8bafbe89687b"}
{"ts": "2026-05-19T14:57:21.606121+08:00", "session_id": "20260519_140003_acf528", "market": "cn", "formula": "rank(ts_corr(volume_ratio,shift(volume_ratio,1),20))*rank(ts_min(low,20)/ts_mean(low,20))", "name": "support_relvol_persist_20", "is_ic": -0.0076, "is_ic_ir": -0.043, "is_sharpe": -3.808, "is_turnover": 0.18, "is_monotonicity": -0.5, "gates": "FAIL", "status": "reverted", "eval_seconds": 159.8, "sleeve_id": "cn_ai_infra_flow_support", "mispricing_source": "The market overweights loud turnover spikes and underweights repeated, orderly participation that keeps lows elevated; delayed recognition of sponsorship creates medium-horizon continuation.", "forced_counterparty": "Retail theme traders, short-horizon profit takers, and benchmark-constrained mutual funds rebalancing for mandate/liquidity reasons rather than 10-20 day alpha.", "data_requirements": "[\"daily OHLCV and volume_ratio on the source-reviewed CN ai_infra universe\",\"beta-hedged sleeve PnL vs 000300.SH and 399006.SZ\",\"rolling correlation vs promoted sleeves\",\"residual risk attribution by AI layer\",\"official filings/releases before any supplier or customer claim is upgraded from hypothesis\"]", "failure_mode": "Fails in policy-beta melt-up or liquidation regimes where persistent relative volume reflects crowding instead of informed accumulation, or when rising floors break because macro liquidity dominates stock-specific sponsorship.", "report_contract": "research_only", "ai_supercycle_layer": "ai_chip_equipment_materials_packaging", "supply_chain_hypothesis": "Validated domestic semicap, materials, and advanced-packaging bottleneck names should show recurring relative-volume sponsorship and higher lows before public order/backlog evidence fully confirms AI capacity translation.", "relationship_evidence_required": "true", "money_readiness": "research_only", "decision": "revert", "session_branch": "main", "base_ref": "origin/main", "merge_base": "b127bcb38ef90487e053bb7009fa8bafbe89687b", "head_commit": "b127bcb38ef90487e053bb7009fa8bafbe89687b"}
{"ts": "2026-05-19T14:57:21.606121+08:00", "session_id": "20260519_140003_acf528", "market": "cn", "formula": "rank(ts_mean(turnover_rate,20) / (ts_std(turnover_rate,20) + 0.01))", "name": "float_flow_stability_20", "is_ic": -0.0105, "is_ic_ir": -0.04, "is_sharpe": 3.526, "is_turnover": 0.122, "is_monotonicity": 0.8, "gates": "FAIL", "status": "reverted", "eval_seconds": 107.5, "sleeve_id": "cn_ai_infra_flow_stability", "mispricing_source": "The market underreacts to gradual, float-normalized accumulation because patient institutional buying is less salient than headline spikes and gets incorporated slowly.", "forced_counterparty": "Short-horizon retail traders and benchmarked mutual funds trading under liquidity and tracking-error constraints", "data_requirements": "[\"daily turnover_rate history\",\"AI universe membership and source-review status\",\"beta-hedged sleeve PnL\",\"residual risk attribution\",\"correlation vs amount_stability_20\"]", "failure_mode": "It stops working in speculative chase or forced-deleveraging regimes, when one-day turnover spikes outperform steady accumulation and the signal degrades into an illiquidity proxy.", "report_contract": "fresh_buy_gate", "ai_supercycle_layer": "none", "supply_chain_hypothesis": "Stable float-normalized turnover should surface D1-D3 AI-infra bottleneck leaders being accumulated before backlog or order evidence is visible; no specific supplier/customer relationship is asserted from current data.", "relationship_evidence_required": "false", "money_readiness": "money_candidate", "decision": "revert", "session_branch": "main", "base_ref": "origin/main", "merge_base": "b127bcb38ef90487e053bb7009fa8bafbe89687b", "head_commit": "b127bcb38ef90487e053bb7009fa8bafbe89687b"}
{"ts": "2026-05-19T14:57:21.606121+08:00", "session_id": "20260519_140003_acf528", "market": "cn", "formula": "rank(ts_mean(turnover_rate,20)/(max(pb,0.5)*(ts_std(delta(turnover_rate,5),20)+0.01)))", "name": "pb_turnover_drift_smooth_20", "is_ic": 0.0, "is_ic_ir": 0.0, "is_sharpe": 0.0, "is_turnover": 0.0, "is_monotonicity": 0.0, "gates": "FAIL", "status": "compute_error", "eval_seconds": 263.9, "sleeve_id": "daily_value_flow_overlay", "mispricing_source": "Balance-sheet anchoring and benchmark frictions delay repricing of hard-asset AI beneficiaries; steady ownership transfer shows up in smooth turnover before earnings/backlog confirmation.", "forced_counterparty": "Legacy holders and benchmarked funds that stay underweight low-multiple infra names until reported AI capex demand is obvious; short-horizon theme traders prefer crowded high-multiple stories.", "data_requirements": "[\"current CN daily tape + daily_basic pb/turnover_rate for IS test\", \"beta-hedged sleeve return and residual risk attribution\", \"correlation vs existing promoted sleeves\", \"debt/backlog/capex filings before any thesis is upgraded beyond setup\"]", "failure_mode": "This stops working if the market is dominated by pure narrative chasing of high-multiple names, or if low PB is mostly distress/credit risk rather than underappreciated AI-capex exposure.", "report_contract": "setup_overlay", "ai_supercycle_layer": "hard_assets_energy_heavy", "supply_chain_hypothesis": "Validated CN hard-asset AI enablers tied to datacenter power, cooling, equipment, packaging, or grid buildout may start rerating through steady ownership transfer before backlog visibility is explicit in reported fundamentals.", "relationship_evidence_required": "true", "money_readiness": "research_only", "decision": "revert", "session_branch": "main", "base_ref": "origin/main", "merge_base": "b127bcb38ef90487e053bb7009fa8bafbe89687b", "head_commit": "b127bcb38ef90487e053bb7009fa8bafbe89687b"}
{"ts": "2026-05-19T14:57:21.606121+08:00", "session_id": "20260519_140003_acf528", "market": "cn", "formula": "rank(ret_20d) * rank(-ts_std(turnover_rate,20))", "name": "leader_turnover_stability_20", "is_ic": -0.0344, "is_ic_ir": -0.113, "is_sharpe": 0.909, "is_turnover": 0.184, "is_monotonicity": 0.7, "gates": "FAIL", "status": "reverted", "eval_seconds": 136.1, "sleeve_id": "cn_ai_leadership_accumulation", "mispricing_source": "Benchmark-lagged institutions accumulate AI bottleneck leaders gradually, while retail/thematic flows overprice noisy turnover bursts and underprice orderly sponsorship.", "forced_counterparty": "Short-horizon T+1 traders taking profits and benchmarked managers constrained by rebalance timing.", "data_requirements": "[\"daily OHLCV + turnover_rate for CN AI-infra universe\",\"benchmark hedge ledger vs 000300.SH and 399006.SZ\",\"rolling correlation vs kshadow_5 and amount_stability_20\",\"source-review metadata before promoting any supply-chain narrative\"]", "failure_mode": "Fails in violent mean-reversion or rumor-squeeze regimes where unstable laggards with turnover spikes outperform steady leaders.", "report_contract": "setup_overlay", "ai_supercycle_layer": "ai_chip_equipment_materials_packaging", "supply_chain_hypothesis": "Orderly 20-day leadership should preferentially surface domestic semiconductor equipment, materials, and advanced-packaging bottleneck names before capex/order evidence is fully diffused.", "relationship_evidence_required": "true", "money_readiness": "research_only", "decision": "revert", "session_branch": "main", "base_ref": "origin/main", "merge_base": "b127bcb38ef90487e053bb7009fa8bafbe89687b", "head_commit": "b127bcb38ef90487e053bb7009fa8bafbe89687b"}
{"ts": "2026-05-19T14:57:21.606121+08:00", "session_id": "20260519_140003_acf528", "market": "cn", "formula": "rank(ts_mean(amount,20)/ts_std(amount,20)) * rank(close/ts_max(high,20))", "name": "stable_amount_near_high_20", "is_ic": -0.0026, "is_ic_ir": -0.017, "is_sharpe": -3.099, "is_turnover": 0.185, "is_monotonicity": -0.8, "gates": "FAIL", "status": "reverted", "eval_seconds": 77.6, "sleeve_id": "daily_price_overlay", "mispricing_source": "Orderly capital commitment plus tight range positioning indicates unfinished institutional accumulation, not just fast momentum; requiring stable amount should reduce overlap with pure price-chase factors.", "forced_counterparty": "T+1 profit-takers and benchmark-constrained underweight long-only funds", "data_requirements": "[\"current daily data is sufficient for IS test\", \"promotion requires sleeve-level beta-hedged return, residual return attribution, and correlation vs existing promoted sleeves\"]", "failure_mode": "It should fail when AI-infra leadership becomes mean-reverting, policy headline-driven, or breakout behavior turns into blowoff speculation with unstable turnover.", "report_contract": "fresh_buy_gate", "ai_supercycle_layer": "ai_networking_optical_cpo", "supply_chain_hypothesis": "Candidate bottleneck leadership in optical/interconnect names tied to AI cluster buildout should appear first as stable capital absorption and near-high price persistence before fundamental confirmation.", "relationship_evidence_required": "true", "money_readiness": "money_candidate", "decision": "revert", "session_branch": "main", "base_ref": "origin/main", "merge_base": "b127bcb38ef90487e053bb7009fa8bafbe89687b", "head_commit": "b127bcb38ef90487e053bb7009fa8bafbe89687b"}
{"ts": "2026-05-19T14:57:21.606121+08:00", "session_id": "20260519_140003_acf528", "market": "cn", "formula": "rank(-(ts_std(amount/circ_market_cap,20)/ts_std(amount/circ_market_cap,60)))*rank(ts_mean((close-open)/(high-low+0.01),20))", "name": "float_compress_body_bias_20_60", "is_ic": 0.0, "is_ic_ir": 0.0, "is_sharpe": 0.0, "is_turnover": 0.0, "is_monotonicity": 0.0, "gates": "FAIL", "status": "reverted", "eval_seconds": 137.9, "sleeve_id": "daily_price_overlay", "mispricing_source": "Slow recognition of real AI-capex winners; float tightens quietly before consensus updates, while the tape still looks too boring for fast-money participation.", "forced_counterparty": "benchmarked generalist funds and T+1 retail swing traders recycling inventory on quiet sessions", "data_requirements": "[\"Current CN daily fields are sufficient for IS test\",\"promotion requires beta-hedged and residual-return attribution vs 000300.SH/399006.SZ\",\"specific supplier/customer claims need source-reviewed evidence cards\"]", "failure_mode": "It stops working in broad policy-beta meltups or panic selloffs, where float compression no longer means informed accumulation and candle-body strength becomes regime noise.", "report_contract": "fresh_buy_gate", "ai_supercycle_layer": "ai_datacenter_edge_infra", "supply_chain_hypothesis": "Candidate datacenter, cooling, power, and interconnect bottleneck names should exhibit recent float-turnover compression with steady upper-body closes before formal capex or order confirmation reaches the market.", "relationship_evidence_required": "true", "money_readiness": "money_candidate", "decision": "revert", "session_branch": "main", "base_ref": "origin/main", "merge_base": "b127bcb38ef90487e053bb7009fa8bafbe89687b", "head_commit": "b127bcb38ef90487e053bb7009fa8bafbe89687b"}
