{"ts": "2026-05-22T14:55:41.759860+08:00", "session_id": "20260522_140003_ff19e4", "market": "cn", "formula": "rank(ts_mean(amount/circ_market_cap,20)/ts_mean(amount/circ_market_cap,120))*rank(-ts_mean(abs(delta(volume_ratio,1)),20))", "name": "floatflow_reaccel_relvol_even_20_120", "is_ic": 0.0, "is_ic_ir": -0.004, "is_sharpe": -1.036, "is_turnover": 0.117, "is_monotonicity": -0.1, "gates": "FAIL", "status": "reverted", "eval_seconds": 149.9, "sleeve_id": "cn_ai_flow_accumulation", "mispricing_source": "AI-capex repricing diffuses slowly into second-line CN supply-chain names; rising float-normalized flow with smooth participation tends to be underreacted to because the tape looks too quiet for momentum capital and lacks source-confirmed headlines.", "forced_counterparty": "Retail breakout chasers and benchmarked managers waiting for obvious price confirmation or verified order news", "data_requirements": "[\"daily OHLCV/amount/volume_ratio/circ_market_cap (available)\", \"AI-infra sleeve beta-hedge and residual risk attribution\", \"original-source filings/PRs/transcripts before any supplier-order claim is promoted\"]", "failure_mode": "Fails in headline-driven melt-ups or broad de-risking when noisy beta dominates cross-section and orderly accumulation no longer distinguishes winners.", "report_contract": "setup_overlay", "ai_supercycle_layer": "ai_chip_equipment_materials_packaging", "supply_chain_hypothesis": "Quiet float-flow reacceleration should surface upstream AI-capex bottleneck suppliers before verified customer/order disclosure reaches the tape.", "relationship_evidence_required": "true", "money_readiness": "research_only", "decision": "revert", "session_branch": "main", "base_ref": "origin/main", "merge_base": "c99187be1dc8d78a84147200981562efcde7b8d5", "head_commit": "c99187be1dc8d78a84147200981562efcde7b8d5"}
{"ts": "2026-05-22T14:55:41.759860+08:00", "session_id": "20260522_140003_ff19e4", "market": "cn", "formula": "rank(-ts_corr(turnover_rate,shift(turnover_rate,1),20))*rank(ts_min(amount/circ_market_cap,20)/ts_mean(amount/circ_market_cap,120))", "name": "turn_auto_floatfloor_20_120", "is_ic": 0.0694, "is_ic_ir": 0.283, "is_sharpe": 5.853, "is_turnover": 0.157, "is_monotonicity": 0.45, "gates": "PASS", "status": "reverted", "eval_seconds": 168.0, "sleeve_id": "daily_flow_regime_overlay", "mispricing_source": "The market overreacts to visible breakout tape and underreacts to quiet sponsorship building, especially when float-adjusted demand stays firm without a clean price trend.", "forced_counterparty": "T+1 retail hot-money traders and benchmark-aware managers trimming volatile AI names that are not yet showing obvious breakout confirmation.", "data_requirements": "[\"current CN daily fields suffice for IS test\",\"for promotion: ai_infra universe tags, beta-hedged attribution vs 000300.SH/399006.SZ, sleeve correlation to promoted factors\"]", "failure_mode": "It stops working if rising activity floors are driven by speculative churn or policy/beta melt-up rather than real sponsorship, so flow quality no longer separates winners from crowded theme beta.", "report_contract": "setup_overlay", "ai_supercycle_layer": "ai_chip_equipment_materials_packaging", "supply_chain_hypothesis": "Within source-reviewed CN AI hardware bottlenecks, this should surface packaging/equipment/material names being accumulated ahead of broader order, capex, or localization confirmation.", "relationship_evidence_required": "true", "money_readiness": "research_only", "decision": "revert", "session_branch": "main", "base_ref": "origin/main", "merge_base": "c99187be1dc8d78a84147200981562efcde7b8d5", "head_commit": "c99187be1dc8d78a84147200981562efcde7b8d5", "oos": "FAIL", "checks_status": "skipped"}
{"ts": "2026-05-22T14:55:41.759860+08:00", "session_id": "20260522_140003_ff19e4", "market": "cn", "formula": "rank(-ts_corr(turnover_rate,shift(turnover_rate,5),20)+ts_min(turnover_rate,20)/ts_mean(turnover_rate,120))", "name": "weekly_turn_reset_floor_20_120", "is_ic": 0.0049, "is_ic_ir": 0.024, "is_sharpe": -0.473, "is_turnover": 0.168, "is_monotonicity": 0.2, "gates": "FAIL", "status": "reverted", "eval_seconds": 163.5, "sleeve_id": "daily_turnover_reaccel_overlay", "mispricing_source": "T+1 retail profit-taking and benchmark-constrained thematic funds de-risk after weekly bursts, while slower capital keeps a baseline bid in validated AI-infra names; the market underprices that surviving sponsorship.", "forced_counterparty": "Retail swing traders and benchmarked theme funds trimming after short-term crowding", "data_requirements": "[\"daily turnover_rate history\",\"ai_infra universe/evidence-state filter\",\"beta-hedged sleeve attribution\",\"correlation vs promoted factors and current sleeves\"]", "failure_mode": "Fails in speculative melt-up regimes where weekly turnover bursts keep compounding, or in liquidity stress where a high turnover floor reflects distribution rather than accumulation.", "report_contract": "setup_overlay", "ai_supercycle_layer": "none", "supply_chain_hypothesis": "Within the reviewed CN AI-infra universe, D1-D3 bottleneck names that keep a durable turnover floor through weekly churn are likely being accumulated ahead of the next capex/order repricing leg.", "relationship_evidence_required": "false", "money_readiness": "research_only", "decision": "revert", "session_branch": "main", "base_ref": "origin/main", "merge_base": "c99187be1dc8d78a84147200981562efcde7b8d5", "head_commit": "c99187be1dc8d78a84147200981562efcde7b8d5"}
{"ts": "2026-05-25T07:23:06.199590+08:00", "session_id": "20260525_062703_ae377b", "market": "cn", "formula": "rank(ts_mean(amount/circ_market_cap,20)/ts_std(amount/circ_market_cap,20))*rank(-(ts_max(turnover_rate,20)/ts_mean(turnover_rate,20)))", "name": "float_spike_absorb_20", "is_ic": -0.0508, "is_ic_ir": -0.198, "is_sharpe": -4.026, "is_turnover": 0.147, "is_monotonicity": -0.5, "gates": "FAIL", "status": "reverted", "eval_seconds": 165.1, "sleeve_id": "daily_flow_absorption", "mispricing_source": "A-share participants chase obvious turnover spikes but discount slow balance-sheet-driven accumulation; benchmarked managers also scale into smaller-float AI names gradually, delaying price discovery.", "forced_counterparty": "retail theme chasers and fast-rotation funds that provide liquidity on quiet days and pay up on later breakout confirmation", "data_requirements": "[current CN daily data is sufficient for IS test, correlation check vs amount/turnover stability sleeves, beta-hedged attribution vs 000300.SH and 399006.SZ, sleeve drawdown/concentration stats, filings/news only if mapping winners to specific supplier/backlog claims]", "failure_mode": "This stops working in retail melt-up or forced deleveraging regimes where turnover spikes carry real information instead of froth, or when quiet flow is just illiquidity rather than accumulation.", "report_contract": "setup_overlay", "ai_supercycle_layer": "ai_chip_equipment_materials_packaging", "supply_chain_hypothesis": "Within source-reviewed CN AI universe, domestic chip equipment/materials/packaging bottleneck names should display steady float-adjusted absorption before backlog and capex recognition is fully priced.", "relationship_evidence_required": "true", "money_readiness": "research_only", "decision": "revert", "session_branch": "main", "base_ref": "origin/main", "merge_base": "c99187be1dc8d78a84147200981562efcde7b8d5", "head_commit": "c99187be1dc8d78a84147200981562efcde7b8d5"}
{"ts": "2026-05-25T07:23:06.199590+08:00", "session_id": "20260525_062703_ae377b", "market": "cn", "formula": "rank(ts_mean(amount/circ_market_cap,20)-ts_std(amount/circ_market_cap,20))", "name": "float_value_absorption_20", "is_ic": 0.0253, "is_ic_ir": 0.086, "is_sharpe": 2.946, "is_turnover": 0.044, "is_monotonicity": -0.1, "gates": "FAIL", "status": "reverted", "eval_seconds": 87.6, "sleeve_id": "daily_flow_absorption", "mispricing_source": "Retail-dominated A-shares overreact to headline momentum and failed breakouts, while longer-horizon capital in crowded AI-infra names must build positions gradually; this creates a lag between steady absorption and full price discovery.", "forced_counterparty": "Short-horizon retail theme traders and benchmark-sensitive managers who cut or rotate after noisy price action, supplying stock to slower institutional accumulators.", "data_requirements": "[\"current CN daily price/volume/daily_basic is sufficient for IS testing\",\"portfolio beta-hedge and residual risk attribution before promotion\",\"ai_infra evidence cards if a picked name is to be explained as a verified supply-chain beneficiary\"]", "failure_mode": "It stops working when the market shifts to rumor-driven one-day squeezes or broad liquidity stress, where stable flow signals inactivity rather than accumulation.", "report_contract": "setup_overlay", "ai_supercycle_layer": "ai_chip_equipment_materials_packaging", "supply_chain_hypothesis": "Candidate D1-D3 domestic bottleneck equipment/materials/packaging names are accumulated through steady float absorption before verified capex, order, or localization evidence is fully reflected in price.", "relationship_evidence_required": "true", "money_readiness": "research_only", "decision": "revert", "session_branch": "main", "base_ref": "origin/main", "merge_base": "c99187be1dc8d78a84147200981562efcde7b8d5", "head_commit": "c99187be1dc8d78a84147200981562efcde7b8d5"}
{"ts": "2026-05-25T07:23:06.199590+08:00", "session_id": "20260525_062703_ae377b", "market": "cn", "formula": "rank(-ts_corr(ret_1d, shift(ret_1d, 1), 20)) * rank(ts_mean(amount / circ_market_cap, 20) / ts_max(amount / circ_market_cap, 20))", "name": "anti_autocorr_float_evenness_20", "is_ic": -0.0399, "is_ic_ir": -0.135, "is_sharpe": -2.623, "is_turnover": 0.187, "is_monotonicity": -0.45, "gates": "FAIL", "status": "reverted", "eval_seconds": 199.0, "sleeve_id": "cn_ai_infra_accumulation", "mispricing_source": "Quiet institutional accumulation in tight-float AI suppliers is underpriced because A-share capital overreacts to visible breakouts and underweights steady inventory transfer.", "forced_counterparty": "retail momentum traders plus benchmark/rebalance sellers providing liquidity", "data_requirements": "[\"current CN daily tape features are sufficient for IS test\", \"promotion needs ai_infra source-review status, sleeve correlation, and beta-hedged attribution vs 000300.SH and 399006.SZ\"]", "failure_mode": "Stops working in rumor-driven limit-up rotations or macro de-risking regimes where spiky crowding dominates steady absorption.", "report_contract": "research_only", "ai_supercycle_layer": "ai_chip_equipment_materials_packaging", "supply_chain_hypothesis": "Domestic AI chip-equipment, materials, and advanced-packaging bottlenecks should surface first as steady float absorption with weak-day support before verified order or backlog evidence appears.", "relationship_evidence_required": "true", "money_readiness": "research_only", "decision": "revert", "session_branch": "main", "base_ref": "origin/main", "merge_base": "c99187be1dc8d78a84147200981562efcde7b8d5", "head_commit": "c99187be1dc8d78a84147200981562efcde7b8d5"}
{"ts": "2026-05-25T07:23:06.199590+08:00", "session_id": "20260525_062703_ae377b", "market": "cn", "formula": "rank(ts_min(turnover_rate,20)/(ts_mean(turnover_rate,20)+0.01))*rank(-ts_corr(ret_1d,shift(ret_1d,1),40))", "name": "anti_autocorr_turnover_floor_20", "is_ic": 0.0042, "is_ic_ir": 0.029, "is_sharpe": -1.735, "is_turnover": 0.157, "is_monotonicity": -0.1, "gates": "FAIL", "status": "reverted", "eval_seconds": 147.5, "sleeve_id": "daily_flow_absorption", "mispricing_source": "T+1 retail churn and liquidity-constrained institutional execution create orderly supply absorption that a pure price factor does not capture.", "forced_counterparty": "short-horizon retail traders taking quick profits and benchmark/margin constrained holders selling pullbacks", "data_requirements": "[\"current CN daily price and turnover_rate are sufficient for IS test\",\"promotion needs beta-hedged sleeve attribution, factor-correlation audit, and realized slippage/turnover ledger\",\"optional moneyflow/margin data to validate the absorption mechanism\"]", "failure_mode": "It should decay in one-way policy beta or panic deleveraging regimes, where return autocorrelation becomes trend-driven and a high turnover floor reflects crowding instead of accumulation.", "report_contract": "fresh_buy_gate", "ai_supercycle_layer": "none", "supply_chain_hypothesis": "Within the CN AI-infra universe, true bottleneck leaders should show persistent participation-floor accumulation and quick dip absorption before the next demand leg is fully priced.", "relationship_evidence_required": "false", "money_readiness": "money_candidate", "decision": "revert", "session_branch": "main", "base_ref": "origin/main", "merge_base": "c99187be1dc8d78a84147200981562efcde7b8d5", "head_commit": "c99187be1dc8d78a84147200981562efcde7b8d5"}
{"ts": "2026-05-25T07:23:06.199590+08:00", "session_id": "20260525_062703_ae377b", "market": "cn", "formula": "rank(ts_mean(amount/circ_market_cap,20)/(ts_std(amount/circ_market_cap,20)+0.0001))", "name": "float_amount_stability_20", "is_ic": -0.0409, "is_ic_ir": -0.155, "is_sharpe": -3.958, "is_turnover": 0.142, "is_monotonicity": -0.5, "gates": "FAIL", "status": "reverted", "eval_seconds": 92.6, "sleeve_id": "cn_ai_flow_accumulation", "mispricing_source": "Slow institutional accumulation in bottleneck AI-infra names is underreacted to because retail flows anchor on visible breakouts and narratives, not on persistent float-adjusted value absorption.", "forced_counterparty": "Retail theme chasers and liquidity-motivated sellers providing stock to patient accumulators", "data_requirements": "[\"amount\",\"circ_market_cap\",\"benchmark returns for beta-hedged attribution\",\"rolling sleeve correlation vs promoted factors\",\"ai_infra universe BFS tags for post-trade attribution\"]", "failure_mode": "Fails in pure headline-chasing regimes where gap moves dominate quiet accumulation, or when low variance in float-adjusted amount mostly identifies stale large-cap defensives rather than true sponsorship.", "report_contract": "fresh_buy_gate", "ai_supercycle_layer": "none", "supply_chain_hypothesis": "Quiet float absorption should preferentially surface D1-D3 CN AI-infra bottleneck suppliers before source-reviewed order/backlog evidence is broadly recognized.", "relationship_evidence_required": "true", "money_readiness": "money_candidate", "decision": "revert", "session_branch": "main", "base_ref": "origin/main", "merge_base": "c99187be1dc8d78a84147200981562efcde7b8d5", "head_commit": "c99187be1dc8d78a84147200981562efcde7b8d5"}
{"ts": "2026-05-25T07:23:06.199590+08:00", "session_id": "20260525_062703_ae377b", "market": "cn", "formula": "rank(-ret_5d/ts_std(turnover_rate,20))", "name": "quiet_pullback_turnover_20", "is_ic": 0.0178, "is_ic_ir": 0.071, "is_sharpe": -1.749, "is_turnover": 0.348, "is_monotonicity": 0.05, "gates": "FAIL", "status": "reverted", "eval_seconds": 112.8, "sleeve_id": "ai_infra_pullback_reentry", "mispricing_source": "Short-horizon theme traders and calendar rotators sell recent losers mechanically, while slower institutional holders in validated AI-infra leaders do not release much inventory, creating temporary underpricing with low churn.", "forced_counterparty": "Retail momentum traders, margin users, and fast thematic rotation funds", "data_requirements": "[\"CN daily ret_5d and turnover_rate on the source-reviewed AI-infra universe\",\"benchmark beta-hedged sleeve attribution before promotion\",\"correlation check vs existing sleeves\"]", "failure_mode": "Fails when low-turnover pullbacks reflect hidden fundamental deterioration, or when the market shifts to indiscriminate high-beta chasing where orderly consolidations stop bouncing.", "report_contract": "setup_overlay", "ai_supercycle_layer": "none", "supply_chain_hypothesis": "Source-reviewed AI-infra bottleneck winners should show orderly pullbacks with stable turnover before the next repricing leg; exact supplier/customer links remain narrative-only until verified in evidence cards.", "relationship_evidence_required": "true", "money_readiness": "research_only", "decision": "revert", "session_branch": "main", "base_ref": "origin/main", "merge_base": "c99187be1dc8d78a84147200981562efcde7b8d5", "head_commit": "c99187be1dc8d78a84147200981562efcde7b8d5"}
{"ts": "2026-05-25T07:23:06.199590+08:00", "session_id": "20260525_062703_ae377b", "market": "cn", "formula": "rank(-(ts_max(turnover_rate,20)/ts_mean(turnover_rate,20)))*rank(-ts_corr(ret_5d,delta(turnover_rate,5),20))", "name": "turnover_spike_underreact_20", "is_ic": -0.0224, "is_ic_ir": -0.09, "is_sharpe": -2.792, "is_turnover": 0.182, "is_monotonicity": -0.55, "gates": "FAIL", "status": "reverted", "eval_seconds": 166.4, "sleeve_id": "cn_ai_flow_accumulation", "mispricing_source": "Retail traders overpay for visible volume spikes, while institutions accumulate AI-infra names gradually; the market underprices steady participation that does not need turnover shocks to move price.", "forced_counterparty": "Retail breakout chasers and benchmark-constrained active funds scaling around subscriptions/redemptions.", "data_requirements": "[\"close\",\"turnover_rate\",\"ret_5d\",\"ai_infra BFS depth/module/source-review status for universe filter\",\"benchmark beta/residual attribution vs 000300.SH and 399006.SZ\"]", "failure_mode": "Fails in mania regimes where turnover spikes themselves become the signal, or when policy/news shocks dominate gradual accumulation.", "report_contract": "setup_overlay", "ai_supercycle_layer": "ai_networking_optical_cpo", "supply_chain_hypothesis": "Validated CN optical/interconnect bottleneck names should show quiet turnover absorption before broader AI-capex repricing reaches the tape; this is a discovery hypothesis, not a verified supplier claim.", "relationship_evidence_required": "false", "money_readiness": "research_only", "decision": "revert", "session_branch": "main", "base_ref": "origin/main", "merge_base": "c99187be1dc8d78a84147200981562efcde7b8d5", "head_commit": "c99187be1dc8d78a84147200981562efcde7b8d5"}
{"ts": "2026-05-25T07:23:06.199590+08:00", "session_id": "20260525_062703_ae377b", "market": "cn", "formula": "rank(ts_mean(amount,20)/ts_std(amount,20)) * rank(-ret_20d)", "name": "amount_absorption_pullback_20", "is_ic": 0.0448, "is_ic_ir": 0.233, "is_sharpe": -0.879, "is_turnover": 0.166, "is_monotonicity": 0.4, "gates": "PASS", "status": "reverted", "eval_seconds": 22.2, "sleeve_id": "cn_ai_infra_accumulation_reentry", "mispricing_source": "Retail and thematic fast money sell recent losers mechanically, while slower institutional buyers absorb supply in high-value low-churn names before fundamentals are re-priced.", "forced_counterparty": "Short-horizon momentum traders and liquidity-driven sellers facing benchmark, redemption, or theme-rotation pressure.", "data_requirements": "[\"CN daily price/volume/amount/turnover data already sufficient for signal construction\",\"Need portfolio-level beta hedge and residual attribution before promotion\",\"If used as AI-supply-chain evidence, require filings/news/transcripts separately\"]", "failure_mode": "Fails when drawdowns reflect real fundamental deterioration or when the tape is dominated by speculative churn rather than institutional absorption.", "report_contract": "setup_overlay", "ai_supercycle_layer": "ai_chip_equipment_materials_packaging", "supply_chain_hypothesis": "Tape may surface temporary de-rating in AI semiconductor equipment/materials leaders where supply-chain bottleneck exposure is being accumulated before earnings/news confirmation.", "relationship_evidence_required": "true", "money_readiness": "research_only", "decision": "revert", "session_branch": "main", "base_ref": "origin/main", "merge_base": "c99187be1dc8d78a84147200981562efcde7b8d5", "head_commit": "c99187be1dc8d78a84147200981562efcde7b8d5", "oos": "FAIL", "checks_status": "skipped"}
{"ts": "2026-05-25T07:23:06.199590+08:00", "session_id": "20260525_062703_ae377b", "market": "cn", "formula": "rank(rank(ret_20d-ret_5d)+rank(ts_mean(amount,20))-rank(ts_std(amount,20)))", "name": "steady_amount_trend_pullback_20", "is_ic": -0.0389, "is_ic_ir": -0.188, "is_sharpe": -2.824, "is_turnover": 0.224, "is_monotonicity": -0.45, "gates": "FAIL", "status": "reverted", "eval_seconds": 134.0, "sleeve_id": "cn_ai_flow_pullback", "mispricing_source": "A-share institutions accumulate AI-capex leaders gradually, while retail and short-horizon traders sell the first pullback and create temporary underpricing during orderly consolidations.", "forced_counterparty": "Retail T+1 profit-takers and benchmarked managers forced to enter only when liquidity is available.", "data_requirements": "[\"daily OHLCV\",\"daily amount\",\"AI universe membership\",\"beta-hedge return series\",\"residual-risk attribution ledger before promotion\"]", "failure_mode": "Fails in broad deleveraging or sharp mean-reversion regimes where stable amount reflects distribution by large holders and medium-term trends break together.", "report_contract": "action_overlay", "ai_supercycle_layer": "ai_networking_optical_cpo", "supply_chain_hypothesis": "Candidate bottleneck optical/interconnect and adjacent datacenter-buildout names should show steady traded-value absorption during 5-day pullbacks inside 20-day leadership advances.", "relationship_evidence_required": "true", "money_readiness": "research_only", "decision": "revert", "session_branch": "main", "base_ref": "origin/main", "merge_base": "c99187be1dc8d78a84147200981562efcde7b8d5", "head_commit": "c99187be1dc8d78a84147200981562efcde7b8d5"}
