{"ts": "2026-05-28T07:22:55.044373+08:00", "session_id": "20260528_062703_a5bf9c", "market": "cn", "formula": "rank(ts_mean(turnover_rate,20)/ts_max(turnover_rate,20))*rank(-ts_corr(close,volume_ratio,5))", "name": "even_turnover_relvol_decorr", "is_ic": -0.0349, "is_ic_ir": -0.159, "is_sharpe": -4.455, "is_turnover": 0.344, "is_monotonicity": -0.35, "gates": "FAIL", "status": "reverted", "eval_seconds": 179.7, "sleeve_id": "cn_ai_orderly_accumulation", "mispricing_source": "Benchmark-aware funds and slower fundamental capital wait for visible order/capex proof, while retail traders fade after spike days; this leaves a participation-shape signal that is distinct from raw price trend/reversal sleeves.", "forced_counterparty": "short-horizon retail sellers after hype days, plus benchmark-constrained institutions that cannot aggressively front-run unconfirmed AI bottleneck demand", "data_requirements": "[\"Current CN daily price/volume/daily_basic fields are sufficient for IS test\", \"Promotion requires beta-hedged sleeve return, residual risk attribution, and correlation check versus promoted factors\", \"Any mapping to specific AI suppliers/orders needs ai_infra evidence cards, filings, transcripts, or official releases\"]", "failure_mode": "It should fail in pure headline-chasing tapes where repeated abnormal-volume spikes are the actual leader signal, or in broad policy/liquidity melt-ups where participation quality stops discriminating within the AI universe.", "report_contract": "research_only", "ai_supercycle_layer": "ai_chip_equipment_materials_packaging", "supply_chain_hypothesis": "Upstream AI chip equipment/materials/packaging bottleneck names should show orderly accumulation before public order or capacity evidence is fully reflected; the factor is meant to surface those candidates without assuming any unverified supplier relationship.", "relationship_evidence_required": "true", "money_readiness": "research_only", "decision": "revert", "session_branch": "main", "base_ref": "origin/main", "merge_base": "83848153d53e89b19c687fcb9440d135d63e22a2", "head_commit": "83848153d53e89b19c687fcb9440d135d63e22a2"}
{"ts": "2026-05-28T07:22:55.044373+08:00", "session_id": "20260528_062703_a5bf9c", "market": "cn", "formula": "rank(ret_20d - ret_5d) * rank(-ts_std(amount,20) / ts_std(amount,60))", "name": "amount_compress_leader_pullback", "is_ic": -0.0146, "is_ic_ir": -0.093, "is_sharpe": -3.509, "is_turnover": 0.217, "is_monotonicity": -0.6, "gates": "FAIL", "status": "reverted", "eval_seconds": 180.3, "sleeve_id": "cn_ai_infra_orderly_pullback", "mispricing_source": "Short-term A-share participants over-discount weekly pullbacks in prior leaders; recent amount-vol compression indicates absorption and lower marginal selling pressure, which is not captured by plain price reversal factors.", "forced_counterparty": "retail momentum traders, short-horizon游资, and benchmarked funds trimming recent winners", "data_requirements": "[\"daily close/ret_5d/ret_20d/amount for factor computation\", \"ai_infra source-reviewed CN universe membership and BFS metadata for deployment scope\", \"portfolio beta-hedge attribution vs 000300.SH/399006.SZ\", \"sleeve correlation and residual risk attribution versus promoted factors\"]", "failure_mode": "Fails in broad deleveraging or narrative-break regimes, where amount compression reflects buyer withdrawal instead of seller exhaustion.", "report_contract": "fresh_buy_gate", "ai_supercycle_layer": "none", "supply_chain_hypothesis": "Within the source-reviewed CN AI-infra universe, D1-D3 bottleneck names often show controlled weekly pullbacks with compressed amount volatility before re-acceleration; any specific supplier/customer mapping remains evidence-gated.", "relationship_evidence_required": "true", "money_readiness": "money_candidate", "decision": "revert", "session_branch": "main", "base_ref": "origin/main", "merge_base": "83848153d53e89b19c687fcb9440d135d63e22a2", "head_commit": "83848153d53e89b19c687fcb9440d135d63e22a2"}
{"ts": "2026-05-28T14:56:22.652239+08:00", "session_id": "20260528_140003_a6f06a", "market": "cn", "formula": "rank(ts_mean(amount,20)/ts_std(ret_1d,20))*rank(-ts_std(turnover_rate,20))", "name": "quiet_flow_absorption_20", "is_ic": -0.0416, "is_ic_ir": -0.14, "is_sharpe": -2.777, "is_turnover": 0.073, "is_monotonicity": -0.35, "gates": "FAIL", "status": "reverted", "eval_seconds": 92.2, "sleeve_id": "daily_flow_quality", "mispricing_source": "A-share traders overpay for visible high-turnover theme spikes and underreact to slow accumulation before orders, backlog, or policy beneficiaries are obvious.", "forced_counterparty": "retail hot-money traders supplying churn liquidity, plus benchmark-constrained long-only managers waiting for headline confirmation", "data_requirements": "[\"daily OHLCV\",\"daily_basic amount/turnover_rate\",\"AI universe membership\",\"factor correlation vs promoted sleeves\",\"beta-hedged sleeve attribution vs 000300.SH and 399006.SZ\"]", "failure_mode": "It stops working when AI thematics become purely event-driven gap speculation, or when low-vol/high-amount trading reflects distribution into strength rather than accumulation.", "report_contract": "setup_overlay", "ai_supercycle_layer": "ai_chip_equipment_materials_packaging", "supply_chain_hypothesis": "Domestic semiconductor equipment, materials, and advanced packaging bottlenecks for AI compute localization should show persistent quiet accumulation before reported orders and margin confirmation.", "relationship_evidence_required": "true", "money_readiness": "research_only", "decision": "revert", "session_branch": "main", "base_ref": "origin/main", "merge_base": "e23d553d30623951cda2e54c387d49e2cd55c5a2", "head_commit": "e23d553d30623951cda2e54c387d49e2cd55c5a2"}
{"ts": "2026-05-28T14:56:22.652239+08:00", "session_id": "20260528_140003_a6f06a", "market": "cn", "formula": "rank(ts_min(volume_ratio,20)/ts_mean(volume_ratio,20))*rank(ret_20d-ret_5d)", "name": "relvol_floor_leadership_pullback_20", "is_ic": -0.0029, "is_ic_ir": -0.018, "is_sharpe": -2.78, "is_turnover": 0.218, "is_monotonicity": -0.2, "gates": "FAIL", "status": "reverted", "eval_seconds": 239.3, "sleeve_id": "cn_ai_leadership_reentry", "mispricing_source": "T+1 retail profit-taking and risk-budgeted trimming create shallow pullbacks in recent AI winners; slower institutions absorb supply, so the tape underreacts before the next 10-20d leg.", "forced_counterparty": "short-horizon retail profit-takers and benchmark/risk-budgeted funds trimming recent winners", "data_requirements": "[\"current CN daily price/volume/daily_basic data are sufficient for factor backtest\",\"promotion requires beta-hedged sleeve attribution, residual risk, drawdown, and corr vs promoted factors\",\"ai_infra evidence cards/relationship ledger required before naming any specific supplier/customer link\"]", "failure_mode": "It stops working in broad deleveraging or policy shock regimes where volume floors reflect crowding instead of sponsorship and recent leaders become forced exits.", "report_contract": "fresh_buy_gate", "ai_supercycle_layer": "ai_chip_equipment_materials_packaging", "supply_chain_hypothesis": "Verified domestic AI bottleneck suppliers should show medium-term leadership with shallow 5d pullbacks and persistent relative-volume floors between order/filing catalysts.", "relationship_evidence_required": "true", "money_readiness": "money_candidate", "decision": "revert", "session_branch": "main", "base_ref": "origin/main", "merge_base": "e23d553d30623951cda2e54c387d49e2cd55c5a2", "head_commit": "e23d553d30623951cda2e54c387d49e2cd55c5a2"}
{"ts": "2026-05-28T14:56:22.652239+08:00", "session_id": "20260528_140003_a6f06a", "market": "cn", "formula": "rank(ts_min(amount/circ_market_cap,20)/ts_mean(amount/circ_market_cap,20))", "name": "float_amount_floor_20", "is_ic": -0.0234, "is_ic_ir": -0.097, "is_sharpe": -3.767, "is_turnover": 0.159, "is_monotonicity": 0.2, "gates": "FAIL", "status": "reverted", "eval_seconds": 179.4, "sleeve_id": "cn_ai_infra_flow_support", "mispricing_source": "Underreaction to persistent sponsorship in float-constrained AI suppliers; the tape looks quiet, so the market underprices inventory transfer from retail and fast money to patient specialist buyers.", "forced_counterparty": "Retail momentum sellers and benchmarked mutual funds that cannot warehouse smaller-float bottleneck names during dull tape", "data_requirements": "[\"daily amount\",\"circ_market_cap\",\"AI universe membership filter\",\"portfolio beta-hedge attribution vs 000300.SH and 399006.SZ before promotion\"]", "failure_mode": "It stops working when the amount floor reflects exit liquidity or policy/speculative churn rather than informed accumulation, or when AI capex demand genuinely rolls over.", "report_contract": "fresh_buy_gate", "ai_supercycle_layer": "ai_chip_equipment_materials_packaging", "supply_chain_hypothesis": "Domestic D1-D3 AI chip equipment, materials, and advanced-packaging bottlenecks should keep a higher floor of float-adjusted traded value ahead of source-confirmed backlog and capacity disclosures.", "relationship_evidence_required": "true", "money_readiness": "money_candidate", "decision": "revert", "session_branch": "main", "base_ref": "origin/main", "merge_base": "e23d553d30623951cda2e54c387d49e2cd55c5a2", "head_commit": "e23d553d30623951cda2e54c387d49e2cd55c5a2"}
{"ts": "2026-05-28T14:56:22.652239+08:00", "session_id": "20260528_140003_a6f06a", "market": "cn", "formula": "rank(-ts_corr(ret_1d,shift(ret_1d,1),20))*rank(ts_mean(ts_sum(turnover_rate,5),20)/ts_max(ts_sum(turnover_rate,5),20))", "name": "anti_autocorr_weekly_turnover_evenness_20", "is_ic": -0.0198, "is_ic_ir": -0.068, "is_sharpe": -3.011, "is_turnover": 0.173, "is_monotonicity": -0.45, "gates": "FAIL", "status": "reverted", "eval_seconds": 163.8, "sleeve_id": "cn_aiinfra_flow_stability", "mispricing_source": "Quiet holder-base recycling in AI-infra leaders is underfollowed by retail-chasing A-share flows; this is not just another price factor because the second leg is weekly turnover evenness, not raw return or raw volume.", "forced_counterparty": "Short-horizon retail traders and liquidity-constrained benchmark funds that must trade around daily sentiment and redemptions.", "data_requirements": "[\"ret_1d\",\"turnover_rate\",\"AI-universe membership from ai_infra\",\"post-test sleeve correlation vs promoted factors\",\"beta-hedged sleeve attribution before promotion\"]", "failure_mode": "Fails when the market shifts into rumor/gap regimes where bursty speculative turnover dominates, or when weekly evenness is just illiquidity rather than absorption.", "report_contract": "research_only", "ai_supercycle_layer": "none", "supply_chain_hypothesis": "Within the source-reviewed CN AI-infra universe, true bottleneck names should show orderly daily shakeouts and even weekly turnover before order/capex evidence becomes consensus.", "relationship_evidence_required": "true", "money_readiness": "research_only", "decision": "revert", "session_branch": "main", "base_ref": "origin/main", "merge_base": "e23d553d30623951cda2e54c387d49e2cd55c5a2", "head_commit": "e23d553d30623951cda2e54c387d49e2cd55c5a2"}
{"ts": "2026-05-28T14:56:22.652239+08:00", "session_id": "20260528_140003_a6f06a", "market": "cn", "formula": "rank(-ps_ttm) * rank(ts_mean(amount / circ_market_cap, 20))", "name": "low_ps_flow_sponsorship_20", "is_ic": 0.0481, "is_ic_ir": 0.176, "is_sharpe": 1.927, "is_turnover": 0.026, "is_monotonicity": 0.35, "gates": "FAIL", "status": "reverted", "eval_seconds": 110.1, "sleeve_id": "cn_ai_rerating_overlay", "mispricing_source": "A-share investors often crowd obvious high-multiple AI names first and underreact to cheaper infrastructure suppliers until sustained turnover signals that institutions are building positions.", "forced_counterparty": "style-constrained growth funds and short-horizon retail traders rotating away from lower-multiple capex beneficiaries", "data_requirements": "`[\"ps_ttm\",\"amount\",\"circ_market_cap\",\"benchmark hedge attribution vs 000300.SH and 399006.SZ\",\"sleeve correlation to promoted factors\",\"ai_infra evidence-card status before production promotion\"]`", "failure_mode": "It stops working when the market is in pure narrative squeeze mode and expensive leaders keep absorbing all marginal capital, or when heavy amount reflects distribution rather than accumulation.", "report_contract": "setup_overlay", "ai_supercycle_layer": "ai_chip_equipment_materials_packaging", "supply_chain_hypothesis": "Candidate domestic AI capex beneficiaries in equipment/materials/packaging should rerate first when sustained traded amount appears before explicit backlog/order evidence is fully reflected in prices.", "relationship_evidence_required": "true", "money_readiness": "research_only", "decision": "revert", "session_branch": "main", "base_ref": "origin/main", "merge_base": "e23d553d30623951cda2e54c387d49e2cd55c5a2", "head_commit": "e23d553d30623951cda2e54c387d49e2cd55c5a2"}
{"ts": "2026-05-28T14:56:22.652239+08:00", "session_id": "20260528_140003_a6f06a", "market": "cn", "formula": "rank(-ps_ttm) * rank(ts_mean(amount,20)/ts_std(amount,20))", "name": "low_ps_amount_stability_20", "is_ic": 0.0057, "is_ic_ir": 0.041, "is_sharpe": -2.026, "is_turnover": 0.11, "is_monotonicity": -0.25, "gates": "FAIL", "status": "reverted", "eval_seconds": 102.1, "sleeve_id": "cn_ai_value_accumulation", "mispricing_source": "Retail headline chasing overpays obvious concept leaders, while slower institutional accumulation in cheaper supply-chain names is under-discounted until revenue evidence catches up.", "forced_counterparty": "Retail momentum traders and benchmarked generalist funds rotating away from lower-excitement names", "data_requirements": "Current daily panel is enough for IS; before promotion require beta-hedged sleeve attribution, sleeve correlation to promoted factors, and ai_infra source-review status for any name surfaced by the ranker.", "failure_mode": "Fails when speculative momentum dominates valuation for long stretches, or when low-PS names are genuine value traps and stable flow is passive holding rather than informed accumulation.", "report_contract": "setup_overlay", "ai_supercycle_layer": "ai_chip_equipment_materials_packaging", "supply_chain_hypothesis": "Candidate D2-D4 chip-equipment/materials/packaging suppliers are being accumulated ahead of source-reviewed order and capex confirmation from the AI buildout cycle.", "relationship_evidence_required": "true", "money_readiness": "research_only", "decision": "revert", "session_branch": "main", "base_ref": "origin/main", "merge_base": "e23d553d30623951cda2e54c387d49e2cd55c5a2", "head_commit": "e23d553d30623951cda2e54c387d49e2cd55c5a2"}
{"ts": "2026-05-28T14:56:22.652239+08:00", "session_id": "20260528_140003_a6f06a", "market": "cn", "formula": "rank(ts_corr(ret_1d,shift(ret_1d,1),20))*rank(ts_mean(turnover_rate,20)/ts_max(turnover_rate,20))", "name": "trend_even_turnover_20", "is_ic": -0.0552, "is_ic_ir": -0.235, "is_sharpe": -5.014, "is_turnover": 0.205, "is_monotonicity": -0.5, "gates": "FAIL", "status": "reverted", "eval_seconds": 152.0, "sleeve_id": "cn_ai_turnover_quality_trend", "mispricing_source": "Slow institutional accumulation in under-owned AI supply-chain names; turnover stays broad-based before capex/order implications are fully reflected in price.", "forced_counterparty": "T+1 retail profit-takers and benchmark-constrained funds that underweight fast-rerating bottleneck suppliers", "data_requirements": "[\"current CN daily data is sufficient for IS test\",\"before promotion: corr check vs d1_close_20_363, d1_ret_20d_20_398, turnover_stability_20, amount_stability_20\",\"beta-hedged sleeve attribution vs 000300.SH and 399006.SZ\"]", "failure_mode": "Fails when the market becomes one-day news/policy chasing and turnover concentrates into blow-off spikes, or when the regime flips to cross-sectional mean reversion.", "report_contract": "research_only", "ai_supercycle_layer": "ai_chip_equipment_materials_packaging", "supply_chain_hypothesis": "Domestic AI chip equipment and advanced packaging names may be repricing gradually as accelerator and memory capacity expansion diffuses into local bottleneck beneficiaries.", "relationship_evidence_required": "true", "money_readiness": "research_only", "decision": "revert", "session_branch": "main", "base_ref": "origin/main", "merge_base": "e23d553d30623951cda2e54c387d49e2cd55c5a2", "head_commit": "e23d553d30623951cda2e54c387d49e2cd55c5a2"}
{"ts": "2026-05-28T14:56:22.652239+08:00", "session_id": "20260528_140003_a6f06a", "market": "cn", "formula": "rank((ret_20d-ret_5d)/(ts_std(volume_ratio,20)+0.01))", "name": "leader_reset_relvol_20", "is_ic": -0.0377, "is_ic_ir": -0.184, "is_sharpe": -2.978, "is_turnover": 0.212, "is_monotonicity": 0.0, "gates": "FAIL", "status": "reverted", "eval_seconds": 147.4, "sleeve_id": "cn_ai_infra_pullback_continuation", "mispricing_source": "A-share retail and short-horizon sector money tend to overreact to short pullbacks in secular winners, while patient allocators reload scarce AI-infra exposure gradually; calm relative-volume behavior delays price recognition.", "forced_counterparty": "short-horizon retail chasers, margin users de-risking on dips, and mandate-driven sector rotators", "data_requirements": "[\"source-reviewed CN AI-universe membership\",\"factor correlation vs stable_relvol_pullback_20 and amount_stability_20 families\",\"beta-hedged sleeve attribution vs 000300.SH and 399006.SZ before promotion\"]", "failure_mode": "Fails when the market shifts to broad deleveraging or news-driven speculation, where low relvol volatility no longer means sponsorship and 20-day leadership mean-reverts instead of continuing.", "report_contract": "setup_overlay", "ai_supercycle_layer": "ai_chip_equipment_materials_packaging", "supply_chain_hypothesis": "Domestic AI chip equipment/materials/advanced-packaging bottleneck names can show defended leadership through quiet 5-day resets before the next capex/order repricing leg.", "relationship_evidence_required": "false", "money_readiness": "research_only", "decision": "revert", "session_branch": "main", "base_ref": "origin/main", "merge_base": "e23d553d30623951cda2e54c387d49e2cd55c5a2", "head_commit": "e23d553d30623951cda2e54c387d49e2cd55c5a2"}
{"ts": "2026-05-28T14:56:22.652239+08:00", "session_id": "20260528_140003_a6f06a", "market": "cn", "formula": "rank(-ts_corr(ret_1d,shift(ret_1d,1),20))*rank(ts_min(turnover_rate,20)/ts_mean(turnover_rate,20))", "name": "anti_autocorr_turnover_floor_20", "is_ic": -0.0198, "is_ic_ir": -0.074, "is_sharpe": -2.367, "is_turnover": 0.195, "is_monotonicity": -0.65, "gates": "FAIL", "status": "reverted", "eval_seconds": 108.7, "sleeve_id": "daily_flow_overlay", "mispricing_source": "T+1 retail chasing and short-horizon de-risking create daily overshoots, while institutions accumulate theme leaders gradually and keep baseline turnover from collapsing.", "forced_counterparty": "retail momentum traders and benchmarked accounts forced to rebalance around short-term price shocks rather than 10-20 day fundamentals", "data_requirements": "[\"daily ret_1d\",\"daily turnover_rate\",\"AI universe membership from ai_infra\",\"correlation check vs existing amount/turnover stability sleeves\",\"beta-hedged sleeve attribution and residual risk report\"]", "failure_mode": "It stops working in one-way breakout or panic regimes where daily autocorrelation turns persistently positive/negative and turnover floor no longer reflects quiet sponsorship but outright crowding or liquidation.", "report_contract": "setup_overlay", "ai_supercycle_layer": "ai_chip_equipment_materials_packaging", "supply_chain_hypothesis": "Within validated CN AI-infra names, bottleneck equipment/material suppliers under quiet accumulation should exhibit stable turnover support and daily noise absorption before backlog/order evidence is fully recognized.", "relationship_evidence_required": "true", "money_readiness": "research_only", "decision": "revert", "session_branch": "main", "base_ref": "origin/main", "merge_base": "e23d553d30623951cda2e54c387d49e2cd55c5a2", "head_commit": "e23d553d30623951cda2e54c387d49e2cd55c5a2"}
