{"ts": "2026-05-19T14:57:21.606121+08:00", "session_id": "20260519_140003_acf528", "market": "cn", "formula": "rank(-ts_corr(ret_1d,shift(ret_1d,1),20)/(ts_std(pct_change(amount,5),20)+0.01))", "name": "anti_autocorr_amtchg_smooth_20", "is_ic": 0.0087, "is_ic_ir": 0.054, "is_sharpe": -1.565, "is_turnover": 0.201, "is_monotonicity": -0.05, "gates": "FAIL", "status": "reverted", "eval_seconds": 159.7, "sleeve_id": "cn_ai_flow_underreaction", "mispricing_source": "The payoff comes from underreaction to orderly weekly value-flow accumulation in validated AI-universe names; it is not a candle or pure momentum clone because the signal requires a smooth amount-change path, not just price strength.", "forced_counterparty": "T+1 retail round-trippers, short-horizon theme desks, and benchmark-constrained domestic long-only funds that add only after confirmation", "data_requirements": "[\"daily amount and ret_1d on the validated CN AI universe for IS test\",\"beta-hedged sleeve return vs 000300.SH and 399006.SZ before promotion\",\"rolling corr vs kshadow_5 and amount_stability_20 family\",\"residual risk attribution by AI layer and BFS depth\",\"filings/press releases if later attaching supplier, order, or capex claims\"]", "failure_mode": "It should fail in one-way policy-beta or rumor-squeeze regimes where negative autocorrelation disappears and smooth weekly amount changes reflect neglect or trapped liquidity rather than informed accumulation.", "report_contract": "setup_overlay", "ai_supercycle_layer": "ai_chip_equipment_materials_packaging", "supply_chain_hypothesis": "Domestic semicap, materials, and advanced-packaging bottleneck candidates should show steady weekly amount absorption and dip-buying before verified order, localization, or capex evidence reaches filings and official releases.", "relationship_evidence_required": "true", "money_readiness": "research_only", "decision": "revert", "session_branch": "main", "base_ref": "origin/main", "merge_base": "b127bcb38ef90487e053bb7009fa8bafbe89687b", "head_commit": "b127bcb38ef90487e053bb7009fa8bafbe89687b"}
{"ts": "2026-05-19T14:57:21.606121+08:00", "session_id": "20260519_140003_acf528", "market": "cn", "formula": "rank(-ts_corr(ret_1d, shift(ret_1d, 1), 20)) * rank(-ts_max(ret_1d, 20))", "name": "anti_autocorr_low_lottery_20", "is_ic": 0.0331, "is_ic_ir": 0.183, "is_sharpe": -1.315, "is_turnover": 0.163, "is_monotonicity": 0.0, "gates": "FAIL", "status": "reverted", "eval_seconds": 252.0, "sleeve_id": "cn_ai_stealth_accumulation", "mispricing_source": "Retail capital overpays for recent spike days, while fundamental buyers scale into real capex beneficiaries over multiple sessions; the market underprices orderly dip absorption.", "forced_counterparty": "retail momentum traders, T+1 profit-takers, short-horizon liquidity providers", "data_requirements": "[\"daily OHLCV\", \"benchmark hedge returns vs 000300.SH/399006.SZ\", \"sleeve correlation matrix\", \"residual risk attribution ledger\"]", "failure_mode": "This stops working in breakout/liquidity-chase regimes where true leaders trend one-way and the best future winners are already the recent spike names.", "report_contract": "fresh_buy_gate", "ai_supercycle_layer": "ai_chip_equipment_materials_packaging", "supply_chain_hypothesis": "Candidate D1-D3 bottleneck suppliers may be accumulated through low-lottery dip buying before order, capex, or backlog evidence is fully reflected in price.", "relationship_evidence_required": "true", "money_readiness": "money_candidate", "decision": "revert", "session_branch": "main", "base_ref": "origin/main", "merge_base": "b127bcb38ef90487e053bb7009fa8bafbe89687b", "head_commit": "b127bcb38ef90487e053bb7009fa8bafbe89687b"}
{"ts": "2026-05-19T14:57:21.606121+08:00", "session_id": "20260519_140003_acf528", "market": "cn", "formula": "rank(-ts_std(amount,20)/ts_std(amount,60))*rank(ts_min(turnover_rate,20)/ts_mean(turnover_rate,20))", "name": "amount_compress_turnover_floor_20_60", "is_ic": -0.0611, "is_ic_ir": -0.226, "is_sharpe": -4.409, "is_turnover": 0.141, "is_monotonicity": 0.0, "gates": "FAIL", "status": "reverted", "eval_seconds": 177.7, "sleeve_id": "cn_ai_flow_absorption", "mispricing_source": "The market overweights noisy breakout sessions and underweights steady ownership transfer during dull consolidations, so sponsorship quality is mispriced until later price confirmation.", "forced_counterparty": "Retail T+1 theme chasers and benchmark-constrained domestic funds that trim or ignore quiet consolidations because they need visible liquidity and headline confirmation.", "data_requirements": "[\"current CN daily OHLCV + amount + turnover_rate are sufficient for IS testing\",\"ai_infra source-reviewed universe filter\",\"beta-hedged sleeve attribution vs 000300.SH and 399006.SZ before promotion\",\"rolling correlation to live sleeves including kshadow_5\"]", "failure_mode": "It stops working in broad speculative melt-up regimes where turnover spikes carry genuine information, or in liquidity-stress regimes where compression reflects absence of demand rather than informed accumulation.", "report_contract": "setup_overlay", "ai_supercycle_layer": "ai_chip_equipment_materials_packaging", "supply_chain_hypothesis": "Validated D1-D3 domestic semicap, materials, packaging, and test bottleneck names should show 20-day activity compression with a persistent turnover floor as institutions absorb float ahead of explicit order or capex confirmation.", "relationship_evidence_required": "true", "money_readiness": "research_only", "decision": "revert", "session_branch": "main", "base_ref": "origin/main", "merge_base": "b127bcb38ef90487e053bb7009fa8bafbe89687b", "head_commit": "b127bcb38ef90487e053bb7009fa8bafbe89687b"}
{"ts": "2026-05-19T14:57:21.606121+08:00", "session_id": "20260519_140003_acf528", "market": "cn", "formula": "rank(ts_mean(amount/circ_market_cap,20)/ts_mean(amount/circ_market_cap,60))", "name": "float_flow_regime_20_60", "is_ic": 0.0, "is_ic_ir": 0.0, "is_sharpe": 0.0, "is_turnover": 0.0, "is_monotonicity": 0.0, "gates": "FAIL", "status": "reverted", "eval_seconds": 80.8, "sleeve_id": "cn_ai_flow_overlay", "mispricing_source": "Slow recognition of upstream AI-infra exposure; persistent float-normalized cash turnover can lead fundamentals when institutions are building positions gradually rather than chasing one-day spikes.", "forced_counterparty": "Benchmarked mutual funds and legacy non-theme holders who adjust exposure gradually and provide inventory before public source evidence or earnings confirmation catches up.", "data_requirements": "[\"Current CN daily fields are sufficient for first-pass IS test\",\"For promotion: sleeve correlation history, benchmark-hedged attribution vs 000300.SH/399006.SZ, and drawdown decomposition by AI layer\"]", "failure_mode": "Fails when turnover is dominated by short-lived thematic speculation or broad deleveraging, so elevated float-normalized flow reflects crowding/liquidity stress rather than steady accumulation.", "report_contract": "research_only", "ai_supercycle_layer": "ai_chip_equipment_materials_packaging", "supply_chain_hypothesis": "Persistent float-normalized flow regime shifts may surface domestic AI bottleneck suppliers in chip equipment, materials, packaging/testing, and adjacent optical/power enablers before explicit order evidence is public.", "relationship_evidence_required": "true", "money_readiness": "research_only", "decision": "revert", "session_branch": "main", "base_ref": "origin/main", "merge_base": "b127bcb38ef90487e053bb7009fa8bafbe89687b", "head_commit": "b127bcb38ef90487e053bb7009fa8bafbe89687b"}
{"ts": "2026-05-19T14:57:21.606121+08:00", "session_id": "20260519_140003_acf528", "market": "cn", "formula": "rank(-ts_corr(abs(ret_5d),delta(log(amount),5),20))", "name": "weekly_flow_absorb_decorr_20", "is_ic": 0.0156, "is_ic_ir": 0.097, "is_sharpe": 0.066, "is_turnover": 0.141, "is_monotonicity": -0.1, "gates": "FAIL", "status": "reverted", "eval_seconds": 238.7, "sleeve_id": "cn_ai_flow_absorption", "mispricing_source": "Underreaction to slow institutional accumulation in constrained AI-infra names; capital reallocation persists before the tape fully reflects it.", "forced_counterparty": "Retail momentum chasers and short-horizon liquidity providers; benchmarked long-only funds that cannot fully front-run theme rotation.", "data_requirements": "Daily OHLCV plus `amount` is enough for factor testing; for promotion require benchmark series (`000300.SH`,`399006.SZ`,`000001.SH`), sleeve correlation panel, drawdown/residual-risk attribution, and source-reviewed `ai_infra` layer/module tags.", "failure_mode": "Breaks in rumor-driven melt-up or macro-liquidity shock regimes where flow/price decoupling reflects dead money or defensive trading rather than absorption.", "report_contract": "setup_overlay", "ai_supercycle_layer": "ai_networking_optical_cpo", "supply_chain_hypothesis": "If this signal clusters in source-reviewed optical/CPO/interconnect names, it may reflect datacenter interconnect bottleneck accumulation ahead of broader AI capex confirmation.", "relationship_evidence_required": "true", "money_readiness": "research_only", "decision": "revert", "session_branch": "main", "base_ref": "origin/main", "merge_base": "b127bcb38ef90487e053bb7009fa8bafbe89687b", "head_commit": "b127bcb38ef90487e053bb7009fa8bafbe89687b"}
{"ts": "2026-05-19T14:57:21.606121+08:00", "session_id": "20260519_140003_acf528", "market": "cn", "formula": "rank(delta(ret_20d,5)*ts_min(volume_ratio,20)/ts_mean(volume_ratio,20))", "name": "ret20_accel_relvol_floor_20", "is_ic": -0.0289, "is_ic_ir": -0.141, "is_sharpe": -2.843, "is_turnover": 0.353, "is_monotonicity": -0.3, "gates": "FAIL", "status": "reverted", "eval_seconds": 224.0, "sleeve_id": "daily_price_overlay", "mispricing_source": "Short-horizon traders anchor on the recent wobble, while persistent relvol floor signals sponsor demand; this is not a naked momentum clone because acceleration must be confirmed by non-collapsing participation.", "forced_counterparty": "redemption-driven theme funds and short-horizon retail profit-takers exiting on consolidation", "data_requirements": "[\"daily OHLCV\",\"daily_basic.volume_ratio\",\"ai_infra universe metadata for BFS depth/module/pool attribution\",\"CN benchmark series for beta-hedged and residual sleeve attribution\"]", "failure_mode": "Fails in sharp regime reversals or broad risk-off tape when relvol floor reflects trapped holders rather than accumulation, or when AI leadership rotates too fast for 20-day acceleration to persist.", "report_contract": "setup_overlay", "ai_supercycle_layer": "none", "supply_chain_hypothesis": "Cross-layer D1-D3 AI-infra bottleneck names should show improving 20-day tape with an intact relvol floor before the market fully reprices their scarcity; no new supplier/customer claim is made by the factor itself.", "relationship_evidence_required": "true", "money_readiness": "research_only", "decision": "revert", "session_branch": "main", "base_ref": "origin/main", "merge_base": "b127bcb38ef90487e053bb7009fa8bafbe89687b", "head_commit": "b127bcb38ef90487e053bb7009fa8bafbe89687b"}
{"ts": "2026-05-19T14:57:21.606121+08:00", "session_id": "20260519_140003_acf528", "market": "cn", "formula": "rank(ts_min(turnover_rate,20)/ts_mean(turnover_rate,20))*rank(-ts_mean(volume_ratio,5))", "name": "turnover_floor_uncrowded_20", "is_ic": -0.0548, "is_ic_ir": -0.202, "is_sharpe": 0.213, "is_turnover": 0.2, "is_monotonicity": 0.1, "gates": "FAIL", "status": "reverted", "eval_seconds": 191.5, "sleeve_id": "cn_ai_flow_accumulation", "mispricing_source": "The market overreacts to visible volume spikes and underprices quiet sponsorship; a defended turnover floor reveals sticky demand before narrative/news confirmation.", "forced_counterparty": "Retail theme-chasers and short-horizon liquidity sellers who exit once headline attention and relative volume fade.", "data_requirements": "[\"CN daily OHLCV\",\"daily_basic turnover_rate\",\"volume_ratio\",\"AI-infra validated CN universe membership\",\"beta/residual attribution vs 000300.SH and 399006.SZ before promotion\"]", "failure_mode": "This stops working in broad speculative melt-ups where crowded high-volume breakouts lead, or in deleveraging regimes where high turnover floor reflects trapped distribution rather than accumulation.", "report_contract": "setup_overlay", "ai_supercycle_layer": "none", "supply_chain_hypothesis": "Cross-layer AI-infra bottleneck names inside the validated CN universe should show defended turnover floors before crowded re-rating, but exact supplier/customer links must come from source review rather than tape alone.", "relationship_evidence_required": "true", "money_readiness": "research_only", "decision": "revert", "session_branch": "main", "base_ref": "origin/main", "merge_base": "b127bcb38ef90487e053bb7009fa8bafbe89687b", "head_commit": "b127bcb38ef90487e053bb7009fa8bafbe89687b"}
{"ts": "2026-05-19T14:57:21.606121+08:00", "session_id": "20260519_140003_acf528", "market": "cn", "formula": "rank(ret_20d - ret_5d) * rank(log(market_cap / circ_market_cap))", "name": "scarce_float_digest_leader_20", "is_ic": 0.0302, "is_ic_ir": 0.112, "is_sharpe": 5.086, "is_turnover": 0.185, "is_monotonicity": 0.8, "gates": "FAIL", "status": "reverted", "eval_seconds": 101.9, "sleeve_id": "cn_ai_infra_leadership", "mispricing_source": "Structural float scarcity makes price discovery slow; after a 5-day digestion, institutional demand for validated AI-infra exposure can resume before the market fully reprices the constrained supply.", "forced_counterparty": "Short-horizon retail profit takers and benchmark-constrained funds that are late to build exposure in scarce-float names", "data_requirements": "[\"unlock calendar\",\"top-holder concentration / strategic ownership\",\"sector breadth for AI-infra peers\",\"beta-hedged sleeve attribution vs 000300.SH and 399006.SZ\"]", "failure_mode": "Stops working when the regime flips to fast mean-reversion, when secondary offerings/unlocks relax float scarcity, or when AI-theme beta unwinds swamp stock-specific supply effects.", "report_contract": "setup_overlay", "ai_supercycle_layer": "ai_chip_equipment_materials_packaging", "supply_chain_hypothesis": "Domestic AI bottleneck equipment/material/advanced-packaging names with constrained free float should show leadership continuation after brief pullbacks as local capital rotates into supercycle beneficiaries.", "relationship_evidence_required": "true", "money_readiness": "research_only", "decision": "revert", "session_branch": "main", "base_ref": "origin/main", "merge_base": "b127bcb38ef90487e053bb7009fa8bafbe89687b", "head_commit": "b127bcb38ef90487e053bb7009fa8bafbe89687b"}
{"ts": "2026-05-19T14:57:21.606121+08:00", "session_id": "20260519_140003_acf528", "market": "cn", "formula": "rank(ts_mean(amount,20)/(ts_std(amount,20)+1)/pb)", "name": "value_flow_stability_20", "is_ic": -0.0396, "is_ic_ir": -0.172, "is_sharpe": -6.263, "is_turnover": 0.072, "is_monotonicity": -0.7, "gates": "FAIL", "status": "reverted", "eval_seconds": 143.5, "sleeve_id": "cn_ai_hardasset_rerating", "mispricing_source": "Investors anchor on old cyclical/heavy-asset multiples and underreact to orderly institutional accumulation in AI-infra enablers; this should be less correlated to pure price-action sleeves because it needs both valuation slack and stable cash sponsorship.", "forced_counterparty": "Benchmarked growth funds and retail narrative chasers that stay underweight low-PB infrastructure names until confirmation is obvious", "data_requirements": "[\"amount\",\"pb\",\"daily OHLCV for hedge attribution\",\"for promotion: filings/transcripts on backlog capex order cadence\",\"source review if any supplier/customer claim is used in narrative\"]", "failure_mode": "It stops working when low-PB names are value traps, balance-sheet stress dominates rerating, or the market regime rewards high-multiple speculative squeeze over orderly accumulation.", "report_contract": "fresh_buy_gate", "ai_supercycle_layer": "hard_assets_energy_heavy", "supply_chain_hypothesis": "Potential datacenter power/cooling, optical manufacturing, packaging, and other hard-asset AI bottleneck names are being accumulated before hard order evidence is fully disseminated.", "relationship_evidence_required": "true", "money_readiness": "money_candidate", "decision": "revert", "session_branch": "main", "base_ref": "origin/main", "merge_base": "b127bcb38ef90487e053bb7009fa8bafbe89687b", "head_commit": "b127bcb38ef90487e053bb7009fa8bafbe89687b"}
{"ts": "2026-05-19T14:57:21.606121+08:00", "session_id": "20260519_140003_acf528", "market": "cn", "formula": "rank(ret_20d) * rank(-ts_kurt(ret_1d,20))", "name": "leader_low_kurtosis_20", "is_ic": -0.0285, "is_ic_ir": -0.152, "is_sharpe": -1.462, "is_turnover": 0.206, "is_monotonicity": -0.1, "gates": "FAIL", "status": "reverted", "eval_seconds": 116.8, "sleeve_id": "cn_ai_bottleneck_continuation", "mispricing_source": "A-share retail flows overpay for jumpy lottery tape and underweight smoother grinders; this factor is not just raw momentum because it conditions leadership on path quality and ownership stability rather than price level alone.", "forced_counterparty": "short-horizon retail profit takers and benchmark-constrained mutual funds that cannot fully chase early orderly repricing", "data_requirements": "[\"current CN daily features only for IS\", \"for promotion: beta-hedged sleeve return, residual risk attribution, correlation vs existing sleeves, ai_infra evidence-card status for underlying names\"]", "failure_mode": "Stops working when the market shifts into pure speculative beta/chip-theme squeeze regimes where high-kurtosis names dominate, or in macro/liquidity shocks that force indiscriminate de-risking across AI leaders.", "report_contract": "setup_overlay", "ai_supercycle_layer": "ai_chip_equipment_materials_packaging", "supply_chain_hypothesis": "Smooth 20-day leadership may be surfacing domestic bottleneck beneficiaries in semiconductor equipment, materials, packaging, or testing as capex expectations diffuse before full fundamental confirmation.", "relationship_evidence_required": "true", "money_readiness": "research_only", "decision": "revert", "session_branch": "main", "base_ref": "origin/main", "merge_base": "b127bcb38ef90487e053bb7009fa8bafbe89687b", "head_commit": "b127bcb38ef90487e053bb7009fa8bafbe89687b"}
{"ts": "2026-05-19T14:57:21.606121+08:00", "session_id": "20260519_140003_acf528", "market": "cn", "formula": "rank(ts_mean(ret_5d,20)*ts_mean(amount,20)/(ts_std(amount,20)+1))", "name": "stable_amount_weekly_drift_20", "is_ic": -0.0464, "is_ic_ir": -0.198, "is_sharpe": -1.998, "is_turnover": 0.104, "is_monotonicity": -0.05, "gates": "FAIL", "status": "reverted", "eval_seconds": 169.9, "sleeve_id": "cn_ai_infra_accumulation", "mispricing_source": "Slow institutional deployment and benchmark-rebalance frictions make the market underreact to steady accumulation in true AI-infra leaders; the amount-stability term is meant to separate this from generic high-beta momentum.", "forced_counterparty": "Short-horizon retail profit takers under T+1 constraints and benchmarked mutual funds that rebalance into new leaders with delay", "data_requirements": "[\"current daily CN fields are sufficient for IS test\",\"before promotion: sleeve correlation vs promoted factors, beta-hedged attribution vs 000300.SH/399006.SZ/399001.SZ, residual risk attribution, AI-universe/source-review status for any supply-chain narrative\"]", "failure_mode": "Fails when the market shifts into one-day rumor/speculation bursts or broad liquidity shocks where noisy laggards outperform steady institutional leaders.", "report_contract": "research_only", "ai_supercycle_layer": "ai_chip_equipment_materials_packaging", "supply_chain_hypothesis": "Domestic semiconductor equipment, materials, and advanced-packaging names closest to accelerator and memory capex bottlenecks should exhibit staircase weekly drift with stable amount before filings fully confirm order conversion.", "relationship_evidence_required": "true", "money_readiness": "research_only", "decision": "revert", "session_branch": "main", "base_ref": "origin/main", "merge_base": "b127bcb38ef90487e053bb7009fa8bafbe89687b", "head_commit": "b127bcb38ef90487e053bb7009fa8bafbe89687b"}
