{"ts": "2026-05-27T07:23:10.744705+08:00", "session_id": "20260527_062702_76a84a", "market": "cn", "formula": "rank(-pb)*rank(ts_min(amount/circ_market_cap,20)/ts_mean(amount/circ_market_cap,60))", "name": "pb_float_floor_regime_20_60", "is_ic": 0.0111, "is_ic_ir": 0.052, "is_sharpe": -1.074, "is_turnover": 0.112, "is_monotonicity": -0.25, "gates": "FAIL", "status": "reverted", "eval_seconds": 159.9, "sleeve_id": "cn_ai_flow_value_overlay", "mispricing_source": "Short-horizon tape readers treat cooling price action as lost theme heat, while institutions continue inventory transfer in validated AI-infra names; float-normalized amount floor captures that hidden absorption better than pure return signals.", "forced_counterparty": "Theme-chasing retail and benchmarked PMs de-risking after failed breakout windows or weak news flow", "data_requirements": "[\"daily amount\",\"pb\",\"circ_market_cap\",\"ai_infra universe membership\",\"BFS depth/module/source-review status for reporting\",\"beta-hedge return and residual risk attribution at sleeve level\"]", "failure_mode": "Fails if low PB is structural distress rather than temporary neglect, or if broad policy/liquidity beta lifts all AI names so trading-floor persistence becomes crowding instead of accumulation.", "report_contract": "setup_overlay", "ai_supercycle_layer": "hard_assets_energy_heavy", "supply_chain_hypothesis": "Candidate capex-heavy AI bottleneck enablers in the validated CN AI-infra universe keep a non-collapsing float-normalized trading floor during digestion because real demand from datacenter/power/equipment buildout is being absorbed before fundamentals print.", "relationship_evidence_required": "true", "money_readiness": "research_only", "decision": "revert", "session_branch": "main", "base_ref": "origin/main", "merge_base": "c99187be1dc8d78a84147200981562efcde7b8d5", "head_commit": "c99187be1dc8d78a84147200981562efcde7b8d5"}
{"ts": "2026-05-27T07:23:10.744705+08:00", "session_id": "20260527_062702_76a84a", "market": "cn", "formula": "rank(-pb)*rank(ts_min(amount/circ_market_cap,20)/ts_mean(amount/circ_market_cap,20))", "name": "pb_float_flow_floor_20", "is_ic": 0.0076, "is_ic_ir": 0.021, "is_sharpe": -2.009, "is_turnover": 0.133, "is_monotonicity": -0.05, "gates": "FAIL", "status": "reverted", "eval_seconds": 151.8, "sleeve_id": "cn_ai_absorption_value", "mispricing_source": "Value anchors and float-adjusted flow floor are slow-moving ownership signals, not a fast price factor; the market underreacts because AI-capex beneficiaries look optically cheap for too long before backlog and margin evidence show up.", "forced_counterparty": "Retail momentum traders and benchmarked PMs rotating out of low-vol, non-breakout names to chase hotter/liquid themes.", "data_requirements": "[\"CN daily OHLCV\",\"daily_basic: amount,pb,circ_market_cap\",\"ai_infra universe/source-review status\",\"beta-hedged sleeve attribution vs 000300.SH and 399006.SZ\",\"rolling corr vs amount_stability_20 and current promoted sleeves\"]", "failure_mode": "Fails when high flow floor is just trapped retail churn or when low PB reflects real balance-sheet stress rather than underappreciated AI-capex optionality.", "report_contract": "fresh_buy_gate", "ai_supercycle_layer": "ai_chip_equipment_materials_packaging", "supply_chain_hypothesis": "Candidate signal for domestic chip equipment/materials/advanced-packaging bottleneck names that are quietly accumulated before verified AI capex demand is fully recognized in reported earnings.", "relationship_evidence_required": "true", "money_readiness": "money_candidate", "decision": "revert", "session_branch": "main", "base_ref": "origin/main", "merge_base": "c99187be1dc8d78a84147200981562efcde7b8d5", "head_commit": "c99187be1dc8d78a84147200981562efcde7b8d5"}
{"ts": "2026-05-27T07:23:10.744705+08:00", "session_id": "20260527_062702_76a84a", "market": "cn", "formula": "rank(-pb) * rank(ts_mean(volume_ratio,20) / (ts_std(turnover_rate,20) + 0.01))", "name": "pb_relvol_absorption_20", "is_ic": 0.0028, "is_ic_ir": 0.005, "is_sharpe": -1.391, "is_turnover": 0.077, "is_monotonicity": -0.2, "gates": "FAIL", "status": "reverted", "eval_seconds": 85.5, "sleeve_id": "cn_ai_infra_accumulation", "mispricing_source": "A-share valuation anchors and benchmark weights adjust slowly, while accumulation by patient capital appears earlier in stable relative-volume patterns than in consensus fundamentals.", "forced_counterparty": "Short-horizon retail profit-takers and benchmark-constrained funds that stay underweight mid-cap AI suppliers until liquidity and evidence become obvious.", "data_requirements": "[\"Current CN daily price/volume/daily_basic data is enough for factor test\", \"Need filings/transcripts/order disclosures to verify AI bottleneck exposure\", \"Need beta-hedged sleeve PnL, residual risk attribution, and correlation to promoted sleeves before promotion\"]", "failure_mode": "It stops working in speculative burst regimes or broad liquidity stress, when stable accumulation no longer leads repricing and valuation stops anchoring entry points.", "report_contract": "research_only", "ai_supercycle_layer": "ai_chip_equipment_materials_packaging", "supply_chain_hypothesis": "Candidate D1-D3 domestic equipment/materials/packaging names tied to accelerator, memory, or optical capex buildout are being accumulated before source-confirmed order flow is fully recognized.", "relationship_evidence_required": "true", "money_readiness": "research_only", "decision": "revert", "session_branch": "main", "base_ref": "origin/main", "merge_base": "c99187be1dc8d78a84147200981562efcde7b8d5", "head_commit": "c99187be1dc8d78a84147200981562efcde7b8d5"}
{"ts": "2026-05-27T07:23:10.744705+08:00", "session_id": "20260527_062702_76a84a", "market": "cn", "formula": "rank(ts_mean(amount/circ_market_cap,20)/ts_std(amount/circ_market_cap,20))*rank(-ts_mean(high/low-1,10))", "name": "float_quiet_absorption_20", "is_ic": -0.0644, "is_ic_ir": -0.207, "is_sharpe": -4.859, "is_turnover": 0.142, "is_monotonicity": -0.45, "gates": "FAIL", "status": "reverted", "eval_seconds": 207.5, "sleeve_id": "cn_ai_infra_accumulation", "mispricing_source": "Underreaction to absorption efficiency in scarce-float AI-infra names; this is not just a price factor because it requires both stable float-normalized flow and low intraday damage.", "forced_counterparty": "Retail swing traders and benchmark-aware mutual funds that trim flat tape or wait for breakout confirmation", "data_requirements": "[\"CN daily amount/high/low/circ_market_cap\", \"AI-infra universe membership and BFS tags for sleeve attribution\", \"beta-hedged residual return and sleeve-correlation report before promotion\"]", "failure_mode": "It stops working in euphoric chase regimes where winners only advance on obvious breakout volume, or in dead-liquidity regimes where tight ranges mean no demand rather than absorption.", "report_contract": "setup_overlay", "ai_supercycle_layer": "ai_chip_equipment_materials_packaging", "supply_chain_hypothesis": "Domestic AI chip equipment, materials, and advanced packaging bottleneck names can be accumulated quietly before order or capex confirmation reaches the public tape.", "relationship_evidence_required": "true", "money_readiness": "research_only", "decision": "revert", "session_branch": "main", "base_ref": "origin/main", "merge_base": "c99187be1dc8d78a84147200981562efcde7b8d5", "head_commit": "c99187be1dc8d78a84147200981562efcde7b8d5"}
{"ts": "2026-05-27T07:23:10.744705+08:00", "session_id": "20260527_062702_76a84a", "market": "cn", "formula": "rank(ts_min(turnover_rate,20)/ts_mean(turnover_rate,20))*rank(-ts_mean(abs(close/open-1),20))", "name": "turnover_floor_body_stability_20", "is_ic": -0.0477, "is_ic_ir": -0.146, "is_sharpe": -4.137, "is_turnover": 0.148, "is_monotonicity": -0.25, "gates": "FAIL", "status": "reverted", "eval_seconds": 168.6, "sleeve_id": "daily_price_overlay", "mispricing_source": "Slow underreaction to steady accumulation in limited-liquidity names; the tape looks quiet, so discretionary and benchmarked capital underweights it until confirmation arrives.", "forced_counterparty": "T+1 retail swing traders and benchmark-aware managers who delay entry until narrative/earnings confirmation", "data_requirements": "[\"daily OHLC\",\"turnover_rate\",\"ai_infra validated CN universe membership\",\"sleeve beta-hedge and residual-risk attribution for promotion\"]", "failure_mode": "Fails in rumor/gap-driven regimes where small bodies reflect inactivity instead of absorption, or when crowding compresses the edge in quiet-accumulation setups.", "report_contract": "setup_overlay", "ai_supercycle_layer": "none", "supply_chain_hypothesis": "none", "relationship_evidence_required": "false", "money_readiness": "research_only", "decision": "revert", "session_branch": "main", "base_ref": "origin/main", "merge_base": "c99187be1dc8d78a84147200981562efcde7b8d5", "head_commit": "c99187be1dc8d78a84147200981562efcde7b8d5"}
{"ts": "2026-05-27T07:23:10.744705+08:00", "session_id": "20260527_062702_76a84a", "market": "cn", "formula": "rank(-pb) * rank(ts_std(amount,60)/(ts_std(amount,20)+1))", "name": "pb_amount_compress_20_60", "is_ic": 0.0037, "is_ic_ir": 0.021, "is_sharpe": -3.696, "is_turnover": 0.093, "is_monotonicity": -0.15, "gates": "FAIL", "status": "reverted", "eval_seconds": 104.7, "sleeve_id": "cn_ai_quiet_value_accumulation", "mispricing_source": "A-share growth capital and retail theme flow often ignore low-multiple infrastructure bottlenecks until orders, capex, or policy confirmation become explicit; amount-volatility compression can reveal informed accumulation earlier.", "forced_counterparty": "Retail concept chasers and benchmark-constrained growth managers who rotate away from low-PB infra names before narrative confirmation.", "data_requirements": "[\"daily amount\",\"pb\",\"AI-universe membership from ai_infra\",\"benchmark beta-hedge attribution ledger\",\"backlog/capex/gross-margin/debt evidence before production promotion\"]", "failure_mode": "It stops working in liquidity panics or pure concept-momentum melt-ups, and it will fail if low PB is a real distress signal rather than temporary neglect.", "report_contract": "setup_overlay", "ai_supercycle_layer": "hard_assets_energy_heavy", "supply_chain_hypothesis": "Capital-heavy AI infrastructure bottlenecks such as power, grid, datacenter shell, or optical-capacity buildout names may re-rate first through quiet accumulation before source-confirmed demand evidence is fully reflected.", "relationship_evidence_required": "true", "money_readiness": "research_only", "decision": "revert", "session_branch": "main", "base_ref": "origin/main", "merge_base": "c99187be1dc8d78a84147200981562efcde7b8d5", "head_commit": "c99187be1dc8d78a84147200981562efcde7b8d5"}
{"ts": "2026-05-27T07:23:10.744705+08:00", "session_id": "20260527_062702_76a84a", "market": "cn", "formula": "rank(-(ts_max(turnover_rate,20)/ts_sum(turnover_rate,20)))*rank(-pct_change(close,10))", "name": "distributed_turnover_pullback_10", "is_ic": -0.0402, "is_ic_ir": -0.155, "is_sharpe": -5.388, "is_turnover": 0.216, "is_monotonicity": -0.5, "gates": "FAIL", "status": "reverted", "eval_seconds": 196.8, "sleeve_id": "cn_ai_absorption_pullback", "mispricing_source": "The market overreacts to visible price weakness and underweights the information in orderly turnover distribution, which signals stronger hands taking supply without a blow-off spike.", "forced_counterparty": "Retail momentum traders, T+1 swing accounts, and thematic funds cutting exposure after a failed breakout", "data_requirements": "[\"daily OHLCV\",\"daily_basic.turnover_rate\",\"AI universe membership\",\"000300.SH and 399006.SZ benchmark returns for beta-hedged attribution\",\"sleeve correlation and residual risk report\"]", "failure_mode": "It stops working in panic/liquidation regimes where quiet pullbacks are genuine distribution, or in pure mania regimes where one-day spike leaders keep running without consolidation.", "report_contract": "setup_overlay", "ai_supercycle_layer": "ai_chip_equipment_materials_packaging", "supply_chain_hypothesis": "Domestic AI hardware bottleneck names should show distributed turnover during pullbacks when informed capital accumulates ahead of clearer capex/order evidence.", "relationship_evidence_required": "true", "money_readiness": "research_only", "decision": "revert", "session_branch": "main", "base_ref": "origin/main", "merge_base": "c99187be1dc8d78a84147200981562efcde7b8d5", "head_commit": "c99187be1dc8d78a84147200981562efcde7b8d5"}
{"ts": "2026-05-27T07:23:10.744705+08:00", "session_id": "20260527_062702_76a84a", "market": "cn", "formula": "rank(ts_min(amount / circ_market_cap,20) / ts_max(amount / circ_market_cap,20))", "name": "float_adj_amount_corridor_20", "is_ic": -0.0526, "is_ic_ir": -0.204, "is_sharpe": -4.966, "is_turnover": 0.134, "is_monotonicity": -0.75, "gates": "FAIL", "status": "reverted", "eval_seconds": 210.9, "sleeve_id": "cn_ai_infra_flow_quality", "mispricing_source": "Free-float and benchmark constraints force informed buyers to build positions gradually, while headline-driven A-share participants overprice visible spikes and underprice quiet absorption.", "forced_counterparty": "retail T+1 theme chasers and liquidity-constrained benchmarked funds", "data_requirements": "[\"amount\",\"circ_market_cap\",\"validated ai_infra CN universe membership\",\"benchmark series for beta-hedged attribution\",\"filings/press releases if later mapped to specific supplier links\"]", "failure_mode": "This stops working when the tape is dominated by broad speculative churn or liquidation, so even weak names show uniform turnover and the corridor no longer separates accumulation from distribution.", "report_contract": "fresh_buy_gate", "ai_supercycle_layer": "ai_networking_optical_cpo", "supply_chain_hypothesis": "Within validated CN optical/interconnect bottleneck names, the winners should show persistent float-adjusted absorption before order/news confirmation; use this as discovery ranking, not supplier proof.", "relationship_evidence_required": "true", "money_readiness": "money_candidate", "decision": "revert", "session_branch": "main", "base_ref": "origin/main", "merge_base": "c99187be1dc8d78a84147200981562efcde7b8d5", "head_commit": "c99187be1dc8d78a84147200981562efcde7b8d5"}
{"ts": "2026-05-27T07:23:10.744705+08:00", "session_id": "20260527_062702_76a84a", "market": "cn", "formula": "rank(-pb) * rank(ts_mean(amount,20) / ts_std(amount,20))", "name": "cheap_amount_absorption_20", "is_ic": 0.0106, "is_ic_ir": 0.085, "is_sharpe": -1.978, "is_turnover": 0.105, "is_monotonicity": -0.2, "gates": "FAIL", "status": "reverted", "eval_seconds": 179.3, "sleeve_id": "cn_ai_infra_value_absorption", "mispricing_source": "Slow recognition of AI-supercycle demand in low-valuation infrastructure names; stable traded-value absorption signals patient institutional buying before narrative confirmation.", "forced_counterparty": "Benchmark-constrained growth managers and retail momentum traders who avoid low-PB heavy-asset names until orders/backlog are publicly visible.", "data_requirements": "[\"current CN daily features are sufficient for IS test\", \"industry classification for sector-neutral risk attribution\", \"benchmark beta/residual return ledger for sleeve promotion\", \"filings/backlog/capex evidence before any supplier claim is upgraded\"]", "failure_mode": "Fails when low PB is mostly distress rather than under-earning capacity, or when speculative theme rotation favors high-beta story stocks over steady accumulation.", "report_contract": "setup_overlay", "ai_supercycle_layer": "hard_assets_energy_heavy", "supply_chain_hypothesis": "Domestic datacenter power, cooling, grid, and other heavy-asset AI bottleneck suppliers may show stable accumulation before confirmed order/backlog disclosure.", "relationship_evidence_required": "true", "money_readiness": "research_only", "decision": "revert", "session_branch": "main", "base_ref": "origin/main", "merge_base": "c99187be1dc8d78a84147200981562efcde7b8d5", "head_commit": "c99187be1dc8d78a84147200981562efcde7b8d5"}
{"ts": "2026-05-27T07:23:10.744705+08:00", "session_id": "20260527_062702_76a84a", "market": "cn", "formula": "rank(ts_mean(amount/circ_market_cap,20)/(ts_std(amount/circ_market_cap,20)+0.001)/clamp(pb,0.1,20))", "name": "pb_float_amount_stability_20", "is_ic": 0.0087, "is_ic_ir": 0.047, "is_sharpe": -2.567, "is_turnover": 0.066, "is_monotonicity": 0.0, "gates": "FAIL", "status": "reverted", "eval_seconds": 80.2, "sleeve_id": "cn_ai_absorption_value", "mispricing_source": "Retail-heavy A-shares overpay for noisy breakouts and underprice quiet institutional absorption in cheaper AI-infra names; this is an ownership/accumulation sleeve, not a close-to-close price continuation clone.", "forced_counterparty": "retail momentum traders and benchmarked allocators concentrated in liquid large caps", "data_requirements": "[\"DSL backtest uses current daily fields only\",\"for promotion: source-reviewed backlog/order/capex evidence cards, gross-margin follow-through, beta-hedged sleeve attribution, correlation check vs amount_stability_20 and pb_float_amount_absorption_20\"]", "failure_mode": "It breaks when the market rewards pure speculative beta over steady sponsorship, or when low-PB AI names are cheap for real balance-sheet/order reasons and accumulation is not informed.", "report_contract": "fresh_buy_gate", "ai_supercycle_layer": "ai_chip_equipment_materials_packaging", "supply_chain_hypothesis": "Domestic AI compute buildout should first tighten D2-D3 chip equipment/material/advanced packaging bottlenecks, and their tradable signal appears as stable float-adjusted amount before verified downstream order disclosures.", "relationship_evidence_required": "true", "money_readiness": "money_candidate", "decision": "revert", "session_branch": "main", "base_ref": "origin/main", "merge_base": "c99187be1dc8d78a84147200981562efcde7b8d5", "head_commit": "c99187be1dc8d78a84147200981562efcde7b8d5"}
{"ts": "2026-05-27T07:23:10.744705+08:00", "session_id": "20260527_062702_76a84a", "market": "cn", "formula": "rank(-pb)*rank(-ts_corr(amount/circ_market_cap,close,20))*rank(-abs(ret_20d))", "name": "pb_float_absorption_pause_20", "is_ic": -0.0146, "is_ic_ir": -0.056, "is_sharpe": -5.054, "is_turnover": 0.184, "is_monotonicity": -0.25, "gates": "FAIL", "status": "reverted", "eval_seconds": 185.6, "sleeve_id": "cn_ai_absorption_value", "mispricing_source": "Retail and fast-money traders anchor on visible breakouts, while quiet accumulation in lower-multiple AI-infra names is underreacted to because price confirmation is missing.", "forced_counterparty": "Short-term retail momentum sellers and benchmarked funds that delay buying until a breakout is obvious.", "data_requirements": "[\"daily price/amount/daily_basic for backtest\",\"beta-hedge attribution vs 000300.SH and 399006.SZ\",\"sleeve correlation vs promoted factors\",\"source-review evidence before any specific supplier/customer claim\"]", "failure_mode": "This stops working in momentum-chasing or policy-squeeze regimes where immediate price strength dominates, or when low PB reflects genuine balance-sheet/earnings impairment rather than temporary neglect.", "report_contract": "fresh_buy_gate", "ai_supercycle_layer": "hard_assets_energy_heavy", "supply_chain_hypothesis": "Potential early accumulation in domestic AI datacenter power, cooling, cable, and other capex bottleneck suppliers before verified order/backlog evidence is fully reflected in price.", "relationship_evidence_required": "true", "money_readiness": "money_candidate", "decision": "revert", "session_branch": "main", "base_ref": "origin/main", "merge_base": "c99187be1dc8d78a84147200981562efcde7b8d5", "head_commit": "c99187be1dc8d78a84147200981562efcde7b8d5"}
{"ts": "2026-05-27T07:23:10.744705+08:00", "session_id": "20260527_062702_76a84a", "market": "cn", "formula": "rank(ts_mean(amount / circ_market_cap,20) / max(pb,0.1))", "name": "value_float_absorption_20", "is_ic": 0.0, "is_ic_ir": 0.0, "is_sharpe": 0.0, "is_turnover": 0.0, "is_monotonicity": 0.0, "gates": "FAIL", "status": "compute_error", "eval_seconds": 115.7, "sleeve_id": "cn_ai_flow_value", "mispricing_source": "Slow fundamental repricing of AI-capex beneficiaries; float-normalized capital absorption reveals informed accumulation before accounting multiples rerate.", "forced_counterparty": "Retail hot-money and benchmarked holders rotating into faster narrative names, supplying stock in slower-rerating AI infra names.", "data_requirements": "[\"CN daily prices + daily_basic(amount,pb,circ_market_cap) for IS test\",\"factor-sleeve correlation matrix\",\"beta-hedge and residual return attribution\",\"ai_infra universe source-review status\",\"filings/news only if a supplier-order claim is later made\"]", "failure_mode": "It fails when low-PB names are cheap for genuine balance-sheet or governance reasons, or when broad AI-beta momentum keeps rewarding expensive leaders over steady accumulators.", "report_contract": "fresh_buy_gate", "ai_supercycle_layer": "ai_chip_equipment_materials_packaging", "supply_chain_hypothesis": "Candidate CN bottleneck suppliers in the AI capex stack should show steady value turnover versus float before backlog or order evidence is fully reflected in PB.", "relationship_evidence_required": "true", "money_readiness": "money_candidate", "decision": "revert", "session_branch": "main", "base_ref": "origin/main", "merge_base": "c99187be1dc8d78a84147200981562efcde7b8d5", "head_commit": "c99187be1dc8d78a84147200981562efcde7b8d5"}
