{"ts": "2026-05-20T07:23:20.341546+08:00", "session_id": "20260520_062702_8909c7", "market": "cn", "formula": "rank(-ts_corr(ret_1d,shift(ret_1d,1),20))*rank(ts_min(turnover_rate,20)/ts_mean(turnover_rate,20))", "name": "anti_autocorr_turnover_floor_20", "is_ic": -0.0376, "is_ic_ir": -0.138, "is_sharpe": 4.019, "is_turnover": 0.191, "is_monotonicity": 0.7, "gates": "FAIL", "status": "reverted", "eval_seconds": 116.4, "sleeve_id": "cn_ai_flow_absorption", "mispricing_source": "Retail theme churn and short-horizon de-risking create repeated daily reversals, while institutions accumulating scarce AI-infra float keep turnover from collapsing; the market underprices that absorption until supply overhang clears.", "forced_counterparty": "Retail momentum traders and benchmarked managers forced to trade around daily volatility and liquidity limits", "data_requirements": "[\"current CN daily ret_1d and turnover_rate for IS test\", \"ai_infra BFS depth/module join for exposure attribution\", \"beta-hedged sleeve PnL, residual risk attribution, and correlation-to-live-sleeves check before promotion\"]", "failure_mode": "Fails in pure policy-squeeze or panic regimes where noisy high-beta chasing dominates and steady turnover no longer signals informed accumulation.", "report_contract": "research_only", "ai_supercycle_layer": "ai_chip_equipment_materials_packaging", "supply_chain_hypothesis": "The signal should preferentially surface CN AI bottleneck names in packaging/test, optical interconnect, and adjacent equipment where funds must build exposure before explicit order evidence is broadly recognized.", "relationship_evidence_required": "true", "money_readiness": "research_only", "decision": "revert", "session_branch": "main", "base_ref": "origin/main", "merge_base": "b127bcb38ef90487e053bb7009fa8bafbe89687b", "head_commit": "b127bcb38ef90487e053bb7009fa8bafbe89687b"}
{"ts": "2026-05-20T07:23:20.341546+08:00", "session_id": "20260520_062702_8909c7", "market": "cn", "formula": "rank(ts_mean(amount/circ_market_cap,20)/ts_max(turnover_rate,20))", "name": "float_flow_antisurge_20", "is_ic": -0.0097, "is_ic_ir": -0.036, "is_sharpe": 5.298, "is_turnover": 0.14, "is_monotonicity": 0.9, "gates": "FAIL", "status": "reverted", "eval_seconds": 190.2, "sleeve_id": "cn_ai_absorption_quality", "mispricing_source": "Benchmarked thematic funds scale into scarce AI bottleneck names gradually, while retail tape attention overweights spike days and underweights steady sponsorship, leaving orderly absorption underpriced.", "forced_counterparty": "short-horizon retail T+1 traders and non-AI legacy holders selling into periodic excitement", "data_requirements": "[\"daily amount\",\"daily turnover_rate\",\"circ_market_cap\",\"sleeve correlation vs amount_stability_20 and turnover_stability_20\",\"beta-hedged attribution vs 000300.SH and 399006.SZ\"]", "failure_mode": "It stops working in squeeze regimes where turnover spikes correctly signal new information, or after major unlocks/float changes that distort float-normalized flow.", "report_contract": "fresh_buy_gate", "ai_supercycle_layer": "ai_chip_equipment_materials_packaging", "supply_chain_hypothesis": "Domestic semicap and packaging bottleneck candidates should exhibit steady float-scaled absorption with limited turnover blowoff days before capex, order, or substitution evidence is broadly recognized.", "relationship_evidence_required": "true", "money_readiness": "money_candidate", "decision": "revert", "session_branch": "main", "base_ref": "origin/main", "merge_base": "b127bcb38ef90487e053bb7009fa8bafbe89687b", "head_commit": "b127bcb38ef90487e053bb7009fa8bafbe89687b"}
{"ts": "2026-05-20T07:23:20.341546+08:00", "session_id": "20260520_062702_8909c7", "market": "cn", "formula": "rank(-(ts_max(amount/circ_market_cap,20)/ts_sum(amount/circ_market_cap,20)))", "name": "float_spike_share_20", "is_ic": -0.0075, "is_ic_ir": -0.028, "is_sharpe": 4.847, "is_turnover": 0.142, "is_monotonicity": 0.9, "gates": "FAIL", "status": "reverted", "eval_seconds": 198.8, "sleeve_id": "cn_ai_flow_accumulation", "mispricing_source": "The market pays too much attention to one-day thematic spikes and not enough to boring multi-day float absorption; T+1 and benchmark/risk limits slow arbitrage.", "forced_counterparty": "Retail theme chasers and benchmark-constrained funds that provide liquidity in scattered rebalance windows.", "data_requirements": "[\"amount\",\"circ_market_cap\",\"validated AI-universe membership\",\"beta-hedged sleeve attribution\",\"correlation to existing sleeves\"]; any supplier/customer reading still needs filings, official PRs, or transcripts.", "failure_mode": "This stops working in policy-gap or rumor-spike regimes where single-day turnover bursts contain genuine new information, or if float/cap data is stale.", "report_contract": "action_overlay", "ai_supercycle_layer": "ai_chip_equipment_materials_packaging", "supply_chain_hypothesis": "Domestic semicap and advanced-packaging bottleneck names should show repeated float absorption before verified capex/order evidence is fully priced.", "relationship_evidence_required": "true", "money_readiness": "research_only", "decision": "revert", "session_branch": "main", "base_ref": "origin/main", "merge_base": "b127bcb38ef90487e053bb7009fa8bafbe89687b", "head_commit": "b127bcb38ef90487e053bb7009fa8bafbe89687b"}
{"ts": "2026-05-20T07:23:20.341546+08:00", "session_id": "20260520_062702_8909c7", "market": "cn", "formula": "rank(-ts_mean(abs(delta(turnover_rate,5)),20))*rank(-ts_max(ret_1d,20))", "name": "weekly_turnover_drift_lowlottery_20", "is_ic": -0.1463, "is_ic_ir": -0.387, "is_sharpe": -2.944, "is_turnover": 0.075, "is_monotonicity": -0.7, "gates": "FAIL", "status": "reverted", "eval_seconds": 167.5, "sleeve_id": "cn_ai_flow_quality", "mispricing_source": "Slow institutional re-risking in scarce AI-capex names is underweighted by fast money, while retail demand overpays for single-day squeeze profiles and supplies liquidity to steadier accumulators.", "forced_counterparty": "Retail momentum traders and benchmark-constrained managers who chase visible spikes or cannot build small bottleneck positions early", "data_requirements": "[\"daily OHLCV\",\"amount\",\"turnover_rate\",\"AI universe membership\",\"beta-hedge attribution vs 000300.SH/399006.SZ before promotion\"]", "failure_mode": "Fails in limit-up/speculation regimes where lottery spikes keep winning, or when policy/news shocks dominate steady ownership-transfer signals.", "report_contract": "setup_overlay", "ai_supercycle_layer": "ai_chip_equipment_materials_packaging", "supply_chain_hypothesis": "Domestic AI-capex bottleneck names in equipment/materials/packaging should show quiet turnover migration before backlog or order confirmation becomes consensus.", "relationship_evidence_required": "true", "money_readiness": "research_only", "decision": "revert", "session_branch": "main", "base_ref": "origin/main", "merge_base": "b127bcb38ef90487e053bb7009fa8bafbe89687b", "head_commit": "b127bcb38ef90487e053bb7009fa8bafbe89687b"}
{"ts": "2026-05-20T07:23:20.341546+08:00", "session_id": "20260520_062702_8909c7", "market": "cn", "formula": "rank(ts_mean(turnover_rate*ret_1d,20))", "name": "turnover_validated_drift_20", "is_ic": 0.0577, "is_ic_ir": 0.151, "is_sharpe": 4.613, "is_turnover": 0.144, "is_monotonicity": 0.9, "gates": "FAIL", "status": "reverted", "eval_seconds": 111.7, "sleeve_id": "cn_ai_flow_overlay", "mispricing_source": "The market underreacts to steady capital commitment in mid-chain AI names because narrative confirmation arrives late; this is not just price momentum because the signal requires actual float transfer, not only price level.", "forced_counterparty": "Short-horizon retail traders and benchmark-constrained holders supplying stock into early institutional accumulation.", "data_requirements": "[\"daily OHLCV\",\"turnover_rate\",\"beta-hedged sleeve attribution vs 000300.SH and 399006.SZ\",\"correlation check vs promoted factors\",\"source-review evidence for any newly surfaced expansion candidates\"]", "failure_mode": "Fails when theme-chasing turns high turnover into blow-off distribution, or when policy/news gaps dominate and 20-day accumulation no longer maps to follow-through.", "report_contract": "setup_overlay", "ai_supercycle_layer": "ai_datacenter_edge_infra", "supply_chain_hypothesis": "CN datacenter, optical interconnect, and power-enablement bottleneck names should show positive return on real float turnover before orders, tenders, or customer ramps are fully evidenced in filings.", "relationship_evidence_required": "true", "money_readiness": "research_only", "decision": "revert", "session_branch": "main", "base_ref": "origin/main", "merge_base": "b127bcb38ef90487e053bb7009fa8bafbe89687b", "head_commit": "b127bcb38ef90487e053bb7009fa8bafbe89687b"}
{"ts": "2026-05-20T07:23:20.341546+08:00", "session_id": "20260520_062702_8909c7", "market": "cn", "formula": "rank(ts_min(turnover_rate,20)/ts_mean(turnover_rate,20))*rank(ts_mean((close-open)/(high-low+0.01),10))", "name": "turnover_floor_body_drive_20", "is_ic": -0.0346, "is_ic_ir": -0.131, "is_sharpe": 5.279, "is_turnover": 0.24, "is_monotonicity": 0.6, "gates": "FAIL", "status": "reverted", "eval_seconds": 113.2, "sleeve_id": "cn_ai_flow_absorption", "mispricing_source": "Underreaction to persistent accumulation in limited-float AI names; benchmarked funds build slowly while fast-rotating thematic capital does not fully price the steady participation floor.", "forced_counterparty": "Short-horizon retail theme traders and T+1 constrained holders supplying stock into steady institutional demand.", "data_requirements": "[\"daily CN price/volume/daily_basic already available\",\"hedged sleeve attribution vs 000300.SH and 399006.SZ\",\"correlation check vs promoted sleeves\",\"source-review confirmation before attaching any supplier/customer narrative\"]", "failure_mode": "Stops working when broad policy/beta waves dominate stock selection or when turnover floor is created by indiscriminate speculation rather than real accumulation.", "report_contract": "setup_overlay", "ai_supercycle_layer": "ai_networking_optical_cpo", "supply_chain_hypothesis": "Domestic optical/interconnect bottleneck names linked to AI datacenter bandwidth expansion should show steady sponsorship and positive body closes before lagging narrative confirmation.", "relationship_evidence_required": "true", "money_readiness": "research_only", "decision": "revert", "session_branch": "main", "base_ref": "origin/main", "merge_base": "b127bcb38ef90487e053bb7009fa8bafbe89687b", "head_commit": "b127bcb38ef90487e053bb7009fa8bafbe89687b"}
{"ts": "2026-05-20T07:23:20.341546+08:00", "session_id": "20260520_062702_8909c7", "market": "cn", "formula": "rank(-ts_corr(ret_1d,shift(ret_1d,1),20)*ts_mean(amount/circ_market_cap,20)/(ts_std(amount/circ_market_cap,20)+0.001))", "name": "anti_autocorr_float_absorption_20", "is_ic": -0.0041, "is_ic_ir": -0.013, "is_sharpe": 0.068, "is_turnover": 0.195, "is_monotonicity": 0.1, "gates": "FAIL", "status": "reverted", "eval_seconds": 162.1, "sleeve_id": "daily_price_overlay", "mispricing_source": "Execution-capacity mismatch in limited-float AI names; patient capital slices into positions while T+1 retail/theme money creates noisy two-way tape. This is a flow-absorption signal, not a close-rank or upper-shadow clone, because it requires both float-normalized value stability and anti-autocorrelated returns.", "forced_counterparty": "short-horizon retail churn and benchmark/liquidity rebalancers supplying stock around a slower institutional bid", "data_requirements": "[\"Initial test uses current daily data: amount, circ_market_cap, ret_1d\", \"For promotion: rolling corr to live factors, beta-hedged sleeve return, residual risk attribution, ai_infra module/depth tags for sub-universe cuts\"]", "failure_mode": "It should break when the AI theme shifts into straight-line momentum mania or broad deleveraging, because negative daily autocorrelation disappears and the signal degrades into a generic size/liquidity proxy.", "report_contract": "research_only", "ai_supercycle_layer": "ai_chip_equipment_materials_packaging", "supply_chain_hypothesis": "Candidate domestic AI chip-equipment/materials/packaging bottlenecks should show steady float-adjusted absorption before backlog and order evidence is fully reflected in price.", "relationship_evidence_required": "true", "money_readiness": "research_only", "decision": "revert", "session_branch": "main", "base_ref": "origin/main", "merge_base": "b127bcb38ef90487e053bb7009fa8bafbe89687b", "head_commit": "b127bcb38ef90487e053bb7009fa8bafbe89687b"}
{"ts": "2026-05-20T07:23:20.341546+08:00", "session_id": "20260520_062702_8909c7", "market": "cn", "formula": "rank((ret_20d-ret_5d)/(ts_std(turnover_rate,20)+0.01))", "name": "_leader_pullback_turnstd_20_", "is_ic": 0.0776, "is_ic_ir": 0.27, "is_sharpe": 4.053, "is_turnover": 0.192, "is_monotonicity": 0.7, "gates": "PASS", "status": "candidate", "eval_seconds": 99.6, "sleeve_id": "_cn_ai_leadership_pullback_", "mispricing_source": "The market tends to over-extrapolate a 1-week loss of momentum as theme exhaustion; in real bottleneck names, recent weakness with stable turnover is often just digestion before continuation.", "forced_counterparty": "Short-horizon retail/theme traders and benchmark-constrained funds trimming recent winners", "data_requirements": "`[\"daily close/open/high/low\",\"daily turnover_rate\",\"AI-universe membership + layer metadata\",\"beta-hedged sleeve PnL and residual risk attribution before promotion\"]`", "failure_mode": "It should fail in panic de-risking or broad breakout-chase regimes, and it also fails if low turnover volatility means genuine attention collapse rather than absorption.", "report_contract": "research_only", "ai_supercycle_layer": "`ai_chip_equipment_materials_packaging`", "supply_chain_hypothesis": "Domestic AI bottleneck names in equipment/materials/packaging can show medium-term leadership with short pullbacks as fast money rotates out but strategic capital keeps float tight.", "relationship_evidence_required": "true", "money_readiness": "research_only", "decision": "candidate", "session_branch": "main", "base_ref": "origin/main", "merge_base": "b127bcb38ef90487e053bb7009fa8bafbe89687b", "head_commit": "b127bcb38ef90487e053bb7009fa8bafbe89687b"}
{"ts": "2026-05-20T07:23:20.341546+08:00", "session_id": "20260520_062702_8909c7", "market": "cn", "formula": "rank(ret_20d)*rank(ts_mean(amount,20)/(ts_std(amount,20)+1))", "name": "stable_amount_leader_20", "is_ic": -0.02, "is_ic_ir": -0.108, "is_sharpe": -2.775, "is_turnover": 0.188, "is_monotonicity": -0.8, "gates": "FAIL", "status": "reverted", "eval_seconds": 92.0, "sleeve_id": "ai_cn_capacity_accumulation", "mispricing_source": "Underreaction to slow, benchmark-constrained institutional accumulation in scarce-capacity AI names; daily tape looks “orderly” rather than exciting, so the market underprices persistence.", "forced_counterparty": "Benchmarked mutual funds and ETF-related allocators that must scale into confirmed leaders gradually; short-horizon retail traders sell liquidity into quiet strength and chase noisier names elsewhere.", "data_requirements": "[\"daily OHLCV\",\"daily_basic.amount\",\"ai_infra universe metadata\",\"benchmark returns for beta-hedged attribution\"]", "failure_mode": "Breaks when the market regime shifts to one-day speculative rotation or forced deleveraging, where stable leaders stop absorbing flow and high-volatility lottery names dominate.", "report_contract": "fresh_buy_gate", "ai_supercycle_layer": "ai_chip_equipment_materials_packaging", "supply_chain_hypothesis": "Domestic wafer-fab, advanced packaging, and test-equipment bottleneck names are accumulated before verified order/backlog disclosures fully propagate into consensus.", "relationship_evidence_required": "true", "money_readiness": "money_candidate", "decision": "revert", "session_branch": "main", "base_ref": "origin/main", "merge_base": "b127bcb38ef90487e053bb7009fa8bafbe89687b", "head_commit": "b127bcb38ef90487e053bb7009fa8bafbe89687b"}
{"ts": "2026-05-20T07:23:20.341546+08:00", "session_id": "20260520_062702_8909c7", "market": "cn", "formula": "rank(ret_20d-ret_5d)*rank(-(ts_max(turnover_rate,20)/ts_mean(turnover_rate,20)))", "name": "leader_pullback_turnover_nospike_20", "is_ic": 0.0032, "is_ic_ir": 0.01, "is_sharpe": 6.471, "is_turnover": 0.179, "is_monotonicity": 0.7, "gates": "FAIL", "status": "reverted", "eval_seconds": 158.6, "sleeve_id": "cn_ai_leader_pullback", "mispricing_source": "Short-horizon theme money sells recent winners on minor pullbacks, while low-spike turnover signals absorption rather than distribution.", "forced_counterparty": "retail momentum traders and benchmarked funds trimming recent winners", "data_requirements": "[\"daily close/open/high/low/turnover_rate\",\"ai_infra universe membership and source-review status\",\"portfolio beta-hedge return, residual return, sleeve drawdown, and sleeve correlation attribution\"]", "failure_mode": "It should stop working in blow-off speculative regimes where turnover spikes are the real continuation signal, or in broad mean-reversion regimes where medium-term leadership no longer persists.", "report_contract": "setup_overlay", "ai_supercycle_layer": "ai_chip_equipment_materials_packaging", "supply_chain_hypothesis": "Candidate AI bottleneck names in CN semicap/materials/packaging/testing should show 20-day leadership followed by shallow 5-day pullbacks without turnover climax before the next repricing leg.", "relationship_evidence_required": "true", "money_readiness": "research_only", "decision": "revert", "session_branch": "main", "base_ref": "origin/main", "merge_base": "b127bcb38ef90487e053bb7009fa8bafbe89687b", "head_commit": "b127bcb38ef90487e053bb7009fa8bafbe89687b"}
{"ts": "2026-05-20T07:23:20.341546+08:00", "session_id": "20260520_062702_8909c7", "market": "cn", "formula": "rank((ret_20d-ret_5d)*ts_mean(amount,20)/(ts_std(amount,20)+1))", "name": "leader_pullback_amountstable_20", "is_ic": -0.0385, "is_ic_ir": -0.181, "is_sharpe": -2.938, "is_turnover": 0.217, "is_monotonicity": 0.1, "gates": "FAIL", "status": "reverted", "eval_seconds": 101.8, "sleeve_id": "cn_ai_infra_orderly_accumulation", "mispricing_source": "T+1 retail profit-taking and benchmarked managers trimming recent winners create shallow pullbacks, while slower institutional accumulation in AI-infra leaders keeps amount stable and the trend resumes.", "forced_counterparty": "Short-horizon retail traders and benchmark-constrained PMs de-risking after recent gains", "data_requirements": "[\"daily OHLCV\",\"amount\",\"ai_infra CN universe membership\",\"benchmark returns for beta-hedged sleeve attribution\"]", "failure_mode": "Fails in violent style rotation into low-quality laggards, policy beta melt-ups, or after stable-amount leaders become crowded and break trend together.", "report_contract": "fresh_buy_gate", "ai_supercycle_layer": "ai_chip_equipment_materials_packaging", "supply_chain_hypothesis": "Orderly pullbacks with stable traded amount should preferentially surface domestic-substitution equipment/materials/packaging bottleneck names being accumulated ahead of reported order or backlog confirmation.", "relationship_evidence_required": "true", "money_readiness": "money_candidate", "decision": "revert", "session_branch": "main", "base_ref": "origin/main", "merge_base": "b127bcb38ef90487e053bb7009fa8bafbe89687b", "head_commit": "b127bcb38ef90487e053bb7009fa8bafbe89687b"}
{"ts": "2026-05-20T07:23:20.341546+08:00", "session_id": "20260520_062702_8909c7", "market": "cn", "formula": "rank(ts_mean(amount / circ_market_cap, 20) / (ts_std(turnover_rate, 20) + 0.01))", "name": "float_absorption_stable_churn_20", "is_ic": -0.0103, "is_ic_ir": -0.04, "is_sharpe": 3.611, "is_turnover": 0.12, "is_monotonicity": 0.8, "gates": "FAIL", "status": "reverted", "eval_seconds": 84.5, "sleeve_id": "cn_ai_flow_accumulation", "mispricing_source": "Slow-moving fundamental and thematic allocators build positions over days, while the marginal A-share price setter overweights noisy turnover spikes and underprices steady absorption of limited float.", "forced_counterparty": "Retail traders and non-thematic benchmark/liquidity sellers who supply float on short-horizon noise", "data_requirements": "[\"amount\",\"turnover_rate\",\"circ_market_cap\",\"benchmark hedge return series\",\"rolling sleeve correlation monitor\",\"filings/official releases if any inferred supplier/customer link is used\"]", "failure_mode": "It weakens when the tape is purely rumor-driven, when float structure changes via placements/unlocks, or when broad deleveraging forces institutions to sell regardless of accumulation quality.", "report_contract": "fresh_buy_gate", "ai_supercycle_layer": "ai_networking_optical_cpo", "supply_chain_hypothesis": "Candidate bottleneck optical/interconnect and related AI infrastructure names should show sustained RMB absorption into limited float before the market fully prices their role in AI capex bottlenecks.", "relationship_evidence_required": "true", "money_readiness": "money_candidate", "decision": "revert", "session_branch": "main", "base_ref": "origin/main", "merge_base": "b127bcb38ef90487e053bb7009fa8bafbe89687b", "head_commit": "b127bcb38ef90487e053bb7009fa8bafbe89687b"}
