{"ts": "2026-05-21T14:55:05.681559+08:00", "session_id": "20260521_140002_d2b4fa", "market": "cn", "formula": "rank(ts_mean(volume_ratio,20)-ts_std(volume_ratio,20))", "name": "steady_relvol_20", "is_ic": -0.0195, "is_ic_ir": -0.136, "is_sharpe": -2.889, "is_turnover": 0.121, "is_monotonicity": -0.45, "gates": "FAIL", "status": "reverted", "eval_seconds": 135.3, "sleeve_id": "cn_ai_flow_accumulation", "mispricing_source": "The market underreacts to smooth multi-day sponsorship in hard-to-underwrite AI bottleneck names because confirmation arrives later through filings, orders, and policy narratives.", "forced_counterparty": "Retail hot-money and benchmark-constrained managers who supply liquidity early or delay reweighting into mid-cap suppliers.", "data_requirements": "[\"daily OHLCV + daily_basic volume_ratio\", \"AI universe membership/evidence-card status\", \"beta-hedged attribution vs 000300.SH/399006.SZ\", \"source-reviewed filings/press releases if a supplier-link claim is used in promotion\"]", "failure_mode": "It breaks when participation becomes rumor-driven and one-day spikes dominate, or when liquidity dries up so low-burst volume simply reflects neglect rather than sponsorship.", "report_contract": "setup_overlay", "ai_supercycle_layer": "ai_chip_equipment_materials_packaging", "supply_chain_hypothesis": "Candidate CN equipment/materials/advanced-packaging bottleneck names should show steady above-baseline participation before reported capex/orders catch up; exact customer and dependency edges still need source review.", "relationship_evidence_required": "true", "money_readiness": "research_only", "decision": "revert", "session_branch": "main", "base_ref": "origin/main", "merge_base": "c550618668ba3d3ec82401f36dd85be095d0fc92", "head_commit": "c550618668ba3d3ec82401f36dd85be095d0fc92"}
{"ts": "2026-05-21T14:55:05.681559+08:00", "session_id": "20260521_140002_d2b4fa", "market": "cn", "formula": "rank(ts_min(turnover_rate,20)/ts_max(turnover_rate,20))", "name": "turnover_floor_spike_balance_20", "is_ic": -0.0561, "is_ic_ir": -0.216, "is_sharpe": -5.1, "is_turnover": 0.141, "is_monotonicity": -0.7, "gates": "FAIL", "status": "reverted", "eval_seconds": 169.6, "sleeve_id": "cn_aiinfra_turnover_path", "mispricing_source": "The market overpays for headline-driven turnover spikes and underprices names with persistent baseline participation; this is a turnover path-shape signal, not a return/candle clone.", "forced_counterparty": "Retail theme chasers and benchmark-aware funds trading around headline/liquidity windows", "data_requirements": "[\"current CN daily turnover_rate history is sufficient for IS test\",\"run correlation check vs promoted factors\",\"before promotion require beta-hedged sleeve attribution and residual-risk report vs 000300.SH/399006.SZ\"]", "failure_mode": "It stops working when AI-theme leadership is driven mainly by breakout-chasing and single-day turnover spikes, or if turnover dispersion is structurally compressed by market-regime or microstructure changes.", "report_contract": "research_only", "ai_supercycle_layer": "ai_chip_equipment_materials_packaging", "supply_chain_hypothesis": "Quietly accumulated semiconductor equipment/material/packaging names may be upstream AI bottlenecks repricing before verified order or backlog evidence appears in filings.", "relationship_evidence_required": "true", "money_readiness": "research_only", "decision": "revert", "session_branch": "main", "base_ref": "origin/main", "merge_base": "c550618668ba3d3ec82401f36dd85be095d0fc92", "head_commit": "c550618668ba3d3ec82401f36dd85be095d0fc92"}
{"ts": "2026-05-21T14:55:05.681559+08:00", "session_id": "20260521_140002_d2b4fa", "market": "cn", "formula": "rank(ts_mean(amount,20)/ts_std(amount,20))*rank(-ps_ttm)", "name": "amount_stability_value_20", "is_ic": 0.0057, "is_ic_ir": 0.041, "is_sharpe": -2.026, "is_turnover": 0.11, "is_monotonicity": -0.25, "gates": "FAIL", "status": "reverted", "eval_seconds": 95.8, "sleeve_id": "cn_ai_accumulation_value", "mispricing_source": "Retail and fast-money flows chase breakout stories, while steadier institutional buying in cheaper AI bottleneck names is underreacted until follow-through tape or verified source evidence appears.", "forced_counterparty": "retail momentum chasers and benchmarked managers crowded into already-expensive leaders", "data_requirements": "[\"daily OHLCV + daily_basic for IS test\", \"benchmark beta-hedge and residual attribution\", \"sleeve correlation vs promoted factors\", \"source-reviewed AI-universe membership and relationship evidence before production use\"]", "failure_mode": "Fails when the market rewards pure speculative beta over orderly accumulation, or when low ps_ttm is just a structural value trap with no real AI capex linkage.", "report_contract": "research_only", "ai_supercycle_layer": "ai_datacenter_edge_infra", "supply_chain_hypothesis": "Quiet accumulation should surface first in CN datacenter, optical, power, and equipment bottleneck suppliers exposed to AI buildout before verified customer or order evidence is broadly disseminated.", "relationship_evidence_required": "true", "money_readiness": "research_only", "decision": "revert", "session_branch": "main", "base_ref": "origin/main", "merge_base": "c550618668ba3d3ec82401f36dd85be095d0fc92", "head_commit": "c550618668ba3d3ec82401f36dd85be095d0fc92"}
{"ts": "2026-05-21T14:55:05.681559+08:00", "session_id": "20260521_140002_d2b4fa", "market": "cn", "formula": "rank(-ts_std(amount,20)/ts_mean(amount,20))*rank(-ts_mean(volume_ratio,5))", "name": "quiet_amount_uncrowded_20", "is_ic": 0.0132, "is_ic_ir": 0.079, "is_sharpe": -2.676, "is_turnover": 0.192, "is_monotonicity": -0.6, "gates": "FAIL", "status": "reverted", "eval_seconds": 201.6, "sleeve_id": "quiet_accumulation_overlay", "mispricing_source": "The market overreacts to noisy high-volume AI narratives and underreacts to quiet institutional accumulation; this signal is participation-quality, not a high-correlation rewrite of price momentum or candlestick shape.", "forced_counterparty": "retail momentum chasers and benchmark-constrained mutual funds that scale in only after evidence/news is obvious", "data_requirements": "[\"current daily fields only for IS test\",\"benchmark-hedged sleeve return vs 000300.SH/399006.SZ/399006.SZ peers\",\"sleeve correlation and residual-risk attribution\",\"capacity/liquidity check\",\"filings/PR/transcripts if any supplier interpretation is promoted\"]", "failure_mode": "It stops working when low relative volume means genuine demand absence rather than quiet absorption, or when the regime shifts to retail-led speculative bursts where crowded tape keeps winning.", "report_contract": "action_overlay", "ai_supercycle_layer": "ai_chip_equipment_materials_packaging", "supply_chain_hypothesis": "Source-reviewed domestic AI chip-equipment/materials/packaging bottlenecks should show steady amount with subdued crowding before capex/order confirmation is fully priced.", "relationship_evidence_required": "true", "money_readiness": "research_only", "decision": "revert", "session_branch": "main", "base_ref": "origin/main", "merge_base": "c550618668ba3d3ec82401f36dd85be095d0fc92", "head_commit": "c550618668ba3d3ec82401f36dd85be095d0fc92"}
{"ts": "2026-05-21T14:55:05.681559+08:00", "session_id": "20260521_140002_d2b4fa", "market": "cn", "formula": "rank(-ts_corr(amount, abs(ret_1d), 20))", "name": "quiet_amount_absorption_20", "is_ic": -0.0035, "is_ic_ir": -0.023, "is_sharpe": -1.333, "is_turnover": 0.181, "is_monotonicity": -0.15, "gates": "FAIL", "status": "reverted", "eval_seconds": 88.4, "sleeve_id": "daily_flow_absorption", "mispricing_source": "Retail money overweights high-drama breakout tape and underweights persistent low-impact capital absorption, so bottleneck names with stealth sponsorship are mispriced until narrative confirmation arrives.", "forced_counterparty": "retail swing traders and benchmark-constrained legacy holders who supply stock on quiet days", "data_requirements": "[\"daily OHLCV\",\"amount\",\"turnover_rate\",\"AI universe membership\",\"beta-hedge attribution vs 000300.SH/399006.SZ\",\"sleeve correlation check vs amount_stability_20\"]; any supplier/customer narrative still needs filings or official source review", "failure_mode": "Fails in pure sentiment-chase regimes where real winners only move on explosive breakout volume, or in liquidity droughts where quiet tape means apathy instead of absorption.", "report_contract": "setup_overlay", "ai_supercycle_layer": "ai_chip_equipment_materials_packaging", "supply_chain_hypothesis": "D1-D3 bottleneck equipment/materials names may show quiet absorption before downstream AI capex, order visibility, or localization urgency is fully reflected in price.", "relationship_evidence_required": "true", "money_readiness": "research_only", "decision": "revert", "session_branch": "main", "base_ref": "origin/main", "merge_base": "c550618668ba3d3ec82401f36dd85be095d0fc92", "head_commit": "c550618668ba3d3ec82401f36dd85be095d0fc92"}
{"ts": "2026-05-21T14:55:05.681559+08:00", "session_id": "20260521_140002_d2b4fa", "market": "cn", "formula": "rank(ts_mean(turnover_rate,20)/(ts_std(ret_1d,20)+0.01))", "name": "float_absorption_efficiency_20", "is_ic": 0.0104, "is_ic_ir": 0.058, "is_sharpe": 1.927, "is_turnover": 0.039, "is_monotonicity": 0.05, "gates": "FAIL", "status": "reverted", "eval_seconds": 119.0, "sleeve_id": "cn_aiinfra_flow_absorption", "mispricing_source": "Slow price discovery in A-shares; steady share turnover without large daily swings suggests informed accumulation rather than fully priced momentum, so the payoff is a flow-efficiency effect rather than another raw price-trend clone.", "forced_counterparty": "retail hot-money and benchmark-constrained mutual funds that trade around headlines or de-risk before fundamental confirmation", "data_requirements": "[\"turnover_rate\",\"ret_1d\",\"benchmark-hedged sleeve PnL\",\"factor correlation matrix\",\"capacity/turnover impact study\",\"source-reviewed evidence before naming any specific supply-chain relationship\"]", "failure_mode": "Stops working when turnover is dominated by speculative theme chasing or forced de-risking, so high turnover no longer means absorption and instead signals distribution.", "report_contract": "setup_overlay", "ai_supercycle_layer": "ai_chip_equipment_materials_packaging", "supply_chain_hypothesis": "candidate domestic chip-equipment, materials, or advanced-packaging bottleneck names are being accumulated before verified order/capacity evidence reaches consensus", "relationship_evidence_required": "true", "money_readiness": "research_only", "decision": "revert", "session_branch": "main", "base_ref": "origin/main", "merge_base": "c550618668ba3d3ec82401f36dd85be095d0fc92", "head_commit": "c550618668ba3d3ec82401f36dd85be095d0fc92"}
{"ts": "2026-05-21T14:55:05.681559+08:00", "session_id": "20260521_140002_d2b4fa", "market": "cn", "formula": "rank(-ret_5d) * rank(ts_mean(amount,20) / (ts_std(amount,20) + 0.01))", "name": "stable_amount_pullback_20", "is_ic": 0.0303, "is_ic_ir": 0.167, "is_sharpe": -2.417, "is_turnover": 0.271, "is_monotonicity": 0.15, "gates": "FAIL", "status": "reverted", "eval_seconds": 154.1, "sleeve_id": "cn_ai_infra_pullback_overlay", "mispricing_source": "Short-horizon A-share momentum money sells weekly weakness, while slower fundamental allocators keep sponsoring validated AI-infra names; the amount-stability filter makes this an ownership-transfer signal rather than a naked price-reversal clone.", "forced_counterparty": "T+1 retail momentum traders, short-horizon sector rotators, and benchmarked funds trimming recent AI winners", "data_requirements": "[\"current CN daily amount and return data for signal calculation\",\"portfolio beta-hedge and residual-risk attribution before promotion\",\"source-review/evidence-card status for any supplier or customer narrative attached to top-ranked names\"]", "failure_mode": "It stops working when the pullback reflects genuine order/capex disappointment, or when leadership broadens so stable amount just proxies large-cap defensiveness instead of accumulation.", "report_contract": "setup_overlay", "ai_supercycle_layer": "ai_networking_optical_cpo", "supply_chain_hypothesis": "Orderly pullbacks with stable traded value should preferentially surface validated CN optical/interconnect bottleneck names being accumulated ahead of downstream order confirmation; price data alone does not verify any specific supplier/customer link.", "relationship_evidence_required": "true", "money_readiness": "research_only", "decision": "revert", "session_branch": "main", "base_ref": "origin/main", "merge_base": "c550618668ba3d3ec82401f36dd85be095d0fc92", "head_commit": "c550618668ba3d3ec82401f36dd85be095d0fc92"}
{"ts": "2026-05-21T14:55:05.681559+08:00", "session_id": "20260521_140002_d2b4fa", "market": "cn", "formula": "rank(ts_min(turnover_rate,20)/(ts_mean(turnover_rate,20)+0.01))*rank(-ret_5d)", "name": "turnover_floor_pullback_5", "is_ic": -0.0038, "is_ic_ir": -0.024, "is_sharpe": -3.0, "is_turnover": 0.292, "is_monotonicity": 0.1, "gates": "FAIL", "status": "reverted", "eval_seconds": 190.8, "sleeve_id": "cn_ai_accumulation_overlay", "mispricing_source": "Short-horizon sellers push price down faster than longer-horizon capital withdraws liquidity, so preserved turnover floor identifies names where supply is being absorbed rather than abandoned.", "forced_counterparty": "Retail momentum traders and fast-money thematic funds unwinding on short pullbacks; benchmark-aware institutions that wait for confirmation and rebalance too slowly.", "data_requirements": "[\"uses current CN daily data only: turnover_rate, ret_5d\",\"before promotion: beta-hedged sleeve return, residual risk attribution, correlation to existing sleeves\",\"if interpreted as supplier leadership: filings/press releases/transcripts for source review\"]", "failure_mode": "Stops working when pullbacks reflect real thesis breaks instead of liquidity exits, or when broad speculative momentum dominates and stable turnover floor no longer signals informed accumulation.", "report_contract": "setup_overlay", "ai_supercycle_layer": "ai_chip_equipment_materials_packaging", "supply_chain_hypothesis": "Should preferentially surface upstream chip equipment/materials/packaging names whose float is being absorbed during tape weakness ahead of verified AI capex and order evidence.", "relationship_evidence_required": "true", "money_readiness": "research_only", "decision": "revert", "session_branch": "main", "base_ref": "origin/main", "merge_base": "c550618668ba3d3ec82401f36dd85be095d0fc92", "head_commit": "c550618668ba3d3ec82401f36dd85be095d0fc92"}
{"ts": "2026-05-21T14:55:05.681559+08:00", "session_id": "20260521_140002_d2b4fa", "market": "cn", "formula": "rank(-ts_corr(ret_5d, amount/circ_market_cap,20))", "name": "float_absorption_diverge_20", "is_ic": 0.0285, "is_ic_ir": 0.087, "is_sharpe": -1.34, "is_turnover": 0.154, "is_monotonicity": 0.05, "gates": "FAIL", "status": "reverted", "eval_seconds": 186.5, "sleeve_id": "cn_ai_flow_absorption", "mispricing_source": "Underreaction to institutional absorption on pullbacks; the tape over-weights visible weakness and under-weights who is taking the other side in float-normalized size.", "forced_counterparty": "T+1 retail dip-sellers and benchmark-constrained funds cutting exposure during headline or style rotations", "data_requirements": "[\"ret_5d\",\"amount\",\"circ_market_cap\"] for IS test; for promotion add ai_infra source-review status, beta-hedged attribution vs 000300.SH and 399006.SZ, and sleeve residual risk stats", "failure_mode": "It fails when weak 5-day tape reflects true fundamental leakage, or when policy-beta melt-ups reward pure breakout chasing instead of absorption setups", "report_contract": "research_only", "ai_supercycle_layer": "ai_chip_equipment_materials_packaging", "supply_chain_hypothesis": "Bottleneck CN equipment, materials, and advanced-packaging names should show float-normalized trading value rising into short pullbacks before backlog or order evidence is fully visible in public filings", "relationship_evidence_required": "true", "money_readiness": "research_only", "decision": "revert", "session_branch": "main", "base_ref": "origin/main", "merge_base": "c550618668ba3d3ec82401f36dd85be095d0fc92", "head_commit": "c550618668ba3d3ec82401f36dd85be095d0fc92"}
{"ts": "2026-05-21T14:55:05.681559+08:00", "session_id": "20260521_140002_d2b4fa", "market": "cn", "formula": "rank(ts_corr(ret_1d,shift(ret_1d,1),20))*rank(-ts_std(turnover_rate,20)/(ts_std(turnover_rate,120)+0.01))", "name": "turnover_regime_autocorr_20_120", "is_ic": -0.0675, "is_ic_ir": -0.232, "is_sharpe": -5.781, "is_turnover": 0.183, "is_monotonicity": -0.6, "gates": "FAIL", "status": "reverted", "eval_seconds": 181.2, "sleeve_id": "cn_ai_accumulation_regime", "mispricing_source": "Multi-week underreaction to accumulation inside the validated AI universe; conditioning persistence on turnover compression makes this a flow-regime signal rather than a high-correlation clone of the existing pure price/candlestick sleeves.", "forced_counterparty": "Retail T+1 traders, theme-chasing liquidity, and benchmarked funds that must adjust exposure incrementally instead of immediately.", "data_requirements": "[\"daily close/ret_1d\",\"daily turnover_rate\",\"AI-universe membership metadata\",\"benchmark series for beta-hedged sleeve attribution\"]; no extra non-daily dataset is required for the initial test.", "failure_mode": "It stops working when the market shifts into headline-driven mean reversion, or when turnover compression reflects illiquidity rather than absorption.", "report_contract": "setup_overlay", "ai_supercycle_layer": "none", "supply_chain_hypothesis": "none", "relationship_evidence_required": "false", "money_readiness": "research_only", "decision": "revert", "session_branch": "main", "base_ref": "origin/main", "merge_base": "c550618668ba3d3ec82401f36dd85be095d0fc92", "head_commit": "c550618668ba3d3ec82401f36dd85be095d0fc92"}
{"ts": "2026-05-21T14:55:05.681559+08:00", "session_id": "20260521_140002_d2b4fa", "market": "cn", "formula": "rank(-ts_max(ret_1d,20))*rank(ts_mean(amount/circ_market_cap,20)/ts_std(amount/circ_market_cap,20))", "name": "low_lottery_float_absorb_20", "is_ic": -0.0525, "is_ic_ir": -0.179, "is_sharpe": -5.075, "is_turnover": 0.139, "is_monotonicity": -0.75, "gates": "FAIL", "status": "reverted", "eval_seconds": 210.1, "sleeve_id": "cn_ai_absorption_overlay", "mispricing_source": "Retail lottery preference overpays for jumpy theme names, while institutions build positions gradually in credible AI-infra suppliers before backlog or order evidence is fully reflected.", "forced_counterparty": "Retail momentum traders and benchmark-constrained funds that wait for explicit order proof", "data_requirements": "[\"current CN daily price/amount/daily_basic for IS test\",\"beta-hedged sleeve return and residual risk attribution before promotion\",\"filings/backlog/capex evidence if later used to label hard-asset AI bottleneck exposure\"]", "failure_mode": "It stops working in full concept-mania regimes where gap-up speculation dominates or in liquidity shocks where steady-absorption names are sold as funding sources.", "report_contract": "setup_overlay", "ai_supercycle_layer": "hard_assets_energy_heavy", "supply_chain_hypothesis": "Datacenter power, cooling, grid and other hard-asset AI enablers in the CN universe should rerate via steady absorption and low-lottery tape before capex or backlog confirmation becomes consensus.", "relationship_evidence_required": "true", "money_readiness": "research_only", "decision": "revert", "session_branch": "main", "base_ref": "origin/main", "merge_base": "c550618668ba3d3ec82401f36dd85be095d0fc92", "head_commit": "c550618668ba3d3ec82401f36dd85be095d0fc92"}
{"ts": "2026-05-21T14:55:05.681559+08:00", "session_id": "20260521_140002_d2b4fa", "market": "cn", "formula": "rank(-ts_std(pct_change(amount / circ_market_cap,5),20))", "name": "weekly_float_flow_stability_20", "is_ic": -0.0298, "is_ic_ir": -0.123, "is_sharpe": -3.49, "is_turnover": 0.116, "is_monotonicity": -0.4, "gates": "FAIL", "status": "reverted", "eval_seconds": 169.5, "sleeve_id": "cn_ai_infra_flow_accumulation", "mispricing_source": "Quiet inventory transfer and underreaction to steady accumulation; this is a flow-path signal, not a reused price-momentum variant.", "forced_counterparty": "Retail thematic chasers and short-horizon liquidity traders who concentrate turnover into bursts rather than sustained absorption.", "data_requirements": "[\"current daily data sufficient for IS test\",\"correlation check vs amount_stability_20 and turnover_stability_20 family\",\"beta-hedged sleeve attribution vs 000300.SH and 399006.SZ before promotion\",\"ai_infra source-review status for ranked names\"]", "failure_mode": "Breaks in rumor-driven spike regimes where one-day speculative turnover dominates, or if it collapses into a generic large-cap/low-beta proxy instead of true accumulation.", "report_contract": "setup_overlay", "ai_supercycle_layer": "ai_chip_equipment_materials_packaging", "supply_chain_hypothesis": "Domestic semicap equipment/materials bottlenecks may be quietly accumulated ahead of verified fab capex or tool/material order visibility, which should appear as smooth weekly float-flow rather than isolated hype spikes.", "relationship_evidence_required": "true", "money_readiness": "research_only", "decision": "revert", "session_branch": "main", "base_ref": "origin/main", "merge_base": "c550618668ba3d3ec82401f36dd85be095d0fc92", "head_commit": "c550618668ba3d3ec82401f36dd85be095d0fc92"}
