{"base_ref": "origin/main", "decision": "revert", "eval_seconds": 151.4, "formula": "rank(ts_mean(ts_mean(turnover_rate,5),20)/ts_max(ts_mean(turnover_rate,5),20))*rank(-ts_corr(ts_mean(turnover_rate,5),shift(ts_mean(turnover_rate,5),5),20))", "gates": "FAIL", "head_commit": "4ede705179d231f6a5351285121c32d4cfeae900", "is_ic": 0.004, "is_ic_ir": 0.027, "is_monotonicity": 0.1, "is_sharpe": -2.774, "is_turnover": 0.13, "market": "cn", "merge_base": "4ede705179d231f6a5351285121c32d4cfeae900", "name": "anti_autocorr_weekly_turnover_evenness_20", "session_branch": "main", "session_id": "20260429_140002_505112", "status": "reverted", "ts": "2026-04-29T14:57:49.276047+08:00"}
{"base_ref": "origin/main", "decision": "candidate", "eval_seconds": 125.4, "formula": "rank(-ts_corr(ret_1d,shift(ret_1d,1),20))*rank(ts_min(ts_sum(turnover_rate,5),20)/ts_mean(ts_sum(turnover_rate,5),20))", "gates": "PASS", "head_commit": "4ede705179d231f6a5351285121c32d4cfeae900", "is_ic": 0.036, "is_ic_ir": 0.4, "is_monotonicity": 0.55, "is_sharpe": 3.494, "is_turnover": 0.166, "market": "cn", "merge_base": "4ede705179d231f6a5351285121c32d4cfeae900", "name": "anti_autocorr_weekly_turnover_floor_20", "session_branch": "main", "session_id": "20260429_140002_505112", "status": "candidate", "ts": "2026-04-29T14:57:49.276047+08:00"}
{"base_ref": "origin/main", "decision": "candidate", "eval_seconds": 121.9, "formula": "rank(-ts_corr(ret_1d,shift(ret_1d,1),20))*rank(-ts_std(ts_sum(turnover_rate,5),20)/ts_mean(ts_sum(turnover_rate,5),20))", "gates": "PASS", "head_commit": "4ede705179d231f6a5351285121c32d4cfeae900", "is_ic": 0.0362, "is_ic_ir": 0.448, "is_monotonicity": 0.65, "is_sharpe": 3.558, "is_turnover": 0.151, "market": "cn", "merge_base": "4ede705179d231f6a5351285121c32d4cfeae900", "name": "anti_autocorr_weekly_turnover_stability_20", "session_branch": "main", "session_id": "20260429_140002_505112", "status": "candidate", "ts": "2026-04-29T14:57:49.276047+08:00"}
{"base_ref": "origin/main", "decision": "revert", "eval_seconds": 152.3, "formula": "rank(ts_corr(ret_1d,shift(ret_1d,1),20))*rank(ts_mean(turnover_rate,20)/ts_max(turnover_rate,20))", "gates": "FAIL", "head_commit": "4ede705179d231f6a5351285121c32d4cfeae900", "is_ic": 0.0033, "is_ic_ir": -0.005, "is_monotonicity": 0.0, "is_sharpe": -4.83, "is_turnover": 0.176, "market": "cn", "merge_base": "4ede705179d231f6a5351285121c32d4cfeae900", "name": "autocorr_turnover_evenness_20", "session_branch": "main", "session_id": "20260429_140002_505112", "status": "reverted", "ts": "2026-04-29T14:57:49.276047+08:00"}
{"base_ref": "origin/main", "decision": "candidate", "eval_seconds": 72.9, "formula": "rank(ts_mean(amount,20) / circ_market_cap / clamp(ts_std(turnover_rate,20),0.01,1))", "gates": "PASS", "head_commit": "4ede705179d231f6a5351285121c32d4cfeae900", "is_ic": 0.0276, "is_ic_ir": 0.314, "is_monotonicity": 0.9, "is_sharpe": 0.518, "is_turnover": 0.12, "market": "cn", "merge_base": "4ede705179d231f6a5351285121c32d4cfeae900", "name": "float_flow_stability_20", "session_branch": "main", "session_id": "20260429_140002_505112", "status": "candidate", "ts": "2026-04-29T14:57:49.276047+08:00"}
{"base_ref": "origin/main", "decision": "revert", "eval_seconds": 154.4, "formula": "(ts_mean(turnover_rate,20)/ts_std(turnover_rate,20))*(-ts_corr(abs(ret_5d),turnover_rate,20))", "gates": "FAIL", "head_commit": "4ede705179d231f6a5351285121c32d4cfeae900", "is_ic": -0.0109, "is_ic_ir": -0.103, "is_monotonicity": -0.3, "is_sharpe": -2.111, "is_turnover": 0.158, "market": "cn", "merge_base": "4ede705179d231f6a5351285121c32d4cfeae900", "name": "quiet_turnover_stability_20", "session_branch": "main", "session_id": "20260429_140002_505112", "status": "reverted", "ts": "2026-04-29T14:57:49.276047+08:00"}
{"base_ref": "origin/main", "decision": "candidate", "eval_seconds": 151.5, "formula": "rank(ts_min(turnover_rate,20) / ts_max(turnover_rate,20))", "gates": "PASS", "head_commit": "4ede705179d231f6a5351285121c32d4cfeae900", "is_ic": 0.0327, "is_ic_ir": 0.338, "is_monotonicity": 0.65, "is_sharpe": 0.906, "is_turnover": 0.116, "market": "cn", "merge_base": "4ede705179d231f6a5351285121c32d4cfeae900", "name": "turnover_corridor_20", "session_branch": "main", "session_id": "20260429_140002_505112", "status": "candidate", "ts": "2026-04-29T14:57:49.276047+08:00"}
{"base_ref": "origin/main", "decision": "revert", "eval_seconds": 64.0, "formula": "rank(-pb)*rank(ts_mean(turnover_rate,20))", "gates": "FAIL", "head_commit": "4ede705179d231f6a5351285121c32d4cfeae900", "is_ic": -0.0175, "is_ic_ir": -0.206, "is_monotonicity": -0.15, "is_sharpe": -3.128, "is_turnover": 0.026, "market": "cn", "merge_base": "4ede705179d231f6a5351285121c32d4cfeae900", "name": "value_attention_20", "session_branch": "main", "session_id": "20260429_140002_505112", "status": "reverted", "ts": "2026-04-29T14:57:49.276047+08:00"}
{"base_ref": "origin/main", "decision": "candidate", "eval_seconds": 184.0, "formula": "rank(-ts_std(pct_change(amount/circ_market_cap,5),20))", "gates": "PASS", "head_commit": "4ede705179d231f6a5351285121c32d4cfeae900", "is_ic": 0.034, "is_ic_ir": 0.338, "is_monotonicity": 0.15, "is_sharpe": 1.1, "is_turnover": 0.099, "market": "cn", "merge_base": "4ede705179d231f6a5351285121c32d4cfeae900", "name": "weekly_floatflow_stability_20", "session_branch": "main", "session_id": "20260429_140002_505112", "status": "candidate", "ts": "2026-04-29T14:57:49.276047+08:00"}
{"ts": "2026-04-30T06:57:16.767201+08:00", "session_id": "20260430_060001_1eb756", "market": "cn", "formula": "rank(ts_mean(amount, 20) / ts_std(amount, 20))", "name": "amount_stability_20", "is_ic": 0.0399, "is_ic_ir": 0.364, "is_sharpe": 1.534, "is_turnover": 0.117, "is_monotonicity": 0.45, "gates": "PASS", "status": "candidate", "eval_seconds": 22.4, "decision": "candidate", "session_branch": "main", "base_ref": "origin/main", "merge_base": "7e71edc0d50443d3db4f0dd72c25238cd7ac1282", "head_commit": "7e71edc0d50443d3db4f0dd72c25238cd7ac1282"}
{"ts": "2026-04-30T06:57:16.767201+08:00", "session_id": "20260430_060001_1eb756", "market": "cn", "formula": "rank(-(ts_std(turnover_rate,20)/ts_std(turnover_rate,60)))", "name": "turnover_vol_compress_20_60", "is_ic": 0.0328, "is_ic_ir": 0.306, "is_sharpe": 2.564, "is_turnover": 0.11, "is_monotonicity": 0.65, "gates": "PASS", "status": "candidate", "eval_seconds": 82.8, "decision": "candidate", "session_branch": "main", "base_ref": "origin/main", "merge_base": "7e71edc0d50443d3db4f0dd72c25238cd7ac1282", "head_commit": "7e71edc0d50443d3db4f0dd72c25238cd7ac1282"}
{"ts": "2026-04-30T06:57:16.767201+08:00", "session_id": "20260430_060001_1eb756", "market": "cn", "formula": "rank(-ts_corr(ret_1d, shift(ret_1d, 1), 20)) * rank(ts_min(turnover_rate, 20) / ts_max(turnover_rate, 20))", "name": "anti_autocorr_turnover_band_20", "is_ic": 0.0383, "is_ic_ir": 0.49, "is_sharpe": 4.135, "is_turnover": 0.169, "is_monotonicity": 0.4, "gates": "PASS", "status": "candidate", "eval_seconds": 149.8, "decision": "candidate", "session_branch": "main", "base_ref": "origin/main", "merge_base": "7e71edc0d50443d3db4f0dd72c25238cd7ac1282", "head_commit": "7e71edc0d50443d3db4f0dd72c25238cd7ac1282"}
{"ts": "2026-04-30T06:57:16.767201+08:00", "session_id": "20260430_060001_1eb756", "market": "cn", "formula": "rank(-ts_corr(ret_1d,shift(ret_1d,1),20))*rank(ts_min(ts_sum(volume_ratio,5),20)/ts_max(ts_sum(volume_ratio,5),20))", "name": "anti_autocorr_weekly_relvol_corridor_20", "is_ic": 0.0373, "is_ic_ir": 0.462, "is_sharpe": 3.408, "is_turnover": 0.156, "is_monotonicity": 0.2, "gates": "PASS", "status": "candidate", "eval_seconds": 172.4, "decision": "candidate", "session_branch": "main", "base_ref": "origin/main", "merge_base": "7e71edc0d50443d3db4f0dd72c25238cd7ac1282", "head_commit": "7e71edc0d50443d3db4f0dd72c25238cd7ac1282"}
{"ts": "2026-04-30T06:57:16.767201+08:00", "session_id": "20260430_060001_1eb756", "market": "cn", "formula": "rank(-ts_corr(ret_1d,shift(ret_1d,1),20))*rank(ts_mean(amount/circ_market_cap,20)/ts_max(amount/circ_market_cap,20))", "name": "anti_autocorr_float_peak_balance_20", "is_ic": 0.0336, "is_ic_ir": 0.46, "is_sharpe": 2.602, "is_turnover": 0.174, "is_monotonicity": 0.25, "gates": "PASS", "status": "candidate", "eval_seconds": 142.4, "decision": "candidate", "session_branch": "main", "base_ref": "origin/main", "merge_base": "7e71edc0d50443d3db4f0dd72c25238cd7ac1282", "head_commit": "7e71edc0d50443d3db4f0dd72c25238cd7ac1282"}
{"ts": "2026-04-30T06:57:16.767201+08:00", "session_id": "20260430_060001_1eb756", "market": "cn", "formula": "rank(-ts_corr(ret_1d, shift(ret_1d, 1), 20)) * rank(-pb)", "name": "anti_autocorr_value_anchor_20", "is_ic": 0.022, "is_ic_ir": 0.179, "is_sharpe": 0.74, "is_turnover": 0.127, "is_monotonicity": -0.15, "gates": "FAIL", "status": "reverted", "eval_seconds": 187.6, "decision": "revert", "session_branch": "main", "base_ref": "origin/main", "merge_base": "7e71edc0d50443d3db4f0dd72c25238cd7ac1282", "head_commit": "7e71edc0d50443d3db4f0dd72c25238cd7ac1282"}
{"ts": "2026-04-30T06:57:16.767201+08:00", "session_id": "20260430_060001_1eb756", "market": "cn", "formula": "rank(-ts_corr(ret_1d, shift(ret_1d, 1), 20)) * rank(ts_min(open / close, 20) / ts_max(open / close, 20))", "name": "anti_autocorr_openclose_corridor_20", "is_ic": 0.041, "is_ic_ir": 0.349, "is_sharpe": 0.573, "is_turnover": 0.152, "is_monotonicity": 0.0, "gates": "PASS", "status": "checks_failed", "eval_seconds": 214.9, "decision": "revert", "session_branch": "main", "base_ref": "origin/main", "merge_base": "7e71edc0d50443d3db4f0dd72c25238cd7ac1282", "head_commit": "7e71edc0d50443d3db4f0dd72c25238cd7ac1282", "oos": "PASS", "checks_status": "failed"}
{"ts": "2026-04-30T06:57:16.767201+08:00", "session_id": "20260430_060001_1eb756", "market": "cn", "formula": "rank(-ts_corr(ret_1d,shift(ret_1d,1),20))*rank(ts_mean(turnover_rate,5)/ts_max(turnover_rate,20))", "name": "anti_autocorr_weekly_turnover_evenness_20", "is_ic": 0.0209, "is_ic_ir": 0.281, "is_sharpe": 1.229, "is_turnover": 0.202, "is_monotonicity": 0.55, "gates": "PASS", "status": "candidate", "eval_seconds": 110.4, "decision": "candidate", "session_branch": "main", "base_ref": "origin/main", "merge_base": "7e71edc0d50443d3db4f0dd72c25238cd7ac1282", "head_commit": "7e71edc0d50443d3db4f0dd72c25238cd7ac1282"}
{"ts": "2026-04-30T06:57:16.767201+08:00", "session_id": "20260430_060001_1eb756", "market": "cn", "formula": "rank(-ts_corr(ret_1d,shift(ret_1d,1),20))*rank(-ts_std(delta(log(amount),5),20))", "name": "anti_autocorr_log_amount_change_20_5", "is_ic": 0.0416, "is_ic_ir": 0.454, "is_sharpe": 2.982, "is_turnover": 0.156, "is_monotonicity": 0.1, "gates": "PASS", "status": "checks_failed", "eval_seconds": 263.8, "decision": "revert", "session_branch": "main", "base_ref": "origin/main", "merge_base": "7e71edc0d50443d3db4f0dd72c25238cd7ac1282", "head_commit": "7e71edc0d50443d3db4f0dd72c25238cd7ac1282", "oos": "PASS", "checks_status": "failed"}
{"ts": "2026-04-30T06:57:16.767201+08:00", "session_id": "20260430_060001_1eb756", "market": "cn", "formula": "rank(-ts_corr(ret_1d,shift(ret_1d,1),20))*rank(ts_min(ts_sum(amount/circ_market_cap,5),20)/ts_mean(ts_sum(amount/circ_market_cap,5),20))", "name": "anti_autocorr_weekly_float_floor_20", "is_ic": 0.036, "is_ic_ir": 0.398, "is_sharpe": 3.528, "is_turnover": 0.166, "is_monotonicity": 0.6, "gates": "PASS", "status": "candidate", "eval_seconds": 147.8, "decision": "candidate", "session_branch": "main", "base_ref": "origin/main", "merge_base": "7e71edc0d50443d3db4f0dd72c25238cd7ac1282", "head_commit": "7e71edc0d50443d3db4f0dd72c25238cd7ac1282"}
{"ts": "2026-04-30T06:57:16.767201+08:00", "session_id": "20260430_060001_1eb756", "market": "cn", "formula": "rank(-ts_corr(ret_1d,shift(ret_1d,1),20))*rank(ts_min(ts_sum(amount,5),20)/ts_max(ts_sum(amount,5),20))", "name": "anti_autocorr_weekly_amount_corridor_20", "is_ic": 0.0367, "is_ic_ir": 0.439, "is_sharpe": 4.248, "is_turnover": 0.159, "is_monotonicity": 0.3, "gates": "PASS", "status": "candidate", "eval_seconds": 170.2, "decision": "candidate", "session_branch": "main", "base_ref": "origin/main", "merge_base": "7e71edc0d50443d3db4f0dd72c25238cd7ac1282", "head_commit": "7e71edc0d50443d3db4f0dd72c25238cd7ac1282"}
{"ts": "2026-04-30T06:57:16.767201+08:00", "session_id": "20260430_060001_1eb756", "market": "cn", "formula": "rank(-ts_corr(ret_1d, shift(ret_1d, 1), 20)) * rank(-ts_mean(abs(delta(volume_ratio, 5)), 20))", "name": "anti_autocorr_weekly_relvol_smooth_20", "is_ic": 0.0408, "is_ic_ir": 0.446, "is_sharpe": 3.163, "is_turnover": 0.155, "is_monotonicity": 0.15, "gates": "PASS", "status": "candidate", "eval_seconds": 142.2, "decision": "candidate", "session_branch": "main", "base_ref": "origin/main", "merge_base": "7e71edc0d50443d3db4f0dd72c25238cd7ac1282", "head_commit": "7e71edc0d50443d3db4f0dd72c25238cd7ac1282"}
{"ts": "2026-04-30T06:57:16.767201+08:00", "session_id": "20260430_060001_1eb756", "market": "cn", "formula": "rank(-ts_corr(ret_1d,shift(ret_1d,1),20))*rank(ts_mean(volume_ratio,20)/ts_max(volume_ratio,20))", "name": "anti_autocorr_relvol_evenness_20", "is_ic": 0.0331, "is_ic_ir": 0.425, "is_sharpe": 1.823, "is_turnover": 0.17, "is_monotonicity": 0.05, "gates": "PASS", "status": "candidate", "eval_seconds": 145.6, "decision": "candidate", "session_branch": "main", "base_ref": "origin/main", "merge_base": "7e71edc0d50443d3db4f0dd72c25238cd7ac1282", "head_commit": "7e71edc0d50443d3db4f0dd72c25238cd7ac1282"}
{"ts": "2026-04-30T06:57:16.767201+08:00", "session_id": "20260430_060001_1eb756", "market": "cn", "formula": "rank(-ts_corr(ret_1d,shift(ret_1d,1),40))*rank(-ts_std(ts_mean(close/open,5),20))", "name": "anti_autocorr_weekly_openclose_stability_20", "is_ic": 0.0311, "is_ic_ir": 0.292, "is_sharpe": 2.134, "is_turnover": 0.104, "is_monotonicity": 0.0, "gates": "PASS", "status": "candidate", "eval_seconds": 179.3, "decision": "candidate", "session_branch": "main", "base_ref": "origin/main", "merge_base": "7e71edc0d50443d3db4f0dd72c25238cd7ac1282", "head_commit": "7e71edc0d50443d3db4f0dd72c25238cd7ac1282"}
{"ts": "2026-04-30T06:57:16.767201+08:00", "session_id": "20260430_060001_1eb756", "market": "cn", "formula": "rank(-ts_corr(ret_1d,shift(ret_1d,1),20))*rank(ts_min(ts_sum(amount,5),20)/ts_max(ts_sum(amount,5),20))", "name": "anti_autocorr_weekly_amount_corridor_20", "is_ic": 0.0367, "is_ic_ir": 0.439, "is_sharpe": 4.248, "is_turnover": 0.159, "is_monotonicity": 0.3, "gates": "PASS", "status": "candidate", "eval_seconds": 129.0, "decision": "candidate", "session_branch": "main", "base_ref": "origin/main", "merge_base": "7e71edc0d50443d3db4f0dd72c25238cd7ac1282", "head_commit": "7e71edc0d50443d3db4f0dd72c25238cd7ac1282"}
{"ts": "2026-04-30T06:57:16.767201+08:00", "session_id": "20260430_060001_1eb756", "market": "cn", "formula": "rank(-ts_skew(amount,20))", "name": "amount_skew_compress_20", "is_ic": 0.0183, "is_ic_ir": 0.197, "is_sharpe": -1.048, "is_turnover": 0.173, "is_monotonicity": 0.8, "gates": "FAIL", "status": "reverted", "eval_seconds": 68.9, "decision": "revert", "session_branch": "main", "base_ref": "origin/main", "merge_base": "7e71edc0d50443d3db4f0dd72c25238cd7ac1282", "head_commit": "7e71edc0d50443d3db4f0dd72c25238cd7ac1282"}
{"ts": "2026-04-30T06:57:16.767201+08:00", "session_id": "20260430_060001_1eb756", "market": "cn", "formula": "rank(-ts_corr(ret_1d,shift(ret_1d,1),20))*rank(ts_min(ts_sum(turnover_rate,5),20)/ts_max(ts_sum(turnover_rate,5),20))", "name": "anti_autocorr_weekly_turnover_corridor_20", "is_ic": 0.0379, "is_ic_ir": 0.454, "is_sharpe": 3.641, "is_turnover": 0.162, "is_monotonicity": 0.5, "gates": "PASS", "status": "candidate", "eval_seconds": 112.3, "decision": "candidate", "session_branch": "main", "base_ref": "origin/main", "merge_base": "7e71edc0d50443d3db4f0dd72c25238cd7ac1282", "head_commit": "7e71edc0d50443d3db4f0dd72c25238cd7ac1282"}
{"ts": "2026-04-30T06:57:16.767201+08:00", "session_id": "20260430_060001_1eb756", "market": "cn", "formula": "rank(-ts_corr(ret_1d, shift(ret_1d, 1), 20)) * rank(ts_mean(ts_sum(amount, 5), 20) / ts_max(ts_sum(amount, 5), 20))", "name": "anti_autocorr_weekly_amount_evenness_20", "is_ic": 0.0367, "is_ic_ir": 0.473, "is_sharpe": 3.934, "is_turnover": 0.167, "is_monotonicity": 0.35, "gates": "PASS", "status": "candidate", "eval_seconds": 139.6, "decision": "candidate", "session_branch": "main", "base_ref": "origin/main", "merge_base": "7e71edc0d50443d3db4f0dd72c25238cd7ac1282", "head_commit": "7e71edc0d50443d3db4f0dd72c25238cd7ac1282"}
{"ts": "2026-04-30T06:57:16.767201+08:00", "session_id": "20260430_060001_1eb756", "market": "cn", "formula": "rank(-ts_corr(ret_1d,shift(ret_1d,1),20))*rank(ts_mean(ts_sum(amount/circ_market_cap,5),20)/ts_max(ts_sum(amount/circ_market_cap,5),20))", "name": "anti_autocorr_weekly_float_evenness_20", "is_ic": 0.0372, "is_ic_ir": 0.479, "is_sharpe": 3.218, "is_turnover": 0.171, "is_monotonicity": 0.45, "gates": "PASS", "status": "candidate", "eval_seconds": 89.7, "decision": "candidate", "session_branch": "main", "base_ref": "origin/main", "merge_base": "7e71edc0d50443d3db4f0dd72c25238cd7ac1282", "head_commit": "7e71edc0d50443d3db4f0dd72c25238cd7ac1282"}
{"ts": "2026-04-30T06:57:16.767201+08:00", "session_id": "20260430_060001_1eb756", "market": "cn", "formula": "rank(-ts_corr(ret_1d,shift(ret_1d,1),20))*rank(-ts_std(ts_mean(volume_ratio,5),20)/ts_mean(ts_mean(volume_ratio,5),20))", "name": "anti_autocorr_weekly_relvol_stability_20", "is_ic": 0.035, "is_ic_ir": 0.445, "is_sharpe": 3.792, "is_turnover": 0.147, "is_monotonicity": 0.3, "gates": "PASS", "status": "candidate", "eval_seconds": 172.0, "decision": "candidate", "session_branch": "main", "base_ref": "origin/main", "merge_base": "7e71edc0d50443d3db4f0dd72c25238cd7ac1282", "head_commit": "7e71edc0d50443d3db4f0dd72c25238cd7ac1282"}
{"ts": "2026-04-30T06:57:16.767201+08:00", "session_id": "20260430_060001_1eb756", "market": "cn", "formula": "rank(-ts_corr(ret_1d,shift(ret_1d,1),40))*rank(-ts_std(ts_sum(turnover_rate,5),20)/ts_mean(ts_sum(turnover_rate,5),20))", "name": "anti_autocorr40_weekly_turnover_stability", "is_ic": 0.0271, "is_ic_ir": 0.285, "is_sharpe": 2.32, "is_turnover": 0.119, "is_monotonicity": 0.7, "gates": "PASS", "status": "candidate", "eval_seconds": 113.4, "decision": "candidate", "session_branch": "main", "base_ref": "origin/main", "merge_base": "7e71edc0d50443d3db4f0dd72c25238cd7ac1282", "head_commit": "7e71edc0d50443d3db4f0dd72c25238cd7ac1282"}
{"ts": "2026-04-30T06:57:16.767201+08:00", "session_id": "20260430_060001_1eb756", "market": "cn", "formula": "rank(-ts_corr(turnover_rate, ret_5d, 20)) * rank(ts_mean(amount, 5) / ts_std(amount, 20))", "name": "turnover_pullback_absorption_20", "is_ic": 0.0352, "is_ic_ir": 0.239, "is_sharpe": 0.114, "is_turnover": 0.152, "is_monotonicity": 0.05, "gates": "PASS", "status": "candidate", "eval_seconds": 68.1, "decision": "candidate", "session_branch": "main", "base_ref": "origin/main", "merge_base": "7e71edc0d50443d3db4f0dd72c25238cd7ac1282", "head_commit": "7e71edc0d50443d3db4f0dd72c25238cd7ac1282"}
{"ts": "2026-04-30T06:57:16.767201+08:00", "session_id": "20260430_060001_1eb756", "market": "cn", "formula": "rank(-ts_corr(ret_1d,shift(ret_1d,1),40))*rank(-ts_std(ts_sum(amount,5),20)/ts_std(ts_sum(amount,5),60))", "name": "anti_autocorr_weekly_amount_compress_20_60", "is_ic": 0.0198, "is_ic_ir": 0.143, "is_sharpe": 1.147, "is_turnover": 0.118, "is_monotonicity": 0.9, "gates": "FAIL", "status": "reverted", "eval_seconds": 136.4, "decision": "revert", "session_branch": "main", "base_ref": "origin/main", "merge_base": "7e71edc0d50443d3db4f0dd72c25238cd7ac1282", "head_commit": "7e71edc0d50443d3db4f0dd72c25238cd7ac1282"}
{"ts": "2026-04-30T06:57:16.767201+08:00", "session_id": "20260430_060001_1eb756", "market": "cn", "formula": "rank(ts_mean(amount, 20) / ts_std(amount, 20)) * rank(-abs(ret_5d))", "name": "amount_stability_pullback_20", "is_ic": 0.0491, "is_ic_ir": 0.365, "is_sharpe": -1.358, "is_turnover": 0.334, "is_monotonicity": 0.25, "gates": "PASS", "status": "checks_failed", "eval_seconds": 20.7, "decision": "revert", "session_branch": "main", "base_ref": "origin/main", "merge_base": "7e71edc0d50443d3db4f0dd72c25238cd7ac1282", "head_commit": "7e71edc0d50443d3db4f0dd72c25238cd7ac1282", "oos": "PASS", "checks_status": "failed"}
{"ts": "2026-04-30T06:57:16.767201+08:00", "session_id": "20260430_060001_1eb756", "market": "cn", "formula": "rank(-ts_corr(ret_1d,shift(ret_1d,1),20))*rank(ts_mean(ts_sum(volume_ratio,5),20)/ts_max(ts_sum(volume_ratio,5),20))", "name": "anti_autocorr_weekly_relvol_evenness_20", "is_ic": 0.0362, "is_ic_ir": 0.466, "is_sharpe": 2.861, "is_turnover": 0.162, "is_monotonicity": 0.3, "gates": "PASS", "status": "candidate", "eval_seconds": 112.9, "decision": "candidate", "session_branch": "main", "base_ref": "origin/main", "merge_base": "7e71edc0d50443d3db4f0dd72c25238cd7ac1282", "head_commit": "7e71edc0d50443d3db4f0dd72c25238cd7ac1282"}
{"ts": "2026-04-30T06:57:16.767201+08:00", "session_id": "20260430_060001_1eb756", "market": "cn", "formula": "rank(-ts_corr(ret_1d,shift(ret_1d,1),20))*rank(-ts_std(ts_sum(amount,5),20)/ts_mean(ts_sum(amount,5),20))", "name": "anti_autocorr_weekly_amount_level_stability_20", "is_ic": 0.0345, "is_ic_ir": 0.431, "is_sharpe": 3.463, "is_turnover": 0.15, "is_monotonicity": 0.25, "gates": "PASS", "status": "candidate", "eval_seconds": 136.8, "decision": "candidate", "session_branch": "main", "base_ref": "origin/main", "merge_base": "7e71edc0d50443d3db4f0dd72c25238cd7ac1282", "head_commit": "7e71edc0d50443d3db4f0dd72c25238cd7ac1282"}
