{"ts": "2026-05-08T06:55:28.203414+08:00", "session_id": "20260508_060002_187722", "market": "cn", "formula": "rank(-ts_kurt(turnover_rate, 20))", "name": "turnover_kurtosis_quiet_20", "is_ic": 0.0062, "is_ic_ir": 0.079, "is_sharpe": -2.28, "is_turnover": 0.184, "is_monotonicity": 0.45, "gates": "FAIL", "status": "reverted", "eval_seconds": 93.8, "sleeve_id": "daily_flow_stability", "mispricing_source": "episodic attention and speculative churn create temporary over-ownership in spiky-turnover names, while quiet-holder names underreact and reprice gradually", "forced_counterparty": "short-horizon retail punters and liquidity-seeking benchmarked funds that crowd into high-attention names and neglect quiet ones", "data_requirements": "`[\"turnover_rate\"]`", "failure_mode": "fails in retail-mania or breakout regimes where turnover spikes reflect persistent information leadership rather than temporary crowding", "report_contract": "fresh_buy_gate", "money_readiness": "money_candidate", "decision": "revert", "session_branch": "main", "base_ref": "origin/main", "merge_base": "7e986da0e351c2b41b5c9cb4f629494d55e1981c", "head_commit": "7e986da0e351c2b41b5c9cb4f629494d55e1981c"}
{"ts": "2026-05-08T06:55:28.203414+08:00", "session_id": "20260508_060002_187722", "market": "cn", "formula": "rank(ts_std(delta(turnover_rate,5),60)/ts_std(delta(turnover_rate,5),20))*rank(-log(circ_market_cap))", "name": "smallfloat_turnshock_compress_20_60", "is_ic": 0.0352, "is_ic_ir": 0.21, "is_sharpe": 2.647, "is_turnover": 0.071, "is_monotonicity": 0.55, "gates": "PASS", "status": "candidate", "eval_seconds": 142.4, "sleeve_id": "float_supply_lockup", "mispricing_source": "Underreaction to post-churn float lock-up; retail attention fades after noisy turnover episodes, but the supply/demand improvement persists into the 10-20 day horizon.", "forced_counterparty": "Retail churners, fund-redemption sellers, and benchmark/rebalance-driven sellers who must supply stock during consolidation regardless of near-term alpha.", "data_requirements": "[\"turnover_rate\",\"circ_market_cap\"]", "failure_mode": "Fails when turnover compression reflects dead liquidity or broad small-cap de-risking rather than genuine strong-hand absorption.", "report_contract": "fresh_buy_gate", "money_readiness": "money_candidate", "decision": "candidate", "session_branch": "main", "base_ref": "origin/main", "merge_base": "7e986da0e351c2b41b5c9cb4f629494d55e1981c", "head_commit": "7e986da0e351c2b41b5c9cb4f629494d55e1981c"}
{"ts": "2026-05-08T06:55:28.203414+08:00", "session_id": "20260508_060002_187722", "market": "cn", "formula": "rank(-ts_corr(delta(volume_ratio,5),shift(delta(volume_ratio,5),5),20))", "name": "anti_autocorr_weekly_relvol_change_20", "is_ic": -0.0105, "is_ic_ir": -0.113, "is_sharpe": -5.947, "is_turnover": 0.192, "is_monotonicity": -0.4, "gates": "FAIL", "status": "reverted", "eval_seconds": 169.7, "sleeve_id": "weekly_participation_decay", "mispricing_source": "Retail attention overshoots create bursty abnormal-volume paths; negative weekly autocorrelation in those shocks is a participation-path signal, not a simple price-trend clone.", "forced_counterparty": "short-horizon retail flow chasers and liquidity-sensitive managers who only add after persistent volume confirmation", "data_requirements": "[\"volume_ratio\"]", "failure_mode": "This should stop working in persistent speculation regimes where positive attention autocorrelation is rewarded and volume bursts keep compounding instead of mean-reverting.", "report_contract": "fresh_buy_gate", "money_readiness": "money_candidate", "decision": "revert", "session_branch": "main", "base_ref": "origin/main", "merge_base": "7e986da0e351c2b41b5c9cb4f629494d55e1981c", "head_commit": "7e986da0e351c2b41b5c9cb4f629494d55e1981c"}
{"ts": "2026-05-08T06:55:28.203414+08:00", "session_id": "20260508_060002_187722", "market": "cn", "formula": "rank(-ts_std(pct_change(amount,5),20)/ts_std(pct_change(amount,5),60))*rank(ts_min(turnover_rate,20)/ts_mean(turnover_rate,20))", "name": "amtchg_turnfloor_compress_20_60", "is_ic": 0.0284, "is_ic_ir": 0.285, "is_sharpe": -0.6, "is_turnover": 0.13, "is_monotonicity": 0.45, "gates": "PASS", "status": "candidate", "eval_seconds": 213.6, "sleeve_id": "flow_absorption_weekly", "mispricing_source": "Slow repricing after liquidity-shock absorption; the signal comes from flow-path compression plus a persistent participation floor, not from a recycled price-momentum variant.", "forced_counterparty": "Retail churners and redemption-driven funds that sell or withdraw liquidity once excitement fades, leaving patient accumulators to absorb supply gradually.", "data_requirements": "[\"amount\",\"turnover_rate\"]", "failure_mode": "Fails when lower flow volatility reflects true information vacuum or policy-induced trading suppression rather than absorbed supply, or when headline momentum makes price react immediately to flow.", "report_contract": "fresh_buy_gate", "money_readiness": "money_candidate", "decision": "candidate", "session_branch": "main", "base_ref": "origin/main", "merge_base": "7e986da0e351c2b41b5c9cb4f629494d55e1981c", "head_commit": "7e986da0e351c2b41b5c9cb4f629494d55e1981c"}
{"ts": "2026-05-08T14:57:39.897050+08:00", "session_id": "20260508_140002_cb715f", "market": "cn", "formula": "rank(-ts_corr(ret_1d,shift(ret_1d,1),20))*rank(-ts_std(pct_change(amount,5),20))", "name": "anti_autocorr_weekly_amount_change_stability_20", "is_ic": 0.0415, "is_ic_ir": 0.449, "is_sharpe": 2.573, "is_turnover": 0.153, "is_monotonicity": 0.15, "gates": "PASS", "status": "checks_failed", "eval_seconds": 176.7, "sleeve_id": "anti_autocorr_flow_evenness", "mispricing_source": "Underreaction to stealth accumulation; the market overpays for attention spikes and underprices names where supply is being absorbed through smooth weekly cash-flow paths.", "forced_counterparty": "retail momentum traders and redemption/benchmark-constrained mutual funds", "data_requirements": "[\"ret_1d\",\"amount\"]", "failure_mode": "Fails when one-way policy/liquidity regimes dominate the cross-section, or when smooth-flow/low-lottery names become crowded and the anti-autocorr signal stops representing real absorption.", "report_contract": "fresh_buy_gate", "money_readiness": "money_candidate", "decision": "revert", "session_branch": "main", "base_ref": "origin/main", "merge_base": "62e27b1718a9c8c7cee619126770fe57cd98d173", "head_commit": "62e27b1718a9c8c7cee619126770fe57cd98d173", "oos": "PASS", "checks_status": "failed"}
{"ts": "2026-05-08T14:57:39.897050+08:00", "session_id": "20260508_140002_cb715f", "market": "cn", "formula": "rank(ts_kurt(turnover_rate,20)) * rank(ts_mean(turnover_rate,20))", "name": "crowded_turnover_kurtosis_20", "is_ic": 0.0215, "is_ic_ir": 0.165, "is_sharpe": -0.897, "is_turnover": 0.131, "is_monotonicity": 0.0, "gates": "FAIL", "status": "reverted", "eval_seconds": 73.9, "sleeve_id": "attention_unwind", "mispricing_source": "Retail-attention crowding and limited arbitrage; this is a participation-distribution signal, not a close-price momentum variant.", "forced_counterparty": "retail momentum traders and thematic funds that chase active names", "data_requirements": "[\"turnover_rate\"]", "failure_mode": "speculative or policy-driven melt-up regimes where crowded high-turnover names keep attracting flow instead of mean-reverting", "report_contract": "fresh_buy_gate", "money_readiness": "money_candidate", "decision": "revert", "session_branch": "main", "base_ref": "origin/main", "merge_base": "62e27b1718a9c8c7cee619126770fe57cd98d173", "head_commit": "62e27b1718a9c8c7cee619126770fe57cd98d173"}
{"ts": "2026-05-08T14:57:39.897050+08:00", "session_id": "20260508_140002_cb715f", "market": "cn", "formula": "rank(-ts_std(turnover_rate,20)/ts_mean(turnover_rate,20))*rank(ts_mean(volume_ratio,20)/ts_max(volume_ratio,20))", "name": "steady_turnover_relvol_evenness_20", "is_ic": 0.0335, "is_ic_ir": 0.342, "is_sharpe": 1.123, "is_turnover": 0.121, "is_monotonicity": 0.35, "gates": "PASS", "status": "candidate", "eval_seconds": 223.3, "sleeve_id": "daily_flow_evenness", "mispricing_source": "Slow underreaction to quiet ownership transfer; this uses the time-shape of participation in `turnover_rate` and `volume_ratio`, so it is not just another price-momentum, reversal, or close-volume-correlation factor.", "forced_counterparty": "Retail attention chasers and benchmark/rebalance or redemption-driven funds trading for mandate/liquidity reasons rather than medium-horizon alpha.", "data_requirements": "[\"turnover_rate\",\"volume_ratio\"]", "failure_mode": "It should weaken in speculative theme or policy-chasing regimes where spiky attention is genuinely informative, or when smooth turnover mainly reflects stagnant illiquidity rather than accumulation.", "report_contract": "fresh_buy_gate", "money_readiness": "money_candidate", "decision": "candidate", "session_branch": "main", "base_ref": "origin/main", "merge_base": "62e27b1718a9c8c7cee619126770fe57cd98d173", "head_commit": "62e27b1718a9c8c7cee619126770fe57cd98d173"}
{"ts": "2026-05-08T14:57:39.897050+08:00", "session_id": "20260508_140002_cb715f", "market": "cn", "formula": "rank(ts_std(delta(turnover_rate,5),60)/ts_std(delta(turnover_rate,5),20))*rank(ts_min(turnover_rate,20)/ts_max(turnover_rate,20))", "name": "weekly_turnshock_floor_compress_20_60", "is_ic": 0.0241, "is_ic_ir": 0.26, "is_sharpe": 0.358, "is_turnover": 0.117, "is_monotonicity": 0.4, "gates": "PASS", "status": "candidate", "eval_seconds": 207.9, "sleeve_id": "daily_flow_absorption", "mispricing_source": "Investors price visible price bursts faster than quieter turnover normalization; post-churn supply clearing with a stable participation floor gets incorporated slowly.", "forced_counterparty": "Retail attention traders exiting after bursty turnover episodes, plus benchmarked institutions and liquidity-motivated sellers who must trade gradually rather than wait for a cleaner tape.", "data_requirements": "[\"turnover_rate\"]", "failure_mode": "It should fail in speculative chase or liquidity-drought regimes, when turnover compression means dead liquidity or crowding rather than strong-hand absorption.", "report_contract": "fresh_buy_gate", "money_readiness": "money_candidate", "decision": "candidate", "session_branch": "main", "base_ref": "origin/main", "merge_base": "62e27b1718a9c8c7cee619126770fe57cd98d173", "head_commit": "62e27b1718a9c8c7cee619126770fe57cd98d173"}
{"ts": "2026-05-08T14:57:39.897050+08:00", "session_id": "20260508_140002_cb715f", "market": "cn", "formula": "rank(-ts_corr(ret_1d,shift(ret_1d,1),20))*rank(ts_mean(turnover_rate,20)/ts_max(turnover_rate,20))", "name": "anti_autocorr_turnover_evenness_20", "is_ic": 0.0341, "is_ic_ir": 0.458, "is_sharpe": 2.258, "is_turnover": 0.174, "is_monotonicity": 0.25, "gates": "PASS", "status": "candidate", "eval_seconds": 122.2, "sleeve_id": "daily_flow_underreaction", "mispricing_source": "Temporary liquidity imbalances from retail chasing and flow-constrained sellers get absorbed gradually by patient capital, leaving a 10-20 day underreaction payoff.", "forced_counterparty": "retail day traders and benchmarked/redemption-driven mutual funds", "data_requirements": "[\"ret_1d\",\"turnover_rate\"]", "failure_mode": "It should weaken in strong trend-chasing regimes where return autocorrelation turns positive, or when turnover evenness reflects broad passive crowding instead of quiet accumulation.", "report_contract": "fresh_buy_gate", "money_readiness": "money_candidate", "decision": "candidate", "session_branch": "main", "base_ref": "origin/main", "merge_base": "62e27b1718a9c8c7cee619126770fe57cd98d173", "head_commit": "62e27b1718a9c8c7cee619126770fe57cd98d173"}
{"ts": "2026-05-08T14:57:39.897050+08:00", "session_id": "20260508_140002_cb715f", "market": "cn", "formula": "rank(-ts_std(pct_change(amount/circ_market_cap,5),20))*rank(-ts_std(close/open-1,20))", "name": "weekly_floatchg_body_stability_20", "is_ic": 0.0422, "is_ic_ir": 0.268, "is_sharpe": 0.178, "is_turnover": 0.093, "is_monotonicity": -0.05, "gates": "PASS", "status": "checks_failed", "eval_seconds": 163.2, "sleeve_id": "float_flow_absorption", "mispricing_source": "Underreaction to patient float-normalized accumulation hidden inside quiet daily price discovery; this is flow-path quality, not a high-correlation close-volume or pure price-trend clone.", "forced_counterparty": "retail swing traders and benchmark-constrained/rebalance funds that must trade inventory gradually rather than for alpha timing", "data_requirements": "[\"amount\",\"circ_market_cap\",\"open\",\"close\"]", "failure_mode": "Breaks in theme-chasing or policy-shock regimes where bursty flow and wide candle bodies carry genuine information, or when quiet float turnover is mostly illiquidity rather than accumulation.", "report_contract": "research_only", "money_readiness": "research_only", "decision": "revert", "session_branch": "main", "base_ref": "origin/main", "merge_base": "62e27b1718a9c8c7cee619126770fe57cd98d173", "head_commit": "62e27b1718a9c8c7cee619126770fe57cd98d173", "oos": "PASS", "checks_status": "failed"}
{"ts": "2026-05-08T14:57:39.897050+08:00", "session_id": "20260508_140002_cb715f", "market": "cn", "formula": "rank(-ts_std(delta(amount/circ_market_cap,5),20))", "name": "weekly_float_flow_stability_20", "is_ic": 0.0253, "is_ic_ir": 0.151, "is_sharpe": -0.58, "is_turnover": 0.042, "is_monotonicity": -0.05, "gates": "FAIL", "status": "reverted", "eval_seconds": 216.1, "sleeve_id": "holder_migration_flow", "mispricing_source": "Slow free-float ownership migration is not fully priced immediately; this is a flow-absorption signal, not a high-correlation variant of a pure price factor.", "forced_counterparty": "Redemption-driven mutual funds, benchmark rebalancers, and other liquidity-motivated sellers who must distribute stock over days rather than optimize timing.", "data_requirements": "[\"amount\",\"circ_market_cap\"]", "failure_mode": "It weakens in speculative tapes where bursty high-turnover names are rewarded, or around unlock/refinancing episodes that mechanically distort float-adjusted flow.", "report_contract": "fresh_buy_gate", "money_readiness": "money_candidate", "decision": "revert", "session_branch": "main", "base_ref": "origin/main", "merge_base": "62e27b1718a9c8c7cee619126770fe57cd98d173", "head_commit": "62e27b1718a9c8c7cee619126770fe57cd98d173"}
{"ts": "2026-05-08T14:57:39.897050+08:00", "session_id": "20260508_140002_cb715f", "market": "cn", "formula": "rank(-ps_ttm) * rank(-ts_std(volume_ratio,20))", "name": "quiet_value_relvol_stability_20", "is_ic": 0.0146, "is_ic_ir": 0.096, "is_sharpe": -1.845, "is_turnover": 0.073, "is_monotonicity": -0.2, "gates": "FAIL", "status": "reverted", "eval_seconds": 143.2, "sleeve_id": "value_attention_slowflow", "mispricing_source": "Retail/speculative capital overpays for noisy attention names, while cheap names with calm participation get underreacted and reprice only gradually.", "forced_counterparty": "Retail theme traders and benchmark-constrained long-only funds that avoid quiet low-multiple names for career-risk/liquidity reasons", "data_requirements": "[\"ps_ttm\",\"volume_ratio\"] with 20-day history", "failure_mode": "Fails in speculative melt-up regimes where expensive high-attention names stay bid, or when low sales multiples reflect true fundamental impairment instead of neglect", "report_contract": "fresh_buy_gate", "money_readiness": "money_candidate", "decision": "revert", "session_branch": "main", "base_ref": "origin/main", "merge_base": "62e27b1718a9c8c7cee619126770fe57cd98d173", "head_commit": "62e27b1718a9c8c7cee619126770fe57cd98d173"}
{"ts": "2026-05-08T14:57:39.897050+08:00", "session_id": "20260508_140002_cb715f", "market": "cn", "formula": "rank(-ts_corr(ret_1d,shift(ret_1d,1),20))*rank(-ts_std(pct_change(volume,5),20))", "name": "anti_autocorr_weekly_volume_change_stability_20", "is_ic": 0.0411, "is_ic_ir": 0.468, "is_sharpe": 3.149, "is_turnover": 0.153, "is_monotonicity": 0.1, "gates": "PASS", "status": "candidate", "eval_seconds": 177.5, "sleeve_id": "weekly_share_flow_absorption", "mispricing_source": "Retail attention overreacts to daily tape noise, while institutions must slice orders across days; this uses the time-shape of share-turnover changes, so it is not just another close-volume correlation or plain reversal factor.", "forced_counterparty": "retail attention traders and benchmark/rebalance or redemption-constrained long-only funds trading for liquidity rather than medium-horizon alpha", "data_requirements": "[\"ret_1d\",\"volume\"]; intraday order-flow or member-level trade ledger is still needed before money-ready deployment to verify true absorption vs passive or index-driven volume.", "failure_mode": "Fails in breakout or policy-driven regimes where returns turn positively autocorrelated and bursty weekly volume growth is genuinely informed rather than temporary churn.", "report_contract": "research_only", "money_readiness": "research_only", "decision": "candidate", "session_branch": "main", "base_ref": "origin/main", "merge_base": "62e27b1718a9c8c7cee619126770fe57cd98d173", "head_commit": "62e27b1718a9c8c7cee619126770fe57cd98d173"}
{"ts": "2026-05-08T14:57:39.897050+08:00", "session_id": "20260508_140002_cb715f", "market": "cn", "formula": "rank(ts_corr(delta(volume_ratio,5),shift(delta(volume_ratio,5),5),20))*rank(ts_max(volume_ratio,20)/(ts_mean(volume_ratio,20)+0.01))", "name": "weekly_relvol_fragility_20", "is_ic": 0.0122, "is_ic_ir": 0.142, "is_sharpe": -3.77, "is_turnover": 0.187, "is_monotonicity": 0.2, "gates": "FAIL", "status": "reverted", "eval_seconds": 198.1, "sleeve_id": "attention_crowding_short", "mispricing_source": "The market over-interprets persistent abnormal participation as information; in reality it is often retail attention and liquidity preference chasing the same liquid stories.", "forced_counterparty": "retail attention chasers and benchmark-constrained managers who must rotate into liquid headline names after repeated volume confirmation", "data_requirements": "[\"daily volume_ratio history >= 25d\"]", "failure_mode": "Fails in broad speculative or policy-driven momentum regimes where repeated high-relvol bursts are genuinely informative and keep attracting incremental buyers.", "report_contract": "fresh_buy_gate", "money_readiness": "money_candidate", "decision": "revert", "session_branch": "main", "base_ref": "origin/main", "merge_base": "62e27b1718a9c8c7cee619126770fe57cd98d173", "head_commit": "62e27b1718a9c8c7cee619126770fe57cd98d173"}
{"ts": "2026-05-08T14:57:39.897050+08:00", "session_id": "20260508_140002_cb715f", "market": "cn", "formula": "rank(-ts_corr(ret_1d,shift(ret_1d,1),20))*rank(ts_mean(ts_sum(volume,5),20)/ts_max(ts_sum(volume,5),20))", "name": "anti_autocorr_weekly_volume_evenness_20", "is_ic": 0.0377, "is_ic_ir": 0.493, "is_sharpe": 3.282, "is_turnover": 0.17, "is_monotonicity": 0.45, "gates": "PASS", "status": "candidate", "eval_seconds": 86.3, "sleeve_id": "anti_autocorr_share_flow_evenness", "mispricing_source": "Underreaction to quiet share-flow sponsorship; this is a weekly participation-shape plus tape-mean-reversion signal, not a reuse of price-volume correlation like `vpcorr_5` or `d2_10_513`.", "forced_counterparty": "retail attention traders, benchmark/rebalance sellers, and redemption-driven funds trading for liquidity or mandate reasons rather than medium-horizon alpha", "data_requirements": "[\"ret_1d\",\"volume\"]; intraday order-flow or member-level trade ledger is still needed before money-ready deployment to distinguish true accumulation from smooth distribution", "failure_mode": "Fails in strong trend/chasing regimes where bursty volume is genuinely informative and short-horizon return autocorrelation turns positive, or when smooth volume mainly reflects dead liquidity", "report_contract": "setup_overlay", "money_readiness": "research_only", "decision": "candidate", "session_branch": "main", "base_ref": "origin/main", "merge_base": "62e27b1718a9c8c7cee619126770fe57cd98d173", "head_commit": "62e27b1718a9c8c7cee619126770fe57cd98d173"}
{"ts": "2026-05-08T14:57:39.897050+08:00", "session_id": "20260508_140002_cb715f", "market": "cn", "formula": "rank(ts_mean(ts_sum(volume,5),20)/ts_max(ts_sum(volume,5),20))*rank(ts_std(delta(turnover_rate,5),60)/ts_std(delta(turnover_rate,5),20))", "name": "weekly_volume_evenness_turnshock_compress_20_60", "is_ic": 0.0217, "is_ic_ir": 0.243, "is_sharpe": 0.524, "is_turnover": 0.114, "is_monotonicity": 0.1, "gates": "PASS", "status": "candidate", "eval_seconds": 216.6, "sleeve_id": "weekly_flow_absorption", "mispricing_source": "Slow post-churn supply absorption and gradual ownership transfer; this is a participation-shape signal using only flow-path structure, not a high-correlation variant of the existing price-volume correlation factors.", "forced_counterparty": "retail attention-chasers and benchmark/redemption-driven funds that trade in bursts for mandate or liquidity reasons rather than medium-horizon alpha", "data_requirements": "[\"volume\",\"turnover_rate\"]; intraday order-flow or broker/member trade ledger is still needed before money-ready deployment to separate true accumulation from stagnant illiquidity", "failure_mode": "Fails in policy/speculative chase regimes where bursty high-turnover leaders keep winning, or when smooth volume simply reflects dead liquidity instead of absorbed supply.", "report_contract": "setup_overlay", "money_readiness": "research_only", "decision": "candidate", "session_branch": "main", "base_ref": "origin/main", "merge_base": "62e27b1718a9c8c7cee619126770fe57cd98d173", "head_commit": "62e27b1718a9c8c7cee619126770fe57cd98d173"}
