{"ts": "2026-05-06T06:57:52.927825+08:00", "session_id": "20260506_060002_3a2ce6", "market": "cn", "formula": "rank(-ts_corr(ret_1d,shift(ret_1d,1),20))*rank(ts_min(ts_sum(turnover_rate,5),20)/ts_std(ts_sum(turnover_rate,5),20))", "name": "anti_autocorr_weekly_turnover_floorstd_20", "is_ic": 0.0367, "is_ic_ir": 0.441, "is_sharpe": 4.149, "is_turnover": 0.151, "is_monotonicity": 0.6, "gates": "PASS", "status": "candidate", "eval_seconds": 123.1, "decision": "candidate", "session_branch": "main", "base_ref": "origin/main", "merge_base": "0f85d5996390cb003536dacf895618eda74b9333", "head_commit": "0f85d5996390cb003536dacf895618eda74b9333"}
{"ts": "2026-05-06T06:57:52.927825+08:00", "session_id": "20260506_060002_3a2ce6", "market": "cn", "formula": "rank(-ts_corr(ret_1d,shift(ret_1d,1),20))*rank(ts_min(ts_sum(volume_ratio,5),20)/ts_std(ts_sum(volume_ratio,5),20))", "name": "anti_autocorr_weekly_relvol_floorstd_20", "is_ic": 0.0357, "is_ic_ir": 0.442, "is_sharpe": 3.553, "is_turnover": 0.15, "is_monotonicity": 0.15, "gates": "PASS", "status": "candidate", "eval_seconds": 118.0, "decision": "candidate", "session_branch": "main", "base_ref": "origin/main", "merge_base": "0f85d5996390cb003536dacf895618eda74b9333", "head_commit": "0f85d5996390cb003536dacf895618eda74b9333"}
{"ts": "2026-05-06T06:57:52.927825+08:00", "session_id": "20260506_060002_3a2ce6", "market": "cn", "formula": "rank(-ts_corr(ret_1d,shift(ret_1d,1),20))*rank(ts_min(ts_sum(amount/market_cap,5),20)/ts_max(ts_sum(amount/market_cap,5),20))", "name": "anti_autocorr_weekly_mcapflow_corridor_20", "is_ic": 0.0384, "is_ic_ir": 0.456, "is_sharpe": 3.503, "is_turnover": 0.161, "is_monotonicity": 0.5, "gates": "PASS", "status": "candidate", "eval_seconds": 167.5, "decision": "candidate", "session_branch": "main", "base_ref": "origin/main", "merge_base": "0f85d5996390cb003536dacf895618eda74b9333", "head_commit": "0f85d5996390cb003536dacf895618eda74b9333"}
{"ts": "2026-05-06T06:57:52.927825+08:00", "session_id": "20260506_060002_3a2ce6", "market": "cn", "formula": "rank(-ret_20d)*rank(ts_min(amount,5)/ts_std(amount,20))", "name": "quiet_reversal_amount_floor", "is_ic": 0.0341, "is_ic_ir": 0.244, "is_sharpe": -1.492, "is_turnover": 0.193, "is_monotonicity": -0.05, "gates": "PASS", "status": "candidate", "eval_seconds": 58.5, "decision": "candidate", "session_branch": "main", "base_ref": "origin/main", "merge_base": "0f85d5996390cb003536dacf895618eda74b9333", "head_commit": "0f85d5996390cb003536dacf895618eda74b9333"}
{"ts": "2026-05-06T06:57:52.927825+08:00", "session_id": "20260506_060002_3a2ce6", "market": "cn", "formula": "rank(-ps_ttm) * rank(-ts_corr(ret_1d, shift(ret_1d, 1), 20))", "name": "anti_autocorr_low_ps_20", "is_ic": 0.008, "is_ic_ir": 0.078, "is_sharpe": -1.525, "is_turnover": 0.127, "is_monotonicity": -0.05, "gates": "FAIL", "status": "reverted", "eval_seconds": 132.1, "decision": "revert", "session_branch": "main", "base_ref": "origin/main", "merge_base": "0f85d5996390cb003536dacf895618eda74b9333", "head_commit": "0f85d5996390cb003536dacf895618eda74b9333"}
{"ts": "2026-05-06T06:57:52.927825+08:00", "session_id": "20260506_060002_3a2ce6", "market": "cn", "formula": "rank(-ts_corr(ret_1d,shift(ret_1d,1),20))*rank(ts_min(ts_sum(amount/circ_market_cap,5),20)/ts_std(ts_sum(amount/circ_market_cap,5),20))", "name": "anti_autocorr_weekly_float_support_20", "is_ic": 0.0367, "is_ic_ir": 0.44, "is_sharpe": 3.947, "is_turnover": 0.151, "is_monotonicity": 0.6, "gates": "PASS", "status": "candidate", "eval_seconds": 114.5, "decision": "candidate", "session_branch": "main", "base_ref": "origin/main", "merge_base": "0f85d5996390cb003536dacf895618eda74b9333", "head_commit": "0f85d5996390cb003536dacf895618eda74b9333"}
{"ts": "2026-05-06T06:57:52.927825+08:00", "session_id": "20260506_060002_3a2ce6", "market": "cn", "formula": "rank(-ts_corr(turnover_rate,shift(turnover_rate,5),20))*rank(ts_min(amount,20)/ts_std(amount,20))", "name": "anti_autocorr_weekly_turnover_amount_floorstd_20", "is_ic": 0.0172, "is_ic_ir": 0.161, "is_sharpe": -0.484, "is_turnover": 0.157, "is_monotonicity": 0.25, "gates": "FAIL", "status": "reverted", "eval_seconds": 94.8, "decision": "revert", "session_branch": "main", "base_ref": "origin/main", "merge_base": "0f85d5996390cb003536dacf895618eda74b9333", "head_commit": "0f85d5996390cb003536dacf895618eda74b9333"}
{"ts": "2026-05-06T06:57:52.927825+08:00", "session_id": "20260506_060002_3a2ce6", "market": "cn", "formula": "rank(-ts_corr(ret_1d,shift(ret_1d,1),20))*rank(-ts_std(pct_change(amount,5),20))", "name": "anti_autocorr_weekly_amount_change_stability_20", "is_ic": 0.0415, "is_ic_ir": 0.449, "is_sharpe": 2.573, "is_turnover": 0.153, "is_monotonicity": 0.15, "gates": "PASS", "status": "checks_failed", "eval_seconds": 175.6, "decision": "revert", "session_branch": "main", "base_ref": "origin/main", "merge_base": "0f85d5996390cb003536dacf895618eda74b9333", "head_commit": "0f85d5996390cb003536dacf895618eda74b9333", "oos": "PASS", "checks_status": "failed"}
{"ts": "2026-05-06T06:57:52.927825+08:00", "session_id": "20260506_060002_3a2ce6", "market": "cn", "formula": "rank(-ts_corr(ret_1d,shift(ret_1d,1),20))*rank(ts_min(ts_sum(volume,5),20)/ts_std(ts_sum(volume,5),20))", "name": "anti_autocorr_weekly_volume_floorstd_20", "is_ic": 0.0381, "is_ic_ir": 0.46, "is_sharpe": 4.465, "is_turnover": 0.151, "is_monotonicity": 0.6, "gates": "PASS", "status": "candidate", "eval_seconds": 151.4, "decision": "candidate", "session_branch": "main", "base_ref": "origin/main", "merge_base": "0f85d5996390cb003536dacf895618eda74b9333", "head_commit": "0f85d5996390cb003536dacf895618eda74b9333"}
{"ts": "2026-05-06T06:57:52.927825+08:00", "session_id": "20260506_060002_3a2ce6", "market": "cn", "formula": "rank(-ts_corr(ret_1d,shift(ret_1d,1),20))*rank(ts_min(ts_sum(volume,5),20)/ts_max(ts_sum(volume,5),20))", "name": "anti_autocorr_weekly_volume_corridor_20", "is_ic": 0.0392, "is_ic_ir": 0.471, "is_sharpe": 3.76, "is_turnover": 0.162, "is_monotonicity": 0.5, "gates": "PASS", "status": "candidate", "eval_seconds": 195.6, "decision": "candidate", "session_branch": "main", "base_ref": "origin/main", "merge_base": "0f85d5996390cb003536dacf895618eda74b9333", "head_commit": "0f85d5996390cb003536dacf895618eda74b9333"}
{"ts": "2026-05-06T14:59:54.991114+08:00", "session_id": "20260506_140032_3bdad6", "market": "cn", "formula": "rank(ts_corr(ret_1d, shift(ret_1d, 1), 20)) * rank(-ts_std(turnover_rate, 20) / (ts_std(turnover_rate, 120) + 0.01))", "name": "ret_autocorr_turn_regime_20_120", "is_ic": 0.0722, "is_ic_ir": 0.452, "is_sharpe": 4.575, "is_turnover": 0.149, "is_monotonicity": 0.35, "gates": "PASS", "status": "reverted", "eval_seconds": 79.7, "decision": "revert", "session_branch": "main", "base_ref": "origin/main", "merge_base": "90cb6688b49efbeba3f4b3643ee79b390d6a916f", "head_commit": "90cb6688b49efbeba3f4b3643ee79b390d6a916f", "oos": "FAIL", "checks_status": "skipped"}
{"ts": "2026-05-06T14:59:54.991114+08:00", "session_id": "20260506_140032_3bdad6", "market": "cn", "formula": "rank(ts_corr(ret_1d,shift(ret_1d,1),20))*rank(-ts_std(pct_change(turnover_rate,5),20))", "name": "ret_autocorr_turn_growth_stability_20", "is_ic": 0.0104, "is_ic_ir": 0.09, "is_sharpe": -3.482, "is_turnover": 0.16, "is_monotonicity": -0.5, "gates": "FAIL", "status": "reverted", "eval_seconds": 188.6, "decision": "revert", "session_branch": "main", "base_ref": "origin/main", "merge_base": "90cb6688b49efbeba3f4b3643ee79b390d6a916f", "head_commit": "90cb6688b49efbeba3f4b3643ee79b390d6a916f"}
{"ts": "2026-05-06T14:59:54.991114+08:00", "session_id": "20260506_140032_3bdad6", "market": "cn", "formula": "rank(-ts_corr(ret_1d,shift(ret_1d,1),20))*rank(-ts_std(pct_change(amount,5),20))", "name": "anti_autocorr_weekly_amount_change_stability_20", "is_ic": 0.0415, "is_ic_ir": 0.449, "is_sharpe": 2.573, "is_turnover": 0.153, "is_monotonicity": 0.15, "gates": "PASS", "status": "checks_failed", "eval_seconds": 153.4, "decision": "revert", "session_branch": "main", "base_ref": "origin/main", "merge_base": "90cb6688b49efbeba3f4b3643ee79b390d6a916f", "head_commit": "90cb6688b49efbeba3f4b3643ee79b390d6a916f", "oos": "PASS", "checks_status": "failed"}
{"ts": "2026-05-06T14:59:54.991114+08:00", "session_id": "20260506_140032_3bdad6", "market": "cn", "formula": "rank(ts_mean(amount,20)/ts_std(amount,20))*rank(-ret_5d)", "name": "amount_stability_weekly_reversal_20", "is_ic": 0.0309, "is_ic_ir": 0.198, "is_sharpe": -2.061, "is_turnover": 0.266, "is_monotonicity": 0.55, "gates": "FAIL", "status": "reverted", "eval_seconds": -12.6, "decision": "revert", "session_branch": "main", "base_ref": "origin/main", "merge_base": "90cb6688b49efbeba3f4b3643ee79b390d6a916f", "head_commit": "90cb6688b49efbeba3f4b3643ee79b390d6a916f"}
{"ts": "2026-05-06T14:59:54.991114+08:00", "session_id": "20260506_140032_3bdad6", "market": "cn", "formula": "rank(ts_mean(ts_sum(volume_ratio,5),20)/ts_max(ts_sum(volume_ratio,5),20)-ts_corr(ret_1d,shift(ret_1d,1),20))", "name": "weekly_relvol_evenness_underreaction_20", "is_ic": 0.0367, "is_ic_ir": 0.466, "is_sharpe": 4.247, "is_turnover": 0.173, "is_monotonicity": 0.15, "gates": "PASS", "status": "candidate", "eval_seconds": 152.0, "decision": "candidate", "session_branch": "main", "base_ref": "origin/main", "merge_base": "90cb6688b49efbeba3f4b3643ee79b390d6a916f", "head_commit": "90cb6688b49efbeba3f4b3643ee79b390d6a916f"}
{"ts": "2026-05-06T14:59:54.991114+08:00", "session_id": "20260506_140032_3bdad6", "market": "cn", "formula": "rank(-ts_std(turnover_rate,20) / ts_mean(turnover_rate,20))", "name": "turnover_stability_20", "is_ic": 0.0374, "is_ic_ir": 0.373, "is_sharpe": 1.522, "is_turnover": 0.121, "is_monotonicity": 0.7, "gates": "PASS", "status": "candidate", "eval_seconds": 103.1, "decision": "candidate", "session_branch": "main", "base_ref": "origin/main", "merge_base": "90cb6688b49efbeba3f4b3643ee79b390d6a916f", "head_commit": "90cb6688b49efbeba3f4b3643ee79b390d6a916f"}
{"ts": "2026-05-06T14:59:54.991114+08:00", "session_id": "20260506_140032_3bdad6", "market": "cn", "formula": "rank(ret_20d)*rank(-ts_skew(turnover_rate,20))", "name": "smooth_turn_momentum_20", "is_ic": 0.0017, "is_ic_ir": 0.012, "is_sharpe": -1.563, "is_turnover": 0.186, "is_monotonicity": 0.45, "gates": "FAIL", "status": "reverted", "eval_seconds": 119.0, "decision": "revert", "session_branch": "main", "base_ref": "origin/main", "merge_base": "90cb6688b49efbeba3f4b3643ee79b390d6a916f", "head_commit": "90cb6688b49efbeba3f4b3643ee79b390d6a916f"}
{"ts": "2026-05-06T14:59:54.991114+08:00", "session_id": "20260506_140032_3bdad6", "market": "cn", "formula": "rank(ret_5d/ts_mean(turnover_rate,20))", "name": "turnover_efficiency_5d", "is_ic": 0.009, "is_ic_ir": 0.045, "is_sharpe": -2.672, "is_turnover": 0.329, "is_monotonicity": 0.35, "gates": "FAIL", "status": "reverted", "eval_seconds": 128.3, "decision": "revert", "session_branch": "main", "base_ref": "origin/main", "merge_base": "90cb6688b49efbeba3f4b3643ee79b390d6a916f", "head_commit": "90cb6688b49efbeba3f4b3643ee79b390d6a916f"}
{"ts": "2026-05-06T14:59:54.991114+08:00", "session_id": "20260506_140032_3bdad6", "market": "cn", "formula": "rank(-ts_corr(ret_1d,shift(ret_1d,1),20))*rank(ts_min(ts_sum(amount/circ_market_cap,5),20)/ts_std(ts_sum(amount/circ_market_cap,5),20))", "name": "anti_autocorr_weekly_float_floorstd_20", "is_ic": 0.0367, "is_ic_ir": 0.44, "is_sharpe": 3.947, "is_turnover": 0.151, "is_monotonicity": 0.6, "gates": "PASS", "status": "candidate", "eval_seconds": 108.7, "decision": "candidate", "session_branch": "main", "base_ref": "origin/main", "merge_base": "90cb6688b49efbeba3f4b3643ee79b390d6a916f", "head_commit": "90cb6688b49efbeba3f4b3643ee79b390d6a916f"}
{"ts": "2026-05-06T14:59:54.991114+08:00", "session_id": "20260506_140032_3bdad6", "market": "cn", "formula": "rank(-ts_corr(ret_1d,shift(ret_1d,1),20))*rank(ts_min(turnover_rate,20)/(ts_std(turnover_rate,20)+0.01))", "name": "anti_autocorr_turnover_floorstd_20", "is_ic": 0.0383, "is_ic_ir": 0.496, "is_sharpe": 4.262, "is_turnover": 0.169, "is_monotonicity": 0.45, "gates": "PASS", "status": "candidate", "eval_seconds": 223.5, "decision": "candidate", "session_branch": "main", "base_ref": "origin/main", "merge_base": "90cb6688b49efbeba3f4b3643ee79b390d6a916f", "head_commit": "90cb6688b49efbeba3f4b3643ee79b390d6a916f"}
{"ts": "2026-05-06T14:59:54.991114+08:00", "session_id": "20260506_140032_3bdad6", "market": "cn", "formula": "rank(-ts_max(ret_1d,20))*rank(ts_min(close/open,20)/(ts_std(close/open,20)+0.001))", "name": "low_lottery_openclose_floorstd_20", "is_ic": 0.0415, "is_ic_ir": 0.226, "is_sharpe": 0.568, "is_turnover": 0.075, "is_monotonicity": -0.15, "gates": "PASS", "status": "checks_failed", "eval_seconds": 204.0, "decision": "revert", "session_branch": "main", "base_ref": "origin/main", "merge_base": "90cb6688b49efbeba3f4b3643ee79b390d6a916f", "head_commit": "90cb6688b49efbeba3f4b3643ee79b390d6a916f", "oos": "PASS", "checks_status": "failed"}
{"ts": "2026-05-06T14:59:54.991114+08:00", "session_id": "20260506_140032_3bdad6", "market": "cn", "formula": "rank(-ts_max(ret_1d,20))*rank(ts_mean(ts_sum(amount,5),20)/ts_max(ts_sum(amount,5),20))", "name": "low_lottery_weekly_amount_evenness_20", "is_ic": 0.0391, "is_ic_ir": 0.251, "is_sharpe": 0.282, "is_turnover": 0.109, "is_monotonicity": 0.0, "gates": "PASS", "status": "candidate", "eval_seconds": 179.7, "decision": "candidate", "session_branch": "main", "base_ref": "origin/main", "merge_base": "90cb6688b49efbeba3f4b3643ee79b390d6a916f", "head_commit": "90cb6688b49efbeba3f4b3643ee79b390d6a916f"}
{"ts": "2026-05-06T14:59:54.991114+08:00", "session_id": "20260506_140032_3bdad6", "market": "cn", "formula": "rank(-pb) * rank(-ts_std(turnover_rate,20) / ts_mean(turnover_rate,20))", "name": "value_turnover_stability_20", "is_ic": 0.036, "is_ic_ir": 0.21, "is_sharpe": -0.043, "is_turnover": 0.081, "is_monotonicity": 0.0, "gates": "PASS", "status": "candidate", "eval_seconds": 37.1, "decision": "candidate", "session_branch": "main", "base_ref": "origin/main", "merge_base": "90cb6688b49efbeba3f4b3643ee79b390d6a916f", "head_commit": "90cb6688b49efbeba3f4b3643ee79b390d6a916f"}
{"ts": "2026-05-06T14:59:54.991114+08:00", "session_id": "20260506_140032_3bdad6", "market": "cn", "formula": "rank(-ts_corr(ret_5d, turnover_rate, 20))", "name": "quiet_drift_turn_corr_20", "is_ic": 0.0353, "is_ic_ir": 0.221, "is_sharpe": -0.226, "is_turnover": 0.126, "is_monotonicity": 0.05, "gates": "PASS", "status": "candidate", "eval_seconds": 78.1, "decision": "candidate", "session_branch": "main", "base_ref": "origin/main", "merge_base": "90cb6688b49efbeba3f4b3643ee79b390d6a916f", "head_commit": "90cb6688b49efbeba3f4b3643ee79b390d6a916f"}
{"ts": "2026-05-06T14:59:54.991114+08:00", "session_id": "20260506_140032_3bdad6", "market": "cn", "formula": "rank(-ret_5d / ts_std(turnover_rate, 20))", "name": "calm_weekly_reversal_turnstd_20", "is_ic": -0.0088, "is_ic_ir": -0.044, "is_sharpe": -3.954, "is_turnover": 0.33, "is_monotonicity": -0.15, "gates": "FAIL", "status": "reverted", "eval_seconds": 46.5, "decision": "revert", "session_branch": "main", "base_ref": "origin/main", "merge_base": "90cb6688b49efbeba3f4b3643ee79b390d6a916f", "head_commit": "90cb6688b49efbeba3f4b3643ee79b390d6a916f"}
{"ts": "2026-05-06T14:59:54.991114+08:00", "session_id": "20260506_140032_3bdad6", "market": "cn", "formula": "rank(-ts_corr(ret_1d,shift(ret_1d,1),20))*rank(ts_min(amount,20)/ts_mean(amount,20))", "name": "anti_autocorr_amount_floor_20", "is_ic": 0.0387, "is_ic_ir": 0.468, "is_sharpe": 2.062, "is_turnover": 0.176, "is_monotonicity": 0.05, "gates": "PASS", "status": "candidate", "eval_seconds": 167.6, "decision": "candidate", "session_branch": "main", "base_ref": "origin/main", "merge_base": "90cb6688b49efbeba3f4b3643ee79b390d6a916f", "head_commit": "90cb6688b49efbeba3f4b3643ee79b390d6a916f"}
{"ts": "2026-05-06T14:59:54.991114+08:00", "session_id": "20260506_140032_3bdad6", "market": "cn", "formula": "rank(-ts_corr(ret_1d,shift(ret_1d,1),20))*rank(ts_min(ts_sum(volume,5),20)/ts_mean(ts_sum(volume,5),20))", "name": "anti_autocorr_weekly_volume_floor_20", "is_ic": 0.0377, "is_ic_ir": 0.418, "is_sharpe": 3.682, "is_turnover": 0.166, "is_monotonicity": 0.55, "gates": "PASS", "status": "candidate", "eval_seconds": 133.7, "decision": "candidate", "session_branch": "main", "base_ref": "origin/main", "merge_base": "90cb6688b49efbeba3f4b3643ee79b390d6a916f", "head_commit": "90cb6688b49efbeba3f4b3643ee79b390d6a916f"}
{"ts": "2026-05-06T14:59:54.991114+08:00", "session_id": "20260506_140032_3bdad6", "market": "cn", "formula": "rank(-ts_corr(ret_5d, shift(ret_5d, 5), 20)) * rank(-ts_std(open / close, 20))", "name": "anti_autocorr_openclose_stability_20", "is_ic": 0.0198, "is_ic_ir": 0.136, "is_sharpe": -2.883, "is_turnover": 0.137, "is_monotonicity": -0.2, "gates": "FAIL", "status": "reverted", "eval_seconds": 260.8, "decision": "revert", "session_branch": "main", "base_ref": "origin/main", "merge_base": "90cb6688b49efbeba3f4b3643ee79b390d6a916f", "head_commit": "90cb6688b49efbeba3f4b3643ee79b390d6a916f"}
{"ts": "2026-05-06T14:59:54.991114+08:00", "session_id": "20260506_140032_3bdad6", "market": "cn", "formula": "rank(-ts_corr(ret_1d,shift(ret_1d,1),20))*rank(ts_min(volume_ratio,20)/ts_std(volume_ratio,20))", "name": "anti_autocorr_relvol_floorstd_20", "is_ic": 0.0359, "is_ic_ir": 0.429, "is_sharpe": 2.709, "is_turnover": 0.165, "is_monotonicity": 0.15, "gates": "PASS", "status": "candidate", "eval_seconds": 23.8, "decision": "candidate", "session_branch": "main", "base_ref": "origin/main", "merge_base": "90cb6688b49efbeba3f4b3643ee79b390d6a916f", "head_commit": "90cb6688b49efbeba3f4b3643ee79b390d6a916f"}
{"ts": "2026-05-06T14:59:54.991114+08:00", "session_id": "20260506_140032_3bdad6", "market": "cn", "formula": "rank(ts_corr(ret_1d,shift(ret_1d,1),20))*rank(ts_min(ts_sum(turnover_rate,5),20)/ts_std(ts_sum(turnover_rate,5),20))", "name": "ret_autocorr_turn_floorstd_20", "is_ic": 0.0038, "is_ic_ir": -0.021, "is_sharpe": -3.944, "is_turnover": 0.162, "is_monotonicity": 0.0, "gates": "FAIL", "status": "reverted", "eval_seconds": 206.5, "decision": "revert", "session_branch": "main", "base_ref": "origin/main", "merge_base": "90cb6688b49efbeba3f4b3643ee79b390d6a916f", "head_commit": "90cb6688b49efbeba3f4b3643ee79b390d6a916f"}
{"ts": "2026-05-06T14:59:54.991114+08:00", "session_id": "20260506_140032_3bdad6", "market": "cn", "formula": "rank(-ts_corr(ret_1d,shift(ret_1d,1),20))*rank(ts_min(ts_sum(amount,5),20)/ts_std(ts_sum(amount,5),20))", "name": "anti_autocorr_weekly_amount_floorstd_20", "is_ic": 0.035, "is_ic_ir": 0.423, "is_sharpe": 3.897, "is_turnover": 0.149, "is_monotonicity": 0.3, "gates": "PASS", "status": "candidate", "eval_seconds": 233.5, "decision": "candidate", "session_branch": "main", "base_ref": "origin/main", "merge_base": "90cb6688b49efbeba3f4b3643ee79b390d6a916f", "head_commit": "90cb6688b49efbeba3f4b3643ee79b390d6a916f"}
{"ts": "2026-05-06T14:59:54.991114+08:00", "session_id": "20260506_140032_3bdad6", "market": "cn", "formula": "rank(-ts_corr(ret_1d,shift(ret_1d,1),20))*rank(ts_min(amount,20)/ts_mean(amount,120))", "name": "anti_autocorr_amount_floor_regime_20_120", "is_ic": -0.0519, "is_ic_ir": -0.335, "is_sharpe": -7.447, "is_turnover": 0.158, "is_monotonicity": -0.15, "gates": "FAIL", "status": "reverted", "eval_seconds": 57.8, "decision": "revert", "session_branch": "main", "base_ref": "origin/main", "merge_base": "90cb6688b49efbeba3f4b3643ee79b390d6a916f", "head_commit": "90cb6688b49efbeba3f4b3643ee79b390d6a916f"}
{"ts": "2026-05-06T14:59:54.991114+08:00", "session_id": "20260506_140032_3bdad6", "market": "cn", "formula": "rank(-ts_corr(ret_1d,shift(ret_1d,1),20))*rank(ts_mean(ts_sum(amount,5),20)/ts_max(ts_sum(amount,5),20))", "name": "anti_autocorr_weekly_amount_evenness_20", "is_ic": 0.0367, "is_ic_ir": 0.473, "is_sharpe": 3.934, "is_turnover": 0.167, "is_monotonicity": 0.35, "gates": "PASS", "status": "candidate", "eval_seconds": 247.4, "decision": "candidate", "session_branch": "main", "base_ref": "origin/main", "merge_base": "90cb6688b49efbeba3f4b3643ee79b390d6a916f", "head_commit": "90cb6688b49efbeba3f4b3643ee79b390d6a916f"}
{"ts": "2026-05-06T14:59:54.991114+08:00", "session_id": "20260506_140032_3bdad6", "market": "cn", "formula": "rank(-ts_corr(ret_1d,shift(ret_1d,1),20))*rank(ts_min(ts_sum(amount,5),20)/ts_max(ts_sum(amount,5),20))", "name": "anti_autocorr_weekly_amount_corridor_20", "is_ic": 0.0367, "is_ic_ir": 0.439, "is_sharpe": 4.248, "is_turnover": 0.159, "is_monotonicity": 0.3, "gates": "PASS", "status": "candidate", "eval_seconds": 168.1, "decision": "candidate", "session_branch": "main", "base_ref": "origin/main", "merge_base": "90cb6688b49efbeba3f4b3643ee79b390d6a916f", "head_commit": "90cb6688b49efbeba3f4b3643ee79b390d6a916f"}
