{"ts": "2026-05-15T14:57:53.935894+08:00", "session_id": "20260515_140003_9fafac", "market": "cn", "formula": "rank(-ts_std(turnover_rate, 20) / (ts_mean(turnover_rate, 20) + 0.01))", "name": "turnover_stability_20", "is_ic": 0.0, "is_ic_ir": 0.0, "is_sharpe": 0.0, "is_turnover": 0.0, "is_monotonicity": 0.0, "gates": "FAIL", "status": "reverted", "eval_seconds": 115.8, "sleeve_id": "cn_aiinfra_quiet_float_absorption", "mispricing_source": "Float-normalized turnover stability captures patient institutional accumulation rather than noisy breakout chasing, so it is not just another price-shape factor.", "forced_counterparty": "Retail momentum traders and benchmarked funds facing liquidity/redemption constraints", "data_requirements": "[\"current daily turnover_rate is sufficient for IS\", \"before promotion require beta-hedged sleeve attribution\", \"correlation vs existing sleeves\", \"capacity/turnover stress by AI layer\", \"if a supplier/customer story is attached, require filings/press releases/transcripts for source review\"]", "failure_mode": "It stops working in rumor-squeeze regimes where unstable high-turnover names dominate leadership, or when low turnover dispersion reflects illiquidity rather than absorption.", "report_contract": "fresh_buy_gate", "ai_supercycle_layer": "ai_chip_equipment_materials_packaging", "supply_chain_hypothesis": "Domestic AI chip equipment/material suppliers may show quiet float absorption before verified capacity or order upgrades appear in filings.", "relationship_evidence_required": "true", "money_readiness": "money_candidate", "decision": "revert", "session_branch": "main", "base_ref": "origin/main", "merge_base": "630e0dd16b5d38cb718e990195890edf7504d2e6", "head_commit": "630e0dd16b5d38cb718e990195890edf7504d2e6"}
{"ts": "2026-05-15T14:57:53.935894+08:00", "session_id": "20260515_140003_9fafac", "market": "cn", "formula": "rank(-ts_corr(close,delta(amount,5),20))*rank(ts_mean(turnover_rate,20)/ts_max(turnover_rate,20))", "name": "price_amt_diverge_turnover_corridor_20", "is_ic": 0.0, "is_ic_ir": 0.0, "is_sharpe": 0.0, "is_turnover": 0.0, "is_monotonicity": 0.0, "gates": "FAIL", "status": "reverted", "eval_seconds": 227.0, "sleeve_id": "cn_ai_flow_absorption", "mispricing_source": "Flow-distribution underreaction, not a pure price factor; it requires cash-flow absorption plus low speculative turnover concentration.", "forced_counterparty": "Retail theme chasers and benchmark-constrained long-only funds waiting for headline or filing confirmation", "data_requirements": "[\"existing daily close/amount/turnover_rate for IS test\",\"for promotion: beta-hedged sleeve return, residual risk attribution, correlation to existing sleeves, and source-reviewed AI-universe membership\",\"if specific supplier/customer interpretation is attached, require filings/press releases/transcripts/news confirmation\"]", "failure_mode": "Stops working when the market rewards one-day rumor spikes over steady accumulation, or when macro/policy beta overwhelms stock-specific absorption.", "report_contract": "fresh_buy_gate", "ai_supercycle_layer": "ai_chip_equipment_materials_packaging", "supply_chain_hypothesis": "Within the source-reviewed CN AI universe, upstream bottleneck suppliers should show quiet cash absorption before public order visibility is fully reflected in price.", "relationship_evidence_required": "true", "money_readiness": "money_candidate", "decision": "revert", "session_branch": "main", "base_ref": "origin/main", "merge_base": "630e0dd16b5d38cb718e990195890edf7504d2e6", "head_commit": "630e0dd16b5d38cb718e990195890edf7504d2e6"}
{"ts": "2026-05-15T14:57:53.935894+08:00", "session_id": "20260515_140003_9fafac", "market": "cn", "formula": "rank((ret_20d - ret_5d) / ts_mean(turnover_rate,5))", "name": "quiet_pullback_leader_20_5", "is_ic": 0.0, "is_ic_ir": 0.0, "is_sharpe": 0.0, "is_turnover": 0.0, "is_monotonicity": 0.0, "gates": "FAIL", "status": "reverted", "eval_seconds": 93.4, "sleeve_id": "cn_ai_leadership_pullback", "mispricing_source": "The payoff comes from underreaction to orderly consolidation in real leaders; strong 20-day performance with cooling recent turnover suggests holders are tightening rather than distributing.", "forced_counterparty": "Retail momentum traders and short-horizon funds forced to recycle capital after a 5-day stall or pullback.", "data_requirements": "[\"CN AI-infra universe daily OHLCV + turnover_rate\", \"000300.SH and 399006.SZ benchmark series for beta-hedged attribution\", \"correlation check versus kshadow_5 and amount_stability_20 family\", \"20-day holding-period turnover and cost check\"]", "failure_mode": "It fails in indiscriminate macro selloffs or retail melt-up regimes where low turnover means fading interest or illiquidity instead of accumulation.", "report_contract": "research_only", "ai_supercycle_layer": "none", "supply_chain_hypothesis": "Broad AI-infra bottleneck names showing strong 20-day leadership with quiet 5-day float turnover may be in accumulation ahead of later evidence on orders, capacity, or domestic substitution.", "relationship_evidence_required": "true", "money_readiness": "research_only", "decision": "revert", "session_branch": "main", "base_ref": "origin/main", "merge_base": "630e0dd16b5d38cb718e990195890edf7504d2e6", "head_commit": "630e0dd16b5d38cb718e990195890edf7504d2e6"}
{"ts": "2026-05-15T14:57:53.935894+08:00", "session_id": "20260515_140003_9fafac", "market": "cn", "formula": "rank(-ts_std(delta(volume_ratio,5),20))*rank(ts_mean((close-open)/(high-low+0.01),20))", "name": "weekly_relvol_body_bias_20", "is_ic": 0.0, "is_ic_ir": 0.0, "is_sharpe": 0.0, "is_turnover": 0.0, "is_monotonicity": 0.0, "gates": "FAIL", "status": "reverted", "eval_seconds": 167.5, "sleeve_id": "cn_ai_flow_body_underreaction", "mispricing_source": "Underreaction to orderly sponsorship; this is a participation-path plus close-quality interaction, not a raw momentum or upper-shadow clone.", "forced_counterparty": "Retail theme chasers, redemption-driven sellers, and benchmark-constrained funds trading around liquidity/rebalance windows.", "data_requirements": "[\"open\",\"high\",\"low\",\"close\",\"volume_ratio\",\"beta-hedged attribution vs 000300.SH/399006.SZ before promotion\",\"corr check vs kshadow_5 and current sleeves\"]", "failure_mode": "Fails in policy/headline squeeze regimes where bursty participation carries real information immediately, or when quiet strong closes are just illiquidity/marking-up rather than accumulation.", "report_contract": "research_only", "ai_supercycle_layer": "ai_chip_equipment_materials_packaging", "supply_chain_hypothesis": "Validated CN semicap, materials, packaging, and testing bottleneck names should show smooth weekly relative-participation and repeated strong closes before source-reviewed capex, order, or backlog evidence is fully priced.", "relationship_evidence_required": "false", "money_readiness": "research_only", "decision": "revert", "session_branch": "main", "base_ref": "origin/main", "merge_base": "630e0dd16b5d38cb718e990195890edf7504d2e6", "head_commit": "630e0dd16b5d38cb718e990195890edf7504d2e6"}
{"ts": "2026-05-15T14:57:53.935894+08:00", "session_id": "20260515_140003_9fafac", "market": "cn", "formula": "rank(-ps_ttm)*rank(ts_mean(amount,20)/(ts_std(amount,20)+1))", "name": "value_absorption_ps20", "is_ic": 0.0, "is_ic_ir": 0.0, "is_sharpe": 0.0, "is_turnover": 0.0, "is_monotonicity": 0.0, "gates": "FAIL", "status": "reverted", "eval_seconds": 93.7, "sleeve_id": "ai_infra_value_absorption", "mispricing_source": "Narrative crowding overpays front-end AI stories and underprices validated suppliers whose rerating starts only when steady value turnover reveals institutional absorption.", "forced_counterparty": "Retail momentum chasers and benchmark-constrained managers anchored to index-heavy AI leaders", "data_requirements": "[\"daily CN price/volume/amount/ps_ttm\",\"ai_infra universe membership + source-review status\",\"beta-hedged sleeve attribution vs 000300.SH/399006.SZ\",\"rolling correlation to promoted sleeves\"]", "failure_mode": "Fails in speculative melt-up regimes where expensive leaders keep expanding multiples and stable-value laggards never receive rotation flows.", "report_contract": "setup_overlay", "ai_supercycle_layer": "ai_chip_equipment_materials_packaging", "supply_chain_hypothesis": "Lower-PS CN equipment/materials/packaging names showing steady traded-value absorption are candidate late-rerating beneficiaries of upstream AI capex bottlenecks.", "relationship_evidence_required": "true", "money_readiness": "research_only", "decision": "revert", "session_branch": "main", "base_ref": "origin/main", "merge_base": "630e0dd16b5d38cb718e990195890edf7504d2e6", "head_commit": "630e0dd16b5d38cb718e990195890edf7504d2e6"}
{"ts": "2026-05-15T14:57:53.935894+08:00", "session_id": "20260515_140003_9fafac", "market": "cn", "formula": "rank(-ts_std(delta(amount/circ_market_cap,5),20))*rank(ts_mean(close/open,20))", "name": "weekly_floatchg_body_evenness_20", "is_ic": 0.0, "is_ic_ir": 0.0, "is_sharpe": 0.0, "is_turnover": 0.0, "is_monotonicity": 0.0, "gates": "FAIL", "status": "reverted", "eval_seconds": 175.5, "sleeve_id": "cn_aiinfra_flow_quality", "mispricing_source": "The market underprices steady float-scaled accumulation quality; headline-driven traders focus on short-term tape and ignore whether capital is entering in a smooth, repeatable way.", "forced_counterparty": "Retail theme traders and benchmark-constrained funds rotating on short-term liquidity and PnL", "data_requirements": "[\"daily price\",\"amount\",\"circ_market_cap\",\"benchmark-hedged attribution vs 000300.SH and 399006.SZ before promotion\",\"source-review filings/news only if a selected name is later claimed to be a verified AI bottleneck supplier\"]", "failure_mode": "It stops working in gap-driven lottery regimes, policy-shock reversals, or broad distribution phases where smooth flow no longer leads future returns.", "report_contract": "action_overlay", "ai_supercycle_layer": "ai_chip_equipment_materials_packaging", "supply_chain_hypothesis": "Domestic AI bottleneck equipment/materials/packaging names showing steady float-flow change and constructive candle bodies are being accumulated ahead of explicit order/backlog confirmation.", "relationship_evidence_required": "true", "money_readiness": "research_only", "decision": "revert", "session_branch": "main", "base_ref": "origin/main", "merge_base": "630e0dd16b5d38cb718e990195890edf7504d2e6", "head_commit": "630e0dd16b5d38cb718e990195890edf7504d2e6"}
{"ts": "2026-05-15T14:57:53.935894+08:00", "session_id": "20260515_140003_9fafac", "market": "cn", "formula": "rank(ts_mean((close-open)/(high-low+0.01),5))*rank(ts_min(amount/circ_market_cap,20)/ts_mean(amount/circ_market_cap,20))", "name": "body_float_floor_20", "is_ic": 0.0, "is_ic_ir": 0.0, "is_sharpe": 0.0, "is_turnover": 0.0, "is_monotonicity": 0.0, "gates": "FAIL", "status": "reverted", "eval_seconds": 147.4, "sleeve_id": "cn_ai_infra_flow_absorption", "mispricing_source": "Underreaction to steady sponsorship in bottleneck AI-infra names; this is not just a price-only continuation factor because it requires a persistent float-flow floor, not merely a strong recent return or small upper shadow.", "forced_counterparty": "Retail/theme traders rotating toward high-excitement names, plus benchmarked mutual funds forced to accumulate gradually rather than instantly clearing the mispricing", "data_requirements": "Current daily data is enough for IS testing; before promotion require beta-hedged sleeve attribution, correlation vs existing CN sleeves, and ai_infra source-review status for any name-specific supply-chain narrative", "failure_mode": "Stops working when the market shifts to pure retail chase or macro beta dominates, so stable participation floors no longer signal informed accumulation", "report_contract": "setup_overlay", "ai_supercycle_layer": "none", "supply_chain_hypothesis": "Cross-layer CN AI-infra bottleneck candidates can re-rate before filings/news confirm orders, and that early repricing should appear as positive body bias with a stable float-flow floor", "relationship_evidence_required": "true", "money_readiness": "research_only", "decision": "revert", "session_branch": "main", "base_ref": "origin/main", "merge_base": "630e0dd16b5d38cb718e990195890edf7504d2e6", "head_commit": "630e0dd16b5d38cb718e990195890edf7504d2e6"}
{"ts": "2026-05-15T14:57:53.935894+08:00", "session_id": "20260515_140003_9fafac", "market": "cn", "formula": "rank(ts_mean(amount/circ_market_cap,20)/ts_std(amount/circ_market_cap,20))", "name": "float_value_absorption_20", "is_ic": 0.0, "is_ic_ir": 0.0, "is_sharpe": 0.0, "is_turnover": 0.0, "is_monotonicity": 0.0, "gates": "FAIL", "status": "reverted", "eval_seconds": 139.2, "sleeve_id": "cn_ai_infra_flow_support", "mispricing_source": "The market underprices persistent ownership transfer in bottleneck AI-infra names because retail flow focuses on visible breakouts while benchmarked institutions build positions gradually and reveal demand only with a lag.", "forced_counterparty": "Retail momentum traders and benchmark-constrained managers who under-own until orders, capex, or guidance become explicit", "data_requirements": "[\"daily amount\",\"daily circ_market_cap\",\"AI-infra vetted universe membership\",\"rolling correlation vs promoted sleeves\",\"beta-hedged sleeve PnL vs 000300.SH/399006.SZ\"]", "failure_mode": "Stops working when theme tape becomes pure speculation and stable float turnover reflects distribution or index rebalancing rather than informed accumulation; also weakens if AI-infra leadership broadens so much that flow support no longer differentiates winners.", "report_contract": "setup_overlay", "ai_supercycle_layer": "ai_datacenter_edge_infra", "supply_chain_hypothesis": "Steady float-normalized value support should surface datacenter and adjacent infrastructure bottleneck names being accumulated ahead of project, procurement, or capex confirmation.", "relationship_evidence_required": "true", "money_readiness": "research_only", "decision": "revert", "session_branch": "main", "base_ref": "origin/main", "merge_base": "630e0dd16b5d38cb718e990195890edf7504d2e6", "head_commit": "630e0dd16b5d38cb718e990195890edf7504d2e6"}
{"ts": "2026-05-15T14:57:53.935894+08:00", "session_id": "20260515_140003_9fafac", "market": "cn", "formula": "rank(-ts_corr(high-low,amount,20))*rank(-ts_corr(ret_1d,shift(ret_1d,1),40))", "name": "absorb_autocorr_decorr_20_40", "is_ic": 0.0, "is_ic_ir": 0.0, "is_sharpe": 0.0, "is_turnover": 0.0, "is_monotonicity": 0.0, "gates": "FAIL", "status": "reverted", "eval_seconds": 149.8, "sleeve_id": "cn_ai_bottleneck_accumulation", "mispricing_source": "Underreaction to steady accumulation in validated AI-infra leaders; the tape reflects supply absorption before consensus fully prices backlog/order-cycle improvement.", "forced_counterparty": "Retail theme chasers and benchmark-constrained institutions that cannot size quickly into concentrated hardware leaders", "data_requirements": "[\"daily OHLC and amount (available)\", \"beta-hedged sleeve attribution vs 000300.SH/399006.SZ\", \"turnover-cost audit at 0.3% round-trip\", \"correlation to existing sleeves before promotion\"]", "failure_mode": "Stops working in pure event-gap or policy-whipsaw regimes where daily bars are dominated by news shocks instead of gradual accumulation, or when the AI basket becomes fully crowded and ranges widen with flow again.", "report_contract": "fresh_buy_gate", "ai_supercycle_layer": "ai_chip_equipment_materials_packaging", "supply_chain_hypothesis": "Validated CN AI hardware bottleneck names should exhibit stable absorption and reduced return chop before public backlog or capex confirmation reaches the market.", "relationship_evidence_required": "true", "money_readiness": "money_candidate", "decision": "revert", "session_branch": "main", "base_ref": "origin/main", "merge_base": "630e0dd16b5d38cb718e990195890edf7504d2e6", "head_commit": "630e0dd16b5d38cb718e990195890edf7504d2e6"}
{"ts": "2026-05-15T14:57:53.935894+08:00", "session_id": "20260515_140003_9fafac", "market": "cn", "formula": "rank(ret_20d) * rank(-ts_std(turnover_rate,20))", "name": "trend_turnover_orderliness_20", "is_ic": 0.0, "is_ic_ir": 0.0, "is_sharpe": 0.0, "is_turnover": 0.0, "is_monotonicity": 0.0, "gates": "FAIL", "status": "reverted", "eval_seconds": 25.8, "sleeve_id": "ai_infra_leadership_continuation", "mispricing_source": "Slow institutional re-underwriting of AI-capex beneficiaries, while retail supply creates temporary entry noise but does not fully reprice persistent leadership.", "forced_counterparty": "Short-horizon retail profit-takers and benchmarked managers who rebalance into strength mechanically rather than on refreshed fundamental conviction.", "data_requirements": "[\"daily price/volume/turnover data for current CN AI-infra universe\", \"portfolio-level beta hedge attribution vs 000300.SH/399006.SZ\", \"sleeve correlation matrix vs promoted factors before promotion\"]", "failure_mode": "Stops working when the market rotates into high-volatility theme chasing, or when AI-infra leadership broadens enough that orderly turnover no longer distinguishes true bottlenecks from crowded momentum.", "report_contract": "setup_overlay", "ai_supercycle_layer": "ai_chip_equipment_materials_packaging", "supply_chain_hypothesis": "Tape should surface accumulation in domestic bottleneck suppliers to accelerator, optical, packaging, and power-chain capex before full earnings recognition.", "relationship_evidence_required": "true", "money_readiness": "research_only", "decision": "revert", "session_branch": "main", "base_ref": "origin/main", "merge_base": "630e0dd16b5d38cb718e990195890edf7504d2e6", "head_commit": "630e0dd16b5d38cb718e990195890edf7504d2e6"}
{"ts": "2026-05-15T14:57:53.935894+08:00", "session_id": "20260515_140003_9fafac", "market": "cn", "formula": "rank(ts_min(turnover_rate,20)/(ts_max(turnover_rate,20)+0.01))", "name": "turnover_corridor_20", "is_ic": 0.0, "is_ic_ir": 0.0, "is_sharpe": 0.0, "is_turnover": 0.0, "is_monotonicity": 0.0, "gates": "FAIL", "status": "reverted", "eval_seconds": 171.6, "sleeve_id": "cn_ai_flow_quality", "mispricing_source": "Retail attention chases turnover spikes, while patient accumulation in AI-infra leaders is underreacted to because the tape looks quiet; this measures participation evenness, not just momentum or candlestick shape.", "forced_counterparty": "Retail T+1 momentum traders and benchmarked funds forced to trade around rumor/news volume bursts.", "data_requirements": "[\"current CN daily OHLC + turnover_rate for validated ai_infra universe\", \"beta-hedged sleeve attribution vs 000300.SH and 399006.SZ before promotion\", \"correlation and residual risk attribution versus existing CN sleeves\"]", "failure_mode": "Fails when the market shifts into broad policy/risk-on squeeze regimes where single-day turnover spikes become continuation rather than exhaustion, or when turnover becomes uniformly elevated across the whole AI book.", "report_contract": "setup_overlay", "ai_supercycle_layer": "ai_networking_optical_cpo", "supply_chain_hypothesis": "Candidate bottleneck repricing in CN optical/interconnect names where steady turnover reflects patient accumulation ahead of later order and capex evidence.", "relationship_evidence_required": "true", "money_readiness": "research_only", "decision": "revert", "session_branch": "main", "base_ref": "origin/main", "merge_base": "630e0dd16b5d38cb718e990195890edf7504d2e6", "head_commit": "630e0dd16b5d38cb718e990195890edf7504d2e6"}
{"ts": "2026-05-15T14:57:53.935894+08:00", "session_id": "20260515_140003_9fafac", "market": "cn", "formula": "rank(-ts_std(delta(log(amount),5),20))", "name": "weekly_log_amount_smooth_20", "is_ic": 0.0, "is_ic_ir": 0.0, "is_sharpe": 0.0, "is_turnover": 0.0, "is_monotonicity": 0.0, "gates": "FAIL", "status": "reverted", "eval_seconds": 179.2, "sleeve_id": "cn_ai_infra_flow_quality", "mispricing_source": "Sticky sponsorship in bottleneck AI suppliers is capitalized too slowly, while short-horizon traders overreact to noisy turnover bursts and underweight steadier accumulation.", "forced_counterparty": "headline-driven retail and benchmarked theme funds forced to chase or de-risk around short-term tape and policy/news bursts", "data_requirements": "[\"current CN daily price/amount data is sufficient for IS evaluation\",\"promotion requires rolling corr vs promoted sleeves, beta-hedged sleeve PnL, residual risk attribution, and drawdown persistence on the AI-infra universe\"]", "failure_mode": "It stops working when AI-infra trades as a single beta tape and steady participation no longer separates informed accumulation from passive sector flow.", "report_contract": "fresh_buy_gate", "ai_supercycle_layer": "ai_chip_equipment_materials_packaging", "supply_chain_hypothesis": "Domestic AI bottleneck suppliers may be accumulated in steady tranches before order and capex evidence is fully capitalized, especially in equipment/materials/packaging tied to accelerator and datacenter build-out.", "relationship_evidence_required": "true", "money_readiness": "money_candidate", "decision": "revert", "session_branch": "main", "base_ref": "origin/main", "merge_base": "630e0dd16b5d38cb718e990195890edf7504d2e6", "head_commit": "630e0dd16b5d38cb718e990195890edf7504d2e6"}
