{"ts": "2026-05-26T07:23:53.826949+08:00", "session_id": "20260526_062702_4e1ae2", "market": "cn", "formula": "rank(ts_std(amount,60)/ts_std(amount,20))*rank(ts_min(turnover_rate,20)/ts_mean(turnover_rate,20))", "name": "amount_compress_turn_floor_20_60", "is_ic": -0.0395, "is_ic_ir": -0.156, "is_sharpe": -4.795, "is_turnover": 0.156, "is_monotonicity": -0.7, "gates": "FAIL", "status": "reverted", "eval_seconds": 247.5, "sleeve_id": "cn_ai_infra_flow_quality", "mispricing_source": "The market overreacts to visibly cooler tape after an AI-theme spike and mistakes consolidation for fading demand, while a stable turnover floor means sponsorship is still present.", "forced_counterparty": "Retail momentum traders and short-horizon theme books taking profits or rotating out after the initial burst.", "data_requirements": "[\"amount\",\"turnover_rate\",\"benchmark hedge attribution vs 000300.SH and 399006.SZ\",\"sleeve correlation to existing promoted factors\"]", "failure_mode": "Fails when CN AI names trade as pure one-day speculation, or when policy/news gaps dominate steady accumulation and turnover-floor information stops mattering.", "report_contract": "setup_overlay", "ai_supercycle_layer": "none", "supply_chain_hypothesis": "Within the source-reviewed CN AI-infra universe, this should surface bottleneck or domestic-substitution names being accumulated through post-theme consolidation before the next capex or order repricing leg; exact upstream/downstream links still need primary-source review.", "relationship_evidence_required": "true", "money_readiness": "research_only", "decision": "revert", "session_branch": "main", "base_ref": "origin/main", "merge_base": "c99187be1dc8d78a84147200981562efcde7b8d5", "head_commit": "c99187be1dc8d78a84147200981562efcde7b8d5"}
{"ts": "2026-05-26T07:23:53.826949+08:00", "session_id": "20260526_062702_4e1ae2", "market": "cn", "formula": "rank(ts_rank(amount/circ_market_cap,20)-ts_rank(abs(ret_5d),20))", "name": "quiet_absorption_floatvalue_20", "is_ic": 0.0113, "is_ic_ir": 0.051, "is_sharpe": -4.736, "is_turnover": 0.617, "is_monotonicity": 0.1, "gates": "FAIL", "status": "reverted", "eval_seconds": 68.5, "sleeve_id": "cn_aiinfra_accumulation", "mispricing_source": "Slow thematic fund accumulation in validated AI-infra names is only partially reflected in price when short-horizon traders anchor on recent flat returns.", "forced_counterparty": "Retail momentum traders and benchmarked long-only funds trimming into liquidity windows", "data_requirements": "[\"current daily data is enough for IS test\",\"before promotion require beta-hedged sleeve return, residual risk attribution, sleeve correlation vs promoted factors, and source-review status for any AI supply-chain claim\"]", "failure_mode": "Stops working when turnover is driven by speculative distribution/news-chasing rather than absorption, or when the market regime rewards immediate breakout momentum instead of delayed repricing.", "report_contract": "setup_overlay", "ai_supercycle_layer": "ai_chip_equipment_materials_packaging", "supply_chain_hypothesis": "Candidate D1-D3 AI capex bottleneck suppliers in equipment/materials/packaging should exhibit quiet float absorption before backlog or order evidence is widely recognized.", "relationship_evidence_required": "true", "money_readiness": "research_only", "decision": "revert", "session_branch": "main", "base_ref": "origin/main", "merge_base": "c99187be1dc8d78a84147200981562efcde7b8d5", "head_commit": "c99187be1dc8d78a84147200981562efcde7b8d5"}
{"ts": "2026-05-26T07:23:53.826949+08:00", "session_id": "20260526_062702_4e1ae2", "market": "cn", "formula": "rank(-ts_corr(ret_5d,turnover_rate,20))*rank(-ts_max(ret_1d,20))", "name": "turnover_absorb_lowlottery_20", "is_ic": -0.0044, "is_ic_ir": -0.018, "is_sharpe": -3.235, "is_turnover": 0.131, "is_monotonicity": -0.15, "gates": "FAIL", "status": "reverted", "eval_seconds": 185.5, "sleeve_id": "cn_ai_infra_accumulation", "mispricing_source": "The payoff comes from retail/theme money overreacting to pullbacks or chasing single-day spikes, while institutions accumulate real leaders across several sessions without a discrete confirming headline.", "forced_counterparty": "Retail momentum chasers, margin-constrained sellers, and benchmarked funds cutting weak tape.", "data_requirements": "[\"CN daily OHLCV + turnover_rate inside the source-reviewed AI universe\",\"pre-promotion beta-hedge and residual-risk attribution vs 000300.SH/399006.SZ\",\"correlation check versus promoted sleeves\"]", "failure_mode": "It stops working when the regime rewards pure high-beta thematic bursts, or when firm turnover during weak returns reflects distribution rather than absorption.", "report_contract": "setup_overlay", "ai_supercycle_layer": "ai_chip_equipment_materials_packaging", "supply_chain_hypothesis": "Candidate semicap equipment/material/packaging bottleneck names should show quiet dip absorption before source-reviewed order or capex evidence is fully priced.", "relationship_evidence_required": "true", "money_readiness": "research_only", "decision": "revert", "session_branch": "main", "base_ref": "origin/main", "merge_base": "c99187be1dc8d78a84147200981562efcde7b8d5", "head_commit": "c99187be1dc8d78a84147200981562efcde7b8d5"}
{"ts": "2026-05-26T07:23:53.826949+08:00", "session_id": "20260526_062702_4e1ae2", "market": "cn", "formula": "rank(ret_20d-ret_5d-ts_std(log(amount),20))", "name": "leader_pullback_logamt_20", "is_ic": 0.0019, "is_ic_ir": 0.015, "is_sharpe": -2.165, "is_turnover": 0.175, "is_monotonicity": -0.65, "gates": "FAIL", "status": "reverted", "eval_seconds": 122.6, "sleeve_id": "leadership_pullback_overlay", "mispricing_source": "Retail and fast thematic money overreact to short pullbacks, while benchmarked institutions accumulate slowly under liquidity, participation, and tracking-error constraints, leaving orderly pullbacks in sponsored AI names underpriced.", "forced_counterparty": "short-horizon profit takers, retail momentum chasers, and fast-money thematic accounts reducing risk into minor weakness", "data_requirements": "[\"daily OHLCV\",\"amount\",\"AI universe membership/evidence status\",\"rolling beta hedge attribution vs 000300.SH and 399006.SZ\",\"correlation check vs promoted factors\"]", "failure_mode": "It stops working when the market shifts from orderly digestion to broad de-risking, so stable traded value reflects quiet distribution instead of absorption, or when AI leadership itself breaks.", "report_contract": "setup_overlay", "ai_supercycle_layer": "none", "supply_chain_hypothesis": "reviewed AI-infra bottleneck names should show steadier capital absorption during shallow pullbacks than narrative-chasing downstream names, but tape alone does not verify any new supplier or customer link", "relationship_evidence_required": "false", "money_readiness": "research_only", "decision": "revert", "session_branch": "main", "base_ref": "origin/main", "merge_base": "c99187be1dc8d78a84147200981562efcde7b8d5", "head_commit": "c99187be1dc8d78a84147200981562efcde7b8d5"}
{"ts": "2026-05-26T07:23:53.826949+08:00", "session_id": "20260526_062702_4e1ae2", "market": "cn", "formula": "rank(ret_20d-ret_5d)*rank(-ts_std(turnover_rate,20)/ts_mean(turnover_rate,20))", "name": "leader_pullback_turnstable_20", "is_ic": -0.054, "is_ic_ir": -0.192, "is_sharpe": -2.427, "is_turnover": 0.203, "is_monotonicity": -0.35, "gates": "FAIL", "status": "reverted", "eval_seconds": 189.3, "sleeve_id": "cn_aiinfra_leadership_pullback", "mispricing_source": "Short-horizon traders monetize the first leg, while benchmarked and slower fundamental capital re-allocates into capacity-constrained AI-infra names with less ownership churn; the turnover-stability term makes this a participation-quality signal, not a high-correlation clone of existing price-only momentum factors.", "forced_counterparty": "retail theme chasers and short-horizon sector rotators taking profits on the first pullback", "data_requirements": "[\"daily OHLCV\",\"daily_basic turnover_rate\",\"ai_infra universe membership\",\"benchmark hedge attribution vs 000300.SH/399006.SZ\",\"sleeve correlation and residual risk attribution\",\"source-reviewed evidence cards before any supplier/customer claim is treated as fact\"]", "failure_mode": "It stops working when AI-infra tape shifts from orderly institutional accumulation to indiscriminate beta squeezes or theme-wide de-risking, so stable-turnover pullbacks become distribution instead of absorption.", "report_contract": "setup_overlay", "ai_supercycle_layer": "ai_chip_equipment_materials_packaging", "supply_chain_hypothesis": "If valid, this should preferentially surface upstream CN equipment/materials/advanced-packaging bottleneck names whose 1-month leadership cools without ownership churn, consistent with institutions absorbing supply before backlog/order evidence is fully priced.", "relationship_evidence_required": "true", "money_readiness": "research_only", "decision": "revert", "session_branch": "main", "base_ref": "origin/main", "merge_base": "c99187be1dc8d78a84147200981562efcde7b8d5", "head_commit": "c99187be1dc8d78a84147200981562efcde7b8d5"}
{"ts": "2026-05-26T07:23:53.826949+08:00", "session_id": "20260526_062702_4e1ae2", "market": "cn", "formula": "rank(ts_mean(amount / circ_market_cap, 20))", "name": "float_notional_absorb_20", "is_ic": 0.0293, "is_ic_ir": 0.099, "is_sharpe": 3.349, "is_turnover": 0.032, "is_monotonicity": 0.05, "gates": "FAIL", "status": "reverted", "eval_seconds": 128.2, "sleeve_id": "cn_aiinfra_accumulation", "mispricing_source": "Inventory-transfer lag between informed accumulation and slower source-review/news recognition inside niche AI-infra supply chains.", "forced_counterparty": "Benchmarked funds constrained by size/liquidity limits and retail holders selling early into strength provide inventory below scarcity value.", "data_requirements": "[\"daily amount\",\"daily circ_market_cap\",\"AI universe membership\",\"benchmark returns for beta-hedged residual attribution\"]", "failure_mode": "Fails when elevated amount is mostly speculative blow-off turnover rather than institutional absorption, or when broad liquidity shocks dominate stock-specific accumulation.", "report_contract": "research_only", "ai_supercycle_layer": "ai_chip_equipment_materials_packaging", "supply_chain_hypothesis": "Persistent float-normalized notional absorption should surface domestic packaging, materials, and tool bottleneck names being accumulated ahead of source-verified AI capacity orders.", "relationship_evidence_required": "true", "money_readiness": "research_only", "decision": "revert", "session_branch": "main", "base_ref": "origin/main", "merge_base": "c99187be1dc8d78a84147200981562efcde7b8d5", "head_commit": "c99187be1dc8d78a84147200981562efcde7b8d5"}
{"ts": "2026-05-26T07:23:53.826949+08:00", "session_id": "20260526_062702_4e1ae2", "market": "cn", "formula": "rank(ts_mean(amount,20)/(ts_std(amount,20)+1))*rank(-ret_20d)", "name": "stable_amt_pullback_20", "is_ic": 0.0448, "is_ic_ir": 0.233, "is_sharpe": -0.879, "is_turnover": 0.166, "is_monotonicity": 0.4, "gates": "PASS", "status": "reverted", "eval_seconds": 95.5, "sleeve_id": "cn_ai_absorption_overlay", "mispricing_source": "Benchmarked funds and short-horizon retail traders sell recent underperformers, but steady RMB turnover indicates patient capital is still accumulating validated AI-infra names before the next 10-20 day repricing leg.", "forced_counterparty": "Retail momentum chasers and mandate-constrained funds de-risking recent laggards", "data_requirements": "[\"daily OHLCV + daily_basic already available\",\"for promotion: benchmark hedge attribution vs 000300.SH/399006.SZ\",\"source-reviewed AI-universe membership and sleeve correlation report\"]", "failure_mode": "It stops working in pure breakout/chasing regimes where stable turnover just identifies liquid large caps and pullbacks reflect genuine demand destruction rather than digestion.", "report_contract": "fresh_buy_gate", "ai_supercycle_layer": "ai_chip_equipment_materials_packaging", "supply_chain_hypothesis": "Source-reviewed D1-D3 semicap/material/packaging bottleneck names should show stable notional support during 20-day pullbacks as institutions pre-position for AI capex and domestic substitution cycles.", "relationship_evidence_required": "true", "money_readiness": "money_candidate", "decision": "revert", "session_branch": "main", "base_ref": "origin/main", "merge_base": "c99187be1dc8d78a84147200981562efcde7b8d5", "head_commit": "c99187be1dc8d78a84147200981562efcde7b8d5", "oos": "FAIL", "checks_status": "skipped"}
{"ts": "2026-05-26T07:23:53.826949+08:00", "session_id": "20260526_062702_4e1ae2", "market": "cn", "formula": "rank(ts_min(turnover_rate,20)/ts_mean(turnover_rate,20))*rank(-ret_5d)", "name": "turnover_floor_pullback_20", "is_ic": -0.0075, "is_ic_ir": -0.038, "is_sharpe": -3.365, "is_turnover": 0.286, "is_monotonicity": 0.1, "gates": "FAIL", "status": "reverted", "eval_seconds": 190.8, "sleeve_id": "cn_ai_infra_pullback_absorption", "mispricing_source": "The market overreacts to short pullbacks while underweighting whether participation stayed continuous; this is a turnover-floor signal, not a pure price-reversal clone.", "forced_counterparty": "Retail theme traders and fast de-risking funds sell the dip mechanically, while benchmark-constrained institutions cannot fully warehouse concentrated AI-theme risk.", "data_requirements": "[\"turnover_rate\",\"ret_5d\",\"canonical ai_infra universe membership\",\"beta-hedged sleeve attribution vs 000300.SH and 399006.SZ\",\"factor correlation to existing CN sleeves\",\"turnover cost audit at 0.3% round-trip\"]", "failure_mode": "It stops working when pullbacks are driven by real fundamental de-rating or broad policy/liquidity shocks, because a stable turnover floor then reflects trapped supply rather than accumulation.", "report_contract": "setup_overlay", "ai_supercycle_layer": "none", "supply_chain_hypothesis": "May preferentially surface defended bottleneck names across the verified AI-infra universe during digestion, but tape alone cannot verify which upstream/downstream relationship is active.", "relationship_evidence_required": "true", "money_readiness": "research_only", "decision": "revert", "session_branch": "main", "base_ref": "origin/main", "merge_base": "c99187be1dc8d78a84147200981562efcde7b8d5", "head_commit": "c99187be1dc8d78a84147200981562efcde7b8d5"}
{"ts": "2026-05-26T07:23:53.826949+08:00", "session_id": "20260526_062702_4e1ae2", "market": "cn", "formula": "rank(ts_mean(turnover_rate,20)/ts_std(turnover_rate,20))*rank(-pct_change(close,10))", "name": "turnover_stable_pullback_10", "is_ic": -0.0324, "is_ic_ir": -0.126, "is_sharpe": -4.7, "is_turnover": 0.206, "is_monotonicity": -0.75, "gates": "FAIL", "status": "reverted", "eval_seconds": 160.7, "sleeve_id": "cn_ai_absorption_pullback", "mispricing_source": "The market overreacts to recent downside in crowded AI themes and underreacts to stable float participation that signals patient accumulation; this is sponsorship-quality plus pullback, not a naked reversal clone.", "forced_counterparty": "Retail momentum traders, theme-rotation funds, and benchmark-constrained long-only sellers meeting rebalance or redemption flows", "data_requirements": "[\"daily close\",\"turnover_rate\",\"AI universe membership\",\"beta-hedged sleeve attribution vs 000300.SH and 399006.SZ\",\"residual risk attribution\",\"rolling correlation vs amount_absorb_pullback_10 and promoted factors\",\"source-reviewed evidence before attaching supplier/customer claims\"]", "failure_mode": "Fails when the pullback reflects real order/capex deterioration, or when policy/squeeze regimes reward high-churn breakouts instead of orderly absorption.", "report_contract": "setup_overlay", "ai_supercycle_layer": "ai_chip_equipment_materials_packaging", "supply_chain_hypothesis": "Within source-reviewed CN semicap, materials, and advanced-packaging bottleneck names, orderly float turnover during pullbacks should surface accumulation ahead of public capex/order confirmation.", "relationship_evidence_required": "true", "money_readiness": "research_only", "decision": "revert", "session_branch": "main", "base_ref": "origin/main", "merge_base": "c99187be1dc8d78a84147200981562efcde7b8d5", "head_commit": "c99187be1dc8d78a84147200981562efcde7b8d5"}
{"ts": "2026-05-26T07:23:53.826949+08:00", "session_id": "20260526_062702_4e1ae2", "market": "cn", "formula": "rank(-ts_mean(abs(pct_change(amount,1)),20)) * rank(-ret_5d)", "name": "smooth_amount_pullback_5", "is_ic": 0.0402, "is_ic_ir": 0.21, "is_sharpe": -2.019, "is_turnover": 0.268, "is_monotonicity": 0.1, "gates": "PASS", "status": "kept", "eval_seconds": 216.0, "sleeve_id": "ai_flow_pullback_overlay", "mispricing_source": "T+1 theme traders extrapolate a weak week, while slower institutions keep working multi-week orders with little disruption to notional flow.", "forced_counterparty": "short-horizon retail momentum traders and risk-limited public funds trimming after recent drawdowns", "data_requirements": "[\"daily OHLCV\",\"daily amount\",\"source-reviewed ai_infra universe membership\",\"benchmark beta-hedge and residual-risk attribution ledger\",\"original-source evidence for any optical/CPO beneficiary claim\"]", "failure_mode": "It stops working when smooth amount reflects neglect rather than sponsorship, or when the pullback is caused by real negative evidence on orders, capex, or customer demand.", "report_contract": "setup_overlay", "ai_supercycle_layer": "ai_networking_optical_cpo", "supply_chain_hypothesis": "Candidate D1 optical/CPO bottleneck names that hold smooth notional flow through a 5-day dip are being accumulated for ongoing AI-cluster interconnect build-out rather than abandoned after a narrative spike.", "relationship_evidence_required": "true", "money_readiness": "research_only", "decision": "keep", "session_branch": "main", "base_ref": "origin/main", "merge_base": "c99187be1dc8d78a84147200981562efcde7b8d5", "head_commit": "c99187be1dc8d78a84147200981562efcde7b8d5", "oos": "PASS", "checks_status": "passed"}
{"ts": "2026-05-26T14:56:45.533513+08:00", "session_id": "20260526_140002_5486d2", "market": "cn", "formula": "rank(ts_mean(amount,20)/(ts_std(amount,20)+1))", "name": "amount_persistence_20", "is_ic": 0.0149, "is_ic_ir": 0.099, "is_sharpe": -1.952, "is_turnover": 0.128, "is_monotonicity": -0.15, "gates": "FAIL", "status": "reverted", "eval_seconds": 95.0, "sleeve_id": "daily_flow_accumulation", "mispricing_source": "T+1 trading, thematic rotation, and limited specialist coverage slow the repricing of informed accumulation in bottleneck AI-infra names.", "forced_counterparty": "short-horizon retail sellers and mandate-driven de-riskers reducing exposure during consolidation", "data_requirements": "[\"CN daily bars\",\"daily_basic.amount\",\"portfolio beta-hedge and residual-risk attribution vs 000300.SH/399006.SZ before promotion\"]", "failure_mode": "Stops working when stable amount becomes just a size/liquidity proxy in broad beta melt-ups or when AI leadership narrows into gap-driven event names.", "report_contract": "setup_overlay", "ai_supercycle_layer": "none", "supply_chain_hypothesis": "No single unverified relationship; the signal is meant to surface validated AI-infra bottleneck names being accumulated ahead of fuller fundamental recognition.", "relationship_evidence_required": "false", "money_readiness": "research_only", "decision": "revert", "session_branch": "main", "base_ref": "origin/main", "merge_base": "c99187be1dc8d78a84147200981562efcde7b8d5", "head_commit": "c99187be1dc8d78a84147200981562efcde7b8d5"}
{"ts": "2026-05-26T14:56:45.533513+08:00", "session_id": "20260526_140002_5486d2", "market": "cn", "formula": "rank(ts_mean(turnover_rate,20)/(ts_std(turnover_rate,20)+0.01))", "name": "turnover_stability_20", "is_ic": -0.0357, "is_ic_ir": -0.134, "is_sharpe": -3.408, "is_turnover": 0.133, "is_monotonicity": -0.3, "gates": "FAIL", "status": "reverted", "eval_seconds": 52.1, "sleeve_id": "cn_ai_flow_leadership", "mispricing_source": "Underreaction to persistent accumulation in research-validated AI-infra names; the market overweights noisy price bursts and underweights stable multi-week turnover sponsorship.", "forced_counterparty": "Retail momentum traders and short-horizon liquidity providers who sell into orderly consolidations; benchmarked institutions that cannot instantly move to target weights in mid/liquid A-share AI names.", "data_requirements": "[\"daily OHLCV\",\"amount\",\"turnover_rate\",\"circ_market_cap for cross-checking size bias\",\"benchmark returns for beta-hedged sleeve attribution\",\"existing sleeve correlation matrix\"]", "failure_mode": "Stops working when turnover stability merely reflects crowded consensus ownership, or when policy/liquidity shocks cause broad speculative turnover to dominate stock-specific accumulation.", "report_contract": "setup_overlay", "ai_supercycle_layer": "none", "supply_chain_hypothesis": "none", "relationship_evidence_required": "false", "money_readiness": "research_only", "decision": "revert", "session_branch": "main", "base_ref": "origin/main", "merge_base": "c99187be1dc8d78a84147200981562efcde7b8d5", "head_commit": "c99187be1dc8d78a84147200981562efcde7b8d5"}
