{"ts": "2026-05-27T16:52:40.668961+08:00", "session_id": "20260527_155704_44d2b7", "market": "cn", "formula": "rank(ts_sum(turnover_rate,20) / ts_max(turnover_rate,20))", "name": "turnover_evenness_20", "is_ic": -0.0557, "is_ic_ir": -0.225, "is_sharpe": -3.806, "is_turnover": 0.155, "is_monotonicity": -0.3, "gates": "FAIL", "status": "reverted", "eval_seconds": 252.4, "sleeve_id": "cn_tape_leadership_continuation", "mispricing_source": "The market underreacts to broad, staggered participation and overreacts to single-day theme spikes; this ranks turnover path quality rather than price level, so it is not just another momentum or candlestick variant.", "forced_counterparty": "Short-horizon retail/theme traders and benchmark-constrained funds that chase visible spike days or rebalance slowly under T+1.", "data_requirements": "[\"daily turnover_rate\", \"AI-universe membership metadata\", \"missing for promotion: AI-layer breadth, source-reviewed filings/press releases for any supplier-order thesis, beta-hedged sleeve attribution\"]", "failure_mode": "It stops working when even turnover reflects neglect/illiquidity instead of accumulation, or when the whole AI-infra tape shifts into one-day speculative burst regimes.", "report_contract": "setup_overlay", "ai_supercycle_layer": "ai_chip_equipment_materials_packaging", "supply_chain_hypothesis": "Domestic packaging, testing, and semiconductor-equipment bottleneck names tied to advanced-packaging capacity expansion should show smoother multi-day turnover absorption before public order evidence is fully recognized.", "relationship_evidence_required": "true", "money_readiness": "research_only", "decision": "revert", "session_branch": "main", "base_ref": "origin/main", "merge_base": "71f9dffaddd84ccee1dd8922a9e618b8a3724187", "head_commit": "71f9dffaddd84ccee1dd8922a9e618b8a3724187"}
{"ts": "2026-05-27T16:52:40.668961+08:00", "session_id": "20260527_155704_44d2b7", "market": "cn", "formula": "rank(-ts_corr(ret_1d,shift(ret_1d,1),40))*rank(-ts_std(pct_change(amount,5),20))", "name": "anti_autocorr_amtgrowth_20_40", "is_ic": 0.0277, "is_ic_ir": 0.173, "is_sharpe": -0.507, "is_turnover": 0.13, "is_monotonicity": 0.2, "gates": "FAIL", "status": "reverted", "eval_seconds": 232.9, "sleeve_id": "cn_ai_accumulation_path", "mispricing_source": "The market underreacts to stealth accumulation because daily price action looks noisy and mean-reverting, so stable flow quality is not fully capitalized into next-horizon returns.", "forced_counterparty": "Retail event-chasers and T+1 weak hands fading moves; benchmarked managers who cannot build AI-infra positions quickly without impact.", "data_requirements": "[\"daily amount and ret_1d are sufficient for IS test\",\"beta-hedged sleeve attribution vs 000300.SH and 399006.SZ\",\"corr report vs promoted factors\",\"for bottleneck interpretation: filings, backlog/capex, and official supplier/customer sources\"]", "failure_mode": "It should weaken or invert in policy-blast breakout regimes where returns trend instead of mean-revert, or when smooth amount simply reflects low liquidity rather than accumulation.", "report_contract": "setup_overlay", "ai_supercycle_layer": "ai_chip_equipment_materials_packaging", "supply_chain_hypothesis": "Candidate domestic AI equipment/materials/packaging bottleneck names may be accumulated ahead of verified order or capex evidence.", "relationship_evidence_required": "true", "money_readiness": "research_only", "decision": "revert", "session_branch": "main", "base_ref": "origin/main", "merge_base": "71f9dffaddd84ccee1dd8922a9e618b8a3724187", "head_commit": "71f9dffaddd84ccee1dd8922a9e618b8a3724187"}
{"ts": "2026-05-27T16:52:40.668961+08:00", "session_id": "20260527_155704_44d2b7", "market": "cn", "formula": "rank(-ts_corr(ret_5d, delta(amount/circ_market_cap,5),20))", "name": "weekly_floatflow_absorb_20", "is_ic": 0.0109, "is_ic_ir": 0.032, "is_sharpe": -1.14, "is_turnover": 0.138, "is_monotonicity": -0.3, "gates": "FAIL", "status": "reverted", "eval_seconds": 184.6, "sleeve_id": "cn_ai_flow_absorption", "mispricing_source": "Slow information diffusion and benchmark/risk constraints let patient buyers accumulate D1-D3 AI names without immediate price confirmation.", "forced_counterparty": "retail theme-chasers and benchmark-constrained PMs", "data_requirements": "[\"daily amount\",\"circ_market_cap\",\"ret_5d\",\"existing-sleeve correlation check\",\"beta-hedged sleeve attribution\",\"residual risk attribution\",\"ai_infra source-review status for any supply-chain narrative\"]", "failure_mode": "It should fail in broad policy-beta melt-ups or retail momentum frenzies where price immediately follows flow and negative flow/return divergence no longer marks informed accumulation.", "report_contract": "setup_overlay", "ai_supercycle_layer": "none", "supply_chain_hypothesis": "Quiet float-flow absorption may surface unresolved D1-D3 AI bottleneck beneficiaries before filings or official customer/supplier evidence are promoted in the ledger.", "relationship_evidence_required": "true", "money_readiness": "research_only", "decision": "revert", "session_branch": "main", "base_ref": "origin/main", "merge_base": "71f9dffaddd84ccee1dd8922a9e618b8a3724187", "head_commit": "71f9dffaddd84ccee1dd8922a9e618b8a3724187"}
{"ts": "2026-05-27T16:52:40.668961+08:00", "session_id": "20260527_155704_44d2b7", "market": "cn", "formula": "rank(ts_mean(amount,20)/ts_std(amount,20))*rank(-delta(turnover_rate,10))", "name": "amount_stability_turn_decay_20", "is_ic": -0.0355, "is_ic_ir": -0.124, "is_sharpe": -5.002, "is_turnover": 0.417, "is_monotonicity": -0.8, "gates": "FAIL", "status": "reverted", "eval_seconds": 122.9, "sleeve_id": "cn_ai_inventory_absorption", "mispricing_source": "A-share attention rotates faster than institutional accumulation; daily screens underprice inventory tightening when money stays steady but float churn fades.", "forced_counterparty": "Short-horizon retail traders and benchmark-aware funds that de-risk lagging names after excitement fades and cannot warehouse inventory patiently.", "data_requirements": "[\"daily amount\",\"turnover_rate\",\"AI universe membership/BFS metadata\",\"benchmark returns (000300.SH, 399006.SZ) for beta-hedged sleeve attribution\",\"existing sleeve correlation panel\"]", "failure_mode": "It breaks when falling turnover reflects disappearing demand or liquidity withdrawal rather than strong-hand absorption, especially during sector-wide deleveraging.", "report_contract": "setup_overlay", "ai_supercycle_layer": "ai_chip_equipment_materials_packaging", "supply_chain_hypothesis": "Domestic semiconductor equipment/materials/packaging suppliers with steady cash turnover but declining float churn may be upstream bottlenecks being accumulated ahead of verified capex and localization orders.", "relationship_evidence_required": "true", "money_readiness": "research_only", "decision": "revert", "session_branch": "main", "base_ref": "origin/main", "merge_base": "71f9dffaddd84ccee1dd8922a9e618b8a3724187", "head_commit": "71f9dffaddd84ccee1dd8922a9e618b8a3724187"}
{"ts": "2026-05-27T16:52:40.668961+08:00", "session_id": "20260527_155704_44d2b7", "market": "cn", "formula": "rank(-ts_std(amount,20))*rank(ret_5d-ret_20d)", "name": "amount_stable_rebound_gap", "is_ic": 0.0519, "is_ic_ir": 0.236, "is_sharpe": 0.762, "is_turnover": 0.163, "is_monotonicity": 0.5, "gates": "PASS", "status": "kept", "eval_seconds": 80.9, "sleeve_id": "cn_ai_infra_tape_reentry", "mispricing_source": "A-share theme traders extrapolate the prior 20-day weakness, while stable成交额 suggests float is not being aggressively dumped and stronger hands are absorbing supply before the next leg.", "forced_counterparty": "short-horizon retail/theme chasers and funds forced to de-risk after recent underperformance", "data_requirements": "[\"current CN daily price/volume/daily_basic data is sufficient for IS test\", \"benchmark hedge and residual-risk attribution ledger required before promotion to production\"]", "failure_mode": "It should fail when the 20-day weakness is driven by real fundamental impairment, policy shock, or broad deleveraging, because stable amount then reflects absent demand rather than absorption.", "report_contract": "setup_overlay", "ai_supercycle_layer": "none", "supply_chain_hypothesis": "none", "relationship_evidence_required": "false", "money_readiness": "research_only", "decision": "keep", "session_branch": "main", "base_ref": "origin/main", "merge_base": "71f9dffaddd84ccee1dd8922a9e618b8a3724187", "head_commit": "71f9dffaddd84ccee1dd8922a9e618b8a3724187", "oos": "PASS", "checks_status": "passed"}
{"ts": "2026-05-28T07:22:55.044373+08:00", "session_id": "20260528_062703_a5bf9c", "market": "cn", "formula": "rank(-ts_std(turnover_rate,20))*rank(-ps_ttm)", "name": "stable_turnover_low_ps", "is_ic": 0.0072, "is_ic_ir": 0.018, "is_sharpe": -2.127, "is_turnover": 0.052, "is_monotonicity": -0.05, "gates": "FAIL", "status": "reverted", "eval_seconds": 128.8, "sleeve_id": "cn_ai_infra_repricing", "mispricing_source": "Narrative-chasing capital overpays for liquid AI concept leaders, while quieter low-PS suppliers with stable holders are repriced only after order and capex evidence diffuses through the market.", "forced_counterparty": "Benchmark-aware PMs and retail theme traders concentrated in high-liquidity, high-multiple leaders; mandate and crowding constraints keep them from owning second-line suppliers until late.", "data_requirements": "[\"turnover_rate\",\"ps_ttm\",\"ai_infra BFS layer/module tags\",\"benchmark hedge series for 000300.SH and 399006.SZ\",\"correlation check vs promoted sleeves and amount_stability_20\",\"source-reviewed backlog/order/capex evidence before production promotion\"]", "failure_mode": "This stops working when the AI tape is in a pure momentum melt-up and expensive leaders keep absorbing all flows, or when low turnover reflects weak demand and the low-PS name is a value trap.", "report_contract": "research_only", "ai_supercycle_layer": "ai_chip_equipment_materials_packaging", "supply_chain_hypothesis": "Under-owned CN equipment, materials, and advanced packaging names with stable ownership are late-cycle bottleneck beneficiaries of upstream AI compute and datacenter capex.", "relationship_evidence_required": "true", "money_readiness": "research_only", "decision": "revert", "session_branch": "main", "base_ref": "origin/main", "merge_base": "83848153d53e89b19c687fcb9440d135d63e22a2", "head_commit": "83848153d53e89b19c687fcb9440d135d63e22a2"}
{"ts": "2026-05-28T07:22:55.044373+08:00", "session_id": "20260528_062703_a5bf9c", "market": "cn", "formula": "rank(-ts_std(amount, 20) / (ts_mean(amount, 20) + 1))", "name": "amount_stability_cv20", "is_ic": 0.0149, "is_ic_ir": 0.099, "is_sharpe": -1.952, "is_turnover": 0.128, "is_monotonicity": -0.15, "gates": "FAIL", "status": "reverted", "eval_seconds": 55.7, "sleeve_id": "cn_ai_flow_accumulation", "mispricing_source": "A-share retail capital overpays for attention bursts and underreacts to quiet sponsorship; stable amount can surface accumulation before order/backlog evidence is fully reflected in price.", "forced_counterparty": "retail momentum chasers and short-horizon liquidity sellers rotating out of low-excitement names", "data_requirements": "[\"daily amount history\", \"benchmark-hedged return attribution vs 000300.SH/399006.SZ\", \"correlation check against existing amount_stability family\", \"ai_infra source-review status for promotion\"]", "failure_mode": "Fails in rumor-driven squeeze regimes where unstable high-turnover names lead, or when suspensions/liquidity shocks distort amount stability.", "report_contract": "setup_overlay", "ai_supercycle_layer": "ai_chip_equipment_materials_packaging", "supply_chain_hypothesis": "Domestic AI semiconductor equipment/materials/packaging bottleneck names are accumulated steadily before verified capex and order evidence becomes consensus.", "relationship_evidence_required": "true", "money_readiness": "research_only", "decision": "revert", "session_branch": "main", "base_ref": "origin/main", "merge_base": "83848153d53e89b19c687fcb9440d135d63e22a2", "head_commit": "83848153d53e89b19c687fcb9440d135d63e22a2"}
{"ts": "2026-05-28T07:22:55.044373+08:00", "session_id": "20260528_062703_a5bf9c", "market": "cn", "formula": "rank(ts_mean(volume_ratio,20))*rank(-ts_std(turnover_rate,20))", "name": "steady_flow_accumulation_20", "is_ic": -0.0502, "is_ic_ir": -0.202, "is_sharpe": -5.144, "is_turnover": 0.1, "is_monotonicity": -0.2, "gates": "FAIL", "status": "reverted", "eval_seconds": 100.0, "sleeve_id": "cn_ai_flow_overlay", "mispricing_source": "Slow accumulation ahead of filings, capex confirmation, or order evidence; price impact is delayed because quiet retail supply and benchmarked funds still provide liquidity during the build phase.", "forced_counterparty": "Retail profit-takers and benchmark-constrained mutual funds that cannot fully front-run unconfirmed AI-capex themes.", "data_requirements": "[\"current daily price/volume/daily_basic is sufficient for IS test\",\"beta-hedged sleeve return and residual risk attribution\",\"correlation vs promoted sleeves\",\"source-review evidence for any implied supplier/customer interpretation\"]", "failure_mode": "Fails when high relative activity becomes pure crowded-theme chasing, or when policy/earnings shocks dominate so turnover stability no longer indicates informed accumulation.", "report_contract": "setup_overlay", "ai_supercycle_layer": "ai_chip_equipment_materials_packaging", "supply_chain_hypothesis": "Domestic AI compute capex should pull through to local chip-equipment, materials, packaging, and test names; steady relative-volume accumulation may surface those bottleneck beneficiaries before original-source order evidence is public.", "relationship_evidence_required": "true", "money_readiness": "research_only", "decision": "revert", "session_branch": "main", "base_ref": "origin/main", "merge_base": "83848153d53e89b19c687fcb9440d135d63e22a2", "head_commit": "83848153d53e89b19c687fcb9440d135d63e22a2"}
{"ts": "2026-05-28T07:22:55.044373+08:00", "session_id": "20260528_062703_a5bf9c", "market": "cn", "formula": "rank(ts_mean(amount/circ_market_cap,20)/ts_std(amount/circ_market_cap,20))*rank(-ret_5d)", "name": "stable_float_pullback_5", "is_ic": -0.0176, "is_ic_ir": -0.066, "is_sharpe": -3.115, "is_turnover": 0.269, "is_monotonicity": -0.5, "gates": "FAIL", "status": "reverted", "eval_seconds": 185.4, "sleeve_id": "cn_ai_accumulation_pullback", "mispricing_source": "Short-horizon A-share traders dump recent losers, while slower real-money accumulation in AI bottleneck names keeps float-adjusted flow unusually orderly and the tape mean-reverts over the next 10-20 days.", "forced_counterparty": "T+1 retail swing traders, momentum tourists, and fast-money pods cutting exposure into 1-week drawdowns.", "data_requirements": "[\"daily amount\",\"circ_market_cap\",\"ret_5d\",\"source-reviewed AI universe membership\",\"for promotion: sleeve correlation matrix, beta-hedged attribution, and original-source evidence for any claimed supply-chain link\"]", "failure_mode": "It fails when the AI theme shifts into broad de-rating or panic liquidation, because stable flow no longer means absorption and pullbacks become value traps.", "report_contract": "setup_overlay", "ai_supercycle_layer": "ai_chip_equipment_materials_packaging", "supply_chain_hypothesis": "Candidate upstream bottleneck suppliers to accelerator, memory, and packaging build-outs show steady float absorption during short pullbacks before backlog/order evidence is fully recognized.", "relationship_evidence_required": "true", "money_readiness": "research_only", "decision": "revert", "session_branch": "main", "base_ref": "origin/main", "merge_base": "83848153d53e89b19c687fcb9440d135d63e22a2", "head_commit": "83848153d53e89b19c687fcb9440d135d63e22a2"}
{"ts": "2026-05-28T07:22:55.044373+08:00", "session_id": "20260528_062703_a5bf9c", "market": "cn", "formula": "rank(ts_corr(volume_ratio, shift(volume_ratio, 5), 20)) * rank(-ret_20d)", "name": "weekly_relvol_pullback_20", "is_ic": 0.0523, "is_ic_ir": 0.278, "is_sharpe": -0.085, "is_turnover": 0.203, "is_monotonicity": 0.4, "gates": "PASS", "status": "reverted", "eval_seconds": 167.3, "sleeve_id": "cn_ai_accumulation_pullback", "mispricing_source": "Short-horizon traders dump recent laggards, but institutions often build AI-theme positions in repeated weekly clips; price looks weak while ownership quality improves, so the cross-section underprices the persistence of that flow.", "forced_counterparty": "Retail momentum traders and benchmark-constrained mutual funds trimming crowded AI names after drawdowns.", "data_requirements": "[\"daily close/volume_ratio/ret_20d\", \"AI universe membership and source-review status\", \"beta-hedged sleeve attribution and factor-correlation checks\", \"original sources/filings before asserting any supplier or customer relationship\"]", "failure_mode": "It stops working when recurring weekly abnormal participation is distribution rather than accumulation, or when the market regime rewards straight-line momentum and keeps punishing pullbacks.", "report_contract": "setup_overlay", "ai_supercycle_layer": "ai_datacenter_edge_infra", "supply_chain_hypothesis": "Candidate datacenter and network buildout beneficiaries may show repeated weekly abnormal participation during 20-day pullbacks before backlog or capex evidence is fully reflected in price.", "relationship_evidence_required": "true", "money_readiness": "research_only", "decision": "revert", "session_branch": "main", "base_ref": "origin/main", "merge_base": "83848153d53e89b19c687fcb9440d135d63e22a2", "head_commit": "83848153d53e89b19c687fcb9440d135d63e22a2", "oos": "FAIL", "checks_status": "skipped"}
{"ts": "2026-05-28T07:22:55.044373+08:00", "session_id": "20260528_062703_a5bf9c", "market": "cn", "formula": "rank(ts_mean(volume_ratio,5)/(ts_std(volume_ratio,20)+0.01))*rank(-ret_20d)", "name": "stable_relvol_pullback_20", "is_ic": 0.0446, "is_ic_ir": 0.24, "is_sharpe": -0.212, "is_turnover": 0.177, "is_monotonicity": 0.4, "gates": "PASS", "status": "kept", "eval_seconds": 170.0, "sleeve_id": "cn_ai_flow_pullback", "mispricing_source": "Retail/theme traders and benchmarked funds de-risk into drawdowns, while slower capital accumulates bottleneck AI names in an orderly way; the relative-volume stability term is intended to keep this distinct from plain reversal.", "forced_counterparty": "Short-horizon retail momentum accounts, margin-constrained sellers, and passive/benchmark rebalancers", "data_requirements": "[\"Current CN daily price/volume data is sufficient for IS testing\", \"Need beta-hedged sleeve return, residual risk attribution, and correlation vs promoted sleeves before promotion\"]", "failure_mode": "It stops working when elevated relative volume is distribution rather than absorption, or when policy/liquidity shocks turn orderly pullbacks into true trend breaks.", "report_contract": "setup_overlay", "ai_supercycle_layer": "ai_chip_equipment_materials_packaging", "supply_chain_hypothesis": "Domestic-substitution bottleneck names in equipment/materials/packaging should show orderly high-attention pullbacks when long-horizon capital absorbs supply ahead of capex and order repricing.", "relationship_evidence_required": "true", "money_readiness": "research_only", "decision": "keep", "session_branch": "main", "base_ref": "origin/main", "merge_base": "83848153d53e89b19c687fcb9440d135d63e22a2", "head_commit": "83848153d53e89b19c687fcb9440d135d63e22a2", "oos": "PASS", "checks_status": "passed"}
{"ts": "2026-05-28T07:22:55.044373+08:00", "session_id": "20260528_062703_a5bf9c", "market": "cn", "formula": "rank(ts_min(turnover_rate,20)/ts_mean(turnover_rate,20))*rank(-ret_5d)", "name": "turnover_floor_pullback_20", "is_ic": -0.0075, "is_ic_ir": -0.038, "is_sharpe": -3.365, "is_turnover": 0.286, "is_monotonicity": 0.1, "gates": "FAIL", "status": "reverted", "eval_seconds": 136.4, "sleeve_id": "cn_ai_flow_pullback", "mispricing_source": "Benchmarked long-only funds and retail momentum traders often sell 5-day weakness mechanically, while informed capital accumulates AI-infra leaders without letting turnover fully dry up; the market underreacts to that absorption.", "forced_counterparty": "Retail dip-sellers, short-horizon momentum accounts, and benchmark-constrained funds de-risking on recent weakness", "data_requirements": "No extra data for IS test beyond listed CN daily features; for promotion require beta-hedged sleeve attribution, residual risk attribution, and correlation vs existing sleeves inside the validated AI universe.", "failure_mode": "Breaks in liquidation regimes where high turnover floor reflects distribution rather than sponsorship, or in spike-driven mania where winners are led by fresh crowding instead of orderly accumulation.", "report_contract": "action_overlay", "ai_supercycle_layer": "none", "supply_chain_hypothesis": "Candidate bottleneck names inside the validated CN AI-infra universe may show pullback absorption before source-confirmed order or capacity news; no specific supplier/customer claim is made from daily data alone.", "relationship_evidence_required": "true", "money_readiness": "research_only", "decision": "revert", "session_branch": "main", "base_ref": "origin/main", "merge_base": "83848153d53e89b19c687fcb9440d135d63e22a2", "head_commit": "83848153d53e89b19c687fcb9440d135d63e22a2"}
