{"ts": "2026-05-12T06:57:50.072917+08:00", "session_id": "20260512_060001_b3afec", "market": "cn", "formula": "rank(-ts_mean(abs(delta(turnover_rate,5)),20)/(ts_mean(turnover_rate,20)+0.01))*rank(-ts_max(ret_1d,20))", "name": "low_lottery_turnover_drift_smooth_20", "is_ic": 0.0425, "is_ic_ir": 0.271, "is_sharpe": 0.417, "is_turnover": 0.101, "is_monotonicity": -0.05, "gates": "PASS", "status": "checks_failed", "eval_seconds": 153.5, "sleeve_id": "daily_flow_underreaction", "mispricing_source": "participation-path smoothness plus anti-lottery screening; this targets quiet accumulation and attention scarcity, not the existing close-volume correlation sleeve", "forced_counterparty": "retail punters chasing recent jackpot names; benchmark-constrained managers who only add after liquidity/price confirmation", "data_requirements": "[\"turnover_rate\",\"ret_1d\"]", "failure_mode": "speculative melt-up or policy-driven microcap mania where recent spike names keep outperforming and smooth-flow names are left behind", "report_contract": "fresh_buy_gate", "money_readiness": "money_candidate", "decision": "revert", "session_branch": "main", "base_ref": "origin/main", "merge_base": "62e27b1718a9c8c7cee619126770fe57cd98d173", "head_commit": "62e27b1718a9c8c7cee619126770fe57cd98d173", "oos": "PASS", "checks_status": "failed"}
{"ts": "2026-05-12T06:57:50.072917+08:00", "session_id": "20260512_060001_b3afec", "market": "cn", "formula": "rank(-ts_corr(amount, abs(ret_1d),20)) * rank(-ts_std(amount,20)/ts_mean(amount,20))", "name": "amount_absret_disconnect_20", "is_ic": 0.0332, "is_ic_ir": 0.445, "is_sharpe": 2.25, "is_turnover": 0.153, "is_monotonicity": 0.55, "gates": "PASS", "status": "candidate", "eval_seconds": 118.1, "sleeve_id": "steady_flow_absorption", "mispricing_source": "Attention-driven traders overpay for names where liquidity only appears during exciting moves; boring, steadily sponsored names are under-owned and reprice slowly.", "forced_counterparty": "Retail theme-chasers and short-horizon desks that must demand immediacy on volatile days.", "data_requirements": "[\"amount\",\"ret_1d\"]; daily cross-sectional ranking, intended for beta-hedged portfolio construction", "failure_mode": "Fails when volatile high-amount days carry genuine information instead of noise, or when policy/theme regimes reward speculative crowding faster than steady-flow names can rerate.", "report_contract": "fresh_buy_gate", "money_readiness": "money_candidate", "decision": "candidate", "session_branch": "main", "base_ref": "origin/main", "merge_base": "62e27b1718a9c8c7cee619126770fe57cd98d173", "head_commit": "62e27b1718a9c8c7cee619126770fe57cd98d173"}
{"ts": "2026-05-12T06:57:50.072917+08:00", "session_id": "20260512_060001_b3afec", "market": "cn", "formula": "rank(ts_mean(ts_sum(volume_ratio,5),20)/ts_max(ts_sum(volume_ratio,5),20))*rank(ts_mean((close-open)/(high-low+0.01),20))", "name": "weekly_relvol_body_bias_20", "is_ic": 0.0303, "is_ic_ir": 0.185, "is_sharpe": 0.65, "is_turnover": 0.161, "is_monotonicity": 0.85, "gates": "FAIL", "status": "reverted", "eval_seconds": 294.5, "sleeve_id": "daily_participation_absorption", "mispricing_source": "Slow diffusion of participation-path information; this is even relative-attention plus close-location, not a raw momentum/reversal or close-volume-correlation clone.", "forced_counterparty": "retail attention traders chasing bursty tapes; benchmarked or redemption-constrained long-only funds supplying stock for mandate/liquidity reasons", "data_requirements": "[\"volume_ratio\",\"open\",\"close\",\"high\",\"low\"]", "failure_mode": "Fails in policy/headline breakout regimes where bursty relative volume is genuinely informative, or when even relative volume mostly identifies dead liquidity instead of patient accumulation.", "report_contract": "fresh_buy_gate", "money_readiness": "money_candidate", "decision": "revert", "session_branch": "main", "base_ref": "origin/main", "merge_base": "62e27b1718a9c8c7cee619126770fe57cd98d173", "head_commit": "62e27b1718a9c8c7cee619126770fe57cd98d173"}
{"ts": "2026-05-12T06:57:50.072917+08:00", "session_id": "20260512_060001_b3afec", "market": "cn", "formula": "rank(-ts_corr(ret_1d,shift(ret_1d,1),20))*rank(ts_min(ts_sum(amount/circ_market_cap,5),20)/ts_std(ts_sum(amount/circ_market_cap,5),20))", "name": "anti_autocorr_weekly_float_floorstd_20", "is_ic": 0.0367, "is_ic_ir": 0.44, "is_sharpe": 3.947, "is_turnover": 0.151, "is_monotonicity": 0.6, "gates": "PASS", "status": "candidate", "eval_seconds": 166.8, "sleeve_id": "anti_autocorr_float_absorption", "mispricing_source": "Short-horizon price pressure gets overreacted to, while steady float-aware participation is underpriced; this is a flow-shape signal, not a close-volume correlation clone.", "forced_counterparty": "retail attention traders, redemption-driven long-only sellers, benchmark/rebalance-constrained funds", "data_requirements": "[\"ret_1d\",\"amount\",\"circ_market_cap\"]; daily data is enough for research, but intraday/member-level flow would be needed before money-ready deployment to verify true absorption vs passive churn", "failure_mode": "Fails in policy/theme momentum regimes where positive return autocorrelation is informative, or when smooth float flow mostly reflects dead illiquidity/passive index flow rather than real accumulation.", "report_contract": "fresh_buy_gate", "money_readiness": "money_candidate", "decision": "candidate", "session_branch": "main", "base_ref": "origin/main", "merge_base": "62e27b1718a9c8c7cee619126770fe57cd98d173", "head_commit": "62e27b1718a9c8c7cee619126770fe57cd98d173"}
{"ts": "2026-05-12T06:57:50.072917+08:00", "session_id": "20260512_060001_b3afec", "market": "cn", "formula": "rank(-ts_corr(delta(turnover_rate,5), abs(ret_1d), 20))", "name": "weekly_turnover_impact_disconnect_20", "is_ic": 0.0002, "is_ic_ir": 0.049, "is_sharpe": -3.371, "is_turnover": 0.178, "is_monotonicity": 0.05, "gates": "FAIL", "status": "reverted", "eval_seconds": 174.1, "sleeve_id": "daily_flow_absorption", "mispricing_source": "This is a flow-to-impact elasticity signal, not a raw price/volume trend signal; it measures whether turnover shocks are being absorbed with muted price response, which should be less correlated with the promoted `ts_corr(close, volume, n)` family.", "forced_counterparty": "retail liquidity-demanders, redemption-driven mutual funds, benchmarked managers rebalancing to flows", "data_requirements": "[\"turnover_rate\", \"ret_1d\"]", "failure_mode": "It should stop working in broad momentum or limit-up/limit-down tapes where turnover shocks convert immediately into price movement and the absorption lag disappears.", "report_contract": "fresh_buy_gate", "money_readiness": "money_candidate", "decision": "revert", "session_branch": "main", "base_ref": "origin/main", "merge_base": "62e27b1718a9c8c7cee619126770fe57cd98d173", "head_commit": "62e27b1718a9c8c7cee619126770fe57cd98d173"}
{"ts": "2026-05-12T06:57:50.072917+08:00", "session_id": "20260512_060001_b3afec", "market": "cn", "formula": "rank(-ts_corr(ret_1d,shift(ret_1d,1),20))*rank(ts_min(amount/circ_market_cap,20)/ts_std(amount/circ_market_cap,20))", "name": "anti_autocorr_float_floorratio_20", "is_ic": 0.0404, "is_ic_ir": 0.497, "is_sharpe": 4.206, "is_turnover": 0.167, "is_monotonicity": 0.45, "gates": "PASS", "status": "candidate", "eval_seconds": 158.1, "sleeve_id": "daily_flow_underreaction", "mispricing_source": "Slow diffusion of steady sponsorship and inventory absorption; unlike close-volume correlation factors, this targets persistent float-adjusted participation floors with a two-sided tape rather than raw price-volume comovement.", "forced_counterparty": "Retail theme-chasers and benchmark-constrained institutions that must trade for liquidity/rebalancing rather than alpha maximization", "data_requirements": "[\"ret_1d\",\"amount\",\"circ_market_cap\"]", "failure_mode": "Fails in one-way momentum or policy-beta regimes where negative autocorrelation stops signaling absorption and instead marks stagnant or structurally illiquid names.", "report_contract": "fresh_buy_gate", "money_readiness": "money_candidate", "decision": "candidate", "session_branch": "main", "base_ref": "origin/main", "merge_base": "62e27b1718a9c8c7cee619126770fe57cd98d173", "head_commit": "62e27b1718a9c8c7cee619126770fe57cd98d173"}
{"ts": "2026-05-12T06:57:50.072917+08:00", "session_id": "20260512_060001_b3afec", "market": "cn", "formula": "rank(-ts_corr(ret_1d,shift(ret_1d,1),20))*rank(-ts_std(delta(log(amount),5),20))", "name": "anti_autocorr_weekly_logamt_stability_20", "is_ic": 0.0416, "is_ic_ir": 0.454, "is_sharpe": 2.982, "is_turnover": 0.156, "is_monotonicity": 0.1, "gates": "PASS", "status": "checks_failed", "eval_seconds": 207.7, "sleeve_id": "daily_flow_underreaction", "mispricing_source": "Temporary retail-driven return reversals coexist with steady sponsor flow; the signal keys off flow-path stability rather than raw price momentum, so it should diversify existing close-volume-corr factors.", "forced_counterparty": "Retail attention traders and benchmarked long-only managers executing mandated flow windows rather than optimizing residual value.", "data_requirements": "[\"ret_1d\",\"amount\"]", "failure_mode": "It should fade in strong trend or policy-shock regimes where negative daily autocorrelation disappears and smooth amount paths reflect consensus crowding rather than quiet absorption.", "report_contract": "fresh_buy_gate", "money_readiness": "money_candidate", "decision": "revert", "session_branch": "main", "base_ref": "origin/main", "merge_base": "62e27b1718a9c8c7cee619126770fe57cd98d173", "head_commit": "62e27b1718a9c8c7cee619126770fe57cd98d173", "oos": "PASS", "checks_status": "failed"}
{"ts": "2026-05-12T06:57:50.072917+08:00", "session_id": "20260512_060001_b3afec", "market": "cn", "formula": "rank(-ts_corr(abs(ret_1d),amount,20))*rank(ts_mean(amount,20)/ts_max(amount,20))", "name": "amount_absret_evenness_20", "is_ic": 0.0275, "is_ic_ir": 0.386, "is_sharpe": 0.457, "is_turnover": 0.157, "is_monotonicity": 0.35, "gates": "PASS", "status": "candidate", "eval_seconds": 214.2, "sleeve_id": "daily_flow_absorption", "mispricing_source": "Hidden accumulation with low price impact; this is a flow-shape signal, not a close-volume correlation clone.", "forced_counterparty": "Retail lottery traders avoid dull names; benchmarked or liquidity-needing holders sell inventory gradually into steady bids.", "data_requirements": "[\"amount\",\"ret_1d\"]", "failure_mode": "Breaks when leadership shifts to high-attention, bursty speculative names where price-insensitive chasing dominates steady accumulation.", "report_contract": "research_only", "money_readiness": "research_only", "decision": "candidate", "session_branch": "main", "base_ref": "origin/main", "merge_base": "62e27b1718a9c8c7cee619126770fe57cd98d173", "head_commit": "62e27b1718a9c8c7cee619126770fe57cd98d173"}
{"ts": "2026-05-12T06:57:50.072917+08:00", "session_id": "20260512_060001_b3afec", "market": "cn", "formula": "rank(-ts_corr(ret_1d,shift(ret_1d,1),20))*rank(ts_mean(ts_sum(volume_ratio,5),20)/ts_max(ts_sum(volume_ratio,5),20))", "name": "anti_autocorr_weekly_relvol_evenness_20", "is_ic": 0.0362, "is_ic_ir": 0.466, "is_sharpe": 2.861, "is_turnover": 0.162, "is_monotonicity": 0.3, "gates": "PASS", "status": "candidate", "eval_seconds": 198.6, "sleeve_id": "daily_flow_underreaction", "mispricing_source": "Attention-driven traders overpay for bursty high-relvol names, leaving steady-participation names underowned even when supply is being absorbed.", "forced_counterparty": "retail theme chasers and liquidity-motivated short-horizon sellers", "data_requirements": "[\"ret_1d\",\"volume_ratio\"]", "failure_mode": "Fails in broad speculative breakout regimes where bursty relative-volume expansion is rewarded and smooth participation stops signaling hidden accumulation.", "report_contract": "fresh_buy_gate", "money_readiness": "money_candidate", "decision": "candidate", "session_branch": "main", "base_ref": "origin/main", "merge_base": "62e27b1718a9c8c7cee619126770fe57cd98d173", "head_commit": "62e27b1718a9c8c7cee619126770fe57cd98d173"}
{"ts": "2026-05-12T06:57:50.072917+08:00", "session_id": "20260512_060001_b3afec", "market": "cn", "formula": "rank(-ts_max(ret_1d,20))*rank(ts_mean((close-open)/(high-low+0.01),20))", "name": "low_lottery_body_bias_20", "is_ic": 0.0407, "is_ic_ir": 0.212, "is_sharpe": -0.903, "is_turnover": 0.146, "is_monotonicity": 0.0, "gates": "PASS", "status": "candidate", "eval_seconds": 193.2, "sleeve_id": "behavioral_underreaction_body", "mispricing_source": "Salience/lottery preference plus slow recognition of close-location buying pressure; this is a price-path quality sleeve, not a close-volume-correlation or raw range-volatility clone.", "forced_counterparty": "Benchmark/rebalance and redemption-constrained long-only funds supplying stock for liquidity or mandate reasons; retail lottery chasers are the uneconomic mirror crowd in high-salience names.", "data_requirements": "[\"ret_1d\",\"open\",\"close\",\"high\",\"low\"]; daily data is sufficient for research and beta-hedged portfolio construction.", "failure_mode": "Breaks in policy/theme momentum or squeeze regimes where high-attention jump names keep leading, or when positive body bias reflects illiquid marking-up rather than real accumulation.", "report_contract": "fresh_buy_gate", "money_readiness": "money_candidate", "decision": "candidate", "session_branch": "main", "base_ref": "origin/main", "merge_base": "62e27b1718a9c8c7cee619126770fe57cd98d173", "head_commit": "62e27b1718a9c8c7cee619126770fe57cd98d173"}
{"ts": "2026-05-12T06:57:50.072917+08:00", "session_id": "20260512_060001_b3afec", "market": "cn", "formula": "rank(ts_min(ts_sum(amount/circ_market_cap,5),20)/ts_std(ts_sum(amount/circ_market_cap,5),20))*rank(ts_mean(ts_sum(volume_ratio,5),20)/ts_max(ts_sum(volume_ratio,5),20))", "name": "float_support_relvol_even_20", "is_ic": 0.0296, "is_ic_ir": 0.299, "is_sharpe": 1.238, "is_turnover": 0.102, "is_monotonicity": 0.7, "gates": "PASS", "status": "candidate", "eval_seconds": 244.0, "sleeve_id": "weekly_float_flow_quality", "mispricing_source": "Slow underreaction to steady float-aware sponsorship and overreaction to bursty attention; this is a pure flow-shape sleeve, not a close-volume-correlation clone.", "forced_counterparty": "retail attention traders; benchmark/rebalance/redemption-constrained long-only funds supplying stock for non-alpha reasons", "data_requirements": "[\"amount\",\"circ_market_cap\",\"volume_ratio\"]; daily beta hedge and residual risk model for portfolio construction; intraday/member flow is helpful before money-ready deployment", "failure_mode": "Fails when smooth participation mainly reflects dead illiquidity or passive churn, or in policy/theme regimes where bursty high-attention names keep leading.", "report_contract": "fresh_buy_gate", "money_readiness": "money_candidate", "decision": "candidate", "session_branch": "main", "base_ref": "origin/main", "merge_base": "62e27b1718a9c8c7cee619126770fe57cd98d173", "head_commit": "62e27b1718a9c8c7cee619126770fe57cd98d173"}
{"ts": "2026-05-12T06:57:50.072917+08:00", "session_id": "20260512_060001_b3afec", "market": "cn", "formula": "rank(ts_min(ts_sum(amount/circ_market_cap,5),20)/ts_std(ts_sum(amount/circ_market_cap,5),20))*rank(ts_mean(ts_sum(turnover_rate,5),20)/ts_max(ts_sum(turnover_rate,5),20))", "name": "float_floorstd_turnover_even_20", "is_ic": 0.0281, "is_ic_ir": 0.29, "is_sharpe": 1.061, "is_turnover": 0.107, "is_monotonicity": 0.95, "gates": "PASS", "status": "candidate", "eval_seconds": 242.5, "sleeve_id": "weekly_float_share_absorption", "mispricing_source": "Slow underreaction to steady float-scaled absorption; this is a participation-shape sleeve, not a close-volume-correlation or naked reversal clone.", "forced_counterparty": "Retail attention traders chasing bursty names, plus benchmarked or redemption-driven long-only funds supplying liquidity for non-alpha reasons.", "data_requirements": "[\"amount\",\"circ_market_cap\",\"turnover_rate\"]", "failure_mode": "Fails when smooth flow is mostly dead illiquidity or passive churn, or in policy/speculative regimes where bursty turnover leaders keep outperforming.", "report_contract": "setup_overlay", "money_readiness": "research_only", "decision": "candidate", "session_branch": "main", "base_ref": "origin/main", "merge_base": "62e27b1718a9c8c7cee619126770fe57cd98d173", "head_commit": "62e27b1718a9c8c7cee619126770fe57cd98d173"}
{"ts": "2026-05-12T06:57:50.072917+08:00", "session_id": "20260512_060001_b3afec", "market": "cn", "formula": "rank(-ts_std(pct_change(amount/circ_market_cap,5),20))*rank(ts_mean(ts_sum(turnover_rate,5),20)/ts_max(ts_sum(turnover_rate,5),20))", "name": "weekly_floatchg_turnover_even_20", "is_ic": 0.0342, "is_ic_ir": 0.335, "is_sharpe": 1.229, "is_turnover": 0.108, "is_monotonicity": 0.25, "gates": "PASS", "status": "candidate", "eval_seconds": 219.9, "sleeve_id": "weekly_float_flow_underreaction", "mispricing_source": "Slow recognition of steady ownership transfer per unit of free float; this is a flow-path quality sleeve, not another close-volume correlation or raw price-reversal factor.", "forced_counterparty": "Retail attention traders, plus redemption-driven and benchmark-constrained long-only funds/rebalancers trading for liquidity or mandate rather than 10-20 day alpha.", "data_requirements": "[\"amount\",\"circ_market_cap\",\"turnover_rate\"]; daily data is enough for research, but intraday/member-level flow ledger is needed before calling it money-ready.", "failure_mode": "Fails when bursty participation is genuinely informative in policy/speculative trend regimes, or when smooth float flow mainly reflects dead illiquidity/passive churn instead of real accumulation.", "report_contract": "setup_overlay", "money_readiness": "research_only", "decision": "candidate", "session_branch": "main", "base_ref": "origin/main", "merge_base": "62e27b1718a9c8c7cee619126770fe57cd98d173", "head_commit": "62e27b1718a9c8c7cee619126770fe57cd98d173"}
{"ts": "2026-05-12T14:58:46.981474+08:00", "session_id": "20260512_140046_7f9cc0", "market": "cn", "formula": "rank(ts_mean(amount / circ_market_cap, 20) / ts_std(amount / circ_market_cap, 20)) * rank(-ts_corr(ret_1d, shift(ret_1d, 1), 20))", "name": "float_absorb_anti_autocorr_20", "is_ic": 0.0399, "is_ic_ir": 0.495, "is_sharpe": 3.724, "is_turnover": 0.166, "is_monotonicity": 0.35, "gates": "PASS", "status": "checks_failed", "eval_seconds": 186.6, "sleeve_id": "daily_float_flow_overlay", "mispricing_source": "Slow institutional accumulation against limited tradable float; this is not just another price-volume corr clone because it uses free-float-normalized flow quality plus serial-return suppression.", "forced_counterparty": "Retail attention chasers and benchmarked holders who rotate on headlines and provide stock into orderly accumulation", "data_requirements": "Current CN daily data is sufficient for computation; optional industry/supply-chain mapping is only needed to label AI-supercycle names after selection", "failure_mode": "Fails in retail-mania or policy-shock regimes where bursty momentum outruns orderly absorption and low-autocorr names become laggards", "report_contract": "fresh_buy_gate", "ai_supercycle_layer": "ai_chip_equipment_materials_packaging", "supply_chain_hypothesis": "If AI capex is creating real bottlenecks, CN equipment/materials/packaging beneficiaries should show persistent amount-per-float absorption with muted daily return feedback before broad recognition", "relationship_evidence_required": "true", "money_readiness": "money_candidate", "decision": "revert", "session_branch": "main", "base_ref": "origin/main", "merge_base": "62e27b1718a9c8c7cee619126770fe57cd98d173", "head_commit": "62e27b1718a9c8c7cee619126770fe57cd98d173", "oos": "PASS", "checks_status": "failed"}
{"ts": "2026-05-12T14:58:46.981474+08:00", "session_id": "20260512_140046_7f9cc0", "market": "cn", "formula": "rank(-ts_corr(abs(ret_1d),amount/circ_market_cap,20))*rank(ts_mean(ts_sum(volume_ratio,5),20)/ts_max(ts_sum(volume_ratio,5),20))", "name": "float_impact_relvol_even_20", "is_ic": 0.0213, "is_ic_ir": 0.386, "is_sharpe": 1.075, "is_turnover": 0.155, "is_monotonicity": 0.0, "gates": "PASS", "status": "candidate", "eval_seconds": 212.2, "sleeve_id": "daily_flow_absorption", "mispricing_source": "Slow underreaction to low-impact sponsorship and overreaction to bursty attention; this is flow elasticity plus participation shape, not another close-volume or naked reversal factor.", "forced_counterparty": "Retail attention traders and benchmarked or redemption-driven funds trading for liquidity, mandate, or T+1 constraints rather than 10-20 day alpha", "data_requirements": "[\"ret_1d\",\"amount\",\"circ_market_cap\",\"volume_ratio\"]; beta-hedged residual-risk attribution required, plus intraday/member flow ledger before money-ready deployment", "failure_mode": "Fails in policy/speculative breakout regimes where bursty relative-volume expansion is genuinely informative, or when muted price impact mostly reflects dead illiquidity or passive churn instead of accumulation", "report_contract": "research_only", "ai_supercycle_layer": "ai_chip_equipment_materials_packaging", "supply_chain_hypothesis": "Candidate domestic AI equipment, materials, and advanced-packaging bottleneck beneficiaries should exhibit steady float-normalized sponsorship with muted absolute-return impact and even relative volume before explicit order evidence becomes consensus", "relationship_evidence_required": "true", "money_readiness": "research_only", "decision": "candidate", "session_branch": "main", "base_ref": "origin/main", "merge_base": "62e27b1718a9c8c7cee619126770fe57cd98d173", "head_commit": "62e27b1718a9c8c7cee619126770fe57cd98d173"}
