{"ts": "2026-05-27T07:23:10.744705+08:00", "session_id": "20260527_062702_76a84a", "market": "cn", "formula": "rank(ts_min(turnover_rate,20)/ts_mean(turnover_rate,20))*rank(-ts_corr(ret_1d,shift(ret_1d,1),20))", "name": "turnover_floor_anti_autocorr_20", "is_ic": -0.0198, "is_ic_ir": -0.074, "is_sharpe": -2.367, "is_turnover": 0.195, "is_monotonicity": -0.65, "gates": "FAIL", "status": "reverted", "eval_seconds": 94.0, "sleeve_id": "cn_ai_flow_absorption", "mispricing_source": "Cross-sectional underreaction to steady float absorption in AI-infra leaders; this is flow-quality plus inventory-absorption, not a simple trend or reversal clone.", "forced_counterparty": "Short-horizon retail and T+1 swing traders who recycle inventory around AI headlines and liquidity spikes.", "data_requirements": "[\"turnover_rate\",\"ret_1d\",\"ai_infra universe tags\",\"benchmark hedge attribution vs 000300.SH and 399006.SZ for promotion\"]", "failure_mode": "Fails in gap-and-go momentum regimes where leadership is one-way and negative autocorrelation no longer reflects absorption.", "report_contract": "research_only", "ai_supercycle_layer": "ai_chip_equipment_materials_packaging", "supply_chain_hypothesis": "D1-D3 China AI bottleneck suppliers should show persistent baseline turnover with choppy tape before validated order/capex evidence reaches the market.", "relationship_evidence_required": "true", "money_readiness": "research_only", "decision": "revert", "session_branch": "main", "base_ref": "origin/main", "merge_base": "c99187be1dc8d78a84147200981562efcde7b8d5", "head_commit": "c99187be1dc8d78a84147200981562efcde7b8d5"}
{"ts": "2026-05-27T07:23:10.744705+08:00", "session_id": "20260527_062702_76a84a", "market": "cn", "formula": "rank(ret_20d-ret_5d) * rank(-ts_std(amount,20)/ts_mean(amount,20))", "name": "stable_amount_trend_pause", "is_ic": -0.0132, "is_ic_ir": -0.079, "is_sharpe": -3.853, "is_turnover": 0.203, "is_monotonicity": -0.85, "gates": "FAIL", "status": "reverted", "eval_seconds": 83.6, "sleeve_id": "cn_ai_flow_accumulation", "mispricing_source": "Slow institutional capital builds AI-infra exposure over weeks, while retail and fast thematic money sell into short pullbacks; stable amount signals inventory transfer instead of thesis exit.", "forced_counterparty": "Retail momentum traders and short-horizon event participants constrained by T+1 and theme churn", "data_requirements": "[\"daily amount\",\"ret_5d\",\"ret_20d\",\"source-reviewed AI-universe membership\",\"beta-hedged sleeve attribution before promotion\"]", "failure_mode": "Fails in broad risk-off tape, liquidity shocks, or when stable amount reflects illiquidity/stagnation rather than accumulation.", "report_contract": "setup_overlay", "ai_supercycle_layer": "ai_chip_equipment_materials_packaging", "supply_chain_hypothesis": "Domestic semiconductor equipment/materials/advanced packaging bottleneck names should show orderly amount support on pullbacks before backlog/order evidence is fully visible in filings.", "relationship_evidence_required": "true", "money_readiness": "research_only", "decision": "revert", "session_branch": "main", "base_ref": "origin/main", "merge_base": "c99187be1dc8d78a84147200981562efcde7b8d5", "head_commit": "c99187be1dc8d78a84147200981562efcde7b8d5"}
{"ts": "2026-05-27T07:23:10.744705+08:00", "session_id": "20260527_062702_76a84a", "market": "cn", "formula": "rank(ts_mean(turnover_rate,20)/(pb+0.1))", "name": "pb_turnover_absorption_20", "is_ic": 0.0289, "is_ic_ir": 0.131, "is_sharpe": 3.92, "is_turnover": 0.033, "is_monotonicity": 0.1, "gates": "FAIL", "status": "reverted", "eval_seconds": 92.4, "sleeve_id": "cn_ai_value_rotation", "mispricing_source": "Underreaction to steady capital absorption in low-valuation AI-infra capacity names; fast money waits for breakout headlines, so rerating lags the flow.", "forced_counterparty": "Benchmarked growth funds and retail theme traders crowded into expensive leaders.", "data_requirements": "[\"current CN daily panel: turnover_rate,pb,price/volume\",\"ai_infra universe metadata for eligible names\",\"post-score beta-hedge, drawdown, and sleeve-correlation attribution\"]", "failure_mode": "Fails when the market remains in a narrow narrative momentum regime and low-PB names are genuine value traps with no order or capex follow-through.", "report_contract": "fresh_buy_gate", "ai_supercycle_layer": "hard_assets_energy_heavy", "supply_chain_hypothesis": "Validated hard-asset AI-infra bottleneck names with persistent turnover can become second-wave beneficiaries after crowded leaders rerate first.", "relationship_evidence_required": "true", "money_readiness": "money_candidate", "decision": "revert", "session_branch": "main", "base_ref": "origin/main", "merge_base": "c99187be1dc8d78a84147200981562efcde7b8d5", "head_commit": "c99187be1dc8d78a84147200981562efcde7b8d5"}
{"ts": "2026-05-27T07:23:10.744705+08:00", "session_id": "20260527_062702_76a84a", "market": "cn", "formula": "rank(-pb)*rank(ts_mean(amount,20)/(ts_std(amount,20)+1))", "name": "pb_amount_stability_absorption", "is_ic": 0.0106, "is_ic_ir": 0.085, "is_sharpe": -1.978, "is_turnover": 0.105, "is_monotonicity": -0.2, "gates": "FAIL", "status": "reverted", "eval_seconds": 68.0, "sleeve_id": "cn_ai_infra_value_absorption", "mispricing_source": "Valuation anchoring and slow recognition of patient accumulation in capex-heavy AI infrastructure names.", "forced_counterparty": "Short-horizon retail traders chasing high-turnover themes and benchmark-aware funds rotating away from quieter low-PB hardware/infra names.", "data_requirements": "[\"company filings/transcripts for backlog, capex, gross margin, and order visibility\",\"source-reviewed customer/supplier evidence before any relationship claim\",\"beta-hedged sleeve return, residual risk, and correlation vs promoted factors\"]", "failure_mode": "It fails when low PB is a genuine distress signal or when speculative concept beta dominates steady accumulation.", "report_contract": "setup_overlay", "ai_supercycle_layer": "hard_assets_energy_heavy", "supply_chain_hypothesis": "Asset-heavy power, datacenter, and buildout enablers with real AI bottleneck exposure are accumulated before order and backlog evidence is obvious in reported fundamentals.", "relationship_evidence_required": "true", "money_readiness": "research_only", "decision": "revert", "session_branch": "main", "base_ref": "origin/main", "merge_base": "c99187be1dc8d78a84147200981562efcde7b8d5", "head_commit": "c99187be1dc8d78a84147200981562efcde7b8d5"}
{"ts": "2026-05-27T07:23:10.744705+08:00", "session_id": "20260527_062702_76a84a", "market": "cn", "formula": "rank(ts_min(amount,20)/ts_mean(amount,20))*rank(ts_mean(volume_ratio,20)/ts_max(volume_ratio,20))", "name": "amount_floor_relvol_even_20", "is_ic": 0.0191, "is_ic_ir": 0.134, "is_sharpe": -1.517, "is_turnover": 0.147, "is_monotonicity": 0.0, "gates": "FAIL", "status": "reverted", "eval_seconds": 149.1, "sleeve_id": "cn_ai_quiet_accumulation", "mispricing_source": "The market overpays for obvious breakout participation and underreacts to steady ownership transfer in validated AI-infra names; this is a flow-quality sleeve, not a simple price-reversal clone.", "forced_counterparty": "Retail theme chasers, benchmark-constrained mutual funds, and redemption-driven sellers", "data_requirements": "[\"daily OHLCV\",\"amount\",\"volume_ratio\",\"validated ai_infra universe membership\",\"benchmark hedge and residual-risk attribution vs 000300.SH and 399006.SZ\",\"rolling correlation vs promoted sleeves\"]", "failure_mode": "Fails in breakout-mania or policy-squeeze regimes where one-day participation spikes are the true leadership signal, or when a high amount floor is passive liquidity/rebalance flow rather than active accumulation.", "report_contract": "setup_overlay", "ai_supercycle_layer": "ai_chip_equipment_materials_packaging", "supply_chain_hypothesis": "Source-reviewed CN semiconductor equipment, materials, and advanced-packaging bottleneck names should show a steady amount floor with evenly distributed relative volume while institutions accumulate ahead of verified AI capex and order spillover.", "relationship_evidence_required": "true", "money_readiness": "research_only", "decision": "revert", "session_branch": "main", "base_ref": "origin/main", "merge_base": "c99187be1dc8d78a84147200981562efcde7b8d5", "head_commit": "c99187be1dc8d78a84147200981562efcde7b8d5"}
{"ts": "2026-05-27T07:23:10.744705+08:00", "session_id": "20260527_062702_76a84a", "market": "cn", "formula": "rank(-abs(ret_20d))*rank(ts_mean(amount,20)/ts_std(amount,20))", "name": "flat_tape_amount_quality_20", "is_ic": 0.0128, "is_ic_ir": 0.075, "is_sharpe": -3.602, "is_turnover": 0.213, "is_monotonicity": -0.5, "gates": "FAIL", "status": "reverted", "eval_seconds": 107.8, "sleeve_id": "cn_ai_infra_accumulation", "mispricing_source": "Investors anchor on recent flat price action and underreact to orderly accumulation; order and capex evidence usually arrives after the ownership transfer has already started.", "forced_counterparty": "Short-horizon retail momentum traders and benchmarked funds that de-risk consolidating names after the first surge", "data_requirements": "[\"source-reviewed AI-universe membership and layer tags\",\"000300.SH/399006.SZ beta-hedge and residual attribution\",\"filings/transcripts/backlog-capex evidence before any supplier/customer claim is promoted\"]", "failure_mode": "Fails when flat tape reflects real demand exhaustion, or when the regime strongly rewards pure high-beta momentum over post-consolidation continuation.", "report_contract": "setup_overlay", "ai_supercycle_layer": "ai_chip_equipment_materials_packaging", "supply_chain_hypothesis": "Domestic chip-equipment, materials, and advanced-packaging bottleneck names show steady amount absorption during consolidation before backlog and capex confirmation is broadly reflected in price.", "relationship_evidence_required": "true", "money_readiness": "research_only", "decision": "revert", "session_branch": "main", "base_ref": "origin/main", "merge_base": "c99187be1dc8d78a84147200981562efcde7b8d5", "head_commit": "c99187be1dc8d78a84147200981562efcde7b8d5"}
{"ts": "2026-05-27T07:23:10.744705+08:00", "session_id": "20260527_062702_76a84a", "market": "cn", "formula": "rank(ts_mean(amount,20)/(circ_market_cap+1))*rank(-pb)", "name": "pb_float_amount_absorption_20", "is_ic": 0.0522, "is_ic_ir": 0.223, "is_sharpe": 2.57, "is_turnover": 0.042, "is_monotonicity": 0.15, "gates": "PASS", "status": "kept", "eval_seconds": 136.7, "sleeve_id": "cn_ai_infra_hard_asset_absorption", "mispricing_source": "Benchmarked growth capital and retail narrative flows overpay high-story names and under-own asset-heavy AI-infra beneficiaries; float-normalized cash participation reveals patient accumulation that is not just a variant of existing price momentum/reversal factors.", "forced_counterparty": "Retail concept chasers and benchmark-constrained managers trimming low-multiple industrial names", "data_requirements": "[\"amount\",\"circ_market_cap\",\"pb\",\"factor correlation vs promoted sleeves\",\"beta-hedged sleeve return\",\"for promotion: filings/backlog/capex/gross margin/original-source order evidence\"]", "failure_mode": "It stops working in narrative melt-up regimes where expensive concept beta dominates, or in macro/liquidity shocks when low-`pb` cyclicals are sold indiscriminately despite steady sponsorship.", "report_contract": "setup_overlay", "ai_supercycle_layer": "hard_assets_energy_heavy", "supply_chain_hypothesis": "Domestic power/cooling/datacenter and other hard-asset AI bottlenecks should show quiet rerating first through float-normalized cash absorption before source-reviewed order evidence is broadly reflected in price.", "relationship_evidence_required": "true", "money_readiness": "research_only", "decision": "keep", "session_branch": "main", "base_ref": "origin/main", "merge_base": "c99187be1dc8d78a84147200981562efcde7b8d5", "head_commit": "c99187be1dc8d78a84147200981562efcde7b8d5", "oos": "PASS", "checks_status": "passed"}
{"ts": "2026-05-27T07:23:10.744705+08:00", "session_id": "20260527_062702_76a84a", "market": "cn", "formula": "rank(-pct_change(close,10)) * rank(ts_min(turnover_rate,20)/ts_mean(turnover_rate,20))", "name": "turnover_floor_pullback_10", "is_ic": -0.016, "is_ic_ir": -0.065, "is_sharpe": -4.196, "is_turnover": 0.228, "is_monotonicity": 0.0, "gates": "FAIL", "status": "reverted", "eval_seconds": 192.1, "sleeve_id": "cn_ai_pullback_absorption", "mispricing_source": "Shallow drawdowns in thematic A-shares are often driven by retail T+1 exits and fast-money de-risking, while institutions keep a trading floor under true leaders; the market over-extrapolates the pullback and underprices the ongoing sponsorship.", "forced_counterparty": "Retail momentum traders and VaR-constrained thematic funds trimming into drawdowns.", "data_requirements": "[\"close\",\"turnover_rate\",\"ai_infra universe membership\",\"benchmark beta hedge attribution\",\"sleeve correlation to existing promoted factors\"]; no extra non-daily data needed for first IS test.", "failure_mode": "It stops working in liquidity-stress or broad deleveraging regimes where a pullback with stable turnover reflects trapped distribution rather than accumulation, or when leadership rotates away from AI hardware bottlenecks.", "report_contract": "research_only", "ai_supercycle_layer": "ai_chip_equipment_materials_packaging", "supply_chain_hypothesis": "Candidate domestic AI chip-equipment, materials, and advanced-packaging bottleneck names should hold turnover floors during pullbacks if institutions are front-running accelerator and datacenter capex demand.", "relationship_evidence_required": "true", "money_readiness": "research_only", "decision": "revert", "session_branch": "main", "base_ref": "origin/main", "merge_base": "c99187be1dc8d78a84147200981562efcde7b8d5", "head_commit": "c99187be1dc8d78a84147200981562efcde7b8d5"}
{"ts": "2026-05-27T07:23:10.744705+08:00", "session_id": "20260527_062702_76a84a", "market": "cn", "formula": "rank(-ps_ttm)*rank(-ts_std(amount/circ_market_cap,20))", "name": "ps_float_amount_stability_20", "is_ic": 0.0085, "is_ic_ir": 0.024, "is_sharpe": -2.163, "is_turnover": 0.054, "is_monotonicity": -0.25, "gates": "FAIL", "status": "reverted", "eval_seconds": 201.8, "sleeve_id": "cn_ai_absorption_value", "mispricing_source": "Lagged accounting and crowded preference for fast-tape names leave low-PS, low-churn AI-infra suppliers underowned until backlog/order evidence reaches the market.", "forced_counterparty": "Retail theme chasers and benchmark-aware managers reducing exposure to flat, low-excitement capex names.", "data_requirements": "[\"current CN daily fields are sufficient for IS test\",\"before promotion measure beta-hedged sleeve return and residual risk attribution\",\"check corr against pb_float_amount_absorption_20 and amount_stability_20 family\",\"source-review any implied supplier/order linkage\"]", "failure_mode": "If stable turnover reflects genuine demand absence rather than accumulation, or if AI capex expectations roll over, the factor becomes a value trap and can lag in momentum-led bursts.", "report_contract": "research_only", "ai_supercycle_layer": "hard_assets_energy_heavy", "supply_chain_hypothesis": "Domestic AI capex bottleneck suppliers in power, cooling, datacenter and adjacent hard-asset chains are accumulated quietly before confirmed order/news evidence is fully visible.", "relationship_evidence_required": "true", "money_readiness": "research_only", "decision": "revert", "session_branch": "main", "base_ref": "origin/main", "merge_base": "c99187be1dc8d78a84147200981562efcde7b8d5", "head_commit": "c99187be1dc8d78a84147200981562efcde7b8d5"}
{"ts": "2026-05-27T07:23:10.744705+08:00", "session_id": "20260527_062702_76a84a", "market": "cn", "formula": "rank((ret_20d-ret_5d)/(ts_std(turnover_rate,20)+0.01))", "name": "leader_pause_turnover_stability_20", "is_ic": 0.0142, "is_ic_ir": 0.04, "is_sharpe": 0.477, "is_turnover": 0.212, "is_monotonicity": 0.15, "gates": "FAIL", "status": "reverted", "eval_seconds": 109.5, "sleeve_id": "cn_ai_pullback_absorption", "mispricing_source": "A-share retail flow tends to take profits on the first pause after a run, while institutional repricing of scarce AI-infra leaders happens more slowly and through low-churn absorption.", "forced_counterparty": "short-horizon retail traders, margin accounts, and fast thematic money de-risking after recent gains", "data_requirements": "[\"daily ret_5d\",\"daily ret_20d\",\"daily turnover_rate\",\"CN AI universe membership from ai_infra\",\"beta/residual attribution vs 000300.SH and 399006.SZ\"]", "failure_mode": "It stops working when the regime shifts from orderly trend continuation to policy-shock or rumor-driven reversal, where low-turnover pullbacks become delayed distribution rather than accumulation.", "report_contract": "fresh_buy_gate", "ai_supercycle_layer": "ai_chip_equipment_materials_packaging", "supply_chain_hypothesis": "Domestic AI semiconductor equipment/material/packaging names already inside the validated universe should show this pullback-then-reacceleration pattern when capex bottleneck repricing is real, but exact customer/order links still need source review.", "relationship_evidence_required": "true", "money_readiness": "money_candidate", "decision": "revert", "session_branch": "main", "base_ref": "origin/main", "merge_base": "c99187be1dc8d78a84147200981562efcde7b8d5", "head_commit": "c99187be1dc8d78a84147200981562efcde7b8d5"}
{"ts": "2026-05-27T07:23:10.744705+08:00", "session_id": "20260527_062702_76a84a", "market": "cn", "formula": "rank(-ret_20d)*rank(market_cap/circ_market_cap)*rank(ts_mean(amount,20)/(ts_std(amount,20)+0.01))", "name": "float_scarcity_absorption_pullback_20", "is_ic": 0.0, "is_ic_ir": -0.001, "is_sharpe": -2.73, "is_turnover": 0.141, "is_monotonicity": 0.1, "gates": "FAIL", "status": "reverted", "eval_seconds": 85.5, "sleeve_id": "cn_ai_absorption_pullback", "mispricing_source": "Short-horizon sellers react to recent drawdown, while strategic holders keep float constrained and medium-horizon capital keeps absorbing supply at steady traded value.", "forced_counterparty": "Retail swing sellers, redemption-driven funds, and passive/rebalance flows that must trade on weakness rather than maximize long-horizon value", "data_requirements": "[\"daily OHLCV\",\"daily_basic amount/market_cap/circ_market_cap\",\"AI-universe membership from ai_infra\",\"benchmark series for beta-hedged residual attribution\"]", "failure_mode": "It should weaken when the market becomes a broad momentum chase, when float expands via unlocks/placements, or when steady amount is no longer a proxy for informed accumulation.", "report_contract": "setup_overlay", "ai_supercycle_layer": "ai_chip_equipment_materials_packaging", "supply_chain_hypothesis": "Domestic AI chip equipment/materials/packaging bottleneck names with tight float are accumulated on pullbacks ahead of capacity/order repricing, but exact customer and supplier links still need source verification.", "relationship_evidence_required": "true", "money_readiness": "research_only", "decision": "revert", "session_branch": "main", "base_ref": "origin/main", "merge_base": "c99187be1dc8d78a84147200981562efcde7b8d5", "head_commit": "c99187be1dc8d78a84147200981562efcde7b8d5"}
{"ts": "2026-05-27T07:23:10.744705+08:00", "session_id": "20260527_062702_76a84a", "market": "cn", "formula": "rank(-ts_corr(ret_5d,amount/circ_market_cap,20))", "name": "ret5_float_absorption_20", "is_ic": 0.0285, "is_ic_ir": 0.087, "is_sharpe": -1.34, "is_turnover": 0.154, "is_monotonicity": 0.05, "gates": "FAIL", "status": "reverted", "eval_seconds": 186.5, "sleeve_id": "weekly_flow_absorption", "mispricing_source": "Weekly de-risking in crowded AI themes creates underreaction; conditioning tape weakness on float-normalized cash turnover makes this an absorption signal, not a naked reversal clone.", "forced_counterparty": "Theme-chasing retail, leveraged traders, and short-horizon funds forced to cut 5-day losers under T+1 and crowding constraints.", "data_requirements": "[\"ret_5d\",\"amount\",\"circ_market_cap\" for CN AI universe; before promotion also require sleeve correlation report and beta/residual attribution vs 000300.SH and 399006.SZ]", "failure_mode": "It stops working when heavy turnover on down weeks is true distribution from fundamental disappointment, or when the market is in a strong momentum regime where pullbacks do not mean-revert.", "report_contract": "fresh_buy_gate", "ai_supercycle_layer": "none", "supply_chain_hypothesis": "Candidate AI-infra bottleneck names can show weekly selloff absorption as weak hands exit and strategic capital accumulates ahead of renewed domestic compute, packaging, optical, or datacenter repricing.", "relationship_evidence_required": "true", "money_readiness": "money_candidate", "decision": "revert", "session_branch": "main", "base_ref": "origin/main", "merge_base": "c99187be1dc8d78a84147200981562efcde7b8d5", "head_commit": "c99187be1dc8d78a84147200981562efcde7b8d5"}
