{"ts": "2026-05-07T06:58:43.620034+08:00", "session_id": "20260507_060002_3ed25b", "market": "cn", "formula": "rank(-ts_corr(ret_5d,turnover_rate,20))*rank(-pb)", "name": "reflexive_turnover_value_20", "is_ic": 0.0314, "is_ic_ir": 0.154, "is_sharpe": -0.208, "is_turnover": 0.093, "is_monotonicity": 0.05, "gates": "FAIL", "status": "reverted", "eval_seconds": 85.8, "sleeve_id": "reflexive_flow_value", "mispricing_source": "This is a return-flow reflexivity sleeve, not a plain price factor: it isolates stocks where trading intensity mechanically chases prior returns, then filters for names already priced expensively on book value.", "forced_counterparty": "Retail momentum chasers and benchmark-sensitive long-only managers who crowd into recent liquid winners and under-own cheap laggards for career-risk and liquidity reasons.", "data_requirements": "[\"ret_5d\",\"turnover_rate\",\"pb\"] from CN daily price + daily_basic; no non-daily data required", "failure_mode": "It should weaken in strong policy-driven momentum regimes where expensive crowded winners keep attracting flows longer than the 10-20 day horizon and valuation stops anchoring price.", "report_contract": "research_only", "money_readiness": "research_only", "decision": "revert", "session_branch": "main", "base_ref": "origin/main", "merge_base": "4613286185edb21bc292ba5db14282c0f26c8943", "head_commit": "4613286185edb21bc292ba5db14282c0f26c8943"}
{"ts": "2026-05-07T06:58:43.620034+08:00", "session_id": "20260507_060002_3ed25b", "market": "cn", "formula": "rank(ts_mean(ts_sum(volume_ratio,5),20)/ts_max(ts_sum(volume_ratio,5),20)-ts_corr(ret_1d,shift(ret_1d,1),20))", "name": "weekly_relvol_evenness_underreaction_20", "is_ic": 0.0367, "is_ic_ir": 0.466, "is_sharpe": 4.247, "is_turnover": 0.173, "is_monotonicity": 0.15, "gates": "PASS", "status": "candidate", "eval_seconds": 292.1, "sleeve_id": "weekly_participation_underreaction", "mispricing_source": "Retail overreaction creates short-horizon reversals, while steady weekly participation reflects slower institutional accumulation; price underreacts because the flow quality is not obvious from raw returns alone.", "forced_counterparty": "retail liquidity-demand traders and benchmarked funds handling subscription/redemption flow", "data_requirements": "[\"ret_1d\",\"volume_ratio\"]", "failure_mode": "Fails when relative volume is dominated by theme-chasing or marketwide policy shocks, so even participation no longer distinguishes accumulation from crowding.", "report_contract": "fresh_buy_gate", "money_readiness": "money_candidate", "decision": "candidate", "session_branch": "main", "base_ref": "origin/main", "merge_base": "4613286185edb21bc292ba5db14282c0f26c8943", "head_commit": "4613286185edb21bc292ba5db14282c0f26c8943"}
{"ts": "2026-05-07T06:58:43.620034+08:00", "session_id": "20260507_060002_3ed25b", "market": "cn", "formula": "rank(-ts_max(ret_1d,20))*rank(ts_mean(turnover_rate,20)/ts_max(turnover_rate,20))", "name": "low_lottery_turnover_evenness_20", "is_ic": 0.0404, "is_ic_ir": 0.286, "is_sharpe": 0.21, "is_turnover": 0.112, "is_monotonicity": 0.0, "gates": "PASS", "status": "candidate", "eval_seconds": 167.1, "sleeve_id": "behavioral_flow_quality", "mispricing_source": "Retail attention in A-shares overpays for recent jackpot days, while steady multi-day participation is underreacted to over a 10-20 day horizon.", "forced_counterparty": "institutions with impact constraints must spread execution across days; retail attention-chasers and news-driven liquidity demanders take the other side around spikes", "data_requirements": "[\"ret_1d\",\"turnover_rate\"]", "failure_mode": "Fails in strong chasing regimes where recent upside spikes keep trending and turnover concentration reflects real information instead of speculative crowding.", "report_contract": "fresh_buy_gate", "money_readiness": "money_candidate", "decision": "candidate", "session_branch": "main", "base_ref": "origin/main", "merge_base": "4613286185edb21bc292ba5db14282c0f26c8943", "head_commit": "4613286185edb21bc292ba5db14282c0f26c8943"}
{"ts": "2026-05-07T14:56:07.370888+08:00", "session_id": "20260507_140002_35890e", "market": "cn", "formula": "rank(ts_min(ts_sum(turnover_rate,5),20)/ts_max(ts_sum(turnover_rate,5),20))", "name": "weekly_turnover_corridor_20", "is_ic": 0.0282, "is_ic_ir": 0.275, "is_sharpe": 0.411, "is_turnover": 0.107, "is_monotonicity": 0.75, "gates": "PASS", "status": "candidate", "eval_seconds": 197.7, "sleeve_id": "weekly_flow_quality", "mispricing_source": "Slow diffusion of patient accumulation; this is a participation-evenness sleeve, not a high-correlation variant of a price trend factor.", "forced_counterparty": "Redemption-driven sellers and benchmark-constrained long-only funds that cannot fully pre-position, plus retail liquidity suppliers who exit quiet names too early.", "data_requirements": "[\"turnover_rate\"]", "failure_mode": "It should weaken when policy/speculative manias favor bursty turnover names, or if the signal collapses into a generic liquidity proxy.", "report_contract": "fresh_buy_gate", "money_readiness": "money_candidate", "decision": "candidate", "session_branch": "main", "base_ref": "origin/main", "merge_base": "7e986da0e351c2b41b5c9cb4f629494d55e1981c", "head_commit": "7e986da0e351c2b41b5c9cb4f629494d55e1981c"}
{"ts": "2026-05-07T14:56:07.370888+08:00", "session_id": "20260507_140002_35890e", "market": "cn", "formula": "rank(ts_mean(ts_sum(amount/circ_market_cap,5),20)/ts_max(ts_sum(amount/circ_market_cap,5),20))*rank(-ts_std(close/open-1,20))", "name": "weekly_float_body_evenness_20", "is_ic": 0.0399, "is_ic_ir": 0.241, "is_sharpe": 0.192, "is_turnover": 0.105, "is_monotonicity": 0.05, "gates": "PASS", "status": "checks_failed", "eval_seconds": 147.8, "sleeve_id": "weekly_flow_underreaction", "mispricing_source": "Underreaction to patient float-normalized accumulation; this keys off flow evenness and candle-body noisiness, not raw momentum or a plain liquidity level.", "forced_counterparty": "Benchmarked mutual funds and index/rebalance flow that must trade over multiple days, with retail attention-chasers taking the other side around noisier names.", "data_requirements": "[\"amount\",\"circ_market_cap\",\"open\",\"close\"]", "failure_mode": "Breaks in policy/thematic chase regimes or price-limit environments where tight bodies are mechanical and bursty participation carries genuine information.", "report_contract": "fresh_buy_gate", "money_readiness": "money_candidate", "decision": "revert", "session_branch": "main", "base_ref": "origin/main", "merge_base": "7e986da0e351c2b41b5c9cb4f629494d55e1981c", "head_commit": "7e986da0e351c2b41b5c9cb4f629494d55e1981c", "oos": "PASS", "checks_status": "failed"}
{"ts": "2026-05-07T14:56:07.370888+08:00", "session_id": "20260507_140002_35890e", "market": "cn", "formula": "rank(-ts_std(ts_sum(volume_ratio,5),20)/ts_mean(ts_sum(volume_ratio,5),20))", "name": "weekly_relvol_stability_20", "is_ic": 0.0294, "is_ic_ir": 0.313, "is_sharpe": 1.559, "is_turnover": 0.094, "is_monotonicity": 0.4, "gates": "PASS", "status": "candidate", "eval_seconds": 196.0, "sleeve_id": "weekly_participation_quality", "mispricing_source": "delayed price response to orderly sponsorship and gradual ownership transfer", "forced_counterparty": "retail theme/attention traders and benchmark or redemption-driven sellers trading for liquidity rather than medium-horizon alpha", "data_requirements": "[\"volume_ratio\"]", "failure_mode": "Fails when speculative regimes reward bursty participation, or when stable relative volume reflects stagnant illiquidity instead of informed accumulation.", "report_contract": "fresh_buy_gate", "money_readiness": "money_candidate", "decision": "candidate", "session_branch": "main", "base_ref": "origin/main", "merge_base": "7e986da0e351c2b41b5c9cb4f629494d55e1981c", "head_commit": "7e986da0e351c2b41b5c9cb4f629494d55e1981c"}
{"ts": "2026-05-07T14:56:07.370888+08:00", "session_id": "20260507_140002_35890e", "market": "cn", "formula": "rank(-clamp(pb,0.1,20))*rank(-ts_max(ret_1d,20))", "name": "value_low_lottery_20", "is_ic": 0.0399, "is_ic_ir": 0.197, "is_sharpe": 0.066, "is_turnover": 0.048, "is_monotonicity": -0.05, "gates": "FAIL", "status": "reverted", "eval_seconds": 240.3, "sleeve_id": "neglected_value_lottery", "mispricing_source": "Retail preference for glamour/high-skew names plus institutional career risk around boring cheap stocks; the payoff is neglect and taste-driven mispricing, not raw momentum/reversal reuse.", "forced_counterparty": "retail lottery seekers and benchmark-constrained long-only managers", "data_requirements": "[\"pb\",\"ret_1d\"]", "failure_mode": "Fails in speculative momentum regimes when expensive high-skew names keep attracting flows and valuation mean reversion is delayed.", "report_contract": "research_only", "money_readiness": "research_only", "decision": "revert", "session_branch": "main", "base_ref": "origin/main", "merge_base": "7e986da0e351c2b41b5c9cb4f629494d55e1981c", "head_commit": "7e986da0e351c2b41b5c9cb4f629494d55e1981c"}
{"ts": "2026-05-07T14:56:07.370888+08:00", "session_id": "20260507_140002_35890e", "market": "cn", "formula": "rank(-ts_std(delta(log(amount),5),20))", "name": "log_amount_change_stability_20_5", "is_ic": 0.0396, "is_ic_ir": 0.342, "is_sharpe": 1.229, "is_turnover": 0.104, "is_monotonicity": 0.05, "gates": "PASS", "status": "checks_failed", "eval_seconds": 268.6, "sleeve_id": "weekly_amount_flow_smoothness", "mispricing_source": "This is a trading-value path signal, not a price-direction clone; smooth amount-change paths indicate orderly inventory transfer and underreaction after temporary flow shocks.", "forced_counterparty": "retail theme chasers and liquidity-needy holders trading in bursts around headlines", "data_requirements": "[\"amount\"]", "failure_mode": "Fails in true information or policy-breakout regimes when bursty amount reflects real fundamental repricing and continuation, not noise.", "report_contract": "fresh_buy_gate", "money_readiness": "money_candidate", "decision": "revert", "session_branch": "main", "base_ref": "origin/main", "merge_base": "7e986da0e351c2b41b5c9cb4f629494d55e1981c", "head_commit": "7e986da0e351c2b41b5c9cb4f629494d55e1981c", "oos": "PASS", "checks_status": "failed"}
{"ts": "2026-05-07T14:56:07.370888+08:00", "session_id": "20260507_140002_35890e", "market": "cn", "formula": "rank(ts_min(ts_sum(amount/circ_market_cap,5),20)/ts_std(ts_sum(amount/circ_market_cap,5),20))", "name": "weekly_float_floorstd_20", "is_ic": 0.0264, "is_ic_ir": 0.258, "is_sharpe": 1.03, "is_turnover": 0.097, "is_monotonicity": 0.65, "gates": "PASS", "status": "candidate", "eval_seconds": 150.9, "sleeve_id": "weekly_float_absorption", "mispricing_source": "This captures persistence of float-normalized participation, not past returns or raw price trend; slow ownership transfer is mispriced because dull, steady flow attracts less attention than spike days.", "forced_counterparty": "Retail attention/lottery traders and benchmark- or cash-flow-constrained funds rotating for non-alpha reasons", "data_requirements": "[\"amount\",\"circ_market_cap\"]", "failure_mode": "Fails in policy/thematic momentum regimes where bursty turnover is rewarded, or when passive/index flow dominates float turnover so steady support no longer indicates informed accumulation.", "report_contract": "fresh_buy_gate", "money_readiness": "money_candidate", "decision": "candidate", "session_branch": "main", "base_ref": "origin/main", "merge_base": "7e986da0e351c2b41b5c9cb4f629494d55e1981c", "head_commit": "7e986da0e351c2b41b5c9cb4f629494d55e1981c"}
{"ts": "2026-05-07T14:56:07.370888+08:00", "session_id": "20260507_140002_35890e", "market": "cn", "formula": "rank(-ts_corr(ret_1d,shift(ret_1d,1),20))*rank(ts_min(ts_sum(turnover_rate,5),20)/ts_std(ts_sum(turnover_rate,5),20))", "name": "anti_autocorr_weekly_turnover_floorstd_20", "is_ic": 0.0367, "is_ic_ir": 0.441, "is_sharpe": 4.149, "is_turnover": 0.151, "is_monotonicity": 0.6, "gates": "PASS", "status": "candidate", "eval_seconds": 156.6, "sleeve_id": "daily_flow_underreaction", "mispricing_source": "Regular participation support plus short-horizon reversal is a flow-quality signal, not a raw price or burst-volume signal; it should be less redundant than simple momentum/reversal or one-day price-volume factors.", "forced_counterparty": "retail attention-chasers, benchmark/rebalance-constrained funds, and liquidity-motivated sellers", "data_requirements": "[\"ret_1d\",\"turnover_rate\"]; intraday order-flow or member-level trade ledger is still required before money-ready deployment to verify true absorption vs crowding.", "failure_mode": "Fails in strong trend/chasing regimes where returns turn positively autocorrelated, or when a high turnover floor reflects crowded speculation/distribution rather than patient institutional accumulation.", "report_contract": "setup_overlay", "money_readiness": "research_only", "decision": "candidate", "session_branch": "main", "base_ref": "origin/main", "merge_base": "7e986da0e351c2b41b5c9cb4f629494d55e1981c", "head_commit": "7e986da0e351c2b41b5c9cb4f629494d55e1981c"}
{"ts": "2026-05-07T14:56:07.370888+08:00", "session_id": "20260507_140002_35890e", "market": "cn", "formula": "rank(-ts_corr(delta(volume_ratio,5), shift(delta(volume_ratio,5),5),20))", "name": "anti_autocorr_weekly_relvol_20", "is_ic": -0.0105, "is_ic_ir": -0.113, "is_sharpe": -5.947, "is_turnover": 0.192, "is_monotonicity": -0.4, "gates": "FAIL", "status": "reverted", "eval_seconds": 203.4, "sleeve_id": "relative_attention_absorption", "mispricing_source": "Attention-driven flow is over-extrapolated and shorting is constrained, so non-persistent relative-volume shocks can leave behind underpriced names after transient crowding clears; this is a flow/attention sleeve, not a price-factor variant.", "forced_counterparty": "retail attention traders and benchmarked managers reacting mechanically to headline volume", "data_requirements": "[\"volume_ratio\"]", "failure_mode": "Fails in genuine information-breakout regimes where persistent relative-volume expansion is informed and should be followed instead of faded.", "report_contract": "research_only", "money_readiness": "research_only", "decision": "revert", "session_branch": "main", "base_ref": "origin/main", "merge_base": "7e986da0e351c2b41b5c9cb4f629494d55e1981c", "head_commit": "7e986da0e351c2b41b5c9cb4f629494d55e1981c"}
{"ts": "2026-05-07T14:56:07.370888+08:00", "session_id": "20260507_140002_35890e", "market": "cn", "formula": "rank(ts_min(turnover_rate,20)/(ts_std(turnover_rate,20)+0.01)-ts_corr(ret_1d,shift(ret_1d,1),20))", "name": "turnover_floorstd_underreaction_20", "is_ic": 0.0345, "is_ic_ir": 0.435, "is_sharpe": 3.015, "is_turnover": 0.137, "is_monotonicity": 0.35, "gates": "PASS", "status": "candidate", "eval_seconds": 266.3, "sleeve_id": "daily_flow_underreaction", "mispricing_source": "The payoff comes from underreaction to quiet but persistent sponsorship; this is a participation-quality signal, not a raw price-momentum clone.", "forced_counterparty": "Retail momentum/liquidity traders and benchmark-constrained funds trading around subscriptions, redemptions, and rebalance flow rather than medium-horizon alpha", "data_requirements": "[\"turnover_rate\",\"ret_1d\"] from CN daily data only", "failure_mode": "Fails in breakout or policy-beta regimes where positive return autocorrelation is rewarded, or when a high turnover floor reflects crowding/distribution instead of patient accumulation", "report_contract": "fresh_buy_gate", "money_readiness": "money_candidate", "decision": "candidate", "session_branch": "main", "base_ref": "origin/main", "merge_base": "7e986da0e351c2b41b5c9cb4f629494d55e1981c", "head_commit": "7e986da0e351c2b41b5c9cb4f629494d55e1981c"}
{"ts": "2026-05-07T14:56:07.370888+08:00", "session_id": "20260507_140002_35890e", "market": "cn", "formula": "rank(-ts_max(ret_1d,20))*rank(ts_min(ts_sum(amount/circ_market_cap,5),20)/ts_std(ts_sum(amount/circ_market_cap,5),20))", "name": "low_lottery_weekly_float_floorstd_20", "is_ic": 0.0369, "is_ic_ir": 0.241, "is_sharpe": -0.002, "is_turnover": 0.089, "is_monotonicity": -0.05, "gates": "PASS", "status": "candidate", "eval_seconds": 156.9, "sleeve_id": "daily_flow_underreaction", "mispricing_source": "Lottery preference and attention bias push capital toward volatile names, leaving quiet free-float absorption underreacted to until positions get marked up.", "forced_counterparty": "Retail lottery chasers and non-alpha liquidity/rebalance sellers.", "data_requirements": "[\"ret_1d\",\"amount\",\"circ_market_cap\"]", "failure_mode": "Fails in momentum-frenzy regimes where unstable high-spike names keep winning and steady float absorption no longer carries a scarcity premium.", "report_contract": "fresh_buy_gate", "money_readiness": "money_candidate", "decision": "candidate", "session_branch": "main", "base_ref": "origin/main", "merge_base": "7e986da0e351c2b41b5c9cb4f629494d55e1981c", "head_commit": "7e986da0e351c2b41b5c9cb4f629494d55e1981c"}
{"ts": "2026-05-07T14:56:07.370888+08:00", "session_id": "20260507_140002_35890e", "market": "cn", "formula": "rank(ts_min(ts_sum(turnover_rate,5),20)/ts_std(ts_sum(turnover_rate,5),20))", "name": "weekly_turnover_floorstd_20", "is_ic": 0.0267, "is_ic_ir": 0.259, "is_sharpe": 1.22, "is_turnover": 0.096, "is_monotonicity": 0.6, "gates": "PASS", "status": "candidate", "eval_seconds": 130.6, "sleeve_id": "participation_stability", "mispricing_source": "The payoff comes from stable ownership structure and slow-moving capital; this is a liquidity-shape signal, not another price-trend clone.", "forced_counterparty": "Retail/speculative traders and liquidity-motivated sellers who rotate out of low-excitement names and leave steady accumulators to absorb supply", "data_requirements": "[\"turnover_rate\"]", "failure_mode": "Fails when speculative high-churn regimes dominate and turnover spikes are rewarded more than stable participation floors", "report_contract": "fresh_buy_gate", "money_readiness": "money_candidate", "decision": "candidate", "session_branch": "main", "base_ref": "origin/main", "merge_base": "7e986da0e351c2b41b5c9cb4f629494d55e1981c", "head_commit": "7e986da0e351c2b41b5c9cb4f629494d55e1981c"}
{"ts": "2026-05-07T14:56:07.370888+08:00", "session_id": "20260507_140002_35890e", "market": "cn", "formula": "rank(ts_mean(amount/circ_market_cap,20)/ts_max(amount/circ_market_cap,20))*rank(-ts_corr(ret_5d,amount/circ_market_cap,20))", "name": "float_even_underreaction_20", "is_ic": 0.0389, "is_ic_ir": 0.281, "is_sharpe": -0.108, "is_turnover": 0.137, "is_monotonicity": 0.4, "gates": "PASS", "status": "checks_failed", "eval_seconds": 182.6, "sleeve_id": "float_flow_underreaction", "mispricing_source": "Quiet float turnover is a flow/ownership signal, and the market underreacts when that flow is not accompanied by an immediate 5-day price move; this is a flow-response inefficiency, not a high-correlation price-only variant.", "forced_counterparty": "liquidity-needing retail sellers and redemption-constrained small funds rotating out on weak recent price action", "data_requirements": "[amount, circ_market_cap, ret_5d]", "failure_mode": "It should stop working in policy/news-driven momentum regimes where flow spikes become genuinely informative immediately, or if float-normalized flow collapses into a large-cap liquidity proxy.", "report_contract": "research_only", "money_readiness": "research_only", "decision": "revert", "session_branch": "main", "base_ref": "origin/main", "merge_base": "7e986da0e351c2b41b5c9cb4f629494d55e1981c", "head_commit": "7e986da0e351c2b41b5c9cb4f629494d55e1981c", "oos": "PASS", "checks_status": "failed"}
{"ts": "2026-05-07T14:56:07.370888+08:00", "session_id": "20260507_140002_35890e", "market": "cn", "formula": "rank(-ts_kurt(delta(amount,5),20))", "name": "weekly_amount_tail_evenness_20", "is_ic": -0.0043, "is_ic_ir": -0.05, "is_sharpe": -4.311, "is_turnover": 0.172, "is_monotonicity": -0.4, "gates": "FAIL", "status": "reverted", "eval_seconds": 122.9, "sleeve_id": "institutional_flow_path", "mispricing_source": "Slow-moving capital must slice orders across days, creating orderly amount-change paths that the market underreacts to; this is a flow-shape signal on amount increments, not a high-correlation price-path variant.", "forced_counterparty": "Benchmark-aware mutual funds and other participation-capped institutions; retail attention traders who overpay for bursty turnover elsewhere", "data_requirements": "[\"amount\"]", "failure_mode": "Fails when speculative bursty-liquidity regimes keep being rewarded, or when mechanical ETF/index rebalance flow dominates amount without informational content.", "report_contract": "fresh_buy_gate", "money_readiness": "money_candidate", "decision": "revert", "session_branch": "main", "base_ref": "origin/main", "merge_base": "7e986da0e351c2b41b5c9cb4f629494d55e1981c", "head_commit": "7e986da0e351c2b41b5c9cb4f629494d55e1981c"}
